A1: SUNDAY | B1: 05:00AM | C1: 05:30AM | D1: 06:00AM | E1: 06:30AM | F1: 07:00AM | G1: 07:30AM | H1: 08:00AM | I1: 08:30AM | J1: 09:00AM | K1: 09:30AM | L1: 10:00AM | M1: 10:30AM | N1: 11:00AM | O1: 11:30AM | P1: 12:00N | Q1: 12:30PM | R1: 01:00PM | S1: 01:30PM | T1: 02:00PM | U1: 02:30PM | V1: 03:00PM | W1: 03:30PM | X1: 04:00PM | Y1: 04:30PM | Z1: 05:00PM | AA1: 05:30PM | AB1: 06:00PM | AC1: 06:30PM | AD1: 07:00PM | AE1: 07:30PM | AF1: 08:00PM | AG1: 08:30PM | AH1: 09:00PM | AI1: 09:30PM | AJ1: 10:00PM | AK1: 10:30PM | AL1: 11:00PM | AM1: 11:30PM | AN1: 12:00M | AO1: 12:30AM | AP1: 01:00AM | AQ1: 01:30AM | AR1: 02:00AM | AS1: 02:30AM | AT1: 03:00AM | AU1: 03:30AM | AV1: 04:00AM | AW1: 04:30AM | AX1: SUNDAY
A3: 1953 | AX3: =A3 -> 1953
A4: 19412 | P4: This is the Life (ABC) | Q4: Life Begins at 80 (DUM) | R4: TBA; [1:15] Hour of Decision | S4: Omnibus (CBS) | V4: Three Guesses; [3:15] Madison Square Garden | W4: See It Now (CBS) | X4: Kukla, Fran and Ollie (NBC) | Y4: The Jack Benny Program (CBS) | Z4: Colgate Comedy Hour (NBC) | AB4: General Electric Theater (CBS) | AC4: Mr. Peepers (NBC) | AD4: The Red Skelton Show (CBS) | AE4: What's My Line? (CBS) | AF4: Studio One (CBS) | AH4: Philco Television Playhouse (NBC) | AJ4: The Doctor (NBC) | AK4: The Web (CBS) | AL4: Live Like a Millionaire (ABC) | AX4: =A4 -> 19412
A5: =A4+7 -> 19419 | M5: Frontiers of Faith (NBC) | N5: Candy Carnival | O5: TBA | P5: This is the Life (ABC) | Q5: Life Begins at 80 (DUM) | R5: TBA; [1:15] Hour of Decision | S5: Omnibus (CBS) | V5: Three Guesses; [3:15] Madison Square Garden | W5: See It Now (CBS) | X5: Invitation Playhouse | Y5: Private Secretary (CBS) | Z5: Colgate Comedy Hour (NBC) | AB5: The Fred Waring Show (CBS) | AC5: Mr. Peepers (NBC) | AD5: The Red Skelton Show (CBS) | AE5: What's My Line? (CBS) | AF5: Studio One (CBS) | AH5: Goodyear Playhouse (NBC) | AJ5: The Doctor (NBC) | AK5: The Web (CBS) | AL5: Tales of Tomorrow (ABC) | AX5: =A5 -> 19419
A6: =A5+7 -> 19426 | M6: Frontiers of Faith (NBC) | N6: Candy Carnival | O6: TBA; [11:55] Paradox | P6: This is the Life (ABC) | Q6: Life Begins at 80 (DUM) | R6: Art Linkletter and the Kids (CBS); [1:15] Hour of Decision | S6: Omnibus (CBS) | V6: Three Guesses; [3:15] Madison Square Garden | W6: See It Now (CBS) | X6: Kukla, Fran and Ollie (NBC) | Y6: Private Secretary (CBS) | Z6: Colgate Comedy Hour (NBC) | AB6: General Electric Theater (CBS) | AC6: Mr. Peepers (NBC) | AD6: The Red Skelton Show (CBS) | AE6: What's My Line? (CBS) | AF6: Studio One (CBS) | AH6: Philco Television Playhouse (NBC) | AJ6: The Doctor (NBC) | AK6: The Web (CBS) | AL6: What's Your Bid? (ABC) | AM6: Miss Chicken Delight; [11:45] Racket Squad (CBS) | AX6: =A6 -> 19426
A7: =A6+7 -> 19433 | M7: The Catholic Hour (NBC) | N7: Candy Carnival | O7: TBA; [11:55] Paradox | P7: This is the Life (ABC) | Q7: Life Begins at 80 (DUM) | R7: Art Linkletter and the Kids (CBS); [1:15] Hour of Decision | S7: Omnibus (CBS) | V7: Three Guesses; [3:15] Madison Square Garden | W7: See It Now (CBS) | X7: Invitation Playhouse | Y7: Private Secretary (CBS) | Z7: Colgate Comedy Hour (NBC) | AB7: General Electric Theater (CBS) | AC7: Mr. Peepers (NBC) | AD7: The Red Skelton Show (CBS) | AE7: What's My Line? (CBS) | AF7: Studio One (CBS) | AH7: Goodyear Playhouse (NBC) | AJ7: The Doctor (NBC) | AK7: The Web (CBS) | AL7: Tales of Tomorrow (ABC) | AM7: Bob Considine (NBC) | AX7: =A7 -> 19433
A8: =A7+7 -> 19440 | M8: The Catholic Hour (NBC) | N8: Candy Carnival | O8: TBA; [11:55] Paradox | P8: This is the Life (ABC) | Q8: Life Begins at 80 (DUM) | R8: Art Linkletter and the Kids (CBS); [1:15] Hour of Decision | S8: Omnibus (CBS) | V8: Three Guesses; [3:15] Madison Square Garden | W8: See It Now (CBS) | X8: Kukla, Fran and Ollie (NBC) | Y8: The Jack Benny Program (CBS) | Z8: Colgate Comedy Hour (NBC) | AB8: General Electric Theater (CBS) | AC8: Mr. Peepers (NBC) | AD8: The Red Skelton Show (CBS) | AE8: What's My Line? (CBS) | AF8: Studio One (CBS) | AH8: Philco Television Playhouse (NBC) | AJ8: The Doctor (NBC) | AK8: The Web (CBS) | AL8: What's Your Bid? (ABC) | AM8: Bob Considine (NBC) | AX8: =A8 -> 19440
A9: =A8+7 -> 19447 | M9: The Catholic Hour (NBC) | N9: Candy Carnival | O9: TBA | P9: This is the Life (ABC) | Q9: Life Begins at 80 (DUM) | R9: Art Linkletter and the Kids (CBS); [1:15] Hour of Decision | S9: Omnibus (CBS) | V9: Three Guesses; [3:15] Madison Square Garden | W9: See It Now (CBS) | X9: Invitation Playhouse | Y9: Private Secretary (CBS) | Z9: Colgate Comedy Hour (NBC) | AB9: The Fred Waring Show (CBS) | AC9: Mr. Peepers (NBC) | AD9: The Red Skelton Show (CBS) | AE9: What's My Line? (CBS) | AF9: Studio One (CBS) | AH9: Goodyear Playhouse (NBC) | AJ9: The Doctor (NBC) | AK9: The Web (CBS) | AL9: Tales of Tomorrow (ABC) | AM9: Bob Considine (NBC); [11:45] The Racket Squad (CBS) | AX9: =A9 -> 19447
A10: =A9+7 -> 19454 | H10: Pontificial Mass | K10: Easter in New York | M10: Frontiers of Faith (NBC) | N10: Candy Carnival | O10: TBA | P10: This is the Life (ABC) | Q10: Life Begins at 80 (DUM) | R10: Art Linkletter and the Kids (CBS); [1:15] Hour of Decision | S10: Omnibus (CBS) | V10: Three Guesses; [3:15] Madison Square Garden | W10: See It Now (CBS) | X10: Kukla, Fran and Ollie (NBC) | Y10: Private Secretary (CBS) | Z10: Colgate Comedy Hour (NBC) | AB10: The Fred Waring Show (CBS) | AC10: Mr. Peepers (NBC) | AD10: The Red Skelton Show (CBS) | AE10: What's My Line? (CBS) | AF10: Studio One (CBS) | AH10: Philco Television Playhouse (NBC) | AJ10: The Doctor (NBC) | AK10: The Web (CBS) | AL10: The Racket Squad (CBS) | AM10: Bob Considine (NBC) | AX10: =A10 -> 19454
A11: =A10+7 -> 19461 | M11: Frontiers of Faith (NBC) | N11: Candy Carnival | O11: TBA | P11: This is the Life (ABC) | Q11: Life Begins at 80 (DUM) | R11: Art Linkletter and the Kids (CBS); [1:15] Hour of Decision | S11: Omnibus (CBS) | V11: Three Guesses; [3:15] Madison Square Garden | W11: See It Now (CBS) | X11: Invitation Playhouse | Y11: Private Secretary (CBS) | Z11: Colgate Comedy Hour (NBC) | AB11: The Fred Waring Show (CBS) | AC11: Mr. Peepers (NBC) | AD11: The Red Skelton Show (CBS) | AE11: What's My Line? (CBS) | AF11: Studio One (CBS) | AH11: Goodyear Playhouse (NBC) | AJ11: The Doctor (NBC) | AK11: The Web (CBS) | AL11: Tales of Tomorrow (ABC) | AM11: Bob Considine (NBC); [11:45] The Racket Squad (CBS) | AX11: =A11 -> 19461
A12: =A11+7 -> 19468 | M12: Frontiers of Faith (NBC) | N12: Candy Carnival | O12: TBA; [11:55] Paradox | P12: This is the Life (ABC) | Q12: Life Begins at 80 (DUM) | R12: TBA; [1:15] Hour of Decision | S12: Omnibus (CBS) | V12: Three Guesses; [3:15] Art Linkletter's House Party (CBS) | W12: See It Now (CBS) | X12: Kukla, Fran and Ollie (NBC) | Y12: The Jack Benny Program (CBS) | Z12: Colgate Comedy Hour (NBC) | AB12: The Fred Waring Show (CBS) | AC12: Mr. Peepers (NBC) | AD12: The Red Skelton Show (CBS) | AE12: What's My Line? (CBS) | AF12: Studio One (CBS) | AH12: Philco Television Playhouse (NBC) | AJ12: The Doctor (NBC) | AK12: The Web (CBS) | AL12: TBA | AM12: Bob Considine (NBC); [11:45] NBC News Reviews (NBC) | AX12: =A12 -> 19468
B13: OTHER CITIES SWITCH TO DAYLIGHT SAVINGS TIME; PORTLAND SHOWS AIR ONE HOUR EARLIER | J13: OTHER CITIES SWITCH TO DAYLIGHT SAVINGS TIME; PORTLAND SHOWS AIR ONE HOUR EARLIER | R13: OTHER CITIES SWITCH TO DAYLIGHT SAVINGS TIME; PORTLAND SHOWS AIR ONE HOUR EARLIER | Z13: OTHER CITIES SWITCH TO DAYLIGHT SAVINGS TIME; PORTLAND SHOWS AIR ONE HOUR EARLIER | AH13: OTHER CITIES SWITCH TO DAYLIGHT SAVINGS TIME; PORTLAND SHOWS AIR ONE HOUR EARLIER | AP13: OTHER CITIES SWITCH TO DAYLIGHT SAVINGS TIME; PORTLAND SHOWS AIR ONE HOUR EARLIER
A14: =A12+7 -> 19475 | K14: Frontiers of Faith (NBC) | L14: Candy Carnival | M14: TBA; [11:55] Paradox | N14: This is the Life (ABC) | O14: Life Begins at 80 (DUM) | P14: TBA; [12:15] Hour of Decision | Q14: Omnibus (CBS) | T14: Three Guesses; [2:15] Art Linkletter's House Party (CBS) | U14: See It Now (CBS) | V14: Invitation Playhouse | W14: Private Secretary (CBS) | X14: Colgate Comedy Hour (NBC) | Z14: The Fred Waring Show (CBS) | AA14: Mr. Peepers (NBC) | AB14: The Red Skelton Show (CBS) | AC14: What's My Line? (CBS) | AD14: Studio One (CBS) | AF14: Goodyear Playhouse (NBC) | AH14: The Doctor (NBC) | AI14: The Web (CBS) | AJ14: Tales of Tomorrow (ABC) | AK14: NBC News Reviews (NBC); [10:45] The Racket Squad (CBS) | AX14: =A14 -> 19475
A15: =A14+7 -> 19482 | K15: Frontiers of Faith (NBC) | L15: Candy Carnival | M15: TBA; [10:55] Paradox | N15: This is the Life (ABC) | O15: TBA | P15: TBA; [12:15] Hour of Decision | Q15: Omnibus (CBS) | T15: Three Guesses; [2:15] Art Linkletter's House Party (CBS) | U15: See It Now (CBS) | V15: Kukla, Fran and Ollie (NBC) | W15: Private Secretary (CBS) | X15: Colgate Comedy Hour (NBC) | Z15: The Fred Waring Show (CBS) | AA15: Mr. Peepers (NBC) | AB15: The Red Skelton Show (CBS) | AC15: What's My Line? (CBS) | AD15: Studio One (CBS) | AF15: Philco Television Playhouse (NBC) | AH15: The Doctor (NBC) | AI15: The Web (CBS) | AJ15: TBA | AK15: NBC News Reviews | AX15: =A15 -> 19482
A16: =A15+7 -> 19489 | K16: Frontiers of Faith (NBC) | L16: Candy Carnival | M16: TBA; [10:55] Paradox | N16: This is the Life (ABC) | O16: TBA | P16: TBA; [12:15] Hour of Decision | Q16: TBA | R16: TBA | S16: TBA | T16: Three Guesses; [2:15] Art Linkletter's House Party (CBS) | U16: See It Now (CBS) | V16: Invitation Playhouse | W16: Private Secretary (CBS) | X16: Colgate Comedy Hour (NBC) | Z16: The Fred Waring Show (CBS) | AA16: Mr. Peepers (NBC) | AB16: The Red Skelton Show (CBS) | AC16: What's My Line? (CBS) | AD16: Studio One (CBS) | AF16: Goodyear Playhouse (NBC) | AH16: The Doctor (NBC) | AI16: The Web (CBS) | AJ16: Tales of Tomorrow (ABC) | AK16: NBC News Reviews (NBC); [10:45] The Racket Squad (CBS) | AX16: =A16 -> 19489
A17: =A16+7 -> 19496 | K17: Frontiers of Faith (NBC) | L17: Candy Carnival | M17: TBA; [10:55] Paradox | N17: This is the Life (ABC) | O17: TBA | P17: TBA; [12:15] Hour of Decision | Q17: Movie [Sunday Star Time]: There Goes Kelley | T17: Three Guesses; [2:15] Art Linkletter's House Party (CBS) | U17: See It Now (CBS) | V17: Kukla, Fran and Ollie (NBC) | W17: The Jack Benny Program (CBS) | X17: Colgate Comedy Hour (NBC) | Z17: The Fred Waring Show (CBS) | AA17: Mr. Peepers (NBC) | AB17: The Red Skelton Show (CBS) | AC17: What's My Line? (CBS) | AD17: Studio One (CBS) | AF17: Philco Television Playhouse (NBC) | AH17: The Doctor (NBC) | AI17: The Web (CBS) | AJ17: Sports Scholar; [10:15] Headlines on Parade | AK17: NBC News Reviews (NBC) | AX17: =A17 -> 19496
A18: =A17+7 -> 19503 | B18: Cerebral Palsy Telethon Continues | J18: Cerebral Palsy Telethon Continues | R18: [1:15] Hour of Decision | S18: Candy Carnival | T18: Three Guesses; [2:15] Art Linkletter's House Party (CBS) | U18: See It Now (CBS) | V18: Invitation Playhouse | W18: Private Secretary (CBS) | X18: Colgate Comedy Hour (NBC) | Z18: The Fred Waring Show (CBS) | AA18: Mr. Peepers (NBC) | AB18: The Red Skelton Show (CBS) | AC18: What's My Line? (CBS) | AD18: Studio One (CBS) | AF18: Goodyear Playhouse (NBC) | AH18: The Doctor (NBC) | AI18: The Web (CBS) | AJ18: Tales of Tomorrow (ABC) | AK18: NBC News Reviews (NBC); [10:45] The Racket Squad (CBS) | AL18: [11:15] Texas Rasslin' | AX18: =A18 -> 19503
A19: =A18+7 -> 19510 | K19: Frontiers of Faith (NBC) | L19: Candy Carnival | M19: TBA; [10:55] Paradox | N19: This is the Life (ABC) | O19: Her Majesty the Queen (Special) | P19: TBA; [12:15] Hour of Decision | Q19: Movie [Sunday Star Time]: King Kelley of the USA | T19: Three Guesses; [2:15] Art Linkletter's House Party (CBS) | U19: See It Now (CBS) | V19: Kukla, Fran and Ollie (NBC) | W19: Private Secretary (CBS) | X19: Colgate Comedy Hour (NBC) | Z19: The Fred Waring Show (CBS) | AA19: Mr. Peepers (NBC) | AB19: The Red Skelton Show (CBS) | AC19: What's My Line? (CBS) | AD19: Studio One (CBS) | AF19: Philco Television Playhouse (NBC) | AH19: The Doctor (NBC) | AI19: The Web (CBS) | AJ19: Sports Scholar | AK19: NBC News Reviews (NBC); [10:45] Quick as a Flash (ABC) | AL19: [11:15] Texas Rasslin' | AX19: =A19 -> 19510
B20: KPTV BECOMES NBC AFFILIATE | J20: KPTV BECOMES NBC AFFILIATE | R20: KPTV BECOMES NBC AFFILIATE | Z20: KPTV BECOMES NBC AFFILIATE | AH20: KPTV BECOMES NBC AFFILIATE | AP20: KPTV BECOMES NBC AFFILIATE
A21: =A19+7 -> 19517 | K21: Frontiers of Faith (NBC) | L21: Candy Carnival | M21: TBA; [10:55] Paradox | N21: This is the Life (ABC) | O21: TBA | P21: TBA; [12:15] Hour of Decision | Q21: Movie [Sunday Star Time]: Nut Farm | T21: TBA [2:15] Art Linkletter's House Party (CBS) | U21: See It Now (CBS) | V21: TBA | W21: Private Secretary (CBS) | X21: Colgate Comedy Hour (NBC) | Z21: The Fred Waring Show (CBS) | AA21: Mr. Peepers (NBC) | AB21: The Red Skelton Show (CBS) | AC21: What's My Line? (CBS) | AD21: Studio One (CBS) | AF21: Goodyear Playhouse (NBC) | AH21: The Doctor (NBC) | AI21: The Web (CBS) | AJ21: Tales of Tomorrow (ABC) | AK21: NBC News Reviews (NBC); [10:45] The Racket Squad (CBS) | AL21: [11:15] Texas Rasslin' | AX21: =A21 -> 19517
A22: =A21+7 -> 19524 | K22: Frontiers of Faith (NBC) | L22: Candy Carnival | M22: TBA; [10:55] Paradox | N22: This is the Life (ABC) | O22: TBA | P22: TBA; [12:15] Hour of Decision | Q22: Movie [Sunday Star Time]: Up in the Air | T22: TBA [2:15] Art Linkletter's House Party (CBS) | U22: See It Now (CBS) | V22: Kukla, Fran and Ollie (NBC) | W22: Your Play Time (CBS) | X22: Colgate Comedy Hour (NBC) | Z22: The Fred Waring Show (CBS) | AA22: Mr. Peepers (NBC) | AB22: The Red Skelton Show (CBS) | AC22: What's My Line? (CBS) | AD22: Studio One (CBS) | AF22: Philco Television Playhouse (NBC) | AH22: The Doctor (NBC) | AI22: The Web (CBS) | AJ22: Sports Scholar; [10:15] Headlines on Parade | AK22: NBC News Reviews (NBC); [10:45] Quick as a Flash (ABC) | AL22: [11:15] Texas Rasslin' | AX22: =A22 -> 19524
A23: =A22+7 -> 19531 | K23: Frontiers of Faith (NBC) | L23: Candy Carnival | M23: TBA; [10:55] Paradox | N23: This is the Life (ABC) | O23: TBA | P23: TBA; [12:15] Hour of Decision | Q23: Movie [Sunday Star Time]: Cheers of the Crowd | T23: TBA [2:15] Art Linkletter's House Party (CBS) | U23: TBA | V23: Kukla, Fran and Ollie (NBC) | W23: Your Play Time (CBS) | X23: The Big Payoff (NBC) | Z23: The Fred Waring Show (CBS) | AA23: Mr. Peepers (NBC) | AB23: The Red Skelton Show (CBS) | AC23: What's My Line? (CBS) | AD23: Studio One (CBS) | AF23: Goodyear Playhouse (NBC) | AH23: The Doctor (NBC) | AI23: The Web (CBS) | AJ23: Tales of Tomorrow (ABC) | AK23: NBC News Reviews (NBC); [10:45] The Racket Squad (CBS) | AL23: [11:15] Texas Rasslin' | AX23: =A23 -> 19531
A24: =A23+7 -> 19538 | K24: Frontiers of Faith (NBC) | L24: Candy Carnival | M24: TBA; [10:55] Paradox | N24: This is the Life (ABC) | O24: TBA | P24: TBA; [12:15] Hour of Decision | Q24: Movie [Sunday Star Time]: Million Dollar Baby | T24: TBA [2:15] Art Linkletter's House Party (CBS) | U24: TBA | V24: The Roy Rogers Show (NBC) | W24: Your Play Time (CBS) | X24: The Big Payoff (NBC) | Z24: General Electric Theater (CBS) | AA24: Mr. Peepers (NBC) | AB24: The Red Skelton Show (CBS) | AC24: What's My Line? (CBS) | AD24: Movie: Fashion Model | AF24: Philco Television Playhouse (NBC) | AH24: The Doctor (NBC) | AI24: The Web (CBS) | AJ24: Sports Scholar; [10:15] Headlines on Parade | AK24: NBC News Reviews (NBC); [10:45] Quick as a Flash (ABC) | AL24: [11:15] Texas Rasslin' | AX24: =A24 -> 19538
A25: =A24+7 -> 19545 | K25: Frontiers of Faith (NBC) | L25: Candy Carnival | M25: TBA; [10:55] Paradox | N25: This is the Life (ABC) | O25: TBA | P25: TBA; [12:15] Hour of Decision | Q25: Movie [Sunday Star Time]: Campus Rhythm | T25: TBA [2:15] Art Linkletter's House Party (CBS) | U25: TBA | V25: The Roy Rogers Show (NBC) | W25: Your Play Time (CBS) | X25: The Big Payoff (NBC) | Z25: General Electric Theater (CBS) | AA25: Mr. Peepers (NBC) | AB25: Sunday Revue | AC25: What's My Line? (CBS) | AD25: Studio One Summer Theater (CBS) | AF25: Philco Television Playhouse (NBC) | AH25: The Doctor (NBC) | AI25: The Web (CBS) | AJ25: TBA | AK25: NBC News Reviews (NBC); [10:45] The Racket Squad (CBS) | AL25: [11:15] Texas Rasslin' | AX25: =A25 -> 19545
A26: =A25+7 -> 19552 | K26: Frontiers of Faith (NBC) | L26: Candy Carnival | M26: TBA; [10:55] Paradox | N26: This is the Life (ABC) | O26: TBA | P26: What's Your Trouble; [12:15] Hour of Decision | Q26: Movie [Sunday Star Time]: Hot Rhythm | T26: Industry on Parade; [2:15] Art Linkletter's House Party (CBS) | U26: TBA | V26: The Roy Rogers Show (NBC) | W26: Your Play Time (CBS) | X26: The Big Payoff (NBC) | Z26: General Electric Theater (CBS) | AA26: Mr. Peepers (NBC) | AB26: Sunday Revue | AC26: What's My Line? (CBS) | AD26: Studio One Summer Theater (CBS) | AF26: Philco Television Playhouse (NBC) | AH26: The Doctor (NBC) | AI26: The Web (CBS) | AJ26: Sports Scholar; [10:15] Headlines on Parade | AK26: NBC News Reviews (NBC); [10:45] Quick as a Flash (ABC) | AL26: [11:15] Texas Rasslin' | AX26: =A26 -> 19552
A27: =A26+7 -> 19559 | K27: Frontiers of Faith (NBC) | L27: TBA | M27: TBA; [10:55] Paradox | N27: This is the Life (ABC) | O27: TBA | P27: What's Your Trouble; [12:15] Hour of Decision | Q27: Movie [Sunday Star Time]: Roar of the Press | T27: Industry on Parade; [2:15] Art Linkletter's House Party (CBS) | U27: TBA | V27: The Roy Rogers Show (NBC) | W27: Your Play Time (CBS) | X27: The Big Payoff (NBC) | Z27: General Electric Theater (CBS) | AA27: Sunday Revue | AC27: What's My Line? (CBS) | AD27: Studio One Summer Theater (CBS) | AF27: Philco Television Playhouse (NBC) | AH27: TBA | AI27: The Web (CBS) | AJ27: Portland Speaks | AK27: NBC News Reviews (NBC); [10:45] The Racket Squad (CBS) | AL27: [11:15] Texas Rasslin' | AX27: =A27 -> 19559
A28: =A27+7 -> 19566 | K28: Frontiers of Faith (NBC) | L28: TBA | M28: TBA; [10:55] Paradox | N28: This is the Life (ABC) | O28: TBA | P28: What's Your Trouble; [12:15] Hour of Decision | Q28: Movie [Sunday Star Time]: | R28: Boy Scout Jamboree (NBC) | S28: Local Film | T28: Industry on Parade; [2:15] Art Linkletter's House Party (CBS) | U28: TBA | V28: The Roy Rogers Show (NBC) | W28: Your Play Time (CBS) | X28: The Big Payoff (NBC) | Z28: General Electric Theater (CBS) | AA28: Sunday Revue | AC28: What's My Line? (CBS) | AD28: Studio One Summer Theater (CBS) | AF28: Philco Television Playhouse (NBC) | AH28: Invitation Playhouse | AI28: The Web (CBS) | AJ28: Sports Scholar; [10:15] Headlines on Parade | AK28: NBC News Reviews (NBC); [10:45] City Hospital (CBS) | AL28: [11:15] Texas Rasslin' | AX28: =A28 -> 19566
A29: =A28+7 -> 19573 | K29: Frontiers of Faith (NBC) | L29: TBA | M29: TBA; [10:55] Paradox | N29: This is the Life (ABC) | O29: TBA | P29: What's Your Trouble; [12:15] Hour of Decision | Q29: Movie [Sunday Star Time]: Broken Dreams | R29: Boy Scout Jamboree (NBC) | S29: Local Film | T29: Industry on Parade; [2:15] Art Linkletter's House Party (CBS) | U29: Talent Patrol (ABC) | V29: The Roy Rogers Show (NBC) | W29: Your Play Time (CBS) | X29: The Big Payoff (NBC) | Z29: General Electric Theater (CBS) | AA29: Sunday Revue | AC29: What's My Line? (CBS) | AD29: Studio One Summer Theater (CBS) | AF29: Philco Television Playhouse (NBC) | AH29: TBA | AI29: The Web (CBS) | AJ29: Portland Speaks | AK29: NBC News Reviews (NBC); [10:45] City Hospital (CBS) | AL29: [11:15] Texas Rasslin' | AX29: =A29 -> 19573
A30: =A29+7 -> 19580 | K30: Frontiers of Faith (NBC) | L30: TBA | M30: TBA; [10:55] Paradox | N30: This is the Life (ABC) | O30: TBA | P30: What's Your Trouble; [12:15] Hour of Decision | Q30: Wedding Belles | R30: Movie [Sunday Star Time]: TBA | S30: Local Film | T30: [2:15] Art Linkletter's House Party (CBS) | U30: Talent Patrol (ABC) | V30: The Roy Rogers Show (NBC) | W30: Your Play Time (CBS) | X30: The Big Payoff (NBC) | Z30: General Electric Theater (CBS) | AA30: Sunday Revue | AC30: What's My Line? (CBS) | AD30: Studio One Summer Theater (CBS) | AF30: Philco Television Playhouse (NBC) | AH30: TBA | AI30: The Web (CBS) | AJ30: Sports Scholar; [10:15] Headlines on Parade | AK30: NBC News Reviews (NBC); [10:45] City Hospital (CBS) | AL30: [11:15] Texas Rasslin' | AX30: =A30 -> 19580
A31: =A30+7 -> 19587 | K31: Frontiers of Faith (NBC) | L31: TBA | M31: TBA; [10:55] Paradox | N31: This is the Life (ABC) | O31: TBA | P31: What's Your Trouble; [12:15] Hour of Decision | Q31: Wedding Belles | R31: Movie [Sunday Star Time]: Silver Skates | T31: [2:15] Art Linkletter's House Party (CBS) | U31: Talent Patrol (ABC) | V31: The Roy Rogers Show (NBC) | W31: Your Play Time (CBS) | X31: The Big Payoff (NBC) | Z31: General Electric Theater (CBS) | AA31: Sunday Revue | AC31: What's My Line? (CBS) | AD31: Studio One Summer Theater (CBS) | AF31: Philco Television Playhouse (NBC) | AH31: TBA | AI31: The Web (CBS) | AJ31: TBA | AK31: NBC News Reviews (NBC); [10:45] City Hospital (CBS) | AL31: [11:15] Texas Rasslin' | AX31: =A31 -> 19587
A32: =A31+7 -> 19594 | K32: Frontiers of Faith (NBC) | L32: TBA | M32: TBA; [10:55] Paradox | N32: This is the Life (ABC) | O32: TBA | P32: What's Your Trouble; [12:15] Hour of Decision | Q32: Wedding Belles | R32: The Big Picture | T32: [2:15] Art Linkletter's House Party (CBS) | U32: Talent Patrol (ABC) | V32: The Roy Rogers Show (NBC) | W32: Your Play Time (CBS) | X32: The Big Payoff (NBC) | Z32: General Electric Theater (CBS) | AA32: Sunday Revue | AC32: What's My Line? (CBS) | AD32: Studio One Summer Theater (CBS) | AF32: Philco Television Playhouse (NBC) | AH32: TBA | AI32: The Web (CBS) | AJ32: Sports Scholar; [10:15] Headlines on Parade | AK32: NBC News Reviews (NBC); [10:45] City Hospital (CBS) | AL32: [11:15] Movie [Five Star Playhouse]: TBA | AX32: =A32 -> 19594
A33: =A32+7 -> 19601 | K33: Frontiers of Faith (NBC) | L33: TBA | M33: TBA; [10:55] Paradox | N33: This is the Life (ABC) | O33: TBA | P33: What's Your Trouble; [12:15] Hour of Decision | Q33: Wedding Belles | R33: The Big Picture | S33: Local Film | T33: Industry on Parade; [2:15] Art Linkletter's House Party (CBS) | U33: Talent Patrol (ABC) | V33: The Roy Rogers Show (NBC) | W33: Your Play Time (CBS) | X33: The Big Payoff (NBC) | Z33: General Electric Theater (CBS) | AA33: Sunday Revue | AC33: What's My Line? (CBS) | AD33: Studio One Summer Theater (CBS) | AF33: Philco Television Playhouse (NBC) | AH33: TBA | AI33: The Web (CBS) | AJ33: TBA | AK33: NBC News Reviews (NBC); [10:45] City Hospital (CBS) | AL33: [11:15] Movie [Five Star Playhouse]: Borrowed Hero | AX33: =A33 -> 19601
A34: =A33+7 -> 19608 | K34: Frontiers of Faith (NBC) | L34: Pro Tennis: from West Side Tennis Cub, Forest Hills, NY | Q34: Wedding Belles | R34: The Big Picture | S34: Local Film | T34: Industry on Parade; [2:15] Art Linkletter's House Party (CBS) | U34: Life Begins at 80 (DUM) | V34: The Roy Rogers Show (NBC) | W34: Your Play Time (CBS) | X34: The Big Payoff (NBC) | Z34: General Electric Theater (CBS) | AA34: Sunday Revue | AC34: What's My Line? (CBS) | AD34: Studio One Summer Theater (CBS) | AF34: Philco Television Playhouse (NBC) | AH34: Nothing But the Best (NBC) | AI34: The Web (CBS) | AJ34: Sports Scholar; [10:15] Headlines on Parade | AK34: NBC News Reviews (NBC); [10:45] City Hospital (CBS) | AL34: [11:15] Movie [Five Star Playhouse]: Right Man | AX34: =A34 -> 19608
A35: =A34+7 -> 19615 | K35: Frontiers of Faith (NBC) | L35: TBA | M35: TBA; [10:55] Paradox | N35: This is the Life (ABC) | O35: TBA | P35: What's Your Trouble; [12:15] Hour of Decision | Q35: Wedding Belles | R35: American Inventory | S35: Local Film | T35: Exercise Mariner (NBC) (Special) | V35: The Roy Rogers Show (NBC) | W35: The Jack Benny Program (CBS) | X35: The Big Payoff (NBC) | Z35: General Electric Theater (CBS) | AA35: Sunday Revue | AC35: What's My Line? (CBS) | AD35: Studio One Summer Theater (CBS) | AF35: Philco Television Playhouse (NBC) | AH35: Nothing But the Best (NBC) | AI35: The Web (CBS) | AJ35: TBA | AK35: NBC News Reviews (NBC); [10:45] City Hospital (CBS) | AL35: [11:15] Movie [Five Star Playhouse]: Redhead (1941) | AX35: =A35 -> 19615
A36: =A35+7 -> 19622 | K36: Frontiers of Faith (NBC) | L36: TBA | M36: TBA; [10:55] Paradox | N36: This is the Life (ABC) | O36: TBA | P36: What's Your Trouble; [12:15] Hour of Decision | Q36: Wedding Belles | R36: The Big Picture | S36: A Date with Judy (ABC) | T36: Industry on Parade; [2:15] Art Linkletter's House Party (CBS) | U36: Life Begins at 80 (DUM) | V36: The Roy Rogers Show (NBC) | W36: Private Secretary (CBS) | X36: The Big Payoff (NBC) | Z36: General Electric Theater (CBS) | AA36: Sunday Revue | AC36: Mr. Peepers (NBC) | AD36: Studio One Summer Theater (CBS) | AF36: Philco Television Playhouse (NBC) | AH36: Nothing But the Best (NBC) | AI36: The Web (CBS) | AJ36: Sports Scholar; [10:15] Headlines on Parade | AK36: NBC News Reviews (NBC); [10:45] Place the Face (CBS) | AL36: [11:15] Movie [Five Star Playhouse]: Blake of Scotland Yard (1937) | AX36: =A36 -> 19622
A37: =A36+7 -> 19629 | J37: [9:15] Reading the Funnies | K37: Christopher; [9:45] TBA | L37: TBA | M37: Frontiers of Faith (NBC) | N37: TBA | O37: TBA | P37: What's Your Trouble; [12:15] Hour of Decision | Q37: TBA | R37: The Big Picture | S37: How Does Your Garden Grow | T37: Bob Considine (NBC); [2:15] Art Linkletter's House Party (CBS) | U37: Wedding Belles | V37: The Roy Rogers Show (NBC) | W37: Life Begins at 80 (DUM) | X37: A Date with Judy (ABC) | Y37: Zoo Parade (NBC) | Z37: Hallmark Hall of Fame (NBC) | AB37: Victory at Sea (NBC) | AC37: The Paul Winchell Show (NBC) | AD37: Chevron Theater | AE37: Mr. Peepers (NBC) | AF37: The Big Payoff (NBC) | AH37: Philco Television Playhouse (NBC) | AJ37: Nothing But the Best (NBC) | AK37: Sports Den | AL37: Sunday News Review; [11:15] Movie [Five Star Playhouse]: Suicide Squadron | AX37: =A37 -> 19629
A39: 1955 | AX39: 1960
A41: 20336 | P41: This is the Life | R41: What's Your Trouble? [1:15] What One Person Can Do | S41: Faith for Today | T41: Industry on Parade; [2:15] Your Own Home Show | U41: Travelog | V41: Mr Wizard | W41: Roy Rogers | X41: People (NBC) | Y41: Captain Gallant | Z41: Meet the Press (NBC) | AA41: Wrestling | AC41: Do-It-Yourself | AD41: Variety Hour | AF41: TV Playhouse | AH41: Loretta Young (NBC) | AI41: The Whistler (NBC) | AJ41: People Are Funny | AK41: The Bob Cummings Show | AL41: Industry on Parade | AX41: =A41 -> 20336
AX42: =A42 -> 0
AX43: =A43 -> 0
A45: 1960 | AX45: 1960
A46: 21918 | I46: Breadbasket, U.S.A. | J46: Off to Adventure [9:15] Americans at Work | K46: Oral Roberts | L46: Christian Science; [10:15] The Pastor | M46: This is the Answer | N46: Halls of Ivy | O46: Herald of Truth | P46: Johns Hopkins | Q46: Bishop Pike | R46: Championship Bridge with Charles Goren (ABC) | S46: Stars of Tomorrow | T46: Movie [Sunday Matinee]: Boomerang (1947) | X46: The Paul Winhell Show (ABC) | Y46: Broken Arrow (ABC) | Z46: Matty's Funday Funnies (ABC) | AA46: The Lone Ranger | AB46: You Asked for It | AC46: Not for Hire | AD46: Colt .45 (ABC) | AE46: Maverick (ABC) | AG46: The Lawman (ABC) | AH46: The Rebel (ABC) | AI46: The Alaskans (ABC) | AK46: 21 Beacon Street (ABC) | AL46: News; [11:15] Movie [Academy Theater]: My Outlaw Brother (1951) | AX46: =A46 -> 21918
A47: 21925 | I47: Breadbasket, U.S.A. | J47: Off to Adventure [9:15] Americans at Work | K47: Oral Roberts | L47: Christian Science; [10:15] The Pastor | M47: This is the Answer | N47: Halls of Ivy | O47: Herald of Truth | P47: Johns Hopkins | Q47: Bishop Pike | R47: Championship Bridge with Charles Goren (ABC) | S47: Stars of Tomorrow | T47: Movie: Lifeboat (1944) | X47: The Paul Winhell Show (ABC) | Y47: Broken Arrow (ABC) | Z47: Matty's Funday Funnies (ABC) | AA47: The Lone Ranger | AB47: You Asked for It | AC47: Not for Hire | AD47: Colt .45 (ABC) | AE47: Maverick (ABC) | AG47: The Lawman (ABC) | AH47: The Rebel (ABC) | AI47: The Alaskans (ABC) | AK47: 21 Beacon Street (ABC) | AL47: News; [11:15] Movie [Academy Theater]: Island Rescue (English; 1951) | AX47: =A47 -> 21925
A48: 21932 | I48: Breadbasket, U.S.A. | J48: Off to Adventure [9:15] Americans at Work | K48: Oral Roberts | L48: Christian Science; [10:15] The Pastor | M48: This is the Answer | N48: Halls of Ivy | O48: Herald of Truth | P48: Hollywood March | R48: Championship Bridge with Charles Goren (ABC) | S48: Stars of Tomorrow | T48: Movie [Sunday Matinee]: The Green Man (English; 1956) | X48: The Paul Winhell Show (ABC) | Y48: Broken Arrow (ABC) | Z48: Matty's Funday Funnies (ABC) | AA48: The Lone Ranger | AB48: You Asked for It | AC48: Not for Hire | AD48: Colt .45 (ABC) | AE48: Maverick (ABC) | AG48: The Lawman (ABC) | AH48: The Rebel (ABC) | AI48: The Alaskans (ABC) | AK48: 21 Beacon Street (ABC) | AL48: News; [11:15] Movie [Academy Theater]: Rise and Shine (1941) | AX48: =A48 -> 21932
A49: 21939 | I49: Breadbasket, U.S.A. | J49: Off to Adventure [9:15] Americans at Work | K49: Oral Roberts | L49: Christian Science; [10:15] The Pastor | M49: This is the Answer | N49: It's a Great Life | O49: Herald of Truth | P49: Johns Hopkins | Q49: Bishop Pike | R49: Championship Bridge with Charles Goren (ABC) | S49: Stars of Tomorrow | T49: Pebble Beach Preview | U49: Bing Crosby Golf Tournament | X49: The Paul Winhell Show (ABC) | Y49: Broken Arrow (ABC) | Z49: Cartoons | AA49: The Lone Ranger | AB49: You Asked for It | AC49: Not for Hire | AD49: Colt .45 (ABC) | AE49: Maverick (ABC) | AG49: The Lawman (ABC) | AH49: The Rebel (ABC) | AI49: The Alaskans (ABC) | AK49: 21 Beacon Street (ABC) | AL49: News; [11:15] Movie [Academy Theater]: Khyber Patrol (1954) | AX49: =A49 -> 21939
A50: 21946 | I50: Breadbasket, U.S.A. | J50: Off to Adventure [9:15] Americans at Work | K50: Oral Roberts | L50: Christian Science; [10:15] The Pastor | M50: This is the Answer | N50: It's a Great Life | O50: Herald of Truth | P50: Johns Hopkins | Q50: Bishop Pike | R50: Championship Bridge with Charles Goren (ABC) | S50: Stars of Tomorrow | T50: Movie [Sunday Matinee]: Drums Along the Mohawk (1939) | X50: The Paul Winhell Show (ABC) | Y50: Broken Arrow (ABC) | Z50: Matty's Funday Funnies (ABC) | AA50: Black Jim Hawk | AB50: You Asked for It | AC50: Not for Hire | AD50: Colt .45 (ABC) | AE50: Maverick (ABC) | AG50: The Lawman (ABC) | AH50: The Rebel (ABC) | AI50: The Alaskans (ABC) | AK50: 21 Beacon Street (ABC) | AL50: News; [11:15] Movie [Academy Theater]: The Lusty Men (1952) | AX50: =A50 -> 21946
A51: 21953 | I51: Breadbasket, U.S.A. | J51: Off to Adventure [9:15] Americans at Work | K51: Oral Roberts | L51: Christian Science; [10:15] The Pastor | M51: This is the Answer | N51: It's a Great Life | O51: Herald of Truth | P51: Johns Hopkins | Q51: Bishop Pike | R51: Championship Bridge with Charles Goren (ABC) | S51: Stars of Tomorrow | T51: Movie [Sunday Matinee]: Les Miserables (1935) | X51: The Paul Winhell Show (ABC) | Y51: Broken Arrow (ABC) | Z51: Matty's Funday Funnies (ABC) | AA51: Black Jim Hawk | AB51: You Asked for It | AC51: Topper | AD51: Colt .45 (ABC) | AE51: Maverick (ABC) | AG51: The Lawman (ABC) | AH51: The Rebel (ABC) | AI51: The Alaskans (ABC) | AK51: 21 Beacon Street (ABC) | AL51: News; [11:15] Movie [Academy Theater]: The Promoter (English; 1952) | AX51: =A51 -> 21953
A52: 21960 | I52: Breadbasket, U.S.A. | J52: Off to Adventure [9:15] Americans at Work | K52: Oral Roberts | L52: Christian Science; [10:15] The Pastor | M52: Movie [Best of Hollywood]: Cat People (1942) | P52: Johns Hopkins | Q52: Bishop Pike | R52: Championship Bridge with Charles Goren (ABC) | S52: Stars of Tomorrow | T52: Movie [Sunday Matinee]: Western Union (1941) | X52: The Paul Winhell Show (ABC) | Y52: Broken Arrow (ABC) | Z52: Matty's Funday Funnies (ABC) | AA52: The Lone Ranger | AB52: You Asked for It | AC52: Topper | AD52: Colt .45 (ABC) | AE52: Maverick (ABC) | AG52: The Lawman (ABC) | AH52: The Rebel (ABC) | AI52: The Alaskans (ABC) | AK52: 21 Beacon Street (ABC) | AL52: News; [11:15] Movie [Academy Theater]: The Americano (1954) | AX52: =A52 -> 21960
A53: 21967 | I53: Breadbasket, U.S.A. | J53: Off to Adventure [9:15] Americans at Work | K53: Oral Roberts | L53: Christian Science; [10:15] The Pastor | M53: Movie [Best of Hollywood]: Fort Yuma (1955) | P53: Johns Hopkins | Q53: Bishop Pike | R53: Championship Bridge with Charles Goren (ABC) | S53: Stars of Tomorrow | T53: Movie [Sunday Matinee]: TBA | X53: The Paul Winhell Show (ABC) | Y53: Tax Tips | Z53: Matty's Funday Funnies (ABC) | AA53: The Lone Ranger | AB53: You Asked for It | AC53: Topper | AD53: Colt .45 (ABC) | AE53: Maverick (ABC) | AG53: The Lawman (ABC) | AH53: The Rebel (ABC) | AI53: The Alaskans (ABC) | AK53: 21 Beacon Street (ABC) | AL53: News; [11:15] Movie [Academy Theater]: The Mikado (English; 1939) | AX53: =A53 -> 21967
A54: 21974 | I54: Breadbasket, U.S.A. | J54: Off to Adventure [9:15] Americans at Work | K54: Oral Roberts | L54: Christian Science; [10:15] The Pastor | M54: Movie [Best of Hollywood]: Where Do We Go from Here? (1945) | P54: Johns Hopkins | Q54: Bishop Pike | R54: Championship Bridge with Charles Goren (ABC) | S54: Stars of Tomorrow | T54: Movie [Sunday Matinee]: The Foxes of Harrow (1947); [3:15] President's Trip [JIP]; [3:30] Movie [Sunday Matinee]: The Foxes of Harrow (1947) [JIP] | X54: The Paul Winhell Show (ABC) | Y54: Broken Arrow (ABC) | Z54: Matty's Funday Funnies (ABC) | AA54: The Lone Ranger | AB54: You Asked for It | AC54: Topper | AD54: Colt .45 (ABC) | AE54: Maverick (ABC) | AG54: The Lawman (ABC) | AH54: The Rebel (ABC) | AI54: The Alaskans (ABC) | AK54: 21 Beacon Street (ABC) | AL54: News; [11:15] Movie [Academy Theater]: Corvette K-225 (1943) | AX54: =A54 -> 21974
A55: 21981 | I55: Breadbasket, U.S.A. | J55: Off to Adventure [9:15] Americans at Work | K55: Oral Roberts | L55: Christian Science; [10:15] The Pastor | M55: Movie [Best of Hollywood]: Pacific Adventure (1947) | P55: Johns Hopkins | Q55: Bishop Pike | R55: Championship Bridge with Charles Goren (ABC) | S55: Stars of Tomorrow | T55: Movie [Sunday Matinee]: Pittsburgh (1942) | X55: The Paul Winhell Show (ABC) | Y55: Broken Arrow (ABC) | Z55: Matty's Funday Funnies (ABC) | AA55: The Lone Ranger | AB55: You Asked for It | AC55: Topper | AD55: Colt .45 (ABC) | AE55: Maverick (ABC) | AG55: The Lawman (ABC) | AH55: The Rebel (ABC) | AI55: The Alaskans (ABC) | AK55: 21 Beacon Street (ABC) | AL55: News; [11:15] Movie [Sunday Academy Theater]: The Lavender Hill Mob (English; 1951) | AX55: =A55 -> 21981
A56: 21988 | I56: Breadbasket, U.S.A. | J56: Off to Adventure [9:15] Americans at Work | K56: Oral Roberts | L56: Christian Science; [10:15] The Pastor | M56: Movie [Best of Hollywood]: Mr. Lord Says No ( ? ) | P56: Johns Hopkins | Q56: Bishop Pike | R56: Championship Bridge with Charles Goren (ABC) | S56: Stars of Tomorrow | T56: Movie [Sunday Matinee]: My Sister Eileen (1942) | X56: The Paul Winhell Show (ABC) | Y56: Broken Arrow (ABC) | Z56: Matty's Funday Funnies (ABC) | AA56: The Lone Ranger | AB56: You Asked for It | AC56: Topper | AD56: Colt .45 (ABC) | AE56: Maverick (ABC) | AG56: The Lawman (ABC) | AH56: The Rebel (ABC) | AI56: The Alaskans (ABC) | AK56: 21 Beacon Street (ABC) | AL56: News; [11:15] Movie [Sunday Academy Theater]: The Promoter (English; 1952) | AX56: =A56 -> 21988
A57: 21995 | I57: Breadbasket, U.S.A. | J57: Off to Adventure [9:15] Americans at Work | K57: Oral Roberts | L57: Christian Science; [10:15] The Pastor | M57: Movie [Best of Hollywood]: Shockproof (1949) | P57: Johns Hopkins | Q57: Bishop Pike | R57: Championship Bridge with Charles Goren (ABC) | S57: Stars of Tomorrow | T57: Movie [Sunday Matinee]: Battle Hell (English; 1957) | X57: The Paul Winhell Show (ABC) | Y57: Broken Arrow (ABC) | Z57: Matty's Funday Funnies (ABC) | AA57: The Lone Ranger | AB57: You Asked for It | AC57: Topper | AD57: Colt .45 (ABC) | AE57: Maverick (ABC) | AG57: The Lawman (ABC) | AH57: The Rebel (ABC) | AI57: The Alaskans (ABC) | AK57: 21 Beacon Street (ABC) | AL57: News; [11:15] Movie [Sunday Academy Theater]: The Man in the White Suit (English; 1952) | AX57: =A57 -> 21995
A58: 22002 | I58: Breadbasket, U.S.A. | J58: Off to Adventure [9:15] Americans at Work | K58: Oral Roberts | L58: Christian Science; [10:15] The Pastor | M58: Movie [Best of Hollywood]: Wicked Woman (?) | P58: Johns Hopkins | Q58: Adventures in Gardening | R58: Championship Bridge with Charles Goren (ABC) | S58: Stars of Tomorrow | T58: Movie [Sunday Matinee]: On Dangerous Ground (1952) | X58: The Paul Winhell Show (ABC) | Y58: Broken Arrow (ABC) | Z58: Matty's Funday Funnies (ABC) | AA58: The Lone Ranger | AB58: You Asked for It | AC58: Topper | AD58: Colt .45 (ABC) | AE58: Maverick (ABC) | AG58: The Lawman (ABC) | AH58: The Rebel (ABC) | AI58: The Alaskans (ABC) | AK58: Johnny Staccato (ABC) | AL58: News; [11:15] Movie [Sunday Academy Theater]: Kind Hearts and Coronets (English; 1949) | AX58: =A58 -> 22002
A59: 22009 | I59: Breadbasket, U.S.A. | J59: Off to Adventure [9:15] Americans at Work | K59: Oral Roberts | L59: Christian Science; [10:15] The Pastor | M59: Movie [Best of Hollywood]: Remember the Day (1941) | P59: Showcase of Homes | Q59: Adventures in Gardening | R59: Guy Lombardo | S59: Stars of Tomorrow | T59: Movie [Sunday Matinee]: Lost Horizon (1937) | X59: The Paul Winhell Show (ABC) | Y59: Robin Hood | Z59: Matty's Funday Funnies (ABC) | AA59: The Lone Ranger | AB59: You Asked for It | AC59: Topper | AD59: Broken Arrow (ABC) | AE59: Maverick (ABC) | AG59: The Lawman (ABC) | AH59: The Rebel (ABC) | AI59: The Alaskans (ABC) | AK59: Johnny Staccato (ABC) | AL59: News; [11:15] Movie [Sunday Academy Theater]: The Malta Story (English; 1954) | AX59: =A59 -> 22009
A60: 22016 | I60: Breadbasket, U.S.A. | J60: Off to Adventure [9:15] Americans at Work | K60: Oral Roberts | L60: Christian Science; [10:15] The Pastor | M60: Movie [Best of Hollywood]: Mr. Peabody and the Mermaid (1948) | P60: Showcase of Homes | Q60: Adventures in Gardening | R60: Guy Lombardo | S60: Stars of Tomorrow | T60: Movie: The Great Lie (1941) | X60: TBA | Y60: Robin Hood | Z60: Matty's Funday Funnies (ABC) | AA60: The Lone Ranger | AB60: You Asked for It | AC60: Topper | AD60: Broken Arrow (ABC) | AE60: Maverick (ABC) | AG60: The Lawman (ABC) | AH60: The Rebel (ABC) | AI60: The Alaskans (ABC) | AK60: Johnny Staccato (ABC) | AL60: News; [11:15] Movie [Sunday Academy Theater]: King's Rhapsody (English; 1955) | AX60: =A60 -> 22016
A61: 22023 | I61: Breadbasket, U.S.A. | J61: Off to Adventure [9:15] Americans at Work | K61: Oral Roberts | L61: Christian Science; [10:15] The Pastor | M61: Movie [Best of Hollywood]: TBA | P61: Showcase of Homes | Q61: Adventures in Gardening | R61: Guy Lombardo | S61: Stars of Tomorrow | T61: Movie: TBA | X61: Citizen Soldier | Y61: Robin Hood | Z61: Matty's Funday Funnies (ABC) | AA61: The Lone Ranger | AB61: You Asked for It | AC61: Topper | AD61: Broken Arrow (ABC) | AE61: Maverick (ABC) | AG61: The Lawman (ABC) | AH61: The Rebel (ABC) | AI61: The Alaskans (ABC) | AK61: Johnny Staccato (ABC) | AL61: News; [11:15] Movie [Sunday Academy Theater]: TBA | AX61: =A61 -> 22023
B62: OTHER CITIES SWITCH TO DAYLIGHT SAVINGS TIME; PORTLAND SHOWS AIR ONE HOUR EARLIER | J62: OTHER CITIES SWITCH TO DAYLIGHT SAVINGS TIME; PORTLAND SHOWS AIR ONE HOUR EARLIER | R62: OTHER CITIES SWITCH TO DAYLIGHT SAVINGS TIME; PORTLAND SHOWS AIR ONE HOUR EARLIER | Z62: OTHER CITIES SWITCH TO DAYLIGHT SAVINGS TIME; PORTLAND SHOWS AIR ONE HOUR EARLIER | AH62: OTHER CITIES SWITCH TO DAYLIGHT SAVINGS TIME; PORTLAND SHOWS AIR ONE HOUR EARLIER | AP62: OTHER CITIES SWITCH TO DAYLIGHT SAVINGS TIME; PORTLAND SHOWS AIR ONE HOUR EARLIER
A63: 22030 | I63: Breadbasket, U.S.A. | J63: Off to Adventure [9:15] Americans at Work | K63: Oral Roberts | L63: Christian Science; [10:15] The Pastor | M63: Movie [Best of Hollywood]: Her Adventurous Night (1946) | P63: Showcase of Homes | Q63: Adventures in Gardening | R63: Ranch Party | S63: Stars of Tomorrow | T63: Movie [Sunday Matinee]: The Unfaithful (1947) | X63: Citizen Soldier | Y63: Robin Hood | Z63: Matty's Funday Funnies (ABC) | AA63: The Lone Ranger | AB63: You Asked for It | AC63: Maverick (ABC) | AE63: The Lawman (ABC) | AF63: The Rebel (ABC) | AG63: The Alaskans (ABC) | AI63: Johnny Staccato (ABC) | AJ63: Heart of the City | AK63: Night Court | AL63: News--John Salisbury; [11:15] Movie [Sunday Academy Theater]: While the City Sleeps (1956) | AX63: =A63 -> 22030
A64: 22037 | I64: Breadbasket, U.S.A. | J64: Off to Adventure [9:15] Americans at Work | K64: Oral Roberts | L64: Christian Science; [10:15] The Pastor | M64: Movie [Best of Hollywood]: TBA | P64: Showcase of Homes | Q64: Adventures in Gardening | R64: Ranch Party | S64: Stars of Tomorrow | T64: Movie [Sunday Matinee]: TBA | X64: Citizen Soldier | Y64: Robin Hood | Z64: Matty's Funday Funnies (ABC) | AA64: The Lone Ranger | AB64: You Asked for It | AC64: Maverick (ABC) | AE64: The Lawman (ABC) | AF64: The Rebel (ABC) | AG64: The Alaskans (ABC) | AI64: Johnny Staccato (ABC) | AJ64: Heart of the City | AK64: Night Court | AL64: News--Sherm Washburn [11:15] Movie [Sunday Academy Theater]: TBA | AX64: =A64 -> 22037
A65: 22044 | I65: Breadbasket, U.S.A. | J65: Off to Adventure [9:15] Americans at Work | K65: Oral Roberts | L65: Christian Science; [10:15] The Pastor | M65: Movie [Best of Hollywood]: Valley of the Sun (1942) | P65: Showcase of Homes | Q65: Adventures in Gardening | R65: Ranch Party | S65: Stars of Tomorrow | T65: Movie [Sunday Matinee]: So Well Remembered (English; 1947) | X65: Citizen Soldier | Y65: Robin Hood | Z65: Matty's Funday Funnies (ABC) | AA65: The Lone Ranger | AB65: You Asked for It | AC65: Maverick (ABC) | AE65: The Lawman (ABC) | AF65: The Rebel (ABC) | AG65: The Alaskans (ABC) | AI65: Johnny Staccato (ABC) | AJ65: Heart of the City | AK65: Night Court | AL65: News--Sherm Washburn [11:15] Movie [Sunday Academy Theater]: Two Guys from Milwaukee (1946) | AX65: =A65 -> 22044
A66: 22051 | I66: Breadbasket, U.S.A. | J66: Off to Adventure [9:15] Americans at Work | K66: Oral Roberts | L66: Christian Science; [10:15] The Pastor | M66: Movie [Best of Hollywood]: It's a Great Feeling (1949) | P66: Showcase of Homes | Q66: Adventures in Gardening | R66: Ranch Party | S66: Stars of Tomorrow | T66: Movie [Sunday Matinee]: Hobson's Choice (English; 1954) | X66: Citizen Soldier | Y66: Broken Arrow (ABC) | Z66: Matty's Funday Funnies (ABC) | AA66: The Lone Ranger | AB66: You Asked for It | AC66: Maverick (ABC) | AE66: The Lawman (ABC) | AF66: The Rebel (ABC) | AG66: The Alaskans (ABC) | AI66: Johnny Staccato (ABC) | AJ66: Heart of the City | AK66: Portland Story | AL66: News--Sherm Washburn [11:15] Movie [Sunday Academy Theater]: TBA | AX66: =A66 -> 22051
A67: 22058 | I67: Breadbasket, U.S.A. | J67: Off to Adventure [9:15] Americans at Work | K67: Oral Roberts | L67: Christian Science; [10:15] The Pastor | M67: Movie [Sunday Theater]: Easy Living (1949) | P67: College News Conference (ABC) | Q67: Adventures in Gardening | R67: Showcase of Homes | S67: Stars of Tomorrow | T67: Movie [Sunday Matinee]: How Green Was My Valley (1941) | X67: Citizen Soldier | Y67: Broken Arrow (ABC) | Z67: Matty's Funday Funnies (ABC) | AA67: The Lone Ranger | AB67: You Asked for It | AC67: Maverick (ABC) | AE67: The Lawman (ABC) | AF67: The Rebel (ABC) | AG67: The Alaskans (ABC) | AI67: Johnny Staccato (ABC) | AJ67: Heart of the City | AK67: Portland Story | AL67: News--Sherm Washburn [11:15] Movie [Sunday Academy Theater]: Lucky Partners (1940) | AX67: =A67 -> 22058
A69: 22072 | I69: Breadbasket, U.S.A. | J69: Off to Adventure [9:15] Americans at Work | K69: Oral Roberts | L69: Christian Science; [10:15] Pastor | M69: Movie [Sunday Theater]: TBA | P69: College News Conference (ABC) | Q69: Adventures in Gardening | R69: Showcase of Homes | S69: Stars of Tomorrow | T69: Movie [Sunday Matinee]: Sergeant York (1941) | Y69: Broken Arrow (ABC) | Z69: Matty's Funday Funnies (ABC) | AA69: The Lone Ranger | AB69: You Asked for It | AC69: Maverick (ABC) | AE69: The Lawman (ABC) | AF69: The Rebel (ABC) | AG69: The Alaskans (ABC) | AI69: Johnny Staccato (ABC) | AJ69: Movie [Movie 12]: Sergeant York (1941) | AX69: =A69 -> 22072
A70: 22079 | I70: Breadbasket, U.S.A. | J70: Off to Adventure [9:15] Americans at Work | K70: Oral Roberts | L70: Christian Science; [10:15] Pastor | M70: Movie [Drive-in Theater]: Overland Pacific (1954) | P70: College News Conference (ABC) | Q70: Adventures in Gardening | R70: Showcase of Homes | S70: Stars of Tomorrow | T70: Movie [Sunday Matinee]: Tender Comrade (1943) | X70: Citizen Soldier | Y70: Broken Arrow (ABC) | Z70: Matty's Funday Funnies (ABC) | AA70: The Lone Ranger | AB70: You Asked for It | AC70: Maverick (ABC) | AE70: The Lawman (ABC) | AF70: The Rebel (ABC) | AG70: The Alaskans (ABC) | AI70: Johnny Staccato (ABC) | AJ70: Heart of the City | AK70: Portland Story | AL70: News [11:15] Movie [Movie 12]: Those Endearing Young Charms (1945) | AX70: =A70 -> 22079
A71: 22086 | I71: Breadbasket, U.S.A. | J71: Off to Adventure [9:15] Americans at Work | K71: Oral Roberts | L71: Christian Science; [10:15] Pastor | M71: Movie: Sally, Irene and Mary (1938) | P71: College News Conference (ABC) | Q71: Guy Lombardo | R71: Showcase of Homes | S71: Stars of Tomorrow | T71: President's Trip (ABC) | U71: Movie: The Ambassador's Daughter (1956) | X71: Citizen Soldier | Y71: Broken Arrow (ABC) | Z71: Matty's Funday Funnies (ABC) | AA71: The Lone Ranger | AB71: You Asked for It | AC71: Maverick (ABC) | AE71: The Lawman (ABC) | AF71: The Rebel (ABC) | AG71: The Alaskans (ABC) | AI71: Fight Preview: Biography of the FIght (ABC) | AJ71: Heart of the City | AK71: Portland Story | AL71: News [11:15] Movie [Movie 12]: Lillian Russell (1940) | AX71: =A71 -> 22086
A72: 22093 | I72: Breadbasket, U.S.A. | J72: Off to Adventure [9:15] Americans at Work | K72: Oral Roberts | L72: Christian Science; [10:15] Pastor | M72: Movie [Drive-in Theater]: So Soon to Die (1957) | P72: College News Conference (ABC) | Q72: Guy Lombardo | R72: Showcase of Homes | S72: TBA | T72: Movie [Sunday Matinee]: Thank Your Lucky Stars (1943) | X72: The Westerner | Y72: Broken Arrow (ABC) | Z72: Matty's Funday Funnies (ABC) | AA72: The Lone Ranger | AB72: You Asked for It | AC72: Maverick (ABC) | AE72: The Lawman (ABC) | AF72: The Rebel (ABC) | AG72: The Alaskans (ABC) | AI72: Johnny Staccato (ABC) | AJ72: Heart of the City | AK72: Portland Story | AL72: News [11:15] Movie [Movie 12]: She Couldn't Say No (1954) | AX72: =A72 -> 22093
A73: 22100 | I73: Breadbasket, U.S.A. | J73: Off to Adventure [9:15] Americans at Work | K73: Oral Roberts | L73: Christian Science; [10:15] Pastor | M73: Movie [Drive-in Theater]: Dragon's Gold (1953) | P73: College News Conference (ABC) | Q73: Showcase of Homes | S73: Top Plays | T73: Movie [Sunday Matinee]: The Prowler (1951) | X73: The Westerner | Y73: Broken Arrow (ABC) | Z73: Convention Preview (ABC) [Special] | AA73: The Lone Ranger | AB73: You Asked for It | AC73: Maverick (ABC) | AE73: The Lawman (ABC) | AF73: The Rebel (ABC) | AG73: The Alaskans (ABC) | AI73: Johnny Staccato (ABC) | AJ73: Heart of the City | AK73: Portland Story | AL73: News [11:15] Movie [Movie 12]: Green for Danger (English; 1946) | AX73: =A73 -> 22100
A75: 22114 | I75: Breadbasket, U.S.A. | J75: Off to Adventure [9:15] Americans at Work | K75: Oral Roberts | L75: Christian Science; [10:15] The Pastor | M75: Movie [Drive-in Theater]: The Brasher Doubloon (1947) | P75: College News Conference (ABC) | Q75: Showcase of Homes | S75: Top Plays | T75: Movie [Sunday Matinee]: Look for the Silver Lining (1949) | X75: The Westerner | Y75: Toppper | Z75: Matty's Funday Funnies (ABC) | AA75: The Lone Ranger | AB75: You Asked for It | AC75: Maverick (ABC) | AE75: The Lawman (ABC) | AF75: The Rebel (ABC) | AG75: The Alaskans (ABC) | AI75: Johnny Staccato (ABC) | AJ75: Portland Story | AK75: Movie [Movie 12]: The Invisible Man's Revenge (1944) | AX75: =A75 -> 22114
A76: 39653 | I76: Breadbasket, U.S.A. | J76: Off to Adventure [9:15] Americans at Work | K76: Oral Roberts | L76: Christian Science; [10:15] The Pastor | M76: Movie [Drive-in Theater]: Gang-Busters (1955) | P76: College News Conference (ABC) | Q76: Showcase of Homes | S76: Top Plays | T76: Movie [Sunday Matinee]: Odd Man Out (English; 1947) | X76: The Westerner | Y76: Toppper | Z76: Matty's Funday Funnies (ABC) | AA76: The Lone Ranger | AB76: You Asked for It | AC76: Maverick (ABC) | AE76: The Lawman (ABC) | AF76: The Rebel (ABC) | AG76: The Alaskans (ABC) | AI76: Johnny Staccato (ABC) | AJ76: Portland Story | AK76: Movie [Movie 12]: Dracula (1931) | AX76: =A76 -> 39653
A77: 22128 | I77: Breadbasket, U.S.A. | J77: Off to Adventure [9:15] Americans at Work | K77: Oral Roberts | L77: Christian Science; [10:15] The Pastor | M77: Movie [Drive-in Theater]: The Magnet (English; 1950) | P77: College News Conference (ABC) | Q77: Showcase of Homes | S77: Top Plays | T77: Movie [Sunday Matinee]: Four Feathers (1939) | X77: The Westerner | Y77: Toppper | Z77: Matty's Funday Funnies (ABC) | AA77: The Lone Ranger | AB77: You Asked for It | AC77: Maverick (ABC) | AE77: The Lawman (ABC) | AF77: The Rebel (ABC) | AG77: The Alaskans (ABC) | AI77: Johnny Staccato (ABC) | AJ77: Portland Story | AK77: Movie [Movie 12]: Clouded Yellow (English; 1950) | AX77: =A77 -> 22128
A78: 22135 | I78: Breadbasket, U.S.A. | J78: Off to Adventure [9:15] Americans at Work | K78: Oral Roberts | L78: Christian Science; [10:15] The Pastor | M78: Movie [Drive-in Theater]: Identity Unknown (1945) | P78: College News Conference (ABC) | Q78: Showcase of Homes | S78: Top Plays | T78: Movie [Sunday Matinee]: Prince and the Pauper (1937) | X78: The Westerner | Y78: Toppper | Z78: Matty's Funday Funnies (ABC) | AA78: The Lone Ranger | AB78: You Asked for It | AC78: Maverick (ABC) | AE78: The Lawman (ABC) | AF78: The Rebel (ABC) | AG78: The Alaskans (ABC) | AI78: Johnny Staccato (ABC) | AJ78: Movie [Movie 12]: Princess O'Rourke (1943) | AX78: =A78 -> 22135
A79: 22142 | I79: Breadbasket, U.S.A. | J79: Off to Adventure [9:15] Americans at Work | K79: Oral Roberts | L79: Christian Science; [10:15] The Pastor | M79: Movie [Drive-in Theater]: Frankenstein (1932) | P79: College News Conference (ABC) | Q79: Showcase of Homes | S79: Top Plays | T79: Movie [Sunday Matinee]: Footlight Parade (1933) | X79: The Westerner | Y79: Toppper | Z79: Matty's Funday Funnies (ABC) | AA79: The Lone Ranger | AB79: You Asked for It | AC79: Maverick (ABC) | AE79: The Lawman (ABC) | AF79: The Rebel (ABC) | AG79: The Alaskans (ABC) | AI79: Johnny Staccato (ABC) | AJ79: Movie [Movie 12]: The Sisters (1938) | AX79: =A79 -> 22142
A80: 22149 | I80: Breadbasket, U.S.A. | J80: Off to Adventure [9:15] Americans at Work | K80: Oral Roberts | L80: Christian Science; [10:15] The Pastor | M80: Movie [Drive-in Theater]: The Verdict (1946) | P80: College News Conference (ABC) | Q80: Showcase of Homes | S80: Top Plays | T80: Movie [Sunday Matinee]: A Yank in London (English; 1946) | X80: The Westerner | Y80: Toppper | Z80: Matty's Funday Funnies (ABC) | AA80: The Lone Ranger | AB80: You Asked for It | AC80: Maverick (ABC) | AE80: The Lawman (ABC) | AF80: The Rebel (ABC) | AG80: The Alaskans (ABC) | AI80: Johnny Staccato (ABC) | AJ80: Movie [Movie 12]: The Man with Two Faces (1934) | AX80: =A80 -> 22149
A81: 22156 | I81: Breadbasket, U.S.A. | J81: Off to Adventure [9:15] Americans at Work | K81: Oral Roberts | L81: Christian Science; [10:15] The Pastor | M81: Movie [Drive-in Theater]: Tiger Shark (1932) | P81: College News Conference (ABC) | Q81: Showcase of Homes | S81: Top Plays | T81: Movie: Winter Meeting (1948) | X81: The Westerner | Y81: Toppper | Z81: Matty's Funday Funnies (ABC) | AA81: The Lone Ranger | AB81: You Asked for It | AC81: Maverick (ABC) | AE81: The Lawman (ABC) | AF81: The Rebel (ABC) | AG81: The Alaskans (ABC) | AI81: Johnny Staccato (ABC) | AJ81: Movie [Movie 12]: Sons of the Sea (English; 1942) | AX81: =A81 -> 22156
A82: 22163 | I82: Breadbasket, U.S.A. | J82: Off to Adventure [9:15] Americans at Work | K82: Oral Roberts | L82: Christian Science; [10:15] The Pastor | M82: Movie [Drive-in Theater]: The Beast with Five Fingers (1946) | P82: College News Conference (ABC) | Q82: Showcase of Homes | S82: Top Plays | T82: Movie: Till the End of Time (1946) | X82: The Westerner | Y82: Toppper | Z82: Land of Promise [Special] | AA82: The Lone Ranger | AB82: You Asked for It | AC82: Maverick (ABC) | AE82: The Lawman (ABC) | AF82: The Rebel (ABC) | AG82: The Alaskans (ABC) | AI82: Johnny Staccato (ABC) | AJ82: Movie [Movie 12]: The Bride Came C.O.D. (1941) | AX82: =A82 -> 22163
A83: 22170 | I83: Breadbasket, U.S.A. | J83: Off to Adventure [9:15] Americans at Work | K83: Oral Roberts | L83: Christian Science; [10:15] The Pastor | M83: Movie [Drive-in Theater]: Damsel in Distress (1937) | Q83: AFL Football (ABC): Houston Oilers vs. Oakland Riaders | V83: TBA | W83: Movie: Footlight Serenade (1942) | Z83: Matty's Funday Funnies (ABC) | AA83: The Lone Ranger | AB83: You Asked for It | AC83: Maverick (ABC) | AE83: The Lawman (ABC) | AF83: The Rebel (ABC) | AG83: The Alaskans (ABC) | AI83: Johnny Staccato (ABC) | AJ83: Movie [Movie 12]: Repeat Performance (1947) | AX83: =A83 -> 22170
A84: 22177 | I84: Breadbasket, U.S.A. | J84: Off to Adventure [9:15] Americans at Work | K84: Oral Roberts | L84: Christian Science; [10:15] The Pastor | M84: Top Plays | N84: TV Showcase of Homes | P84: Famous Playhouse | Q84: AFL Football (ABC): Los Angeles Chargers vs. Houston Oilers | V84: TBA | W84: Movie: The Toast of New York (1937) | Z84: Matty's Funday Funnies (ABC) | AA84: The Lone Ranger | AB84: You Asked for It | AC84: Maverick (ABC) | AE84: The Lawman (ABC) | AF84: The Rebel (ABC) | AG84: The Alaskans (ABC) | AI84: Johnny Staccato (ABC) | AJ84: Movie [Movie 12]: Rembrandt (1936) | AX84: =A84 -> 22177
B85: OTHER CITIES SWITCH TO STANDARD TIME; PORTLAND SHOWS AIR ONE HOUR LATER | J85: OTHER CITIES SWITCH TO STANDARD TIME; PORTLAND SHOWS AIR ONE HOUR LATER | R85: OTHER CITIES SWITCH TO STANDARD TIME; PORTLAND SHOWS AIR ONE HOUR LATER | Z85: OTHER CITIES SWITCH TO STANDARD TIME; PORTLAND SHOWS AIR ONE HOUR LATER | AH85: OTHER CITIES SWITCH TO STANDARD TIME; PORTLAND SHOWS AIR ONE HOUR LATER | AP85: OTHER CITIES SWITCH TO STANDARD TIME; PORTLAND SHOWS AIR ONE HOUR LATER
A86: 22184 | I86: Breadbasket, U.S.A. | J86: Off to Adventure [9:15] Americans at Work | K86: Oral Roberts | L86: Christian Science; [10:15] The Pastor | M86: Top Plays | N86: TV Showcase of Homes | P86: Famous Playhouse | Q86: AFL Football (ABC): Los Angeles Chargers vs. Dallas Texans | W86: Top Plays | X86: Stars of Tomorrow | Y86: Famous Playhouse | Z86: Matty's Funday Funnies (ABC) | AA86: Rocky and His Friends (ABC) | AB86: You Asked for It | AC86: Walt Disney Presents (ABC) | AE86: Maverick (ABC) | AG86: The Lawman (ABC) | AH86: The Rebel (ABC) | AI86: The Alaskans (ABC) | AK86: Movie [Movie 12]: Ruthless (1948) | AX86: =A86 -> 22184
A87: 22191 | I87: Breadbasket, U.S.A. | J87: Off to Adventure [9:15] Americans at Work | K87: Oral Roberts | L87: AFL Football (ABC): Los Angeles Chargers vs. Buffalo Bills | R87: TV Showcase of Homes | T87: Movie: TBA | X87: Stars of Tomorrow | Y87: Famous Playhouse | Z87: Matty's Funday Funnies (ABC) | AA87: Rocky and His Friends (ABC) | AB87: You Asked for It | AC87: Walt Disney Presents (ABC) | AE87: Maverick (ABC) | AG87: The Lawman (ABC) | AH87: The Rebel (ABC) | AI87: The Islanders (ABC) | AK87: The Walter Winchell Show (ABC) | AL87: Movie [Movie 12]: TBA | AX87: =A87 -> 22191
A88: 22198 | I88: Breadbasket, U.S.A. | J88: Off to Adventure [9:15] Americans at Work | K88: Oral Roberts | L88: Christian Science; [10:15] The Pastor | M88: It is Written | N88: TV Showcase of Homes | P88: Top Plays | Q88: AFL Football (ABC): Oakland Raiders vs. Dallas Texans | W88: Famous Playhouse | X88: Stars of Tomorrow | Y88: Western Square Dance | Z88: Matty's Funday Funnies (ABC) | AA88: Rocky and His Friends (ABC) | AB88: You Asked for It | AC88: Walt Disney Presents (ABC) | AE88: Maverick (ABC) | AG88: The Lawman (ABC) | AH88: The Rebel (ABC) | AI88: The Islanders (ABC) | AK88: The Walter Winchell Show (ABC) | AL88: Movie [Movie 12]: Brigham Young (1940) | AX88: =A88 -> 22198
A89: 22205 | I89: Breadbasket, U.S.A. | J89: Off to Adventure [9:15] Americans at Work | K89: Oral Roberts | L89: Christian Science; [10:15] The Pastor | M89: It is Written | N89: TV Showcase of Homes | P89: Top Plays | Q89: AFL Football (ABC): Dallas Texans vs. Houston Oilers | W89: Top Plays | X89: Stars of Tomorrow | Y89: Western Square Dance | Z89: Matty's Funday Funnies (ABC) | AA89: Rocky and His Friends (ABC) | AB89: You Asked for It | AC89: Walt Disney Presents (ABC) | AE89: Maverick (ABC) | AG89: The Lawman (ABC) | AH89: The Rebel (ABC) | AI89: The Islanders (ABC) | AK89: The Walter Winchell Show (ABC) | AL89: Movie [Movie 12]: Lifeboat (1944) | AX89: =A89 -> 22205
A90: 22212 | I90: Breadbasket, U.S.A. | J90: Light TIme [9:15] Americans at Work | K90: Oral Roberts | L90: Christian Science; [10:15] The Pastor | M90: It is Written | N90: TV Showcase of Homes | P90: Top Plays | Q90: AFL Football (ABC): Boston Patriots vs. Denver Broncos | W90: Top Plays | X90: Stars of Tomorrow | Y90: Western Square Dance | Z90: Matty's Funday Funnies (ABC) | AA90: Rocky and His Friends (ABC) | AB90: You Asked for It | AC90: Walt Disney Presents (ABC) | AE90: Maverick (ABC) | AG90: The Lawman (ABC) | AH90: The Rebel (ABC) | AI90: The Islanders (ABC) | AK90: The Walter Winchell Show (ABC) | AL90: Movie [Movie 12]: If You Knew Susie (1948) | AX90: =A90 -> 22212
A91: 22219 | I91: Americans at Work; [8:45] Abbott and Costello; [9:15] Learn to Draw | K91: Oral Roberts | L91: Christian Science; [10:15] Light Time | M91: It is Written | N91: AFL Football (ABC): Houston Oilers vs. Buffalo Bills | T91: TV Showcase of Homes | V91: Top Plays | W91: Western Square Dance | X91: Stars of Tomorrow | Y91: Men with a Mission | Z91: Matty's Funday Funnies (ABC) | AA91: Rocky and His Friends (ABC) | AB91: You Asked for It | AC91: Walt Disney Presents (ABC) | AE91: Maverick (ABC) | AG91: The Lawman (ABC) | AH91: The Rebel (ABC) | AI91: The Islanders (ABC) | AK91: The Walter Winchell Show (ABC) | AL91: Movie [Movie 12]: Crossfire (1947) | AX91: =A91 -> 22219
A92: 22226 | I92: Americans at Work; [8:45] Abbott and Costello; [9:15] Learn to Draw | K92: Oral Roberts | L92: Christian Science; [10:15] Light Time | M92: It is Written | N92: AFL Football (ABC): Dallas Texans vs. Buffalo Bills | T92: TV Showcase of Homes | V92: Top Plays | W92: Western Square Dance | X92: Stars of Tomorrow | Y92: Men with a Mission | Z92: Matty's Funday Funnies (ABC) | AA92: Rocky and His Friends (ABC) | AB92: You Asked for It | AC92: Walt Disney Presents (ABC) | AE92: Maverick (ABC) | AG92: The Lawman (ABC) | AH92: The Rebel (ABC) | AI92: The Islanders (ABC) | AK92: The Walter Winchell Show (ABC) | AL92: Movie: [Movie 12]: Berlin Correspondent (1942) | AX92: =A92 -> 22226
A93: 22233 | I93: Americans at Work; [8:45] Abbott and Costello; [9:15] Learn to Draw | K93: Oral Roberts | L93: Christian Science; [10:15] Light Time | M93: It is Written | N93: TV Showcase of Homes | P93: Western Square Dance | Q93: Top Plays | R93: AFL Football (ABC): Houston Oilers vs. Los Angeles Chargers | X93: Stars of Tomorrow | Y93: Men with a Mission | Z93: Matty's Funday Funnies (ABC) | AA93: Rocky and His Friends (ABC) | AB93: You Asked for It | AC93: Walt Disney Presents (ABC) | AE93: Maverick (ABC) | AG93: The Lawman (ABC) | AH93: The Rebel (ABC) | AI93: The Islanders (ABC) | AK93: Union Pacific | AL93: The Walter Winchell Show; [11:15] Movie [Movie 12]: Sylvia Scarlet (1935) | AX93: =A93 -> 22233
A94: 22240 | I94: Americans at Work; [8:45] Abbott and Costello; [9:15] Learn to Draw | K94: Oral Roberts | L94: Christian Science; [10:15] Light Time | M94: It is Written | N94: TV Showcase of Homes | P94: Western Square Dance | Q94: Top Plays | R94: AFL Football (ABC): Buffalo Bills vs. Los Angeles Chargers | W94: Top Plays | X94: Stars of Tomorrow | Y94: Men with a Mission | Z94: Matty's Funday Funnies (ABC) | AA94: Rocky and His Friends (ABC) | AB94: You Asked for It | AC94: Walt Disney Presents (ABC) | AE94: Maverick (ABC) | AG94: The Lawman (ABC) | AH94: The Rebel (ABC) | AI94: The Islanders (ABC) | AK94: Union Pacific | AL94: Movie: [Movie 12]: A Stolen Life (1946) | AX94: =A94 -> 22240
A95: 22247 | I95: Americans at Work; [8:45] Abbott and Costello; [9:15] Learn to Draw | K95: Oral Roberts | L95: Christian Science; [10:15] Light Time | M95: It is Written | N95: TV Showcase of Homes | P95: 1961 Portland Boat Show | Q95: Western Square Dance | R95: Stars of Tomorrow | S95: Men with a Mission | T95: AFL Football (ABC): Oakland Raiders vs. Los Angeles Chargers | Z95: Matty's Funday Funnies (ABC) | AA95: Rocky and His Friends (ABC) | AB95: You Asked for It | AC95: Walt Disney Presents (ABC) | AE95: Maverick (ABC) | AG95: The Lawman (ABC) | AH95: The Rebel (ABC) | AI95: The Islanders (ABC) | AK95: Winston Churchill: The Valiant Years (ABC) | AL95: The Walter Winchell Show; [11:15] Movie [Movie 12]: Brute Force (1947) | AX95: =A95 -> 22247
A96: 22254 | I96: Americans at Work; [8:45] Abbott and Costello; [9:15] Learn to Draw | K96: Oral Roberts | L96: Christian Science; [10:15] Light Time | M96: It is Written | N96: TV Showcase of Homes | P96: Top Plays | Q96: Western Square Dance | R96: Stars of Tomorrow | S96: AFL Football (ABC): Los Angeles Chargers vs. Oakland Raiders | Y96: Men with a Mission | Z96: Matty's Funday Funnies (ABC) | AA96: Rocky and His Friends (ABC) | AB96: You Asked for It | AC96: Walt Disney Presents (ABC) | AE96: Maverick (ABC) | AG96: The Lawman (ABC) | AH96: The Rebel (ABC) | AI96: The Islanders (ABC) | AK96: Winston Churchill: The Valiant Years (ABC) | AL96: The Walter Winchell Show; [11:15] Movie [Movie 12]: The Unfaithful (1947) | AX96: =A96 -> 22254
A97: 22261 | I97: Americans at Work; [8:45] Abbott and Costello; [9:15] Learn to Draw | K97: Oral Roberts | L97: Christian Science; [10:15] Light Time | M97: It is Written | N97: TV Showcase of Homes | P97: Western Square Dance | Q97: Top Plays | R97: AFL Football (ABC): New York Titans vs. Oakland Raiders | X97: Stars of Tomorrow | Y97: Men with a Mission | Z97: Matty's Funday Funnies (ABC) | AA97: Rocky and His Friends (ABC) | AB97: You Asked for It | AC97: Walt Disney Presents (ABC) | AE97: Maverick (ABC) | AG97: The Lawman (ABC) | AH97: The Rebel (ABC) | AI97: The Islanders (ABC) | AK97: Winston Churchill: The Valiant Years (ABC) | AL97: Movie: [Movie 12]: At War with the Army (1950) | AX97: =A97 -> 22261
A98: 22268 | I98: Americans at Work; [8:45] Abbott and Costello; [9:15] Learn to Draw | K98: Oral Roberts | L98: Christian Science; [10:15] Light Time | M98: It is Written | N98: TV Showcase of Homes | P98: Western Square Dance | Q98: Top Plays | R98: AFL Football (ABC): New York Titans vs. Los Angeles Chargers | X98: Stars of Tomorrow | Y98: Men with a Mission | Z98: Matty's Funday Funnies (ABC) | AA98: Rocky and His Friends (ABC) | AB98: You Asked for It | AC98: Walt Disney Presents (ABC) | AE98: Maverick (ABC) | AG98: The Lawman (ABC) | AH98: The Rebel (ABC) | AI98: The Islanders (ABC) | AK98: Movie: [Movie 12]: Navy Wife (1956) | AX98: =A98 -> 22268
A99: 22275 | I99: Americans at Work; [8:45] Abbott and Costello; [9:15] Learn to Draw | K99: Oral Roberts | L99: Christian Science; [10:15] Light Time | M99: It is Written | N99: Top Plays | P99: TV Showcase of Homes | R99: Movie: Holiday Affair (1949) | V99: Western Square Dance | X99: Stars of Tomorrow | Y99: Men with a Mission | Z99: Matty's Funday Funnies (ABC) | AA99: Rocky and His Friends (ABC) | AB99: You Asked for It | AC99: Walt Disney Presents (ABC) | AE99: Maverick (ABC) | AG99: The Lawman (ABC) | AH99: The Rebel (ABC) | AI99: The Islanders (ABC) | AK99: Movie: [Movie 12]: I Remember Mama (1948) | AX99: =A99 -> 22275
A100: 1961 | AX100: 1961
A101: 22282 | I101: Americans at Work; [8:45] Abbott and Costello; [9:15] Learn to Draw | K101: Oral Roberts | L101: Christian Science; [10:15] Light Time | M101: It is Written | N101: Top Plays | O101: TV Showcase of Homes | R101: AFL Football Championship (ABC): Los Angeles Chargers vs. Houston Oilers | W101: Top Plays | X101: Stars of Tomorrow | Y101: Top Plays | Z101: Matty's Funday Funnies (ABC) | AA101: Rocky and His Friends (ABC) | AB101: You Asked for It | AC101: Walt Disney Presents (ABC) | AE101: Maverick (ABC) | AG101: The Lawman (ABC) | AH101: The Rebel (ABC) | AI101: The Will to Victory (ABC) [Special] | AK101: Movie: [Movie 12]: Since You Went Away (1944) | AX101: =A101 -> 22282
A104: 23164 | I104: Herald of Truth | J104: Oral Roberts | K104: Guy Lombardo | L104: TBA | M104: Bible Class | N104: Famous Playhouse: A Likely Story | O104: Robin Hood | P104: Air Power | Q104: TV Show of Homes | S104: Stars of Tomorrow | T104: Movie: A Foreign Affair (1948) | Y104: Take Two | Z104: Major Adams | AB104: You Asked for It | AC104: Checkmate | AE104: Jetsons (ABC) | AF104: Movie: Subway in the Sky (1959) | AJ104: Voice of Firestone (ABC) | AK104: Howard K. Smith (ABC) | AL104: Movie: Riding High (1943) | AX104: =A104 -> 23164
A106: 1964 | AX106: 1964
A107: 23430 | I107: Herald of Truth | J107: Oral Roberts | K107: Gospel Favorites | M107: Bible Class | N107: Way of Life | O107: Sports Highlights | P107: TV Show of Homes | R107: Discovery '64 (ABC) | S107: Issues and Answers (ABC) | T107: Movie: Ring of Fear (1954) | X107: Stars of Tomorrow | Y107: Science All-Stars | Z107: Checkmate | AB107: You Asked for It | AC107: Hennesey | AD107: I'm Dickens, He's Fenster (ABC) | AE107: Jamie McPheeters (ABC) | AG107: Arrest and Trial (ABC) | AJ107: Movie: The Frogmen (1951) | AM107: [11:45] Movie: Having Wonderful Crime (1945) | AX107: =A107 -> 23430
B108: KPTV BECOMES INDEPENDENT | J108: KPTV BECOMES INDEPENDENT | R108: KPTV BECOMES INDEPENDENT | Z108: KPTV BECOMES INDEPENDENT | AH108: KPTV BECOMES INDEPENDENT | AP108: KPTV BECOMES INDEPENDENT
A109: 23437 | K109: Herald of Truth | L109: Oral Roberts | M109: Bible Class | N109: Way of Life | O109: Sports Highlights | P109: Americans at Work; [12:15] Social Security | Q109: TV Show of Homes | S109: Stars of Tomorrow | T109: Movie: Ring of Fear (1954) | X109: Rocky and His Friends | Y109: Navy Log | Z109: Checkmate | AB109: You Asked for It | AC109: Movie: Sayonara (1957) | AI109: Hennesey | AJ109: Movie: Hail the Conquering Hero (1944) | AX109: =A109 -> 23437
A110: 23444 | K110: Oral Roberts | L110: Herald of Truth | M110: Bible Class | N110: Way of Life | O110: Sports Highlights | P110: Americans at Work; [12:15] Social Security | Q110: TV Show of Homes | S110: Stars of Tomorrow | T110: Movie: Soldier of Fortune (1955) | X110: Rocky and His Friends | Y110: Navy Log | Z110: Checkmate | AB110: You Asked for It | AC110: Movie: You're in the Navy Now (1951) | AG110: Hennesey | AH110: Great Music | AI110: Movie: Every Girl Should Be Married (1948) | AX110: =A110 -> 23444
A112: 1965 | AX112: 1965
A113: 23997 | K113: Oral Roberts | L113: Breadbasket, U.S.A. | M113: [10:45] The Living Word | N113: Social Security; [11:15] Navy Film | O113: [11:45] Americans at Work | P113: TV Show of Homes | R113: Bible Class | S113: Sergeant Preston | T113: Movie: Practically Yours (1944) | X113: Checkmate | Z113: Rocky and His Friends | AA113: Tales of Wells Fargo | AB113: You Asked for It | AC113: Movie: Night People (1954) | AG113: Hennesey | AH113: Roller Derby | AJ113: Dan Smoot; [10:15] Manion Forum | AK113: Project 12 | AL113: Movie: Murder, He Says (1945) | AX113: =A113 -> 23997
A114: 24004 | K114: Oral Roberts | L114: Breadbasket, U.S.A. | M114: The Living Word | N114: Social Security; [11:15] Navy Film | O114: [11:45] Americans at Work | P114: TV Show of Homes | R114: Bible Class | T114: Movie: Having a Wonderful Time (1938) | X114: Checkmate | Z114: Rocky and His Friends | AA114: Tales of Wells Fargo | AB114: You Asked for It | AC114: Movie: Hondo (1954) | AG114: Hennesey | AH114: Feature Film | AI114: Peter Gunn | AJ114: Dan Smoot; [10:15] Manion Forum | AK114: Project 12 | AL114: Movie: Mr. and Mrs. Smith (1941) | AX114: =A114 -> 24004
A117: 1970 | AX117: 1970
A118: 25572 | F118: [7:15] News--Don Stellges | G118: Revival Fires | H118: Kathryn Kuhlman | I118: Cathedral of Tomorrow | K118: Oral Roberts | L118: Day of Discovery | M118: It is Written | N118: The Power of Your Attitudes | O118: Film--Medicine; [11:45] Film--Investment | P118: Movie [Brunch Theater]: 7th Cavalry (1956); [1:45] Great Music | T118: Olympiad 1964 | X118: Skippy | Y118: The Battle for Asia | AA118: The Big Valley | AC118: Movie [Hollywood's Best]: Jupiter's Darling (1955) | AG118: The Don Stellges Report | AH118: Movie [Sunday Showtime]: That Lady (1955) | AL118: World of Sport; [11:05] Movie [Movie 12]: Crack in the Mirror (1960) | AX118: =A118 -> 25572
A119: =A118+7 -> 25579 | F119: [7:15] News--Don Stellges | G119: Revival Fires | H119: Kathryn Kuhlman | I119: Cathedral of Tomorrow | K119: Oral Roberts | L119: Day of Discovery | M119: It is Written | N119: The Power of Your Attitudes | O119: TV Show of Homes | P119: Movie [Brunch Theater]: Devil's Doorway (1950); [1:45] Great Music | T119: Movie [Sunday Matinee]: The Winning Team (1952); [3:55] Film--Art | X119: Skippy | Y119: The Battle for Asia | AA119: The Big Valley | AC119: Movie [Hollywood's Best]: A Dog of Flanders (1960) | AG119: Apollo 12 | AH119: Movie [Sunday Showtime]: No Time for Sergeants (1958) | AL119: [11:10] World of Sport; [11:15] Movie [Movie 12]: Santiago (1956) | AX119: =A119 -> 25579
A120: =A119+7 -> 25586
A121: =A120+7 -> 25593 | F121: [7:15] News Review-- Don Stellges | G121: Revival Fires | H121: Kathryn Kuhlman | I121: Cathedral of Tomorrow | K121: Oral Roberts | L121: Day of Discovery | M121: It is Written | N121: The Power of Your Attitudes | O121: TV Show of Homes | P121: Movie [Brunch Theater]: Run Home Slow (1965); [1:45] Great Music | T121: Movie [Sunday Matinee]: The Thief of Bagdad (1940) | X121: Skippy | Y121: Reformation | AA121: The Big Valley | AC121: Movie [Hollywood's Best]: East of Eden (1955) | AG121: [8:50] The Don Stellges Report | AH121: Movie [Sunday Showtime]: September Storm (1960) | AL121: World of Sport; [11:05] Movie [Movie 12]: Climats (1962) | AX121: =A121 -> 25593
A122: =A121+7 -> 25600 | F122: [7:15] News Review-- Don Stellges | G122: Revival Fires | H122: Kathryn Kuhlman | I122: Cathedral of Tomorrow | K122: Oral Roberts | L122: Day of Discovery | M122: It is Written | N122: The Power of Your Attitudes | O122: TV Show of Homes | P122: Movie [Brunch Theater]: The Hired Gun (1957) | T122: Movie [Sunday Matinee]: A Slight Case of Larceny (1953) | X122: Skippy | Y122: Judd for the Defense | AA122: The Big Valley | AC122: Movie [Hollywood's Best]: The Little Shepherd of Kingdom Come (1961) | AG122: [8:40] The Don Stellges Report | AH122: The Front Page | AK122: Hawaii Calls | AL122: World of Sport; [11:05] Movie [Movie 12]: I Wonder Who's Kissing Her Now (1947) | AX122: =A122 -> 25600
A123: =A122+7 -> 25607 | F123: [7:15] News Review-- Don Stellges | G123: Revival Fires | H123: Kathryn Kuhlman | I123: Cathedral of Tomorrow | K123: Oral Roberts | L123: Day of Discovery | M123: It is Written | N123: The Power of Your Attitudes | O123: TV Show of Homes | P123: Movie [Brunch Theater]: Domino Kid (1957) | T123: Movie [Sunday Matinee]: The Clown (1953) | X123: Skippy | Y123: Judd for the Defense | AA123: The Big Valley | AC123: Movie [Hollywood's Best]: Many Rivers to Cross (1954) | AG123: The Don Stellges Report | AH123: Movie [Sunday Showtime]: Screaming Mimi (1958) | AL123: World of Sport; [11:05] Movie [Movie 12]: The Goddess (1958) | AX123: =A123 -> 25607
A124: =A123+7 -> 25614 | F124: [7:15] News Review-- Don Stellges | G124: Revival Fires | H124: Kathryn Kuhlman | I124: Cathedral of Tomorrow | K124: Oral Roberts | L124: Day of Discovery | M124: It is Written | N124: The Power of Your Attitudes | O124: TV Show of Homes | P124: Movie [Brunch Theater]: Apache Rifles (1965) | T124: Movie [Sunday Matinee]: McHale's Navy (1964) | X124: Skippy | Y124: Judd for the Defense | AA124: The Big Valley | AC124: Movie [Hollywood's Best]: Father Goose (1964) | AG124: [8:50] The Don Stellges Report | AH124: Movie [Sunday Showtime]: Teahouse of the August Moon (1956) | AL124: [11:25] World of Sport; [11:30] Movie [Movie 12]: Tip on a Dead Jockey (1957) | AX124: =A124 -> 25614
A125: =A124+7 -> 25621 | F125: [7:15] News Review-- Don Stellges | G125: Revival Fires | H125: Kathryn Kuhlman | I125: Cathedral of Tomorrow | K125: Oral Roberts | L125: Day of Discovery | M125: It is Written | N125: The Power of Your Attitudes | O125: TV Show of Homes | P125: Movie [Brunch Theater]: Taggart (1965) | T125: Movie [Sunday Matinee]: McHale's Navy Joins the Air Force (1965) | X125: Skippy | Y125: Judd for the Defense | AA125: The Big Valley | AC125: Movie [Hollywood's Best]: Send Me No Flowers (1964) | AG125: [8:50] The Don Stellges Report | AH125: Movie [Sunday Showtime]: Sunday in New York (1963) | AL125: World of Sport; [11:05] Movie [Movie 12]: The Sound and the Fury (1959) | AX125: =A125 -> 25621
A126: =A125+7 -> 25628
A127: =A126+7 -> 25635 | F127: [7:15] News Review-- Don Stellges | G127: Revival Fires | H127: Kathryn Kuhlman | I127: Cathedral of Tomorrow | K127: Oral Roberts | L127: Day of Discovery | M127: It is Written | N127: The Power of Your Attitudes | O127: TV Show of Homes | P127: College Skiing: NCAA Skiing Championships from Franconia, New Hampshire | T127: Movie [Sunday Matinee]: Thunder in the Valley (1947) | X127: Skippy | Y127: Judd for the Defense | AA127: The Big Valley | AC127: Movie [Hollywood's Best]: The Birds (1963) | AG127: [8:35] The Don Stellges Report | AH127: Movie [Sunday Showtime]: Teresa (1951) | AL127: [11:05] Movie [Movie 12]: The Borgia Stick (1967) | AX127: =A127 -> 25635
A128: =A127+7 -> 25642 | F128: [7:15] News Review-- Don Stellges | G128: Revival Fires | H128: Kathryn Kuhlman | I128: Cathedral of Tomorrow | K128: Oral Roberts | L128: Day of Discovery | M128: It is Written | N128: The Power of Your Attitudes | O128: TV Show of Homes | P128: Movie [Brunch Theater]: The Left Handed Gun (1958) | T128: Movie [Sunday Matinee]: The 30-Foot Bride of Candy Rock (1959); [3:45] Film--Medicine | X128: Skippy | Y128: Judd for the Defense | AA128: The Big Valley | AC128: Movie [Hollywood's Best]: The Mating Game (1958) | AG128: The Don Stellges Report | AH128: The David Frost Show | AK128: Faces and Places | AL128: Movie [Movie 12]: Young Bees (1953) | AX128: =A128 -> 25642
A129: =A128+7 -> 25649 | F129: [7:15] News Review-- Don Stellges | G129: Revival Fires | H129: Kathryn Kuhlman | I129: Cathedral of Tomorrow | K129: Oral Roberts | L129: Day of Discovery | M129: It is Written | N129: The Power of Your Attitudes | O129: TV Show of Homes | P129: Movie [Brunch Theater]: The Raiders (1963) | T129: Movie [Sunday Matinee]: Harem Girl (1952); [3:45] Film--Medicine | X129: Skippy | Y129: Judd for the Defense | AA129: The Big Valley | AC129: Movie [Hollywood's Best]: The McConnell Story (1955) | AG129: [8:40] The Don Stellges Report | AH129: Movie [Sunday Showtime]: The Hasty Heart (1950) | AL129: Movie [Movie 12]: Sincerely Yours (1955) | AX129: =A129 -> 25649
A130: =A129+7 -> 25656 | F130: [7:15] News Review-- Don Stellges | G130: Revival Fires | H130: Kathryn Kuhlman | I130: Cathedral of Tomorrow | K130: Oral Roberts | L130: Day of Discovery | M130: It is Written | N130: The Power of Your Attitudes | O130: TV Show of Homes | P130: Movie [Brunch Theater]: Comanche Station (no date) | T130: Movie [Sunday Matinee]: Smoky (1946) | X130: Skippy | Y130: Judd for the Defense | AA130: The Big Valley | AC130: Movie [Hollywood's Best]: King of Kings (1961) | AI130: Movie [Sunday Showtime]: The Girl Who Had Everything (1953) | AL130: Movie [Movie 12]: Blood and Sand (1941) | AX130: =A130 -> 25656
A131: =A130+7 -> 25663
A132: =A131+7 -> 25670 | F132: [7:15] News Review-- Don Stellges | G132: Revival Fires | H132: Kathryn Kuhlman | I132: Cathedral of Tomorrow | K132: Oral Roberts | L132: Day of Discovery | M132: It is Written | N132: The Power of Your Attitudes | O132: TV Show of Homes | P132: Track and Field Meet: Oregon State Beavers vs Stanford Indians at Corvallis, Oregon (taped replay) | R132: 12 O'Clock High | T132: Movie [Sunday Matinee]: The Man Who Never Was (1956) | X132: Skippy | Y132: Judd for the Defense | AA132: The Big Valley | AC132: Movie [Hollywood's Best]: Something of Value (1957) | AG132: [8:50] The Don Stellges Report | AH132: Movie [Sunday Showtime]: Strictly Dishonorable (1951) | AL132: Movie [Movie 12]: Onionhead (1958) | AX132: =A132 -> 25670
A133: =A132+7 -> 25677 | F133: [7:15] News Review-- Don Stellges | G133: Revival Fires | H133: Kathryn Kuhlman | I133: Cathedral of Tomorrow | K133: Oral Roberts | L133: Day of Discovery | M133: It is Written | N133: The Power of Your Attitudes | O133: TV Show of Homes | P133: Track and Field Meet: Oregon State Beavers vs Washington Huskies, Oregon (taped replay) | R133: 12 O'Clock High | T133: Movie [Sunday Matinee]: On the Threshold of Space (1956) | X133: Skippy | Y133: Judd for the Defense | AA133: The Big Valley | AC133: Movie [Hollywood's Best]: Father of the Bride (1950) | AG133: The Don Stellges Report | AH133: Movie [Sunday Showtime]: Father's Little Dividend (1951) | AL133: Movie [Movie 12]: So This Is Love (1953) | AX133: =A133 -> 25677
A134: =A133+7 -> 25684
A135: =A134+7 -> 25691 | F135: [7:15] News Review-- Don Stellges | G135: Revival Fires | H135: Kathryn Kuhlman | I135: Cathedral of Tomorrow | K135: Oral Roberts | L135: Day of Discovery | M135: It is Written | N135: The Power of Your Attitudes | O135: TV Show of Homes | P135: Movie [Brunch Theater]: Gun Glory (1957) | T135: Movie [Sunday Matinee]: Half a Hero (1953) | X135: Skippy | Y135: Judd for the Defense | AA135: The Big Valley | AC135: Movie [Hollywood's Best]: A Man Could Get Killed (1966) | AG135: [8:45] The Don Stellges Report | AH135: Movie [Sunday Showtime]: Jailhouse Rock (1967) | AL135: Movie [Movie 12]: A Star is Born (1955) | AX135: =A135 -> 25691
A136: =A135+7 -> 25698 | F136: [7:15] News Review-- Don Stellges | G136: Revival Fires | H136: Kathryn Kuhlman | I136: Cathedral of Tomorrow | K136: Oral Roberts | L136: Day of Discovery | M136: It is Written | N136: The Power of Your Attitudes | O136: TV Show of Homes | P136: Movie [Brunch Theater]: He Rides Tall (1964) | T136: College Football: Oregon State University vs football intra-squad competition from Corvallis, OR (Film) | W136: Golf | X136: Skippy | Y136: Judd for the Defense | AA136: The Big Valley | AC136: Movie [Hollywood's Best]: Blindfold (1966) | AG136: [8:45] The Don Stellges Report | AH136: David Frost: Tribute to George Devine | AJ136: Eugene O'Neil -- Profile (Special) | AL136: Movie [Movie 12]: The Egg and I (1947) | AX136: =A136 -> 25698
A137: =A136+7 -> 25705
A138: =A137+7 -> 25712 | F138: [7:15] News Review-- Don Stellges | G138: Revival Fires | H138: I Believe in Miracles | I138: Cathedral of Tomorrow | K138: Oral Roberts | L138: Day of Discovery | M138: It is Written | N138: The Power of Your Attitudes | O138: TV Show of Homes | P138: Movie [Brunch Theater]: Showdown (1963) | T138: Movie [Sunday Matinee]: The Great Diamond Robbery (1953) | X138: Skippy | Y138: Judd for the Defense | AA138: The Big Valley | AC138: Movie [Hollywood's Best]: Bell, Book and Candle (1958) | AG138: [8:40] The Don Stellges Report | AH138: David Frost Presents: Noel Coward | AJ138: The Epic That Never Was | AL138: Movie [Movie 12]: Ivy (1947) | AX138: =A138 -> 25712
A139: =A138+7 -> 25719 | F139: [7:15] News Review-- Don Stellges | G139: Revival Fires | H139: I Believe in Miracles | I139: Cathedral of Tomorrow | K139: Oral Roberts | L139: Day of Discovery | M139: It is Written | N139: The Power of Your Attitudes | O139: TV Show of Homes | P139: Movie [Brunch Theater]: Shaggy (1948) | S139: Daring Ventures | T139: Movie [Sunday Matinee]: Excuse My Dust (1951) | W139: Film-- Insurance; [3:45] Film-- Investment | X139: Skippy | Y139: Hawaii Calls | Z139: Faces and Places | AA139: The Big Valley | AC139: Movie [Hollywood's Best]: For Love or Money (1963) | AG139: [8:45] The Don Stellges Report | AH139: Movie [Sunday Showtime]: Destry Rides Again (1939) | AL139: Movie [Movie 12]: Key Witness (1960) | AX139: =A139 -> 25719
A140: =A139+7 -> 25726 | F140: [7:15] News Review-- Don Stellges | G140: Revival Fires | H140: I Believe in Miracles | I140: Cathedral of Tomorrow | K140: Oral Roberts | L140: Day of Discovery | M140: Adventure Calls | N140: The Power of Your Attitudes | O140: TV Show of Homes | P140: Movie [Brunch Theater]: Ghost of the China Sea (1958) | T140: Movie [Sunday Matinee]: Mr. Belvedere Goes to College (1949) | X140: Skippy | Y140: Hawaii Calls | Z140: Faces and Places | AA140: The Big Valley | AC140: Movie [Hollywood's Best]: Cockleshell Heroes (1955) | AG140: [8:30] The Don Stellges Report | AH140: Movie [Sunday Showtime]: Just This Once (1952) | AL140: Movie [Movie 12]: Caged Fury (1948) | AX140: =A140 -> 25726
A141: =A140+7 -> 25733 | F141: [7:15] News Review-- Don Stellges | G141: Revival Fires | H141: I Believe in Miracles | I141: Cathedral of Tomorrow | K141: Oral Roberts | L141: Day of Discovery | M141: Adventure Calls | N141: The Power of Your Attitudes | O141: TV Show of Homes | P141: Movie [Brunch Theater]: Tornado (1943); [1:45] Film-- Investment | T141: Movie [Sunday Matinee]: The Burning Hills (1956) | X141: Skippy | Y141: Youth Circus (Live) | AA141: The Big Valley | AC141: Movie [Hollywood's Best]: Athena (1954) | AG141: [8:35] The Don Stellges Report | AH141: Movie [Sunday Showtime]: The Garment Jungle (1957) | AL141: Movie [Movie 12]: You Gotta Stay Happy (1948) | AX141: =A141 -> 25733
A142: =A141+7 -> 25740 | F142: [7:15] News Review-- Don Stellges | G142: Revival Fires | H142: I Believe in Miracles | I142: Cathedral of Tomorrow | K142: Oral Roberts | L142: Day of Discovery | M142: Adventure Calls | N142: The Power of Your Attitudes | O142: TV Show of Homes | P142: Movie [Brunch Theater]: The King's Musketeers (Italian-English; 1960); [1:45] Film-- Medicine | T142: Movie [Sunday Matinee]: The Winning Team (1952) | X142: Skippy | Y142: Hawaii Calls | Z142: Faces and Places | AA142: The Big Valley | AC142: Movie [Hollywood's Best]: If a Man Answers (1962) | AG142: [8:40] The Don Stellges Report | AH142: Movie [Sunday Showtime]: I'll See You in My Dreams (1952) | AL142: Movie [Movie 12]: East of Eden (1955) | AX142: =A142 -> 25740
A143: =A142+7 -> 25747 | F143: [7:15] News Review-- Don Stellges | G143: Revival Fires | H143: I Believe in Miracles | I143: Rex Humbard | K143: Oral Roberts | L143: Day of Discovery | M143: Adventure Calls | N143: The Power of Your Attitudes | O143: High and Wild | P143: Movie [Brunch Theater]: Glory Alley (1952) | T143: Movie [Sunday Matinee]: Sherlock Holmes in Washington (1942) | W143: Faces and Places | X143: Skippy | Y143: Passport to Travel | Z143: Rex Humbard | AA143: The Big Valley | AC143: Movie [Hollywood's Best]: Song Without End (1960) | AH143: Movie [Sunday Showtime]: Auntie Mame (1958) | AN143: Movie [Movie 12]: Home Before Dark (1958) | AX143: =A143 -> 25747
A144: =A143+7 -> 25754 | F144: [7:15] News Review-- Don Stellges | G144: Revival Fires | H144: I Believe in Miracles | I144: Rex Humbard | K144: Oral Roberts | L144: Day of Discovery | M144: Adventure Calls | N144: The Power of Your Attitudes | O144: High and Wild | P144: Movie [Brunch Theater]: The Left Handed Gun (1958) | T144: Movie [Sunday Matinee]: Abbott and Costello Meet Frankenstein (1949) | X144: Skippy | Y144: Hawaii Calls | Z144: Faces and Places | AA144: The Big Valley | AC144: Movie [Hollywood's Best]: Three Little Words (1950) | AG144: Patriotic Music-- First Assembly of God Church of Portland, Oregon (Special) | AH144: Movie [Sunday Showtime]: Man in the Dark (English; 1964) | AL144: Movie [Movie 12]: Dracula (1931) | AX144: =A144 -> 25754
A146: 1971 | AX146: =A146 -> 1971
A147: 25943 | F147: [7:15] News Review-- Don Stellges | G147: Revival Fires | H147: I Believe in Miracles | I147: Rex Humbard | K147: Oral Roberts | L147: Day of Discovery | M147: It is Written | N147: A New Way to Live | O147: Faces and Places | P147: College Basketball: Notre Dame Fighting Irish vs. Air Force Academy Falcons [LIVE] | T147: Movie: Edge of Eternity (1959) | W147: [3:45] Film | X147: Hawaii Calls | Y147: David Niven | AA147: Here Come the Brides | AC147: Movie: Million Dollar Mermaid (1952) | AH147: Columbia Crossroads | AJ147: The 10 O'Clock News | AK147: High and Wild | AL147: Movie: Queen Bee (1955) | AX147: =A147 -> 25943
A149: 1972 | AX149: =A149 -> 1972
A152: 1973 | AX152: =A152 -> 1973
A155: 1974 | AX155: =A155 -> 1974
A157: 27392 | E157: [6:45] News | F157: Old-Time Gospel Hour (Jerry Falwell) | H157: I Believe in Miracles | I157: Rex Humbard | K157: Oral Roberts | L157: Day of Discovery | M157: It is Written | N157: New Way to Live | O157: Good News | P157: The Virginian | S157: Movie [Sunday Matinee]: Gidget Goes Hawaiian (1961) | W157: Movie: Phantom of the Opera (1943) | AA157: Movie [Hollywood's Best]: The Jayhawkers (1959) | AE157: The FBI | AG157: This is Music | AH157: Columbia Crossroads | AJ157: Sunday News Review | AK157: The Virginian | AN157: Jimmy Swaggart | AX157: =A157 -> 27392
A158: 1975 | AX158: 1975
A159: 27399 | E159: [6:45] News | F159: Old-Time Gospel Hour (Jerry Falwell) | H159: I Believe in Miracles | I159: Rex Humbard | K159: Oral Roberts | L159: Day of Discovery | M159: It is Written | N159: New Way to Live | O159: Good News | P159: Movie [Brunch Theater]: Untamed Frontier (1952) | S159: American Bowl | Y159: Travelin' | AA159: Movie [Hollywood's Best]: I Love a Mystery (1966) | AE159: The FBI | AG159: Columbia Crossroads | AJ159: Sunday News Review | AK159: The Virginian | AN159: Jimmy Swaggart | AX159: =A159 -> 27399
A160: =A159+7 -> 27406 | E160: [6:45] News | F160: Old-Time Gospel Hour (Jerry Falwell) | H160: I Believe in Miracles | I160: Rex Humbard | K160: Oral Roberts | L160: Day of Discovery | M160: It is Written | N160: New Way to Live | O160: Good News | P160: Movie [Brunch Theater]: The Ride Back (1957) | S160: Movie [Sunday Matinee]: The Old Dark Horse (1963); [3:15] Changing Times | W160: It Takes a Thief | Y160: Mission: Impossible | AA160: Movie [Hollywood's Best]: Thunder Bay (1953) | AE160: A Year of Laurels | AG160: Movie: King A filmed Record Montgomery to Memphis (1970) | AK160: Civil Rights Update | AL160: The Virginian | AO160: Jimmy Swaggart | AX160: =A160 -> 27406
A161: =A160+7 -> 27413 | E161: [6:45] News | F161: Old-Time Gospel Hour (Jerry Falwell) | H161: I Believe in Miracles | I161: Rex Humbard | K161: Oral Roberts | L161: Day of Discovery | M161: It is Written | N161: New Way to Live | O161: Good News | P161: Movie [Brunch Theater]: A Day of Fury (1956) | S161: Movie [Sunday Matinee]: That Funny Feeling (1965); [3:15] Changing Times | W161: It Takes a Thief | Y161: Mission: Impossible | AA161: Movie [Hollywood's Best]: Voice in the Mirror (1958) | AE161: The FBI | AG161: World of Survival | AH161: Columbia Crossroads | AJ161: Sunday News Review | AK161: The Virginian | AN161: Jimmy Swaggart | AX161: =A161 -> 27413
A162: =A161+7 -> 27420 | E162: [6:45] News | F162: Old-Time Gospel Hour (Jerry Falwell) | H162: I Believe in Miracles | I162: Rex Humbard | K162: Oral Roberts | L162: Day of Discovery | M162: It is Written | N162: New Way to Live | O162: Good News | P162: Movie [Brunch Theater]: When the Daltons Rode (1940) | S162: Movie [Sunday Matinee]: And Then There Were None (1945) | W162: It Takes a Thief | Y162: Mission: Impossible | AA162: Movie [Hollywood's Best]: Pal Joey (1957) | AE162: The FBI | AG162: World of Survival | AH162: Columbia Crossroads | AJ162: Sunday News Review | AK162: The Virginian | AN162: Jimmy Swaggart | AX162: =A162 -> 27420
A163: =A162+7 -> 27427 | E163: [6:45] News | F163: Old-Time Gospel Hour (Jerry Falwell) | H163: I Believe in Miracles | I163: Rex Humbard | K163: Oral Roberts | L163: Day of Discovery | M163: It is Written | N163: New Way to Live | O163: Good News | P163: Movie [Brunch Theater]: Tumbleweeds (1953) | S163: Movie [Sunday Matinee]: Magic Carpet (1972) | W163: It Takes a Thief | Y163: Mission: Impossible | AA163: Movie [Hollywood's Best]: Mister Cory (1957) | AE163: Golden Globe Awards | AH163: Change Within the Unchanging | AI163: Columbia Crossroads | AJ163: Sunday News Review | AK163: The Virginian | AN163: Jimmy Swaggart | AX163: =A163 -> 27427
A164: =A163+7 -> 27434 | E164: [6:45] News | F164: Old-Time Gospel Hour (Jerry Falwell) | H164: I Believe in Miracles | I164: Rex Humbard | K164: Oral Roberts | L164: Day of Discovery | M164: It is Written | N164: New Way to Live | O164: Good News | P164: Movie [Brunch Theater]: Stage to Thunder Rock (1964) | S164: Movie [Sunday Matinee]: My Little Chickadee (1940) | W164: It Takes a Thief | Y164: Mission: Impossible | AA164: Movie [Hollywood's Best]: Escape to Mindanao (1968) | AE164: The FBI | AG164: World of Survival | AH164: Columbia Crossroads | AJ164: Sunday News Review | AK164: The Virginian | AN164: Jimmy Swaggart | AX164: =A164 -> 27434
A165: =A164+7 -> 27441 | E165: [6:45] News | F165: Old-Time Gospel Hour (Jerry Falwell) | H165: I Believe in Miracles | I165: Rex Humbard | K165: Oral Roberts | L165: Day of Discovery | M165: It is Written | N165: New Way to Live | O165: Good News | P165: Movie [Brunch Theater]: Kathy O' (1958) | T165: Andy Williams San Diego Open | X165: Night Gallery | Y165: Mission: Impossible | AA165: Movie [Hollywood's Best]: The Sound of Anger (1968) | AE165: The FBI | AG165: World of Survival | AH165: Columbia Crossroads | AJ165: Sunday News Review | AK165: The Virginian | AN165: Jimmy Swaggart | AX165: =A165 -> 27441
A166: =A165+7 -> 27448 | E166: [6:45] News | F166: Old-Time Gospel Hour (Jerry Falwell) | H166: I Believe in Miracles | I166: Rex Humbard | K166: Oral Roberts | L166: Day of Discovery | M166: It is Written | N166: New Way to Live | O166: Good News | P166: Movie [Brunch Theater]: The Tall T (1957) | S166: Movie [Sunday Matinee]: The Private War of Major Benson (1955) | W166: It Takes a Thief | Y166: Mission: Impossible | AA166: Movie [Hollywood's Best]: This Happy Feeing (1958) | AE166: The FBI | AG166: World of Survival | AH166: Columbia Crossroads | AJ166: Sunday News Review | AK166: The Virginian | AN166: Jimmy Swaggart | AX166: =A166 -> 27448
A167: =A166+7 -> 27455 | E167: [6:45] News | F167: Old-Time Gospel Hour (Jerry Falwell) | H167: I Believe in Miracles | I167: Rex Humbard | K167: Oral Roberts | L167: Day of Discovery | M167: It is Written | N167: New Way to Live | O167: Good News | P167: Movie [Brunch Theater]: Drums Across the River (1954) | S167: Movie [Sunday Matinee]: The Ghost and Mr. Chicken (1965) | W167: It Takes a Thief | Y167: Mission: Impossible | AA167: Movie [Hollywood's Best]: Rhubarb (1951) | AE167: The FBI | AG167: World of Survival | AH167: Columbia Crossroads | AJ167: Sunday News Review | AK167: The Virginian | AN167: Jimmy Swaggart | AX167: =A167 -> 27455
A168: =A167+7 -> 27462 | E168: [6:45] News | F168: Old-Time Gospel Hour (Jerry Falwell) | H168: I Believe in Miracles | I168: Rex Humbard | K168: Oral Roberts | L168: Day of Discovery | M168: It is Written | N168: New Way to Live | O168: Good News | P168: Movie [Brunch Theater]: Law and Order (1953) | S168: Movie [Sunday Matinee]: It Happened to Jane (1955) | W168: It Takes a Thief | Y168: Mission: Impossible | AA168: Movie [Hollywood's Best]: The Impatient Heart (1971) | AE168: The FBI | AG168: World of Survival | AH168: Billy Graham Crusade | AJ168: Sunday News Review | AK168: The Virginian | AN168: Jimmy Swaggart | AX168: =A168 -> 27462
A169: =A168+7 -> 27469 | E169: [6:45] News | F169: Old-Time Gospel Hour (Jerry Falwell) | H169: I Believe in Miracles | I169: Rex Humbard | K169: Oral Roberts | L169: Day of Discovery | M169: It is Written | N169: New Way to Live | O169: Good News | P169: Movie [Brunch Theater]: Raw Edge (1956) | S169: Movie [Sunday Matinee]: A Hard Day's Night (1964) | W169: It Takes a Thief | Y169: Mission: Impossible | AA169: Movie [Hollywood's Best]: Unfinished Woman (1941) | AE169: The FBI | AG169: World of Survival | AH169: Columbia Crossroads | AJ169: Sunday News Review | AK169: The Virginian | AN169: Jimmy Swaggart | AX169: =A169 -> 27469
A170: =A169+7 -> 27476 | B170: Easter Seal Telethon--Continues | H170: Easter Seal Telethon--Continues | P170: Easter Seal Telethon--Continues | X170: Secrets of the Deep | Y170: Mission: Impossible | AA170: Movie [Hollywood's Best]: The Aquarians (1970) | AE170: The FBI | AG170: Good News | AH170: Oral Roberts | AI170: It is Written | AJ170: I Believe in Miracles | AK170: Rex Humbard | AM170: Jimmy Swaggart | AX170: =A170 -> 27476
A171: =A170+7 -> 27483 | E171: [6:45] News | F171: Old-Time Gospel Hour (Jerry Falwell) | H171: I Believe in Miracles | I171: Rex Humbard | K171: Oral Roberts | L171: Day of Discovery | M171: It is Written | N171: New Way to Live | O171: Good News | P171: Movie [Brunch Theater]: Apache Drums (1951) | S171: Movie [Sunday Matinee]: Step Down to Terror (1959) | V171: NBA Basketball: Portland Trail Blazers vs Seattle SuperSonics | Z171: I Dream of Jeannie | AA171: Movie [Hollywood's Best]: But Not for Me (1959) | AE171: The FBI | AG171: World of Survival | AH171: Spring Event '75 with Oral Roberts | AJ171: Sunday News Review | AK171: The Virginian | AN171: Jimmy Swaggart | AX171: =A171 -> 27483
A172: =A171+7 -> 27490 | E172: [6:45] News | F172: Old-Time Gospel Hour (Jerry Falwell) | H172: I Believe in Miracles | I172: Rex Humbard | K172: Oral Roberts | L172: Day of Discovery | M172: It is Written | N172: New Way to Live | O172: Good News | P172: Movie [Brunch Theater]: The Duel at Silver Creek (1952) | S172: Movie [Sunday Matinee]: Frankie and Johnny (1966) | W172: It Takes a Thief | Y172: Mission: Impossible | AA172: Movie [Hollywood's Best]: Asylum for a Spy (1967) | AE172: The FBI | AG172: World of Survival | AH172: Columbia Crossroads | AJ172: Sunday News Review | AK172: The Virginian | AN172: Jimmy Swaggart | AX172: =A172 -> 27490
A173: =A172+7 -> 27497 | E173: [6:45] News | F173: Old-Time Gospel Hour (Jerry Falwell) | H173: I Believe in Miracles | I173: Rex Humbard | K173: Oral Roberts | L173: Day of Discovery | M173: It is Written | N173: New Way to Live | O173: Good News | P173: Movie [Brunch Theater]: The Saga of Hemp Brown (1958) | S173: Movie [Sunday Matinee]: Family Honeymoon (1948) | W173: It Takes a Thief | Y173: Mission: Impossible | AA173: Movie [Hollywood's Best]: Detour to Nowhere (1972) | AE173: The FBI | AG173: World of Survival | AH173: Columbia Crossroads | AJ173: Sunday News Review | AK173: The Virginian | AN173: Jimmy Swaggart | AX173: =A173 -> 27497
A174: =A173+7 -> 27504 | E174: [6:45] News | F174: Old-Time Gospel Hour (Jerry Falwell) | H174: I Believe in Miracles | I174: Rex Humbard | K174: Oral Roberts | L174: Day of Discovery | M174: It is Written | N174: New Way to Live | O174: Good News | P174: Movie [Brunch Theater]: Back to God's Country (1953) | S174: Movie [Sunday Matinee]: The Three Stooges in Orbit (1962) | W174: It Takes a Thief | Y174: Mission: Impossible | AA174: Movie [Hollywood's Best]: Hell Below Zero (1954) | AE174: The FBI | AG174: World of Survival | AH174: Columbia Crossroads | AJ174: Sunday News Review | AK174: The Virginian | AN174: Jimmy Swaggart | AX174: =A174 -> 27504
A175: =A174+7 -> 27511 | E175: [6:45] News | F175: Old-Time Gospel Hour (Jerry Falwell) | H175: I Believe in Miracles | I175: Rex Humbard | K175: Oral Roberts | L175: Day of Discovery | M175: It is Written | N175: New Way to Live | O175: Good News | P175: Movie [Brunch Theater]: Comanche Territory (1950) | S175: Movie [Sunday Matinee]: The Milkman (1950) | W175: It Takes a Thief | Y175: Mission: Impossible | AA175: Movie [Hollywood's Best]: The Tall Men (1951) | AE175: The FBI | AG175: World of Survival | AH175: Columbia Crossroads | AJ175: Sunday News Review | AK175: The Virginian | AN175: Jimmy Swaggart | AX175: =A175 -> 27511
A176: =A175+7 -> 27518 | E176: [6:45] News | F176: Old-Time Gospel Hour (Jerry Falwell) | H176: I Believe in Miracles | I176: Rex Humbard | K176: Oral Roberts | L176: Day of Discovery | M176: It is Written | N176: New Way to Live | O176: Good News | P176: Movie [Brunch Theater]: Money, Women and Guns (1958) | S176: Movie [Sunday Matinee]: Casanova's Big Night (1954) | W176: It Takes a Thief | Y176: Mission: Impossible | AA176: Movie [Hollywood's Best]: A Prize of Gold (1955) | AE176: The FBI | AG176: World of Survival | AH176: Columbia Crossroads | AJ176: Sunday News Review | AK176: The Virginian | AN176: Jimmy Swaggart | AX176: =A176 -> 27518
A177: =A176+7 -> 27525 | E177: [6:45] News | F177: Old-Time Gospel Hour (Jerry Falwell) | H177: I Believe in Miracles | I177: Rex Humbard | K177: Oral Roberts | L177: Day of Discovery | M177: It is Written | N177: New Way to Live | O177: Good News | P177: Movie [Brunch Theater]: Day of the Badman (1958) | S177: Movie [Sunday Matinee]: The Big Mouth (1967) | W177: It Takes a Thief | Y177: Mission: Impossible | AA177: Movie [Hollywood's Best]: Cockleshell Heroes (1955) | AE177: The FBI | AG177: World of Survival | AH177: Columbia Crossroads | AJ177: Sunday News Review | AK177: The Virginian | AN177: Jimmy Swaggart | AX177: =A177 -> 27525
A178: =A177+7 -> 27532 | E178: [6:45] News | F178: Old-Time Gospel Hour (Jerry Falwell) | H178: I Believe in Miracles | I178: Rex Humbard | K178: Oral Roberts | L178: Day of Discovery | M178: It is Written | N178: New Way to Live | O178: Good News | P178: Movie [Brunch Theater]: Dawn at Socorro (1954) | S178: Movie [Sunday Matinee]: The Geisha Boy (1958) | W178: It Takes a Thief | Y178: Mission: Impossible | AA178: Movie [Hollywood's Best]: Abandon Ship (1957) | AE178: The FBI | AG178: World of Survival | AH178: Columbia Crossroads | AJ178: Sunday News Review | AK178: The Virginian | AN178: Jimmy Swaggart | AX178: =A178 -> 27532
A179: =A178+7 -> 27539 | E179: [6:45] News | F179: Old-Time Gospel Hour (Jerry Falwell) | H179: I Believe in Miracles | I179: Rex Humbard | K179: Oral Roberts | L179: Day of Discovery | M179: It is Written | N179: New Way to Live | O179: Good News | P179: Movie [Brunch Theater]: The Great Sioux Uprising (1953) | S179: Movie [Sunday Matinee]: Tammy and the Bachelor (1957) | W179: It Takes a Thief | Y179: Mission: Impossible | AA179: Movie [Hollywood's Best]: The Savage (1953) | AE179: Take Me Home Again | AG179: World of Survival | AH179: Columbia Crossroads | AJ179: Sunday News Review--Sylvia Stinson | AK179: The Virginian | AN179: Jimmy Swaggart | AX179: =A179 -> 27539
A180: =A179+7 -> 27546 | E180: [6:45] News | F180: Old-Time Gospel Hour (Jerry Falwell) | H180: I Believe in Miracles | I180: Rex Humbard | K180: Oral Roberts | L180: Day of Discovery | M180: It is Written | N180: New Way to Live | O180: Good News | P180: Movie [Brunch Theater]: The Glass Web (1953) | S180: Movie [Sunday Matinee]: Off Limits (1953) | W180: It Takes a Thief | Y180: Mission: Impossible | AA180: Movie [Hollywood's Best]: The Challengers (1970) | AE180: The FBI | AG180: World of Survival | AH180: Columbia Crossroads | AJ180: Sunday News Review--Sylvia Stinson | AK180: The Virginian | AN180: Jimmy Swaggart | AX180: =A180 -> 27546
A181: =A180+7 -> 27553 | E181: [6:45] News | F181: Old-Time Gospel Hour (Jerry Falwell) | H181: I Believe in Miracles | I181: Rex Humbard | K181: Oral Roberts | L181: Day of Discovery | M181: It is Written | N181: New Way to Live | O181: Good News | P181: Movie [Brunch Theater]: The Suspect (1944) | S181: Movie [Sunday Matinee]: Gidget Goes Hawaiian (1961) | W181: It Takes a Thief | Y181: Mission: Impossible | AA181: Movie [Hollywood's Best]: A Howling in the Woods (1971) | AE181: The FBI | AG181: World of Survival | AH181: Columbia Crossroads | AJ181: Sunday News Review--Sylvia Stinson | AK181: The Virginian | AN181: Jimmy Swaggart | AX181: =A181 -> 27553
A182: =A181+7 -> 27560 | E182: [6:45] News | F182: Old-Time Gospel Hour (Jerry Falwell) | H182: I Believe in Miracles | I182: Rex Humbard | K182: Oral Roberts | L182: Day of Discovery | M182: It is Written | N182: New Way to Live | O182: Good News | P182: Movie [Brunch Theater]: The Incredible Shrinking Man (1957) | S182: Movie [Sunday Matinee]: Sally and Saint Anne (1952) | W182: It Takes a Thief | Y182: Mission: Impossible | AA182: Movie [Hollywood's Best]: A Clear and Present Danger (1970) | AE182: The FBI | AG182: World of Survival | AH182: Columbia Crossroads | AJ182: Sunday News Review--Sylvia Stinson | AK182: The Virginian | AN182: Jimmy Swaggart | AX182: =A182 -> 27560
A183: =A182+7 -> 27567 | E183: [6:45] News | F183: Old-Time Gospel Hour (Jerry Falwell) | H183: I Believe in Miracles | I183: Rex Humbard | K183: Oral Roberts | L183: Day of Discovery | M183: It is Written | N183: New Way to Live | O183: Good News | P183: Movie [Brunch Theater]: Phantom Lady (1944) | S183: Movie [Sunday Matinee]: Tammy and the Doctor (1963) | W183: It Takes a Thief | Y183: Mission: Impossible | AA183: Movie [Hollywood's Best]: Marriage: Year One (1971) | AE183: The FBI | AG183: World of Survival | AH183: Columbia Crossroads | AJ183: News Review--Sylvia Stinson | AK183: The Virginian | AN183: Jimmy Swaggart | AX183: =A183 -> 27567
A184: =A183+7 -> 27574 | E184: [6:45] News | F184: Old-Time Gospel Hour (Jerry Falwell) | H184: I Believe in Miracles | I184: Rex Humbard | K184: Oral Roberts | L184: Day of Discovery | M184: It is Written | N184: New Way to Live | O184: Good News | P184: Movie [Brunch Theater]: Black Angel (1946) | S184: Secrets of the Deep | T184: Baseball: Bellingtham Dodgers vs Portland Mavericks | Y184: Mission: Impossible | AA184: Movie [Hollywood's Best]: The Profane Comedy (1969) | AE184: The FBI | AG184: World of Survival | AH184: Oral Roberts | AJ184: News Review--Sylvia Stinson | AK184: The Virginian | AN184: Jimmy Swaggart | AX184: =A184 -> 27574
A185: =A184+7 -> 27581 | E185: [6:45] News | F185: Old-Time Gospel Hour (Jerry Falwell) | H185: I Believe in Miracles | I185: Rex Humbard | K185: Oral Roberts | L185: Day of Discovery | M185: It is Written | N185: New Way to Live | O185: Good News | P185: Movie [Brunch Theater]: The Desert Hawk (1950) | S185: Movie [Sunday Matinee]: Tammy and the Millionaire (1967) | W185: It Takes a Thief | Y185: Mission: Impossible | AA185: Movie [Hollywood's Best]: Kathy O' (1958) | AE185: The FBI | AG185: World of Survival | AH185: Columbia Crossroads | AJ185: News Review--Sylvia Stinson | AK185: The Virginian | AN185: Jimmy Swaggart | AX185: =A185 -> 27581
A186: =A185+7 -> 27588 | E186: [6:45] News | F186: Old-Time Gospel Hour (Jerry Falwell) | H186: I Believe in Miracles | I186: Rex Humbard | K186: Oral Roberts | L186: Day of Discovery | M186: It is Written | N186: New Way to Live | O186: Good News | P186: Movie [Brunch Theater]: Scarlet Angel (1952) | S186: Movie [Sunday Matinee]: Has Anybody Seen My Gal? (1952) | W186: It Takes a Thief | Y186: Mission: Impossible | AA186: Movie [Hollywood's Best]: The Century Turns (1972) | AE186: The FBI | AG186: World of Survival | AH186: Columbia Crossroads | AJ186: News Review--Sylvia Stinson | AK186: The Virginian | AN186: Jimmy Swaggart | AX186: =A186 -> 27588
A187: =A186+7 -> 27595 | E187: [6:45] News | F187: Old-Time Gospel Hour (Jerry Falwell) | H187: I Believe in Miracles | I187: Rex Humbard | K187: Oral Roberts | L187: Day of Discovery | M187: It is Written | N187: New Way to Live | O187: Good News | P187: Movie [Brunch Theater]: Singapore (1947) | S187: Movie [Sunday Matinee]: The Buster Keaton Story (1957) | W187: It Takes a Thief | Y187: Mission: Impossible | AA187: Movie [Hollywood's Best]: Never Steal Anything Small (1959) | AE187: The FBI | AG187: World of Survival | AH187: Columbia Crossroads | AJ187: News Review--Sylvia Stinson | AK187: The Virginian | AN187: Jimmy Swaggart | AX187: =A187 -> 27595
A188: =A187+7 -> 27602 | E188: [6:45] News | F188: Old-Time Gospel Hour (Jerry Falwell) | H188: I Believe in Miracles | I188: Rex Humbard | K188: Oral Roberts | L188: Day of Discovery | M188: It is Written | N188: New Way to Live | O188: Good News | P188: Movie [Brunch Theater]: Man in the Dark (1964) | S188: Movie [Sunday Matinee]: Help! (1965) | W188: It Takes a Thief | Y188: The Kopykats | AA188: Movie [Hollywood's Best]: Hauser's Memory (1970) | AE188: The FBI | AG188: World of Survival | AH188: Columbia Crossroads | AJ188: News Review--Sylvia Stinson | AK188: The Virginian | AN188: Jimmy Swaggart | AX188: =A188 -> 27602
A189: =A188+7 -> 27609 | E189: [6:45] News | F189: Old-Time Gospel Hour (Jerry Falwell) | H189: I Believe in Miracles | I189: Rex Humbard | K189: Oral Roberts | L189: Day of Discovery | M189: It is Written | N189: New Way to Live | O189: Good News | P189: Movie [Brunch Theater]: The Wackiest Ship in the Army (1960) | T189: WFL Football: Portland Thunder vs Southern California Sun | Y189: The Kopykats | AA189: Movie [Hollywood's Best]: Conspiracy to Kill (1971) | AE189: The FBI | AG189: Movie: To Hell and Back (1955) | AK189: News Review--Sylvia Stinson | AL189: The Virginian | AO189: Jimmy Swaggart | AX189: =A189 -> 27609
A190: =A189+7 -> 27616 | E190: [6:45] News | F190: Old-Time Gospel Hour (Jerry Falwell) | H190: I Believe in Miracles | I190: Rex Humbard | K190: Oral Roberts | L190: Day of Discovery | M190: Bible Story | N190: New Way to Live | O190: Good News | P190: Movie [Brunch Theater]: Wings of Chance (1960) | S190: Movie [Sunday Matinee]: Beach Ball (1965) | W190: It Takes a Thief | Y190: The Kopykats | AA190: Movie [Hollywood's Best]: The Unguarded Moment (1956) | AE190: The FBI | AG190: World of Survival | AH190: Columbia Crossroads | AJ190: News Review--Sylvia Stinson | AK190: The Virginian | AN190: Jimmy Swaggart | AX190: =A190 -> 27616
A191: =A190+7 -> 27623 | E191: [6:45] News | F191: Old-Time Gospel Hour (Jerry Falwell) | H191: I Believe in Miracles | I191: Rex Humbard | K191: Oral Roberts | L191: Day of Discovery | M191: Bible Story | N191: New Way to Live | O191: Good News | P191: Movie [Brunch Theater]: Flood Tide (1958) | S191: Movie [Sunday Matinee]: Fluffy (1965) | W191: It Takes a Thief | Y191: The Kopykats | AA191: Movie [Hollywood's Best]: The Private War of Major Benson (1955) | AE191: The FBI | AG191: Fiesta Mexicana | AH191: Tony and Lena | AJ191: News Review--Sylvia Stinson | AK191: The Virginian | AN191: Jimmy Swaggart | AX191: =A191 -> 27623
A192: =A191+7 -> 27630 | E192: [6:45] News | F192: Old-Time Gospel Hour (Jerry Falwell) | H192: I Believe in Miracles | I192: Rex Humbard | K192: Oral Roberts | L192: Day of Discovery | M192: Bible Story | N192: New Way to Live | O192: Good News | P192: Movie [Brunch Theater]: Joe Dakota (1957) | S192: Movie [Sunday Matinee]: Up Front (1951) | W192: It Takes a Thief | Y192: The Kopykats | AA192: Movie [Hollywood's Best]: One Desire (1955) | AE192: The FBI | AG192: World of Survival | AH192: Columbia Crossroads | AJ192: News Review--Sylvia Stinson | AK192: The Virginian | AN192: Jimmy Swaggart | AX192: =A192 -> 27630
A193: =A192+7 -> 27637 | E193: [6:45] News | F193: Old-Time Gospel Hour (Jerry Falwell) | H193: I Believe in Miracles | I193: Rex Humbard | K193: Oral Roberts | L193: Day of Discovery | M193: Bible Story | N193: New Way to Live | O193: Good News | P193: Movie [Brunch Theater]: The Three Stooges Meet Hercules (1961) | S193: Movie [Sunday Matinee]: The Road to Hong Kong (1962) | W193: It Takes a Thief | Y193: The Kopykats | AA193: Movie [Hollywood's Best]: My Man Godfrey (1957) | AE193: Jerry Lewis Muscular Distrophy Telethon | AN193: Jerry Lewis Muscular Distrophy Telethon Continues | AV193: Jerry Lewis Muscular Distrophy Telethon Continues | AX193: =A193 -> 27637
A194: =A193+7 -> 27644 | E194: [6:45] News | F194: Old-Time Gospel Hour (Jerry Falwell) | H194: I Believe in Miracles | I194: Rex Humbard | K194: Oral Roberts | L194: Day of Discovery | M194: It is Written | N194: New Way to Live | O194: Good News | P194: Movie [Brunch Theater]: When the Daltons Rode (1940) | S194: Movie [Sunday Matinee]: Bengal Brigade (1954) | W194: It Takes a Thief | Y194: The Kopykats | AA194: Movie [Hollywood's Best]: Companions in Nightmare (1968) | AE194: The FBI | AG194: World of Survival | AH194: Oral Roberts in Alaska | AJ194: News Review--Sylvia Stinson | AK194: The Virginian | AN194: Jimmy Swaggart | AX194: =A194 -> 27644
A195: =A194+7 -> 27651 | E195: [6:45] News | F195: Jerry Falwell | H195: I Believe in Miracles | I195: Rex Humbard | K195: Oral Roberts | L195: Day of Discovery | M195: It is Written | N195: New Way to Live | O195: Good News | P195: Movie [Brunch Theater]: Night Passage (1957) | T195: Movie [Sunday Matinee]: Desert Legion (1953) | X195: It Takes a Thief | Z195: Movie [Hollywood's Best]: The Ipcress File (1965) | AD195: Animal World | AE195: Secrets of the Deep | AF195: World of Survival | AG195: Number 12 Northwest--Don Stellges | AH195: Columbia Crossroads | AJ195: News Review--Sylvia Stinson | AK195: Night Gallery | AL195: The Virginian | AO195: Jimmy Swaggart | AX195: =A195 -> 27651
A196: =A195+7 -> 27658 | E196: [6:45] News | F196: Jerry Falwell | H196: I Believe in Miracles | I196: Rex Humbard | K196: Oral Roberts | L196: Day of Discovery | M196: It is Written | N196: New Way to Live | O196: Good News | P196: Movie [Brunch Theater]: Town Tamer (1965) | T196: Movie [Sunday Matinee]: Ali Baba and the Forty Thieves (1944) | X196: It Takes a Thief | Z196: Movie [Hollywood's Best]: Rage (1966) | AD196: Animal World | AE196: Secrets of the Deep | AF196: World of Survival | AG196: Number 12 Northwest | AH196: Columbia Crossroads | AJ196: News Review--Sylvia Stinson | AK196: The Sixth Sense (Night Gallery) | AL196: The Virginian | AO196: Jimmy Swaggart | AX196: =A196 -> 27658
A197: =A196+7 -> 27665 | E197: [6:45] News | F197: Jerry Falwell | H197: I Believe in Miracles | I197: Rex Humbard | K197: Oral Roberts | L197: Day of Discovery | M197: It is Written | N197: New Way to Live | O197: Good News | P197: Movie [Brunch Theater]: Destry Rides Again (1939) | T197: Movie [Sunday Matinee]: Arabian Nights (1942) | X197: It Takes a Thief | Z197: Movie [Hollywood's Best]: The Sound of Anger (1968) | AD197: Animal World | AE197: Secrets of the Deep | AF197: World of Survival | AG197: Playing Games with the Unseen World | AH197: Columbia Crossroads | AJ197: News Review--Sylvia Stinson | AK197: The Sixth Sense (Night Gallery) | AL197: The Virginian | AX197: =A197 -> 27665
A198: =A197+7 -> 27672 | E198: [6:45] News | F198: Jerry Falwell | H198: I Believe in Miracles | I198: Rex Humbard | K198: Oral Roberts | L198: Day of Discovery | M198: It is Written | N198: New Way to Live | O198: Good News | P198: Movie [Brunch Theater]: Destry (1954) | T198: Movie [Sunday Matinee]: East of Sumatra (1953) | X198: It Takes a Thief | Z198: Movie [Hollywood's Best]: The Wrong Box (1966) | AD198: Animal World | AE198: Secrets of the Deep | AF198: World of Survival | AG198: Number 12 Northwest | AH198: Columbia Crossroads | AJ198: News Review--Sylvia Stinson | AK198: Night Gallery | AL198: The Virginian | AX198: =A198 -> 27672
A199: =A198+7 -> 27679 | E199: [6:45] News | F199: Jerry Falwell | H199: I Believe in Miracles | I199: Rex Humbard | K199: Oral Roberts | L199: Day of Discovery | M199: It is Written | N199: New Way to Live | O199: Good News | P199: Movie [Brunch Theater]: Walk the Proud Land (1956) | T199: Movie [Sunday Matinee]: Saskatchewan (1954) | X199: It Takes a Thief | Z199: Movie [Hollywood's Best]: Sergeant Ryker (1963) | AD199: Animal World | AE199: Secrets of the Deep | AF199: World of Survival | AG199: Number 12 Northwest | AH199: Columbia Crossroads | AJ199: News Review--Sylvia Stinson | AK199: Night Gallery | AL199: The Virginian | AX199: =A199 -> 27679
A200: =A199+7 -> 27686 | E200: [6:45] News | F200: Jerry Falwell | H200: I Believe in Miracles | I200: Rex Humbard | K200: Oral Roberts | L200: Day of Discovery | M200: It is Written | N200: New Way to Live | O200: Good News | P200: Movie [Brunch Theater]: The Lady from Cheyenne (1941) | T200: Movie [Sunday Matinee]: Rogue's Regiment (1948) | X200: It Takes a Thief | Z200: Movie [Hollywood's Best]: A Matter of Innocence (1967) | AD200: Animal World | AE200: Secrets of the Deep | AF200: World of Survival | AG200: Number 12 Northwest | AH200: Columbia Crossroads | AJ200: News Review--Sylvia Stinson | AK200: The Porter Wagoner Show | AL200: The Virginian | AX200: =A200 -> 27686
A201: =A200+7 -> 27693 | E201: [6:45] News | F201: Jerry Falwell | H201: I Believe in Miracles | I201: Rex Humbard | K201: Oral Roberts | L201: Day of Discovery | M201: It is Written | N201: New Way to Live | O201: Good News | P201: Movie [Brunch Theater]: The Fighting O'Flynn (1948) | T201: Movie [Sunday Matinee]: The Smugglers (1968) | X201: It Takes a Thief | Z201: Movie [Hollywood's Best]: A Funny Thing Happened on the Way to the Forum (1966) | AD201: Animal World | AE201: Secrets of the Deep | AF201: World of Survival | AG201: Number 12 Northwest | AH201: Columbia Crossroads | AJ201: News Review--Sylvia Stinson | AK201: Night Gallery | AL201: The Virginian | AX201: =A201 -> 27693
A202: =A201+7 -> 27700 | E202: [6:45] News | F202: Jerry Falwell | H202: I Believe in Miracles | I202: Rex Humbard | K202: Oral Roberts | L202: Day of Discovery | M202: It is Written | N202: New Way to Live | O202: Good News | P202: Movie [Brunch Theater]: Slim Carter (1957) | T202: Movie [Sunday Matinee]: The Aquarians (1970) | X202: It Takes a Thief | Z202: Movie [Hollywood's Best]: Hell and High Water (1954) | AD202: Animal World | AE202: Secrets of the Deep | AF202: World of Survival | AG202: Number 12 Northwest | AH202: Columbia Crossroads | AJ202: News Review--Sylvia Stinson | AK202: Night Gallery | AL202: The Virginian | AX202: =A202 -> 27700
A203: =A202+7 -> 27707 | E203: [6:45] News | F203: Jerry Falwell | H203: I Believe in Miracles | I203: Rex Humbard | K203: Oral Roberts | L203: Day of Discovery | M203: It is Written | N203: New Way to Live | O203: Good News | P203: Movie [Brunch Theater]: The Rawhide Years (1956) | T203: Movie [Sunday Matinee]: Frankie and Johnny (1966) | X203: It Takes a Thief | Z203: Movie [Hollywood's Best]: The Left Hand of God (1955) | AD203: Animal World | AE203: Secrets of the Deep | AF203: World of Survival | AG203: Number 12 Northwest | AH203: Columbia Crossroads | AJ203: News Review--Sylvia Stinson | AK203: Night Gallery | AL203: The Virginian | AX203: =A203 -> 27707
A204: =A203+7 -> 27714 | E204: [6:45] News | F204: Jerry Falwell | H204: I Believe in Miracles | I204: Rex Humbard | K204: Oral Roberts | L204: Day of Discovery | M204: It is Written | N204: New Way to Live | O204: Good News | P204: Movie [Brunch Theater]: Wyoming Mail (1950) | T204: Movie [Sunday Matinee]: Off Limits (1953) | X204: It Takes a Thief | Z204: Movie [Hollywood's Best]: The Racers (1955) | AD204: Animal World | AE204: Secrets of the Deep | AF204: World of Survival | AG204: Number 12 Northwest | AH204: Columbia Crossroads | AJ204: News Review--Sylvia Stinson | AK204: Night Gallery | AL204: The Virginian | AX204: =A204 -> 27714
A205: =A204+7 -> 27721 | E205: [6:45] News | F205: Jerry Falwell | H205: I Believe in Miracles | I205: Rex Humbard | K205: Oral Roberts | L205: Day of Discovery | M205: It is Written | N205: New Way to Live | O205: Good News | P205: Movie [Brunch Theater]: Backlash (1956); [1:45] Changing Times | T205: Movie [Sunday Matinee]: The Purple Mask (1955) | X205: It Takes a Thief | Z205: Movie [Hollywood's Best]: From Hell to Texas (1958) | AD205: Animal World | AE205: Secrets of the Deep | AF205: World of Survival | AG205: Number 12 Northwest | AH205: Columbia Crossroads | AJ205: News Review--Sylvia Stinson | AK205: Night Gallery | AL205: The Virginian | AX205: =A205 -> 27721
A206: =A205+7 -> 27728 | E206: [6:45] News | F206: Jerry Falwell | H206: I Believe in Miracles | I206: Rex Humbard | K206: Oral Roberts | L206: Day of Discovery | M206: It is Written | N206: New Way to Live | O206: Good News | P206: Movie [Brunch Theater]: The Night of the Grizzly (1966) | T206: Movie [Sunday Matinee]: Yankee Buccaneer (1952) | X206: It Takes a Thief | Z206: Movie [Hollywood's Best]: Robinson Crusoe on Mars (1964) | AD206: NBA Basketball: Portland Trail Blazers vs Los Angeles Lakers | AI206: News Review--Sylvia Stinson | AJ206: Good News America | AL206: The Virginian | AX206: =A206 -> 27728
A207: =A206+7 -> 27735 | E207: [6:45] News | F207: Jerry Falwell | H207: I Believe in Miracles | I207: Rex Humbard | K207: Oral Roberts | L207: Day of Discovery | M207: It is Written | N207: New Way to Live | O207: Good News | P207: Movie [Brunch Theater]: Kelly and Me (1957) | T207: Movie [Sunday Matinee]: Sierra (1950); [3:45] Changing Times | X207: It Takes a Thief | Z207: Movie [Hollywood's Best]: Captain Lightfoot (1955) | AD207: Animal World | AE207: Rock 'n' Fun Magic Show | AG207: Number 12 Northwest | AH207: Columbia Crossroads | AJ207: News Review--Sylvia Stinson | AK207: World of Survival | AL207: The Virginian | AX207: =A207 -> 27735
A208: =A207+7 -> 27742 | E208: [6:45] News | F208: Jerry Falwell | H208: I Believe in Miracles | I208: Rex Humbard | K208: Oral Roberts | L208: Day of Discovery | M208: It is Written | N208: New Way to Live | O208: Good News | P208: Movie [Brunch Theater]: My Little Chickadee (1940) | T208: Movie [Sunday Matinee]: Ride a Crooked Trail (1958) | X208: It Takes a Thief | Z208: Movie [Hollywood's Best]: Blindfold (1966) | AD208: Animal World | AE208: Audubon Wildlife Theater | AF208: World of Survival | AG208: Number 12 Northwest | AH208: Oral Roberts' Christmas is Love | AJ208: News Review--Sylvia Stinson | AK208: The Sixth Sense (Night Gallery) | AL208: The Virginian | AX208: =A208 -> 27742
A209: =A208+7 -> 27749 | E209: [6:45] News | F209: Jerry Falwell | H209: I Believe in Miracles | I209: Rex Humbard | K209: Oral Roberts | L209: Day of Discovery | M209: It is Written | N209: New Way to Live | O209: Good News | P209: Movie [Brunch Theater]: Arabian Nights (1942) | T209: Movie [Sunday Matinee]: Omar Khayyam (1957) | X209: It Takes a Thief | Z209: Movie [Hollywood's Best]: April Love (1957) | AD209: Animal World | AE209: Audubon Wildlife Theater | AF209: World of Survival | AG209: Number 12 Northwest | AH209: Columbia Crossroads | AJ209: News Review--Sylvia Stinson | AK209: Night Gallery | AL209: The Virginian | AX209: =A209 -> 27749
A210: =A209+7 -> 27756 | E210: [6:45] News | F210: Jerry Falwell | H210: I Believe in Miracles | I210: Rex Humbard | K210: Oral Roberts | L210: Day of Discovery | M210: It is Written | N210: New Way to Live | O210: Good News | P210: Movie [Brunch Theater]: Once Upon a Horse (1958) | T210: Movie [Sunday Matinee]: Siege of the Saxons (1963) | X210: It Takes a Thief | Z210: Movie [Hollywood's Best]: Operation: Cobra (1971) | AD210: Animal World | AE210: Audubon Wildlife Theater | AF210: World of Survival | AG210: Number 12 Northwest | AH210: Columbia Crossroads | AJ210: News Review--Sylvia Stinson | AK210: Golden Heritage--Golden Harvest | AL210: The Virginian | AX210: =A210 -> 27756
A211: 1976 | AX211: =A211 -> 1976
A214: 1977 | AX214: =A214 -> 1977
A217: 1978 | AX217: =A217 -> 1978
A220: 1979 | AX220: =A220 -> 1979
A223: 1980 | AX223: =A223 -> 1980
A224: 29226 | E224: [6:45] News | F224: Jerry Falwell | H224: A New Way to Live | I224: Oral Roberts | J224: Rex Humbard | L224: Day of Discovery | M224: It is Written | N224: Jimmy Swaggart | O224: Good News | P224: Movie [Brunch Theater]: Cotter (1971) | T224: Movie [Sunday Matinee]: Willie and Joe Back at the Front (1952) | X224: Star Trek | Z224: Movie [Hollywood's Best]: Romanoff and Juliet (1961) | AE224: Audubon Wildlife Theatre | AF224: In Search Of | AG224: Guinness Game | AH224: TBA | AI224: Dialogue | AJ224: Public Affairs | AK224: Indian Time | AL224: The FBI | AN224: Mission: Impossible | AX224: =A224 -> 29226
A225: 29233 | E225: [6:45] News | F225: Jerry Falwell | H225: A New Way to Live | I225: Oral Roberts | J225: Rex Humbard | L225: Day of Discovery | M225: It is Written | N225: Jimmy Swaggart | O225: Good News | P225: Movie [Brunch Theater]: Trail of the Lonesome Pine (1936) | T225: Movie [Sunday Matinee]: The Milkman (1950) | X225: Star Trek | Z225: Movie [Hollywood's Best]: Popi (1969) | AE225: Audubon Wildlife Theatre | AF225: In Search Of | AG225: Guinness Game | AH225: True Position [Special] | AJ225: Thru Human Hands [Special] | AL225: Dialogue | AM225: Public Affairs | AN225: Mission: Impossible | AX225: =A225 -> 29233
A226: 29240 | E226: [6:45] News | F226: Jerry Falwell | H226: A New Way to Live | I226: Oral Roberts | J226: Rex Humbard | L226: Day of Discovery | M226: It is Written | N226: Jimmy Swaggart | O226: Good News | P226: Movie [Brunch Theater]: The Gatling Gun (1971) | T226: Movie [Sunday Matinee]: My Favorite Spy (1951) | X226: Star Trek | Z226: Movie [Hollywood's Best]: Catch-22 (1970) | AE226: Audubon Wildlife Theatre | AF226: In Search Of | AG226: Guinness Game | AH226: Weather Report '80 [Special] | AJ226: I Care [Special] | AL226: Dialogue | AM226: Public Affairs | AN226: Mission: Impossible | AX226: =A226 -> 29240
A227: 29247 | E227: [6:45] News | F227: Jerry Falwell | H227: A New Way to Live | I227: Oral Roberts | J227: Rex Humbard | L227: Day of Discovery | M227: It is Written | N227: Jimmy Swaggart | O227: Good News | P227: Movie [Brunch Theater]: The Brothers O'Toole (1972) | T227: Movie [Sunday Matinee]: The Egg and I (1947) | X227: Star Trek | Z227: Movie [Hollywood's Best]: Solomon and Sheba (1959) | AE227: Guinness Game | AF227: Movie: Jumbo (1962) | AK227: Dialogue | AL227: Public Affairs | AN227: Mission: Impossible | AX227: =A227 -> 29247