A1: FRIDAY | B1: 05:00AM | C1: 05:30AM | D1: 06:00AM | E1: 06:30AM | F1: 07:00AM | G1: 07:30AM | H1: 08:00AM | I1: 08:30AM | J1: 09:00AM | K1: 09:30AM | L1: 10:00AM | M1: 10:30AM | N1: 11:00AM | O1: 11:30AM | P1: 12:00N | Q1: 12:30PM | R1: 01:00PM | S1: 01:30PM | T1: 02:00PM | U1: 02:30PM | V1: 03:00PM | W1: 03:30PM | X1: 04:00PM | Y1: 04:30PM | Z1: 05:00PM | AA1: 05:30PM | AB1: 06:00PM | AC1: 06:30PM | AD1: 07:00PM | AE1: 07:30PM | AF1: 08:00PM | AG1: 08:30PM | AH1: 09:00PM | AI1: 09:30PM | AJ1: 10:00PM | AK1: 10:30PM | AL1: 11:00PM | AM1: 11:30PM | AN1: 12:00M | AO1: 12:30AM | AP1: 01:00AM | AQ1: 01:30AM | AR1: 02:00AM | AS1: 02:30AM | AT1: 03:00AM | AU1: 03:30AM | AV1: 04:00AM | AW1: 04:30AM | AX1: FRIDAY
A3: 1953 | AX3: =A3 -> 1953
A4: 19417 | P4: The Big Payoff (NBC) | Q4: Welcome Travelers (NBC) | R4: The Kate Smith Hour (NBC) | T4: Double or Nothing (CBS) | U4: Strike It Rich (CBS) | V4: Movie [Matinee Theater]: False Faces | X4: [4:15] Search For Tomorrow (CBS) | Y4: Love of Life (CBS); [4:45] TBA | Z4: TBA | AA4: The Roy Rogers Show (NBC) | AB4: The Cisco Kid | AC4: The CBS Evening News --Douglas Edwards (CBS); [6:45] Time for Beany | AD4: The Gillette Cavalcade of Sports (NBC); [7:45] Camel News Caravan (NBC) | AF4: Abbott and Costello | AG4: You Asked for It (ABC) | AH4: The Big Story (NBC) | AI4: Mr. and Mrs. North (CBS) | AJ4: The Dennis Day Show (NBC) | AK4: My Favorite Story--Adolphe Menjou | AL4: The Bob Considine Show (NBC); [11:15] The Life of Riley (NBC) | AM4: [11:45] Movie [Nite Owl Theater]: London Blackout Murders | AX4: =A4 -> 19417
A5: =A4+7 -> 19424 | O5: [11:45] TBA | P5: The Big Payoff (NBC) | Q5: Welcome Travelers (NBC) | R5: The Kate Smith Hour (NBC) | T5: Double or Nothing (CBS) | U5: Strike It Rich (CBS) | V5: Movie [Matinee Theater]: Who Killed Aunt Maggie? | X5: [4:15] Search For Tomorrow (CBS) | Y5: Love of Life (CBS); [4:45] TBA | Z5: Terry and the Pirates | AA5: The Roy Rogers Show (NBC) | AB5: The Cisco Kid | AC5: The CBS Evening News --Douglas Edwards (CBS); [6:45] Time for Beany | AD5: The Gillette Cavalcade of Sports (NBC); [7:45] Camel News Caravan (NBC) | AF5: Abbott and Costello | AG5: You Asked for It (ABC) | AH5: The Big Story (NBC) | AI5: Mr. and Mrs. North (CBS) | AJ5: The Dennis Day Show (NBC) | AK5: My Favorite Story--Adolphe Menjou | AL5: The Bob Considine Show (NBC); [11:15] The Life of Riley (NBC) | AM5: [11:45] Movie [Nite Owl Theater]: Next of Kin | AX5: =A5 -> 19424
A6: =A5+7 -> 19431 | H6: United Nations General Assembly (NBC) | O6: [11:45] Comedy Carnival | P6: The Big Payoff (NBC) | Q6: Welcome Travelers (NBC) | R6: The Kate Smith Hour (NBC) | T6: Double or Nothing (CBS) | U6: Strike It Rich (CBS) | V6: Movie [Matinee Theater]: King of the Circus | X6: [4:15] Search For Tomorrow (CBS) | Y6: Love of Life (CBS); [4:45] TBA | Z6: The Quiz Kids (CBS) | AA6: The Roy Rogers Show (NBC) | AB6: The Cisco Kid | AC6: The CBS Evening News --Douglas Edwards (CBS); [6:45] Time for Beany | AD6: NCAA Regional Playoffs: From Corvallis, Oregon | AH6: The Big Story (NBC) | AI6: Mr. and Mrs. North (CBS) | AJ6: The Dennis Day Show (NBC) | AK6: My Favorite Story--Adolphe Menjou | AL6: Club Embassy; (NBC) [11:15] The Life of Riley (NBC) | AM6: [11:45] Movie [Nite Owl Theater]: Melody Maker | AX6: =A6 -> 19431
A7: =A6+7 -> 19438 | H7: United Nations General Assembly (NBC) | O7: [11:45] Comedy Carnival | P7: The Big Payoff (NBC) | Q7: Welcome Travelers (NBC) | R7: The Kate Smith Hour (NBC) | T7: Double or Nothing (CBS) | U7: Strike It Rich (CBS) | V7: Movie [Matinee Theater]: Bowery Boy | X7: [4:15] Search For Tomorrow (CBS) | Y7: Love of Life (CBS); [4:45] TBA | Z7: Terry and the Pirates | AA7: The Roy Rogers Show (NBC) | AB7: The Cisco Kid | AC7: The CBS Evening News --Douglas Edwards (CBS); [6:45] Time for Beany | AD7: The Gillette Cavalcade of Sports (NBC); [7:45] Camel News Caravan (NBC) | AF7: Abbott and Costello | AG7: You Asked for It (ABC) | AH7: The Big Story (NBC) | AI7: Mr. and Mrs. North (CBS) | AJ7: The Dennis Day Show (NBC) | AK7: My Favorite Story--Adolphe Menjou | AL7: Club Embassy; (NBC) [11:15] The Life of Riley (NBC) | AM7: [11:45] Movie [Nite Owl Theater]: Vampire's Ghost | AX7: =A7 -> 19438
A8: =A7+7 -> 19445 | H8: United Nations General Assembly (NBC) | O8: [11:45] Comedy Carnival | P8: The Big Payoff (NBC) | Q8: Welcome Travelers (NBC) | R8: The Kate Smith Hour (NBC) | T8: Double or Nothing (CBS) | U8: Strike It Rich (CBS) | V8: Movie [Matinee Theater]: Whispering Footsteps | X8: [4:15] Search For Tomorrow (CBS) | Y8: Love of Life (CBS); [4:45] TBA | Z8: The Quiz Kids (CBS) | AA8: The Roy Rogers Show (NBC) | AB8: The Cisco Kid | AC8: The CBS Evening News --Douglas Edwards (CBS); [6:45] Time for Beany | AD8: The Gillette Cavalcade of Sports (NBC); [7:45] Camel News Caravan (NBC) | AF8: Abbott and Costello | AG8: You Asked for It (ABC) | AH8: The Big Story (NBC) | AI8: Mr. and Mrs. North (CBS) | AJ8: The Dennis Day Show (NBC) | AK8: My Favorite Story | AL8: Club Embassy; (NBC) [11:15] The Life of Riley (NBC) | AM8: [11:45] Movie [Nite Owl Theater]: It Could Happen to You | AX8: =A8 -> 19445
A9: =A8+7 -> 19452 | O9: [11:45] TBA | P9: The Big Payoff (NBC) | Q9: Welcome Travelers (NBC) | R9: The Kate Smith Hour (NBC) | T9: Double or Nothing (CBS) | U9: Strike It Rich (CBS) | V9: Movie [Matinee Theater]: TBA | X9: [4:15] Search For Tomorrow (CBS) | Y9: Love of Life (CBS); [4:45] TBA | Z9: Terry and the Pirates | AA9: The Roy Rogers Show (NBC) | AB9: The Cisco Kid | AC9: The CBS Evening News --Douglas Edwards (CBS); [6:45] Time for Beany | AD9: The Gillette Cavalcade of Sports (NBC); [7:45] Camel News Caravan (NBC) | AF9: Abbott and Costello | AG9: You Asked for It (ABC) | AH9: The Big Story (NBC) | AI9: The Dennis Day Show (NBC) | AJ9: Chance of a Lifetime (ABC) | AK9: My Favorite Story | AL9: Club Embassy; (NBC) [11:15] The Life of Riley (NBC) | AM9: [11:45] Movie [Nite Owl Theater]: TBA | AX9: =A9 -> 19452
A10: =A9+7 -> 19459 | O10: [11:45] TBA | P10: The Big Payoff (NBC) | Q10: Welcome Travelers (NBC) | R10: The Kate Smith Hour (NBC) | T10: Double or Nothing (CBS) | U10: Strike It Rich (CBS) | V10: Movie [Matinee Theater]: Dr. Christian Meets the Woman | X10: [4:15] Search For Tomorrow (CBS) | Y10: Love of Life (CBS); [4:45] TBA | Z10: The Quiz Kids (CBS) | AA10: The Roy Rogers Show (NBC) | AB10: The Cisco Kid | AC10: The CBS Evening News --Douglas Edwards (CBS); [6:45] Time for Beany | AD10: The Gillette Cavalcade of Sports (NBC); [7:45] Camel News Caravan (NBC) | AF10: Abbott and Costello | AG10: You Asked for It (ABC) | AH10: The Big Story (NBC) | AI10: The Dennis Day Show (NBC) | AJ10: Chance of a Lifetime (ABC) | AK10: My Favorite Story | AL10: Club Embassy; (NBC) [11:15] The Life of Riley (NBC) | AM10: [11:45] Movie [Nite Owl Theater]: Cheers for Miss Bishop | AX10: =A10 -> 19459
A11: =A10+7 -> 19466 | O11: [11:45] TBA | P11: The Big Payoff (NBC) | Q11: Welcome Travelers (NBC) | R11: The Kate Smith Hour (NBC) | T11: Double or Nothing (CBS) | U11: Strike It Rich (CBS) | V11: Movie [Matinee Theater]: TBA | X11: [4:15] Search For Tomorrow (CBS) | Y11: Love of Life (CBS); [4:45] TBA | Z11: Terry and the Pirates | AA11: The Roy Rogers Show (NBC) | AB11: The Cisco Kid | AC11: The CBS Evening News --Douglas Edwards (CBS); [6:45] Time for Beany | AD11: The Gillette Cavalcade of Sports (NBC); [7:45] Camel News Caravan (NBC) | AF11: Abbott and Costello | AG11: You Asked for It (ABC) | AH11: The Big Story (NBC) | AI11: The Dennis Day Show (NBC) | AJ11: Chance of a Lifetime (ABC) | AK11: My Favorite Story | AL11: Club Embassy; (NBC) [11:15] The Life of Riley (NBC) | AM11: [11:45] Movie [Nite Owl Theater]: Swiss Family Robinson | AX11: =A11 -> 19466
A12: =A11+7 -> 19473 | O12: [11:45] TBA | P12: The Big Payoff (NBC) | Q12: Welcome Travelers (NBC) | R12: The Kate Smith Hour (NBC) | T12: Double or Nothing (CBS) | U12: Strike It Rich (CBS) | V12: Movie [Matinee Theater]: Costal Command | X12: [4:15] Search For Tomorrow (CBS) | Y12: Love of Life (CBS); [4:45] TBA | Z12: The Quiz Kids (CBS) | AA12: The Roy Rogers Show (NBC) | AB12: The Cisco Kid | AC12: The CBS Evening News --Douglas Edwards (CBS); [6:45] Time for Beany | AD12: The Gillette Cavalcade of Sports (NBC); [7:45] Camel News Caravan (NBC) | AF12: Abbott and Costello | AG12: You Asked for It (ABC) | AH12: The Big Story (NBC) | AI12: The Dennis Day Show (NBC) | AJ12: Chance of a Lifetime (ABC) | AK12: My Favorite Story | AL12: Club Embassy; (NBC) [11:15] The Life of Riley (NBC) | AM12: [11:45] Movie [Nite Owl Theater]: Second Chorus | AX12: =A12 -> 19473
B13: OTHER CITIES SWITCH TO DAYLIGHT SAVINGS TIME; PORTLAND SHOWS AIR ONE HOUR EARLIER | J13: OTHER CITIES SWITCH TO DAYLIGHT SAVINGS TIME; PORTLAND SHOWS AIR ONE HOUR EARLIER | R13: OTHER CITIES SWITCH TO DAYLIGHT SAVINGS TIME; PORTLAND SHOWS AIR ONE HOUR EARLIER | Z13: OTHER CITIES SWITCH TO DAYLIGHT SAVINGS TIME; PORTLAND SHOWS AIR ONE HOUR EARLIER | AH13: OTHER CITIES SWITCH TO DAYLIGHT SAVINGS TIME; PORTLAND SHOWS AIR ONE HOUR EARLIER | AP13: OTHER CITIES SWITCH TO DAYLIGHT SAVINGS TIME; PORTLAND SHOWS AIR ONE HOUR EARLIER
A14: =A12+7 -> 19480 | K14: What's Cooking? | L14: Local Film | M14: [10:45] News from KPTV | N14: The Big Payoff (NBC) | O14: Welcome Travelers (NBC) | P14: The Kate Smith Hour (NBC) | R14: Double or Nothing (CBS) | S14: Strike It Rich (CBS) | T14: Movie [Matinee Theater]: TBA | V14: [3:15] Search For Tomorrow (CBS) | W14: Love of Life (CBS); [3:45] TBA | X14: Terry and the Pirates | Y14: The Roy Rogers Show (NBC) | Z14: The Cisco Kid | AA14: The CBS Evening News --Douglas Edwards (CBS); [5:45] Time for Beany | AB14: The Gillette Cavalcade of Sports (NBC); [6:45] Camel News Caravan (NBC) | AD14: Abbott and Costello | AE14: You Asked for It (ABC) | AF14: The Big Story (NBC) | AG14: The Dennis Day Show (NBC) | AH14: Chance of a Lifetime (ABC) | AI14: My Favorite Story | AJ14: Club Embassy; (NBC) [10:15] Bob Considine (NBC) | AK14: Famous Fights from Madison Square Garden; [10:45] Movie [Nite Owl Theater]: Swiss Family Robinson | AX14: =A14 -> 19480
A15: =A14+7 -> 19487 | K15: What's Cooking? | L15: Local Film | M15: [10:45] News from KPTV | N15: The Big Payoff (NBC) | O15: Welcome Travelers (NBC) | P15: The Kate Smith Hour (NBC) | R15: Double or Nothing (CBS) | S15: Strike It Rich (CBS) | T15: Movie [Matinee Theater]: TBA | V15: [3:15] Search For Tomorrow (CBS) | W15: Love of Life (CBS); [3:45] TBA | X15: The Quiz Kids (CBS) | Y15: The Roy Rogers Show (NBC) | Z15: The Cisco Kid | AA15: The CBS Evening News --Douglas Edwards (CBS); [5:45] Time for Beany | AB15: The Gillette Cavalcade of Sports (NBC); [6:45] Camel News Caravan (NBC) | AD15: TBA | AE15: You Asked for It (ABC) | AF15: The Big Story (NBC) | AG15: The Dennis Day Show (NBC) | AH15: Chance of a Lifetime (ABC) | AI15: My Favorite Story | AJ15: Club Embassy; (NBC) [10:15] Bob Considine (NBC) | AK15: Famous Fights from Madison Square Garden; [10:45] Movie [Nite Owl Theater]: TBA | AX15: =A15 -> 19487
A16: =A15+7 -> 19494 | K16: What's Cooking? | L16: Local Film | M16: [10:45] News from KPTV | N16: The Big Payoff (NBC) | O16: Welcome Travelers (NBC) | P16: The Kate Smith Hour (NBC) | R16: Double or Nothing (CBS) | S16: Strike It Rich (CBS) | T16: Movie [Matinee Theater]: Spy Train | V16: [3:15] Search For Tomorrow (CBS) | W16: Love of Life (CBS); [3:45] The Toymaker | X16: Terry and the Pirates | Y16: The Roy Rogers Show (NBC) | Z16: The Cisco Kid | AA16: The CBS Evening News --Douglas Edwards (CBS); [5:45] Time for Beany | AB16: The Gillette Cavalcade of Sports (NBC); [6:45] Camel News Caravan (NBC) | AD16: Hoffman Hayride | AE16: You Asked for It (ABC) | AF16: The Big Story (NBC) | AG16: The Dennis Day Show (NBC) | AH16: Chance of a Lifetime (ABC) | AI16: My Favorite Story | AJ16: Club Embassy; (NBC) [10:15] Bob Considine (NBC) | AK16: Famous Fights from Madison Square Garden; [10:45] Movie [Nite Owl Theater]: Sweethearts of the USA | AX16: =A16 -> 19494
A17: =A16+7 -> 19501 | K17: What's Cooking? | L17: Local Film | M17: [10:45] Northwest News Digest | N17: The Big Payoff (NBC) | O17: Welcome Travelers (NBC) | P17: The Kate Smith Hour (NBC) | R17: Double or Nothing (CBS) | S17: Strike It Rich (CBS) | T17: Movie [Matinee Theater]: Rose of the Rio Grande | V17: [3:15] Search For Tomorrow (CBS) | W17: Love of Life (CBS); [3:45] The Toymaker | X17: The Quiz Kids (CBS) | Y17: The Roy Rogers Show (NBC) | Z17: The Cisco Kid | AA17: The CBS Evening News --Douglas Edwards (CBS); [5:45] Time for Beany | AB17: The Gillette Cavalcade of Sports (NBC); [6:45] Camel News Caravan (NBC) | AD17: Hoffman Hayride | AE17: You Asked for It (ABC) | AF17: The Big Story (NBC) | AG17: The Dennis Day Show (NBC) | AH17: Chance of a Lifetime (ABC) | AI17: My Favorite Story | AJ17: Club Embassy; (NBC) [10:15] Bob Considine (NBC) | AK17: Famous Fights from Madison Square Garden; [10:45] Movie [Nite Owl Theater]: Danger Flight | AX17: =A17 -> 19501
A18: =A17+7 -> 19508 | K18: What's Cooking? | L18: Local Film | M18: [10:45] Northwest News Digest | N18: The Big Payoff (NBC) | O18: Welcome Travelers (NBC) | P18: The Kate Smith Hour (NBC) | R18: Double or Nothing (CBS) | S18: Strike It Rich (CBS) | T18: Movie [Matinee Theater]: Man from Headquarters | V18: [3:15] Search For Tomorrow (CBS) | W18: Love of Life (CBS); [3:45] The Toymaker | X18: Terry and the Pirates | Y18: The Roy Rogers Show (NBC) | Z18: The Cisco Kid | AA18: The CBS Evening News --Douglas Edwards (CBS); [5:45] Time for Beany | AB18: The Gillette Cavalcade of Sports (NBC); [6:45] Camel News Caravan (NBC) | AD18: Hoffman Hayride | AE18: You Asked for It (ABC) | AF18: The Big Story (NBC) | AG18: The Dennis Day Show (NBC) | AH18: Chance of a Lifetime (ABC) | AI18: My Favorite Story | AJ18: Club Embassy; (NBC) [10:15] Bob Considine (NBC) | AK18: Famous Fights from Madison Square Garden; [10:45] Movie [Nite Owl Theater]: Sing Sing Nights | AX18: =A18 -> 19508
B19: KPTV BECOMES NBC AFFILIATE | J19: KPTV BECOMES NBC AFFILIATE | R19: KPTV BECOMES NBC AFFILIATE | Z19: KPTV BECOMES NBC AFFILIATE | AH19: KPTV BECOMES NBC AFFILIATE | AP19: KPTV BECOMES NBC AFFILIATE
A20: =A18+7 -> 19515 | K20: What's Cooking? | L20: Local Film | M20: [10:45] Northwest News Digest | N20: The Big Payoff (NBC) | O20: Welcome Travelers (NBC) | P20: The Kate Smith Hour (NBC) | R20: Double or Nothing (CBS) | S20: Strike It Rich (CBS) | T20: Movie [Matinee Theater]: Double Trouble | V20: [3:15] Search For Tomorrow (CBS) | W20: Love of Life (CBS); [3:45] The Toymaker | X20: The Quiz Kids (CBS) | Y20: The Roy Rogers Show (NBC) | Z20: The Cisco Kid | AA20: The CBS Evening News --Douglas Edwards (CBS); [5:45] Time for Beany | AB20: The Gillette Cavalcade of Sports (NBC); [6:45] Camel News Caravan (NBC) | AD20: Hoffman Hayride | AE20: You Asked for It (ABC) | AF20: The Big Story (NBC) | AG20: The Dennis Day Show (NBC) | AH20: Chance of a Lifetime (ABC) | AI20: My Favorite Story | AJ20: TBA; [10:15] Bob Considine (NBC) | AK20: Famous Fights from Madison Square Garden; [10:45] TBA | AL20: Club Embassy (NBC); [11:15] Movie [Nite Owl Theater]: Sky Patrol | AX20: =A20 -> 19515
A21: =A20+7 -> 19522 | K21: Rose Festival Parade: From Multnomah Stadium | Q21: Ladie's Choice (NBC) | R21: Double or Nothing (CBS) | S21: Strike It Rich (CBS) | T21: Movie [Matinee Theater]: Deadly Game | V21: [3:15] Search For Tomorrow (CBS) | W21: Love of Life (CBS); [3:45] The Toymaker | X21: Terry and the Pirates | Y21: The Roy Rogers Show (NBC) | Z21: The Cisco Kid | AA21: The CBS Evening News --Douglas Edwards (CBS); [5:45] Time for Beany | AB21: The Gillette Cavalcade of Sports (NBC); [6:45] Camel News Caravan (NBC) | AD21: Hoffman Hayride | AE21: You Asked for It (ABC) | AF21: The Big Story (NBC) | AG21: The Dennis Day Show (NBC) | AH21: Chance of a Lifetime (ABC) | AI21: My Favorite Story | AJ21: TBA; [10:15] Bob Considine (NBC) | AK21: Famous Fights from Madison Square Garden; [10:45] TBA | AL21: Club Embassy (NBC); [11:15] Movie [Nite Owl Theater]: Mr. Wong, Detective | AX21: =A21 -> 19522
A22: =A21+7 -> 19529 | K22: What's Cooking? | L22: Local Film | M22: [10:45] Northwest News Digest | N22: The Big Payoff (NBC) | O22: Welcome Travelers (NBC) | P22: On Your Account (NBC) | Q22: Ladie's Choice (NBC) | R22: Double or Nothing (CBS) | S22: Strike It Rich (CBS) | T22: Movie [Matinee Theater]: Bride for Henry | V22: [3:15] Search For Tomorrow (CBS) | W22: Love of Life (CBS); [3:45] The Toymaker | X22: TBA | Y22: The Roy Rogers Show (NBC) | Z22: The Cisco Kid | AA22: The CBS Evening News --Douglas Edwards (CBS); [5:45] Time for Beany | AB22: The Gillette Cavalcade of Sports (NBC); [6:45] Camel News Caravan (NBC) | AD22: Hoffman Hayride | AE22: You Asked for It (ABC) | AF22: The Big Story (NBC) | AG22: The Dennis Day Show (NBC) | AH22: Chance of a Lifetime (ABC) | AI22: My Favorite Story | AJ22: TBA; [10:15] Bob Considine (NBC) | AK22: TBA; [10:45] Sports Den | AL22: Club Embassy (NBC); [11:15] Famous Fights from Madison Square Garden | AM22: Movie [Nite Owl Theater]: Should a Girl Marry? | AX22: =A22 -> 19529
A23: =A22+7 -> 19536 | K23: What's Cooking? | L23: Local Film | M23: [10:45] Northwest News Digest | N23: The Big Payoff (NBC) | O23: Welcome Travelers (NBC) | P23: On Your Account (NBC) | Q23: Ladie's Choice (NBC) | R23: Double or Nothing (CBS) | S23: Strike It Rich (CBS) | T23: Movie [Matinee Theater]: Father Steps Out | V23: [3:15] Search For Tomorrow (CBS) | W23: Love of Life (CBS); [3:45] The Toymaker | X23: Terry and the Pirates | Y23: The Roy Rogers Show (NBC) | Z23: The Cisco Kid | AA23: The CBS Evening News --Douglas Edwards (CBS); [5:45] Time for Beany | AB23: The Gillette Cavalcade of Sports (NBC); [6:45] Camel News Caravan (NBC) | AD23: Hoffman Hayride | AE23: You Asked for It (ABC) | AF23: The Big Story (NBC) | AG23: The Dennis Day Show (NBC) | AH23: Chance of a Lifetime (ABC) | AI23: My Favorite Story | AJ23: TBA; [10:15] Bob Considine (NBC) | AK23: TBA; [10:45] Sports Den | AL23: TBA; [11:15] Famous Fights from Madison Square Garden | AM23: Movie [Nite Owl Theater]: Fatal Hour | AX23: =A23 -> 19536
A24: =A23+7 -> 19543 | K24: What's Cooking? | L24: Local Film | M24: [10:45] Northwest News Digest | N24: The Big Payoff (NBC) | O24: Welcome Travelers (NBC) | P24: On Your Account (NBC) | Q24: Ladie's Choice (NBC) | R24: Double or Nothing (CBS) | S24: Strike It Rich (CBS) | T24: Movie [Matinee Theater]: He Couldn't Take It | V24: [3:15] Search For Tomorrow (CBS) | W24: Love of Life (CBS); [3:45] The Toymaker | X24: TBA | Y24: TBA | Z24: The Cisco Kid | AA24: The CBS Evening News --Douglas Edwards (CBS); [5:45] Time for Beany | AB24: The Gillette Sports Reel; [6:45] Camel News Caravan (NBC) | AD24: Hoffman Hayride | AE24: You Asked for It (ABC) | AF24: The Big Story (NBC) | AG24: The Dennis Day Show (NBC) | AH24: Chance of a Lifetime (ABC) | AI24: My Favorite Story | AJ24: Safety Spotlight; [10:15] Bob Considine (NBC) | AK24: Vest Pocket Theater; [10:45] Sports Den | AL24: Famous Fights from Madison Square Garden; [11:15] Movie [Nite Owl Theater]: Boy of the Streets | AX24: =A24 -> 19543
A25: =A24+7 -> 19550 | K25: What's Cooking? | L25: Local Film | M25: [10:45] Northwest News Digest | N25: The Big Payoff (NBC) | O25: Welcome Travelers (NBC) | P25: On Your Account (NBC) | Q25: Ladie's Choice (NBC) | R25: Double or Nothing (CBS) | S25: Strike It Rich (CBS) | T25: Movie [Matinee Theater]: Phantom Killer | V25: [3:15] Search For Tomorrow (CBS) | W25: Love of Life (CBS); [3:45] The Toymaker | X25: Terry and the Pirates | Y25: TBA | Z25: The Cisco Kid | AA25: The CBS Evening News --Douglas Edwards (CBS); [5:45] Time for Beany | AB25: The Gillette Sports Reel | AC25: It Happened in Sports; [6:45] Camel News Caravan (NBC) | AD25: Hoffman Hayride | AE25: You Asked for It (ABC) | AF25: The Big Story (NBC) | AG25: The Goldbergs (NBC) | AH25: Chance of a Lifetime (ABC) | AI25: Miracle Spotlight; [9:45] Bob Considine (NBC) | AJ25: Wrestling from Portland | AL25: Famous Fights from Madison Square Garden; [11:15] Movie [Nite Owl Theater]: Loud Speaker | AX25: =A25 -> 19550
A26: =A25+7 -> 19557 | K26: What's Cooking? | L26: Local Film | M26: [10:45] Northwest News Digest | N26: The Big Payoff (NBC) | O26: Welcome Travelers (NBC) | P26: On Your Account (NBC) | Q26: Ladie's Choice (NBC) | R26: Double or Nothing (CBS) | S26: Strike It Rich (CBS) | T26: Movie [Matinee Theater]: Gang Bullets | V26: [3:15] Search For Tomorrow (CBS) | W26: Love of Life (CBS); [3:45] The Toymaker | X26: TBA | Y26: TBA | Z26: The Cisco Kid | AA26: The CBS Evening News --Douglas Edwards (CBS); [5:45] Time for Beany | AB26: The Gillette Sports Newsreel | AC26: It Happened in Sports; [6:45] Camel News Caravan (NBC) | AD26: Hoffman Hayride | AE26: You Asked for It (ABC) | AF26: Doorway to Danger (NBC) | AG26: The Goldbergs (NBC) | AH26: Chance of a Lifetime (ABC) | AI26: Bob Considine (NBC) [9:45] TBA | AJ26: Wrestling from Portland | AL26: Famous Fights from Madison Square Garden; [11:15] Movie [Nite Owl Theater]: Melody Parade | AX26: =A26 -> 19557
A27: =A26+7 -> 19564 | K27: What's Cooking? | L27: Local Film | M27: [10:45] Northwest News Digest | N27: The Big Payoff (NBC) | O27: Welcome Travelers (NBC) | P27: On Your Account (NBC) | Q27: Ladie's Choice (NBC) | R27: Double or Nothing (CBS) | S27: Strike It Rich (CBS) | T27: Movie [Matinee Theater]: Strange Mr. Gregory | V27: [3:15] Search For Tomorrow (CBS) | W27: Love of Life (CBS); [3:45] The Toymaker | X27: Terry and the Pirates | Y27: TBA | Z27: The Cisco Kid | AA27: Alka-Seltzer Newspaper of the Air; [5:45] Time for Beany | AB27: The Gillette Sports Newsreel | AC27: It Happened in Sports; [6:45] Camel News Caravan (NBC) | AD27: Hoffman Hayride | AE27: You Asked for It (ABC) | AF27: Doorway to Danger (NBC) | AG27: The Goldbergs (NBC) | AH27: Chance of a Lifetime (ABC) | AI27: Bob Considine (NBC) [9:45] TBA | AJ27: Wrestling from Portland | AL27: Famous Fights from Madison Square Garden; [11:15] Movie [Nite Owl Theater]: Face of Marble | AX27: =A27 -> 19564
A28: =A27+7 -> 19571 | K28: What's Cooking? | L28: Local Film | M28: [10:45] TBA | N28: The Big Payoff (NBC) | O28: Welcome Travelers (NBC) | P28: On Your Account (NBC) | Q28: Ladie's Choice (NBC) | R28: Double or Nothing (CBS) | S28: Strike It Rich (CBS) | T28: Movie [Matinee Theater]: Hoosier Schoolboy | V28: [3:15] Search For Tomorrow (CBS) | W28: Love of Life (CBS); [3:45] The Toymaker | X28: TBA | Y28: TBA | Z28: The Cisco Kid | AA28: Northwest News Digest; [5:40] Alka-Seltzer Newspaper of the Air; [5:45] Time for Beany | AB28: The Gillette Sports Newsreel | AC28: It Happened in Sports; [6:45] Camel News Caravan (NBC) | AD28: Hoffman Hayride | AE28: You Asked for It (ABC) | AF28: Doorway to Danger (NBC) | AG28: The Goldbergs (NBC) | AH28: Chance of a Lifetime (ABC) | AI28: Bob Considine (NBC) [9:45] TBA | AJ28: Wrestling by Heidelberg | AL28: Famous Fights from Madison Square Garden; [11:15] Movie [Nite Owl Theater]: Mutiny in the Big House | AX28: =A28 -> 19571
A29: =A28+7 -> 19578 | K29: What's Cooking? | L29: Local Film | M29: [10:45] TBA | N29: The Big Payoff (NBC) | O29: Welcome Travelers (NBC) | P29: On Your Account (NBC) | Q29: Ladie's Choice (NBC) | R29: Double or Nothing (CBS) | S29: Strike It Rich (CBS) | T29: Movie [Matinee Theater]: Port of Missing Girls | V29: [3:15] Search For Tomorrow (CBS) | W29: Love of Life (CBS); [3:45] The Toymaker | X29: Terry and the Pirates | Y29: TBA | Z29: The Cisco Kid | AA29: Northwest News Digest; [5:40] Alka-Seltzer Newspaper of the Air; [5:45] Time for Beany | AB29: The Gillette Sports Newsreel | AC29: It Happened in Sports; [6:45] Camel News Caravan (NBC) | AD29: TBA | AE29: You Asked for It (ABC) | AF29: Doorway to Danger (NBC) | AG29: The Goldbergs (NBC) | AH29: Chance of a Lifetime (ABC) | AI29: Bob Considine (NBC) [9:45] TBA | AJ29: Wrestling by Heidelberg | AL29: Famous Fights from Madison Square Garden; [11:15] Movie [Nite Owl Theater]: Doomed to Die | AX29: =A29 -> 19578
A30: =A29+7 -> 19585 | K30: What's Cooking? | L30: Local Film | M30: [10:45] TBA | N30: The Big Payoff (NBC) | O30: Welcome Travelers (NBC) | P30: On Your Account (NBC) | Q30: United Nations General Assembly (NBC) | R30: Double or Nothing (CBS) | S30: Strike It Rich (CBS) | T30: Movie [Matinee Theater]: She's in the Army | V30: [3:15] Search For Tomorrow (CBS) | W30: Love of Life (CBS); [3:45] The Toymaker | X30: TBA | Y30: TBA | Z30: The Cisco Kid | AA30: Northwest News Digest; [5:40] Alka-Seltzer Newspaper of the Air; [5:45] Time for Beany | AB30: The Gillette Sports Newsreel | AC30: On the Practice Tee; [6:45] Camel News Caravan (NBC) | AD30: The Gene Autry Show (CBS) | AE30: You Asked for It (ABC) | AF30: Doorway to Danger (NBC) | AG30: The Goldbergs (NBC) | AH30: Chance of a Lifetime (ABC) | AI30: Bob Considine (NBC) [9:45] TBA | AJ30: Wrestling by Heidelberg | AL30: Famous Fights from Madison Square Garden; [11:15] Movie [Nite Owl Theater]: Behind the Mask | AX30: =A30 -> 19585
A31: =A30+7 -> 19592 | K31: What's Cooking? | L31: Local Film | M31: [10:45] TBA | N31: The Big Payoff (NBC) | O31: Welcome Travelers (NBC) | P31: On Your Account (NBC) | Q31: United Nations General Assembly (NBC) | R31: Double or Nothing (CBS) | S31: Strike It Rich (CBS) | T31: Movie [Matinee Theater]: The Mystery | V31: [3:15] Search For Tomorrow (CBS) | W31: Love of Life (CBS); [3:45] The Toymaker | X31: Terry and the Pirates | Y31: TBA | Z31: TBA | AA31: Northwest News Digest; [5:40] Alka-Seltzer Newspaper of the Air; [5:45] Time for Beany | AB31: The Gillette Sports Newsreel | AC31: On the Practice Tee; [6:45] Camel News Caravan (NBC) | AD31: The Gene Autry Show (CBS) | AE31: You Asked for It (ABC) | AF31: Doorway to Danger (NBC) | AG31: The Goldbergs (NBC) | AH31: Chance of a Lifetime (ABC) | AI31: Bob Considine (NBC) [9:45] Vest Pocket Theater | AJ31: Wrestling by Heidelberg | AL31: Pulse of the City; [11:15] Movie [Nite Owl Theater]: Behind the Mask | AX31: =A31 -> 19592
A32: =A31+7 -> 19599 | K32: What's Cooking? | L32: Local Film | M32: [10:45] TBA | N32: The Big Payoff (NBC) | O32: Welcome Travelers (NBC) | P32: On Your Account (NBC) | Q32: United Nations General Assembly (NBC) | R32: Double or Nothing (CBS) | S32: Strike It Rich (CBS) | T32: Movie [Matinee Theater]: Wings Over the Pacific (1943) | V32: [3:15] Search For Tomorrow (CBS) | W32: Love of Life (CBS); [3:45] The Toymaker | X32: Movie [Six-Gun Playhouse]: Western films | AA32: TBA; [5:45] Northwest News Digest; [5:55] Alka-Seltzer Newspaper of the Air | AB32: The Gillette Sports Newsreel | AC32: On the Practice Tee; [6:45] Camel News Caravan (NBC) | AD32: The Gene Autry Show (CBS) | AE32: You Asked for It (ABC) | AF32: Doorway to Danger (NBC) | AG32: The Goldbergs (NBC) | AH32: Chance of a Lifetime (ABC) | AI32: Bob Considine (NBC) [9:45] Vest Pocket Theater | AJ32: Wrestling by Heidelberg | AL32: Pulse of the City; [11:15] Movie [Nite Owl Theater]: Kentucky Carnival (1932) | AX32: =A32 -> 19599
A33: =A32+7 -> 19606 | K33: What's Cooking? | L33: Local Film | M33: [10:45] TBA | N33: The Big Payoff (NBC) | O33: Welcome Travelers (NBC) | P33: On Your Account (NBC) | Q33: United Nations General Assembly (NBC) | R33: Double or Nothing (CBS) | S33: Strike It Rich (CBS) | T33: Movie [Matinee Theater]: Spy Train (1943) | V33: [3:15] Search For Tomorrow (CBS) | W33: Love of Life (CBS); [3:45] The Toymaker | X33: Terry and the Pirates | Y33: Movie [Six-Gun Playhouse]: Western films | AA33: TBA; [5:45] Northwest News Digest; [5:55] Alka-Seltzer Newspaper of the Air | AB33: The Gillette Cavalcade of Sports (NBC); [6:45] Camel News Caravan (NBC) | AD33: The Gene Autry Show (CBS) | AE33: You Asked for It (ABC) | AF33: Doorway to Danger (NBC) | AG33: The Goldbergs (NBC) | AH33: Chance of a Lifetime (ABC) | AI33: Bob Considine (NBC) [9:45] Vest Pocket Theater | AJ33: Wrestling by Heidelberg | AL33: Pulse of the City; [11:15] Movie [Nite Owl Theater]: Murder by Invitation (1941) | AX33: =A33 -> 19606
A34: =A33+7 -> 19613 | K34: What's Cooking? | L34: TBA | M34: [10:45] TBA | N34: The Big Payoff (NBC) | O34: Welcome Travelers (NBC) | P34: On Your Account (NBC) | Q34: United Nations General Assembly (NBC) | R34: Double or Nothing (CBS) | S34: Strike It Rich (CBS) | T34: Movie [Matinee Theater]: The Shanghai Cobra (1945) | V34: [3:15] Search For Tomorrow (CBS) | W34: Love of Life (CBS); [3:45] The Toymaker | X34: Movie [Six-Gun Playhouse]: Western films | AA34: TBA; [5:45] Northwest News Digest; [5:55] Alka-Seltzer Newspaper of the Air | AB34: The Gillette Cavalcade of Sports (NBC); [6:45] Camel News Caravan (NBC) | AD34: The Gene Autry Show (CBS) | AE34: You Asked for It (ABC) | AF34: The Big Story (NBC) | AG34: The Goldbergs (NBC) | AH34: Chance of a Lifetime (ABC) | AI34: Bob Considine (NBC) [9:45] Vest Pocket Theater | AJ34: Wrestling by Heidelberg | AL34: TBA; [11:15] Movie [Nite Owl Theater]: Paradise Isle (1937) | AX34: =A34 -> 19613
A35: =A34+7 -> 19620 | K35: What's Cooking? | L35: Ding Dong School (NBC) | M35: TBA | N35: The Big Payoff (NBC) | O35: Welcome Travelers (NBC) | P35: On Your Account (NBC) | Q35: United Nations General Assembly (NBC) | R35: Double or Nothing (CBS) | S35: Strike It Rich (CBS) | T35: Movie [Matinee Theater]: Sing Sing Nights (1934) | V35: [3:15] Search For Tomorrow (CBS) | W35: Love of Life (CBS); [3:45] The Toymaker | X35: Movie [Six-Gun Playhouse]: Western films | Z35: [5:15] Peanut Circus | AA35: TBA; [5:45] Northwest News Digest; [5:55] Alka-Seltzer Newspaper of the Air | AB35: The Gillette Cavalcade of Sports (NBC); [6:45] Camel News Caravan (NBC) | AD35: The Gene Autry Show (CBS) | AE35: You Asked for It (ABC) | AF35: The Big Story (NBC) | AG35: The Goldbergs (NBC) | AH35: Chance of a Lifetime (ABC) | AI35: Bob Considine (NBC) [9:45] Vest Pocket Theater | AJ35: Wrestling by Heidelberg | AL35: TBA; [11:15] Movie [Nite Owl Theater]: Skyway (1933) | AX35: =A35 -> 19620
A36: =A35+7 -> 19627 | K36: What's Cooking? | L36: Ding Dong School (NBC) | M36: TBA | N36: The Big Payoff (NBC) | O36: Welcome Travelers (NBC) | P36: On Your Account (NBC) | Q36: Movie [Matinee Theater]: Kentucky Bluestreak (1935) | S36: Strike It Rich (CBS) | T36: Double or Nothing (CBS) | U36: The Kate Smith Hour (NBC) | V36: [3:15] Search For Tomorrow (CBS) | W36: Love of Life (CBS); [3:45] The Toymaker | X36: Movie [Six-Gun Playhouse]: Western films | Z36: [5:15] Peanut Circus | AA36: TBA; [5:45] Northwest News Digest; [5:55] Alka-Seltzer Newspaper of the Air | AB36: The Gillette Cavalcade of Sports (NBC); [6:45] Camel News Caravan (NBC) | AD36: The Gene Autry Show (CBS) | AE36: You Asked for It (ABC) | AF36: The Big Story (NBC) | AG36: The Goldbergs (NBC) | AH36: TBA | AI36: TBA; [9:45] Vest Pocket Theater | AJ36: Wrestling by Heidelberg | AL36: TBA; [11:15] Movie [Nite Owl Theater]: The Rogue's Tavern (1936) | AX36: =A36 -> 19627
A37: =A36+7 -> 19634 | J37: [9:15] What's Cooking? | K37: [9:45] World Series Baseball: New York Yankees vs. Brooklyn Dodgers (Game 3) (NBC) | P37: [12:15] Ding Dong School (NBC) | Q37: [12:45] Hawkins Falls (NBC) | R37: Movie [Matinee Theater]: TBA | U37: On Your Account (NBC) | V37: The Kate Smith Hour (NBC) | X37: Welcome Travelers (NBC) | Y37: The Toymaker | Z37: Howdy Doody (NBC) | AA37: Peanut Circus; [5:45] TBA | AB37: The Cisco Kid | AC37: TBA; [6:45] Northwest News Digest; [6:50] Spors on View; [6:55] Alka-Seltzer Newspaper of the Air | AD37: The Gillette Cavalcade of Sports (NBC); [7:45] Camel News Caravan (NBC) | AF37: The Dave Garroway Show (NBC) | AG37: Douglas Fairbanks Presents | AH37: The Big Story (NBC) | AI37: You Asked for It (ABC) | AJ37: Heidelberg Wrestling | AL37: News; [11:15] Movie: [Nite Owl Theater]: TBA | AX37: =A37 -> 19634
A46: 1960 | AX46: 1960
A47: 21916 | F47: O.E.A. Presents | G47: Eye Opener | H47: Uncle Charlie's Roundhouse | J47: Tournament of Roses Parade (ABC) | M47: [10:45] Movie [The Early Show]: Androcles and the Lion (1952) | Q47: TBA | R47: Music Bingo (ABC) | S47: Medic | T47: Day in Court (ABC) | U47: Gale Storm (ABC) | V47: Beat the Clock (ABC) | W47: Who Do You Trust? (ABC) | X47: American Bandstand (ABC) | Y47: High Time | Z47: Three Stooges | AA47: Rin Tin Tin (ABC) | AB47: Cartoons--Uncle Charlie; [6:15] News--John Salisbury; [6:25] Sports Roundup--Charlie LaFranchise | AC47: Bold Venture | AD47: San Francisco Beat | AE47: Walt Disney Presents (ABC) | AG47: Man from Blackhawk (ABC) | AH47: 77 Sunset Strip (ABC) | AJ47: The Detectives (ABC) | AK47: Black Saddle (ABC) | AL47: News; [11:15]: Movie [Movie 12]: Hitler's Children (1942) | AX47: =A47 -> 21916
A48: 21923 | F48: O.E.A. Presents | G48: Eye Opener | H48: Uncle Charlie's Roundhouse | J48: Romper Room | K48: Movie [The Early Show]: Fly Away, Baby (1937) | N48: The Better Half | O48: The Life of Riley | P48: Restless Gun (ABC) | Q48: Love That Bob! (ABC) | R48: About Faces (ABC) | S48: Medic | T48: Day in Court (ABC) | U48: Gale Storm (ABC) | V48: Beat the Clock (ABC) | W48: Who Do You Trust? (ABC) | X48: American Bandstand (ABC) | Y48: High Time | Z48: Three Stooges | AA48: Rin Tin Tin (ABC) | AB48: Cartoons--Uncle Charlie; [6:15] News--John Salisbury; [6:25] Sports Roundup--Charlie LaFranchise | AC48: Bold Venture | AD48: San Francisco Beat | AE48: Walt Disney Presents (ABC) | AG48: Man from Blackhawk (ABC) | AH48: 77 Sunset Strip (ABC) | AJ48: The Detectives (ABC) | AK48: Black Saddle (ABC) | AL48: News; [11:15]: Movie [Movie 12]: The Sea Shalt Not Have Them (English, 1954) | AX48: =A48 -> 21923
A49: 21930 | F49: O.E.A. Presents | G49: Eye Opener | H49: Uncle Charlie's Roundhouse | J49: Romper Room | K49: Movie [The Early Show]: Wine, Women and Horses (1937) | N49: The Better Half | O49: The Life of Riley | P49: Restless Gun (ABC) | Q49: Love That Bob! (ABC) | R49: About Faces (ABC) | S49: Medic | T49: Day in Court (ABC) | U49: Gale Storm (ABC) | V49: Beat the Clock (ABC) | W49: Who Do You Trust? (ABC) | X49: American Bandstand (ABC) | Y49: High Time | Z49: Three Stooges | AA49: Rin Tin Tin (ABC) | AB49: Cartoons--Uncle Charlie; [6:15] News--John Salisbury; [6:25] Sports Roundup--Charlie LaFranchise | AC49: Bold Venture | AD49: San Francisco Beat | AE49: Walt Disney Presents (ABC) | AG49: Man from Blackhawk (ABC) | AH49: 77 Sunset Strip (ABC) | AJ49: The Detectives (ABC) | AK49: Black Saddle (ABC) | AL49: News; [11:15]: Movie [Movie 12]: Tycoon (1947) | AX49: =A49 -> 21930
A50: 21937 | F50: O.E.A. Presents | G50: Eye Opener | H50: Uncle Charlie's Roundhouse | J50: Romper Room | K50: Movie [The Early Show]: The Rich are Always with Us (1932) | N50: The Better Half | O50: The Life of Riley | P50: Restless Gun (ABC) | Q50: Love That Bob! (ABC) | R50: About Faces (ABC) | S50: Medic | T50: Day in Court (ABC) | U50: Gale Storm (ABC) | V50: Beat the Clock (ABC) | W50: Who Do You Trust? (ABC) | X50: American Bandstand (ABC) | Y50: High Time | Z50: Three Stooges | AA50: Rin Tin Tin (ABC) | AB50: Cartoons--Uncle Charlie; [6:15] News--John Salisbury | AC50: Bold Venture | AD50: San Francisco Beat | AE50: Walt Disney Presents (ABC) | AG50: Man from Blackhawk (ABC) | AH50: 77 Sunset Strip (ABC) | AJ50: The Detectives (ABC) | AK50: Black Saddle (ABC) | AL50: News; [11:15]: Movie [Movie 12]: Underground (1941) | AX50: =A50 -> 21937
A51: 21944 | F51: O.E.A. Presents | G51: Eye Opener | H51: Uncle Charlie's Roundhouse | J51: Romper Room | K51: Movie [The Early Show]: No Place to Go (1939) | N51: The Better Half | O51: The Life of Riley | P51: Restless Gun (ABC) | Q51: Love That Bob! (ABC) | R51: About Faces (ABC) | S51: Medic | T51: Day in Court (ABC) | U51: Gale Storm (ABC) | V51: Beat the Clock (ABC) | W51: Who Do You Trust? (ABC) | X51: American Bandstand (ABC) | Y51: High Time | Z51: Three Stooges | AA51: Rin Tin Tin (ABC) | AB51: Cartoons--Uncle Charlie; [6:15] News--John Salisbury | AC51: Bold Venture | AD51: San Francisco Beat | AE51: Walt Disney Presents (ABC) | AG51: Man from Blackhawk (ABC) | AH51: 77 Sunset Strip (ABC) | AJ51: The Detectives (ABC) | AK51: Black Saddle (ABC) | AL51: News; [11:15]: Movie [Movie 12]: Torpedo Alley (1953) | AX51: =A51 -> 21944
A52: 21951 | F52: O.E.A. Presents | G52: Eye Opener | H52: Uncle Charlie's Roundhouse | J52: Romper Room | K52: Movie [The Early Show]: Don Juan Quilligan (1945) | N52: The Better Half | O52: The Life of Riley | P52: Restless Gun (ABC) | Q52: Love That Bob! (ABC) | R52: About Faces (ABC) | S52: Medic | T52: Day in Court (ABC) | U52: Gale Storm (ABC) | V52: Beat the Clock (ABC) | W52: Who Do You Trust? (ABC) | X52: American Bandstand (ABC) | Y52: High Time | Z52: Three Stooges | AA52: Rin Tin Tin (ABC) | AB52: Cartoons--Uncle Charlie; [6:15] News--John Salisbury | AC52: Bold Venture | AD52: San Francisco Beat | AE52: Walt Disney Presents (ABC) | AG52: Man from Blackhawk (ABC) | AH52: 77 Sunset Strip (ABC) | AJ52: The Detectives (ABC) | AK52: Black Saddle (ABC) | AL52: News; [11:15]: Movie [Movie 12]: Finger Man (1955) | AX52: =A52 -> 21951
A53: 21958 | F53: O.E.A. Presents | G53: Eye Opener | H53: Uncle Charlie's Roundhouse | J53: Romper Room | K53: Movie [The Early Show]: The Great Rupert (1950) | N53: The Better Half | O53: The Life of Riley | P53: Restless Gun (ABC) | Q53: Love That Bob! (ABC) | R53: About Faces (ABC) | S53: Medic | T53: Day in Court (ABC) | U53: Gale Storm (ABC) | V53: Beat the Clock (ABC) | W53: Who Do You Trust? (ABC) | X53: American Bandstand (ABC) | Y53: High Time | Z53: Three Stooges | AA53: Rin Tin Tin (ABC) | AB53: Cartoons--Uncle Charlie; [6:15] News--John Salisbury | AC53: Bold Venture | AD53: San Francisco Beat | AE53: Walt Disney Presents (ABC) | AG53: Man from Blackhawk (ABC) | AH53: 77 Sunset Strip (ABC) | AJ53: The Detectives (ABC) | AK53: Black Saddle (ABC) | AL53: News; [11:15]: Movie [Movie 12]: One Minute to Zero (1952) | AX53: =A53 -> 21958
A54: 21965 | F54: O.E.A. Presents | G54: Eye Opener | H54: Uncle Charlie's Roundhouse | J54: Romper Room | K54: Movie [The Early Show]: One Last Fling (1949) | N54: The Better Half | O54: Burns and Allen | P54: Restless Gun (ABC) | Q54: Love That Bob! (ABC) | R54: About Faces (ABC) | S54: Medic | T54: Day in Court (ABC) | U54: Gale Storm (ABC) | V54: Beat the Clock (ABC) | W54: Who Do You Trust? (ABC) | X54: American Bandstand (ABC) | Y54: High Time | Z54: Three Stooges | AA54: Rin Tin Tin (ABC) | AB54: Cartoons--Uncle Charlie; [6:15] News--John Salisbury | AC54: Bold Venture | AD54: San Francisco Beat | AE54: Walt Disney Presents (ABC) | AG54: The Citadel (ABC) | AJ54: The Detectives (ABC) | AK54: Black Saddle (ABC) | AL54: News; [11:15]: Movie [Movie 12]: Undercover Man (1949) | AX54: =A54 -> 21965
A55: 21972 | F55: O.E.A. Presents | G55: Eye Opener | H55: Uncle Charlie's Roundhouse | J55: Romper Room | K55: Movie [The Early Show]: The Woman in Question (English; 1944) | N55: The Better Half | O55: Burns and Allen | P55: Restless Gun (ABC) | Q55: Love That Bob! (ABC) | R55: About Faces (ABC) | S55: Medic | T55: Day in Court (ABC) | U55: Gale Storm (ABC) | V55: Beat the Clock (ABC) | W55: Who Do You Trust? (ABC) | X55: American Bandstand (ABC) | Y55: High Time | Z55: Three Stooges | AA55: Rin Tin Tin (ABC) | AB55: Cartoons--Uncle Charlie; [6:15] News--John Salisbury | AC55: Bold Venture | AD55: San Francisco Beat | AE55: Walt Disney Presents (ABC) | AG55: Man from Blackhawk (ABC) | AH55: 77 Sunset Strip (ABC) | AJ55: The Detectives (ABC) | AK55: Black Saddle (ABC) | AL55: News; [11:15]: Movie [Movie 12]: TBA | AX55: =A55 -> 21972
A56: 21979 | F56: O.E.A. Presents | G56: Eye Opener | H56: Uncle Charlie's Roundhouse | J56: Romper Room | K56: Movie [The Early Show]: Dry Rot (English; 1956) | N56: The Better Half | O56: Burns and Allen | P56: Restless Gun (ABC) | Q56: Love That Bob! (ABC) | R56: About Faces (ABC) | S56: Medic | T56: Day in Court (ABC) | U56: Gale Storm (ABC) | V56: Beat the Clock (ABC) | W56: Who Do You Trust? (ABC) | X56: American Bandstand (ABC) | Y56: High Time | Z56: Three Stooges | AA56: Rin Tin Tin (ABC) | AB56: Cartoons--Uncle Charlie; [6:15] News--John Salisbury | AC56: Bold Venture | AD56: San Francisco Beat | AE56: Walt Disney Presents (ABC) | AG56: Man from Blackhawk (ABC) | AH56: 77 Sunset Strip (ABC) | AJ56: The Detectives (ABC) | AK56: Black Saddle (ABC) | AL56: News; [11:15]: Movie [Movie 12]: Mexican Manhunt (1953) | AX56: =A56 -> 21979
A57: 21986 | F57: O.E.A. Presents | G57: Eye Opener | H57: Uncle Charlie's Roundhouse | J57: Romper Room | K57: Movie [The Early Show]: The Cabin in the Cotton (1932) | N57: The Better Half | O57: It's A Great Life | P57: Restless Gun (ABC) | Q57: Love That Bob! (ABC) | R57: About Faces (ABC) | S57: Medic | T57: Day in Court (ABC) | U57: Gale Storm (ABC) | V57: Beat the Clock (ABC) | W57: Who Do You Trust? (ABC) | X57: American Bandstand (ABC) | Y57: High Time | Z57: Three Stooges | AA57: Rin Tin Tin (ABC) | AB57: News Central | AC57: Bold Venture | AD57: San Francisco Beat | AE57: Walt Disney Presents (ABC) | AG57: Man from Blackhawk (ABC) | AH57: 77 Sunset Strip (ABC) | AJ57: The Detectives (ABC) | AK57: Black Saddle (ABC) | AL57: News; [11:15]: Movie [Movie 12]: Son of Fury (1942) | AX57: =A57 -> 21986
A58: 21993 | F58: O.E.A. Presents | G58: Eye Opener | H58: Uncle Charlie's Roundhouse | J58: Romper Room | K58: Movie [The Early Show]: Wings Over Honolulu (1937) | N58: The Better Half | O58: It's A Great Life | P58: Restless Gun (ABC) | Q58: Love That Bob! (ABC) | R58: About Faces (ABC) | S58: Medic | T58: Day in Court (ABC) | U58: Gale Storm (ABC) | V58: Beat the Clock (ABC) | W58: Who Do You Trust? (ABC) | X58: American Bandstand (ABC) | Y58: High Time | Z58: Three Stooges | AA58: Rin Tin Tin (ABC) | AB58: News Central | AC58: Bold Venture | AD58: San Francisco Beat | AE58: Walt Disney Presents (ABC) | AG58: Man from Blackhawk (ABC) | AH58: 77 Sunset Strip (ABC) | AJ58: The Detectives (ABC) | AK58: Black Saddle (ABC) | AL58: News; [11:15]: Movie [Movie 12]: Ten Gentlemen from West Point (1942) | AX58: =A58 -> 21993
A59: 22000 | F59: O.E.A. Presents | G59: Eye Opener | H59: Uncle Charlie's Roundhouse | J59: Romper Room | K59: Movie [The Early Show]: The Face Behind the Mask (1941) | N59: The Better Half | O59: It's A Great Life | P59: Restless Gun (ABC) | Q59: Love That Bob! (ABC) | R59: About Faces (ABC) | S59: Medic | T59: Day in Court (ABC) | U59: Gale Storm (ABC) | V59: Beat the Clock (ABC) | W59: Who Do You Trust? (ABC) | X59: American Bandstand (ABC) | Y59: High Time | Z59: Three Stooges | AA59: Rin Tin Tin (ABC) | AB59: News Central | AC59: Bold Venture | AD59: San Francisco Beat | AE59: Walt Disney Presents (ABC) | AG59: Man from Blackhawk (ABC) | AH59: 77 Sunset Strip (ABC) | AJ59: The Detectives (ABC) | AK59: Black Saddle (ABC) | AL59: News; [11:15]: Movie [Movie 12]: Ruthless (1948) | AX59: =A59 -> 22000
A60: 22007 | F60: O.E.A. Presents | G60: Eye Opener | H60: Uncle Charlie's Roundhouse | J60: Romper Room | K60: Movie [The Early Show]: TBA | N60: The Better Half | O60: It's A Great Life | P60: Restless Gun (ABC) | Q60: Love That Bob! (ABC) | R60: About Faces (ABC) | S60: Medic | T60: Day in Court (ABC) | U60: Gale Storm (ABC) | V60: Beat the Clock (ABC) | W60: Who Do You Trust? (ABC) | X60: American Bandstand (ABC) | Y60: High Time | Z60: Three Stooges | AA60: Rin Tin Tin (ABC) | AB60: News Central | AC60: Union Pacific | AD60: San Francisco Beat | AE60: Walt Disney Presents (ABC) | AG60: Man from Blackhawk (ABC) | AH60: 77 Sunset Strip (ABC) | AJ60: The Detectives (ABC) | AK60: Black Saddle (ABC) | AL60: News; [11:15]: Movie [Movie 12]: TBA | AX60: =A60 -> 22007
A61: 22014 | F61: O.E.A. Presents | G61: Eye Opener | H61: Uncle Charlie's Roundhouse | J61: Romper Room | K61: Movie [The Early Show]: TBA | N61: The Better Half | O61: It's A Great Life | P61: Restless Gun (ABC) | Q61: Love That Bob! (ABC) | R61: About Faces (ABC) | S61: Medic | T61: Day in Court (ABC) | U61: Gale Storm (ABC) | V61: Beat the Clock (ABC) | W61: Who Do You Trust? (ABC) | X61: American Bandstand (ABC) | Y61: High Time | Z61: Three Stooges | AA61: Rin Tin Tin (ABC) | AB61: News Central | AC61: Union Pacific | AD61: San Francisco Beat | AE61: Walt Disney Presents (ABC) | AG61: Man from Blackhawk (ABC) | AH61: 77 Sunset Strip (ABC) | AJ61: The Detectives (ABC) | AK61: Black Saddle (ABC) | AL61: News; [11:15]: Movie [Movie 12]: TBA | AX61: =A61 -> 22014
A62: 22021 | F62: O.E.A. Presents | G62: Eye Opener | H62: Uncle Charlie's Roundhouse | J62: Romper Room | K62: Movie [The Early Show]: TBA | N62: The Better Half | O62: It's A Great Life | P62: Restless Gun (ABC) | Q62: Love That Bob! (ABC) | R62: About Faces (ABC) | S62: Medic | T62: Day in Court (ABC) | U62: Gale Storm (ABC) | V62: Beat the Clock (ABC) | W62: Who Do You Trust? (ABC) | X62: American Bandstand (ABC) | Y62: High Time | Z62: Three Stooges | AA62: Rin Tin Tin (ABC) | AB62: News Central | AC62: Union Pacific | AD62: San Francisco Beat | AE62: Walt Disney Presents (ABC) | AG62: Man from Blackhawk (ABC) | AH62: 77 Sunset Strip (ABC) | AJ62: The Detectives (ABC) | AK62: Black Saddle (ABC) | AL62: News; [11:15]: Movie [Movie 12]: The Steel Cage (1954) | AX62: =A62 -> 22021
A63: 22028 | F63: O.E.A. Presents | G63: Eye Opener | H63: Uncle Charlie's Roundhouse | J63: Romper Room | K63: Movie [The Early Show]: Stranger on Horseback (1955) | N63: The Better Half | O63: It's A Great Life | P63: Restless Gun (ABC) | Q63: Love That Bob! (ABC) | R63: About Faces (ABC) | S63: Medic | T63: Day in Court (ABC) | U63: Gale Storm (ABC) | V63: Beat the Clock (ABC) | W63: Who Do You Trust? (ABC) | X63: American Bandstand (ABC) | Y63: High Time | Z63: Three Stooges | AA63: Rin Tin Tin (ABC) | AB63: News Central | AC63: Union Pacific | AD63: San Francisco Beat | AE63: Walt Disney Presents (ABC) | AG63: Man from Blackhawk (ABC) | AH63: 77 Sunset Strip (ABC) | AJ63: The Detectives (ABC) | AK63: Black Saddle (ABC) | AL63: News; [11:15]: Movie [Movie 12]: TBA | AX63: =A63 -> 22028
B64: OTHER CITIES SWITCH TO DAYLIGHT SAVINGS TIME; PORTLAND SHOWS AIR ONE HOUR EARLIER | J64: OTHER CITIES SWITCH TO DAYLIGHT SAVINGS TIME; PORTLAND SHOWS AIR ONE HOUR EARLIER | R64: OTHER CITIES SWITCH TO DAYLIGHT SAVINGS TIME; PORTLAND SHOWS AIR ONE HOUR EARLIER | Z64: OTHER CITIES SWITCH TO DAYLIGHT SAVINGS TIME; PORTLAND SHOWS AIR ONE HOUR EARLIER | AH64: OTHER CITIES SWITCH TO DAYLIGHT SAVINGS TIME; PORTLAND SHOWS AIR ONE HOUR EARLIER | AP64: OTHER CITIES SWITCH TO DAYLIGHT SAVINGS TIME; PORTLAND SHOWS AIR ONE HOUR EARLIER
A65: 22035 | F65: O.E.A. Presents | G65: Eye Opener | H65: Uncle Charlie's Roundhouse | J65: Romper Room | K65: Burns and Allen | L65: Rosemary Clooney | M65: The Better Half | N65: Restless Gun (ABC) | O65: Love That Bob! (ABC) | P65: About Faces (ABC) | Q65: Medic | R65: Day in Court (ABC) | S65: Gale Storm (ABC) | T65: Beat the Clock (ABC) | U65: Who Do You Trust? (ABC) | V65: American Bandstand (ABC) | W65: High Time | X65: Uncle Charlie's Den | Z65: Three Stooges | AA65: Rin Tin Tin (ABC) | AB65: News Central | AC65: Walt Disney Presents (ABC) | AE65: Man from Blackhawk (ABC) | AF65: 77 Sunset Strip (ABC) | AH65: The Detectives (ABC) | AI65: Black Saddle (ABC) | AJ65: Union Pacific | AK65: Decoy | AL65: News--John Salisbury; [11:15]: Movie [Movie 12]: The Spanish Main (1945) | AX65: =A65 -> 22035
A66: 22042 | F66: O.E.A. Presents | G66: Eye Opener | H66: Uncle Charlie's Roundhouse | J66: Romper Room | K66: Burns and Allen | L66: Rosemary Clooney | M66: The Better Half | N66: Restless Gun (ABC) | O66: Love That Bob! (ABC) | P66: About Faces (ABC) | Q66: Medic | R66: Day in Court (ABC) | S66: Gale Storm (ABC) | T66: Beat the Clock (ABC) | U66: Who Do You Trust? (ABC) | V66: American Bandstand (ABC) | W66: High Time | X66: Uncle Charlie's Den | Z66: Three Stooges | AA66: Rin Tin Tin (ABC) | AB66: News Central | AC66: Walt Disney Presents (ABC) | AE66: Man from Blackhawk (ABC) | AF66: 77 Sunset Strip (ABC) | AH66: The Detectives (ABC) | AI66: Black Saddle (ABC) | AJ66: Union Pacific | AK66: Decoy | AL66: News--John Salisbury; [11:15]: Movie [Movie 12]: Bengazi (1955) | AX66: =A66 -> 22042
A67: 22049 | F67: O.E.A. Presents | G67: Eye Opener | H67: Uncle Charlie's Roundhouse | J67: Romper Room | K67: Burns and Allen | L67: Rosemary Clooney | M67: The Better Half | N67: Restless Gun (ABC) | O67: Love That Bob! (ABC) | P67: About Faces (ABC) | Q67: Medic | R67: Day in Court (ABC) | S67: Gale Storm (ABC) | T67: Beat the Clock (ABC) | U67: Who Do You Trust? (ABC) | V67: American Bandstand (ABC) | W67: High Time | X67: Uncle Charlie's Den | Z67: Three Stooges | AA67: Rin Tin Tin (ABC) | AB67: News Central | AC67: Walt Disney Presents (ABC) | AE67: Man from Blackhawk (ABC) | AF67: 77 Sunset Strip (ABC) | AH67: The Detectives (ABC) | AI67: Black Saddle (ABC) | AJ67: Union Pacific | AK67: Decoy | AL67: News--John Salisbury; [11:15]: Movie [Movie 12]: The Set-Up (1949) | AX67: =A67 -> 22049
A68: 22056 | F68: O.E.A. Presents | G68: Eye Opener | H68: Uncle Charlie's Roundhouse | J68: Romper Room | K68: Burns and Allen | L68: Rosemary Clooney | M68: The Better Half | N68: Restless Gun (ABC) | O68: Love That Bob! (ABC) | P68: About Faces (ABC) | Q68: Medic | R68: Day in Court (ABC) | S68: Gale Storm (ABC) | T68: Beat the Clock (ABC) | U68: Who Do You Trust? (ABC) | V68: American Bandstand (ABC) | W68: High Time | X68: Uncle Charlie's Den | Z68: Three Stooges | AA68: Rin Tin Tin (ABC) | AB68: News Central | AC68: Walt Disney Presents (ABC) | AE68: Man from Blackhawk (ABC) | AF68: 77 Sunset Strip (ABC) | AH68: The Detectives (ABC) | AI68: Black Saddle (ABC) | AJ68: Union Pacific | AK68: Decoy | AL68: News--John Salisbury; [11:15]: Movie [Movie 12]: Riffraff (1948) | AX68: =A68 -> 22056
A69: 22063 | F69: O.E.A. Presents | G69: Eye Opener | H69: Uncle Charlie's Roundhouse | J69: Romper Room | K69: Burns and Allen | L69: Rosemary Clooney | M69: The Better Half | N69: Restless Gun (ABC) | O69: Love That Bob! (ABC) | P69: About Faces (ABC) | Q69: Medic | R69: Day in Court (ABC) | S69: Gale Storm (ABC) | T69: Beat the Clock (ABC) | U69: Who Do You Trust? (ABC) | V69: American Bandstand (ABC) | W69: High Time | X69: Uncle Charlie's Den | Z69: Three Stooges | AA69: Rin Tin Tin (ABC) | AB69: News Central | AC69: Walt Disney Presents (ABC) | AE69: Man from Blackhawk (ABC) | AF69: 77 Sunset Strip (ABC) | AH69: The Detectives (ABC) | AI69: Black Saddle (ABC) | AJ69: Union Pacific | AK69: Decoy | AL69: News--John Salisbury; [11:15]: Movie [Movie 12]: Back From Eternity (1956) | AX69: =A69 -> 22063
A71: 22077 | F71: O.E.A. Presents | G71: Eye Opener | H71: Uncle Charlie's Roundhouse | J71: Romper Room | K71: Burns and Allen | L71: Rosemary Clooney | M71: The Better Half | N71: Restless Gun (ABC) | O71: Love That Bob! (ABC) | P71: About Faces (ABC) | Q71: Medic | R71: Day in Court (ABC) | S71: Gale Storm (ABC) | T71: Beat the Clock (ABC) | U71: Who Do You Trust? (ABC) | V71: American Bandstand (ABC) | W71: High Time | X71: Uncle Charlie's Den | Z71: Three Stooges | AA71: Rin Tin Tin (ABC) | AB71: News Central | AC71: Walt Disney Presents (ABC) | AE71: Man from Blackhawk (ABC) | AF71: 77 Sunset Strip (ABC) | AH71: The Detectives (ABC) | AI71: Black Saddle (ABC) | AJ71: Union Pacific | AK71: Decoy | AL71: News--John Salisbury; [11:15]: Movie [Movie 12]: The House on 92nd Street (1945) | AX71: =A71 -> 22077
A72: 22084 | F72: O.E.A. Presents | G72: Eye Opener | H72: Uncle Charlie's Roundhouse | J72: Romper Room | K72: Burns and Allen | L72: Rosemary Clooney | M72: The Better Half | N72: Restless Gun (ABC) | O72: Love That Bob! (ABC) | P72: About Faces (ABC) | Q72: Medic | R72: Day in Court (ABC) | S72: Gale Storm (ABC) | T72: Beat the Clock (ABC) | U72: Who Do You Trust? (ABC) | V72: American Bandstand (ABC) | W72: High Time | X72: Uncle Charlie's Den | Z72: Three Stooges | AA72: Rin Tin Tin (ABC) | AB72: News Central | AC72: Walt Disney Presents (ABC) | AE72: Man from Blackhawk (ABC) | AF72: 77 Sunset Strip (ABC) | AH72: The Detectives (ABC) | AI72: Black Saddle (ABC) | AJ72: Union Pacific | AK72: Decoy | AL72: News--John Salisbury; [11:15]: Movie [Movie 12]: Undercover Man (1949) | AX72: =A72 -> 22084
A73: 22091 | F73: O.E.A. Presents | G73: Eye Opener | H73: Uncle Charlie's Roundhouse | J73: Romper Room | K73: Burns and Allen | L73: Rosemary Clooney | M73: The Better Half | N73: Restless Gun (ABC) | O73: Love That Bob! (ABC) | P73: About Faces (ABC) | Q73: Medic | R73: Day in Court (ABC) | S73: Gale Storm (ABC) | T73: Beat the Clock (ABC) | U73: Who Do You Trust? (ABC) | V73: American Bandstand (ABC) | W73: High Time | X73: Uncle Charlie's Den | Z73: Three Stooges | AA73: Rin Tin Tin (ABC) | AB73: News Central | AC73: Walt Disney Presents (ABC) | AE73: Man from Blackhawk (ABC) | AF73: 77 Sunset Strip (ABC) | AH73: The Detectives (ABC) | AI73: Black Saddle (ABC) | AJ73: Union Pacific | AK73: Decoy | AL73: News--John Salisbury; [11:15]: Movie [Movie 12]: Flying Leathernecks (1951) | AX73: =A73 -> 22091
A74: 22098 | F74: O.E.A. Presents | G74: Eye Opener | H74: Uncle Charlie's Roundhouse | J74: Romper Room | K74: It's a Great Life | L74: Rosemary Clooney | M74: The Better Half | N74: Restless Gun (ABC) | O74: Love That Bob! (ABC) | P74: About Faces (ABC) | Q74: Medic | R74: Day in Court (ABC) | S74: Gale Storm (ABC) | T74: Beat the Clock (ABC) | U74: Who Do You Trust? (ABC) | V74: American Bandstand (ABC) | W74: High Time | X74: Uncle Charlie's Den | Z74: Three Stooges | AA74: Rin Tin Tin (ABC) | AB74: News Central | AC74: Walt Disney Presents (ABC) | AE74: Man from Blackhawk (ABC) | AF74: 77 Sunset Strip (ABC) | AH74: The Detectives (ABC) | AI74: Black Saddle (ABC) | AJ74: Union Pacific | AK74: Decoy | AL74: News--John Salisbury; [11:15]: Movie [Movie 12]: Under Capricorn (1949) | AX74: =A74 -> 22098
A75: 22105 | F75: O.E.A. Presents | G75: Eye Opener | H75: Uncle Charlie's Roundhouse | J75: Romper Room | K75: It's a Great Life | L75: Rosemary Clooney | M75: The Better Half | N75: Restless Gun (ABC) | O75: Love That Bob! (ABC) | P75: About Faces (ABC) | Q75: Medic | R75: Day in Court (ABC) | S75: Gale Storm (ABC) | T75: Beat the Clock (ABC) | U75: Who Do You Trust? (ABC) | V75: American Bandstand (ABC) | W75: High Time | X75: Uncle Charlie's Den | Z75: Three Stooges | AA75: Rin Tin Tin (ABC) | AB75: News Central | AC75: Walt Disney Presents (ABC) | AE75: Man from Blackhawk (ABC) | AF75: 77 Sunset Strip (ABC) | AH75: The Detectives (ABC) | AI75: Black Saddle (ABC) | AJ75: Union Pacific | AK75: Decoy | AL75: News--John Salisbury; [11:15]: Movie [Movie 12]: The Street with No Name (1948) | AX75: =A75 -> 22105
A77: 22119 | F77: O.E.A. Presents | G77: Eye Opener | H77: Uncle Charlie's Roundhouse | J77: Romper Room | K77: It's a Great Life | L77: Rosemary Clooney | M77: The Better Half | N77: Restless Gun (ABC) | O77: Love That Bob! (ABC) | P77: About Faces (ABC) | Q77: Medic | R77: Day in Court (ABC) | S77: Gale Storm (ABC) | T77: Beat the Clock (ABC) | U77: Who Do You Trust? (ABC) | V77: American Bandstand (ABC) | W77: High Time | X77: Uncle Charlie's Den | Z77: Three Stooges | AA77: Rin Tin Tin (ABC) | AB77: News Central | AC77: Walt Disney Presents (ABC) | AE77: Man from Blackhawk (ABC) | AF77: 77 Sunset Strip (ABC) | AH77: The Detectives (ABC) | AI77: Black Saddle (ABC) | AJ77: Union Pacific | AK77: Decoy | AL77: News--John Salisbury; [11:15]: Movie [Movie 12]: Rancho Notorious (1952) | AX77: =A77 -> 22119
A78: 22126 | F78: O.E.A. Presents | G78: Eye Opener | H78: Uncle Charlie's Roundhouse | J78: Romper Room | K78: It's a Great Life | L78: Rosemary Clooney | M78: The Better Half | N78: Restless Gun (ABC) | O78: Love That Bob! (ABC) | P78: About Faces (ABC) | Q78: Medic | R78: Day in Court (ABC) | S78: Gale Storm (ABC) | T78: Beat the Clock (ABC) | U78: Who Do You Trust? (ABC) | V78: American Bandstand (ABC) | W78: High Time | X78: Uncle Charlie's Den | Z78: Three Stooges | AA78: Rin Tin Tin (ABC) | AB78: News Central | AC78: Walt Disney Presents (ABC) | AE78: Man from Blackhawk (ABC) | AF78: 77 Sunset Strip (ABC) | AH78: The Detectives (ABC) | AI78: Black Saddle (ABC) | AJ78: Union Pacific | AK78: Decoy | AL78: News--John Salisbury; [11:15]: Movie [Movie 12]: Beachhead (1953) | AX78: =A78 -> 22126
A79: 22133 | F79: O.E.A. Presents | G79: Eye Opener | H79: Uncle Charlie's Roundhouse | J79: Romper Room | K79: It's a Great Life | L79: Rosemary Clooney | M79: The Better Half | N79: Restless Gun (ABC) | O79: Love That Bob! (ABC) | P79: About Faces (ABC) | Q79: Medic | R79: Day in Court (ABC) | S79: Gale Storm (ABC) | T79: Beat the Clock (ABC) | U79: Who Do You Trust? (ABC) | V79: American Bandstand (ABC) | W79: High Time | X79: Uncle Charlie's Den | Z79: Three Stooges | AA79: Rin Tin Tin (ABC) | AB79: News Central | AC79: Walt Disney Presents (ABC) | AE79: Man from Blackhawk (ABC) | AF79: 77 Sunset Strip (ABC) | AH79: The Detectives (ABC) | AI79: Black Saddle (ABC) | AJ79: Union Pacific | AK79: Decoy | AL79: News--John Salisbury; [11:15]: Movie [Movie 12]: Best of the Badmen (1951) | AX79: =A79 -> 22133
A80: 22140 | F80: O.E.A. Presents | G80: Eye Opener | H80: Uncle Charlie's Roundhouse | J80: Romper Room | K80: It's a Great Life | L80: Rosemary Clooney | M80: The Better Half | N80: Restless Gun (ABC) | O80: Love That Bob! (ABC) | P80: About Faces (ABC) | Q80: Medic | R80: Day in Court (ABC) | S80: Gale Storm (ABC) | T80: Beat the Clock (ABC) | U80: Who Do You Trust? (ABC) | V80: American Bandstand (ABC) | W80: High Time | X80: Uncle Charlie's Den | Z80: Three Stooges | AA80: Rin Tin Tin (ABC) | AB80: Football (ABC) Baltimore Colts vs. All Stars | AF80: 77 Sunset Strip (ABC) | AH80: TBA | AI80: TBA | AJ80: Union Pacific | AK80: Decoy | AL80: News--John Salisbury; [11:15]: Movie [Movie 12]: Kiss Me Deadlyi (1955) | AX80: =A80 -> 22140
A81: 22147 | F81: O.E.A. Presents | G81: Eye Opener | H81: Uncle Charlie's Roundhouse | J81: Romper Room | K81: It's a Great Life | L81: Abbott and Costello | M81: The Better Half | N81: Restless Gun (ABC) | O81: Love That Bob! (ABC) | P81: About Faces (ABC) | Q81: Medic | R81: Day in Court (ABC) | S81: Gale Storm (ABC) | T81: Beat the Clock (ABC) | U81: Who Do You Trust? (ABC) | V81: American Bandstand (ABC) | W81: High Time | X81: Uncle Charlie's Den | Z81: Three Stooges | AA81: Rin Tin Tin (ABC) | AB81: News Central | AC81: Walt Disney Presents (ABC) | AE81: Man from Blackhawk (ABC) | AF81: 77 Sunset Strip (ABC) | AH81: The Detectives (ABC) | AI81: Black Saddle (ABC) | AJ81: Union Pacific | AK81: Decoy | AL81: News--John Salisbury; [11:15]: Movie [Movie 12]: Southwest Passage (1954) | AX81: =A81 -> 22147
A82: 22154 | F82: O.E.A. Presents | G82: Eye Opener | H82: Uncle Charlie's Roundhouse | J82: Romper Room | K82: It's a Great Life | L82: Abbott and Costello | M82: The Better Half | N82: Restless Gun (ABC) | O82: Love That Bob! (ABC) | P82: About Faces (ABC) | Q82: Medic | R82: Day in Court (ABC) | S82: Gale Storm (ABC) | T82: Beat the Clock (ABC) | U82: Who Do You Trust? (ABC) | V82: American Bandstand (ABC) | W82: High Time | X82: Uncle Charlie's Den | Z82: Three Stooges | AA82: Rin Tin Tin (ABC) | AB82: News Central | AC82: Walt Disney Presents (ABC) | AE82: Man from Blackhawk (ABC) | AF82: 77 Sunset Strip (ABC) | AH82: The Detectives (ABC) | AI82: Black Saddle (ABC) | AJ82: Union Pacific | AK82: Decoy | AL82: News--John Salisbury; [11:15]: Movie [Movie 12]: The Steel Lady (1953) | AX82: =A82 -> 22154
A83: 22161 | F83: O.E.A. Presents | G83: Eye Opener | H83: Uncle Charlie's Roundhouse | J83: Romper Room | K83: It's a Great Life | L83: Abbott and Costello | M83: The Better Half | N83: Restless Gun (ABC) | O83: Love That Bob! (ABC) | P83: About Faces (ABC) | Q83: Medic | R83: Day in Court (ABC) | S83: Gale Storm (ABC) | T83: Beat the Clock (ABC) | U83: Who Do You Trust? (ABC) | V83: American Bandstand (ABC) | W83: High Time | X83: Uncle Charlie's Den | Z83: Three Stooges | AA83: Rin Tin Tin (ABC) | AB83: News Central | AC83: Walt Disney Presents (ABC) | AE83: Man from Blackhawk (ABC) | AF83: 77 Sunset Strip (ABC) | AH83: The Detectives (ABC) | AI83: Black Saddle (ABC) | AJ83: Union Pacific | AK83: Western Square Dance | AL83: News--John Salisbury; [11:15]: Movie [Movie 12]: Cash on Delivery (English; 1956) | AX83: =A83 -> 22161
A84: 22168 | F84: O.E.A. Presents | G84: Eye Opener | H84: Uncle Charlie's Roundhouse | J84: Romper Room | K84: It's a Great Life | L84: Abbott and Costello | M84: The Better Half | N84: Restless Gun (ABC) | O84: Queen for a Day (1960) | P84: About Faces (ABC) | Q84: Medic | R84: Day in Court (ABC) | S84: Gale Storm (ABC) | T84: Beat the Clock (ABC) | U84: Who Do You Trust? (ABC) | V84: American Bandstand (ABC) | W84: High Time | X84: Uncle Charlie's Den | Z84: Three Stooges | AA84: Rin Tin Tin (ABC) | AB84: News Central | AC84: Walt Disney Presents (ABC) | AE84: Man from Blackhawk (ABC) | AF84: 77 Sunset Strip (ABC) | AH84: The Detectives (ABC) | AI84: Black Saddle (ABC) | AJ84: Union Pacific | AK84: Western Square Dance | AL84: News--John Salisbury; [11:15]: Movie [Movie 12]: Pacific Adventure (1947) | AX84: =A84 -> 22168
A85: 22175 | F85: O.E.A. Presents | G85: Eye Opener | H85: Uncle Charlie's Roundhouse | J85: Romper Room | K85: It's a Great Life | L85: Abbott and Costello | M85: The Better Half | N85: Restless Gun (ABC) | O85: Queen for a Day (1960) | P85: About Faces (ABC) | Q85: Medic | R85: Day in Court (ABC) | S85: Gale Storm (ABC) | T85: Beat the Clock (ABC) | U85: Who Do You Trust? (ABC) | V85: American Bandstand (ABC) | W85: High Time | X85: Uncle Charlie's Den | Z85: Three Stooges | AA85: Rin Tin Tin (ABC) | AB85: News Central | AC85: Walt Disney Presents (ABC) | AE85: Man from Blackhawk (ABC) | AF85: 77 Sunset Strip (ABC) | AH85: The Detectives (ABC) | AI85: Black Saddle (ABC) | AJ85: Union Pacific | AK85: Western Square Dance | AL85: News--John Salisbury; [11:15]: Movie [Movie 12]: This Thing Called Love (1941) | AX85: =A85 -> 22175
A86: 22182 | F86: O.E.A. Presents | G86: Eye Opener | H86: Uncle Charlie's Roundhouse | J86: Romper Room | K86: It's a Great Life | L86: Abbott and Costello | M86: The Better Half | N86: Restless Gun (ABC) | O86: Queen for a Day (1960) | P86: About Faces (ABC) | Q86: Medic | R86: Day in Court (ABC) | S86: Gale Storm (ABC) | T86: Beat the Clock (ABC) | U86: Who Do You Trust? (ABC) | V86: American Bandstand (ABC) | W86: High Time | X86: Uncle Charlie's Den | Z86: Three Stooges | AA86: Rin Tin Tin (ABC) | AB86: News Central | AC86: Walt Disney Presents (ABC) | AE86: Man from Blackhawk (ABC) | AF86: 77 Sunset Strip (ABC) | AH86: The Detectives (ABC) | AI86: Black Saddle (ABC) | AJ86: Union Pacific | AK86: Western Square Dance | AL86: News--John Salisbury; [11:15]: Movie [Movie 12]: The Well-Groomed Bride (1946) | AX86: =A86 -> 22182
B87: OTHER CITIES SWITCH TO STANDARD TIME; PORTLAND SHOWS AIR ONE HOUR LATER | J87: OTHER CITIES SWITCH TO STANDARD TIME; PORTLAND SHOWS AIR ONE HOUR LATER | R87: OTHER CITIES SWITCH TO STANDARD TIME; PORTLAND SHOWS AIR ONE HOUR LATER | Z87: OTHER CITIES SWITCH TO STANDARD TIME; PORTLAND SHOWS AIR ONE HOUR LATER | AH87: OTHER CITIES SWITCH TO STANDARD TIME; PORTLAND SHOWS AIR ONE HOUR LATER | AP87: OTHER CITIES SWITCH TO STANDARD TIME; PORTLAND SHOWS AIR ONE HOUR LATER
A88: 11231 | F88: O.E.A. Presents | G88: Eye Opener | H88: Uncle Charlie's Roundhouse | J88: Romper Room | K88: The Better Half | L88: It's a Great Life | M88: Medic | N88: Court U.S.A. | O88: The Life of Riley | P88: Restless Gun (ABC) | Q88: Queen for a Day (ABC) | R88: About Faces (ABC) | S88: Citizen Soldier | T88: Day in Court (ABC) | U88: Gale Storm (ABC) | V88: Beat the Clock (ABC) | W88: Who Do You Trust? (ABC) | X88: American Bandstand (ABC) | Y88: Uncle Charlie's Den | Z88: Three Stooges | AA88: Rin Tin Tin (ABC) | AB88: Topper | AC88: News Central | AD88: The Pioneers | AE88: Matty's Funday Funnies (ABC) | AF88: Flight | AG88: The Flintstones (ABC) | AH88: 77 Sunset Strip (ABC) | AJ88: The Detectives (ABC) | AK88: Black Saddle (ABC) | AL88: News; [11:15]: Movie [Movie 12]: Desert Fury (1947) | AX88: =A88 -> 11231
A89: 22196 | F89: O.E.A. Presents | G89: Eye Opener | H89: Uncle Charlie's Roundhouse | J89: Romper Room | K89: The Better Half | L89: It's a Great Life | M89: Medic | N89: Court U.S.A. | O89: The Life of Riley | P89: The Texan (ABC) | Q89: Queen for a Day (ABC) | R89: About Faces (ABC) | S89: Citizen Soldier | T89: Day in Court (ABC) | U89: Gale Storm (ABC) | V89: Beat the Clock (ABC) | W89: Who Do You Trust? (ABC) | X89: American Bandstand (ABC) | Y89: Uncle Charlie's Den | Z89: Three Stooges | AA89: Rin Tin Tin (ABC) | AB89: Topper | AC89: News Central | AD89: The Pioneers | AE89: Nixon-Kennedy Presidential Debate (ABC) [Special] | AG89: The Flintstones (ABC) | AH89: 77 Sunset Strip (ABC) | AJ89: The Detectives (ABC) | AK89: The Law and Mr. Jones (ABC) | AL89: News; [11:15]: Movie [Movie 12]: The Ghost Breakers (1940) | AX89: =A89 -> 22196
A90: 22203 | F90: O.E.A. Presents | G90: Eye Opener | H90: Uncle Charlie's Roundhouse | J90: Romper Room | K90: The Better Half | L90: It's a Great Life | M90: Medic | N90: Morning Court (ABC) | O90: Love That Bob! (ABC) | P90: The Texan (ABC) | Q90: Queen for a Day (ABC) | R90: About Faces (ABC) | S90: Citizen Soldier | T90: Day in Court (ABC) | U90: Road to Reality (ABC) | V90: Beat the Clock (ABC) | W90: Who Do You Trust? (ABC) | X90: American Bandstand (ABC) | Y90: Uncle Charlie's Den | Z90: Three Stooges | AA90: Rin Tin Tin (ABC) | AB90: Topper | AC90: News Central | AD90: The Pioneers | AE90: Matty's Funday Funnies (ABC) | AF90: Harrigan and Son (ABC) | AG90: The Flintstones (ABC) | AH90: 77 Sunset Strip (ABC) | AJ90: The Detectives (ABC) | AK90: The Law and Mr. Jones (ABC) | AL90: News; [11:15]: Movie [Movie 12]: The Bride Wore Boots (1946) | AX90: =A90 -> 22203
A91: 22210 | F91: O.E.A. Presents | G91: Eye Opener | H91: Uncle Charlie's Roundhouse | J91: Romper Room | K91: The Better Half | L91: It's a Great Life | M91: Medic | N91: Morning Court (ABC) | O91: Love That Bob! (ABC) | P91: The Texan (ABC) | Q91: Queen for a Day (ABC) | R91: About Faces (ABC) | S91: Citizen Soldier | T91: Day in Court (ABC) | U91: Road to Reality (ABC) | V91: Beat the Clock (ABC) | W91: Who Do You Trust? (ABC) | X91: American Bandstand (ABC) | Y91: Uncle Charlie's Den | Z91: Three Stooges | AA91: Rin Tin Tin (ABC) | AB91: Topper | AC91: News Central | AD91: The Pioneers | AE91: Matty's Funday Funnies (ABC) | AF91: Harrigan and Son (ABC) | AG91: The Flintstones (ABC) | AH91: 77 Sunset Strip (ABC) | AJ91: Nixon-Kennedy Presidential Debate (ABC) [Special] | AL91: News; [11:15]: Movie [Movie 12]: Hazard (1948) | AX91: =A91 -> 22210
A92: 22217 | F92: O.E.A. Presents | G92: Eye Opener | H92: Uncle Charlie's Roundhouse | J92: Romper Room | K92: The Better Half | L92: It's a Great Life | M92: Medic | N92: Morning Court (ABC) | O92: Love That Bob! (ABC) | P92: The Texan (ABC) | Q92: Queen for a Day (ABC) | R92: About Faces (ABC) | S92: Citizen Soldier | T92: Day in Court (ABC) | U92: Road to Reality (ABC) | V92: Beat the Clock (ABC) | W92: Who Do You Trust? (ABC) | X92: American Bandstand (ABC) | Y92: Uncle Charlie's Den | Z92: Three Stooges | AA92: Rin Tin Tin (ABC) | AB92: Topper | AC92: News Central | AD92: The Pioneers | AE92: Matty's Funday Funnies (ABC) | AF92: Harrigan and Son (ABC) | AG92: The Flintstones (ABC) | AH92: 77 Sunset Strip (ABC) | AJ92: The Detectives (ABC) | AK92: The Law and Mr. Jones (ABC) | AL92: News; [11:15]: Movie [Movie 12]: Calcutta (1947) | AX92: =A92 -> 22217
A93: 22224 | F93: O.E.A. Presents | G93: Eye Opener | H93: Uncle Charlie's Roundhouse | J93: Romper Room | K93: The Better Half | L93: It's a Great Life | M93: Medic | N93: Morning Court (ABC) | O93: Love That Bob! (ABC) | P93: The Texan (ABC) | Q93: Queen for a Day (ABC); [12:55] Political Talk--Democratic | R93: About Faces (ABC) | S93: Citizen Soldier | T93: Day in Court (ABC); [2:25] Political Talk--Republican | U93: Road to Reality (ABC) | V93: Beat the Clock (ABC) | W93: Who Do You Trust? (ABC) | X93: American Bandstand (ABC) | Y93: Uncle Charlie's Den | Z93: Three Stooges | AA93: Rin Tin Tin (ABC) | AB93: Topper | AC93: News Central | AD93: The Pioneers | AE93: Matty's Funday Funnies (ABC) | AF93: Harrigan and Son (ABC) | AG93: The Flintstones (ABC) | AH93: 77 Sunset Strip (ABC) | AJ93: The Detectives (ABC) | AK93: The Law and Mr. Jones (ABC) | AL93: News; [11:15]: Movie [Movie 12]: And Now Tomorror (1944) | AX93: =A93 -> 22224
A94: 22231 | F94: O.E.A. Presents | G94: Eye Opener | H94: Uncle Charlie's Roundhouse | J94: Romper Room | K94: The Better Half | L94: It's a Great Life | M94: Medic | N94: Morning Court (ABC) | O94: Love That Bob! (ABC) | P94: The Texan (ABC) | Q94: Queen for a Day (ABC) | R94: About Faces (ABC) | S94: Citizen Soldier | T94: Day in Court (ABC) | U94: Road to Reality (ABC) | V94: Beat the Clock (ABC) | W94: Who Do You Trust? (ABC) | X94: American Bandstand (ABC) | Y94: Uncle Charlie's Den | Z94: Three Stooges | AA94: Rin Tin Tin (ABC) | AB94: Topper | AC94: News Central | AD94: The Pioneers | AE94: Matty's Funday Funnies (ABC) | AF94: Harrigan and Son (ABC) | AG94: The Flintstones (ABC) | AH94: 77 Sunset Strip (ABC) | AJ94: The Detectives (ABC) | AK94: The Law and Mr. Jones (ABC) | AL94: News; [11:15]: Movie [Movie 12]: Our Hearts Were Young and Gay (1944) | AX94: =A94 -> 22231
A95: 22238 | F95: O.E.A. Presents | G95: Eye Opener | H95: Uncle Charlie's Roundhouse | J95: Romper Room | K95: The Better Half | L95: It's a Great Life | M95: Medic | N95: Morning Court (ABC) | O95: Love That Bob! (ABC) | P95: The Texan (ABC) | Q95: Beat the Clock (ABC) | R95: About Faces (ABC) | S95: Citizen Soldier | T95: Day in Court (ABC) | U95: Road to Reality (ABC) | V95: Queen for a Day (ABC) | W95: Who Do You Trust? (ABC) | X95: American Bandstand (ABC) | Y95: Uncle Charlie's Den | Z95: Three Stooges | AA95: Rin Tin Tin (ABC) | AB95: Topper | AC95: News Central | AD95: The Pioneers | AE95: Matty's Funday Funnies (ABC) | AF95: Harrigan and Son (ABC) | AG95: The Flintstones (ABC) | AH95: 77 Sunset Strip (ABC) | AJ95: The Detectives (ABC) | AK95: The Law and Mr. Jones (ABC) | AL95: News; [11:15]: Movie [Movie 12]: The Palm Beach Story (1942) | AX95: =A95 -> 22238
A96: 22245 | F96: O.E.A. Presents | G96: Eye Opener | H96: Uncle Charlie's Roundhouse | J96: Romper Room | K96: The Better Half | L96: It's a Great Life | M96: Medic | N96: Morning Court (ABC) | O96: Love That Bob! (ABC) | P96: The Texan (ABC) | Q96: Beat the Clock (ABC) | R96: About Faces (ABC) | S96: Citizen Soldier | T96: Day in Court (ABC) | U96: Road to Reality (ABC) | V96: Queen for a Day (ABC) | W96: Who Do You Trust? (ABC) | X96: American Bandstand (ABC) | Y96: Uncle Charlie's Den | Z96: Three Stooges | AA96: Rin Tin Tin (ABC) | AB96: Holiday Playhouse [Special] | AC96: News Central | AD96: The Pioneers | AE96: Matty's Funday Funnies (ABC) | AF96: Close-Up (ABC) [Special] | AG96: The Flintstones (ABC) | AH96: 77 Sunset Strip (ABC) | AJ96: The Detectives (ABC) | AK96: The Law and Mr. Jones (ABC) | AL96: News; [11:15]: Movie [Movie 12]: The Night Has a Thousand Eyes (1948) | AX96: =A96 -> 22245
A97: 22252 | F97: O.E.A. Presents | G97: Eye Opener | H97: Uncle Charlie's Roundhouse | J97: Romper Room | K97: The Better Half | L97: It's a Great Life | M97: Medic | N97: Morning Court (ABC) | O97: Love That Bob! (ABC) | P97: The Texan (ABC) | Q97: Beat the Clock (ABC) | R97: About Faces (ABC) | S97: Citizen Soldier | T97: Day in Court (ABC) | U97: Road to Reality (ABC) | V97: Queen for a Day (ABC) | W97: Who Do You Trust? (ABC) | X97: American Bandstand (ABC) | Y97: Uncle Charlie's Den | Z97: Three Stooges | AA97: Rin Tin Tin (ABC) | AB97: Holiday Playhouse [Special] | AC97: News Central | AD97: The Pioneers | AE97: Matty's Funday Funnies (ABC) | AF97: Harrigan and Son (ABC) | AG97: The Flintstones (ABC) | AH97: 77 Sunset Strip (ABC) | AJ97: The Detectives (ABC) | AK97: The Law and Mr. Jones (ABC) | AL97: News; [11:15]: Movie [Movie 12]: Buck Benny Rides Again (1940) | AX97: =A97 -> 22252
A98: 22259 | F98: O.E.A. Presents | G98: Eye Opener | H98: Uncle Charlie's Roundhouse | J98: Romper Room | K98: The Better Half | L98: It's a Great Life | M98: Medic | N98: Morning Court (ABC) | O98: Love That Bob! (ABC) | P98: The Texan (ABC) | Q98: Beat the Clock (ABC) | R98: About Faces (ABC) | S98: Citizen Soldier | T98: Day in Court (ABC) | U98: Road to Reality (ABC) | V98: Queen for a Day (ABC) | W98: Who Do You Trust? (ABC) | X98: American Bandstand (ABC) | Y98: Uncle Charlie's Den | Z98: Three Stooges | AA98: Rin Tin Tin (ABC) | AB98: Holiday Playhouse [Special] | AC98: News Central | AD98: The Pioneers | AE98: Matty's Funday Funnies (ABC) | AF98: Harrigan and Son (ABC) | AG98: The Flintstones (ABC) | AH98: 77 Sunset Strip (ABC) | AJ98: The Detectives (ABC) | AK98: CloseUp! (ABC) [Special] | AL98: News; [11:15]: Movie [Movie 12]: Dream Girl (1948) | AX98: =A98 -> 22259
A99: 22266 | F99: O.E.A. Presents | G99: Eye Opener | H99: Uncle Charlie's Roundhouse | J99: Romper Room | K99: The Better Half | L99: It's a Great Life | M99: Medic | N99: Morning Court (ABC) | O99: Love That Bob! (ABC) | P99: The Texan (ABC) | Q99: Beat the Clock (ABC) | R99: About Faces (ABC) | S99: Citizen Soldier | T99: Day in Court (ABC) | U99: Road to Reality (ABC) | V99: Queen for a Day (ABC) | W99: Who Do You Trust? (ABC) | X99: American Bandstand (ABC) | Y99: Uncle Charlie's Den | Z99: Three Stooges | AA99: Rin Tin Tin (ABC) | AB99: Holiday Playhouse [Special] | AC99: News Central | AD99: The Pioneers | AE99: Matty's Funday Funnies (ABC) | AF99: Harrigan and Son (ABC) | AG99: The Flintstones (ABC) | AH99: 77 Sunset Strip (ABC) | AJ99: The Detectives (ABC) | AK99: The Law and Mr. Jones (ABC) | AL99: News; [11:15]: Movie [Movie 12]: The White Angel (1936) | AX99: =A99 -> 22266
A100: 22273 | F100: O.E.A. Presents | G100: Eye Opener | H100: Uncle Charlie's Roundhouse | J100: Romper Room | K100: The Better Half | L100: It's a Great Life | M100: Medic | N100: Morning Court (ABC) | O100: Love That Bob! (ABC) | P100: The Texan (ABC) | Q100: Beat the Clock (ABC) | R100: About Faces (ABC) | S100: Citizen Soldier | T100: Day in Court (ABC) | U100: Road to Reality (ABC) | V100: Queen for a Day (ABC) | W100: Who Do You Trust? (ABC) | X100: American Bandstand (ABC) | Y100: Uncle Charlie's Den | Z100: Three Stooges | AA100: Rin Tin Tin (ABC) | AB100: Topper | AC100: News Central | AD100: The Pioneers | AE100: Matty's Funday Funnies (ABC) | AF100: Harrigan and Son (ABC) | AG100: The Flintstones (ABC) | AH100: 77 Sunset Strip (ABC) | AJ100: The Detectives (ABC) | AK100: The Law and Mr. Jones (ABC) | AL100: News; [11:15]: Movie [Movie 12]: Her Sister's Secret (1946) | AX100: =A100 -> 22273
A101: 22280 | F101: O.E.A. Presents | G101: Eye Opener | H101: Uncle Charlie's Roundhouse | J101: Romper Room | K101: The Better Half | L101: It's a Great Life | M101: Medic | N101: Morning Court (ABC) | O101: Love That Bob! (ABC) | P101: The Texan (ABC) | Q101: Beat the Clock (ABC) | R101: About Faces (ABC) | S101: Citizen Soldier | T101: Day in Court (ABC) | U101: Road to Reality (ABC) | V101: Queen for a Day (ABC) | W101: Who Do You Trust? (ABC) | X101: American Bandstand (ABC) | Y101: Uncle Charlie's Den | Z101: Three Stooges | AA101: Rin Tin Tin (ABC) | AB101: Topper | AC101: News Central | AD101: The Pioneers | AE101: Matty's Funday Funnies (ABC) | AF101: Harrigan and Son (ABC) | AG101: The Flintstones (ABC) | AH101: 77 Sunset Strip (ABC) | AJ101: The Detectives (ABC) | AK101: The Law and Mr. Jones (ABC) | AL101: News; [11:15]: Movie [Movie 12]: Her Sister's Secret (1946) | AX101: =A101 -> 22280
A102: 1961 | AX102: =A102 -> 1961
A103: 22287 | F103: O.E.A. Presents | G103: Eye Opener | H103: Uncle Charlie's Roundhouse | J103: Romper Room | K103: The Better Half | L103: It's a Great Life | M103: Medic | N103: Morning Court (ABC) | O103: Love That Bob! (ABC) | P103: The Texan (ABC) | Q103: Beat the Clock (ABC) | R103: About Faces (ABC) | S103: Citizen Soldier | T103: Day in Court (ABC) | U103: Road to Reality (ABC) | V103: Queen for a Day (ABC) | W103: Who Do You Trust? (ABC) | X103: American Bandstand (ABC) | Y103: Uncle Charlie's Den | Z103: Three Stooges | AA103: Rin Tin Tin (ABC) | AB103: Topper | AC103: News Central | AD103: The Pioneers | AE103: Matty's Funday Funnies (ABC) | AF103: Harrigan and Son (ABC) | AG103: The Flintstones (ABC) | AH103: 77 Sunset Strip (ABC) | AJ103: The Detectives (ABC) | AK103: The Law and Mr. Jones (ABC) | AL103: News; [11:15]: Movie [Movie 12]: Shall We Dance? (1936) | AX103: =A103 -> 22287
A107: 1962 | AX107: =A107 -> 1962
A109: 1963 | AX109: 1963
A112: 23169 | E112: [6:45] Telecourse | G112: Cartoon Capers; [7:45] Dr. Zoom's Cartoons; [8:15] King Leonardo | I112: Romper Room | J112: Jack LaLanne | K112: News--Ed Arndt; [9:35] Movie: The Biscuit Eater (1940) | N112: Life of Riley | O112: Seven Keys (ABC) | P112: Ernie Ford | Q112: Father Knows Best | R112: General Hospital (ABC) | S112: Girl Talk | T112: Day in Court; [2:25] News | U112: Jayne Wyman | V112: Queen for a Day | W112: Who Do You Trust? | X112: American Bandstand (ABC) | Y112: Discovery '63; [4:55] American Newsstand | Z112: Three Stooges | AA112: Popeye Theater | AB112: Cartoon Castle | AC112: News--Sanders, Arndt; [6:45] ABC News | AD112: Indianapolis "500" | AE112: Cheyenne (ABC) | AG112: The Flintstones (ABC) | AH112: I'm Dickens.. He's Fenster (ABC) | AI112: 77 Sunset Strip (ABC) | AK112: Peter Gunn | AL112: News, Sports | AM112: Movie: Bigger Than Life (1956) | AP112: [1:15] Movie: An Act of Murder (1948) | AX112: =A112 -> 23169
A115: 1964 | AX115: 1964
A119: 1965 | AX119: 1965
A120: 24002 | K120: [9:45] News, Weather | L120: Vocabulary Building | M120: Jack La Lanne | N120: 12 in the Morning | O120: Sergeant Preston | P120: Cartoon Castle [Dr. Zoom] | R120: Girl Talk | S120: Movie: Enchanted April (1935) | V120: [3:15] News--Duane Bock | W120: Touch Turtle | X120: [4:15] Rocky and Friends | Y120: Popeye's Pier 12 | Z120: Lloyd Thaxton | AB120: Peter Potamus | AC120: Trackdown | AD120: The Rifleman | AE120: Wanderlust | AF120: Shivaree | AG120: The Bobby Lord Show | AH120: Greyhound Racing | AI120: The Untouchables | AK120: Movie: Ruby Gentry (1953) | AN120: Movie: No Man of Her Own (1932) | AX120: =A120 -> 24002
A121: 24009 | K121: [9:45] News, Weather | L121: Vocabulary Building | M121: Jack La Lanne | N121: 12 in the Morning | O121: Sergeant Preston | P121: Cartoon Castle [Dr. Zoom] | R121: Girl Talk | S121: Movie: Another Face (1935) | V121: [3:15] News--Duane Bock | W121: Touch Turtle | X121: [4:15] Rocky and Friends | Y121: Popeye's Pier 12 | Z121: Lloyd Thaxton | AB121: Peter Potamus | AC121: Trackdown | AD121: The Rifleman | AE121: Wanderlust | AF121: Shivaree | AG121: The Bobby Lord Show | AH121: Greyhound Racing | AI121: The Untouchables | AK121: Movie: The Frogmen (1951) | AN121: [12:15] Movie: An American Tragedy (1931) | AX121: =A121 -> 24009
A125: 1970 | AX125: 1970
A126: 25577 | F126: Breadbasket USA | G126: The Flintstones | H126: Hobo Kelly | J126: The Patty Duke Show | K126: The Wonderful World of Women | L126: Movie [Morning Movie 12]: The Raid (1954) | O126: Fashions in Sewing; [11:40] 12 in the Morning; [11:50] News--Don Stellges | P126: Rusty Nails' Cartoons | R126: The Movie Game | S126: Air of Disaster | U126: The Galloping Gourmet | V126: The Three O'Clock News--Don Stellges/ Jimmy Jones/ Bill Swing | W126: He Said! She Said! | X126: Beat the Clock | Y126: Popeye's Pier 12 | Z126: The Flintstones | AA126: Sea Hunt | AB126: Gilligan's Island | AC126: The Invaders | AE126: Perry Mason | AG126: The David Frost Show | AJ126: The 10 O'Clock News--Don Stellges | AK126: Felony Squad | AL126: Movie [Movie 12]: The Man Who Never Was (1956) | AO126: Movie [Movie 12]: Bride of Frankenstein (1953) | AX126: =A126 -> 25577
A127: =A126+7 -> 25584 | F127: Breadbasket USA | G127: The Flintstones | H127: Hobo Kelly | J127: The Patty Duke Show | K127: The Wonderful World of Women | L127: Movie [Morning Movie 12]: Steakout on Dope Street (1958) | O127: Fashions in Sewing; [11:40] 12 in the Morning; [11:50] News--Don Stellges | P127: Rusty Nails' Cartoons | R127: The Movie Game | S127: Run for Your Life | U127: The Galloping Gourmet | V127: The Three O'Clock News--Don Stellges/ Jimmy Jones/ Bill Swing | W127: He Said! She Said! | X127: Beat the Clock | Y127: Popeye's Pier 12 | Z127: The Flintstones | AA127: Sea Hunt | AB127: Gilligan's Island | AC127: Star Trek | AE127: Perry Mason | AG127: The David Frost Show | AJ127: The 10 O'Clock News--Don Stellges | AK127: Felony Squad | AL127: Movie [Movie 12]: She Played With Fire (1958) | AO127: Movie [Movie 12]: Frankenstein Meets the Wolf Man (1943) | AX127: =A127 -> 25584
A128: =A127+7 -> 25591
A129: =A128+7 -> 25598 | F129: Breadbasket USA | G129: The Flintstones | H129: Hobo Kelly | J129: The Patty Duke Show | K129: The Wonderful World of Women | L129: Movie [Morning Movie 12]: The Deerslayer (1957) | O129: Fashions in Sewing; [11:40] 12 in the Morning; [11:50] News--Don Stellges | P129: Rusty Nails' Cartoons | R129: The Movie Game | S129: Run for Your Life | U129: The Galloping Gourmet | V129: The Three O'Clock News--Don Stellges/ Jimmy Jones/ Bill Swing | W129: He Said! She Said! | X129: Beat the Clock | Y129: Popeye's Pier 12 | Z129: The Flintstones | AA129: Sea Hunt | AB129: Gilligan's Island | AC129: Star Trek | AE129: Perry Mason | AG129: The David Frost Show | AJ129: The 10 O'Clock News-- Don Stellges/ Michael Hartfield/ Jimmy Jones | AK129: Felony Squad | AL129: Movie [Movie 12]: Wind Across the Everglades (1958) | AO129: Movie [Movie 12]: Son of Dracula (1943) | AX129: =A129 -> 25598
A130: =A129+7 -> 25605 | F130: Breadbasket USA | G130: The Flintstones | H130: Hobo Kelly | J130: The Patty Duke Show | K130: The Wonderful World of Women | L130: Movie [Morning Movie 12]: Along the Great Divide (1951) | O130: Fashions in Sewing; [11:40] 12 in the Morning; [11:50] News--Don Stellges | P130: Rusty Nails' Cartoons | R130: The Movie Game | S130: Run for Your Life | U130: The Galloping Gourmet | V130: The Three O'Clock News--Don Stellges/ Jimmy Jones/ Bill Swing | W130: He Said! She Said! | X130: Beat the Clock | Y130: Popeye's Pier 12 | Z130: The Flintstones | AA130: Sea Hunt | AB130: Gilligan's Island | AC130: Star Trek | AE130: Perry Mason | AG130: The David Frost Show | AJ130: The 10 O'Clock News-- Don Stellges/ Michael Hartfield/ Jimmy Jones | AK130: Felony Squad | AL130: Movie [Movie 12]: All the Fine Young Cannibals (1960) | AX130: =A130 -> 25605
A131: =A130+7 -> 25612 | F131: Breadbasket USA | G131: The Flintstones | H131: Hobo Kelly | J131: The Patty Duke Show | K131: The Wonderful World of Women | L131: Movie [Morning Movie 12]: Tea for Two (1950) | O131: Fashions in Sewing; [11:40] 12 in the Morning; [11:50] News--Don Stellges | P131: Rusty Nails' Cartoons | R131: The Movie Game | S131: Run for Your Life | U131: The Galloping Gourmet | V131: The Three O'Clock News--Don Stellges/ Jimmy Jones/ Bill Swing | W131: He Said! She Said! | X131: Beat the Clock | Y131: Popeye's Pier 12 | Z131: The Flintstones | AA131: Sea Hunt | AB131: Gilligan's Island | AC131: Star Trek | AE131: Perry Mason | AG131: The David Frost Show | AJ131: The 10 O'Clock News-- Don Stellges/ Michael Hartfield/ Jimmy Jones | AK131: Felony Squad | AL131: Movie [Movie 12]: Anatomy of a Murder (1959) | AX131: =A131 -> 25612
A132: =A131+7 -> 25619 | F132: Breadbasket USA | G132: The Flintstones | H132: Hobo Kelly | J132: The Patty Duke Show | K132: The Wonderful World of Women | L132: Movie [Morning Movie 12]: The Big Trees (1952) | O132: Fashions in Sewing; [11:40] 12 in the Morning; [11:50] News--Don Stellges | P132: Rusty Nails' Cartoons | R132: The Movie Game | S132: Run for Your Life | U132: The Galloping Gourmet | V132: The Three O'Clock News--Don Stellges/ Jimmy Jones/ Bill Swing | W132: He Said! She Said! | X132: Beat the Clock | Y132: Popeye's Pier 12 | Z132: The Flintstones | AA132: Sea Hunt | AB132: Gilligan's Island | AC132: Star Trek | AE132: Perry Mason | AG132: The David Frost Show | AJ132: The 10 O'Clock News-- Don Stellges/ Michael Hartfield/ Jimmy Jones | AK132: Felony Squad | AL132: Movie [Movie 12]: Beloved Infidel (1959) | AX132: =A132 -> 25619
A133: =A132+7 -> 25626 | F133: Breadbasket USA | G133: The Flintstones | H133: Hobo Kelly | J133: The Patty Duke Show | K133: The Wonderful World of Women | L133: Movie [Morning Movie 12]: The Bottom of the Bottle (1956) | O133: Fashions in Sewing; [11:40] 12 in the Morning; [11:50] News--Don Stellges | P133: Rusty Nails' Cartoons | R133: The Movie Game | S133: Run for Your Life | U133: The Galloping Gourmet | V133: The Three O'Clock News--Don Stellges/ Jimmy Jones/ Bill Swing | W133: He Said! She Said! | X133: Beat the Clock | Y133: Popeye's Pier 12 | Z133: The Flintstones | AA133: Sea Hunt | AB133: Gilligan's Island | AC133: Star Trek | AE133: Perry Mason | AG133: The David Frost Show | AJ133: The 10 O'Clock News-- Don Stellges/ Michael Hartfield/ Jimmy Jones | AK133: Felony Squad | AL133: Movie [Movie 12]: Captain Newman, M.D. (1964) | AX133: =A133 -> 25626
A134: =A133+7 -> 25633
A135: =A134+7 -> 25640 | F135: Breadbasket USA | G135: The Flintstones | H135: Hobo Kelly | J135: The Patty Duke Show | K135: The Wonderful World of Women | L135: Movie [Morning Movie 12]: Dick Tracy vs. Cueball (1946) | O135: Fashions in Sewing; [11:40] 12 in the Morning; [11:50] News--Don Stellges | P135: Rusty Nails' Cartoons | R135: The Movie Game | S135: Run for Your Life | U135: The Galloping Gourmet | V135: The Three O'Clock News--Don Stellges/ Jimmy Jones/ Bill Swing | W135: He Said! She Said! | X135: Beat the Clock | Y135: Popeye's Pier 12 | Z135: The Flintstones | AA135: Sea Hunt | AB135: Star Trek | AD135: College Basketball: NCAA Small College Championship from Evansville, Indiana | AG135: The David Frost Show | AJ135: The 10 O'Clock News-- Don Stellges/ Michael Hartfield/ Jimmy Jones | AK135: Felony Squad | AL135: Movie [Movie 12]: Sweet Bird of Youth (1961) | AX135: =A135 -> 25640
A136: =A135+7 -> 25647 | F136: Breadbasket USA | G136: The Flintstones | H136: Hobo Kelly | J136: The Patty Duke Show | K136: The Wonderful World of Women | L136: Movie [Morning Movie 12]: Sherlock Holmes and the House of Fear (1945) | O136: Fashions in Sewing; [11:40] 12 in the Morning; [11:55] News--Larry Curran | P136: Rusty Nails' Cartoons | R136: The Movie Game | S136: Hawaii Calls | T136: Faces and Places | U136: The Galloping Gourmet | V136: The Three O'Clock News--Don Stellges/ Jimmy Jones/ Bill Swing | W136: He Said! She Said! | X136: Beat the Clock | Y136: Popeye's Pier 12 | Z136: The Flintstones | AA136: Sea Hunt | AB136: Gilligan's Island | AC136: Star Trek | AE136: Perry Mason | AG136: The David Frost Show | AJ136: The 10 O'Clock News-- Don Stellges/ Michael Hartfield/ Jimmy Jones | AK136: Felony Squad | AL136: Movie [Movie 12]: Julie (1957) | AX136: =A136 -> 25647
A137: =A136+7 -> 25654 | F137: Breadbasket USA | G137: The Flintstones | H137: Hobo Kelly | J137: The Patty Duke Show | K137: The Wonderful World of Women | L137: Movie [Morning Movie 12]: Riding Shotgun (1955) | O137: Fashions in Sewing; [11:40] 12 in the Morning; [11:50] News--Larry Curran | P137: Rusty Nails' Cartoons | R137: The Movie Game | S137: Hawaii Calls | T137: Faces and Places | U137: The Galloping Gourmet | V137: The Three O'Clock News--Don Stellges/ Jimmy Jones/ Bill Swing | W137: He Said! She Said! | X137: Beat the Clock | Y137: Popeye's Pier 12 | Z137: The Flintstones | AA137: Sea Hunt | AB137: Gilligan's Island | AC137: Star Trek | AE137: Felony Squad | AF137: WHL Hockey: Portland Buckaroos vs Vancouver Canucks | AK137: The 10 O'Clock News-- Don Stellges/ Michael Hartfield/ Jimmy Jones | AL137: Movie [Movie 12]: Les Miserables (1952) | AX137: =A137 -> 25654
A138: =A137+7 -> 25661 | F138: Breadbasket USA | G138: The Flintstones | H138: Hobo Kelly | J138: The Patty Duke Show | K138: The Wonderful World of Women | L138: Movie [Morning Movie 12]: Backfire (1950) | O138: Fashions in Sewing; [11:40] 12 in the Morning; [11:50] News--Larry Curran | P138: Rusty Nails' Cartoons | R138: The Movie Game | S138: Hawaii Calls | T138: Faces and Places | U138: The Galloping Gourmet | V138: The Three O'Clock News--Don Stellges/ Jimmy Jones/ Bill Swing | W138: He Said! She Said! | X138: Beat the Clock | Y138: Popeye's Pier 12 | Z138: The Flintstones | AA138: Sea Hunt | AB138: Gilligan's Island | AC138: Star Trek | AE138: Perry Mason | AG138: The David Frost Show | AJ138: The 10 O'Clock News-- Don Stellges/ Michael Hartfield/ Jimmy Jones | AK138: Felony Squad | AL138: Movie [Movie 12]: Blood Alley (1966) | AX138: =A138 -> 25661
A139: =A138+7 -> 25668
A140: =A139+7 -> 25675 | F140: Breadbasket USA | G140: The Flintstones | H140: Hobo Kelly | J140: The Patty Duke Show | K140: The Wonderful World of Women | L140: Movie [Morning Movie 12]: Top Secret Affair (1957) | O140: Fashions in Sewing; [11:40] 12 in the Morning; [11:50] News--Larry Curran | P140: Rusty Nails' Cartoons | R140: The Movie Game | S140: The Naked City | U140: The Galloping Gourmet | V140: The Three O'Clock News--Don Stellges/ Jimmy Jones/ Bill Swing | W140: He Said! She Said! | X140: Beat the Clock | Y140: Popeye's Pier 12 | Z140: The Addams Family | AA140: Sea Hunt | AB140: Gilligan's Island | AC140: Star Trek | AE140: Perry Mason | AG140: The David Frost Show | AJ140: The 10 O'Clock News-- Don Stellges/ Michael Hartfield/ Jimmy Jones | AK140: Felony Squad | AL140: Movie [Movie 12]: Man with a Cloak (1951) | AX140: =A140 -> 25675
A141: =A140+7 -> 25682 | F141: Breadbasket USA | G141: The Flintstones | H141: Hobo Kelly | J141: The Patty Duke Show | K141: The Wonderful World of Women | L141: Movie [Morning Movie 12]: Something for the Boys (1944) | O141: Fashions in Sewing; [11:40] 12 in the Morning; [11:50] News--Larry Curran | P141: Rusty Nails' Cartoons | R141: The Movie Game | S141: The Naked City | U141: The Galloping Gourmet | V141: The Three O'Clock News--Don Stellges/ Jimmy Jones/ Bill Swing | W141: He Said! She Said! | X141: Beat the Clock | Y141: Popeye's Pier 12 | Z141: The Addams Family | AA141: Sea Hunt | AB141: Gilligan's Island | AC141: Star Trek | AE141: Perry Mason | AG141: The David Frost Show | AJ141: The 10 O'Clock News-- Don Stellges/ Michael Hartfield/ Jimmy Jones | AK141: Felony Squad | AL141: Movie [Movie 12]: Mystery Street (1950) | AX141: =A141 -> 25682
A142: =A141+7 -> 25689
A143: =A142+7 -> 25696 | F143: Breadbasket USA | G143: The Flintstones | H143: Hobo Kelly | J143: The Patty Duke Show | K143: The Wonderful World of Women | L143: Movie [Morning Movie 12]: Down Among the Sheltering Palms (1953) | O143: Fashions in Sewing; [11:40] 12 in the Morning; [11:50] News--Larry Curran | P143: Rusty Nails' Cartoons | R143: The Movie Game | S143: The Naked City | U143: The Galloping Gourmet | V143: The Three O'Clock News--Don Stellges/ Jimmy Jones/ Bill Swing | W143: He Said! She Said! | X143: Beat the Clock | Y143: Popeye's Pier 12 | Z143: The Addams Family | AA143: Sea Hunt | AB143: Gilligan's Island | AC143: Star Trek | AE143: Perry Mason | AG143: The David Frost Show | AJ143: The 10 O'Clock News-- Don Stellges/ Michael Hartfield/ Jimmy Jones | AK143: Felony Squad | AL143: Movie [Movie 12]: The Night Walker (1964) | AX143: =A143 -> 25696
A144: =A143+7 -> 25703 | F144: Breadbasket USA | G144: The Flintstones | H144: Hobo Kelly | J144: The Patty Duke Show | K144: The Wonderful World of Women | L144: Movie [Morning Movie 12]: Domino Kid (1957) | O144: Fashions in Sewing; [11:40] 12 in the Morning; [11:50] News--Larry Curran | P144: Rusty Nails' Cartoons | R144: The Movie Game | S144: The Naked City | U144: The Galloping Gourmet | V144: The Three O'Clock News--Don Stellges/ Jimmy Jones/ Bill Swing | W144: He Said! She Said! | X144: Beat the Clock | Y144: Popeye's Pier 12 | Z144: The Addams Family | AA144: Sea Hunt | AB144: Gilligan's Island | AC144: Star Trek | AE144: Perry Mason | AG144: The David Frost Show | AJ144: The 10 O'Clock News-- Don Stellges/ Michael Hartfield/ Jimmy Jones | AK144: Candidate's Fair | AL144: Movie [Movie 12]: Executive Suite (1954) | AX144: =A144 -> 25703
A145: =A144+7 -> 25710
A146: =A145+7 -> 25717 | F146: Breadbasket USA | G146: The Flintstones | H146: Hobo Kelly | J146: The Patty Duke Show | K146: The Wonderful World of Women | L146: Movie [Morning Movie 12]: Pin-up Girl (1944) | O146: Fashions in Sewing; [11:40] 12 in the Morning; [11:50] News--Larry Curran | P146: Rusty Nails' Cartoons | R146: The Movie Game | S146: The Naked City | U146: The Galloping Gourmet | V146: The Three O'Clock News--Don Stellges/ Jimmy Jones/ Bill Swing | W146: He Said! She Said! | X146: Beat the Clock | Y146: Popeye's Pier 12 | Z146: The Addams Family | AA146: Sea Hunt | AB146: Gilligan's Island | AC146: Star Trek | AE146: Perry Mason | AG146: The David Frost Show | AJ146: The 10 O'Clock News-- Don Stellges/ Michael Hartfield/ Jimmy Jones | AK146: The Honey-mooners | AL146: Movie [Movie 12]: Jeopardy (1953) | AX146: =A146 -> 25717
A147: =A146+7 -> 25724 | F147: Breadbasket USA | G147: The Flintstones | H147: Hobo Kelly | J147: The Patty Duke Show | K147: The Wonderful World of Women | L147: Movie [Morning Movie 12]: Screaming Mimi (1958) | O147: 12 in the Morning; [11:40] News--Larry Curran | P147: Rusty Nails' Cartoons | R147: The Movie Game | S147: The Untouchables | U147: The Galloping Gourmet | V147: The Three O'Clock News--Don Stellges/ Jimmy Jones [3:20] Fashions in Sewing | W147: He Said! She Said! | X147: Beat the Clock | Y147: Popeye's Pier 12 | Z147: The Addams Family | AA147: Sea Hunt | AB147: Gilligan's Island | AC147: Star Trek | AE147: Perry Mason | AG147: The David Frost Show | AJ147: The 10 O'Clock News-- Don Stellges/ Michael Hartfield/ Jimmy Jones | AK147: The Honey-mooners | AL147: Movie [Movie 12]: The Seventh Sin (1957) | AX147: =A147 -> 25724
A148: =A147+7 -> 25731 | F148: Breadbasket USA | G148: The Flintstones | H148: Hobo Kelly | J148: The Patty Duke Show | K148: The Wonderful World of Women | L148: Movie [Morning Movie 12]: Jazz Boat (1960) | O148: 12 in the Morning; [11:40] News--Larry Curran/ Bill Swing | P148: Rusty Nails' Cartoons | R148: The Movie Game | S148: The Untouchables | U148: The Galloping Gourmet | V148: The Three O'Clock News--Don Stellges/ Jimmy Jones [3:20] Fashions in Sewing | W148: He Said! She Said! | X148: Beat the Clock | Y148: Popeye's Pier 12 | Z148: The Addams Family | AA148: Sea Hunt | AB148: Gilligan's Island | AC148: Star Trek | AE148: Perry Mason | AG148: The David Frost Show | AJ148: The 10 O'Clock News-- Don Stellges/ Michael Hartfield/ Jimmy Jones | AK148: The Honey-mooners | AL148: Movie [Movie 12]: Two Weeks in Another Town (1962) | AX148: =A148 -> 25731
A149: =A148+7 -> 25738 | F149: Breadbasket USA | G149: The Flintstones | H149: Hobo Kelly | J149: The Patty Duke Show | K149: The Wonderful World of Women | L149: Movie [Morning Movie 12]: Jazz Boat (1960) | O149: 12 in the Morning; [11:40] News--Larry Curran/ Bill Swing | P149: Rusty Nails' Cartoons | R149: The Movie Game | S149: The Untouchables | U149: The Galloping Gourmet | V149: The Three O'Clock News--Don Stellges/ Jimmy Jones [3:20] Fashions in Sewing | W149: He Said! She Said! | X149: Beat the Clock | Y149: Popeye's Pier 12 | Z149: The Addams Family | AA149: Sea Hunt | AB149: Gilligan's Island | AC149: Star Trek | AE149: Perry Mason | AG149: The David Frost Show | AJ149: The 10 O'Clock News-- Don Stellges/ Michael Hartfield/ Jimmy Jones | AK149: The Honey-mooners | AL149: Movie [Movie 12]: Two Weeks in Another Town (1962) | AX149: =A149 -> 25738
A150: =A149+7 -> 25745 | F150: Breadbasket USA | G150: The Flintstones | H150: Hobo Kelly | J150: The Patty Duke Show | K150: The Wonderful World of Women | L150: Movie [Morning Movie 12]: Warning from Space (Japanese; 1963) | O150: 12 in the Morning; [11:40] News--Larry Curran/ Bill Swing | P150: Rusty Nails' Cartoons | R150: The Movie Game | S150: Faces and Places | U150: The Galloping Gourmet | V150: The Three O'Clock News--Don Stellges/ Jimmy Jones [3:20] Fashions in Sewing | W150: He Said! She Said! | X150: Beat the Clock | Y150: Popeye's Pier 12 | Z150: The Addams Family | AA150: Sea Hunt | AB150: Gilligan's Island | AC150: Star Trek | AE150: Billy Graham (Special) | AG150: The David Frost Show | AJ150: The 10 O'Clock News-- Don Stellges/ Michael Hartfield/ Jimmy Jones | AK150: The Honey-mooners | AL150: Movie [Movie 12]: Anatomy of a Murder (1959) | AX150: =A150 -> 25745
A151: =A150+7 -> 25752 | F151: Breadbasket USA | G151: The Flintstones | H151: Hobo Kelly | J151: The Patty Duke Show | K151: The Wonderful World of Women | L151: Movie [Morning Movie 12]: Contraband Spain (English; 1958) | O151: 12 in the Morning; [11:40] News--Larry Curran/ Bill Swing | P151: Rusty Nails' Cartoons | R151: The Movie Game | S151: Faces and Places | U151: The Galloping Gourmet | V151: The Three O'Clock News--Don Stellges/ Jimmy Jones [3:20] Fashions in Sewing | W151: He Said! She Said! | X151: Beat the Clock | Y151: Popeye's Pier 12 | Z151: The Addams Family | AA151: Sea Hunt | AB151: Gilligan's Island | AC151: Star Trek | AE151: The Real Tom Kennedy Show | AG151: The David Frost Show | AJ151: The 10 O'Clock News-- Don Stellges/ Michael Hartfield/ Jimmy Jones | AK151: The Honey-mooners | AL151: Movie [Movie 12]: Johnny Tiger (1966) | AX151: =A151 -> 25752
A152: =A151+7 -> 25759 | F152: Breadbasket USA | G152: Cartoon Castle | H152: Hobo Kelly | J152: The Patty Duke Show | K152: The Wonderful World of Women | L152: Movie [Morning Movie 12]: Inside the Walls of Folsom Prison (1951) | O152: 12 in the Morning; [11:40] News--Larry Curran/ Bill Swing | P152: Rusty Nails' Cartoons | R152: The Movie Game | S152: Faces and Places | U152: The Galloping Gourmet | V152: The Three O'Clock News--Don Stellges/ Jimmy Jones [3:20] Fashions in Sewing | W152: He Said! She Said! | X152: Beat the Clock | Y152: Popeye's Pier 12 | Z152: Mister Ed | AA152: Sea Hunt | AB152: Gilligan's Island | AC152: Star Trek | AE152: Perry Mason | AG152: The David Frost Show | AJ152: The 10 O'Clock News-- Don Stellges/ Michael Hartfield/ Jimmy Jones | AK152: The Honey-mooners | AL152: Movie [Movie 12]: The Asphalt Jungle (1950) | AX152: =A152 -> 25759
A160: 1975 | AX160: 1975
A161: 27397 | F161: You | G161: The Flintstones | H161: Cartoon Castle | I161: Nanny and the Professor | J161: Name That Tune (NBC) | K161: News--Larry Curran/Young | L161: Now You See It (CBS) | M161: It Takes a Thief | O161: Search for Tomorrow (CBS) | P161: Jeopardy! (NBC) | Q161: The Bold Ones | S161: Movie: The Shrike (1955) | W161: Gomer Pyle, USMC | X161: Ramblin' Rod | Y161: Batman | Z161: I Dream of Jeannie | AA161: Courtship of Eddie's Father | AB161: The Mod Squad | AD161: The The FBI | AF161: Movie [The Movie]: Hauser's Memory (1970) | AJ161: The 10 O'Clock News | AL161: Movie [Movie 12]: They Died with Their Boots On (1941) | AX161: =A161 -> 27397
A162: 27404 | F162: You | G162: The Flintstones | H162: Cartoon Castle | I162: Nanny and the Professor | J162: Celebrity Sweepstakes (NBC) | K162: News--Larry Curran/Young | L162: Now You See It (CBS) | M162: It Takes a Thief | O162: Search for Tomorrow (CBS) | P162: How to Survive a Marriage (NBC) | Q162: Bold Ones | S162: Movie: But Not for Me (1959) | W162: Gomer Pyle, USMC | X162: Ramblin' Rod | Y162: Batman | Z162: I Dream of Jeannie | AA162: Courtship of Eddie's Father | AB162: Jimmy Dean | AC162: NBA Basketball: Portland Trailblazers vs Phoenix Suns | AG162: Virginian | AJ162: The 10 O'Clock News | AL162: College Basketball: Stanford Cardinals vs Oregon Ducks | AX162: =A162 -> 27404
A163: =A162+7 -> 27411 | F163: You | G163: The Flintstones | H163: Cartoon Castle | I163: Petticoat Junction | J163: Celebrity Sweepstakes (NBC) | K163: Nanny and the Professor | L163: Now You See It (CBS) | M163: Bold Ones | O163: Search for Tomorrow (CBS) | P163: How to Survive a Marriage (NBC) | Q163: Movie [Matinee 12]: Adventures of Mark Twain (1944) | V163: Gomer Pyle, USMC | W163: Batman | X163: Ramblin' Rod | Y163: I Dream of Jeannie | Z163: The Mod Squad | AB163: Star Trek | AD163: The The FBI | AF163: Movie [The Movie]: To Hell and Back (1955) | AJ163: The 10 O'Clock News | AL163: Movie [Movie 12]: Carrie (1952) | AX163: =A163 -> 27411
A164: =A163+7 -> 27418 | F164: You | G164: The Flintstones | H164: Cartoon Castle | I164: Petticoat Junction | J164: Celebrity Sweepstakes (NBC) | K164: Nanny and the Professor | L164: Now You See It (CBS) | M164: Bold Ones | O164: Search for Tomorrow (CBS) | P164: How to Survive a Marriage (NBC) | Q164: Movie [Matinee 12]: The Charge of the Light Brigade (1936) | V164: Gomer Pyle, USMC | W164: Batman | X164: Ramblin' Rod | Y164: I Dream of Jeannie | Z164: The Mod Squad | AB164: Star Trek | AD164: The The FBI | AF164: Movie [The Movie]: Never Steal Anything Small (1959) | AJ164: The 10 O'Clock News | AL164: Movie [Movie 12]: The War Lord (1965) | AX164: =A164 -> 27418
A165: =A164+7 -> 27425 | F165: You | G165: The Flintstones | H165: Cartoon Castle | I165: Petticoat Junction | J165: Celebrity Sweepstakes (NBC) | K165: Nanny and the Professor | L165: Now You See It (CBS) | M165: Bold Ones | O165: Search for Tomorrow (CBS) | P165: How to Survive a Marriage (NBC) | Q165: Movie [Matinee 12]: The Misfits (1961) | V165: Gomer Pyle, USMC | W165: Batman | X165: Ramblin' Rod | Y165: I Dream of Jeannie | Z165: The Mod Squad | AB165: Star Trek | AD165: The The FBI | AF165: NBA Basketball: Portland Trail Blazers vs Seattle SuperSonics | AJ165: The 10 O'Clock News | AL165: Movie [Movie 12]: Birdman of Alcatraz (1962) | AX165: =A165 -> 27425
A166: =A165+7 -> 27432 | F166: You | G166: The Flintstones | H166: Cartoon Castle | I166: Petticoat Junction | J166: Celebrity Sweepstakes (NBC) | K166: Nanny and the Professor | L166: Now You See It (CBS) | M166: Bold Ones | O166: Search for Tomorrow (CBS) | P166: How to Survive a Marriage (NBC) | Q166: Movie [Matinee 12]: Sabrina (1954) | V166: Gomer Pyle, USMC | W166: Batman | X166: Ramblin' Rod | Y166: I Dream of Jeannie | Z166: The Mod Squad | AB166: Star Trek | AD166: The The FBI | AF166: College Basketball: USC Trojans vs Oregon Ducks | AJ166: The 10 O'Clock News | AL166: Movie [Movie 12]: Mirage (1965) | AX166: =A166 -> 27432
A167: =A166+7 -> 27439 | F167: You | G167: The Flintstones | H167: Cartoon Castle | I167: Petticoat Junction | J167: Celebrity Sweepstakes (NBC) | K167: Nanny and the Professor | L167: Now You See It (CBS) | M167: Bold Ones | O167: Search for Tomorrow (CBS) | P167: How to Survive a Marriage (NBC) | Q167: Movie [Matinee 12]: Some Like it Hot (1959) | V167: Gomer Pyle, USMC | W167: Batman | X167: Ramblin' Rod | Y167: I Dream of Jeannie | Z167: The Mod Squad | AB167: Star Trek | AD167: The The FBI | AF167: NBA Basketball: Portland Trail Blazers vs Seattle SuperSonics | AJ167: The 10 O'Clock News | AL167: Movie [Movie 12]: My Man Godfrey (1957) | AX167: =A167 -> 27439
A168: =A167+7 -> 27446 | F168: You | G168: The Flintstones | H168: Cartoon Castle | I168: Petticoat Junction | J168: Celebrity Sweepstakes (NBC) | K168: Nanny and the Professor | L168: Now You See It (CBS) | M168: Bold Ones | O168: Search for Tomorrow (CBS) | P168: How to Survive a Marriage (NBC) | Q168: Movie [Matinee 12]: The Fortune Cookie (1965) | V168: Gomer Pyle, USMC | W168: Batman | X168: Ramblin' Rod | Y168: I Dream of Jeannie | Z168: The Mod Squad | AB168: Star Trek | AD168: The The FBI | AF168: College Basketball: Oregon Ducks vs California Golden Bears | AJ168: The 10 O'Clock News | AL168: Movie [Movie 12]: Teacher's Pet (1958) | AX168: =A168 -> 27446
A169: =A168+7 -> 27453 | F169: You | G169: The Flintstones | H169: Cartoon Castle | I169: Petticoat Junction | J169: Celebrity Sweepstakes (NBC) | K169: Nanny and the Professor | L169: Now You See It (CBS) | M169: Bold Ones | O169: Search for Tomorrow (CBS) | P169: How to Survive a Marriage (NBC) | Q169: Movie [Matinee 12]: Man of a Thousand Faces (1957) | V169: Gomer Pyle, USMC | W169: Batman | X169: Ramblin' Rod | Y169: I Dream of Jeannie | Z169: The Mod Squad | AB169: Star Trek | AD169: The The FBI | AF169: Movie [The Movie]: I Love My Wife (1970) | AJ169: The 10 O'Clock News | AL169: College Basketball: Washington Huskies vs Oregon Ducks | AX169: =A169 -> 27453
A170: =A169+7 -> 27460 | F170: You | G170: The Flintstones | H170: Cartoon Castle | I170: Petticoat Junction | J170: Celebrity Sweepstakes (NBC) | K170: Nanny and the Professor | L170: Now You See It (CBS) | M170: Bold Ones | O170: Search for Tomorrow (CBS) | P170: How to Survive a Marriage (NBC) | Q170: Movie [Matinee 12]: Shadow of a Doubt (1942) | V170: Gomer Pyle, USMC | W170: Batman | X170: Ramblin' Rod | Y170: The Mickey Mouse Club | Z170: The Mod Squad | AB170: Star Trek | AD170: The The FBI | AF170: Movie [The Movie]: Flight to Tangier (1953) | AJ170: The 10 O'Clock News | AL170: Movie [Movie 12]: Blindfold (1966) | AX170: =A170 -> 27460
A171: =A170+7 -> 27467 | F171: You | G171: The Flintstones | H171: Cartoon Castle | I171: Petticoat Junction | J171: Celebrity Sweepstakes (NBC) | K171: Nanny and the Professor | L171: Now You See It (CBS) | M171: Sarge (Bold Ones) | O171: Search for Tomorrow (CBS) | P171: How to Survive a Marriage (NBC) | Q171: Movie [Matinee 12]: The Notorious Landlady (1962) | V171: Gomer Pyle, USMC | W171: Batman | X171: Ramblin' Rod | Y171: NBA Basketball: Portland Trail Blazers vs Boston Celtics | AC171: Courtship of Eddie's Father | AD171: The The FBI | AF171: Movie [The Movie]: Incident at Phantom Hill (1966) | AJ171: The 10 O'Clock News | AL171: Movie [Movie 12]: The Last Sunset (1961) | AX171: =A171 -> 27467
A172: =A171+7 -> 27474 | F172: You | G172: The Flintstones | H172: Cartoon Castle | I172: Petticoat Junction | J172: Celebrity Sweepstakes (NBC) | K172: Nanny and the Professor | L172: Now You See It (CBS) | M172: Sarge (Bold Ones) | O172: Search for Tomorrow (CBS) | P172: How to Survive a Marriage (NBC) | Q172: Movie [Matinee 12]: Shipmates Forever (1935) | V172: Gomer Pyle, USMC | W172: Batman | X172: Ramblin' Rod | Y172: The Mickey Mouse Club | Z172: The Mod Squad | AB172: Star Trek | AD172: The The FBI | AF172: Movie [The Movie]: Rage (1966) | AJ172: The 10 O'Clock News | AL172: Movie [Movie 12]: The Spiral Road (1962) | AX172: =A172 -> 27474
A173: =A172+7 -> 27481 | F173: You | G173: The Flintstones | H173: Cartoon Castle | I173: Petticoat Junction | J173: Celebrity Sweepstakes (NBC) | K173: Nanny and the Professor | L173: Now You See It (CBS) | M173: Bold Ones | O173: Search for Tomorrow (CBS) | P173: How to Survive a Marriage (NBC) | Q173: Movie [Matinee 12]: The Miracle (1959) | V173: Gomer Pyle, USMC | W173: Batman | X173: Ramblin' Rod | Y173: The Mickey Mouse Club | Z173: The Mod Squad | AB173: Star Trek | AD173: The The FBI | AF173: Movie [The Movie]: The Jayhawkers (1959) | AJ173: The 10 O'Clock News | AL173: Movie [Movie 12]: A Gathering of Eagles (1963) | AP173: [1:20] Movie [Movie 12]: The Mississippi Gambler (1953) | AX173: =A173 -> 27481
A174: =A173+7 -> 27488 | F174: You | G174: The Flintstones | H174: Cartoon Castle | I174: Petticoat Junction | J174: Celebrity Sweepstakes (NBC) | K174: Nanny and the Professor | L174: Now You See It (CBS) | M174: Bold Ones | O174: Search for Tomorrow (CBS) | P174: How to Survive a Marriage (NBC) | Q174: Movie [Matinee 12]: The Buccaneer (1938) | V174: Gomer Pyle, USMC | W174: Batman | X174: Ramblin' Rod | Y174: The Mickey Mouse Club | Z174: The Mod Squad | AB174: Star Trek | AD174: The The FBI | AF174: Movie [The Movie]: City Beneath the Sea (1953) | AJ174: The 10 O'Clock News | AL174: Movie [Movie 12]: Bengal Brigade (1954) | AO174: [12:45] Movie [Movie 12]: Man in the Shadow (1957) | AX174: =A174 -> 27488
A175: =A174+7 -> 27495 | F175: You | G175: The Flintstones | H175: Cartoon Castle | I175: Petticoat Junction | J175: Celebrity Sweepstakes (NBC) | K175: Nanny and the Professor | L175: Now You See It (CBS) | M175: Bold Ones | O175: Search for Tomorrow (CBS) | P175: How to Survive a Marriage (NBC) | Q175: Movie [Matinee 12]: Kings Go Forth (1958) | V175: Gomer Pyle, USMC | W175: Batman | X175: Ramblin' Rod | Y175: The Mickey Mouse Club | Z175: The Mod Squad | AB175: Star Trek | AD175: The The FBI | AF175: Movie [The Movie]: Branded (1950) | AJ175: The 10 O'Clock News | AL175: Panogeric IV | AN175: Movie [Movie 12]: Twilight for the Gods (1958) | AR175: [2:25] Movie [Movie 12]: When the Daltons Rode (1940) | AX175: =A175 -> 27495
A176: =A175+7 -> 27502 | F176: You | G176: The Flintstones | H176: Cartoon Castle | I176: Petticoat Junction | J176: Celebrity Sweepstakes (NBC) | K176: Nanny and the Professor | L176: Now You See It (CBS) | M176: Bold Ones | O176: Search for Tomorrow (CBS) | P176: TBA | Q176: Movie [Matinee 12]: Gentleman Jim (1942) | V176: Gomer Pyle, USMC | W176: Batman | X176: Ramblin' Rod | Y176: The Mickey Mouse Club | Z176: The Mod Squad | AB176: Star Trek | AD176: The The FBI | AF176: Movie [The Movie]: Take One False Step (1949) | AJ176: The 10 O'Clock News | AL176: Movie [Movie 12]: Magnificent Obsession (1954) | AO176: Movie [Movie 12]: The Fat Man (1951) | AX176: =A176 -> 27502
A177: =A176+7 -> 27509 | F177: You | G177: The Flintstones | H177: Cartoon Castle | J177: Celebrity Sweepstakes (NBC) | K177: Petticoat Junction | L177: Now You See It (CBS) | M177: Mister Ed | N177: I Dream of Jeannie | O177: Search for Tomorrow (CBS) | P177: Perry Mason | R177: Movie [Matinee 12]: Ride the Pink Horse (1947) | V177: Gomer Pyle, USMC | W177: Gentle Ben | X177: Ramblin' Rod | Y177: The Mickey Mouse Club | Z177: The Mod Squad | AB177: Star Trek | AD177: The The FBI | AF177: Movie [The Movie]: Cat Ballou (1965) | AJ177: The 10 O'Clock News | AL177: Movie [Movie 12]: Sirocco (1951) | AX177: =A177 -> 27509
A178: =A177+7 -> 27516 | F178: You | G178: The Flintstones | H178: Cartoon Castle | J178: Celebrity Sweepstakes (NBC) | K178: Petticoat Junction | L178: Now You See It (CBS) | M178: Mister Ed | N178: I Dream of Jeannie | O178: Search for Tomorrow (CBS) | P178: Perry Mason | R178: Movie [Matinee 12]: The Lively Set (1964) | V178: Gomer Pyle, USMC | W178: Gentle Ben | X178: Ramblin' Rod | Y178: The Mickey Mouse Club | Z178: The Mod Squad | AB178: Star Trek | AD178: The The FBI | AF178: Movie [The Movie]: Brock's Last Case (1973) | AJ178: The 10 O'Clock News | AL178: Movie [Movie 12]: The Caine Mutiny (1954) | AX178: =A178 -> 27516
A179: =A178+7 -> 27523 | F179: You | G179: The Flintstones | H179: Cartoon Castle | J179: Celebrity Sweepstakes (NBC) | K179: Petticoat Junction | L179: Now You See It (CBS) | M179: Mister Ed | N179: I Dream of Jeannie | O179: Search for Tomorrow (CBS) | P179: Perry Mason | R179: Movie [Matinee 12]: The Midnight Story (1957) | V179: Gomer Pyle, USMC | W179: Gentle Ben | X179: Ramblin' Rod | Y179: The Mickey Mouse Club | Z179: The Mod Squad | AB179: Star Trek | AD179: The The FBI | AF179: Movie [The Movie]: Murder One (1969) | AJ179: The 10 O'Clock News | AL179: Movie [Movie 12]: In a Lonely Place (1950) | AX179: =A179 -> 27523
A180: =A179+7 -> 27530 | F180: You | G180: The Flintstones | H180: Cartoon Castle | J180: Celebrity Sweepstakes (NBC) | K180: Petticoat Junction | L180: Now You See It (CBS) | M180: Mister Ed | N180: I Dream of Jeannie | O180: Search for Tomorrow (CBS) | P180: Perry Mason | R180: Movie [Matinee 12]: Meet Danny Wilson (1952) | V180: Gomer Pyle, USMC | W180: Gentle Ben | X180: Ramblin' Rod | Y180: The Mickey Mouse Club | Z180: The Mod Squad | AB180: Star Trek | AD180: The The FBI | AF180: Movie [The Movie]: Operation: Cobra (1971) | AJ180: The 10 O'Clock News | AL180: Movie [Movie 12]: The Harder They Fall (1956) | AP180: [1:10] Movie [Movie 12]: No Name on the Bullet (1959) | AX180: =A180 -> 27530
A181: =A180+7 -> 27537 | F181: You | G181: The Flintstones | H181: Cartoon Castle | J181: Celebrity Sweepstakes (NBC) | K181: Petticoat Junction | L181: Now You See It (CBS) | M181: Mister Ed | N181: I Dream of Jeannie | O181: Search for Tomorrow (CBS) | P181: Perry Mason | R181: Movie [Matinee 12]: The Raging Tide (1951) | V181: Gomer Pyle, USMC | W181: Gentle Ben | X181: Ramblin' Rod | Y181: The Mickey Mouse Club | Z181: The Mod Squad | AB181: Star Trek | AD181: The The FBI | AF181: Movie [The Movie]: The Marrying Kind (1952) | AJ181: The 10 O'Clock News | AL181: Movie [Movie 12]: Knock on Any Door (1949) | AX181: =A181 -> 27537
A182: =A181+7 -> 27544 | F182: You | G182: The Flintstones | H182: Cartoon Castle | J182: Celebrity Sweepstakes (NBC) | K182: Petticoat Junction | L182: Now You See It (CBS) | M182: Mister Ed | N182: I Dream of Jeannie | O182: Search for Tomorrow (CBS) | P182: Perry Mason | R182: Movie [Matinee 12]: Corvette K-225 (1943) | V182: Gomer Pyle, USMC | W182: Gentle Ben | X182: Ramblin' Rod | Y182: The Mickey Mouse Club | Z182: The Mod Squad | AB182: Star Trek | AD182: The The FBI | AF182: Movie [The Movie]: The Bravos (1972) | AJ182: The 10 O'Clock News | AL182: Movie [Movie 12]: Tokyo Joe (1949) | AX182: =A182 -> 27544
A183: =A182+7 -> 27551 | F183: You | G183: The Flintstones | H183: Cartoon Castle | J183: Celebrity Sweepstakes (NBC) | K183: Petticoat Junction | L183: Now You See It (CBS) | M183: Mister Ed | N183: I Dream of Jeannie | O183: Search for Tomorrow (CBS) | P183: Perry Mason | R183: Movie [Matinee 12]: Air Cadet (1951) | V183: Gomer Pyle, USMC | W183: Batman | X183: Ramblin' Rod | Y183: The Mickey Mouse Club | Z183: The Mod Squad | AB183: Star Trek | AD183: The The FBI | AF183: Movie [The Movie]: Ellery Queen: Don't Look Behind You (1971) | AJ183: The 10 O'Clock News | AL183: Movie [Movie 12]: Touch of Evil (1958) | AX183: =A183 -> 27551
A184: =A183+7 -> 27558 | F184: You | G184: The Flintstones | H184: Cartoon Castle | J184: Celebrity Sweepstakes (NBC) | K184: Petticoat Junction | L184: Now You See It (CBS) | M184: Mister Ed | N184: I Dream of Jeannie | O184: Search for Tomorrow (CBS) | P184: Perry Mason | R184: Movie [Matinee 12]: Because of You (1952) | V184: Gomer Pyle, USMC | W184: Batman | X184: Ramblin' Rod | Y184: The Mickey Mouse Club | Z184: The Mod Squad | AB184: Star Trek | AD184: The The FBI | AF184: Movie [The Movie]: How I Spent My Summer Vacation (1966) | AJ184: The 10 O'Clock News | AL184: Movie [Movie 12]: The Running Man (1963) | AX184: =A184 -> 27558
A185: =A184+7 -> 27565 | F185: You | G185: The Flintstones | H185: Cartoon Castle | J185: Celebrity Sweepstakes (NBC) | K185: Petticoat Junction | L185: Tattletales (CBS) | M185: Mister Ed | N185: I Dream of Jeannie | O185: Search for Tomorrow (CBS) | P185: Perry Mason | R185: Movie [Matinee 12]: City Across the River (1949) | V185: Gomer Pyle, USMC | W185: Batman | X185: Ramblin' Rod | Y185: The Mickey Mouse Club | Z185: The Mod Squad | AB185: Star Trek | AD185: The The FBI | AF185: Movie [The Movie]: Madame X (1966) | AJ185: The 10 O'Clock News | AL185: Movie [Movie 12]: The Champagne Murders (1967) | AX185: =A185 -> 27565
A186: =A185+7 -> 27572 | F186: You | G186: The Flintstones | H186: Cartoon Castle | J186: Celebrity Sweepstakes (NBC) | K186: Petticoat Junction | L186: Tattletales (CBS) | M186: Mister Ed | N186: I Dream of Jeannie | O186: Search for Tomorrow (CBS) | P186: Perry Mason | R186: Movie [Matinee 12]: The Runaround (1946) | V186: Land of the Giants | X186: Ramblin' Rod | Y186: The Mickey Mouse Club | Z186: The Mod Squad | AB186: Star Trek | AD186: The The FBI | AF186: Movie [The Movie]: Raw Edge (1956) | AJ186: The 10 O'Clock News--Michael Hartfield/Sylvia Stinson | AL186: Movie [Movie 12]: I Love a Mystery (1966) | AX186: =A186 -> 27572
A187: =A186+7 -> 27579 | F187: You | G187: The Flintstones | H187: Cartoon Castle | J187: Celebrity Sweepstakes (NBC) | K187: Petticoat Junction | L187: Tattletales (CBS) | M187: Mister Ed | N187: I Dream of Jeannie | O187: Search for Tomorrow (CBS) | P187: Perry Mason | R187: Movie [Matinee 12]: The Wild and the Innocent (1959) | V187: Land of the Giants | X187: Ramblin' Rod | Y187: The Mickey Mouse Club | Z187: The Mod Squad | AB187: Star Trek | AD187: Oral Roberts | AF187: Movie [The Movie]: Buchanan Rides Alone (1958) | AJ187: The 10 O'Clock News--Michael Hartfield/Sylvia Stinson | AL187: Movie [Movie 12]: Battle Hymn (1956) | AX187: =A187 -> 27579
A188: =A187+7 -> 27586 | F188: You | G188: The Flintstones | H188: Cartoon Castle | J188: Celebrity Sweepstakes (NBC) | K188: Petticoat Junction | L188: Tattletales (CBS) | M188: Mister Ed | N188: Safari to Adventure | O188: Search for Tomorrow (CBS) | P188: Perry Mason | R188: Movie [Matinee 12]: The Fighting O'Flynn (1948) | V188: Land of the Giants | X188: Ramblin' Rod | Y188: The Mickey Mouse Club | Z188: Mission: Impossible | AB188: Star Trek | AD188: The The FBI | AF188: Movie [The Movie]: A Day of Fury (1956) | AJ188: The 10 O'Clock News--Michael Hartfield/Sylvia Stinson | AL188: Movie [Movie 12]: The Mountain Road (1960) | AX188: =A188 -> 27586
A189: =A188+7 -> 27593 | F189: You | G189: Cartoon Castle | I189: Nanny and the Professor | J189: Celebrity Sweepstakes (NBC) | K189: Audubon Wildlife Theatre | L189: Tattletales (CBS) | M189: Gomer Pyle, USMC | N189: Safari to Adventure | O189: Search for Tomorrow (CBS) | P189: Perry Mason | R189: Movie [Matinee 12]: Champagne for Caesar (1950) | V189: Land of the Giants | X189: Ramblin' Rod | Y189: The Mickey Mouse Club | Z189: Mission: Impossible | AB189: Star Trek | AD189: The The FBI | AF189: Movie [The Movie]: Wild Heritage (1958) | AI189: Porter Wagoner | AJ189: The 10 O'Clock News--Michael Hartfield/Sylvia Stinson | AL189: Movie [Movie 12]: Impact (1949) | AX189: =A189 -> 27593
A190: =A189+7 -> 27600 | F190: You | G190: Cartoon Castle | I190: Nanny and the Professor | J190: Celebrity Sweepstakes (NBC) | K190: Audubon Wildlife Theatre | L190: Tattletales (CBS) | M190: Gomer Pyle, USMC | N190: Safari to Adventure | O190: Search for Tomorrow (CBS) | P190: Perry Mason | R190: Movie [Matinee 12]: The Last Time I Saw Archie (1961) | V190: Land of the Giants | X190: Ramblin' Rod | Y190: The Mickey Mouse Club | Z190: Mission: Impossible | AB190: Star Trek | AD190: Movie [The Movie]: Gunsmoke (1953) | AG190: Boxing: Mike Quarry vs Petro Soto from Las Vegas | AI190: Porter Wagoner | AJ190: The 10 O'Clock News--Michael Hartfield/Sylvia Stinson | AL190: Movie [Movie 12]: They Died with Their Boots On (1941) | AX190: =A190 -> 27600
A191: =A190+7 -> 27607 | F191: You | G191: Cartoon Castle | I191: Nanny and the Professor | J191: Celebrity Sweepstakes (NBC) | K191: Audubon Wildlife Theatre | L191: Tattletales (CBS) | M191: Gomer Pyle, USMC | N191: Safari to Adventure | O191: Search for Tomorrow (CBS) | P191: Perry Mason | R191: Movie [Matinee 12]: The Square Jungle (1955) | V191: Land of the Giants | X191: Ramblin' Rod | Y191: The Mickey Mouse Club | Z191: Mission: Impossible | AB191: Star Trek | AD191: Movie [The Movie]: Quantez (1957) | AG191: Boxing: Ernie Shavers vs Henry Clark from Las Vegas | AI191: Porter Wagoner | AJ191: The 10 O'Clock News--Michael Hartfield/Sylvia Stinson | AL191: Movie [Movie 12]: The Devil at 4 O'clock (1961) | AX191: =A191 -> 27607
A192: =A191+7 -> 27614 | F192: You | G192: Cartoon Castle | I192: Nanny and the Professor | J192: Celebrity Sweepstakes (NBC) | K192: Audubon Wildlife Theatre | L192: Tattletales (CBS) | M192: Gomer Pyle, USMC | N192: Safari to Adventure | O192: Search for Tomorrow (CBS) | P192: Perry Mason | R192: Movie [Matinee 12]: The Mating Season (1951) | V192: Land of the Giants | X192: Ramblin' Rod | Y192: The Mickey Mouse Club | Z192: Mission: Impossible | AB192: Star Trek | AD192: Movie [The Movie]: Star in the Dust (1956) | AG192: Boxing: Mike Rossman vs Mike Nixon from Las Vegas | AI192: Porter Wagoner | AJ192: The 10 O'Clock News--Michael Hartfield/Sylvia Stinson | AL192: Movie [Movie 12]: The Satan Bug (1965) | AX192: =A192 -> 27614
A193: =A192+7 -> 27621 | F193: You | G193: Cartoon Castle | I193: Nanny and the Professor | J193: Celebrity Sweepstakes (NBC) | K193: Audubon Wildlife Theatre | L193: Tattletales (CBS) | M193: Gomer Pyle, USMC | N193: Safari to Adventure | O193: Search for Tomorrow (CBS) | P193: Perry Mason | R193: Movie [Matinee 12]: The Lonely Man (1957) | V193: Land of the Giants | X193: Ramblin' Rod | Y193: The Mickey Mouse Club | Z193: Mission: Impossible | AB193: Star Trek | AD193: Movie [The Movie]: Ride Clear of Diable (1954) | AG193: Boxing: Eugene "Cyclone" Hart vs "Sugar" Ray Seales from Atlantic City | AI193: Porter Wagoner | AJ193: The 10 O'Clock News--Michael Hartfield/Sylvia Stinson | AL193: Movie [Movie 12]: Man of a Thousand Faces (1957) | AX193: =A193 -> 27621
A194: =A193+7 -> 27628 | F194: You | G194: Cartoon Castle | I194: Nanny and the Professor | J194: Petticoat Junction | K194: Movie [The Morning Movie]: Francis Joins the WACs (1954) | O194: Search for Tomorrow (CBS) | P194: Perry Mason | R194: Movie [Matinee 12]: The Shrike (1955) | V194: Land of the Giants | X194: Ramblin' Rod | Y194: The Mickey Mouse Club | Z194: Mission: Impossible | AB194: Star Trek | AD194: Movie [The Movie]: You Never Can Tell (1951) | AG194: Boxing: Ray Lunny III vs Vilomar Fernandez from San Francisco | AI194: Porter Wagoner | AJ194: The 10 O'Clock News--Michael Hartfield/Sylvia Stinson | AL194: Movie [Movie 12]: The Great Impostor (1961) | AX194: =A194 -> 27628
A195: =A194+7 -> 27635 | F195: You | G195: Cartoon Castle | I195: Nanny and the Professor | J195: Petticoat Junction | K195: Movie [The Morning Movie]: The 3 Worlds of Gulliver (1960) | O195: Search for Tomorrow (CBS) | P195: Perry Mason | R195: Movie [Matinee 12]: My Dear Secretary (1948) | V195: I Dream of Jeannie | W195: Speed Racer | X195: Ramblin' Rod | Y195: The Mickey Mouse Club | Z195: Mission: Impossible | AB195: Star Trek | AD195: Movie [The Movie]: The Bank Dick (1940) | AG195: Boxing: Monroe Brooks vs Adolph Viruet from Las Vegas | AI195: Porter Wagoner | AJ195: The 10 O'Clock News--Michael Hartfield/Sylvia Stinson | AL195: Movie [Movie 12]: Anatomy of a Murder (1959) | AX195: =A195 -> 27635
A196: =A195+7 -> 27642 | F196: You | G196: Cartoon Castle | I196: Nanny and the Professor | J196: Petticoat Junction | K196: Movie [The Morning Movie]: The Second Woman (1951) | O196: Search for Tomorrow (CBS) | P196: Perry Mason | R196: Movie [Matinee 12]: Ivy (1947) | V196: I Dream of Jeannie | W196: Speed Racer | X196: Ramblin' Rod | Y196: The Mickey Mouse Club | Z196: Mission: Impossible | AB196: Star Trek | AD196: Movie [The Movie]: The Desert Hawk (1950) | AG196: Boxing: Mike Rossman vs Mike Quarry from Las Vegas | AI196: Porter Wagoner | AJ196: The 10 O'Clock News--Michael Hartfield/Sylvia Stinson | AL196: Movie [Movie 12]: Romanoff and Juliet (1961) | AX196: =A196 -> 27642
A197: =A196+7 -> 27649 | F197: You | G197: Ramblin' Rod | I197: Gomer Pyle, USMC | J197: Petticoat Junction | K197: Movie [The Morning Movie]: Bright Victory (1951) | O197: Search for Tomorrow (CBS) | P197: Perry Mason | R197: Movie [Matinee 12]: The Happy Thieves (1962) | V197: I Dream of Jeannie | W197: Speed Racer | X197: The Flintstones | Y197: The Mickey Mouse Club | Z197: The Courtship of Eddie's Father | AA197: Room 222 | AB197: Adam-12 | AC197: Adam-12 | AD197: The The FBI | AF197: Movie [The Movie]: Bunny Lake is Missing (1965) | AJ197: The 10 O'Clock News | AL197: Movie [Movie 12]: The Notorious Landlady (1962) | AX197: =A197 -> 27649
A198: =A197+7 -> 27656 | F198: You | G198: Ramblin' Rod | I198: Gomer Pyle, USMC | J198: Petticoat Junction | K198: Movie [The Morning Movie]: Meet Danny Wilson (1952) | O198: Search for Tomorrow (CBS) | P198: Perry Mason | R198: Movie [Matinee 12]: An Act of Murder (1948) | V198: I Dream of Jeannie | W198: Speed Racer | X198: The Flintstones | Y198: The Mickey Mouse Club | Z198: The Courtship of Eddie's Father | AA198: Room 222 | AB198: Adam-12 | AC198: Adam-12 | AD198: The The FBI | AF198: Movie [The Movie]: No Man is an Island (1962) | AJ198: The 10 O'Clock News | AL198: Movie [Movie 12]: Luv (1967) | AX198: =A198 -> 27656
A199: =A198+7 -> 27663 | F199: You | G199: Ramblin' Rod | I199: Gomer Pyle, USMC | J199: Petticoat Junction | K199: Movie [The Morning Movie]: Willie and Joe Back at the Front (1952) | O199: Search for Tomorrow (CBS) | P199: Perry Mason | R199: Movie [Matinee 12]: The Restless Years (1958) | V199: I Dream of Jeannie | W199: Speed Racer | X199: The Flintstones | Y199: The Mickey Mouse Club | Z199: The Courtship of Eddie's Father | AA199: Room 222 | AB199: Adam-12 | AC199: Adam-12 | AD199: The The FBI | AF199: Movie [The Movie]: Lover Come Back (1962) | AJ199: The 10 O'Clock News | AL199: Movie [Movie 12]: Johnny Cool (1963) | AX199: =A199 -> 27663
A200: =A199+7 -> 27670 | F200: You | G200: Ramblin' Rod | I200: Gomer Pyle, USMC | J200: Petticoat Junction | K200: Movie [The Morning Movie]: Shadow of a Doubt (1942) | O200: Search for Tomorrow (CBS) | P200: Perry Mason | R200: Movie [Matinee 12]: Louisa (1950) | V200: I Dream of Jeannie | W200: Speed Racer | X200: The Flintstones | Y200: The Mickey Mouse Club | Z200: The Courtship of Eddie's Father | AA200: Room 222 | AB200: Adam-12 | AC200: Adam-12 | AD200: The The FBI | AF200: Movie [The Movie]: Escape of the Birdmen (1971) | AJ200: The 10 O'Clock News | AL200: Movie [Movie 12]: Alvarez Kelly (1966) | AX200: =A200 -> 27670
A201: =A200+7 -> 27677 | F201: You | G201: Ramblin' Rod | I201: Gomer Pyle, USMC | J201: Petticoat Junction | K201: Movie [The Morning Movie]: The Fat Man (1951) | N201: Not for Women Only | O201: Search for Tomorrow (CBS) | P201: Perry Mason | R201: Movie [Matinee 12]: Champagne for Caesar (1950) | V201: I Dream of Jeannie | W201: Speed Racer | X201: The Flintstones | Y201: The Mickey Mouse Club | Z201: The Courtship of Eddie's Father | AA201: Room 222 | AB201: Adam-12 | AC201: Adam-12 | AD201: The The FBI | AF201: Movie [The Movie]: The Mouse That Roared (1959) | AJ201: The 10 O'Clock News | AL201: Movie [Movie 12]: Roman Holiday (1953) | AX201: =A201 -> 27677
A202: =A201+7 -> 27684 | F202: You | G202: Ramblin' Rod | I202: Gomer Pyle, USMC | J202: Petticoat Junction | K202: Movie [The Morning Movie]: The Price of Fear (1956) | N202: Not for Women Only | O202: Search for Tomorrow (CBS) | P202: Perry Mason | R202: Movie [Matinee 12]: Hide and Seek (1964) | V202: I Dream of Jeannie | W202: Speed Racer | X202: The Flintstones | Y202: The Mickey Mouse Club | Z202: The Courtship of Eddie's Father | AA202: Room 222 | AB202: Adam-12 | AC202: Adam-12 | AD202: The The FBI | AF202: Movie [The Movie]: The Doomsday Flight (1966) | AJ202: The 10 O'Clock News | AL202: Movie [Movie 12]: Red Sky at Morning (1971) | AX202: =A202 -> 27684
A203: =A202+7 -> 27691 | F203: You | G203: Ramblin' Rod | I203: Gomer Pyle, USMC | J203: Petticoat Junction | K203: Movie [The Morning Movie]: Singapore (1947) | N203: Not for Women Only | O203: Search for Tomorrow (CBS) | P203: Perry Mason | R203: Movie [Matinee 12]: Six Bridges to Cross (1955) | V203: I Dream of Jeannie | W203: Speed Racer | X203: The Flintstones | Y203: The Mickey Mouse Club | Z203: The Courtship of Eddie's Father | AA203: Room 222 | AB203: Adam-12 | AC203: Adam-12 | AD203: The The FBI | AF203: NBA Basketball: Portland Trail Blazers vs Seattle SuperSonics | AJ203: Trail Blazers Post Game Show | AK203: The 10 O'Clock News | AL203: Movie [Movie 12]: Summer and Smoke (1961) | AX203: =A203 -> 27691
A204: =A203+7 -> 27698 | F204: You | G204: Ramblin' Rod | I204: Gomer Pyle, USMC | J204: Petticoat Junction | K204: Movie [The Morning Movie]: Take Me to Town (1953) | N204: Not for Women Only | O204: Search for Tomorrow (CBS) | P204: Perry Mason | R204: Movie [Matinee 12]: City Across the River (1949) | V204: I Dream of Jeannie | W204: Speed Racer | X204: The Flintstones | Y204: The Mickey Mouse Club | Z204: The Courtship of Eddie's Father | AA204: Room 222 | AB204: Adam-12 | AC204: Adam-12 | AD204: The The FBI | AF204: Movie [The Movie]: Rhubarb (1951) | AJ204: The 10 O'Clock News | AL204: Movie [Movie 12]: The Great Northfield, Minnesota Raid (1972) | AX204: =A204 -> 27698
A205: =A204+7 -> 27705 | F205: You | G205: Ramblin' Rod | I205: Gomer Pyle, USMC | J205: Petticoat Junction | K205: Movie [The Morning Movie]: Seven Sinners (1940) | N205: Not for Women Only | O205: Search for Tomorrow (CBS) | P205: Perry Mason | R205: Movie [Matinee 12]: There's Always Tomorrow (1956) | V205: I Dream of Jeannie | W205: Speed Racer | X205: The Flintstones | Y205: The Mickey Mouse Club | Z205: The Courtship of Eddie's Father | AA205: Room 222 | AB205: Adam-12 | AC205: Adam-12 | AD205: The The FBI | AF205: Movie [The Movie]: The Girl in the Red Velvet Swing (1955) | AJ205: The 10 O'Clock News | AK205: OMSI Auction--Rod Anders | AN205: Movie [Movie 12]: One More Train to Rob (1971) | AX205: =A205 -> 27705
A206: =A205+7 -> 27712 | F206: You | G206: Ramblin' Rod | I206: Gomer Pyle, USMC | J206: Petticoat Junction | K206: Movie [The Morning Movie]: The Flame of New Orleans (1941) | N206: Not for Women Only | O206: Search for Tomorrow (CBS) | P206: Perry Mason | R206: Movie [Matinee 12]: Family Honeymoon (1948) | V206: I Dream of Jeannie | W206: Speed Racer | X206: The Flintstones | Y206: The Mickey Mouse Club | Z206: The Courtship of Eddie's Father | AA206: Room 222 | AB206: Adam-12 | AC206: Adam-12 | AD206: The The FBI | AF206: Movie [The Movie]: Night People (1954) | AJ206: The 10 O'Clock News | AL206: Movie [Movie 12]: Sabrina (1954) | AX206: =A206 -> 27712
A207: =A206+7 -> 27719 | F207: Ounce of Prevention | G207: Ramblin' Rod | I207: Gomer Pyle, USMC | J207: Petticoat Junction | K207: Movie [The Morning Movie]: The Ride Back (1957) | N207: Not for Women Only | O207: Search for Tomorrow (CBS) | P207: Perry Mason | R207: Movie [Matinee 12]: Take One False Step (1949) | V207: I Dream of Jeannie | W207: Speed Racer | X207: The Flintstones | Y207: The Mickey Mouse Club | Z207: The Courtship of Eddie's Father | AA207: Room 222 | AB207: Adam-12 | AC207: Adam-12 | AD207: The The FBI | AF207: Movie [The Movie]: Red Skies of Montana (1952) | AJ207: The 10 O'Clock News | AL207: Movie [Movie 12]: The Marcus-Nelson Murders (1973) | AX207: =A207 -> 27719
A208: =A207+7 -> 27726 | F208: Ounce of Prevention | G208: Ramblin' Rod | I208: Gomer Pyle, USMC | J208: Petticoat Junction | K208: Movie [The Morning Movie]: Bonzo Goes to College (1952) | N208: Not for Women Only | O208: Search for Tomorrow (CBS) | P208: Perry Mason | R208: Movie [Matinee 12]: Francis Joins the WACS (1954) | V208: I Dream of Jeannie | W208: Speed Racer | X208: The Flintstones | Y208: The Mickey Mouse Club | Z208: The Courtship of Eddie's Father | AA208: Room 222 | AB208: Adam-12 | AC208: Adam-12 | AD208: Billy Graham Crusade | AF208: Movie [The Movie]: In Love and War (1958) | AJ208: The 10 O'Clock News | AL208: Movie [Movie 12]: The Chase (1966) | AX208: =A208 -> 27726
A209: =A208+7 -> 27733 | F209: Ounce of Prevention | G209: Ramblin' Rod | I209: Gomer Pyle, USMC | J209: Petticoat Junction | K209: Movie [The Morning Movie]: Quicksand (1950) | N209: Not for Women Only | O209: Search for Tomorrow (CBS) | P209: Perry Mason | R209: Movie [Matinee 12]: The Sun Never Sets (1939) | V209: I Dream of Jeannie | W209: Speed Racer | X209: The Flintstones | Y209: The Mickey Mouse Club | Z209: The Courtship of Eddie's Father | AA209: Room 222 | AB209: Adam-12 | AC209: Adam-12 | AD209: The The FBI | AF209: Movie [The Movie]: Winchester for Hire (1967) | AJ209: The 10 O'Clock News | AL209: Movie [Movie 12]: Pal Joey (1957) | AX209: =A209 -> 27733
A210: =A209+7 -> 27740 | F210: Ounce of Prevention | G210: Ramblin' Rod | I210: Gomer Pyle, USMC | J210: Petticoat Junction | K210: Movie [The Morning Movie]: Money, Women and Guns (1958) | N210: Not for Women Only | O210: Search for Tomorrow (CBS) | P210: Perry Mason | R210: Movie [Matinee 12]: Once More, My Darling (1949) | V210: I Dream of Jeannie | W210: Speed Racer | X210: The Flintstones | Y210: The Mickey Mouse Club | Z210: The Courtship of Eddie's Father | AA210: Room 222 | AB210: Adam-12 | AC210: Adam-12 | AD210: The The FBI | AF210: Lundstroms Headin' West | AH210: The Kopycats | AJ210: The 10 O'Clock News | AL210: Movie [Movie 12]: The Glenn Miller Story (1954) | AX210: =A210 -> 27740
A211: =A210+7 -> 27747 | F211: Ounce of Prevention | G211: Ramblin' Rod | I211: Gomer Pyle, USMC | J211: Petticoat Junction | K211: Movie [The Morning Movie]: D.O.A. (1949) | N211: Not for Women Only | O211: Search for Tomorrow (CBS) | P211: Perry Mason | R211: Movie [Matinee 12]: Hired Wife (1940) | V211: I Dream of Jeannie | W211: Speed Racer | X211: The Flintstones | Y211: The Mickey Mouse Club | Z211: Blue-Grey Game | AF211: Movie [The Movie]: Magnificent Thief (1967) | AJ211: The 10 O'Clock News | AL211: Movie [Movie 12]: Away All Boats (1956) | AX211: =A211 -> 27747
A212: =A211+7 -> 27754 | F212: Ounce of Prevention | G212: Ramblin' Rod | I212: Gomer Pyle, USMC | J212: Petticoat Junction | K212: Movie [The Morning Movie]: Everything's Ducky (1961) | N212: Not for Women Only | O212: TBA | P212: Perry Mason | R212: Movie [Matinee 12]: Destry Rides Again (1939) | V212: I Dream of Jeannie | W212: Speed Racer | X212: The Flintstones | Y212: The Mickey Mouse Club | Z212: The Courtship of Eddie's Father | AA212: Room 222 | AB212: Adam-12 | AC212: Adam-12 | AD212: The The FBI | AF212: NBA Basketball: Portland Trail Blazers vs Los Angeles Lakers | AK212: The 10 O'Clock News | AM212: Movie [Movie 12]: Sunshine (1973) | AX212: =A212 -> 27754
A213: 1976 | AX213: =A213 -> 1976
A214: 27761 | F214: Ounce of Prevention | G214: Ramblin' Rod | I214: Gomer Pyle, USMC | J214: Petticoat Junction | K214: Movie [The Morning Movie]: The Bandit of Zhobe (1959) | N214: Not for Women Only | O214: Search for Tomorrow (CBS) | P214: Perry Mason | R214: Movie [Matinee 12]: The Crimson Blade (1963) | V214: I Dream of Jeannie | W214: Speed Racer | X214: The Flintstones | Y214: The Mickey Mouse Club | Z214: The Courtship of Eddie's Father | AA214: Room 222 | AB214: Adam-12 | AC214: Adam-12 | AD214: The The FBI | AF214: Movie [The Movie]: Good Morning, Miss Dove (1955) | AJ214: The 10 O'Clock News | AL214: Movie [Movie 12]: Untamed (1955) | AX214: =A214 -> 27761
A217: 1977 | AX217: =A217 -> 1977
A220: 1978 | AX220: =A220 -> 1978
A223: 1979 | AX223: =A223 -> 1979
A226: 1980 | AX226: =A226 -> 1980
A227: 29231 | E227: Health Field | F227: Big Blue Marble | G227: Ramblin' Rod | I227: Krofft Superstars | J227: Marcus Welby, M.D. | L227: Bonanza | N227: Match Game | O227: The New Joker's Wild | P227: Perry Mason | R227: Movie [Matinee 12]: The Desert Fox (1951) | V227: Room 222 | W227: Bugs Bunny & Friends | X227: The Flintstones | Y227: Gilligan's Island | Z227: The Brady Bunch | AA227: Bewitched | AB227: The Bionic Woman | AD227: Happy Days Again | AE227: I Love Lucy | AF227: Movie [The Movie]: Murder One (1969) | AJ227: The 10 O'Clock News | AL227: The Benny Hill Show | AM227: The Odd Couple | AN227: Movie: [Movie 12]: Man of a Thousand Faces (1957) | AX227: =AX226+7 -> 1987
A228: 29238 | E228: Health Field | F228: Big Blue Marble | G228: Ramblin' Rod | I228: Krofft Superstars | J228: Marcus Welby, M.D. | L228: Bonanza | N228: Match Game | O228: The New Joker's Wild | P228: Perry Mason | R228: Movie [Matinee 12]: Submarine Command (1951) | V228: Bewitched | W228: Bugs Bunny & Friends | X228: The Flintstones | Y228: The Brady Bunch | Z228: Star Trek | AB228: Emergency One! | AD228: Happy Days Again | AE228: Hogan's Heroes | AF228: Movie [The Movie]: Lovers and Other Strangers (1970) | AJ228: The 10 O'Clock News | AL228: The Benny Hill Show | AM228: The Odd Couple | AN228: Movie: [Movie 12]: What Ever Happened to Aunt Alice? (1969) | AX228: =AX227+7 -> 1994
A229: 29245 | E229: Health Field | F229: Big Blue Marble | G229: Ramblin' Rod | I229: Krofft Superstars | J229: Marcus Welby, M.D. | L229: Bonanza | N229: Match Game | O229: The New Joker's Wild | P229: Perry Mason | R229: Movie [Matinee 12]: Retreat, Hell! (1952) | V229: Bewitched | W229: Bugs Bunny & Friends | X229: The Flintstones | Y229: The Brady Bunch | Z229: Star Trek | AB229: Emergency One! | AD229: Happy Days Again | AE229: Hogan's Heroes | AF229: Movie [The Movie]: The Naked Runner (English; 1967) | AJ229: The 10 O'Clock News | AL229: The Benny Hill Show | AM229: The Odd Couple | AN229: Movie: [Movie 12]: The Grissom Gang (1971) | AX229: =AX228+7 -> 2001
A230: 29252 | E230: Health Field | F230: Big Blue Marble | G230: Ramblin' Rod | I230: Krofft Superstars | J230: Marcus Welby, M.D. | L230: Bonanza | N230: Match Game | O230: The New Joker's Wild | P230: Perry Mason | R230: Movie [Matinee 12]: Ebb Tide (1937) | V230: Bewitched | W230: Bugs Bunny & Friends | X230: The Flintstones | Y230: The Brady Bunch | Z230: Star Trek | AB230: Emergency One! | AD230: Happy Days Again | AE230: Hogan's Heroes | AF230: The Top of the Hill [Special] (Part Two) | AJ230: The 10 O'Clock News | AL230: The Benny Hill Show | AM230: The Odd Couple | AN230: Movie: [Movie 12]: The Stone Killer (1973) | AX230: =AX229+7 -> 2008