A1: THURSDAY | B1: 05:00AM | C1: 05:30AM | D1: 06:00AM | E1: 06:30AM | F1: 07:00AM | G1: 07:30AM | H1: 08:00AM | I1: 08:30AM | J1: 09:00AM | K1: 09:30AM | L1: 10:00AM | M1: 10:30AM | N1: 11:00AM | O1: 11:30AM | P1: 12:00N | Q1: 12:30PM | R1: 01:00PM | S1: 01:30PM | T1: 02:00PM | U1: 02:30PM | V1: 03:00PM | W1: 03:30PM | X1: 04:00PM | Y1: 04:30PM | Z1: 05:00PM | AA1: 05:30PM | AB1: 06:00PM | AC1: 06:30PM | AD1: 07:00PM | AE1: 07:30PM | AF1: 08:00PM | AG1: 08:30PM | AH1: 09:00PM | AI1: 09:30PM | AJ1: 10:00PM | AK1: 10:30PM | AL1: 11:00PM | AM1: 11:30PM | AN1: 12:00M | AO1: 12:30AM | AP1: 01:00AM | AQ1: 01:30AM | AR1: 02:00AM | AS1: 02:30AM | AT1: 03:00AM | AU1: 03:30AM | AV1: 04:00AM | AW1: 04:30AM | AX1: THURSDAY
A3: 1953 | AX3: =A3 -> 1953
A4: 19416 | O4: [11:45] The Garry Moore Show (CBS) | P4: The Big Payoff (NBC) | Q4: Welcome Travelers (NBC) | R4: The Kate Smith Hour (NBC) | T4: The Feminine Angle; [2:15] Arthur Godfrey Time (CBS) | U4: Strike It Rich (CBS) | V4: Movie [Matinee Theater]: Melody and Moonlight | X4: [4:15] Search For Tomorrow (CBS) | Y4: Love of Life (CBS); [4:45] Stranger Than Fiction | Z4: TBA | AA4: The Quiz Kids (CBS) | AB4: Range Rider | AC4: The CBS Evening News --Douglas Edwards (CBS); [6:45] Time for Beany | AD4: Club Embassy (NBC); [7:15] Sportsman's Club | AE4: The Dinah Shore Show (NBC); [7:45] Camel News Caravan (NBC) | AF4: You Bet Your Life (NBC) | AG4: The Burns and Allen Show (CBS) | AH4: The Unexpected | AI4: Ford Theater (NBC) | AJ4: Martin Kane, Private Eye (NBC) | AK4: Hollywood Wrestling | AM4: Movie [Nite Owl Theater]: Citadel of Crime | AX4: =A4 -> 19416
A5: =A4+7 -> 19423 | N5: Freedom Rings (CBS) | O5: Hollywood Reel; [11:45] The Garry Moore Show (CBS) | P5: The Big Payoff (NBC) | Q5: Welcome Travelers (NBC) | R5: The Kate Smith Hour (NBC) | T5: The Feminine Angle; [2:15] Arthur Godfrey Time (CBS) | U5: Strike It Rich (CBS) | V5: Movie [Matinee Theater]: The Great Train Robbery | X5: [4:15] Search For Tomorrow (CBS) | Y5: Love of Life (CBS); [4:45] Stranger Than Fiction | Z5: Howdy Doody (NBC) | AA5: TBA | AB5: Range Rider | AC5: The CBS Evening News --Douglas Edwards (CBS); [6:45] Time for Beany | AD5: Club Embassy (NBC); [7:15] Sportsman's Club | AE5: The Dinah Shore Show (NBC); [7:45] Camel News Caravan (NBC) | AF5: You Bet Your Life (NBC) | AG5: The Burns and Allen Show (CBS) | AH5: The Unexpected | AI5: Ford Theater (NBC) | AJ5: Martin Kane, Private Eye (NBC) | AK5: Hollywood Wrestling | AM5: Movie [Nite Owl Theater]: The Affairs of Jimmy Valentine | AX5: =A5 -> 19423
A6: =A5+7 -> 19430 | H6: United Nations General Assembly (NBC) | N6: Freedom Rings (CBS) | O6: Hollywood Reel; [11:45] The Garry Moore Show (CBS) | P6: The Big Payoff (NBC) | Q6: Welcome Travelers (NBC) | R6: The Kate Smith Hour (NBC) | T6: The Feminine Angle; [2:15] Arthur Godfrey Time (CBS) | U6: Strike It Rich (CBS) | V6: Movie [Matinee Theater]: Fangs of the Wild | X6: [4:15] Search For Tomorrow (CBS) | Y6: Love of Life (CBS); [4:45] Stranger Than Fiction | Z6: Howdy Doody (NBC) | AA6: Children's Program | AB6: Range Rider | AC6: The CBS Evening News --Douglas Edwards (CBS); [6:45] Time for Beany | AD6: My Hero (NBC) | AE6: The Dinah Shore Show (NBC); [7:45] Camel News Caravan (NBC) | AF6: You Bet Your Life (NBC) | AG6: The Burns and Allen Show (CBS) | AH6: The Unexpected | AI6: Ford Theater (NBC) | AJ6: Martin Kane, Private Eye (NBC) | AK6: Hollywood Wrestling | AM6: Movie [Nite Owl Theater]: Medicine Man | AX6: =A6 -> 19430
A7: =A6+7 -> 19437 | H7: United Nations General Assembly (NBC) | N7: Freedom Rings (CBS) | O7: Hollywood Reel; [11:45] The Garry Moore Show (CBS) | P7: The Big Payoff (NBC) | Q7: Welcome Travelers (NBC) | R7: The Kate Smith Hour (NBC) | T7: The Feminine Angle; [2:15] Arthur Godfrey Time (CBS) | U7: Strike It Rich (CBS) | V7: Movie [Matinee Theater]: A Scream in the Dark | X7: [4:15] Search For Tomorrow (CBS) | Y7: Love of Life (CBS); [4:45] TBA | Z7: Howdy Doody (NBC) | AA7: Children's Program | AB7: Range Rider | AC7: The CBS Evening News --Douglas Edwards (CBS); [6:45] Time for Beany | AD7: My Hero (NBC) | AE7: The Academy Awards (NBC) (Special) | AH7: The Unexpected | AI7: Ford Theater (NBC) | AJ7: Martin Kane, Private Eye (NBC) | AK7: Hollywood Wrestling | AM7: Movie [Nite Owl Theater]: Slums of New York | AX7: =A7 -> 19437
A8: =A7+7 -> 19444 | H8: United Nations General Assembly (NBC) | N8: Freedom Rings (CBS) | O8: Hollywood Reel; [11:45] The Garry Moore Show (CBS) | P8: The Big Payoff (NBC) | Q8: Welcome Travelers (NBC) | R8: The Kate Smith Hour (NBC) | T8: The Feminine Angle; [2:15] Arthur Godfrey Time (CBS) | U8: Strike It Rich (CBS) | V8: Movie [Matinee Theater]: The Girl Who Dared | X8: [4:15] Search For Tomorrow (CBS) | Y8: Love of Life (CBS); [4:45] Stranger Than Fiction | Z8: Howdy Doody (NBC) | AA8: Children's Program | AB8: Range Rider | AC8: The CBS Evening News --Douglas Edwards (CBS); [6:45] Time for Beany | AD8: My Hero (NBC) | AE8: The Dinah Shore Show (NBC); [7:45] Camel News Caravan (NBC) | AF8: You Bet Your Life (NBC) | AG8: The Burns and Allen Show (CBS) | AH8: The Unexpected | AI8: Ford Theater (NBC) | AJ8: Martin Kane, Private Eye (NBC) | AK8: Wrestling from Hollywood | AM8: Movie [Nite Owl Theater]: The Leavenworth Case | AX8: =A8 -> 19444
A9: =A8+7 -> 19451 | N9: Freedom Rings (CBS) | O9: Hollywood Reel; [11:45] The Garry Moore Show (CBS) | P9: The Big Payoff (NBC) | Q9: Welcome Travelers (NBC) | R9: The Kate Smith Hour (NBC) | T9: The Feminine Angle; [2:15] Arthur Godfrey Time (CBS) | U9: Strike It Rich (CBS) | V9: Movie [Matinee Theater]: TBA | X9: [4:15] Search For Tomorrow (CBS) | Y9: Love of Life (CBS); [4:45] Stranger Than Fiction | Z9: Howdy Doody (NBC) | AA9: TBA | AB9: Range Rider | AC9: The CBS Evening News --Douglas Edwards (CBS); [6:45] Time for Beany | AD9: My Hero (NBC) | AE9: The Dinah Shore Show (NBC); [7:45] Camel News Caravan (NBC) | AF9: You Bet Your Life (NBC) | AG9: The Burns and Allen Show (CBS) | AH9: The Unexpected | AI9: Ford Theater (NBC) | AJ9: Martin Kane, Private Eye (NBC) | AK9: Wrestling from Hollywood | AM9: Movie [Nite Owl Theater]: TBA | AX9: =A9 -> 19451
A10: =A9+7 -> 19458 | N10: Freedom Rings (CBS) | O10: Hollywood Reel; [11:45] The Garry Moore Show (CBS) | P10: The Big Payoff (NBC) | Q10: Welcome Travelers (NBC) | R10: The Kate Smith Hour (NBC) | T10: The Feminine Angle; [2:15] Arthur Godfrey Time (CBS) | U10: Strike It Rich (CBS) | V10: Movie [Matinee Theater]: Mickey the Great | X10: [4:15] Search For Tomorrow (CBS) | Y10: Love of Life (CBS); [4:45] Stranger Than Fiction | Z10: Howdy Doody (NBC) | AA10: TBA | AB10: Range Rider | AC10: The CBS Evening News --Douglas Edwards (CBS); [6:45] Time for Beany | AD10: My Hero (NBC) | AE10: The Dinah Shore Show (NBC); [7:45] Camel News Caravan (NBC) | AF10: You Bet Your Life (NBC) | AG10: The Burns and Allen Show (CBS) | AH10: The Unexpected | AI10: Ford Theater (NBC) | AJ10: Martin Kane, Private Eye (NBC) | AK10: Wrestling from Hollywood | AM10: Movie [Nite Owl Theater]: Missing Girls | AX10: =A10 -> 19458
A11: =A10+7 -> 19465 | N11: Freedom Rings (CBS) | O11: Hollywood Reel; [11:45] The Garry Moore Show (CBS) | P11: The Big Payoff (NBC) | Q11: Welcome Travelers (NBC) | R11: The Kate Smith Hour (NBC) | T11: The Feminine Angle; [2:15] Arthur Godfrey Time (CBS) | U11: Strike It Rich (CBS) | V11: Movie [Matinee Theater]: I Can't Escape | X11: [4:15] Search For Tomorrow (CBS) | Y11: Love of Life (CBS); [4:45] Stranger Than Fiction | Z11: Howdy Doody (NBC) | AA11: TBA | AB11: Range Rider | AC11: The CBS Evening News --Douglas Edwards (CBS); [6:45] Time for Beany | AD11: My Hero (NBC) | AE11: The Dinah Shore Show (NBC); [7:45] Camel News Caravan (NBC) | AF11: You Bet Your Life (NBC) | AG11: The Burns and Allen Show (CBS) | AH11: The Unexpected | AI11: Ford Theater (NBC) | AJ11: Martin Kane, Private Eye (NBC) | AK11: Wrestling from Hollywood | AM11: Movie [Nite Owl Theater]: Desert Victory | AX11: =A11 -> 19465
A12: =A11+7 -> 19472 | N12: Freedom Rings (CBS) | O12: Hollywood Reel; [11:45] The Garry Moore Show (CBS) | P12: The Big Payoff (NBC) | Q12: Welcome Travelers (NBC) | R12: The Kate Smith Hour (NBC) | T12: The Feminine Angle; [2:15] Arthur Godfrey Time (CBS) | U12: Strike It Rich (CBS) | V12: Movie [Matinee Theater]: TBA | X12: [4:15] Search For Tomorrow (CBS) | Y12: Love of Life (CBS); [4:45] Stranger Than Fiction | Z12: Howdy Doody (NBC) | AA12: TBA | AB12: Range Rider | AC12: The CBS Evening News --Douglas Edwards (CBS); [6:45] Time for Beany | AD12: My Hero (NBC) | AE12: The Dinah Shore Show (NBC); [7:45] Camel News Caravan (NBC) | AF12: You Bet Your Life (NBC) | AG12: The Burns and Allen Show (CBS) | AH12: The Unexpected | AI12: Ford Theater (NBC) | AJ12: Martin Kane, Private Eye (NBC) | AK12: Wrestling from Hollywood | AM12: Movie [Nite Owl Theater]: TBA | AX12: =A12 -> 19472
B13: OTHER CITIES SWITCH TO DAYLIGHT SAVINGS TIME; PORTLAND SHOWS AIR ONE HOUR EARLIER | J13: OTHER CITIES SWITCH TO DAYLIGHT SAVINGS TIME; PORTLAND SHOWS AIR ONE HOUR EARLIER | R13: OTHER CITIES SWITCH TO DAYLIGHT SAVINGS TIME; PORTLAND SHOWS AIR ONE HOUR EARLIER | Z13: OTHER CITIES SWITCH TO DAYLIGHT SAVINGS TIME; PORTLAND SHOWS AIR ONE HOUR EARLIER | AH13: OTHER CITIES SWITCH TO DAYLIGHT SAVINGS TIME; PORTLAND SHOWS AIR ONE HOUR EARLIER | AP13: OTHER CITIES SWITCH TO DAYLIGHT SAVINGS TIME; PORTLAND SHOWS AIR ONE HOUR EARLIER
A14: =A12+7 -> 19479 | K14: What's Cooking? | L14: Freedom Rings (CBS) | M14: Hollywood Reel; [10:45] The Garry Moore Show (CBS) | N14: The Big Payoff (NBC) | O14: Welcome Travelers (NBC) | P14: The Kate Smith Hour (NBC) | R14: Pulse of the City; [1:15] Arthur Godfrey Time (CBS) | S14: Strike It Rich (CBS) | T14: Movie [Matinee Theater]: TBA | V14: [3:15] Search For Tomorrow (CBS) | W14: Love of Life (CBS); [3:45] TBA | X14: Howdy Doody (NBC) | Y14: TBA | Z14: Range Rider | AA14: The CBS Evening News --Douglas Edwards (CBS); [5:45] Time for Beany | AB14: My Hero (NBC) | AC14: The Dinah Shore Show (NBC); [7:45] Camel News Caravan (NBC) | AD14: You Bet Your Life (NBC) | AE14: The Burns and Allen Show (CBS) | AF14: The Unexpected | AG14: Ford Theater (NBC) | AH14: Martin Kane, Private Eye (NBC) | AI14: Wrestling from Hollywood | AK14: Movie [Nite Owl Theater]: TBA | AX14: =A14 -> 19479
A15: =A14+7 -> 19486 | K15: What's Cooking? | L15: Freedom Rings (CBS) | M15: Hollywood Reel; [10:45] The Garry Moore Show (CBS) | N15: The Big Payoff (NBC) | O15: Welcome Travelers (NBC) | P15: The Kate Smith Hour (NBC) | R15: Pulse of the City; [1:15] Arthur Godfrey Time (CBS) | S15: Strike It Rich (CBS) | T15: Movie [Matinee Theater]: TBA | V15: [3:15] Search For Tomorrow (CBS) | W15: Love of Life (CBS); [3:45] TBA | X15: Howdy Doody (NBC) | Y15: Kid Magic | Z15: Range Rider | AA15: The CBS Evening News --Douglas Edwards (CBS); [5:45] Time for Beany | AB15: My Hero (NBC) | AC15: The Dinah Shore Show (NBC); [6:45] Camel News Caravan (NBC) | AD15: You Bet Your Life (NBC) | AE15: The Burns and Allen Show (CBS) | AF15: The Unexpected | AG15: Ford Theater (NBC) | AH15: Martin Kane, Private Eye (NBC) | AI15: Wrestling from Hollywood | AK15: Movie [Nite Owl Theater]: TBA | AX15: =A15 -> 19486
A16: =A15+7 -> 19493 | K16: What's Cooking? | L16: Freedom Rings (CBS) | M16: Hollywood Reel; [10:45] The Garry Moore Show (CBS) | N16: The Big Payoff (NBC) | O16: Welcome Travelers (NBC) | P16: The Kate Smith Hour (NBC) | R16: Pulse of the City; [1:15] Arthur Godfrey Time (CBS) | S16: Strike It Rich (CBS) | T16: Movie [Matinee Theater]: Kentucky Carnival | V16: [3:15] Search For Tomorrow (CBS) | W16: Love of Life (CBS); [3:45] Stranger Than Fiction | X16: Howdy Doody (NBC) | Y16: Kid Magic; [4:45] The Toymaker | Z16: Range Rider | AA16: The CBS Evening News --Douglas Edwards (CBS); [5:45] Time for Beany | AB16: My Hero (NBC) | AC16: The Dinah Shore Show (NBC); [6:45] Camel News Caravan (NBC) | AD16: You Bet Your Life (NBC) | AE16: The Burns and Allen Show (CBS) | AF16: The Unexpected | AG16: Ford Theater (NBC) | AH16: Martin Kane, Private Eye (NBC) | AI16: Wrestling from Hollywood | AK16: Movie [Nite Owl Theater]: Last Alarm | AX16: =A16 -> 19493
A17: =A16+7 -> 19500 | K17: What's Cooking? | L17: Freedom Rings (CBS) | M17: Hollywood Reel; [10:45] The Garry Moore Show (CBS) | N17: The Big Payoff (NBC) | O17: Welcome Travelers (NBC) | P17: The Kate Smith Hour (NBC) | R17: Pulse of the City; [1:15] Arthur Godfrey Time (CBS) | S17: Strike It Rich (CBS) | T17: Movie [Matinee Theater]: Scarlet Cue | V17: [3:15] Search For Tomorrow (CBS) | W17: Love of Life (CBS); [3:45] Stranger Than Fiction | X17: Howdy Doody (NBC) | Y17: Kid Magic; [4:45] The Toymaker | Z17: Range Rider | AA17: The CBS Evening News --Douglas Edwards (CBS); [5:45] Time for Beany | AB17: Candy Theater | AC17: The Dinah Shore Show (NBC); [6:45] Camel News Caravan (NBC) | AD17: You Bet Your Life (NBC) | AE17: The Burns and Allen Show (CBS) | AF17: The Unexpected | AG17: Ford Theater (NBC) | AH17: Martin Kane, Private Eye (NBC) | AI17: Wrestling from Hollywood | AK17: Movie [Nite Owl Theater]: Stunt Pilot | AX17: =A17 -> 19500
A18: =A17+7 -> 19507 | K18: What's Cooking? | L18: Freedom Rings (CBS) | M18: Hollywood Reel; [10:45] The Garry Moore Show (CBS) | N18: The Big Payoff (NBC) | O18: Welcome Travelers (NBC) | P18: The Kate Smith Hour (NBC) | R18: Pulse of the City; [1:15] Arthur Godfrey Time (CBS) | S18: Strike It Rich (CBS) | T18: Movie [Matinee Theater]: Legion of the Missing Men | V18: [3:15] Search For Tomorrow (CBS) | W18: Love of Life (CBS); [3:45] The Toy Maker | X18: Howdy Doody (NBC) | Y18: Kid Magic; [4:45] TBA | Z18: Range Rider | AA18: The CBS Evening News --Douglas Edwards (CBS); [5:45] Time for Beany | AB18: Zero-Freeze Theater | AC18: The Dinah Shore Show (NBC); [6:45] Camel News Caravan (NBC) | AD18: You Bet Your Life (NBC) | AE18: The Burns and Allen Show (CBS) | AF18: The Unexpected | AG18: Ford Theater (NBC) | AH18: Martin Kane, Private Eye (NBC) | AI18: TBA | AJ18: Ethel Barrymore Theater | AK18: Movie [Nite Owl Theater]: Sarong Girl | AX18: =A18 -> 19507
B19: KPTV BECOMES NBC AFFILIATE | J19: KPTV BECOMES NBC AFFILIATE | R19: KPTV BECOMES NBC AFFILIATE | Z19: KPTV BECOMES NBC AFFILIATE | AH19: KPTV BECOMES NBC AFFILIATE | AP19: KPTV BECOMES NBC AFFILIATE
A20: =A18+7 -> 19514 | K20: What's Cooking? | L20: Freedom Rings (CBS) | M20: TBA; [10:45] The Garry Moore Show (CBS) | N20: The Big Payoff (NBC) | O20: Welcome Travelers (NBC) | P20: The Kate Smith Hour (NBC) | R20: Pulse of the City; [1:15] Arthur Godfrey Time (CBS) | S20: Strike It Rich (CBS) | T20: Movie [Matinee Theater]: Call of the Jungle | V20: [3:15] Search For Tomorrow (CBS) | W20: Love of Life (CBS); [3:45] The Toy Maker | X20: Howdy Doody (NBC) | Y20: Kid Magic; [4:45] TBA | Z20: Range Rider | AA20: The CBS Evening News --Douglas Edwards (CBS); [5:45] Time for Beany | AB20: Candy Theater | AC20: The Dinah Shore Show (NBC); [6:45] Camel News Caravan (NBC) | AD20: You Bet Your Life (NBC) | AE20: The Burns and Allen Show (CBS) | AF20: The Unexpected | AG20: Ford Theater (NBC) | AH20: Martin Kane, Private Eye (NBC) | AI20: Ethel Barrymore Theater | AJ20: Wrestling from Hollywood | AL20: Movie [Nite Owl Theater]: Shadow of Suspicion | AX20: =A20 -> 19514
A21: =A20+7 -> 19521 | K21: What's Cooking? | L21: Freedom Rings (CBS) | M21: TBA; [10:45] The Garry Moore Show (CBS) | N21: The Big Payoff (NBC) | O21: Welcome Travelers (NBC) | P21: On Your Account (NBC) | Q21: Ladie's Choice (NBC) | R21: Pulse of the City; [1:15] Arthur Godfrey Time (CBS) | S21: Strike It Rich (CBS) | T21: Movie [Matinee Theater]: Drums of the Desert | V21: [3:15] Search For Tomorrow (CBS) | W21: Love of Life (CBS); [3:45] The Toy Maker | X21: Howdy Doody (NBC) | Y21: Kid Magic; [4:45] TBA | Z21: Range Rider | AA21: The CBS Evening News --Douglas Edwards (CBS); [5:45] Time for Beany | AB21: Zero-Freeze Theater | AC21: The Dinah Shore Show (NBC); [6:45] Camel News Caravan (NBC) | AD21: You Bet Your Life (NBC) | AE21: The Burns and Allen Show (CBS) | AF21: The Unexpected | AG21: Ford Theater (NBC) | AH21: Martin Kane, Private Eye (NBC) | AI21: Ethel Barrymore Theater | AJ21: Wrestling from Hollywood | AL21: Movie [Nite Owl Theater]: Revenge of the Zombies | AX21: =A21 -> 19521
A22: =A21+7 -> 19528 | K22: What's Cooking? | L22: Freedom Rings (CBS) | M22: TBA; [10:45] The Garry Moore Show (CBS) | N22: The Big Payoff (NBC) | O22: Welcome Travelers (NBC) | P22: On Your Account (NBC) | Q22: Ladie's Choice (NBC) | R22: Pulse of the City; [1:15] Arthur Godfrey Time (CBS) | S22: Strike It Rich (CBS) | T22: Movie [Matinee Theater]: One Thrilling Night | V22: [3:15] Search For Tomorrow (CBS) | W22: Love of Life (CBS); [3:45] The Toy Maker | X22: Howdy Doody (NBC) | Y22: Kid Magic; [4:45] TBA | Z22: Range Rider | AA22: The CBS Evening News --Douglas Edwards (CBS); [5:45] Time for Beany | AB22: Candy Theater | AC22: The Dinah Shore Show (NBC); [6:45] Camel News Caravan (NBC) | AD22: You Bet Your Life (NBC) | AE22: The Burns and Allen Show (CBS) | AF22: The Unexpected | AG22: Ford Theater (NBC) | AH22: Martin Kane, Private Eye (NBC) | AI22: Ethel Barrymore Theater | AJ22: Wrestling from Hollywood | AL22: Movie [Nite Owl Theater]: Phantom of Chinatown | AX22: =A22 -> 19528
A23: =A22+7 -> 19535 | K23: What's Cooking? | L23: Freedom Rings (CBS) | M23: TBA; [10:45] The Garry Moore Show (CBS) | N23: The Big Payoff (NBC) | O23: Welcome Travelers (NBC) | P23: On Your Account (NBC) | Q23: Ladie's Choice (NBC) | R23: Pulse of the City; [1:15] Arthur Godfrey Time (CBS) | S23: Strike It Rich (CBS) | T23: Movie [Matinee Theater]: Luck of Roaring Camp | V23: [3:15] Search For Tomorrow (CBS) | W23: Love of Life (CBS); [3:45] The Toy Maker | X23: Howdy Doody (NBC) | Y23: Kid Magic; [4:45] TBA | Z23: Range Rider | AA23: The CBS Evening News --Douglas Edwards (CBS); [5:45] Time for Beany | AB23: Zero-Freeze Theater | AC23: The Dinah Shore Show (NBC); [6:45] Camel News Caravan (NBC) | AD23: You Bet Your Life (NBC) | AE23: The Burns and Allen Show (CBS) | AF23: The Unexpected | AG23: Ford Theater (NBC) | AH23: Martin Kane, Private Eye (NBC) | AI23: Ethel Barrymore Theater | AJ23: Wrestling from Hollywood | AL23: Movie [Nite Owl Theater]: Mystery of Mr. Wong | AX23: =A23 -> 19535
A24: =A23+7 -> 19542 | K24: What's Cooking? | L24: Freedom Rings (CBS) | M24: TBA; [10:45] The Garry Moore Show (CBS) | N24: The Big Payoff (NBC) | O24: Welcome Travelers (NBC) | P24: On Your Account (NBC) | Q24: Ladie's Choice (NBC) | R24: Capsule Theater; [1:15] Arthur Godfrey Time (CBS) | S24: Strike It Rich (CBS) | T24: Movie [Matinee Theater]: Nearly 18 | V24: [3:15] Search For Tomorrow (CBS) | W24: Love of Life (CBS); [3:45] The Toy Maker | X24: Howdy Doody (NBC) | Y24: Kid Magic; [4:45] Variety Roundup | Z24: Range Rider | AA24: The CBS Evening News --Douglas Edwards (CBS); [5:45] Time for Beany | AB24: Candy Theater | AC24: The Dinah Shore Show (NBC); [6:45] Camel News Caravan (NBC) | AD24: You Bet Your Life (NBC) | AE24: The Burns and Allen Show (CBS) | AF24: The Unexpected | AG24: Ford Theater (NBC) | AH24: Martin Kane, Private Eye (NBC) | AI24: Ethel Barrymore Theater | AJ24: Wrestling from Hollywood | AL24: Movie [Nite Owl Theater]: Honeymoon Limited | AX24: =A24 -> 19542
A25: =A24+7 -> 19549 | K25: What's Cooking? | L25: Freedom Rings (CBS) | M25: TBA; [10:45] The Garry Moore Show (CBS) | N25: The Big Payoff (NBC) | O25: Welcome Travelers (NBC) | P25: On Your Account (NBC) | Q25: Ladie's Choice (NBC) | R25: Capsule Theater; [1:15] Arthur Godfrey Time (CBS) | S25: Strike It Rich (CBS) | T25: Movie [Matinee Theater]: Fashion Model | V25: [3:15] Search For Tomorrow (CBS) | W25: Love of Life (CBS); [3:45] The Toy Maker | X25: Howdy Doody (NBC) | Y25: Kid Magic; [4:45] Variety Roundup | Z25: Range Rider | AA25: The CBS Evening News --Douglas Edwards (CBS); [5:45] Time for Beany | AB25: Zero-Freeze Theater | AC25: Hunting and Fishing News; [6:45] Camel News Caravan (NBC) | AD25: You Bet Your Life (NBC) | AE25: Dragnet (NBC) | AF25: The Unexpected | AG25: Ford Theater (NBC) | AH25: Martin Kane, Private Eye (NBC) | AI25: Ethel Barrymore Theater | AJ25: Wrestling from Hollywood | AL25: Movie [Nite Owl Theater]: Fear | AX25: =A25 -> 19549
A26: =A25+7 -> 19556 | K26: What's Cooking? | L26: Freedom Rings (CBS) | M26: TBA | N26: The Big Payoff (NBC) | O26: Welcome Travelers (NBC) | P26: On Your Account (NBC) | Q26: Ladie's Choice (NBC) | R26: Capsule Theater; [1:15] Arthur Godfrey Time (CBS) | S26: Strike It Rich (CBS) | T26: Movie [Matinee Theater]: Make a Million | V26: [3:15] Search For Tomorrow (CBS) | W26: Love of Life (CBS); [3:45] The Toy Maker | X26: Howdy Doody (NBC) | Y26: Kid Magic; [4:45] Variety Roundup | Z26: Range Rider | AA26: The CBS Evening News --Douglas Edwards (CBS); [5:45] Time for Beany | AB26: Candy Theater | AC26: Hunting and Fishing News; [6:45] Camel News Caravan (NBC) | AD26: You Bet Your Life (NBC) | AE26: Dragnet (NBC) | AF26: The Unexpected | AG26: Ford Theater (NBC) | AH26: Martin Kane, Private Eye (NBC) | AI26: Ethel Barrymore Theater | AJ26: Wrestling from Hollywood | AL26: Movie [Nite Owl Theater]: What a Man | AX26: =A26 -> 19556
A27: =A26+7 -> 19563 | K27: What's Cooking? | L27: Freedom Rings (CBS) | M27: TBA | N27: The Big Payoff (NBC) | O27: Welcome Travelers (NBC) | P27: On Your Account (NBC) | Q27: Ladie's Choice (NBC) | R27: Capsule Theater; [1:15] Arthur Godfrey Time (CBS) | S27: Strike It Rich (CBS) | T27: Movie [Matinee Theater]: Leave it to the Irish | V27: [3:15] Search For Tomorrow (CBS) | W27: Love of Life (CBS); [3:45] The Toy Maker | X27: Howdy Doody (NBC) | Y27: Kid Magic; [4:45] Variety Roundup | Z27: Range Rider | AA27: Alka-Seltzer Newspaper of the Air; [5:45] Time for Beany | AB27: Zero-Freeze Theater | AC27: Hunting and Fishing News; [6:45] Camel News Caravan (NBC) | AD27: You Bet Your Life (NBC) | AE27: Dragnet (NBC) | AF27: The Unexpected | AG27: Ford Theater (NBC) | AH27: Martin Kane, Private Eye (NBC) | AI27: Ethel Barrymore Theater | AJ27: Wrestling from Hollywood | AL27: Movie [Nite Owl Theater]: Barefoot Boy | AX27: =A27 -> 19563
A28: =A27+7 -> 19570 | K28: What's Cooking? | L28: Freedom Rings (CBS) | M28: TBA | N28: The Big Payoff (NBC) | O28: Welcome Travelers (NBC) | P28: On Your Account (NBC) | Q28: Ladie's Choice (NBC) | R28: Capsule Theater; [1:15] Arthur Godfrey Time (CBS) | S28: Strike It Rich (CBS) | T28: Movie [Matinee Theater]: Let's Go Collegiate | V28: [3:15] Search For Tomorrow (CBS) | W28: Love of Life (CBS); [3:45] The Toy Maker | X28: Howdy Doody (NBC) | Y28: Kid Magic; [4:45] Variety Roundup | Z28: Range Rider | AA28: Northwest News Digest; [5:40] Alka-Seltzer Newspaper of the Air; [5:45] Time for Beany | AB28: Candy Theater | AC28: Hunting and Fishing News; [6:45] Camel News Caravan (NBC) | AD28: You Bet Your Life (NBC) | AE28: Dragnet (NBC) | AF28: The Unexpected | AG28: Ford Theater (NBC) | AH28: Martin Kane, Private Eye (NBC) | AI28: Ethel Barrymore Theater | AJ28: Wrestling from Hollywood | AL28: Movie [Nite Owl Theater]: Tomorrow's Youth | AX28: =A28 -> 19570
A29: =A28+7 -> 19577 | K29: What's Cooking? | L29: Freedom Rings (CBS) | M29: TBA | N29: The Big Payoff (NBC) | O29: Welcome Travelers (NBC) | P29: On Your Account (NBC) | Q29: Ladie's Choice (NBC) | R29: Capsule Theater; [1:15] Arthur Godfrey Time (CBS) | S29: Strike It Rich (CBS) | T29: Movie [Matinee Theater]: Mystery Plane | V29: [3:15] Search For Tomorrow (CBS) | W29: Love of Life (CBS); [3:45] The Toy Maker | X29: Howdy Doody (NBC) | Y29: Kid Magic; [4:45] Felix the Cat | Z29: Range Rider | AA29: Northwest News Digest; [5:40] Alka-Seltzer Newspaper of the Air; [5:45] Time for Beany | AB29: TBA | AC29: Hunting and Fishing News; [6:45] Camel News Caravan (NBC) | AD29: You Bet Your Life (NBC) | AE29: Dragnet (NBC) | AF29: The Unexpected | AG29: Ford Theater (NBC) | AH29: Martin Kane, Private Eye (NBC) | AI29: Ethel Barrymore Theater | AJ29: Wrestling from Hollywood | AL29: Movie [Nite Owl Theater]: Sign of the Wolf | AX29: =A29 -> 19577
A30: =A29+7 -> 19584 | K30: What's Cooking? | L30: Freedom Rings (CBS) | M30: TBA | N30: The Big Payoff (NBC) | O30: Welcome Travelers (NBC) | P30: On Your Account (NBC) | Q30: Ladie's Choice (NBC) | R30: Capsule Theater; [1:15] Arthur Godfrey Time (CBS) | S30: Strike It Rich (CBS) | T30: Movie [Matinee Theater]: Hidden Enemy | V30: [3:15] Search For Tomorrow (CBS) | W30: Love of Life (CBS); [3:45] The Toy Maker | X30: Howdy Doody (NBC) | Y30: Kid Magic; [4:45] Felix the Cat | Z30: Range Rider | AA30: Northwest News Digest; [5:40] Alka-Seltzer Newspaper of the Air; [5:45] Time for Beany | AB30: TBA | AC30: Hunting and Fishing News; [6:45] Camel News Caravan (NBC) | AD30: You Bet Your Life (NBC) | AE30: Dragnet (NBC) | AF30: The Unexpected | AG30: Ford Theater (NBC) | AH30: Martin Kane, Private Eye (NBC) | AI30: Ethel Barrymore Theater | AJ30: Wrestling from Hollywood | AL30: Movie [Nite Owl Theater]: Thirteenth Man | AX30: =A30 -> 19584
A31: =A30+7 -> 19591 | K31: What's Cooking? | L31: Freedom Rings (CBS) | M31: TBA | N31: The Big Payoff (NBC) | O31: Welcome Travelers (NBC) | P31: On Your Account (NBC) | Q31: United Nations General Assembly (NBC) | R31: Capsule Theater; [1:15] Arthur Godfrey Time (CBS) | S31: Strike It Rich (CBS) | T31: Movie [Matinee Theater]: Crime Smasher | V31: [3:15] Search For Tomorrow (CBS) | W31: Love of Life (CBS); [3:45] The Toy Maker | X31: Howdy Doody (NBC) | Y31: TBA; [4:45] Felix the Cat | Z31: Range Rider | AA31: Northwest News Digest; [5:40] Alka-Seltzer Newspaper of the Air; [5:45] Time for Beany | AB31: The Cisco Kid | AC31: Hunting and Fishing News; [6:45] Camel News Caravan (NBC) | AD31: You Bet Your Life (NBC) | AE31: Dragnet (NBC) | AF31: The Unexpected | AG31: Ford Theater (NBC) | AH31: Martin Kane, Private Eye (NBC) | AI31: Ethel Barrymore Theater | AJ31: Wrestling from Hollywood | AL31: Movie [Nite Owl Theater]: Little Pal | AX31: =A31 -> 19591
A32: =A31+7 -> 19598 | K32: What's Cooking? | L32: Freedom Rings (CBS) | M32: TBA | N32: The Big Payoff (NBC) | O32: Welcome Travelers (NBC) | P32: On Your Account (NBC) | Q32: United Nations General Assembly (NBC) | R32: Capsule Theater; [1:15] Arthur Godfrey Time (CBS) | S32: Strike It Rich (CBS) | T32: Movie [Matinee Theater]: Under the Big Top | V32: [3:15] Search For Tomorrow (CBS) | W32: Love of Life (CBS); [3:45] The Toy Maker | X32: Howdy Doody (NBC) | Y32: TBA; [4:45] Felix the Cat | Z32: Range Rider | AA32: TBA; [5:45] Northwest News Digest; [5:55] Alka-Seltzer Newspaper of the Air | AB32: The Cisco Kid | AC32: Hunting and Fishing News; [6:45] Camel News Caravan (NBC) | AD32: You Bet Your Life (NBC) | AE32: Dragnet (NBC) | AF32: The Unexpected | AG32: Ford Theater (NBC) | AH32: Martin Kane, Private Eye (NBC) | AI32: TBA | AJ32: Wrestling from Hollywood | AL32: Movie [Nite Owl Theater]: Phantom Broadcast | AX32: =A32 -> 19598
A33: =A32+7 -> 19605 | K33: What's Cooking? | L33: Freedom Rings (CBS) | M33: TBA | N33: The Big Payoff (NBC) | O33: Welcome Travelers (NBC) | P33: On Your Account (NBC) | Q33: United Nations General Assembly (NBC) | R33: The Little Show (ABC); [1:15] Arthur Godfrey Time (CBS) | S33: Strike It Rich (CBS) | T33: Movie [Matinee Theater]: Police Bullets | V33: [3:15] Search For Tomorrow (CBS) | W33: Love of Life (CBS); [3:45] The Toy Maker | X33: Howdy Doody (NBC) | Y33: TBA; [4:45] Felix the Cat | Z33: Range Rider | AA33: TBA; [5:45] Northwest News Digest; [5:55] Alka-Seltzer Newspaper of the Air | AB33: The Cisco Kid | AC33: Hunting and Fishing News; [6:45] Camel News Caravan (NBC) | AD33: You Bet Your Life (NBC) | AE33: Dragnet (NBC) | AF33: The Unexpected | AG33: Ford Theater (NBC) | AH33: Martin Kane, Private Eye (NBC) | AI33: On the Practice Tee; [9:45] TBA | AJ33: Wrestling from Hollywood | AL33: Movie [Nite Owl Theater]: House of Mystery (1934) | AX33: =A33 -> 19605
A34: =A33+7 -> 19612 | K34: What's Cooking? | L34: Freedom Rings (CBS) | M34: TBA | N34: The Big Payoff (NBC) | O34: Welcome Travelers (NBC) | P34: On Your Account (NBC) | Q34: United Nations General Assembly (NBC) | R34: The Little Show (ABC); [1:15] Arthur Godfrey Time (CBS) | S34: Strike It Rich (CBS) | T34: Movie [Matinee Theater]: Oh, What a Night | V34: [3:15] Search For Tomorrow (CBS) | W34: Love of Life (CBS); [3:45] The Toy Maker | X34: Howdy Doody (NBC) | Y34: TBA; [4:45] Felix the Cat | Z34: Range Rider | AA34: TBA; [5:45] Northwest News Digest; [5:55] Alka-Seltzer Newspaper of the Air | AB34: The Cisco Kid | AC34: Hunting and Fishing News; [6:45] Camel News Caravan (NBC) | AD34: You Bet Your Life (NBC) | AE34: Dragnet (NBC) | AF34: The Unexpected | AG34: Ford Theater (NBC) | AH34: Martin Kane, Private Eye (NBC) | AI34: On the Practice Tee; [9:45] TBA | AJ34: Wrestling from Hollywood | AL34: Movie [Nite Owl Theater]: The Nut Farm (1935) | AX34: =A34 -> 19612
A35: =A34+7 -> 19619 | K35: What's Cooking? | L35: Freedom Rings (CBS) | M35: TBA | N35: The Big Payoff (NBC) | O35: Welcome Travelers (NBC) | P35: On Your Account (NBC) | Q35: United Nations General Assembly (NBC) | R35: The Little Show (ABC); [1:15] Arthur Godfrey Time (CBS) | S35: Strike It Rich (CBS) | T35: Movie [Matinee Theater]: Sky Patrol (1939) | V35: [3:15] Search For Tomorrow (CBS) | W35: Love of Life (CBS); [3:45] The Toy Maker | X35: Howdy Doody (NBC) | Y35: TBA; [4:45] Felix the Cat | Z35: Range Rider | AA35: TBA; [5:45] Northwest News Digest; [5:55] Alka-Seltzer Newspaper of the Air | AB35: The Cisco Kid | AC35: Hunting and Fishing News; [6:45] Camel News Caravan (NBC) | AD35: You Bet Your Life (NBC) | AE35: Dragnet (NBC) | AF35: The Unexpected | AG35: Ford Theater (NBC) | AH35: Martin Kane, Private Eye (NBC) | AI35: On the Practice Tee; [9:45] TBA | AJ35: Wrestling from Hollywood | AL35: Movie [Nite Owl Theater]: Telephone Operator (1937) | AX35: =A35 -> 19619
A36: =A35+7 -> 19626 | K36: What's Cooking? | L36: Ding Dong School (NBC) | M36: TBA | N36: The Big Payoff (NBC) | O36: Welcome Travelers (NBC) | P36: On Your Account (NBC) | Q36: Movie [Matinee Theater]: Red Dragon (1945) | S36: Strike It Rich (CBS) | T36: TBA; [2:15] Arthur Godfrey Time (CBS) | U36: The Kate Smith Hour (NBC) | V36: The Little Show; [3:15] Search For Tomorrow (CBS) | W36: Love of Life (CBS); [3:45] The Toy Maker | X36: Howdy Doody (NBC) | Y36: TBA; [4:45] Felix the Cat | Z36: Range Rider | AA36: TBA; [5:45] Northwest News Digest; [5:55] Alka-Seltzer Newspaper of the Air | AB36: The Cisco Kid | AC36: Hunting and Fishing News; [6:45] Camel News Caravan (NBC) | AD36: You Bet Your Life (NBC) | AE36: Dragnet (NBC) | AF36: The Unexpected | AG36: Ford Theater (NBC) | AH36: Martin Kane, Private Eye (NBC) | AI36: Football Hilites: Portland Community College | AJ36: Wrestling from Hollywood | AL36: Chuck Foster's Newscene; [11:05] Movie [Nite Owl Theater]: The Reckless Way (1936) | AX36: =A36 -> 19626
A37: =A36+7 -> 19633 | J37: [9:15] What's Cooking? | K37: [9:45] World Series Baseball: Brooklyn Dodgers vs. New York Yankees (Game 2) (NBC) | Q37: [12:45] Hawkins Falls (NBC) | R37: Movie [Matinee Theater]: TBA; [2:15] Hollywood Reel | U37: On Your Account (NBC) | V37: The Kate Smith Hour (NBC) | X37: Welcome Travelers (NBC) | Y37: The Toymaker | Z37: Howdy Doody (NBC) | AA37: Terry and the Pirates | AB37: Range Rider | AC37: Hunting and Fishing News; [6:45] Northwest News Digest; [6:50] Spors on View; [6:55] Alka-Seltzer Newspaper of the Air | AD37: Football Hilites: Portland Community College | AE37: TBA; [7:45] Camel News Caravan (NBC) | AF37: You Bet Your Life (NBC) | AG37: Dragnet (NBC) | AH37: The Unexpected | AI37: Ford Theater (NBC) | AJ37: Martin Kane, Private Eye (NBC) | AK37: The Big Playback; [10:45] Sports Den | AL37: Chuck Foster's Newscene; [11:05] News; [11:15] Movie: [Nite Owl Theater]: TBA | AX37: =A37 -> 19633
A40: 1960 | AX40: 1960
A41: 21922 | F41: OMSI Presents | G41: Eye Opener | H41: Uncle Charlie's Roundhouse | J41: Romper Room | K41: Movie [Early Show]: Truck Busters (1943) | N41: The Better Half | O41: The Life of Riley | P41: Restless Gun (ABC) | Q41: Love That Bob! (ABC) | R41: About Faces (ABC) | S41: Official Detective | T41: Day in Court (ABC) | U41: Gale Storm (ABC) | V41: Beat the Clock (ABC) | W41: Who Do You Trust? (ABC) | X41: American Bandstand (ABC) | Y41: High Time | Z41: Three Stooges | AA41: Rocky and His Friends (ABC) | AB41: Cartoons--Uncle Charlie; [6:15] News--John Salisbury; [6:25] Fishing Forecast | AC41: Sheriff of Cochise | AD41: Tombstone Territory | AE41: Gale Storm (ABC) | AF41: Donna Reed (ABC) | AG41: The Real McCoys (ABC) | AH41: The Pat Boone--Chevy Showroom (ABC) | AI41: The Untouchables (ABC) | AK41: Take a Good Look (ABC) | AL41: News; [11:15] Movie [Best of Hollywood]: White Heat (1949) | AX41: =A41 -> 21922
A42: 21929 | F42: OMSI Presents | G42: Eye Opener | H42: Uncle Charlie's Roundhouse | J42: Romper Room | K42: Movie [Early Show]: That Man's Here Again (1937) | N42: The Better Half | O42: The Life of Riley | P42: Restless Gun (ABC) | Q42: Love That Bob! (ABC) | R42: About Faces (ABC) | S42: Official Detective | T42: Day in Court (ABC) | U42: Gale Storm (ABC) | V42: Beat the Clock (ABC) | W42: Who Do You Trust? (ABC) | X42: American Bandstand (ABC) | Y42: High Time | Z42: Three Stooges | AA42: Rocky and His Friends (ABC) | AB42: Cartoons--Uncle Charlie; [6:15] News--John Salisbury; [6:25] Fishing Forecast | AC42: Sheriff of Cochise | AD42: Tombstone Territory | AE42: Gale Storm (ABC) | AF42: Donna Reed (ABC) | AG42: The Real McCoys (ABC) | AH42: The Pat Boone--Chevy Showroom (ABC) | AI42: The Untouchables (ABC) | AK42: Take a Good Look (ABC) | AL42: News; [11:15] Movie [Best of Hollywood]: Japanese War Bride (1952) | AX42: =A42 -> 21929
A43: 21936 | F43: OMSI Presents | G43: Eye Opener | H43: Uncle Charlie's Roundhouse | J43: Romper Room | K43: Movie [Early Show]: The Purchase Price (1932) | N43: The Better Half | O43: The Life of Riley | P43: Restless Gun (ABC) | Q43: Love That Bob! (ABC) | R43: About Faces (ABC) | S43: Official Detective | T43: Day in Court (ABC) | U43: Gale Storm (ABC) | V43: Beat the Clock (ABC) | W43: Who Do You Trust? (ABC) | X43: American Bandstand (ABC) | Y43: High Time | Z43: Three Stooges | AA43: Rocky and His Friends (ABC) | AB43: Cartoons--Uncle Charlie; [6:15] News--John Salisbury; [6:25] Fishing Forecast | AC43: Sheriff of Cochise | AD43: Tombstone Territory | AE43: Gale Storm (ABC) | AF43: Donna Reed (ABC) | AG43: The Real McCoys (ABC) | AH43: The Pat Boone--Chevy Showroom (ABC) | AI43: The Untouchables (ABC) | AK43: Take a Good Look (ABC) | AL43: News; [11:15] Movie [Best of Hollywood]: All Quiet on the Western Front (1930) | AX43: =A43 -> 21936
A44: 21943 | F44: OMSI Presents | G44: Eye Opener | H44: Uncle Charlie's Roundhouse | J44: Romper Room | K44: Movie [Early Show]: The Dead End Kids on Dress Parade (1939) | N44: The Better Half | O44: The Life of Riley | P44: Restless Gun (ABC) | Q44: Love That Bob! (ABC) | R44: About Faces (ABC) | S44: Official Detective | T44: Day in Court (ABC) | U44: Gale Storm (ABC) | V44: Beat the Clock (ABC) | W44: Who Do You Trust? (ABC) | X44: American Bandstand (ABC) | Y44: High Time | Z44: Three Stooges | AA44: Rocky and His Friends (ABC) | AB44: Cartoons--Uncle Charlie; [6:15] News--John Salisbury; [6:25] Fishing Forecast | AC44: Sheriff of Cochise | AD44: Tombstone Territory | AE44: Gale Storm (ABC) | AF44: Donna Reed (ABC) | AG44: The Real McCoys (ABC) | AH44: The Pat Boone--Chevy Showroom (ABC) | AI44: The Untouchables (ABC) | AK44: Take a Good Look (ABC) | AL44: News; [11:15] Movie [Best of Hollywood]: The Bigamist (1953) | AX44: =A44 -> 21943
A45: 21950 | F45: OMSI Presents | G45: Eye Opener | H45: Uncle Charlie's Roundhouse | J45: Romper Room | K45: Movie [Early Show]: The Secret Man (English; 1958) | N45: The Better Half | O45: The Life of Riley | P45: Restless Gun (ABC) | Q45: Love That Bob! (ABC) | R45: About Faces (ABC) | S45: Official Detective | T45: Day in Court (ABC) | U45: Gale Storm (ABC) | V45: Beat the Clock (ABC) | W45: Who Do You Trust? (ABC) | X45: American Bandstand (ABC) | Y45: High Time | Z45: Three Stooges | AA45: Rocky and His Friends (ABC) | AB45: Cartoons--Uncle Charlie; [6:15] News--John Salisbury; [6:25] Fishing Forecast | AC45: Sheriff of Cochise | AD45: Tombstone Territory | AE45: Gale Storm (ABC) | AF45: Donna Reed (ABC) | AG45: The Real McCoys (ABC) | AH45: The Pat Boone--Chevy Showroom (ABC) | AI45: The Untouchables (ABC) | AK45: Take a Good Look (ABC) | AL45: News; [11:15] Movie [Best of Hollywood]: Ivory Hunter (British; 1952) | AX45: =A45 -> 21950
A46: 21957 | F46: OMSI Presents | G46: Eye Opener | H46: Uncle Charlie's Roundhouse | J46: Romper Room | K46: Movie [Early Show]: Slim (1937) | N46: The Better Half | O46: The Life of Riley | P46: Restless Gun (ABC) | Q46: Love That Bob! (ABC) | R46: About Faces (ABC) | S46: Official Detective | T46: Day in Court (ABC) | U46: Gale Storm (ABC) | V46: Beat the Clock (ABC) | W46: Who Do You Trust? (ABC) | X46: American Bandstand (ABC) | Y46: High Time | Z46: Three Stooges | AA46: Rocky and His Friends (ABC) | AB46: Cartoons--Uncle Charlie; [6:15] News--John Salisbury; [6:25] Fishing Forecast | AC46: Sheriff of Cochise | AD46: Tombstone Territory | AE46: Gale Storm (ABC) | AF46: Donna Reed (ABC) | AG46: The Real McCoys (ABC) | AH46: The Pat Boone--Chevy Showroom (ABC) | AI46: The Untouchables (ABC) | AK46: Take a Good Look (ABC) | AL46: News; [11:15] Movie [Best of Hollywood]: Under Capricorn (1949) | AX46: =A46 -> 21957
A47: 21964 | F47: OMSI Presents | G47: Eye Opener | H47: Uncle Charlie's Roundhouse | J47: Romper Room | K47: Movie [Early Show]: The Verdict (1946) | N47: The Better Half | O47: It's a Great Life | P47: Restless Gun (ABC) | Q47: Love That Bob! (ABC) | R47: About Faces (ABC) | S47: Official Detective | T47: Day in Court (ABC) | U47: Gale Storm (ABC) | V47: Beat the Clock (ABC) | W47: Who Do You Trust? (ABC) | X47: American Bandstand (ABC) | Y47: High Time | Z47: Three Stooges | AA47: Rocky and His Friends (ABC) | AB47: Cartoons--Uncle Charlie; [6:15] News--John Salisbury; [6:25] Fishing Forecast | AC47: Sheriff of Cochise | AD47: Tombstone Territory | AE47: Gale Storm (ABC) | AF47: Donna Reed (ABC) | AG47: The Real McCoys (ABC) | AH47: The Pat Boone--Chevy Showroom (ABC) | AI47: The Untouchables (ABC) | AK47: Take a Good Look (ABC) | AL47: News; [11:15] Movie [Thursday Academy Theater]: Witness to Murder (1954) | AX47: =A47 -> 21964
A48: 21971 | F48: OMSI Presents | G48: Eye Opener | H48: Uncle Charlie's Roundhouse | J48: Romper Room | K48: Movie [Early Show]: TBA | N48: The Better Half | O48: It's a Great Life | P48: Restless Gun (ABC) | Q48: Love That Bob! (ABC) | R48: About Faces (ABC) | S48: Official Detective | T48: Day in Court (ABC) | U48: Gale Storm (ABC) | V48: Beat the Clock (ABC) | W48: Who Do You Trust? (ABC) | X48: American Bandstand (ABC) | Y48: High Time | Z48: Three Stooges | AA48: Rocky and His Friends (ABC) | AB48: Cartoons--Uncle Charlie; [6:15] News--John Salisbury; [6:25] Fishing Forecast | AC48: Sheriff of Cochise | AD48: Tombstone Territory | AE48: Gale Storm (ABC) | AF48: Donna Reed (ABC) | AG48: The Real McCoys (ABC) | AH48: The Pat Boone--Chevy Showroom (ABC) | AI48: The Untouchables (ABC) | AK48: Take a Good Look (ABC) | AL48: News; [11:15] Movie [Thursday Academy Theater]: TBA | AX48: =A48 -> 21971
A49: 21978 | F49: OMSI Presents | G49: Eye Opener | H49: Uncle Charlie's Roundhouse | J49: Romper Room | K49: Movie [Early Show]: Burmuda Convoy ( ? ) | N49: The Better Half | O49: It's a Great Life | P49: Restless Gun (ABC) | Q49: Love That Bob! (ABC) | R49: About Faces (ABC) | S49: Official Detective | T49: Day in Court (ABC) | U49: Gale Storm (ABC) | V49: Beat the Clock (ABC) | W49: Who Do You Trust? (ABC) | X49: American Bandstand (ABC) | Y49: High Time | Z49: Three Stooges | AA49: Rocky and His Friends (ABC) | AB49: Cartoons--Uncle Charlie; [6:15] News--John Salisbury; [6:25] Fishing Forecast | AC49: Sheriff of Cochise | AD49: Tombstone Territory | AE49: Gale Storm (ABC) | AF49: Donna Reed (ABC) | AG49: The Real McCoys (ABC) | AH49: The Pat Boone--Chevy Showroom (ABC) | AI49: The Untouchables (ABC) | AK49: Take a Good Look (ABC) | AL49: News; [11:15] Movie [Thursday Academy Theater]: Invasion of the Body Snatchers (1956) | AX49: =A49 -> 21978
A50: 21985 | F50: OMSI Presents | G50: Eye Opener | H50: Uncle Charlie's Roundhouse | J50: Romper Room | K50: Movie [Early Show]: Grand Exit (1953) | N50: The Better Half | O50: It's a Great Life | P50: Restless Gun (ABC) | Q50: Love That Bob! (ABC) | R50: About Faces (ABC) | S50: Official Detective | T50: Day in Court (ABC) | U50: Gale Storm (ABC) | V50: Beat the Clock (ABC) | W50: Who Do You Trust? (ABC) | X50: American Bandstand (ABC) | Y50: High Time | Z50: Three Stooges | AA50: Rocky and His Friends (ABC) | AB50: News Central | AC50: Sheriff of Cochise | AD50: Tombstone Territory | AE50: Gale Storm (ABC) | AF50: Donna Reed (ABC) | AG50: The Real McCoys (ABC) | AH50: The Pat Boone--Chevy Showroom (ABC) | AI50: The Untouchables (ABC) | AK50: Take a Good Look (ABC) | AL50: News; [11:15] Movie [Academy Theater]: Heaven Can Wait (1943) | AX50: =A50 -> 21985
A51: 21992 | F51: OMSI Presents | G51: Eye Opener | H51: Uncle Charlie's Roundhouse | J51: Romper Room | K51: Movie [Early Show]: Wonder Bar (1934) | N51: The Better Half | O51: It's a Great Life | P51: Restless Gun (ABC) | Q51: Love That Bob! (ABC) | R51: About Faces (ABC) | S51: Official Detective | T51: Day in Court (ABC) | U51: Gale Storm (ABC) | V51: Beat the Clock (ABC) | W51: Who Do You Trust? (ABC) | X51: American Bandstand (ABC) | Y51: High Time | Z51: Three Stooges | AA51: Rocky and His Friends (ABC) | AB51: News Central | AC51: Sheriff of Cochise | AD51: Tombstone Territory | AE51: Gale Storm (ABC) | AF51: Donna Reed (ABC) | AG51: The Real McCoys (ABC) | AH51: The Pat Boone--Chevy Showroom (ABC) | AI51: The Untouchables (ABC) | AK51: Take a Good Look (ABC) | AL51: News; [11:15] Movie [Thursday Theater]: The Babe Ruth Story (1948) | AX51: =A51 -> 21992
A52: 21999 | F52: OMSI Presents | G52: Eye Opener | H52: Uncle Charlie's Roundhouse | J52: Romper Room | K52: Movie [Early Show]: The Mouthpiece (1932) | N52: The Better Half | O52: It's a Great Life | P52: Restless Gun (ABC) | Q52: Love That Bob! (ABC) | R52: About Faces (ABC) | S52: Official Detective | T52: Day in Court (ABC) | U52: Gale Storm (ABC) | V52: Beat the Clock (ABC) | W52: Who Do You Trust? (ABC) | X52: American Bandstand (ABC) | Y52: High Time | Z52: Three Stooges | AA52: Rocky and His Friends (ABC) | AB52: News Central | AC52: Sheriff of Cochise | AD52: Tombstone Territory | AE52: Gale Storm (ABC) | AF52: Donna Reed (ABC) | AG52: The Real McCoys (ABC) | AH52: The Pat Boone--Chevy Showroom (ABC) | AI52: The Untouchables (ABC) | AK52: Take a Good Look (ABC) | AL52: News; [11:15] Movie [Thursday Theater]: To the Ends of the Earth (1948) | AX52: =A52 -> 21999
A53: 22006 | F53: OMSI Presents | G53: Eye Opener | H53: Uncle Charlie's Roundhouse | J53: Romper Room | K53: Movie [Early Show]: Go into Your Dance (1935) | N53: The Better Half | O53: It's a Great Life | P53: Restless Gun (ABC) | Q53: Love That Bob! (ABC) | R53: About Faces (ABC) | S53: Official Detective | T53: Day in Court (ABC) | U53: Gale Storm (ABC) | V53: Beat the Clock (ABC) | W53: Who Do You Trust? (ABC) | X53: American Bandstand (ABC) | Y53: High Time | Z53: Three Stooges | AA53: Rocky and His Friends (ABC) | AB53: News Central | AC53: Sheriff of Cochise | AD53: Tombstone Territory | AE53: All-Star Circus (ABC) [Special] | AG53: The Real McCoys (ABC) | AH53: The Pat Boone--Chevy Showroom (ABC) | AI53: The Untouchables (ABC) | AK53: Take a Good Look (ABC) | AL53: News; [11:15] Movie [Thursday Theater]: Citizen Kane (1941) | AX53: =A53 -> 22006
A54: 22013 | F54: OMSI Presents | G54: Eye Opener | H54: Uncle Charlie's Roundhouse | J54: Romper Room | K54: Movie [Early Show]: TBA | N54: The Better Half | O54: It's a Great Life | P54: Restless Gun (ABC) | Q54: Love That Bob! (ABC) | R54: About Faces (ABC) | S54: Official Detective | T54: Day in Court (ABC) | U54: Gale Storm (ABC) | V54: Beat the Clock (ABC) | W54: Who Do You Trust? (ABC) | X54: American Bandstand (ABC) | Y54: High Time | Z54: Three Stooges | AA54: Rocky and His Friends (ABC) | AB54: News Central | AC54: Sheriff of Cochise | AD54: Tombstone Territory | AE54: The Pioneers (Death Valley Days) | AF54: Donna Reed (ABC) | AG54: The Real McCoys (ABC) | AH54: The Pat Boone--Chevy Showroom (ABC) | AI54: The Untouchables (ABC) | AK54: Take a Good Look (ABC) | AL54: News; [11:15] Movie [Thursday Theater]: Mother Wore Tights (1947) | AX54: =A54 -> 22013
A55: 22020 | F55: OMSI Presents | G55: Eye Opener | H55: Uncle Charlie's Roundhouse | J55: Romper Room | K55: Movie [Early Show]: TBA | N55: The Better Half | O55: It's a Great Life | P55: Restless Gun (ABC) | Q55: Love That Bob! (ABC) | R55: About Faces (ABC) | S55: Official Detective | T55: Day in Court (ABC) | U55: Gale Storm (ABC) | V55: Beat the Clock (ABC) | W55: Who Do You Trust? (ABC) | X55: American Bandstand (ABC) | Y55: High Time | Z55: Three Stooges | AA55: Rocky and His Friends (ABC) | AB55: News Central | AC55: Sheriff of Cochise | AD55: Tombstone Territory | AE55: The Pioneers (Death Valley Days) | AF55: Donna Reed (ABC) | AG55: The Real McCoys (ABC) | AH55: The Pat Boone--Chevy Showroom (ABC) | AI55: The Untouchables (ABC) | AK55: Take a Good Look (ABC) | AL55: News; [11:15] Movie [Thursday Theater]: Foreign Intrigue (1956) | AX55: =A55 -> 22020
A56: 22027 | F56: OMSI Presents | G56: Eye Opener | H56: Uncle Charlie's Roundhouse | J56: Romper Room | K56: Movie [Early Show]: The Mummy's Ghost (1944) | N56: The Better Half | O56: It's a Great Life | P56: Restless Gun (ABC) | Q56: Love That Bob! (ABC) | R56: About Faces (ABC) | S56: Official Detective | T56: Day in Court (ABC) | U56: Gale Storm (ABC) | V56: Beat the Clock (ABC) | W56: Who Do You Trust? (ABC) | X56: American Bandstand (ABC) | Y56: High Time | Z56: Three Stooges | AA56: Rocky and His Friends (ABC) | AB56: News Central | AC56: Sheriff of Cochise | AD56: Tombstone Territory | AE56: The Pioneers (Death Valley Days) | AF56: Donna Reed (ABC) | AG56: The Real McCoys (ABC) | AH56: The Pat Boone--Chevy Showroom (ABC) | AI56: The Untouchables (ABC) | AK56: Take a Good Look (ABC) | AL56: News; [11:15] Movie [Thursday Theater]: TBA | AX56: =A56 -> 22027
B57: OTHER CITIES SWITCH TO DAYLIGHT TIME; PORTLAND SHOWS AIR ONE HOUR EARLIER | J57: OTHER CITIES SWITCH TO DAYLIGHT TIME; PORTLAND SHOWS AIR ONE HOUR EARLIER | R57: OTHER CITIES SWITCH TO DAYLIGHT TIME; PORTLAND SHOWS AIR ONE HOUR EARLIER | Z57: OTHER CITIES SWITCH TO DAYLIGHT TIME; PORTLAND SHOWS AIR ONE HOUR EARLIER | AH57: OTHER CITIES SWITCH TO DAYLIGHT TIME; PORTLAND SHOWS AIR ONE HOUR EARLIER | AP57: OTHER CITIES SWITCH TO DAYLIGHT TIME; PORTLAND SHOWS AIR ONE HOUR EARLIER
A58: 22034 | F58: OMSI Presents | G58: Eye Opener | H58: Uncle Charlie's Roundhouse | J58: Romper Room | K58: Burns and Allen | L58: Rosemary Clooney | M58: The Better Half | N58: Restless Gun (ABC) | O58: Love That Bob! (ABC) | P58: About Faces (ABC) | Q58: Official Detective | R58: Day in Court (ABC) | S58: Gale Storm (ABC) | T58: Beat the Clock (ABC) | U58: Who Do You Trust? (ABC) | V58: American Bandstand (ABC) | W58: High Time | X58: Uncle Charlie's Den | Z58: Three Stooges | AA58: Rocky and His Friends (ABC) | AB58: News Central | AC58: Sheriff of Cochise | AD58: Donna Reed (ABC) | AE58: The Real McCoys (ABC) | AF58: The Pat Boone--Chevy Showroom (ABC) | AG58: The Untouchables (ABC) | AI58: Take a Good Look (ABC) | AJ58: Tombstone Territory | AK58: Death Valley Days | AL58: News--John Salisbury; [11:15] Movie [Movie 12]: Time Out of Mind (1947) | AX58: =A58 -> 22034
A59: 22041 | F59: OMSI Presents | G59: Eye Opener | H59: Uncle Charlie's Roundhouse | J59: Romper Room | K59: Burns and Allen | L59: Rosemary Clooney | M59: The Better Half | N59: Restless Gun (ABC) | O59: Love That Bob! (ABC) | P59: About Faces (ABC) | Q59: Official Detective | R59: Day in Court (ABC) | S59: Gale Storm (ABC) | T59: Beat the Clock (ABC) | U59: Who Do You Trust? (ABC) | V59: American Bandstand (ABC) | W59: High Time | X59: Uncle Charlie's Den | Z59: Three Stooges | AA59: Rocky and His Friends (ABC) | AB59: News Central | AC59: Sheriff of Cochise | AD59: Donna Reed (ABC) | AE59: The Real McCoys (ABC) | AF59: The Pat Boone--Chevy Showroom (ABC) | AG59: The Untouchables (ABC) | AI59: Take a Good Look (ABC) | AJ59: Tombstone Territory | AK59: The Pioneers (Death Valley Days) | AL59: News--John Salisbury; [11:15] Movie [Movie 12]: Mr. Lucky (1943) | AX59: =A59 -> 22041
A60: 22048 | F60: OMSI Presents | G60: Eye Opener | H60: Uncle Charlie's Roundhouse | J60: Romper Room | K60: Burns and Allen | L60: Rosemary Clooney | M60: The Better Half | N60: Restless Gun (ABC) | O60: Love That Bob! (ABC) | P60: About Faces (ABC) | Q60: Official Detective | R60: Day in Court (ABC) | S60: Gale Storm (ABC) | T60: Beat the Clock (ABC) | U60: Who Do You Trust? (ABC) | V60: American Bandstand (ABC) | W60: High Time | X60: Uncle Charlie's Den | Z60: Three Stooges | AA60: Rocky and His Friends (ABC) | AB60: News Central | AC60: Sheriff of Cochise | AD60: Donna Reed (ABC) | AE60: The Real McCoys (ABC) | AF60: The Pat Boone--Chevy Showroom (ABC) | AG60: Frank Sinatra (ABC) [Special] | AI60: Take a Good Look (ABC) | AJ60: Tombstone Territory | AK60: The Pioneers (Death Valley Days) | AL60: News--John Salisbury; [11:15] Movie [Movie 12]: At War with the Army (1950) | AX60: =A60 -> 22048
A61: 22055 | F61: OMSI Presents | G61: Eye Opener | H61: Uncle Charlie's Roundhouse | J61: Romper Room | K61: Burns and Allen | L61: Rosemary Clooney | M61: The Better Half | N61: Restless Gun (ABC) | O61: Love That Bob! (ABC) | P61: About Faces (ABC) | Q61: Official Detective | R61: Day in Court (ABC) | S61: Gale Storm (ABC) | T61: Beat the Clock (ABC) | U61: Who Do You Trust? (ABC) | V61: American Bandstand (ABC) | W61: High Time | X61: Uncle Charlie's Den | Z61: Three Stooges | AA61: Rocky and His Friends (ABC) | AB61: News Central | AC61: Sheriff of Cochise | AD61: Donna Reed (ABC) | AE61: The Real McCoys (ABC) | AF61: The Pat Boone--Chevy Showroom (ABC) | AG61: The Untouchables (ABC) | AI61: Take a Good Look (ABC) | AJ61: Tombstone Territory | AK61: The Pioneers (Death Valley Days) | AL61: News--John Salisbury; [11:15] Movie [Movie 12]: Annie Oakley (1935) | AX61: =A61 -> 22055
A62: 22062 | F62: OMSI Presents | G62: Eye Opener | H62: Uncle Charlie's Roundhouse | J62: Romper Room | K62: Burns and Allen | L62: Rosemary Clooney | M62: The Better Half | N62: Restless Gun (ABC) | O62: Love That Bob! (ABC) | P62: About Faces (ABC) | Q62: Official Detective | R62: Day in Court (ABC) | S62: Gale Storm (ABC) | T62: Beat the Clock (ABC) | U62: Who Do You Trust? (ABC) | V62: American Bandstand (ABC) | W62: High Time | X62: Uncle Charlie's Den | Z62: Three Stooges | AA62: Rocky and His Friends (ABC) | AB62: News Central | AC62: Sheriff of Cochise | AD62: Donna Reed (ABC) | AE62: The Real McCoys (ABC) | AF62: The Pat Boone--Chevy Showroom (ABC) | AG62: The Untouchables (ABC) | AI62: Take a Good Look (ABC) | AJ62: Tombstone Territory | AK62: The Pioneers (Death Valley Days) | AL62: News--John Salisbury; [11:15] Movie [Movie 12]: All My Sons (1948) | AX62: =A62 -> 22062
A64: 22076 | F64: OMSI Presents | G64: Eye Opener | H64: Uncle Charlie's Roundhouse | J64: Romper Room | K64: Burns and Allen | L64: Rosemary Clooney | M64: The Better Half | N64: Restless Gun (ABC) | O64: Love That Bob! (ABC) | P64: About Faces (ABC) | Q64: Official Detective | R64: Day in Court (ABC) | S64: Gale Storm (ABC) | T64: Beat the Clock (ABC) | U64: Who Do You Trust? (ABC) | V64: American Bandstand (ABC) | W64: High Time | X64: Uncle Charlie's Den | Z64: Three Stooges | AA64: Rocky and His Friends (ABC) | AB64: News Central | AC64: Big Camera--Bob Brown | AD64: Donna Reed (ABC) | AE64: The Real McCoys (ABC) | AF64: The Pat Boone--Chevy Showroom (ABC) | AG64: The Untouchables (ABC) | AI64: Take a Good Look (ABC) | AJ64: Tombstone Territory | AK64: The Pioneers (Death Valley Days) | AL64: News--John Salisbury; [11:15] Movie [Movie 12]: The Americano (1954) | AX64: =A64 -> 22076
A65: 22083 | F65: OMSI Presents | G65: Eye Opener | H65: Uncle Charlie's Roundhouse | J65: Romper Room | K65: Burns and Allen | L65: Rosemary Clooney | M65: The Better Half | N65: Restless Gun (ABC) | O65: Love That Bob! (ABC) | P65: About Faces (ABC) | Q65: Official Detective | R65: Day in Court (ABC) | S65: Gale Storm (ABC) | T65: Beat the Clock (ABC) | U65: Who Do You Trust? (ABC) | V65: American Bandstand (ABC) | W65: High Time | X65: Uncle Charlie's Den | Z65: Three Stooges | AA65: Rocky and His Friends (ABC) | AB65: News Central | AC65: Big Camera--Bob Brown | AD65: Donna Reed (ABC) | AE65: The Real McCoys (ABC) | AF65: The Pat Boone--Chevy Showroom (ABC) | AG65: The Untouchables (ABC) | AI65: Take a Good Look (ABC) | AJ65: Tombstone Territory | AK65: The Pioneers (Death Valley Days) | AL65: News--John Salisbury; [11:15] Movie [Movie 12]: A Likely Story (1947) | AX65: =A65 -> 22083
A66: 22090 | F66: OMSI Presents | G66: Eye Opener | H66: Uncle Charlie's Roundhouse | J66: Romper Room | K66: Burns and Allen | L66: Rosemary Clooney | M66: The Better Half | N66: Restless Gun (ABC) | O66: Love That Bob! (ABC) | P66: About Faces (ABC) | Q66: Official Detective | R66: Day in Court (ABC) | S66: Gale Storm (ABC) | T66: Beat the Clock (ABC) | U66: Who Do You Trust? (ABC) | V66: American Bandstand (ABC) | W66: High Time | X66: Uncle Charlie's Den | Z66: Three Stooges | AA66: Rocky and His Friends (ABC) | AB66: News Central | AC66: Big Camera--Bob Brown | AD66: Donna Reed (ABC) | AE66: The Real McCoys (ABC) | AF66: The Pat Boone--Chevy Showroom (ABC) | AG66: The Untouchables (ABC) | AI66: Take a Good Look (ABC) | AJ66: Tombstone Territory | AK66: The Pioneers (Death Valley Days) | AL66: News--John Salisbury; [11:15] Movie [Movie 12]: Massacre at Sand Creek (1956) | AX66: =A66 -> 22090
A67: 22097 | F67: OMSI Presents | G67: Eye Opener | H67: Uncle Charlie's Roundhouse | J67: Romper Room | K67: It's a Great Life | L67: Rosemary Clooney | M67: The Better Half | N67: Restless Gun (ABC) | O67: Love That Bob! (ABC) | P67: About Faces (ABC) | Q67: Official Detective | R67: Day in Court (ABC) | S67: Gale Storm (ABC) | T67: Beat the Clock (ABC) | U67: Who Do You Trust? (ABC) | V67: American Bandstand (ABC) | W67: High Time | X67: Uncle Charlie's Den | Z67: Three Stooges | AA67: Rocky and His Friends (ABC) | AB67: News Central | AC67: Big Camera--Bob Brown | AD67: Donna Reed (ABC) | AE67: The Real McCoys (ABC) | AF67: Jeannie Carson | AG67: The Untouchables (ABC) | AI67: Take a Good Look (ABC) | AJ67: Tombstone Territory | AK67: The Pioneers (Death Valley Days) | AL67: News--John Salisbury; [11:15] Movie [Movie 12]: The Informer (1935) | AX67: =A67 -> 22097
A68: 22104 | F68: OMSI Presents | G68: Eye Opener | H68: Uncle Charlie's Roundhouse | J68: Romper Room | K68: It's a Great Life | L68: Rosemary Clooney | M68: The Better Half | N68: Restless Gun (ABC) | O68: Love That Bob! (ABC) | P68: About Faces (ABC) | Q68: Official Detective | R68: Day in Court (ABC) | S68: Gale Storm (ABC) | T68: Beat the Clock (ABC) | U68: Who Do You Trust? (ABC) | V68: American Bandstand (ABC) | W68: High Time | X68: Uncle Charlie's Den | Z68: Three Stooges | AA68: Rocky and His Friends (ABC) | AB68: News Central | AC68: Big Camera--Bob Brown | AD68: Donna Reed (ABC) | AE68: The Real McCoys (ABC) | AF68: Jeannie Carson | AG68: The Untouchables (ABC) | AI68: Take a Good Look (ABC) | AJ68: Tombstone Territory | AK68: The Pioneers (Death Valley Days) | AL68: News--John Salisbury; [11:15] Movie [Movie 12]: Boomerang (1947) | AX68: =A68 -> 22104
A70: 22118 | F70: OMSI Presents | G70: Eye Opener | H70: Uncle Charlie's Roundhouse | J70: Romper Room | K70: It's a Great Life | L70: Rosemary Clooney | M70: The Better Half | N70: Restless Gun (ABC) | O70: Love That Bob! (ABC) | P70: About Faces (ABC) | Q70: Official Detective | R70: Day in Court (ABC) | S70: Gale Storm (ABC) | T70: Beat the Clock (ABC) | U70: Who Do You Trust? (ABC) | V70: American Bandstand (ABC) | W70: High Time | X70: Uncle Charlie's Den | Z70: Three Stooges | AA70: Rocky and His Friends (ABC) | AB70: News Central | AC70: Big Camera--Bob Brown | AD70: Donna Reed (ABC) | AE70: The Real McCoys (ABC) | AF70: Jeannie Carson | AG70: The Untouchables (ABC) | AI70: Take a Good Look (ABC) | AJ70: Tombstone Territory | AK70: The Pioneers (Death Valley Days) | AL70: News--John Salisbury; [11:15] Movie [Movie 12]: Bride for Sale (1949) | AX70: =A70 -> 22118
A71: 22125 | F71: OMSI Presents | G71: Eye Opener | H71: Uncle Charlie's Roundhouse | J71: Romper Room | K71: It's a Great Life | L71: Rosemary Clooney | M71: The Better Half | N71: Restless Gun (ABC) | O71: Love That Bob! (ABC) | P71: About Faces (ABC) | Q71: Official Detective | R71: Day in Court (ABC) | S71: Gale Storm (ABC) | T71: Beat the Clock (ABC) | U71: Who Do You Trust? (ABC) | V71: American Bandstand (ABC) | W71: Republican Convention (ABC) | AE71: Donna Reed (ABC) | AF71: TBA | AG71: The Untouchables (ABC) | AI71: TBA | AJ71: Tombstone Territory | AK71: The Pioneers (Death Valley Days) | AL71: News--John Salisbury; [11:15] Movie [Movie 12]: Scudda-Hoo! Scudda-Hay! (1948) | AX71: =A71 -> 22125
A72: 22132 | F72: OMSI Presents | G72: Eye Opener | H72: Uncle Charlie's Roundhouse | J72: Romper Room | K72: It's a Great Life | L72: Rosemary Clooney | M72: The Better Half | N72: Restless Gun (ABC) | O72: Love That Bob! (ABC) | P72: About Faces (ABC) | Q72: Official Detective | R72: Day in Court (ABC) | S72: Gale Storm (ABC) | T72: Beat the Clock (ABC) | U72: Who Do You Trust? (ABC) | V72: American Bandstand (ABC) | W72: High Time | X72: Uncle Charlie's Den | Z72: Three Stooges | AA72: Rocky and His Friends (ABC) | AB72: News Central | AC72: Big Camera--Bob Brown | AD72: Donna Reed (ABC) | AE72: The Real McCoys (ABC) | AF72: Jeannie Carson | AG72: The Untouchables (ABC) | AI72: TBA | AJ72: Tombstone Territory | AK72: The Pioneers (Death Valley Days) | AL72: News--John Salisbury; [11:15] Movie [Movie 12]: Maryland (1940) | AX72: =A72 -> 22132
A73: 22139 | F73: OMSI Presents | G73: Eye Opener | H73: Uncle Charlie's Roundhouse | J73: Romper Room | K73: It's a Great Life | L73: Rosemary Clooney | M73: The Better Half | N73: Restless Gun (ABC) | O73: Love That Bob! (ABC) | P73: About Faces (ABC) | Q73: Official Detective | R73: Day in Court (ABC) | S73: Gale Storm (ABC) | T73: Beat the Clock (ABC) | U73: Who Do You Trust? (ABC) | V73: American Bandstand (ABC) | W73: High Time | X73: Uncle Charlie's Den | Z73: Three Stooges | AA73: Rocky and His Friends (ABC) | AB73: News Central | AC73: Big Camera--Bob Brown | AD73: Donna Reed (ABC) | AE73: The Real McCoys (ABC) | AF73: Jeannie Carson | AG73: The Untouchables (ABC) | AI73: Famous Playhouse | AJ73: Tombstone Territory | AK73: The Pioneers (Death Valley Days) | AL73: News--John Salisbury; [11:15] Movie [Movie 12]: Shining Victory (1941) | AX73: =A73 -> 22139
A74: 22146 | F74: OMSI Presents | G74: Eye Opener | H74: Uncle Charlie's Roundhouse | J74: Romper Room | K74: It's a Great Life | L74: Abbott and Costello | M74: The Better Half | N74: Restless Gun (ABC) | O74: Love That Bob! (ABC) | P74: About Faces (ABC) | Q74: Official Detective | R74: Day in Court (ABC) | S74: Gale Storm (ABC) | T74: Beat the Clock (ABC) | U74: Who Do You Trust? (ABC) | V74: American Bandstand (ABC) | W74: High Time | X74: Uncle Charlie's Den | Z74: Three Stooges | AA74: Rocky and His Friends (ABC) | AB74: News Central | AC74: Big Camera--Bob Brown | AD74: Donna Reed (ABC) | AE74: The Real McCoys (ABC) | AF74: Jeannie Carson | AG74: The Untouchables (ABC) | AI74: Silents Please (ABC) | AJ74: Tombstone Territory | AK74: The Pioneers (Death Valley Days) | AL74: News--John Salisbury; [11:15] Movie [Movie 12]: Androcles and the Lion (1952) | AX74: =A74 -> 22146
A75: 22153 | F75: OMSI Presents | G75: Eye Opener | H75: Uncle Charlie's Roundhouse | J75: Romper Room | K75: It's a Great Life | L75: Abbott and Costello | M75: The Better Half | N75: Restless Gun (ABC) | O75: Love That Bob! (ABC) | P75: About Faces (ABC) | Q75: Official Detective | R75: Day in Court (ABC) | S75: Gale Storm (ABC) | T75: Beat the Clock (ABC) | U75: Who Do You Trust? (ABC) | V75: American Bandstand (ABC) | W75: High Time | X75: Uncle Charlie's Den | Z75: Three Stooges | AA75: Rocky and His Friends (ABC) | AB75: News Central | AC75: Big Camera--Bob Brown | AD75: Donna Reed (ABC) | AE75: The Real McCoys (ABC) | AF75: Jeannie Carson | AG75: The Untouchables (ABC) | AI75: Silents Please (ABC) | AJ75: Tombstone Territory | AK75: The Pioneers (Death Valley Days) | AL75: News--John Salisbury; [11:15] Movie [Movie 12]: Knute Rockne--All American (1940) | AX75: =A75 -> 22153
A76: 22160 | F76: OMSI Presents | G76: Eye Opener | H76: Uncle Charlie's Roundhouse | J76: Romper Room | K76: It's a Great Life | L76: Abbott and Costello | M76: The Better Half | N76: Restless Gun (ABC) | O76: Love That Bob! (ABC) | P76: About Faces (ABC) | Q76: Official Detective | R76: Day in Court (ABC) | S76: Gale Storm (ABC) | T76: Beat the Clock (ABC) | U76: Who Do You Trust? (ABC) | V76: American Bandstand (ABC) | W76: High Time | X76: Uncle Charlie's Den | Z76: Three Stooges | AA76: Rocky and His Friends (ABC) | AB76: News Central | AC76: Big Camera--Bob Brown | AD76: Donna Reed (ABC) | AE76: The Real McCoys (ABC) | AF76: Jeannie Carson | AG76: The Untouchables (ABC) | AI76: Silents Please (ABC) | AJ76: Tombstone Territory | AK76: The Pioneers (Death Valley Days) | AL76: News--John Salisbury; [11:15] Movie [Movie 12]: Divorce of Lady X (English;?) | AX76: =A76 -> 22160
A77: 22167 | F77: OMSI Presents | G77: Eye Opener | H77: Uncle Charlie's Roundhouse | J77: Romper Room | K77: It's a Great Life | L77: Abbott and Costello | M77: The Better Half | N77: Restless Gun (ABC) | O77: Queen for a Day (ABC) | P77: About Faces (ABC) | Q77: Official Detective | R77: Day in Court (ABC) | S77: Gale Storm (ABC) | T77: Beat the Clock (ABC) | U77: Who Do You Trust? (ABC) | V77: American Bandstand (ABC) | W77: High Time | X77: Uncle Charlie's Den | Z77: Three Stooges | AA77: Rocky and His Friends (ABC) | AB77: News Central | AC77: Big Camera--Bob Brown | AD77: Donna Reed (ABC) | AE77: The Real McCoys (ABC) | AF77: Jeannie Carson | AG77: The Untouchables (ABC) | AI77: Silents Please (ABC) | AJ77: Tombstone Territory | AK77: The Pioneers (Death Valley Days) | AL77: News--John Salisbury; [11:15] Movie [Movie 12]: No Minor Vices (1948) | AX77: =A77 -> 22167
A78: 22174 | F78: OMSI Presents | G78: Eye Opener | H78: Uncle Charlie's Roundhouse | J78: Romper Room | K78: It's a Great Life | L78: Abbott and Costello | M78: The Better Half | N78: Restless Gun (ABC) | O78: Queen for a Day (ABC) | P78: About Faces (ABC) | Q78: Official Detective | R78: Day in Court (ABC) | S78: Gale Storm (ABC) | T78: Beat the Clock (ABC) | U78: Who Do You Trust? (ABC) | V78: American Bandstand (ABC) | W78: High Time | X78: Uncle Charlie's Den | Z78: Three Stooges | AA78: Rocky and His Friends (ABC) | AB78: News Central | AC78: Big Camera--Bob Brown | AD78: Donna Reed (ABC) | AE78: The Real McCoys (ABC) | AF78: Jeannie Carson | AG78: The Untouchables (ABC) | AI78: Silents Please (ABC) | AJ78: Tombstone Territory | AK78: The Pioneers (Death Valley Days) | AL78: News--John Salisbury; [11:15] Movie [Movie 12]: Night unto Night (1947) | AX78: =A78 -> 22174
A79: 22181 | F79: OMSI Presents | G79: Eye Opener | H79: Uncle Charlie's Roundhouse | J79: Romper Room | K79: It's a Great Life | L79: Abbott and Costello | M79: The Better Half | N79: Restless Gun (ABC) | O79: Queen for a Day (ABC) | P79: About Faces (ABC) | Q79: Official Detective | R79: Day in Court (ABC) | S79: Gale Storm (ABC) | T79: Beat the Clock (ABC) | U79: Who Do You Trust? (ABC) | V79: American Bandstand (ABC) | W79: High Time | X79: Uncle Charlie's Den | Z79: Three Stooges | AA79: Rocky and His Friends (ABC) | AB79: News Central | AC79: Big Camera--Bob Brown | AD79: Donna Reed (ABC) | AE79: The Real McCoys (ABC) | AF79: Jeannie Carson | AG79: The Untouchables (ABC) | AI79: Silents Please (ABC) | AJ79: Tombstone Territory | AK79: The Pioneers (Death Valley Days) | AL79: News--John Salisbury; [11:15] Movie [Movie 12]: Dragonwyck (1946) | AX79: =A79 -> 22181
B80: OTHER CITIES SWITCH TO STANDARD TIME; PORTLAND SHOWS AIR ONE HOUR LATER | J80: OTHER CITIES SWITCH TO STANDARD TIME; PORTLAND SHOWS AIR ONE HOUR LATER | R80: OTHER CITIES SWITCH TO STANDARD TIME; PORTLAND SHOWS AIR ONE HOUR LATER | Z80: OTHER CITIES SWITCH TO STANDARD TIME; PORTLAND SHOWS AIR ONE HOUR LATER | AH80: OTHER CITIES SWITCH TO STANDARD TIME; PORTLAND SHOWS AIR ONE HOUR LATER | AP80: OTHER CITIES SWITCH TO STANDARD TIME; PORTLAND SHOWS AIR ONE HOUR LATER
A81: 22188 | F81: OMSI Presents | G81: Eye Opener | H81: Uncle Charlie's Roundhouse | J81: Romper Room | K81: The Better Half | L81: It's a Great Life | M81: San Francisco Beat | N81: Court U.S.A. | O81: The Life of Riley | P81: Restless Gun (ABC) | Q81: Queen for a Day (ABC) | R81: About Faces (ABC) | S81: Official Detective | T81: Day in Court (ABC) | U81: Gale Storm (ABC) | V81: Beat the Clock (ABC) | W81: Who Do You Trust? (ABC) | X81: American Bandstand (ABC) | Y81: Uncle Charlie's Den | Z81: Three Stooges | AA81: Rocky and His Friends (ABC) | AB81: Topper | AC81: News Central | AD81: Tombstone Territory | AE81: Guestward Ho! (ABC) | AF81: Donna Reed (ABC) | AG81: The Real McCoys (ABC) | AH81: My Three Sons (ABC) | AI81: The Untouchables (ABC) | AK81: Silents Please (ABC) | AL81: News; [11:15] Movie [Movie 12]: The Tuttles of Tahiti (1942) | AX81: =A81 -> 22188
A82: 22195 | F82: OMSI Presents | G82: Eye Opener | H82: Uncle Charlie's Roundhouse | J82: Romper Room | K82: The Better Half | L82: It's a Great Life | M82: San Francisco Beat | N82: Court U.S.A. | O82: The Life of Riley | P82: The Texan (ABC) | Q82: Queen for a Day (ABC) | R82: About Faces (ABC) | S82: Official Detective | T82: Day in Court (ABC) | U82: Gale Storm (ABC) | V82: Beat the Clock (ABC) | W82: Who Do You Trust? (ABC) | X82: American Bandstand (ABC) | Y82: Uncle Charlie's Den | Z82: Three Stooges | AA82: Rocky and His Friends (ABC) | AB82: Topper | AC82: News Central | AD82: Treasure | AE82: Guestward Ho! (ABC) | AF82: Donna Reed (ABC) | AG82: The Real McCoys (ABC) | AH82: My Three Sons (ABC) | AI82: Victor Borge (ABC) [Special] | AK82: Silents Please (ABC) | AL82: News; [11:15] Movie [Movie 12]: Caught (1949) | AX82: =A82 -> 22195
A83: 22202 | F83: OMSI Presents | G83: Eye Opener | H83: Uncle Charlie's Roundhouse | J83: Romper Room | K83: The Better Half | L83: It's a Great Life | M83: San Francisco Beat | N83: Morning Court (ABC) | O83: Love That Bob! (ABC) | P83: The Texan (ABC) | Q83: Queen for a Day (ABC) | R83: About Faces (ABC) | S83: Official Detective | T83: Day in Court (ABC) | U83: Gale Storm (ABC) | V83: Beat the Clock (ABC) | W83: Who Do You Trust? (ABC) | X83: American Bandstand (ABC) | Y83: Uncle Charlie's Den | Z83: Three Stooges | AA83: Rocky and His Friends (ABC) | AB83: Topper | AC83: News Central | AD83: Treasure | AE83: Nixon-Kennedy Presidential Debate (ABC) [Special] | AG83: The Real McCoys (ABC) | AH83: My Three Sons (ABC) | AI83: The Untouchables (ABC) | AK83: CloseUp (ABC) [Special] | AL83: News; [11:15] Movie [Movie 12]: Days of Glory (1944) | AX83: =A83 -> 22202
A84: 22209 | F84: OMSI Presents | G84: Eye Opener | H84: Uncle Charlie's Roundhouse | J84: Romper Room | K84: The Better Half | L84: It's a Great Life | M84: San Francisco Beat | N84: Morning Court (ABC) | O84: Love That Bob! (ABC) | P84: The Texan (ABC) | Q84: Queen for a Day (ABC) | R84: About Faces (ABC) | S84: Official Detective | T84: Day in Court (ABC) | U84: Road to Reality (ABC) | V84: Beat the Clock (ABC) | W84: Who Do You Trust? (ABC) | X84: American Bandstand (ABC) | Y84: Uncle Charlie's Den | Z84: Three Stooges | AA84: Rocky and His Friends (ABC) | AB84: Topper | AC84: News Central | AD84: Treasure | AE84: Guestward Ho! (ABC) | AF84: Donna Reed (ABC) | AG84: The Real McCoys (ABC) | AH84: My Three Sons (ABC) | AI84: The Untouchables (ABC) | AK84: Movie [Movie 12]: For Whom the Bell Tolls (1943) | AX84: =A84 -> 22209
A85: 22216 | F85: OMSI Presents | G85: Eye Opener | H85: Uncle Charlie's Roundhouse | J85: Romper Room | K85: The Better Half | L85: It's a Great Life | M85: San Francisco Beat | N85: Morning Court (ABC) | O85: Love That Bob! (ABC) | P85: The Texan (ABC) | Q85: Queen for a Day (ABC) | R85: About Faces (ABC) | S85: Official Detective | T85: Day in Court (ABC) | U85: Road to Reality (ABC) | V85: Beat the Clock (ABC) | W85: Who Do You Trust? (ABC) | X85: American Bandstand (ABC) | Y85: Uncle Charlie's Den | Z85: Three Stooges | AA85: Rocky and His Friends (ABC) | AB85: Topper | AC85: News Central | AD85: Treasure | AE85: Guestward Ho! (ABC) | AF85: Donna Reed (ABC) | AG85: The Real McCoys (ABC) | AH85: My Three Sons (ABC) | AI85: A Date with Debbie (ABC) [Special] | AK85: Take a Good Look (ABC) | AL85: News; [11:15] Movie [Movie 12]: Remember the Day (1943) | AX85: =A85 -> 22216
A86: 22223 | F86: OMSI Presents | G86: Eye Opener | H86: Uncle Charlie's Roundhouse | J86: Romper Room | K86: The Better Half | L86: It's a Great Life | M86: San Francisco Beat | N86: Morning Court (ABC) | O86: Love That Bob! (ABC) | P86: The Texan (ABC) | Q86: Queen for a Day (ABC); [12:55] Political Talk--Republican | R86: About Faces (ABC) | S86: Official Detective | T86: Day in Court (ABC); [2:25] Political Talk--Democratic | U86: Road to Reality (ABC) | V86: Beat the Clock (ABC) | W86: Who Do You Trust? (ABC) | X86: American Bandstand (ABC) | Y86: Uncle Charlie's Den | Z86: Three Stooges | AA86: Rocky and His Friends (ABC) | AB86: Topper | AC86: News Central | AD86: Treasure | AE86: Guestward Ho! (ABC) | AF86: Donna Reed (ABC) | AG86: The Real McCoys (ABC) | AH86: My Three Sons (ABC) | AI86: The Untouchables (ABC) | AK86: CloseUp (ABC) [Special] | AL86: News; [11:15] Movie [Movie 12]: Angels with Dirty Faces (1938) | AX86: =A86 -> 22223
A87: 22230 | F87: OMSI Presents | G87: Eye Opener | H87: Uncle Charlie's Roundhouse | J87: Romper Room | K87: The Better Half | L87: It's a Great Life | M87: San Francisco Beat | N87: Morning Court (ABC) | O87: Love That Bob! (ABC) | P87: The Texan (ABC) | Q87: Queen for a Day (ABC) | R87: About Faces (ABC) | S87: Official Detective | T87: Day in Court (ABC) | U87: Road to Reality (ABC) | V87: Beat the Clock (ABC) | W87: Who Do You Trust? (ABC) | X87: American Bandstand (ABC) | Y87: Uncle Charlie's Den | Z87: Three Stooges | AA87: Rocky and His Friends (ABC) | AB87: Topper | AC87: News Central | AD87: Treasure | AE87: Guestward Ho! (ABC) | AF87: Donna Reed (ABC) | AG87: The Real McCoys (ABC) | AH87: My Three Sons (ABC) | AI87: The Untouchables (ABC) | AK87: Take a Good Look (ABC) | AL87: News; [11:15] Movie [Movie 12]: Night Beat (English; 1949) | AX87: =A87 -> 22230
A88: 22237 | F88: OMSI Presents | G88: Eye Opener | H88: Uncle Charlie's Roundhouse | J88: Romper Room | K88: The Better Half | L88: It's a Great Life | M88: San Francisco Beat | N88: Morning Court (ABC) | O88: Love That Bob! (ABC) | P88: The Texan (ABC) | Q88: Beat the Clock (ABC) | R88: About Faces (ABC) | S88: Official Detective | T88: Day in Court (ABC) | U88: Road to Reality (ABC) | V88: Queen for a Day (ABC) | W88: Who Do You Trust? (ABC) | X88: American Bandstand (ABC) | Y88: Uncle Charlie's Den | Z88: Three Stooges | AA88: Rocky and His Friends (ABC) | AB88: Topper | AC88: News Central | AD88: Treasure | AE88: Guestward Ho! (ABC) | AF88: Donna Reed (ABC) | AG88: The Real McCoys (ABC) | AH88: My Three Sons (ABC) | AI88: The Untouchables (ABC) | AK88: Take a Good Look (ABC) | AL88: News; [11:15] Movie [Movie 12]: Ruggles of Red Gap (1935) | AX88: =A88 -> 22237
A89: 22244 | F89: OMSI Presents | G89: Eye Opener | H89: Uncle Charlie's Roundhouse | J89: Romper Room | K89: The Better Half | L89: It's a Great Life | M89: 1961 Portland Boat Show | N89: Football Kickoff (ABC); College Football (ABC) Texas A&M vs. Texas; [2:15] Postgame Scoreboard | U89: AFL Football (ABC) Dallas Texans vs. New York Titans | AA89: Rocky and His Friends (ABC) | AB89: Topper | AC89: News Central | AD89: Treasure | AE89: Guestward Ho! (ABC) | AF89: Donna Reed (ABC) | AG89: The Real McCoys (ABC) | AH89: My Three Sons (ABC) | AI89: The Untouchables (ABC) | AK89: Take a Good Look (ABC) | AL89: News; [11:15] Movie [Movie 12]: The Miracle of the Bells (1948) | AX89: =A89 -> 22244
A90: 22251 | F90: OMSI Presents | G90: Eye Opener | H90: Uncle Charlie's Roundhouse | J90: Romper Room | K90: The Better Half | L90: It's a Great Life | M90: San Francisco Beat | N90: Morning Court (ABC) | O90: Love That Bob! (ABC) | P90: The Texan (ABC) | Q90: Beat the Clock (ABC) | R90: About Faces (ABC) | S90: The Crusader | T90: Day in Court (ABC) | U90: Road to Reality (ABC) | V90: Queen for a Day (ABC) | W90: Who Do You Trust? (ABC) | X90: American Bandstand (ABC) | Y90: Uncle Charlie's Den | Z90: Three Stooges | AA90: Rocky and His Friends (ABC) | AB90: Topper | AC90: News Central | AD90: Treasure | AE90: Guestward Ho! (ABC) | AF90: Donna Reed (ABC) | AG90: The Real McCoys (ABC) | AH90: My Three Sons (ABC) | AI90: The Untouchables (ABC) | AK90: Take a Good Look (ABC) | AL90: News; [11:15] Movie [Movie 12]: Desert Sands (1955) | AX90: =A90 -> 22251
A91: 22258 | F91: OMSI Presents | G91: Eye Opener | H91: Uncle Charlie's Roundhouse | J91: Romper Room | K91: The Better Half | L91: It's a Great Life | M91: San Francisco Beat | N91: Morning Court (ABC) | O91: Love That Bob! (ABC) | P91: The Texan (ABC) | Q91: Beat the Clock (ABC) | R91: About Faces (ABC) | S91: The Crusader | T91: Day in Court (ABC) | U91: Road to Reality (ABC) | V91: Queen for a Day (ABC) | W91: Who Do You Trust? (ABC) | X91: American Bandstand (ABC) | Y91: Uncle Charlie's Den | Z91: Three Stooges | AA91: Rocky and His Friends (ABC) | AB91: Topper | AC91: News Central | AD91: Treasure | AE91: Guestward Ho! (ABC) | AF91: Donna Reed (ABC) | AG91: The Real McCoys (ABC) | AH91: My Three Sons (ABC) | AI91: The Untouchables (ABC) | AK91: Take a Good Look (ABC) | AL91: News; [11:15] Movie [Movie 12]: Back from Eternity (1956) | AX91: =A91 -> 22258
A92: 22265 | F92: OMSI Presents | G92: Eye Opener | H92: Uncle Charlie's Roundhouse | J92: Romper Room | K92: The Better Half | L92: It's a Great Life | M92: San Francisco Beat | N92: Morning Court (ABC) | O92: Love That Bob! (ABC) | P92: The Texan (ABC) | Q92: Beat the Clock (ABC) | R92: About Faces (ABC) | S92: The Crusader | T92: Day in Court (ABC) | U92: Road to Reality (ABC) | V92: Queen for a Day (ABC) | W92: Who Do You Trust? (ABC) | X92: American Bandstand (ABC) | Y92: Uncle Charlie's Den | Z92: Three Stooges | AA92: Rocky and His Friends (ABC) | AB92: Topper | AC92: News Central | AD92: Treasure | AE92: Guestward Ho! (ABC) | AF92: Donna Reed (ABC) | AG92: The Real McCoys (ABC) | AH92: My Three Sons (ABC) | AI92: The Untouchables (ABC) | AK92: Take a Good Look (ABC) | AL92: News; [11:15] Movie [Movie 12]: Torped Alley (1953) | AX92: =A92 -> 22265
A93: 22272 | F93: OMSI Presents | G93: Eye Opener | H93: Uncle Charlie's Roundhouse | J93: Romper Room | K93: The Better Half | L93: It's a Great Life | M93: San Francisco Beat | N93: Morning Court (ABC) | O93: Love That Bob! (ABC) | P93: The Texan (ABC) | Q93: Beat the Clock (ABC) | R93: About Faces (ABC) | S93: The Crusader | T93: Day in Court (ABC) | U93: Road to Reality (ABC) | V93: Queen for a Day (ABC) | W93: Who Do You Trust? (ABC) | X93: American Bandstand (ABC) | Y93: Uncle Charlie's Den | Z93: Three Stooges | AA93: Rocky and His Friends (ABC) | AB93: Topper | AC93: News Central | AD93: Treasure | AE93: Guestward Ho! (ABC) | AF93: Donna Reed (ABC) | AG93: The Real McCoys (ABC) | AH93: My Three Sons (ABC) | AI93: The Untouchables (ABC) | AK93: Take a Good Look (ABC) | AL93: News; [11:15] Movie [Movie 12]: Sally, Irene and Mary (1938) | AX93: =A93 -> 22272
A94: 22279 | F94: OMSI Presents | G94: Eye Opener | H94: Uncle Charlie's Roundhouse | J94: Romper Room | K94: The Better Half | L94: It's a Great Life | M94: San Francisco Beat | N94: Morning Court (ABC) | O94: Love That Bob! (ABC) | P94: The Texan (ABC) | Q94: Beat the Clock (ABC) | R94: About Faces (ABC) | S94: The Crusader | T94: Day in Court (ABC) | U94: Road to Reality (ABC) | V94: Queen for a Day (ABC) | W94: Who Do You Trust? (ABC) | X94: American Bandstand (ABC) | Y94: Uncle Charlie's Den | Z94: Three Stooges | AA94: Rocky and His Friends (ABC) | AB94: Topper | AC94: News Central | AD94: Treasure | AE94: Guestward Ho! (ABC) | AF94: Donna Reed (ABC) | AG94: The Real McCoys (ABC) | AH94: My Three Sons (ABC) | AI94: The Untouchables (ABC) | AK94: Take a Good Look (ABC) | AL94: News; [11:15] Movie [Movie 12]: Intermezzo (1939) | AX94: =A94 -> 22279
A95: 1961 | AX95: =A95 -> 1961
A96: 22286 | F96: OMSI Presents | G96: Eye Opener | H96: Uncle Charlie's Roundhouse | J96: Romper Room | K96: The Better Half | L96: It's a Great Life | M96: San Francisco Beat | N96: Morning Court (ABC) | O96: Love That Bob! (ABC) | P96: The Texan (ABC) | Q96: Beat the Clock (ABC) | R96: About Faces (ABC) | S96: The Crusader | T96: Day in Court (ABC) | U96: Road to Reality (ABC) | V96: Queen for a Day (ABC) | W96: Who Do You Trust? (ABC) | X96: American Bandstand (ABC) | Y96: Uncle Charlie's Den | Z96: Three Stooges | AA96: Rocky and His Friends (ABC) | AB96: Topper | AC96: News Central | AD96: Treasure | AE96: Guestward Ho! (ABC) | AF96: Donna Reed (ABC) | AG96: The Real McCoys (ABC) | AH96: My Three Sons (ABC) | AI96: The Untouchables (ABC) | AK96: Take a Good Look (ABC) | AL96: News; [11:15] Movie [Movie 12]: TBA | AX96: =A96 -> 22286
A100: 1962 | AX100: =A100 -> 1962
A102: 1963 | AX102: =A102 -> 1963
A103: 23168 | F103: Paul's Agriscope | G103: Cartoon Capers; [7:45] Dr. Zoom's Cartoons; [8:15] King Leonardo | I103: Romper Room | J103: Jack LaLanne | K103: News--Ed Arndt; [9:35] Movie: Don't Bother to Knock (1952) | N103: Life of Riley | O103: Seven Keys (ABC) | P103: Ernie Ford | Q103: Father Knows Best | R103: General Hospital (ABC) | S103: Girl Talk | T103: Day in Court; [2:25] News | U103: Jayne Wyman | V103: Queen for a Day | W103: Who Do You Trust? | X103: American Bandstand (ABC) | Y103: Discovery '63; [4:55] American Newsstand | Z103: Three Stooges | AA103: Popeye Theater | AB103: Cartoon Castle | AC103: News--Sanders, Arndt; [6:45] ABC News | AD103: Navy Log | AE103: Ozzie and Harriet (ABC) | AF103: Donna Reed (ABC) | AG103: Leave it to Beaver (ABC) | AH103: My Three Sons (ABC) | AI103: McHale's Navy (ABC) | AJ103: Alcoa Premiere (ABC) | AL103: News, Sports | AM103: Northwest Wrestling | AO103: Zane Grey | AP103: Movie: Underwater (1955) | AX103: 23168
A109: 1965 | AX109: 1965
A110: 24001 | K110: [9:45] News, Weather | L110: Modern England | M110: Jack La Lanne | N110: 12 in the Morning | O110: Sergeant Preston | P110: Cartoon Castle [Dr. Zoom] | R110: Girl Talk | S110: Movie: Higher and Higher (1943) | V110: [3:15] News--Duane Bock | W110: Touch Turtle | X110: [4:15] Rocky and Friends | Y110: Popeye's Pier 12 | Z110: Lloyd Thaxton | AB110: Huckleberry Hound | AC110: Trackdown | AD110: The Rifleman | AE110: Holiday | AF110: Movie: A Southern Yankee (1948) | AJ110: Laramie | AL110: Sports Final--Jimmy Jones; [11:05] Movie: Fixed Bayonets (1951) | AX110: =A110 -> 24001
A111: 24008 | K111: [9:45] News, Weather | L111: Modern England | M111: Jack La Lanne | N111: 12 in the Morning | O111: Sergeant Preston | P111: Cartoon Castle [Dr. Zoom] | R111: Girl Talk | S111: Movie: Look Who's Laughing (1941) | V111: [3:15] News--Duane Bock | W111: Touch Turtle | X111: [4:15] Rocky and Friends | Y111: Popeye's Pier 12 | Z111: Lloyd Thaxton | AB111: Huckleberry Hound | AC111: Trackdown | AD111: The Rifleman | AE111: Holiday | AF111: Movie: Sword of the Conqueror (Italian, 1961) | AJ111: Laramie | AL111: Sports Final--Jimmy Jones; [11:05] Movie: The Great War (Italian, 1961) | AX111: =A111 -> 24008
A117: 1970 | AX117: 1970
A118: 25576 | F118: Telecourse | G118: The Flintstones | H118: Hobo Kelly | J118: The Patty Duke Show | K118: The Wonderful World of Women | L118: Movie [Morning Movie 12]: Bigger Than Life (1956) | O118: Fashions in Sewing; [11:40] 12 in the Morning; [11:50] News--Don Stellges | P118: Rusty Nails' Cartoons | R118: The Movie Game | S118: Lewis and Clark | U118: The Galloping Gourmet | V118: The Three O'Clock News--Don Stellges/ Jimmy Jones/ Bill Swing | W118: He Said! She Said! | X118: Beat the Clock | Y118: Popeye's Pier 12 | Z118: The Flintstones | AA118: Sea Hunt | AB118: Gilligan's Island | AC118: The Invaders | AE118: Perry Mason | AG118: The David Frost Show | AJ118: The 10 O'Clock News--Don Stellges | AK118: Felony Squad | AL118: Movie [Movie 12]: The King's Thief (1955) | AX118: =A118 -> 25576
A119: =A118+7 -> 25583 | F119: Telecourse | G119: The Flintstones | H119: Hobo Kelly | J119: The Patty Duke Show | K119: The Wonderful World of Women | L119: Movie [Morning Movie 12]: Sweet Rosie O'Grady (1943) | O119: Fashions in Sewing; [11:40] 12 in the Morning; [11:50] News--Don Stellges | P119: Rusty Nails' Cartoons | R119: The Movie Game | S119: Run for Your Life | U119: The Galloping Gourmet | V119: The Three O'Clock News--Don Stellges/ Jimmy Jones/ Bill Swing | W119: He Said! She Said! | X119: Beat the Clock | Y119: Popeye's Pier 12 | Z119: The Flintstones | AA119: Sea Hunt | AB119: Gilligan's Island | AC119: Star Trek | AE119: Perry Mason | AG119: The David Frost Show | AJ119: The 10 O'Clock News--Don Stellges | AK119: Felony Squad | AL119: Movie [Movie 12]: Land of the Pharaohs (1955) | AX119: =A119 -> 25583
A120: =A119+7 -> 25590
A121: =A120+7 -> 25597 | F121: Telecourse | G121: The Flintstones | H121: Hobo Kelly | J121: The Patty Duke Show | K121: The Wonderful World of Women | L121: Movie [Morning Movie 12]: Crime Wave (1954) | O121: Fashions in Sewing; [11:40] 12 in the Morning; [11:50] News--Don Stellges | P121: Rusty Nails' Cartoons | R121: The Movie Game | S121: Run for Your Life | U121: The Galloping Gourmet | V121: The Three O'Clock News--Don Stellges/ Jimmy Jones/ Bill Swing | W121: He Said! She Said! | X121: Beat the Clock | Y121: Popeye's Pier 12 | Z121: The Flintstones | AA121: Sea Hunt | AB121: Gilligan's Island | AC121: Star Trek | AE121: Perry Mason | AG121: The David Frost Show | AJ121: The 10 O'Clock News-- Don Stellges/ Michael Hartfield/ Jimmy Jones | AK121: Felony Squad | AL121: Movie [Movie 12]: Sword of Lancelot (1962) | AX121: =A121 -> 25597
A122: =A121+7 -> 25604 | F122: Telecourse | G122: The Flintstones | H122: Hobo Kelly | J122: The Patty Duke Show | K122: The Wonderful World of Women | L122: Movie [Morning Movie 12]: A Life in the Balance (1955) | O122: Fashions in Sewing; [11:40] 12 in the Morning; [11:50] News--Don Stellges | P122: Rusty Nails' Cartoons | R122: The Movie Game | S122: Run for Your Life | U122: The Galloping Gourmet | V122: The Three O'Clock News--Don Stellges/ Jimmy Jones/ Bill Swing | W122: He Said! She Said! | X122: Beat the Clock | Y122: Popeye's Pier 12 | Z122: The Flintstones | AA122: Sea Hunt | AB122: Gilligan's Island | AC122: Star Trek | AE122: Perry Mason | AG122: College Basketball: Portland State University vs Parsons College | AK122: The 10 O'Clock News-- Don Stellges/ Michael Hartfield/ Jimmy Jones | AL122: Movie [Movie 12]: The Warrior and the Slave Girl (1958) | AX122: =A122 -> 25604
A123: =A122+7 -> 25611 | F123: Telecourse | G123: The Flintstones | H123: Hobo Kelly | J123: The Patty Duke Show | K123: The Wonderful World of Women | L123: Movie [Morning Movie 12]: The Moonraker (1958) | O123: Fashions in Sewing; [11:40] 12 in the Morning; [11:50] News--Don Stellges | P123: Rusty Nails' Cartoons | R123: The Movie Game | S123: Run for Your Life | U123: The Galloping Gourmet | V123: The Three O'Clock News--Don Stellges/ Jimmy Jones/ Bill Swing | W123: He Said! She Said! | X123: Beat the Clock | Y123: Popeye's Pier 12 | Z123: The Flintstones | AA123: Sea Hunt | AB123: Gilligan's Island | AC123: Star Trek | AE123: Perry Mason | AG123: The David Frost Show | AJ123: The 10 O'Clock News-- Don Stellges/ Michael Hartfield/ Jimmy Jones | AK123: Felony Squad | AL123: Movie [Movie 12]: The Mark of the Hawk (1958) | AX123: =A123 -> 25611
A124: =A123+7 -> 25618 | F124: Telecourse | G124: The Flintstones | H124: Hobo Kelly | J124: The Patty Duke Show | K124: The Wonderful World of Women | L124: Movie [Morning Movie 12]: Illegal (1955) | O124: Fashions in Sewing; [11:40] 12 in the Morning; [11:50] News--Don Stellges | P124: Rusty Nails' Cartoons | R124: The Movie Game | S124: Run for Your Life | U124: The Galloping Gourmet | V124: The Three O'Clock News--Don Stellges/ Jimmy Jones/ Bill Swing | W124: He Said! She Said! | X124: Beat the Clock | Y124: Popeye's Pier 12 | Z124: The Flintstones | AA124: Sea Hunt | AB124: Gilligan's Island | AC124: Star Trek | AE124: Perry Mason | AG124: The David Frost Show | AJ124: The 10 O'Clock News-- Don Stellges/ Michael Hartfield/ Jimmy Jones | AK124: Felony Squad | AL124: Movie [Movie 12]: Esther and the King (1960) | AX124: =A124 -> 25618
A125: =A124+7 -> 25625 | F125: Telecourse | G125: The Flintstones | H125: Hobo Kelly | J125: The Patty Duke Show | K125: The Wonderful World of Women | L125: Education of the Blind | N125: Faces and Places | O125: Fashions in Sewing; [11:40] 12 in the Morning; [11:50] News--Don Stellges | P125: Rusty Nails' Cartoons | R125: The Movie Game | S125: Run for Your Life | U125: The Galloping Gourmet | V125: The Three O'Clock News--Don Stellges/ Jimmy Jones/ Bill Swing | W125: He Said! She Said! | X125: Beat the Clock | Y125: Popeye's Pier 12 | Z125: The Flintstones | AA125: Sea Hunt | AB125: Gilligan's Island | AC125: Star Trek | AE125: Perry Mason | AG125: The David Frost Show | AJ125: The 10 O'Clock News-- Don Stellges/ Michael Hartfield/ Jimmy Jones | AK125: Felony Squad | AL125: Movie [Movie 12]: Anne of the Indies (1951) | AX125: =A125 -> 25625
A126: =A125+7 -> 25632
A127: =A126+7 -> 25639 | F127: Telecourse | G127: The Flintstones | H127: Hobo Kelly | J127: The Patty Duke Show | K127: The Wonderful World of Women | L127: Movie [Morning Movie 12]: Lucky Me (1954) | O127: Fashions in Sewing; [11:40] 12 in the Morning; [11:50] News--Don Stellges | P127: Rusty Nails' Cartoons | R127: The Movie Game | S127: Run for Your Life | U127: The Galloping Gourmet | V127: The Three O'Clock News--Don Stellges/ Jimmy Jones/ Bill Swing | W127: He Said! She Said! | X127: Beat the Clock | Y127: Popeye's Pier 12 | Z127: The Flintstones | AA127: Sea Hunt | AB127: Gilligan's Island | AC127: Star Trek | AE127: Perry Mason | AG127: The David Frost Show | AJ127: The 10 O'Clock News-- Don Stellges/ Michael Hartfield/ Jimmy Jones | AK127: Felony Squad | AL127: Movie [Movie 12]: Hot Blood (1956) | AX127: =A127 -> 25639
A128: =A127+7 -> 25646 | F128: Telecourse | G128: The Flintstones | H128: Hobo Kelly | J128: The Patty Duke Show | K128: The Wonderful World of Women | L128: Movie [Morning Movie 12]: Bambuti (1956) | O128: Fashions in Sewing; [11:40] 12 in the Morning; [11:55] News--Larry Curran | P128: Rusty Nails' Cartoons | R128: The Movie Game | S128: Hawaii Calls | T128: Faces and Places | U128: The Galloping Gourmet | V128: The Three O'Clock News--Don Stellges/ Jimmy Jones/ Bill Swing | W128: He Said! She Said! | X128: Beat the Clock | Y128: Popeye's Pier 12 | Z128: The Flintstones | AA128: Sea Hunt | AB128: Star Trek | AD128: Boxing: National Golden Gloves Championship from Las Vegas | AH128: The David Frost Show | AK128: The 10 O'Clock News-- Don Stellges/ Michael Hartfield/ Jimmy Jones | AL128: Movie [Movie 12]: Behind the Mask of Zorro (1962) | AX128: =A128 -> 25646
A129: =A128+7 -> 25653 | F129: Telecourse | G129: The Flintstones | H129: Hobo Kelly | J129: The Patty Duke Show | K129: The Wonderful World of Women | L129: Movie [Morning Movie 12]: X the Unknown (1957) | O129: Fashions in Sewing; [11:40] 12 in the Morning; [11:50] News--Larry Curran | P129: Rusty Nails' Cartoons | R129: The Movie Game | S129: Hawaii Calls | T129: Faces and Places | U129: The Galloping Gourmet | V129: The Three O'Clock News--Don Stellges/ Jimmy Jones/ Bill Swing | W129: He Said! She Said! | X129: Beat the Clock | Y129: Popeye's Pier 12 | Z129: The Flintstones | AA129: Sea Hunt | AB129: Gilligan's Island | AC129: Star Trek | AE129: Perry Mason | AG129: The David Frost Show | AJ129: The 10 O'Clock News-- Don Stellges/ Michael Hartfield/ Jimmy Jones | AK129: Felony Squad | AL129: Movie [Movie 12]: Captain Horatio Hornblower (1951) | AX129: =A129 -> 25653
A130: =A129+7 -> 25660 | F130: Telecourse | G130: The Flintstones | H130: Hobo Kelly | J130: The Patty Duke Show | K130: The Wonderful World of Women | L130: Movie [Morning Movie 12]: Three Sailors and a Girl (1953) | O130: Fashions in Sewing; [11:40] 12 in the Morning; [11:50] News--Larry Curran | P130: Rusty Nails' Cartoons | R130: The Movie Game | S130: Hawaii Calls | T130: Faces and Places | U130: The Galloping Gourmet | V130: The Three O'Clock News--Don Stellges/ Jimmy Jones/ Bill Swing | W130: He Said! She Said! | X130: Beat the Clock | Y130: Popeye's Pier 12 | Z130: The Flintstones | AA130: Sea Hunt | AB130: Gilligan's Island | AC130: Star Trek | AE130: Perry Mason | AG130: The David Frost Show | AJ130: The 10 O'Clock News-- Don Stellges/ Michael Hartfield/ Jimmy Jones | AK130: Felony Squad | AL130: Movie [Movie 12]: Miracle in the Rain (1956) | AX130: =A130 -> 25660
A131: =A130+7 -> 25667
A132: =A131+7 -> 25674 | F132: Telecourse | G132: The Flintstones | H132: Hobo Kelly | J132: The Patty Duke Show | K132: The Wonderful World of Women | L132: Movie [Morning Movie 12]: The Three Swords of Zorro (1960) | O132: Fashions in Sewing; [11:40] 12 in the Morning; [11:50] News--Larry Curran | P132: Rusty Nails' Cartoons | R132: The Movie Game | S132: The Naked City | U132: The Galloping Gourmet | V132: The Three O'Clock News--Don Stellges/ Jimmy Jones/ Bill Swing | W132: He Said! She Said! | X132: Beat the Clock | Y132: Popeye's Pier 12 | Z132: The Addams Family | AA132: Sea Hunt | AB132: Gilligan's Island | AC132: Star Trek | AE132: Perry Mason | AG132: The David Frost Show | AJ132: The 10 O'Clock News-- Don Stellges/ Michael Hartfield/ Jimmy Jones | AK132: Felony Squad | AL132: Movie [Movie 12]: Hot Summer Night (1957) | AX132: =A132 -> 25674
A133: =A132+7 -> 25681 | F133: Telecourse | G133: The Flintstones | H133: Hobo Kelly | J133: The Patty Duke Show | K133: The Wonderful World of Women | L133: Movie [Morning Movie 12]: Hello, Frisco, Hello (1943) | O133: Fashions in Sewing; [11:40] 12 in the Morning; [11:50] News--Larry Curran | P133: Rusty Nails' Cartoons | R133: The Movie Game | S133: The Naked City | U133: The Galloping Gourmet | V133: The Three O'Clock News--Don Stellges/ Jimmy Jones/ Bill Swing | W133: He Said! She Said! | X133: Beat the Clock | Y133: Popeye's Pier 12 | Z133: The Addams Family | AA133: Sea Hunt | AB133: Gilligan's Island | AC133: Star Trek | AE133: Perry Mason | AG133: The David Frost Show | AJ133: The 10 O'Clock News-- Don Stellges/ Michael Hartfield/ Jimmy Jones | AK133: Felony Squad | AL133: Movie [Movie 12]: Mother Wore Tights (1947) | AX133: =A133 -> 25681
A134: =A133+7 -> 25688
A135: =A134+7 -> 25695 | F135: Telecourse | G135: The Flintstones | H135: Hobo Kelly | J135: The Patty Duke Show | K135: The Wonderful World of Women | L135: Movie [Morning Movie 12]: The Silver Whip (1953) | O135: Fashions in Sewing; [11:40] 12 in the Morning; [11:50] News--Larry Curran | P135: Rusty Nails' Cartoons | R135: The Movie Game | S135: The Naked City | U135: The Galloping Gourmet | V135: The Three O'Clock News--Don Stellges/ Jimmy Jones/ Bill Swing | W135: He Said! She Said! | X135: Beat the Clock | Y135: Popeye's Pier 12 | Z135: The Addams Family | AA135: Sea Hunt | AB135: Gilligan's Island | AC135: Star Trek | AE135: Perry Mason | AG135: The David Frost Show | AJ135: The 10 O'Clock News-- Don Stellges/ Michael Hartfield/ Jimmy Jones | AK135: Felony Squad | AL135: Movie [Movie 12]: Wild Seed (1965) | AX135: =A135 -> 25695
A136: =A135+7 -> 25702 | F136: Telecourse | G136: The Flintstones | H136: Hobo Kelly | J136: The Patty Duke Show | K136: The Wonderful World of Women | L136: Movie [Morning Movie 12]: Fast and Sexy (1960) | O136: Fashions in Sewing; [11:40] 12 in the Morning; [11:50] News--Larry Curran | P136: Rusty Nails' Cartoons | R136: The Movie Game | S136: The Naked City | U136: The Galloping Gourmet | V136: The Three O'Clock News--Don Stellges/ Jimmy Jones/ Bill Swing | W136: He Said! She Said! | X136: Beat the Clock | Y136: Popeye's Pier 12 | Z136: The Addams Family | AA136: Sea Hunt | AB136: Gilligan's Island | AC136: Star Trek | AE136: Perry Mason | AG136: The David Frost Show | AJ136: The 10 O'Clock News-- Don Stellges/ Michael Hartfield/ Jimmy Jones | AK136: The Honey-mooners | AL136: Movie [Movie 12]: All Fall Down (1961) | AX136: =A136 -> 25702
A137: =A136+7 -> 25709
A138: =A137+7 -> 25716 | F138: Telecourse | G138: The Flintstones | H138: Hobo Kelly | J138: The Patty Duke Show | K138: The Wonderful World of Women | L138: Movie [Morning Movie 12]: The Little Savage (1959) | O138: Fashions in Sewing; [11:40] 12 in the Morning; [11:50] News--Larry Curran | P138: Rusty Nails' Cartoons | R138: The Movie Game | S138: The Naked City | U138: The Galloping Gourmet | V138: The Three O'Clock News--Don Stellges/ Jimmy Jones/ Bill Swing | W138: He Said! She Said! | X138: Beat the Clock | Y138: Popeye's Pier 12 | Z138: The Addams Family | AA138: Sea Hunt | AB138: Gilligan's Island | AC138: Star Trek | AE138: The Fabulous Sixties (Special) | AG138: The David Frost Show | AJ138: The 10 O'Clock News-- Don Stellges/ Michael Hartfield/ Jimmy Jones | AK138: The Honey-mooners | AL138: Movie [Movie 12]: Let No Man Write My Epitaph (1960) | AX138: =A138 -> 25716
A139: =A138+7 -> 25723 | F139: Telecourse | G139: The Flintstones | H139: Hobo Kelly | J139: The Patty Duke Show | K139: The Wonderful World of Women | L139: Movie [Morning Movie 12]: Suicide Mission (1956) | O139: 12 in the Morning; [11:40] News--Larry Curran | P139: Rusty Nails' Cartoons | R139: The Movie Game | S139: The Untouchables | U139: The Galloping Gourmet | V139: The Three O'Clock News--Don Stellges/ Jimmy Jones/ Bill Swing; [3:20] Fashions in Sewing | W139: He Said! She Said! | X139: Beat the Clock | Y139: Popeye's Pier 12 | Z139: The Addams Family | AA139: Sea Hunt | AB139: Gilligan's Island | AC139: Star Trek | AE139: Perry Mason | AG139: The David Frost Show | AJ139: The 10 O'Clock News-- Don Stellges/ Michael Hartfield/ Jimmy Jones | AK139: The Honey-mooners | AL139: Movie [Movie 12]: Family Honeymoon (1948) | AX139: =A139 -> 25723
A140: =A139+7 -> 25730 | F140: Telecourse | G140: The Flintstones | H140: Hobo Kelly | J140: The Patty Duke Show | K140: The Wonderful World of Women | L140: Movie [Morning Movie 12]: Rock Around the Clock (1956) | O140: 12 in the Morning; [11:40] News--Larry Curran | P140: Rusty Nails' Cartoons | R140: The Movie Game | S140: The Untouchables | U140: The Galloping Gourmet | V140: The Three O'Clock News--Don Stellges/ Jimmy Jones [3:20] Fashions in Sewing | W140: He Said! She Said! | X140: Beat the Clock | Y140: Popeye's Pier 12 | Z140: The Addams Family | AA140: Sea Hunt | AB140: Gilligan's Island | AC140: Star Trek | AE140: Perry Mason | AG140: The David Frost Show | AJ140: The 10 O'Clock News-- Don Stellges/ Michael Hartfield/ Jimmy Jones | AK140: The Honey-mooners | AL140: Movie [Movie 12]: Goodbye, My Fancy (1951) | AX140: =A140 -> 25730
A141: =A140+7 -> 25737 | F141: Telecourse | G141: The Flintstones | H141: Hobo Kelly | J141: The Patty Duke Show | K141: The Wonderful World of Women | L141: Movie [Morning Movie 12]: Hercules and the Ten Avengers (1964) | O141: 12 in the Morning; [11:40] News--Larry Curran/ Bill Swing | P141: Rusty Nails' Cartoons | R141: The Movie Game | S141: The Untouchables | U141: The Galloping Gourmet | V141: The Three O'Clock News--Don Stellges/ Jimmy Jones [3:20] Fashions in Sewing | W141: He Said! She Said! | X141: Beat the Clock | Y141: Popeye's Pier 12 | Z141: The Addams Family | AA141: Sea Hunt | AB141: Gilligan's Island | AC141: Star Trek | AE141: The Tom Kennedy Show (Special) | AG141: The David Frost Show | AJ141: The 10 O'Clock News-- Don Stellges/ Michael Hartfield/ Jimmy Jones | AK141: The Honey-mooners | AL141: Movie [Movie 12]: Captain Horatio Hornblower (1951) | AX141: =A141 -> 25737
A142: =A141+7 -> 25744 | F142: Telecourse | G142: The Flintstones | H142: Hobo Kelly | J142: The Patty Duke Show | K142: The Wonderful World of Women | L142: Movie [Morning Movie 12]: Let's Rock! (1958) | O142: 12 in the Morning; [11:40] News--Larry Curran/ Bill Swing | P142: Rusty Nails' Cartoons | R142: The Movie Game | S142: Faces and Places | U142: The Galloping Gourmet | V142: The Three O'Clock News--Don Stellges/ Jimmy Jones [3:20] Fashions in Sewing | W142: He Said! She Said! | X142: Beat the Clock | Y142: Popeye's Pier 12 | Z142: The Addams Family | AA142: Sea Hunt | AB142: Gilligan's Island | AC142: Star Trek | AE142: Billy Graham (Special) | AG142: The David Frost Show | AJ142: The 10 O'Clock News-- Don Stellges/ Michael Hartfield/ Jimmy Jones | AK142: The Honey-mooners | AL142: Movie [Movie 12]: Suicide Mission (English; 1956) | AX142: =A142 -> 25744
A143: =A142+7 -> 25751 | F143: Telecourse | G143: The Flintstones | H143: Hobo Kelly | J143: The Patty Duke Show | K143: The Wonderful World of Women | L143: Movie [Morning Movie 12]: Pin-up Girl (1944) | O143: 12 in the Morning; [11:40] News--Larry Curran/ Bill Swing | P143: Rusty Nails' Cartoons | R143: The Movie Game | S143: Faces and Places | U143: The Galloping Gourmet | V143: The Three O'Clock News--Don Stellges/ Jimmy Jones [3:20] Fashions in Sewing | W143: He Said! She Said! | X143: Beat the Clock | Y143: Popeye's Pier 12 | Z143: The Addams Family | AA143: Sea Hunt | AB143: Gilligan's Island | AC143: Star Trek | AE143: The Real Tom Kennedy Show | AG143: The David Frost Show | AJ143: The 10 O'Clock News-- Don Stellges/ Michael Hartfield/ Jimmy Jones | AK143: The Honey-mooners | AL143: Movie [Movie 12]: Rebel Without a Cause (1955) | AX143: =A143 -> 25751
A144: =A143+7 -> 25758 | F144: Telecourse | G144: Cartoon Castle | H144: Hobo Kelly | J144: The Patty Duke Show | K144: The Wonderful World of Women | L144: Movie [Morning Movie 12]: About Face (1952) | O144: 12 in the Morning; [11:40] News--Larry Curran/ Bill Swing | P144: Rusty Nails' Cartoons | R144: The Movie Game | S144: Faces and Places | U144: The Galloping Gourmet | V144: The Three O'Clock News--Don Stellges/ Jimmy Jones [3:20] Fashions in Sewing | W144: He Said! She Said! | X144: Beat the Clock | Y144: Popeye's Pier 12 | Z144: Mister Ed | AA144: Sea Hunt | AB144: Gilligan's Island | AC144: Star Trek | AE144: Perry Mason | AG144: The David Frost Show | AJ144: The 10 O'Clock News-- Don Stellges/ Michael Hartfield/ Jimmy Jones | AK144: The Honey-mooners | AL144: Movie [Movie 12]: I Saw What You Did (1965) | AX144: =A144 -> 25758
A150: 1975 | AX150: 1975
A151: 27396 | F151: Government Story | G151: The Flintstones | H151: Cartoon Castle | I151: Nanny and the Professor | J151: Name That Tune (NBC) | K151: News--Larry Curran/Young | L151: Now You See It (CBS) | M151: It Takes a Thief | O151: Search for Tomorrow (CBS) | P151: Jeopardy! (NBC) | Q151: The Bold Ones | S151: Movie: The Hanged Man (1964) | W151: Gomer Pyle, USMC | X151: Ramblin' Rod | Y151: Batman | Z151: I Dream of Jeannie | AA151: Courtship of Eddie's Father | AB151: The Mod Squad | AD151: The The FBI | AF151: Movie [The Movie]: Hauser's Memory (1970) | AJ151: The 10 O'Clock News | AL151: Movie [Movie 12]: Saboteur (1942) | AX151: 27396
A152: 27403 | F152: Government Story | G152: The Flintstones | H152: Cartoon Castle | I152: Nanny and the Professor | J152: Celebrity Sweepstakes (NBC) | K152: News--Larry Curran/Young | L152: Now You See It (CBS) | M152: It Takes a Thief | O152: Search for Tomorrow (CBS) | P152: How to Survive a Marriage (NBC) | Q152: Bold Ones | S152: Movie: Champagne for Caesar (1950) | W152: Gomer Pyle, USMC | X152: Ramblin' Rod | Y152: Batman | Z152: I Dream of Jeannie | AA152: Courtship of Eddie's Father | AB152: The Mod Squad | AD152: The The FBI | AF152: College Basketball: Washington Huskies vs UCLA Bruins | AJ152: The 10 O'Clock News | AL152: Movie [Movie 12]: The Priest Killer (1971) | AX152: 27403
A153: =A152+7 -> 27410 | F153: Government Story | G153: The Flintstones | H153: Cartoon Castle | I153: Petticoat Junction | J153: Celebrity Sweepstakes (NBC) | K153: Nanny and the Professor | L153: Now You See It (CBS) | M153: Bold Ones | O153: Search for Tomorrow (CBS) | P153: How to Survive a Marriage (NBC) | Q153: Movie [Matinee 12]: The Tempest (1958) | V153: Gomer Pyle, USMC | W153: Batman | X153: Ramblin' Rod | Y153: I Dream of Jeannie | Z153: College Basketball: North Carolina State Wolfpack vs Maryland Terrapins | AD153: The The FBI | AF153: College Basketball: Oregon State Beavers vs Washington Huskies | AJ153: The 10 O'Clock News | AL153: Movie [Movie 12]: Shadow Over Elveron (1968) | AX153: =AX152+7 -> 27410
A154: =A153+7 -> 27417 | F154: Government Story | G154: The Flintstones | H154: Cartoon Castle | I154: Petticoat Junction | J154: Celebrity Sweepstakes (NBC) | K154: Nanny and the Professor | L154: Now You See It (CBS) | M154: Bold Ones | O154: Search for Tomorrow (CBS) | P154: How to Survive a Marriage (NBC) | Q154: Movie [Matinee 12]: This Earth is Mine (1959) | V154: Gomer Pyle, USMC | W154: Batman | X154: Ramblin' Rod | Y154: I Dream of Jeannie | Z154: The Mod Squad | AB154: Star Trek | AD154: The The FBI | AF154: Movie [The Movie]: Never Steal Anything Small (1959) | AJ154: The 10 O'Clock News | AL154: Movie [Movie 12]: Something Wild (1961) | AX154: =AX153+7 -> 27417
A155: =A154+7 -> 27424 | F155: Government Story | G155: The Flintstones | H155: Cartoon Castle | I155: Petticoat Junction | J155: Celebrity Sweepstakes (NBC) | K155: Nanny and the Professor | L155: Now You See It (CBS) | M155: Bold Ones | O155: Search for Tomorrow (CBS) | P155: How to Survive a Marriage (NBC) | Q155: Movie [Matinee 12]: Follow That Dream (1962) | V155: Gomer Pyle, USMC | W155: Batman | X155: Ramblin' Rod | Y155: I Dream of Jeannie | Z155: The Mod Squad | AB155: Star Trek | AD155: The The FBI | AF155: Movie [The Movie]: Mask of Marcella (1972) | AJ155: The 10 O'Clock News | AL155: Movie [Movie 12]: The Life of Emile Zola (1937) | AX155: =AX154+7 -> 27424
A156: =A155+7 -> 27431 | F156: Government Story | G156: The Flintstones | H156: Cartoon Castle | I156: Petticoat Junction | J156: Celebrity Sweepstakes (NBC) | K156: Nanny and the Professor | L156: Now You See It (CBS) | M156: Bold Ones | O156: Search for Tomorrow (CBS) | P156: How to Survive a Marriage (NBC) | Q156: Movie [Matinee 12]: Pillow Talk (1959) | V156: Gomer Pyle, USMC | W156: Batman | X156: Ramblin' Rod | Y156: I Dream of Jeannie | Z156: The Mod Squad | AB156: Star Trek | AD156: The The FBI | AF156: College Basketball: California Golden Bears vs Washington Huskies | AJ156: The 10 O'Clock News | AL156: Movie [Movie 12]: Games (1967) | AX156: =AX155+7 -> 27431
A157: =A156+7 -> 27438 | F157: Government Story | G157: The Flintstones | H157: Cartoon Castle | I157: Petticoat Junction | J157: Celebrity Sweepstakes (NBC) | K157: Nanny and the Professor | L157: Now You See It (CBS) | M157: Bold Ones | O157: Search for Tomorrow (CBS) | P157: How to Survive a Marriage (NBC) | Q157: Movie [Matinee 12]: Romanoff and Juliet (1961) | V157: Gomer Pyle, USMC | W157: Batman | X157: Ramblin' Rod | Y157: I Dream of Jeannie | Z157: The Mod Squad | AB157: Star Trek | AD157: The The FBI | AF157: Movie [The Movie]: The Wrong Box (1966) | AJ157: The 10 O'Clock News | AL157: Movie [Movie 12]: Companions in Nightmare (1968) | AX157: =AX156+7 -> 27438
A158: =A157+7 -> 27445 | F158: Government Story | G158: The Flintstones | H158: Cartoon Castle | I158: Petticoat Junction | J158: Celebrity Sweepstakes (NBC) | K158: Nanny and the Professor | L158: Now You See It (CBS) | M158: Bold Ones | O158: Search for Tomorrow (CBS) | P158: How to Survive a Marriage (NBC) | Q158: Movie [Matinee 12]: The Pink Panther (1964) | V158: Gomer Pyle, USMC | W158: Batman | X158: Ramblin' Rod | Y158: I Dream of Jeannie | Z158: The Mod Squad | AB158: Star Trek | AD158: The The FBI | AF158: College Basketball: UCLA Bruins vs Washington State Cougars | AJ158: The 10 O'Clock News | AL158: Movie [Movie 12]: Never on Sunday (1960) | AX158: =AX157+7 -> 27445
A159: =A158+7 -> 27452 | F159: Government Story | G159: The Flintstones | H159: Cartoon Castle | I159: Petticoat Junction | J159: Celebrity Sweepstakes (NBC) | K159: Nanny and the Professor | L159: Now You See It (CBS) | M159: Bold Ones | O159: Search for Tomorrow (CBS) | P159: How to Survive a Marriage (NBC) | Q159: Movie [Matinee 12]: The Trouble with Angels (1966) | V159: Gomer Pyle, USMC | W159: Batman | X159: Ramblin' Rod | Y159: I Dream of Jeannie | Z159: The Mod Squad | AB159: Star Trek | AD159: The The FBI | AF159: Movie [The Movie]: I Love My Wife (1970) | AJ159: The 10 O'Clock News | AL159: Movie [Movie 12]: Midnight Lace (1960) | AX159: =AX158+7 -> 27452
A160: =A159+7 -> 27459 | F160: Government Story | G160: The Flintstones | H160: Cartoon Castle | I160: Petticoat Junction | J160: Celebrity Sweepstakes (NBC) | K160: Nanny and the Professor | L160: Now You See It (CBS) | M160: Bold Ones | O160: Search for Tomorrow (CBS) | P160: How to Survive a Marriage (NBC) | Q160: Movie [Matinee 12]: The Proud and the Profane (1956) | V160: Gomer Pyle, USMC | W160: Batman | X160: Ramblin' Rod | Y160: The Mickey Mouse Club | Z160: The Mod Squad | AB160: Star Trek | AD160: The The FBI | AF160: Movie [The Movie]: Flight to Tangier (1953) | AJ160: The 10 O'Clock News | AL160: Movie [Movie 12]: An Act of Murder (1948) | AX160: =AX159+7 -> 27459
A161: =A160+7 -> 27466 | F161: Government Story | G161: The Flintstones | H161: Cartoon Castle | I161: Petticoat Junction | J161: Celebrity Sweepstakes (NBC) | K161: Nanny and the Professor | L161: Now You See It (CBS) | M161: Sarge (Bold Ones) | O161: Search for Tomorrow (CBS) | P161: How to Survive a Marriage (NBC) | Q161: Movie [Matinee 12]: Moment to Moment (1966) | V161: Gomer Pyle, USMC | W161: Batman | X161: Ramblin' Rod | Y161: The Mickey Mouse Club | Z161: The Mod Squad | AB161: Star Trek | AD161: The The FBI | AF161: Movie [The Movie]: Incident at Phantom Hill (1966) | AJ161: The 10 O'Clock News | AL161: Movie [Movie 12]: All Quiet on the Western Front (1930) | AX161: =AX160+7 -> 27466
A162: =A161+7 -> 27473 | F162: Government Story | G162: The Flintstones | H162: Cartoon Castle | I162: Petticoat Junction | J162: Celebrity Sweepstakes (NBC) | K162: Nanny and the Professor | L162: Now You See It (CBS) | M162: Sarge (Bold Ones) | O162: Search for Tomorrow (CBS) | P162: How to Survive a Marriage (NBC) | Q162: Movie [Matinee 12]: Back Street (1961) | V162: Gomer Pyle, USMC | W162: Batman | X162: Ramblin' Rod | Y162: The Mickey Mouse Club | Z162: The Mod Squad | AB162: Star Trek | AD162: The The FBI | AF162: Movie [The Movie]: Rage (1966) | AJ162: The 10 O'Clock News | AL162: Movie [Movie 12]: Temptation (1946) | AX162: =AX161+7 -> 27473
A163: =A162+7 -> 27480 | F163: Government Story | G163: The Flintstones | H163: Cartoon Castle | I163: Petticoat Junction | J163: Celebrity Sweepstakes (NBC) | K163: Nanny and the Professor | L163: Now You See It (CBS) | M163: Sarge (Bold Ones) | O163: Search for Tomorrow (CBS) | P163: How to Survive a Marriage (NBC) | Q163: Movie [Matinee 12]: The Egg and I (1947) | V163: Gomer Pyle, USMC | W163: Batman | X163: Ramblin' Rod | Y163: The Mickey Mouse Club | Z163: The Mod Squad | AB163: Star Trek | AD163: The The FBI | AF163: Movie [The Movie]: The Jayhawkers (1959) | AJ163: The 10 O'Clock News | AL163: Movie [Movie 12]: Congo Crossing (1956) | AX163: =AX162+7 -> 27480
A164: =A163+7 -> 27487 | F164: Government Story | G164: The Flintstones | H164: Cartoon Castle | I164: Petticoat Junction | J164: Celebrity Sweepstakes (NBC) | K164: Nanny and the Professor | L164: Now You See It (CBS) | M164: Bold Ones | O164: Search for Tomorrow (CBS) | P164: How to Survive a Marriage (NBC) | Q164: Movie [Matinee 12]: The Last Adventure (1966) | V164: Gomer Pyle, USMC | W164: Batman | X164: Ramblin' Rod | Y164: The Mickey Mouse Club | Z164: The Mod Squad | AB164: Star Trek | AD164: The The FBI | AF164: Movie [The Movie]: City Beneath the Sea (1953) | AJ164: The 10 O'Clock News | AL164: Movie [Movie 12]: The Female Animal (1957) | AX164: =AX163+7 -> 27487
A165: =A164+7 -> 27494 | F165: Government Story | G165: The Flintstones | H165: Cartoon Castle | I165: Petticoat Junction | J165: Celebrity Sweepstakes (NBC) | K165: Nanny and the Professor | L165: Now You See It (CBS) | M165: Bold Ones | O165: Search for Tomorrow (CBS) | P165: How to Survive a Marriage (NBC) | Q165: Movie [Matinee 12]: Alvarez Kelly (1966) | V165: Gomer Pyle, USMC | W165: Batman | X165: Ramblin' Rod | Y165: The Mickey Mouse Club | Z165: The Mod Squad | AB165: Star Trek | AD165: The The FBI | AF165: Movie [The Movie]: Branded (1950) | AJ165: The 10 O'Clock News | AL165: Movie [Movie 12]: Female on the Beach (1955) | AX165: =AX164+7 -> 27494
A166: =A165+7 -> 27501 | F166: Government Story | G166: The Flintstones | H166: Cartoon Castle | I166: Petticoat Junction | J166: Celebrity Sweepstakes (NBC) | K166: Nanny and the Professor | L166: Now You See It (CBS) | M166: Bold Ones | O166: Search for Tomorrow (CBS) | P166: How to Survive a Marriage (NBC) | Q166: Movie [Matinee 12]: Robinson Crusoe on Mars (1964) | V166: Gomer Pyle, USMC | W166: Batman | X166: Ramblin' Rod | Y166: The Mickey Mouse Club | Z166: The Mod Squad | AB166: Star Trek | AD166: The The FBI | AF166: Movie [The Movie]: Take One False Step (1949) | AJ166: The 10 O'Clock News | AL166: Movie [Movie 12]: The Greatest Man (1956) | AX166: =AX165+7 -> 27501
A167: =A166+7 -> 27508 | F167: Government Story | G167: The Flintstones | H167: Cartoon Castle | J167: Celebrity Sweepstakes (NBC) | K167: Petticoat Junction | L167: Now You See It (CBS) | M167: Mister Ed | N167: I Dream of Jeannie | O167: Search for Tomorrow (CBS) | P167: Perry Mason | R167: Movie [Matinee 12]: Arizona Raiders (1965) | V167: Gomer Pyle, USMC | W167: Gentle Ben | X167: Ramblin' Rod | Y167: The Mickey Mouse Club | Z167: The Mod Squad | AB167: Star Trek | AD167: The The FBI | AF167: Movie [The Movie]: Killers of Kilimanjaro (1959) | AJ167: The 10 O'Clock News | AL167: Movie [Movie 12]: Stranger in My Arms (1959) | AX167: =AX166+7 -> 27508
A168: =A167+7 -> 27515 | F168: Government Story | G168: The Flintstones | H168: Cartoon Castle | J168: Celebrity Sweepstakes (NBC) | K168: Petticoat Junction | L168: Now You See It (CBS) | M168: Mister Ed | N168: I Dream of Jeannie | O168: Search for Tomorrow (CBS) | P168: Perry Mason | R168: Movie [Matinee 12]: Send Me No Flowers (1964) | V168: Gomer Pyle, USMC | W168: Gentle Ben | X168: Ramblin' Rod | Y168: The Mickey Mouse Club | Z168: The Mod Squad | AB168: Star Trek | AD168: The The FBI | AF168: Movie [The Movie]: Born Yesterday (1950) | AJ168: The 10 O'Clock News | AL168: Movie [Movie 12]: Let's Do It Again (1953) | AX168: =AX167+7 -> 27515
A169: =A168+7 -> 27522 | F169: Government Story | G169: The Flintstones | H169: Cartoon Castle | J169: Celebrity Sweepstakes (NBC) | K169: Petticoat Junction | L169: Now You See It (CBS) | M169: Mister Ed | N169: I Dream of Jeannie | O169: Search for Tomorrow (CBS) | P169: Perry Mason | R169: Movie [Matinee 12]: Treasure of the Lost Canyon (1952) | V169: Gomer Pyle, USMC | W169: Gentle Ben | X169: Ramblin' Rod | Y169: The Mickey Mouse Club | Z169: The Mod Squad | AB169: Star Trek | AD169: The The FBI | AF169: Movie [The Movie]: The Solid Gold Cadillac (1956) | AJ169: The 10 O'Clock News | AL169: Movie [Movie 12]: All My Sons (1948) | AX169: =AX168+7 -> 27522
A170: =A169+7 -> 27529 | F170: Government Story | G170: The Flintstones | H170: Cartoon Castle | J170: Celebrity Sweepstakes (NBC) | K170: Petticoat Junction | L170: Now You See It (CBS) | M170: Mister Ed | N170: I Dream of Jeannie | O170: Search for Tomorrow (CBS) | P170: Perry Mason | R170: Movie [Matinee 12]: The Three Worlds of Gulliver (1960) | V170: Gomer Pyle, USMC | W170: Gentle Ben | X170: Ramblin' Rod | Y170: The Mickey Mouse Club | Z170: The Mod Squad | AB170: Star Trek | AD170: The The FBI | AF170: Movie [The Movie]: My Six Convicts (1952) | AJ170: The 10 O'Clock News | AL170: Movie [Movie 12]: The Killers (1946) | AX170: =AX169+7 -> 27529
A171: =A170+7 -> 27536 | F171: Government Story | G171: The Flintstones | H171: Cartoon Castle | J171: Celebrity Sweepstakes (NBC) | K171: Petticoat Junction | L171: Now You See It (CBS) | M171: Mister Ed | N171: I Dream of Jeannie | O171: Search for Tomorrow (CBS) | P171: Perry Mason | R171: Movie [Matinee 12]: Back Street (1941) | V171: Gomer Pyle, USMC | W171: Gentle Ben | X171: Ramblin' Rod | Y171: The Mickey Mouse Club | Z171: The Mod Squad | AB171: Star Trek | AD171: The The FBI | AF171: Burt Bacharach and Associates | AH171: The Late Great Planet Earth | AJ171: The 10 O'Clock News | AL171: Movie [Movie 12]: Slaughter on Tenth Avenue (1957) | AX171: =AX170+7 -> 27536
A172: =A171+7 -> 27543 | F172: Government Story | G172: The Flintstones | H172: Cartoon Castle | J172: Celebrity Sweepstakes (NBC) | K172: Petticoat Junction | L172: Now You See It (CBS) | M172: Mister Ed | N172: I Dream of Jeannie | O172: Search for Tomorrow (CBS) | P172: Perry Mason | R172: Movie [Matinee 12]: Rogues' Regiment (1948) | V172: Gomer Pyle, USMC | W172: Gentle Ben | X172: Ramblin' Rod | Y172: The Mickey Mouse Club | Z172: The Mod Squad | AB172: Star Trek | AD172: The The FBI | AF172: Movie [The Movie]: Surprise Package (1960) | AJ172: The 10 O'Clock News | AL172: Movie [Movie 12]: Career (1959) | AX172: =AX171+7 -> 27543
A173: =A172+7 -> 27550 | F173: Government Story | G173: The Flintstones | H173: Cartoon Castle | J173: Celebrity Sweepstakes (NBC) | K173: Petticoat Junction | L173: Now You See It (CBS) | M173: Mister Ed | N173: I Dream of Jeannie | O173: Search for Tomorrow (CBS) | P173: Perry Mason | R173: Movie [Matinee 12]: Arizona Raiders (1965) | V173: Gomer Pyle, USMC | W173: Batman | X173: Ramblin' Rod | Y173: The Mickey Mouse Club | Z173: The Mod Squad | AB173: Star Trek | AD173: The The FBI | AF173: Movie [The Movie]: All That Heaven Allows (1955) | AJ173: The 10 O'Clock News | AL173: Movie [Movie 12]: Cry for Happy (1961) | AX173: =AX172+7 -> 27550
A174: =A173+7 -> 27557 | F174: Government Story | G174: The Flintstones | H174: Cartoon Castle | J174: Celebrity Sweepstakes (NBC) | K174: Petticoat Junction | L174: Now You See It (CBS) | M174: Mister Ed | N174: I Dream of Jeannie | O174: Search for Tomorrow (CBS) | P174: Perry Mason | R174: Movie [Matinee 12]: Ivy (1947) | V174: Gomer Pyle, USMC | W174: Batman | X174: Ramblin' Rod | Y174: The Mickey Mouse Club | Z174: The Mod Squad | AB174: Star Trek | AD174: The The FBI | AF174: Movie [The Movie]: Hired Wife (1940) | AJ174: The 10 O'Clock News | AL174: Movie [Movie 12]: The Train (1964) | AX174: =AX173+7 -> 27557
A175: =A174+7 -> 27564 | F175: Government Story | G175: The Flintstones | H175: Cartoon Castle | J175: Celebrity Sweepstakes (NBC) | K175: Petticoat Junction | L175: Tattletales (CBS) | M175: Mister Ed | N175: I Dream of Jeannie | O175: Search for Tomorrow (CBS) | P175: Perry Mason | R175: Movie [Matinee 12]: South Sea Sinner (1950) | V175: Gomer Pyle, USMC | W175: Batman | X175: Ramblin' Rod | Y175: The Mickey Mouse Club | Z175: The Mod Squad | AB175: Star Trek | AD175: The The FBI | AF175: Movie [The Movie]: The Tarnished Angels (1957) | AJ175: The 10 O'Clock News | AL175: Movie [Movie 12]: Another Part of the Forest (1948) | AX175: =AX174+7 -> 27564
A176: =A175+7 -> 27571 | F176: Government Story | G176: The Flintstones | H176: Cartoon Castle | J176: Celebrity Sweepstakes (NBC) | K176: Petticoat Junction | L176: Tattletales (CBS) | M176: Mister Ed | N176: I Dream of Jeannie | O176: Search for Tomorrow (CBS) | P176: Perry Mason | R176: Movie [Matinee 12]: The Tattered Dress (1957) | V176: Land of the Giants | X176: Ramblin' Rod | Y176: The Mickey Mouse Club | Z176: The Mod Squad | AB176: Star Trek | AD176: The The FBI | AF176: Movie [The Movie]: Do You Take This Stranger? (1971) | AJ176: The 10 O'Clock News--Michael Hartfield/Sylvia Stinson | AL176: Movie [Movie 12]: Imitation of Life (1959) | AX176: =AX175+7 -> 27571
A177: =A176+7 -> 27578 | F177: Government Story | G177: The Flintstones | H177: Cartoon Castle | J177: Celebrity Sweepstakes (NBC) | K177: Petticoat Junction | L177: Tattletales (CBS) | M177: Mister Ed | N177: I Dream of Jeannie | O177: Search for Tomorrow (CBS) | P177: Perry Mason | R177: Movie [Matinee 12]: This Love of Ours (1945) | V177: Land of the Giants | X177: Ramblin' Rod | Y177: The Mickey Mouse Club | Z177: The Mod Squad | AB177: Star Trek | AD177: The The FBI | AF177: Movie [The Movie]: Lock, Stock and Barrel (1971) | AJ177: The 10 O'Clock News--Michael Hartfield/Sylvia Stinson | AL177: Movie [Movie 12]: The Intruders (1967) | AX177: =AX176+7 -> 27578
A178: =A177+7 -> 27585 | F178: Government Story | G178: The Flintstones | H178: Cartoon Castle | J178: Celebrity Sweepstakes (NBC) | K178: Petticoat Junction | L178: Tattletales (CBS) | M178: Mister Ed | N178: Safari to Adventure | O178: Search for Tomorrow (CBS) | P178: Perry Mason | R178: Movie [Matinee 12]: The Jokers (1967) | V178: Land of the Giants | X178: Ramblin' Rod | Y178: The Mickey Mouse Club | Z178: Mission: Impossible | AB178: Star Trek | AD178: The The FBI | AF178: Movie [The Movie]: The Thrill of It All (1963) | AJ178: The 10 O'Clock News--Michael Hartfield/Sylvia Stinson | AL178: Movie [Movie 12]: The L-Shaped Room (1962) | AX178: =AX177+7 -> 27585
A179: =A178+7 -> 27592 | F179: Government Story | G179: Cartoon Castle | I179: Nanny and the Professor | J179: Celebrity Sweepstakes (NBC) | K179: Audubon Wildlife Theatre | L179: Tattletales (CBS) | M179: Gomer Pyle, USMC | N179: Safari to Adventure | O179: Search for Tomorrow (CBS) | P179: Perry Mason | R179: Movie [Matinee 12]: Flesh and Fantasy (1943) | V179: Land of the Giants | X179: Ramblin' Rod | Y179: The Mickey Mouse Club | Z179: Mission: Impossible | AB179: Star Trek | AD179: The The FBI | AF179: Movie [The Movie]: The Art of Love (1965) | AJ179: The 10 O'Clock News--Michael Hartfield/Sylvia Stinson | AL179: Movie [Movie 12]: This Earth is Mine (1959) | AX179: =AX178+7 -> 27592
A180: =A179+7 -> 27599 | F180: Government Story | G180: Cartoon Castle | I180: Nanny and the Professor | J180: Celebrity Sweepstakes (NBC) | K180: Audubon Wildlife Theatre | L180: Tattletales (CBS) | M180: Bill Burrud | O180: Search for Tomorrow (CBS) | P180: Perry Mason | R180: Movie [Matinee 12]: Unfinished Woman (1941) | V180: Land of the Giants | X180: Ramblin' Rod | Y180: The Mickey Mouse Club | Z180: Mission: Impossible | AB180: Star Trek | AD180: The The FBI | AF180: Movie [The Movie]: It Started in Naples (1960) | AJ180: The 10 O'Clock News--Michael Hartfield/Sylvia Stinson | AL180: Movie [Movie 12]: 13 West Street (1962) | AX180: =AX179+7 -> 27599
A181: =A180+7 -> 27606 | F181: Government Story | G181: Cartoon Castle | I181: Nanny and the Professor | J181: Celebrity Sweepstakes (NBC) | K181: Audubon Wildlife Theatre | L181: Tattletales (CBS) | M181: Bill Burrud | O181: Search for Tomorrow (CBS) | P181: Perry Mason | R181: Movie [Matinee 12]: Evil Roy Slade (1972) | V181: Land of the Giants | X181: Ramblin' Rod | Y181: The Mickey Mouse Club | Z181: Mission: Impossible | AB181: Star Trek | AD181: The The FBI | AF181: Movie [The Movie]: Trapeze (1956) | AJ181: The 10 O'Clock News--Michael Hartfield/Sylvia Stinson | AL181: Movie [Movie 12]: Toys in the Attic (1963) | AX181: =AX180+7 -> 27606
A182: =A181+7 -> 27613 | F182: Government Story | G182: Cartoon Castle | I182: Nanny and the Professor | J182: Celebrity Sweepstakes (NBC) | K182: Audubon Wildlife Theatre | L182: Tattletales (CBS) | M182: Bill Burrud | O182: Search for Tomorrow (CBS) | P182: Perry Mason | R182: Movie [Matinee 12]: Flight to Tangier (1953) | V182: Land of the Giants | X182: Ramblin' Rod | Y182: The Mickey Mouse Club | Z182: Mission: Impossible | AB182: Star Trek | AD182: The The FBI | AF182: Movie [The Movie]: The Guns of August (1964) | AJ182: The 10 O'Clock News--Michael Hartfield/Sylvia Stinson | AL182: Movie [Movie 12]: The Interns (1962) | AX182: =AX181+7 -> 27613
A183: =A182+7 -> 27620 | F183: Government Story | G183: Cartoon Castle | I183: Nanny and the Professor | J183: Celebrity Sweepstakes (NBC) | K183: Audubon Wildlife Theatre | L183: Tattletales (CBS) | M183: Bill Burrud | O183: Search for Tomorrow (CBS) | P183: Perry Mason | R183: Movie [Matinee 12]: That Kind of Woman (1959) | V183: Land of the Giants | X183: Ramblin' Rod | Y183: The Mickey Mouse Club | Z183: Mission: Impossible | AB183: Star Trek | AD183: The The FBI | AF183: Movie [The Movie]: Sullivan's Empire (1967) | AJ183: The 10 O'Clock News--Michael Hartfield/Sylvia Stinson | AL183: Movie [Movie 12]: The Miracle Worker (1962) | AX183: =AX182+7 -> 27620
A184: =A183+7 -> 27627 | F184: Government Story | G184: Cartoon Castle | I184: Nanny and the Professor | J184: Petticoat Junction | K184: Movie [The Morning Movie]: The Lady Gambles (1949) | O184: Search for Tomorrow (CBS) | P184: Perry Mason | R184: Movie [Matinee 12]: Seminole (1953) | V184: Land of the Giants | X184: Ramblin' Rod | Y184: The Mickey Mouse Club | Z184: Mission: Impossible | AB184: Star Trek | AD184: The The FBI | AF184: Movie [The Movie]: Valley of Mystery (1967) | AJ184: The 10 O'Clock News--Michael Hartfield/Sylvia Stinson | AL184: Movie [Movie 12]: Patterns (1956) | AX184: =AX183+7 -> 27627
A185: =A184+7 -> 27634 | F185: Government Story | G185: Cartoon Castle | I185: Nanny and the Professor | J185: Petticoat Junction | K185: Movie [The Morning Movie]: Sally and Saint Anne (1952) | O185: Search for Tomorrow (CBS) | P185: Perry Mason | R185: Movie [Matinee 12]: Foxfire (1955) | V185: I Dream of Jeannie | W185: Speed Racer | X185: Ramblin' Rod | Y185: The Mickey Mouse Club | Z185: Mission: Impossible | AB185: Star Trek | AD185: The The FBI | AF185: Movie [The Movie]: This Happy Feeling (1958) | AJ185: The 10 O'Clock News--Michael Hartfield/Sylvia Stinson | AL185: Movie [Movie 12]: The Outsider (1961) | AX185: =AX184+7 -> 27634
A186: =A185+7 -> 27641 | F186: Government Story | G186: Cartoon Castle | I186: Nanny and the Professor | J186: Petticoat Junction | K186: Movie [The Morning Movie]: Once More, My Darling (1949) | O186: Search for Tomorrow (CBS) | P186: Perry Mason | R186: Movie [Matinee 12]: High Hell (1958) | V186: I Dream of Jeannie | W186: Speed Racer | X186: Ramblin' Rod | Y186: The Mickey Mouse Club | Z186: Mission: Impossible | AB186: Star Trek | AD186: Billy Graham Crusade | AF186: Movie [The Movie]: Sword in the Desert (1949) | AJ186: The 10 O'Clock News--Michael Hartfield/Sylvia Stinson | AL186: Movie [Movie 12]: And Then There Were None (1945) | AX186: =AX185+7 -> 27641
A187: =A186+7 -> 27648 | F187: Government Story | G187: Ramblin' Rod | I187: Gomer Pyle, USMC | J187: Petticoat Junction | K187: Movie [The Morning Movie]: Meet Me at the Fair (1952) | O187: Search for Tomorrow (CBS) | P187: Perry Mason | R187: Movie [Matinee 12]: Captain Lightfoot (1955) | V187: I Dream of Jeannie | W187: Speed Racer | X187: The Flintstones | Y187: The Mickey Mouse Club | Z187: The Courtship of Eddie's Father | AA187: Room 222 | AB187: Adam-12 | AC187: Adam-12 | AD187: The The FBI | AF187: Movie [The Movie]: Ellery Queen: Don't Look Behind You (1971) | AJ187: The 10 O'Clock News | AL187: Mission: Impossible | AX187: =AX186+7 -> 27648
A188: =A187+7 -> 27655 | F188: Government Story | G188: Ramblin' Rod | I188: Gomer Pyle, USMC | J188: Petticoat Junction | K188: Movie [The Morning Movie]: Stranger in My Arms (1959) | O188: Search for Tomorrow (CBS) | P188: Perry Mason | R188: Movie [Matinee 12|: This Island Earth (1955) | V188: I Dream of Jeannie | W188: Speed Racer | X188: The Flintstones | Y188: The Mickey Mouse Club | Z188: The Courtship of Eddie's Father | AA188: Room 222 | AB188: Adam-12 | AC188: Adam-12 | AD188: The The FBI | AF188: Movie [The Movie]: The World in His Arms (1952) | AJ188: The 10 O'Clock News | AL188: Mission: Impossible | AX188: =AX187+7 -> 27655
A189: =A188+7 -> 27662 | F189: Overseas Mission | G189: Ramblin' Rod | I189: Gomer Pyle, USMC | J189: Petticoat Junction | K189: Movie [The Morning Movie]: The Milkman (1950) | O189: Search for Tomorrow (CBS) | P189: Perry Mason | R189: Movie [Matinee 12|: The Runaround (1946) | V189: I Dream of Jeannie | W189: Speed Racer | X189: The Flintstones | Y189: The Mickey Mouse Club | Z189: The Courtship of Eddie's Father | AA189: Room 222 | AB189: Adam-12 | AC189: Adam-12 | AD189: The The FBI | AF189: Movie [The Movie]: Pillow Talk (1959) | AJ189: The 10 O'Clock News | AL189: Mission: Impossible | AX189: =AX188+7 -> 27662
A190: =A189+7 -> 27669 | F190: Overseas Mission | G190: Ramblin' Rod | I190: Gomer Pyle, USMC | J190: Petticoat Junction | K190: Movie [The Morning Movie]: The Great Man (1956) | O190: Search for Tomorrow (CBS) | P190: Perry Mason | R190: Movie [Matinee 12|: Tammy and the Millionaire (1967) | V190: I Dream of Jeannie | W190: Speed Racer | X190: The Flintstones | Y190: The Mickey Mouse Club | Z190: The Courtship of Eddie's Father | AA190: Room 222 | AB190: Adam-12 | AC190: Adam-12 | AD190: The The FBI | AF190: Movie [The Movie]: Man on the Outside (1973) | AJ190: The 10 O'Clock News | AL190: Mission: Impossible | AX190: =AX189+7 -> 27669
A191: =A190+7 -> 27676 | F191: Overseas Mission | G191: Ramblin' Rod | I191: Gomer Pyle, USMC | J191: Petticoat Junction | K191: Movie [The Morning Movie]: Drums Across the River (1954) | N191: Not for Women Only | O191: Search for Tomorrow (CBS) | P191: Perry Mason | R191: Movie [Matinee 12|: My Six Loves (1963) | V191: I Dream of Jeannie | W191: Speed Racer | X191: The Flintstones | Y191: The Mickey Mouse Club | Z191: The Courtship of Eddie's Father | AA191: Room 222 | AB191: Adam-12 | AC191: Adam-12 | AD191: The The FBI | AF191: Movie [The Movie]: Dr. Strangelove: or, How I Learned to Stop Worrying and Love the Bomb (1964) | AJ191: The 10 O'Clock News | AL191: Mission: Impossible | AX191: =AX190+7 -> 27676
A192: =A191+7 -> 27683 | F192: Overseas Mission | G192: Ramblin' Rod | I192: Gomer Pyle, USMC | J192: Petticoat Junction | K192: Movie [The Morning Movie]: Law and Order (1953) | N192: Not for Women Only | O192: Search for Tomorrow (CBS) | P192: Perry Mason | R192: Movie [Matinee 12|: Privilege (1967) | V192: I Dream of Jeannie | W192: Speed Racer | X192: The Flintstones | Y192: The Mickey Mouse Club | Z192: The Courtship of Eddie's Father | AA192: Room 222 | AB192: Adam-12 | AC192: Adam-12 | AD192: The The FBI | AF192: Movie [The Movie]: The War Lover (1962) | AJ192: The 10 O'Clock News | AL192: Mission: Impossible | AX192: =AX191+7 -> 27683
A193: =A192+7 -> 27690 | F193: Overseas Mission | G193: Ramblin' Rod | I193: Gomer Pyle, USMC | J193: Petticoat Junction | K193: Movie [The Morning Movie]: Step Down to Terror (1959) | N193: Not for Women Only | O193: Search for Tomorrow (CBS) | P193: Perry Mason | R193: Movie [Matinee 12|: East of Sudan (1964) | V193: I Dream of Jeannie | W193: Speed Racer | X193: The Flintstones | Y193: The Mickey Mouse Club | Z193: The Courtship of Eddie's Father | AA193: Room 222 | AB193: Adam-12 | AC193: Adam-12 | AD193: The The FBI | AF193: Movie [The Movie]: Johnny Dark (1954) | AJ193: The 10 O'Clock News | AL193: Mission: Impossible | AX193: =AX192+7 -> 27690
A194: =A193+7 -> 27697 | F194: Overseas Mission | G194: Ramblin' Rod | I194: Gomer Pyle, USMC | J194: Petticoat Junction | K194: Movie [The Morning Movie]: Untamed Frontier (1952) | N194: Not for Women Only | O194: Search for Tomorrow (CBS) | P194: Perry Mason | R194: Movie [Matinee 12|: Has Anybody Seen My Gal? (1952) | V194: I Dream of Jeannie | W194: Speed Racer | X194: The Flintstones | Y194: The Mickey Mouse Club | Z194: The Courtship of Eddie's Father | AA194: Room 222 | AB194: Adam-12 | AC194: Adam-12 | AD194: The The FBI | AF194: Movie [The Movie]: The Trouble with Angels (1966) | AJ194: The 10 O'Clock News | AL194: Mission: Impossible | AN194: Night Gallery | AX194: =AX193+7 -> 27697
A195: =A194+7 -> 27704 | F195: Overseas Mission | G195: Ramblin' Rod | I195: Gomer Pyle, USMC | J195: Petticoat Junction | K195: Movie [The Morning Movie]: Man from the Alamo (1953) | N195: Not for Women Only | O195: Search for Tomorrow (CBS) | P195: Perry Mason | R195: Movie [Matinee 12|: Weekend with Father (1951) | V195: I Dream of Jeannie | W195: Speed Racer | X195: The Flintstones | Y195: The Mickey Mouse Club | Z195: The Courtship of Eddie's Father | AA195: Room 222 | AB195: Adam-12 | AC195: Adam-12 | AD195: The The FBI | AF195: Movie [The Movie]: House of Bamboo (1955) | AJ195: The 10 O'Clock News | AL195: Mission: Impossible | AN195: Night Gallery | AX195: =AX194+7 -> 27704
A196: =A195+7 -> 27711 | F196: Overseas Mission | G196: Ramblin' Rod | I196: Gomer Pyle, USMC | J196: Petticoat Junction | K196: Movie [The Morning Movie]: No Name on the Bullet (1959) | N196: Not for Women Only | O196: Search for Tomorrow (CBS) | P196: Perry Mason | R196: Movie [Matinee 12|: South Sea Sinner (1950) | V196: I Dream of Jeannie | W196: Speed Racer | X196: The Flintstones | Y196: The Mickey Mouse Club | Z196: The Courtship of Eddie's Father | AA196: Room 222 | AB196: Adam-12 | AC196: Adam-12 | AD196: The The FBI | AF196: Movie [The Movie]: Prince Valiant (1954) | AJ196: The 10 O'Clock News | AL196: Mission: Impossible | AN196: The Sixth Sense (Night Gallery) | AX196: =AX195+7 -> 27711
A197: =A196+7 -> 27718 | F197: Overseas Mission | G197: Ramblin' Rod | I197: Gomer Pyle, USMC | J197: Petticoat Junction | K197: Movie [The Morning Movie]: Kansas Raiders (1950) | N197: Not for Women Only | O197: Search for Tomorrow (CBS) | P197: Perry Mason | R197: Movie [Matinee 12|: A Man Could Get Killed (1966) | V197: I Dream of Jeannie | W197: Speed Racer | X197: The Flintstones | Y197: The Mickey Mouse Club | Z197: The Courtship of Eddie's Father | AA197: Room 222 | AB197: Adam-12 | AC197: Adam-12 | AD197: The The FBI | AF197: Movie [The Movie]: White Witch Doctor (1953) | AJ197: The 10 O'Clock News | AL197: Mission: Impossible | AN197: The Persuaders | AX197: =AX196+7 -> 27718
A198: =A197+7 -> 27725 | F198: Overseas Mission | G198: Ramblin' Rod | I198: Gomer Pyle, USMC | J198: Petticoat Junction | K198: Movie [The Morning Movie]: You Never Can Tell (1951) | N198: Not for Women Only | O198: Search for Tomorrow (CBS) | P198: Perry Mason | R198: Movie [Matinee 12|: Mister Cory (1957) | V198: I Dream of Jeannie | W198: Speed Racer | X198: The Flintstones | Y198: The Mickey Mouse Club | Z198: The Courtship of Eddie's Father | AA198: Room 222 | AB198: Adam-12 | AC198: Adam-12 | AD198: Billy Graham Crusade | AF198: Movie [The Movie]: The Barbarian and the Geisha (1958) | AJ198: The 10 O'Clock News | AL198: Mission: Impossible | AN198: The Persuaders | AX198: =AX197+7 -> 27725
A199: =A198+7 -> 27732 | F199: Overseas Mission | G199: Ramblin' Rod | I199: Gomer Pyle, USMC | J199: Petticoat Junction | K199: Movie [The Morning Movie]: Horizons West (1952) | N199: Not for Women Only | O199: Search for Tomorrow (CBS) | P199: Perry Mason | R199: Movie [Matinee 12|: Theodora Goes Wild (1936) | V199: I Dream of Jeannie | W199: Speed Racer | X199: The Flintstones | Y199: The Mickey Mouse Club | Z199: The Courtship of Eddie's Father | AA199: Room 222 | AB199: Adam-12 | AC199: Adam-12 | AD199: The The FBI | AF199: Movie [The Movie]: Send Me No Flowers (1964) | AJ199: The 10 O'Clock News | AL199: Mission: Impossible | AN199: The Persuaders | AX199: =AX198+7 -> 27732
A200: =A199+7 -> 27739 | F200: Overseas Mission | G200: Ramblin' Rod | I200: Gomer Pyle, USMC | J200: Petticoat Junction | K200: Movie [The Morning Movie]: Cobra Woman (1944) | N200: Not for Women Only | O200: Search for Tomorrow (CBS) | P200: Perry Mason | R200: Movie [Matinee 12|: My Dear Secretary (1948) | V200: I Dream of Jeannie | W200: Speed Racer | X200: The Flintstones | Y200: The Mickey Mouse Club | Z200: The Courtship of Eddie's Father | AA200: Room 222 | AB200: Adam-12 | AC200: Adam-12 | AD200: Audubon Wildlife Theater | AE200: NBA Basketball: Portland Trail Blazers vs Golden State Warriors | AJ200: The 10 O'Clock News | AL200: Mission: Impossible | AN200: The Persuaders | AX200: =AX199+7 -> 27739
A201: =A200+7 -> 27746 | F201: Overseas Mission | G201: Ramblin' Rod | I201: Gomer Pyle, USMC | J201: Petticoat Junction | K201: Movie [The Morning Movie]: Against All Flags (1952) | N201: Not for Women Only | O201: Search for Tomorrow (CBS) | P201: Perry Mason | R201: Movie [Matinee 12|: Female on the Beach (1955) | V201: I Dream of Jeannie | W201: Speed Racer | X201: The Flintstones | Y201: The Mickey Mouse Club | Z201: The Courtship of Eddie's Father | AA201: Room 222 | AB201: Adam-12 | AC201: Adam-12 | AD201: The The FBI | AF201: Movie [The Movie]: The Mudlark (1950) | AJ201: The 10 O'Clock News | AL201: Mission: Impossible | AN201: The Persuaders | AX201: =AX200+7 -> 27746
A202: =A201+7 -> 27753 | F202: There's Good News for You! | G202: Ramblin' Rod | I202: Bicentennial Christmas on Campus | J202: Petticoat Junction | K202: Movie [The Morning Movie]: The Snow Queen (1958) | N202: Not for Women Only | O202: Search for Tomorrow (CBS) | P202: Perry Mason | R202: Movie [Matinee 12|: Ali Baba and the Forty Thieves (1944) | V202: I Dream of Jeannie | W202: Speed Racer | X202: The Flintstones | Y202: The Mickey Mouse Club | Z202: The Courtship of Eddie's Father | AA202: Room 222 | AB202: Adam-12 | AC202: Adam-12 | AD202: The The FBI | AF202: Movie [The Movie]: I'd Climb the Highest Mountain (1951) | AJ202: The 10 O'Clock News | AL202: Mission: Impossible | AN202: The Persuaders | AX202: =AX201+7 -> 27753
A203: 1976 | AX203: =A203 -> 1976
A204: 27760 | F204: Overseas Mission | G204: Ramblin' Rod | I204: Gomer Pyle, USMC | J204: Petticoat Junction | K204: Movie [The Morning Movie]: The Cimarron Kid (1951) | N204: Not for Women Only | O204: World of Survival | P204: Perry Mason | R204: Movie [Matinee 12|: Kathy O' (1958) | V204: I Dream of Jeannie | W204: Speed Racer | X204: The Flintstones | Y204: The Mickey Mouse Club | Z204: The Courtship of Eddie's Father | AA204: Room 222 | AB204: Adam-12 | AC204: Adam-12 | AD204: The The FBI | AF204: Movie [The Movie]: A Howling in the Woods (1971) | AJ204: The 10 O'Clock News | AL204: Mission: Impossible | AN204: The Persuaders | AX204: 27760
A207: 1977 | AX207: =A207 -> 1977
A210: 1978 | AX210: =A210 -> 1978
A213: 1979 | AX213: =A213 -> 1979
A216: 1980 | AX216: =A216 -> 1980
A217: 29230 | E217: Health Field | F217: Gigglesnort Hotel | G217: Ramblin' Rod | I217: Krofft Superstars | J217: Marcus Welby, M.D. | L217: Bonanza | N217: Match Game | O217: The New Joker's Wild | P217: Perry Mason | R217: Movie [Matinee 12]: Silent Running (1972) | V217: Room 222 | W217: Bugs Bunny & Friends | X217: The Flintstones | Y217: Gilligan's Island | Z217: The Brady Bunch | AA217: Bewitched | AB217: Hogan's Heroes | AC217: College Basketball: Oregon State Beavers vs. Arizona Wildcats [LIVE] | AG217: Movie [The Movie]: Kung Fu (1972) | AJ217: The 10 O'Clock News | AL217: The Benny Hill Show | AM217: The Odd Couple | AN217: Mission: Impossible | AX217: =AX216+7 -> 1987
A218: 29237 | E218: Health Field | F218: Gigglesnort Hotel | G218: Ramblin' Rod | I218: Krofft Superstars | J218: Marcus Welby, M.D. | L218: Bonanza | N218: Match Game | O218: The New Joker's Wild | P218: Perry Mason | R218: Movie [Matinee 12]: Ritual of Evil (1970) | V218: Bewitched | W218: Bugs Bunny & Friends | X218: The Flintstones | Y218: The Brady Bunch | Z218: Star Trek | AB218: Emergency One! | AD218: Happy Days Again | AE218: College Basketball: Washington State Cougars vs. Oregon State Beavers | AI218: Hogan's Heroes | AJ218: The 10 O'Clock News | AL218: The Benny Hill Show | AM218: The Odd Couple | AN218: Mission: Impossible | AX218: =AX217+7 -> 1994
A219: 29244 | E219: Health Field | F219: Gigglesnort Hotel | G219: Ramblin' Rod | I219: Krofft Superstars | J219: Marcus Welby, M.D. | L219: Bonanza | N219: Match Game | O219: The New Joker's Wild | P219: Perry Mason | R219: Movie [Matinee 12]: Blowing Wind (1953) | V219: Bewitched | W219: Bugs Bunny & Friends | X219: The Flintstones | Y219: The Brady Bunch | Z219: Star Trek | AB219: Emergency One! | AD219: Happy Days Again | AE219: Hogan's Heroes | AF219: Movie [The Movie]: Charly (1968) | AJ219: The 10 O'Clock News | AL219: The Benny Hill Show | AM219: The Odd Couple | AN219: Mission: Impossible | AX219: =AX218+7 -> 2001
A220: 29251 | E220: Health Field | F220: Gigglesnort Hotel | G220: Ramblin' Rod | I220: Krofft Superstars | J220: Marcus Welby, M.D. | L220: Bonanza | N220: Match Game | O220: The New Joker's Wild | P220: Perry Mason | R220: Movie [Matinee 12]: Golden Earrings (1947) | V220: Bewitched | W220: Bugs Bunny & Friends | X220: The Flintstones | Y220: The Brady Bunch | Z220: Star Trek | AB220: Emergency One! | AD220: Happy Days Again | AE220: Hogan's Heroes | AF220: The Top of the Hill [Special] (Part One) | AJ220: The 10 O'Clock News | AL220: The Benny Hill Show | AM220: The Odd Couple | AN220: Mission: Impossible | AX220: =AX219+7 -> 2008