A1: MONDAY | B1: 05:00AM | C1: 05:30AM | D1: 06:00AM | E1: 06:30AM | F1: 07:00AM | G1: 07:30AM | H1: 08:00AM | I1: 08:30AM | J1: 09:00AM | K1: 09:30AM | L1: 10:00AM | M1: 10:30AM | N1: 11:00AM | O1: 11:30AM | P1: 12:00N | Q1: 12:30PM | R1: 01:00PM | S1: 01:30PM | T1: 02:00PM | U1: 02:30PM | V1: 03:00PM | W1: 03:30PM | X1: 04:00PM | Y1: 04:30PM | Z1: 05:00PM | AA1: 05:30PM | AB1: 06:00PM | AC1: 06:30PM | AD1: 07:00PM | AE1: 07:30PM | AF1: 08:00PM | AG1: 08:30PM | AH1: 09:00PM | AI1: 09:30PM | AJ1: 10:00PM | AK1: 10:30PM | AL1: 11:00PM | AM1: 11:30PM | AN1: 12:00M | AO1: 12:30AM | AP1: 01:00AM | AQ1: 01:30AM | AR1: 02:00AM | AS1: 02:30AM | AT1: 03:00AM | AU1: 03:30AM | AV1: 04:00AM | AW1: 04:30AM | AX1: MONDAY
A3: 1953 | AX3: =A3 -> 1953
A4: 19413 | P4: The Big Payoff (NBC) | Q4: Welcome Travelers (NBC) | R4: The Kate Smith Hour (NBC) | T4: Double or Nothing (CBS) | U4: Strike It Rich (CBS) | V4: Movie [Matinee Theater]: Thou Shalt Not Kill | X4: [4:15] Search For Tomorrow (CBS) | Y4: Love of Life (CBS); [4:45] TBA | Z4: TBA | AA4: Hopalong Cassidy | AC4: Telenews; [6:45] Time for Beany | AD4: Chance of a Lifetime (ABC) | AE4: Short, Short Dramas (NBC); [7:45] Camel News Caravan (NBC) | AF4: Chevron Theater | AG4: Voice of Firestone (NBC) | AH4: I Love Lucy (CBS) | AI4: The Red Buttons Show (CBS) | AJ4: Robert Montgomery Presents (NBC) | AL4: Candid Camera | AM4: Movie [Nite Owl Theater]: X Marks the Spot | AX4: =A4 -> 19413
A5: =A4+7 -> 19420 | P5: The Big Payoff (NBC) | Q5: Welcome Travelers (NBC) | R5: The Kate Smith Hour (NBC) | T5: Double or Nothing (CBS) | U5: Strike It Rich (CBS) | V5: Movie [Matinee Theater]: Citadel of Crime | X5: [4:15] Search For Tomorrow (CBS) | Y5: Love of Life (CBS); [4:45] TBA | Z5: Wild Bill Hickok | AA5: Hopalong Cassidy | AC5: Telenews; [6:45] Time for Beany | AD5: Chance of a Lifetime (ABC) | AE5: Short, Short Dramas (NBC); [7:45] Camel News Caravan (NBC) | AF5: Chevron Theater | AG5: Voice of Firestone (NBC) | AH5: I Love Lucy (CBS) | AI5: The Red Buttons Show (CBS) | AJ5: Robert Montgomery Presents (NBC) | AL5: Candid Camera | AM5: Movie [Nite Owl Theater]: Man From Frisco | AX5: =A5 -> 19420
A6: =A5+7 -> 19427 | H6: United Nations General Assembly (NBC) | O6: [11:45] Comedy Carnival | P6: The Big Payoff (NBC) | Q6: Welcome Travelers (NBC) | R6: The Kate Smith Hour (NBC) | T6: Double or Nothing (CBS) | U6: Strike It Rich (CBS) | V6: Movie [Matinee Theater]: Gangs of the City | X6: [4:15] Search For Tomorrow (CBS) | Y6: Love of Life (CBS); [4:45] TBA | Z6: Wild Bill Hickok | AA6: Hopalong Cassidy | AC6: Telenews; [6:45] Time for Beany | AD6: Chance of a Lifetime (ABC) | AE6: Short, Short Dramas (NBC); [7:45] Camel News Caravan (NBC) | AF6: Chevron Theater | AG6: Voice of Firestone (NBC) | AH6: I Love Lucy (CBS) | AI6: The Red Buttons Show (CBS) | AJ6: Robert Montgomery Presents (NBC) | AL6: Candid Camera | AM6: Movie [Nite Owl Theater]: Larceny on the Air | AX6: =A6 -> 19427
A7: =A6+7 -> 19434 | H7: United Nations General Assembly (NBC) | O7: [11:45] Comedy Carnival | P7: The Big Payoff (NBC) | Q7: Welcome Travelers (NBC) | R7: The Kate Smith Hour (NBC) | T7: Double or Nothing (CBS) | U7: Strike It Rich (CBS) | V7: Movie [Matinee Theater]: Medicine Man | X7: [4:15] Search For Tomorrow (CBS) | Y7: Love of Life (CBS); [4:45] TBA | Z7: Wild Bill Hickok | AA7: Hopalong Cassidy | AC7: Telenews; [6:45] Time for Beany | AD7: Chance of a Lifetime (ABC) | AE7: Short, Short Dramas (NBC); [7:45] Camel News Caravan (NBC) | AF7: Chevron Theater | AG7: Voice of Firestone (NBC) | AH7: I Love Lucy (CBS) | AI7: The Red Buttons Show (CBS) | AJ7: Robert Montgomery Presents (NBC) | AL7: Candid Camera | AM7: Movie [Nite Owl Theater]: I Stand Accused | AX7: =A7 -> 19434
A8: =A7+7 -> 19441 | H8: United Nations General Assembly (NBC) | O8: [11:45] Comedy Carnival | P8: The Big Payoff (NBC) | Q8: Welcome Travelers (NBC) | R8: The Kate Smith Hour (NBC) | T8: Double or Nothing (CBS) | U8: Strike It Rich (CBS) | V8: Movie [Matinee Theater]: Slums of New York | X8: [4:15] Search For Tomorrow (CBS) | Y8: Love of Life (CBS); [4:45] TBA | Z8: Wild Bill Hickok | AA8: Hopalong Cassidy | AC8: Telenews; [6:45] Time for Beany | AD8: Chance of a Lifetime (ABC) | AE8: Short, Short Dramas (NBC); [7:45] Camel News Caravan (NBC) | AF8: Chevron Theater | AG8: Voice of Firestone (NBC) | AH8: I Love Lucy (CBS) | AI8: The Red Buttons Show (CBS) | AJ8: Robert Montgomery Presents (NBC) | AL8: Candid Camera | AM8: Movie [Nite Owl Theater]: Grandpa Goes to Town | AX8: =A8 -> 19441
A9: =A8+7 -> 19448 | O9: [11:45] TBA | P9: The Big Payoff (NBC) | Q9: Welcome Travelers (NBC) | R9: The Kate Smith Hour (NBC) | T9: Double or Nothing (CBS) | U9: Strike It Rich (CBS) | V9: Movie [Matinee Theater]: The Leavenworth Case | X9: [4:15] Search For Tomorrow (CBS) | Y9: Love of Life (CBS); [4:45] TBA | Z9: Wild Bill Hickok | AA9: Hopalong Cassidy | AC9: Telenews; [6:45] Time for Beany | AD9: Chance of a Lifetime (ABC) | AE9: Short, Short Dramas (NBC); [7:45] Camel News Caravan (NBC) | AF9: Chevron Theater | AG9: Voice of Firestone (NBC) | AH9: I Love Lucy (CBS) | AI9: The Red Buttons Show (CBS) | AJ9: Robert Montgomery Presents (NBC) | AL9: Candid Camera | AM9: Movie [Nite Owl Theater]: The Crooked Road | AX9: =A9 -> 19448
A10: =A9+7 -> 19455 | O10: [11:45] TBA | P10: The Big Payoff (NBC) | Q10: Welcome Travelers (NBC) | R10: The Kate Smith Hour (NBC) | T10: Double or Nothing (CBS) | U10: Strike It Rich (CBS) | V10: Movie [Matinee Theater]: Danger on the Air | X10: [4:15] Search For Tomorrow (CBS) | Y10: Love of Life (CBS); [4:45] TBA | Z10: Wild Bill Hickok | AA10: Hopalong Cassidy | AC10: Telenews; [6:45] Time for Beany | AD10: Sportsman's Club; [7:15] TBA | AE10: Short, Short Dramas (NBC); [7:45] Camel News Caravan (NBC) | AF10: Chevron Theater | AG10: Voice of Firestone (NBC) | AH10: I Love Lucy (CBS) | AI10: The Red Buttons Show (CBS) | AJ10: Robert Montgomery Presents (NBC) | AL10: Candid Camera | AM10: Movie [Nite Owl Theater]: The Great Train Robbery | AX10: =A10 -> 19455
A11: =A10+7 -> 19462 | O11: [11:45] TBA | P11: The Big Payoff (NBC) | Q11: Welcome Travelers (NBC) | R11: The Kate Smith Hour (NBC) | T11: Double or Nothing (CBS) | U11: Strike It Rich (CBS) | V11: Movie [Matinee Theater]: Scream in the Night | X11: [4:15] Search For Tomorrow (CBS) | Y11: Love of Life (CBS); [4:45] TBA | Z11: Wild Bill Hickok | AA11: Hopalong Cassidy | AC11: Telenews; [6:45] Time for Beany | AD11: Sportsman's Club; [7:15] TBA | AE11: Short, Short Dramas (NBC); [7:45] Camel News Caravan (NBC) | AF11: Chevron Theater | AG11: Voice of Firestone (NBC) | AH11: I Love Lucy (CBS) | AI11: The Red Buttons Show (CBS) | AJ11: Robert Montgomery Presents (NBC) | AL11: Candid Camera | AM11: Movie [Nite Owl Theater]: Silent Partner | AX11: =A11 -> 19462
A12: =A11+7 -> 19469 | O12: [11:45] TBA | P12: The Big Payoff (NBC) | Q12: Welcome Travelers (NBC) | R12: The Kate Smith Hour (NBC) | T12: Double or Nothing (CBS) | U12: Strike It Rich (CBS) | V12: Movie [Matinee Theater]: Next of Kin | X12: [4:15] Search For Tomorrow (CBS) | Y12: Love of Life (CBS); [4:45] TBA | Z12: Wild Bill Hickok | AA12: Hopalong Cassidy | AC12: Telenews; [6:45] Time for Beany | AD12: Sportsman's Club; [7:15] Telenews Sports Review | AE12: Short, Short Dramas (NBC); [7:45] Camel News Caravan (NBC) | AF12: Chevron Theater | AG12: Voice of Firestone (NBC) | AH12: I Love Lucy (CBS) | AI12: The Red Buttons Show (CBS) | AJ12: Robert Montgomery Presents (NBC) | AL12: Candid Camera | AM12: Movie [Nite Owl Theater]: The Purple V | AX12: =A12 -> 19469
B13: OTHER CITIES SWITCH TO DAYLIGHT SAVINGS TIME; PORTLAND SHOWS AIR ONE HOUR EARLIER | J13: OTHER CITIES SWITCH TO DAYLIGHT SAVINGS TIME; PORTLAND SHOWS AIR ONE HOUR EARLIER | R13: OTHER CITIES SWITCH TO DAYLIGHT SAVINGS TIME; PORTLAND SHOWS AIR ONE HOUR EARLIER | Z13: OTHER CITIES SWITCH TO DAYLIGHT SAVINGS TIME; PORTLAND SHOWS AIR ONE HOUR EARLIER | AH13: OTHER CITIES SWITCH TO DAYLIGHT SAVINGS TIME; PORTLAND SHOWS AIR ONE HOUR EARLIER | AP13: OTHER CITIES SWITCH TO DAYLIGHT SAVINGS TIME; PORTLAND SHOWS AIR ONE HOUR EARLIER
A14: =A12+7 -> 19476 | K14: What's Cooking? | L14: Local Film; [10:45] News from KPTV | N14: The Big Payoff (NBC) | O14: Welcome Travelers (NBC) | P14: The Kate Smith Hour (NBC) | R14: Double or Nothing (CBS) | S14: Strike It Rich (CBS) | T14: Movie [Matinee Theater]: Top Sergeant | V14: [3:15] Search For Tomorrow (CBS) | W14: Love of Life (CBS); [3:45] TBA | X14: Wild Bill Hickok | Y14: Hopalong Cassidy | AA14: Telenews; [5:45] Time for Beany | AB14: The Ken Murray Show (CBS) | AC14: Sportsman's Club; [6:45] Camel News Caravan (NBC) | AD14: Chevron Theater | AE14: Voice of Firestone (NBC) | AF14: I Love Lucy (CBS) | AG14: The Red Buttons Show (CBS) | AH14: Robert Montgomery Presents (NBC) | AJ14: TBA | AK14: Movie [Nite Owl Theater]: Mystery Broadcast | AX14: =A14 -> 19476
A15: 19483 | K15: What's Cooking? | L15: Local Film; [10:45] News from KPTV | N15: The Big Payoff (NBC) | O15: Welcome Travelers (NBC) | P15: The Kate Smith Hour (NBC) | R15: Double or Nothing (CBS) | S15: Strike It Rich (CBS) | T15: Movie [Matinee Theater]: TBA | V15: [3:15] Search For Tomorrow (CBS) | W15: Love of Life (CBS); [3:45] TBA | X15: Wild Bill Hickok | Y15: Hopalong Cassidy | AA15: Telenews; [5:45] Time for Beany | AB15: The Alan Young Show (CBS) | AC15: Sportsman's Club; [6:45] Camel News Caravan (NBC) | AD15: Chevron Theater | AE15: Voice of Firestone (NBC) | AF15: I Love Lucy (CBS) | AG15: The Red Buttons Show (CBS) | AH15: Robert Montgomery Presents (NBC) | AJ15: TBA | AK15: Movie [Nite Owl Theater]: TBA | AX15: =A15 -> 19483
A16: =A15+7 -> 19490 | K16: What's Cooking? | L16: Local Film; [10:45] News from KPTV | N16: The Big Payoff (NBC) | O16: Welcome Travelers (NBC) | P16: The Kate Smith Hour (NBC) | R16: Double or Nothing (CBS) | S16: Strike It Rich (CBS) | T16: Movie [Matinee Theater]: Mr. Wong, Detective | V16: [3:15] Search For Tomorrow (CBS) | W16: Love of Life (CBS); [3:45] The Toymaker | X16: Wild Bill Hickok | Y16: Hopalong Cassidy | AA16: Telenews; [5:45] Time for Beany | AB16: The Ken Murray Show (CBS) | AC16: Sportsman's Club; [6:45] Camel News Caravan (NBC) | AD16: Chevron Theater | AE16: Voice of Firestone (NBC) | AF16: I Love Lucy (CBS) | AG16: The Red Buttons Show (CBS) | AH16: Robert Montgomery Presents (NBC) | AJ16: The Arthur Murray Dancing Party (Live) | AK16: Movie [Nite Owl Theater]: Rhythm in the Clouds | AX16: =A16 -> 19490
A17: =A16+7 -> 19497 | K17: What's Cooking? | L17: Local Film; [10:45] Northwest News Digest | N17: The Big Payoff (NBC) | O17: Welcome Travelers (NBC) | P17: The Kate Smith Hour (NBC) | R17: Double or Nothing (CBS) | S17: Strike It Rich (CBS) | T17: Movie [Matinee Theater]: Phantom Broadcast | V17: [3:15] Search For Tomorrow (CBS) | W17: Love of Life (CBS); [3:45] The Toymaker | X17: Wild Bill Hickok | Y17: Hopalong Cassidy | AA17: Telenews; [5:45] Time for Beany | AB17: The Alan Young Show (CBS) | AC17: Sportsman's Club; [6:45] Camel News Caravan (NBC) | AD17: Chevron Theater | AE17: Voice of Firestone (NBC) | AF17: I Love Lucy (CBS) | AG17: The Red Buttons Show (CBS) | AH17: Robert Montgomery Presents (NBC) | AJ17: The Arthur Murray Dancing Party (Live) | AK17: Movie [Nite Owl Theater]: Hitchhike Lady | AX17: =A17 -> 19497
A18: =A17+7 -> 19504 | K18: What's Cooking? | L18: Local Film; [10:45] Northwest News Digest | N18: The Big Payoff (NBC) | O18: Welcome Travelers (NBC) | P18: The Kate Smith Hour (NBC) | R18: Double or Nothing (CBS) | S18: Strike It Rich (CBS) | T18: Movie [Matinee Theater]: Undercover Agent | V18: [3:15] Search For Tomorrow (CBS) | W18: Love of Life (CBS); [3:45] The Toymaker | X18: Wild Bill Hickok | Y18: Hopalong Cassidy | AA18: Telenews; [5:45] Time for Beany | AB18: The Ken Murray Show (CBS) | AC18: Sportsman's Club; [6:45] Camel News Caravan (NBC) | AD18: Chevron Theater | AE18: Voice of Firestone (NBC) | AF18: I Love Lucy (CBS) | AG18: The Red Buttons Show (CBS) | AH18: Robert Montgomery Presents (NBC) | AJ18: The Arthur Murray Dancing Party (Live) | AK18: Movie [Nite Owl Theater]: Circus Girl | AX18: =A18 -> 19504
B19: KPTV BECOMES NBC AFFILIATE | J19: KPTV BECOMES NBC AFFILIATE | R19: KPTV BECOMES NBC AFFILIATE | Z19: KPTV BECOMES NBC AFFILIATE | AH19: KPTV BECOMES NBC AFFILIATE | AP19: KPTV BECOMES NBC AFFILIATE
A20: =A18+7 -> 19511 | K20: What's Cooking? | L20: Local Film; [10:45] Northwest News Digest | N20: The Big Payoff (NBC) | O20: Welcome Travelers (NBC) | P20: The Kate Smith Hour (NBC) | R20: Double or Nothing (CBS) | S20: Strike It Rich (CBS) | T20: Movie [Matinee Theater]: Sensation Hunters | V20: [3:15] Search For Tomorrow (CBS) | W20: Love of Life (CBS); [3:45] The Toymaker | X20: Wild Bill Hickok | Y20: Hopalong Cassidy | AA20: Telenews; [5:45] Time for Beany | AB20: The Alan Young Show (CBS) | AC20: Sportsman's Club; [6:45] Camel News Caravan (NBC) | AD20: Chevron Theater | AE20: Voice of Firestone (NBC) | AF20: I Love Lucy (CBS) | AG20: The Red Buttons Show (CBS) | AH20: Robert Montgomery Presents (NBC) | AJ20: The Arthur Murray Dancing Party (Live) | AK20: TBA; [10:45] The Big Playback | AL20: Movie [Nite Owl Theater]: Mama Runs Wild | AX20: =A20 -> 19511
A21: =A20+7 -> 19518 | K21: What's Cooking? | L21: Local Film | M21: TBA; [10:45] Northwest News Digest | N21: The Big Payoff (NBC) | O21: Welcome Travelers (NBC) | P21: On Your Account (NBC) | Q21: Ladie's Choice (NBC) | R21: Double or Nothing (CBS) | S21: Strike It Rich (CBS) | T21: Movie [Matinee Theater]: Smart Guy | V21: [3:15] Search For Tomorrow (CBS) | W21: Love of Life (CBS); [3:45] The Toymaker | X21: Wild Bill Hickok | Y21: Hopalong Cassidy | AA21: Telenews; [5:45] Time for Beany | AB21: The Ken Murray Show (CBS) | AC21: Sportsman's Club; [6:45] Camel News Caravan (NBC) | AD21: Chevron Theater | AE21: Voice of Firestone (NBC) | AF21: I Love Lucy (CBS) | AG21: The Red Buttons Show (CBS) | AH21: Robert Montgomery Presents (NBC) | AJ21: The Arthur Murray Dancing Party (Live) | AK21: Vacationland America (Sightseeing with the Swayzes); [10:45] The Big Playback | AL21: Movie [Nite Owl Theater]: Laughing Irish Eyes | AX21: =A21 -> 19518
A22: =A21+7 -> 19525 | K22: What's Cooking? | L22: Local Film | M22: TBA; [10:45] Northwest News Digest | N22: The Big Payoff (NBC) | O22: Welcome Travelers (NBC) | P22: On Your Account (NBC) | Q22: Ladie's Choice (NBC) | R22: Double or Nothing (CBS) | S22: Strike It Rich (CBS) | T22: Movie [Matinee Theater]: Last Alarm | V22: [3:15] Search For Tomorrow (CBS) | W22: Love of Life (CBS); [3:45] The Toymaker | X22: Wild Bill Hickok | Y22: Hopalong Cassidy | Z22: The Ford Fiftieth Anniversary Show (CBS and NBC) | AD22: Chevron Theater | AE22: Voice of Firestone (NBC) | AF22: TBA | AG22: TBA | AH22: Robert Montgomery Presents (NBC) | AJ22: The Arthur Murray Dancing Party (Live) | AK22: Vacationland America (Sightseeing with the Swayzes); [10:45] The Big Playback | AL22: Movie [Nite Owl Theater]: Lady Behave | AX22: =A22 -> 19525
A23: =A22+7 -> 19532 | K23: What's Cooking? | L23: Local Film | M23: TBA; [10:45] Northwest News Digest | N23: The Big Payoff (NBC) | O23: Welcome Travelers (NBC) | P23: On Your Account (NBC) | Q23: Ladie's Choice (NBC) | R23: Double or Nothing (CBS) | S23: Strike It Rich (CBS) | T23: Movie [Matinee Theater]: Lost in the Stratosphere | V23: [3:15] Search For Tomorrow (CBS) | W23: Love of Life (CBS); [3:45] The Toymaker | X23: Wild Bill Hickok | Y23: Hopalong Cassidy | AA23: Telenews; [5:45] Time for Beany | AB23: The Ken Murray Show (CBS) | AC23: Sportsman's Club; [6:45] Camel News Caravan (NBC) | AD23: Chevron Theater | AE23: Voice of Firestone (NBC) | AF23: I Love Lucy (CBS) | AG23: Masquerade Party (CBS) | AH23: Robert Montgomery Presents (NBC) | AJ23: The Arthur Murray Dancing Party (Live) | AK23: Vacationland America (Sightseeing with the Swayzes); [10:45] The Big Playback | AL23: Movie [Nite Owl Theater]: Main Street Lawyer | AX23: =A23 -> 19532
A24: =A23+7 -> 19539 | K24: What's Cooking? | L24: Local Film | M24: TBA; [10:45] Northwest News Digest | N24: The Big Payoff (NBC) | O24: Welcome Travelers (NBC) | P24: On Your Account (NBC) | Q24: Ladie's Choice (NBC) | R24: Double or Nothing (CBS) | S24: Strike It Rich (CBS) | T24: Movie [Matinee Theater]: Club Paradise | V24: [3:15] Search For Tomorrow (CBS) | W24: Love of Life (CBS); [3:45] The Toymaker | X24: Wild Bill Hickok | Y24: Hopalong Cassidy | AA24: Telenews; [5:45] Time for Beany | AB24: The Alan Young Show (CBS) | AC24: Sportsman's Club; [6:45] Camel News Caravan (NBC) | AD24: Chevron Theater | AE24: Voice of Firestone (NBC) | AF24: I Love Lucy (CBS) | AG24: Masquerade Party (CBS) | AH24: TBA | AJ24: The Arthur Murray Dancing Party (Live) | AK24: Vacationland America (Sightseeing with the Swayzes); [10:45] The Big Playback | AL24: Movie [Nite Owl Theater]: She Married a Cop | AX24: =A24 -> 19539
A25: =A24+7 -> 19546 | K25: What's Cooking? | L25: Local Film | M25: TBA; [10:45] Northwest News Digest | N25: The Big Payoff (NBC) | O25: Welcome Travelers (NBC) | P25: On Your Account (NBC) | Q25: Ladie's Choice (NBC) | R25: Double or Nothing (CBS) | S25: Strike It Rich (CBS) | T25: Movie [Matinee Theater]: Money Means Nothing | V25: [3:15] Search For Tomorrow (CBS) | W25: Love of Life (CBS); [3:45] The Toymaker | X25: Wild Bill Hickok | Y25: Hopalong Cassidy | AA25: Telenews; [5:45] Time for Beany | AB25: Boxing from Chicago | AC25: Sportsman's Club; [6:45] Camel News Caravan (NBC) | AD25: Chevron Theater | AE25: Voice of Firestone (NBC) | AF25: Racket Squad (CBS) | AG25: TBA | AH25: Robert Montgomery Presents (NBC) | AJ25: The Arthur Murray Dancing Party (Live) | AK25: Vacationland America (Sightseeing with the Swayzes); [10:45] The Big Playback | AL25: Movie [Nite Owl Theater]: One Thousand Dollars a Minute | AX25: =A25 -> 19546
A26: =A25+7 -> 19553 | K26: What's Cooking? | L26: Local Film | M26: TBA; [10:45] Northwest News Digest | N26: The Big Payoff (NBC) | O26: Welcome Travelers (NBC) | P26: On Your Account (NBC) | Q26: Ladie's Choice (NBC) | R26: Double or Nothing (CBS) | S26: Strike It Rich (CBS) | T26: Movie [Matinee Theater]: Secret Service | V26: [3:15] Search For Tomorrow (CBS) | W26: Love of Life (CBS); [3:45] The Toymaker | X26: Wild Bill Hickok | Y26: Hopalong Cassidy | AA26: Telenews; [5:45] Time for Beany | AB26: Boxing from Chicago | AC26: Sportsman's Club; [6:45] Camel News Caravan (NBC) | AD26: Chevron Theater | AE26: Voice of Firestone (NBC) | AF26: What's My Name? (NBC) | AG26: Safety Spotlight | AH26: Robert Montgomery Presents (NBC) | AJ26: The Arthur Murray Dancing Party (Live) | AK26: The Big Playback; [10:45] Sports Den | AL26: Movie [Nite Owl Theater]: Mickey the Kid | AX26: =A26 -> 19553
A27: =A26+7 -> 19560 | K27: What's Cooking? | L27: Local Film | M27: TBA; [10:45] Northwest News Digest | N27: The Big Payoff (NBC) | O27: Welcome Travelers (NBC) | P27: On Your Account (NBC) | Q27: Ladie's Choice (NBC) | R27: Double or Nothing (CBS) | S27: Strike It Rich (CBS) | T27: Movie [Matinee Theater]: Happy Landing | V27: [3:15] Search For Tomorrow (CBS) | W27: Love of Life (CBS); [3:45] The Toymaker | X27: Wild Bill Hickok | Y27: Hopalong Cassidy | AA27: Alka-Seltzer Newspaper of the Air; [5:45] Time for Beany | AB27: Boxing from Chicago | AC27: Sportsman's Club; [6:45] Camel News Caravan (NBC) | AD27: Chevron Theater | AE27: TBA | AF27: What's My Name? (NBC) | AG27: Safety Spotlight | AH27: Robert Montgomery Presents (NBC) | AJ27: The Arthur Murray Dancing Party (Live) | AK27: The Big Playback; [10:45] Sports Den | AL27: Movie [Nite Owl Theater]: Higgins Family | AX27: =A27 -> 19560
A28: =A27+7 -> 19567 | K28: What's Cooking? | L28: Local Film | M28: [10:45] TBA | N28: The Big Payoff (NBC) | O28: Welcome Travelers (NBC) | P28: On Your Account (NBC) | Q28: Ladie's Choice (NBC) | R28: Double or Nothing (CBS) | S28: Strike It Rich (CBS) | T28: Movie [Matinee Theater]: Mysterious Mr. Wong | V28: [3:15] Search For Tomorrow (CBS) | W28: Love of Life (CBS); [3:45] The Toymaker | X28: Wild Bill Hickok | Y28: Hopalong Cassidy | AA28: Northwest News Digest; [5:40] Alka-Seltzer Newspaper of the Air; [5:45] Time for Beany | AB28: Boxing from Chicago | AC28: Sportsman's Club; [6:45] Camel News Caravan (NBC) | AD28: Chevron Theater | AE28: Voice of Firestone (NBC) | AF28: Name That Tune (NBC) | AG28: Safety Spotlight; [8:45] TBA | AH28: Robert Montgomery Presents (NBC) | AJ28: The Arthur Murray Dancing Party (Live) | AK28: The Big Playback; [10:45] Sports Den | AL28: Movie [Nite Owl Theater]: Country Gentleman | AX28: =A28 -> 19567
A29: =A28+7 -> 19574 | K29: What's Cooking? | L29: Local Film | M29: [10:45] TBA | N29: The Big Payoff (NBC) | O29: Welcome Travelers (NBC) | P29: On Your Account (NBC) | Q29: Ladie's Choice (NBC) | R29: Double or Nothing (CBS) | S29: Strike It Rich (CBS) | T29: Movie [Matinee Theater]: Law of the Jungle | V29: [3:15] Search For Tomorrow (CBS) | W29: Love of Life (CBS); [3:45] The Toymaker | X29: Wild Bill Hickok | Y29: Hopalong Cassidy | AA29: Northwest News Digest; [5:40] Alka-Seltzer Newspaper of the Air; [5:45] Time for Beany | AB29: Boxing from Chicago | AC29: Sportsman's Club; [6:45] Camel News Caravan (NBC) | AD29: Chevron Theater | AE29: Voice of Firestone (NBC) | AF29: Name That Tune (NBC) | AG29: Safety Spotlight; [8:45] TBA | AH29: Robert Montgomery Presents (NBC) | AJ29: The Arthur Murray Dancing Party (Live) | AK29: The Big Playback; [10:45] Sports Den | AL29: Movie [Nite Owl Theater]: SOS Tidal Wave | AX29: =A29 -> 19574
A30: =A29+7 -> 19581 | K30: What's Cooking? | L30: Local Film | M30: [10:45] TBA | N30: The Big Payoff (NBC) | O30: Welcome Travelers (NBC) | P30: On Your Account (NBC) | Q30: Ladie's Choice (NBC) | R30: Double or Nothing (CBS) | S30: Strike It Rich (CBS) | T30: Movie [Matinee Theater]: Living Ghost | V30: [3:15] Search For Tomorrow (CBS) | W30: Love of Life (CBS); [3:45] The Toymaker | X30: Wild Bill Hickok | Y30: Hopalong Cassidy | AA30: Northwest News Digest; [5:40] Alka-Seltzer Newspaper of the Air; [5:45] Time for Beany | AB30: Boxing from Chicago | AC30: Sportsman's Club; [6:45] Camel News Caravan (NBC) | AD30: Chevron Theater | AE30: Voice of Firestone (NBC) | AF30: Name That Tune (NBC) | AG30: Safety Spotlight; [8:45] Armchair Adventure | AH30: Robert Montgomery Presents (NBC) | AJ30: The Arthur Murray Dancing Party (Live) | AK30: The Big Playback; [10:45] Sports Den | AL30: Movie [Nite Owl Theater]: Gangs of New York | AX30: =A30 -> 19581
A31: =A30+7 -> 19588 | K31: What's Cooking? | L31: Local Film | M31: [10:45] TBA | N31: The Big Payoff (NBC) | O31: Welcome Travelers (NBC) | P31: On Your Account (NBC) | Q31: United Nations General Assembly (NBC) | R31: Double or Nothing (CBS) | S31: Strike It Rich (CBS) | T31: Movie [Matinee Theater]: You Can't Beat the Law | V31: [3:15] Search For Tomorrow (CBS) | W31: Love of Life (CBS); [3:45] The Toymaker | X31: Wild Bill Hickok | Y31: Hopalong Cassidy | AA31: Northwest News Digest; [5:40] Alka-Seltzer Newspaper of the Air; [5:45] Time for Beany | AB31: Boxing from Chicago | AC31: Sportsman's Club; [6:45] Camel News Caravan (NBC) | AD31: Chevron Theater | AE31: Voice of Firestone (NBC) | AF31: Name That Tune (NBC) | AG31: Safety Spotlight; [8:45] Armchair Adventure | AH31: Robert Montgomery Presents (NBC) | AJ31: The Arthur Murray Dancing Party (Live) | AK31: The Big Playback; [10:45] Sports Den | AL31: Telenews Weekly; [11:15] Movie [Nite Owl Theater]: Covered Trailer | AX31: =A31 -> 19588
A32: =A31+7 -> 19595 | K32: What's Cooking? | L32: Local Film | M32: [10:45] TBA | N32: The Big Payoff (NBC) | O32: Welcome Travelers (NBC) | P32: On Your Account (NBC) | Q32: United Nations General Assembly (NBC) | R32: Double or Nothing (CBS) | S32: Strike It Rich (CBS) | T32: Movie [Matinee Theater]: Here Comes Kelly | V32: [3:15] Search For Tomorrow (CBS) | W32: Love of Life (CBS); [3:45] The Toymaker | X32: Wild Bill Hickok | Y32: Hopalong Cassidy | AA32: TBA; [5:45] Northwest News Digest; [5:55] Alka-Seltzer Newspaper of the Air | AB32: Boxing from Chicago | AC32: Sportsman's Club; [6:45] Camel News Caravan (NBC) | AD32: Chevron Theater | AE32: Voice of Firestone (NBC) | AF32: Name That Tune (NBC) | AG32: Safety Spotlight; [8:45] Armchair Adventure | AH32: Robert Montgomery Presents (NBC) | AJ32: The Arthur Murray Dancing Party (Live) | AK32: The Big Playback; [10:45] Sports Den | AL32: Telenews Weekly; [11:15] Movie [Nite Owl Theater]: Woman Doctor | AX32: =A32 -> 19595
A33: =A32+7 -> 19602 | K33: What's Cooking? | L33: Local Film | M33: [10:45] TBA | N33: The Big Payoff (NBC) | O33: Welcome Travelers (NBC) | P33: On Your Account (NBC) | Q33: United Nations General Assembly (NBC) | R33: Double or Nothing (CBS) | S33: Strike It Rich (CBS) | T33: Movie [Matinee Theater]: Remedy for Riches | V33: [3:15] Search For Tomorrow (CBS) | W33: Love of Life (CBS); [3:45] The Toymaker | X33: Wild Bill Hickok | Y33: Hopalong Cassidy | AA33: TBA; [5:45] Northwest News Digest; [5:55] Alka-Seltzer Newspaper of the Air | AB33: Boxing from Chicago | AC33: Sportsman's Club; [6:45] Camel News Caravan (NBC) | AD33: Chevron Theater | AE33: Voice of Firestone (NBC) | AF33: Name That Tune (NBC) | AG33: Safety Spotlight; [8:45] Armchair Adventure | AH33: Robert Montgomery Presents (NBC) | AJ33: The Arthur Murray Dancing Party (Live) | AK33: The Big Playback; [10:45] Sports Den | AL33: Telenews Weekly; [11:15] Movie [Nite Owl Theater]: Gentleman from Louisiana | AX33: =A33 -> 19602
A34: =A33+7 -> 19609 | K34: What's Cooking? | L34: Local Film | M34: [10:45] TBA | N34: The Big Payoff (NBC) | O34: Welcome Travelers (NBC) | P34: On Your Account (NBC) | Q34: United Nations General Assembly (NBC) | R34: Double or Nothing (CBS) | S34: Strike It Rich (CBS) | T34: Movie [Matinee Theater]: Melody Master | V34: [3:15] Search For Tomorrow (CBS) | W34: Love of Life (CBS); [3:45] The Toymaker | X34: Wild Bill Hickok | Y34: Movie [Six Gun Playhouse]: Western films | AA34: [5:45] Northwest News Digest; [5:55] Alka-Seltzer Newspaper of the Air | AB34: Boxing from Chicago | AC34: Sportsman's Club; [6:45] Camel News Caravan (NBC) | AD34: Chevron Theater | AE34: Voice of Firestone (NBC) | AF34: Name That Tune (NBC) | AG34: Safety Spotlight; [8:45] Armchair Adventure | AH34: Robert Montgomery Presents (NBC) | AJ34: The Arthur Murray Dancing Party (Live) | AK34: The Big Playback; [10:45] Sports Den | AL34: Telenews Weekly; [11:15] Movie [Nite Owl Theater]: Earl fo Puddlestone | AX34: =A34 -> 19609
A35: =A34+7 -> 19616 | K35: What's Cooking? | L35: Local Film | M35: [10:45] TBA | N35: The Big Payoff (NBC) | O35: Welcome Travelers (NBC) | P35: On Your Account (NBC) | Q35: United Nations General Assembly (NBC) | R35: Double or Nothing (CBS) | S35: Strike It Rich (CBS) | T35: Movie [Matinee Theater]: There Goes Kelly (1945) | V35: [3:15] Search For Tomorrow (CBS) | W35: Love of Life (CBS); [3:45] The Toymaker | X35: Wild Bill Hickok | Y35: Movie [Six Gun Playhouse]: Western films | AA35: [5:45] Northwest News Digest; [5:55] Alka-Seltzer Newspaper of the Air | AB35: Boxing from Chicago | AC35: Sportsman's Club; [6:45] Camel News Caravan (NBC) | AD35: Chevron Theater | AE35: Voice of Firestone (NBC) | AF35: Name That Tune (NBC) | AG35: Safety Spotlight; [8:45] Armchair Adventure | AH35: Robert Montgomery Presents (NBC) | AJ35: The Arthur Murray Dancing Party (Live) | AK35: The Big Playback; [10:45] Sports Den | AL35: Telenews Weekly; [11:15] Movie [Nite Owl Theater]: Hearts in Bondage (1936) | AX35: =A35 -> 19616
A36: =A35+7 -> 19623 | K36: What's Cooking? | L36: Ding Dong School (NBC) | M36: TBA | N36: The Big Payoff (NBC) | O36: Welcome Travelers (NBC) | P36: On Your Account (NBC) | Q36: Movie [Matinee Theater]: Skybound (1935) | S36: Strike It Rich (CBS) | T36: Double or Nothing (CBS) | U36: The Kate Smith Hour (NBC) | V36: TBA; [3:15] Search For Tomorrow (CBS) | W36: Love of Life (CBS); [3:45] The Toymaker | X36: Wild Bill Hickok | Y36: Movie [Six Gun Playhouse]: Western films | AA36: [5:45] Northwest News Digest; [5:55] Alka-Seltzer Newspaper of the Air | AB36: Boxing from Chicago | AC36: Sportsman's Club; [6:45] Camel News Caravan (NBC) | AD36: Chevron Theater | AE36: Voice of Firestone (NBC) | AF36: Name That Tune (NBC) | AG36: Safety Spotlight; [8:45] Armchair Adventure | AH36: Robert Montgomery Presents (NBC) | AJ36: The Arthur Murray Dancing Party (Live) | AK36: The Big Playback; [10:45] Sports Den | AL36: Chuck Foster's Newscene; [11:05] Telenews Weekly; [11:15] Movie [Nite Owl Theater]: Hearts in Bondage (1936) | AX36: =A36 -> 19623
A37: =A36+7 -> 19630 | J37: [9:15] Movie [Morning Movie]: TBA | M37: What's Cooking? | N37: Hawkins Falls (NBC); [11:15] TBA | O37: TBA | P37: TBA | Q37: TBA | R37: Movie [Matinee Theater]: Tomboy (1940) | U37: On Your Account (NBC) | V37: The Kate Smith Hour (NBC) | X37: TBA | Y37: The Toymaker | Z37: Howdy Doody (NBC) | AA37: Wild Bill Hickok | AB37: TBA | AC37: TBA; [6:45] Northwest News Digest; [6:50] Spors on View; [6:55] Alka-Seltzer Newspaper of the Air | AD37: Boxing from Chicago | AE37: Sportsman's Club; [7:45] Camel News Caravan (NBC) | AF37: Name That Tune (NBC) | AG37: Voice of Firestone (NBC) | AH37: TBA | AI37: Robert Montgomery Presents (NBC) | AK37: The Arthur Murray Dancing Party (Live) | AL37: News; [11:15] Movie: [Nite Owl Theater]: Meet the Missus" (1940) | AX37: =A37 -> 19630
A39: 1955 | AX39: =A39 -> 1955
A41: 20337 | F41: Today (NBC) | H41: Test Pattern | I41: Rainbow Review | J41: Ding Dong School | K41: Parent's Time; World at Home | L41: Home (NBC) | N41: Tennessee Ernie Ford | O41: Feather Your Nest | P41: Movie: The Thirteenth Man | S41: Northwest Home | T41: Harry S. Truman [Special] | U41: It Pays to Be Married | V41: Way of the World; [3:15] First Love | W41: The World of Mr. Sweeney; [3:45] Modern Romances | X41: The Pinky Lee Show (NBC) | Y41: Howdy Doody (NBC) | Z41: Heck Harper Show | AA41: Wild Bill Hickok | AB41: See Hear; [6:20] News--Ivan Smith | AC41: Tony Martin (NBC); [6:45] News (NBC) | AD41: Captured | AE41: Badge 714 | AF41: Medic (NBC) | AG41: Comedy Review (NBC) | AI41: Robert Montgomery Presents (NBC) | AK41: News; [10:35] Movie: Shock
A49: 1957 | AX49: =A49 -> 1957
A53: 21037 | F53: Today (NBC) | H53: Tic Tac Dough (NBC) | I53: It Could Be You (NBC) | J53: Home (NBC); [9:38] News Central; [9:42] Home | L53: The Price is Right (NBC) | M53: Bride and Groom (NBC) | N53: Matinee Theatre (NBC) | P53: Queen for a Day (NBC) | Q53: [1:45] Modern Romances (NBC) | R53: Comedy Time | S53: Truth or Conse-quences (NBC) | T53: Movie: Eight o'Clock Walk (1953) | W53: O.M.S.I. Presents | X53: Colonel Tim McCoy; [4:15] Range Rider | Y53: [4:45] Kit Carson | Z53: [5:15] Boston Blackie | AA53: [5:45] News Central | AB53: Corliss Archer | AC53: Georgia Gibbs (NBC); [6:45] NBC News (NBC) | AD53: Charlie Farrell Show | AE53: Action Tonight | AF53: Twenty-One (NBC) | AG53: Arthur Murray Party | AH53: Ted Mack's Original Amateur Hour | AI53: Liberace | AJ53: Famous Playhouse | AK53: Weather News; [10:35] Movie: Diamond Wizard (1954) | AX53: =A53 -> 21037
A54: =A53+7 -> 21044
A55: =A54+7 -> 21051
A56: =A55+7 -> 21058 | F56: Today (NBC) | H56: Tic Tac Dough (NBC) | I56: It Could Be You (NBC) | J56: Arlene Francis (NBC) | K56: Treasure Hunt (NBC) | L56: The Price is Right (NBC) | M56: Bride and Groom (NBC) | N56: Matinee Theatre (NBC) | P56: Queen for a Day (NBC) | Q56: [1:45] Modern Romances (NBC) | R56: Comedy Time | S56: Truth or Conse-quences (NBC)
A57: =A56+7 -> 21065
A58: =A57+7 -> 21072
A59: =A58+7 -> 21079
A60: =A59+7 -> 21086
A61: =A60+7 -> 21093
A64: 21156 | G64: O.E.A. Presents | H64: Today (NBC) | J64: Tic Tac Dough (NBC) | K64: It Could Be You (NBC) | L64: Arlene Francis (NBC) | M64: Treasure Hunt (NBC) | N64: The Price is Right (NBC) | O64: Bride and Groom (NBC) | P64: Matinee Theater (NBC) | R64: Queen for a Day (NBC) | S64: [1:45] Modern Romances (NBC) | T64: Comedy Time | U64: Truth or Conse-quences (NBC) | V64: Movie [Afternoon Theatre]: Alcatraz Island (1938) | Y64: High Time | AA64: Suspense Unlimited | AB64: News Central; [6:15] NBC News (NBC) | AC64: PCC Hilites | AD64: Badge 714 | AE64: The Price is Right (NBC) | AF64: Restless Gun (NBC) | AG64: Tales of Wells Fargo (NBC) | AH64: Twenty-One (NBC) | AI64: Turn of Fate (NBC) | AJ64: Suspicion (NBC) | AL64: Movie: Embraceable You (1948) | AX64: =A64 -> 21156
A65: =A64+7 -> 21163 | AX65: =A65 -> 21163
A66: =A65+7 -> 21170 | AX66: =A66 -> 21170
A67: =A66+7 -> 21177 | AX67: =A67 -> 21177
A68: =A67+7 -> 21184 | AX68: =A68 -> 21184
A70: 1958 | AX70: =A70 -> 1958
A72: 21233 | G72: O.E.A. Presents | H72: Today (NBC) | J72: Tic Tac Dough (NBC) | K72: It Could Be You (NBC) | L72: Stage 12 | M72: Treasure Hunt (NBC) | N72: The Price is Right (NBC) | O72: Kitty Foyle (NBC) | P72: Matinee Theater (NBC) | R72: Queen for a Day (NBC) | S72: [1:45] Modern Romances (NBC) | T72: Comedy Time | U72: Truth or Conse-quences (NBC) | V72: Movie [Afternoon Theatre]: I Like Your Nerve (1931) | Y72: High Time | AA72: Suspense Unlimited | AB72: News Central; [6:15] NBC News | AC72: Corliss Archer | AD72: Badge 714 | AE72: The Price is Right (NBC) | AF72: Restless Gun (NBC) | AG72: Tales of Wells Fargo (NBC) | AH72: Twenty-One (NBC) | AI72: Goodyear Theatre (NBC) | AJ72: Suspicion (NBC) | AL72: Movie: Confessions of a Nazi Spy (1939)
A86: 1960 | AX86: 1960
A87: 21919 | F87: OMSI Presents | G87: Eye Opener | H87: Uncle Charlie's Roundhouse | J87: Romper Room | K87: Movie [Early Show]: Personal Maid's Secret (1935) | N87: The Better Half | O87: The Life of Riley | P87: Restless Gun (ABC) | Q87: Love That Bob! (ABC) | R87: About Faces (ABC) | S87: Conrad Nagel Theater | T87: Day in Court (ABC) | U87: Gale Storm (ABC) | V87: Beat the Clock (ABC) | W87: Who Do You Trust? (ABC) | X87: American Bandstand (ABC) | Y87: High Time | Z87: Three Stooges | AA87: My Friend Flicka (ABC) | AB87: Cartoons--Uncle Charlie; [6:15] News--John Salisbury; [6:25] Sports Roundup--Charlie LaFranchise | AC87: Seven League Boots | AD87: Silent Service | AE87: Cheyenne (ABC) | AG87: Bourbon Street Beat (ABC) | AI87: Adventures in Paradise (ABC) | AK87: Man with a Camera (ABC) | AL87: News; [11:15] Movie [Academy Art Theater]: The Man in Grey (English, 1943) | AX87: =A87 -> 21919
A88: 21926 | F88: OMSI Presents | G88: Eye Opener | H88: Uncle Charlie's Roundhouse | J88: Romper Room | K88: Movie [Early Show]: The Wagons Roll at Night (1941) | N88: The Better Half | O88: The Life of Riley | P88: Restless Gun (ABC) | Q88: Love That Bob! (ABC) | R88: About Faces (ABC) | S88: Tugboat Annie | T88: Day in Court (ABC) | U88: Gale Storm (ABC) | V88: Beat the Clock (ABC) | W88: Who Do You Trust? (ABC) | X88: American Bandstand (ABC) | Y88: High Time | Z88: Three Stooges | AA88: My Friend Flicka (ABC) | AB88: Cartoons--Uncle Charlie; [6:15] News--John Salisbury; [6:25] Sports Roundup--Charlie LaFranchise | AC88: Seven League Boots | AD88: Silent Service | AE88: Cheyenne (ABC) | AG88: Bourbon Street Beat (ABC) | AI88: Adventures in Paradise (ABC) | AK88: Man with a Camera (ABC) | AL88: News; [11:15] Movie [Academy Theater]: Mad About Men (English; 1954) | AX88: =A88 -> 21926
A89: 21933 | F89: OMSI Presents | G89: Eye Opener | H89: Uncle Charlie's Roundhouse | J89: Romper Room | K89: Movie [Early Show]: Star Witness (1931) | N89: The Better Half | O89: The Life of Riley | P89: Restless Gun (ABC) | Q89: Love That Bob! (ABC) | R89: About Faces (ABC) | S89: Tugboat Annie | T89: Day in Court (ABC) | U89: Gale Storm (ABC) | V89: Beat the Clock (ABC) | W89: Who Do You Trust? (ABC) | X89: American Bandstand (ABC) | Y89: High Time | Z89: Three Stooges | AA89: My Friend Flicka (ABC) | AB89: Cartoons--Uncle Charlie; [6:15] News--John Salisbury | AC89: Seven League Boots | AD89: Silent Service | AE89: Cheyenne (ABC) | AG89: Bourbon Street Beat (ABC) | AI89: Adventures in Paradise (ABC) | AK89: Man with a Camera (ABC) | AL89: News; [11:15] Movie [Academy Theater]: Odd Man Out (English; 1947) | AX89: =A89 -> 21933
A90: 21940 | F90: OMSI Presents | G90: Eye Opener | H90: Uncle Charlie's Roundhouse | J90: Romper Room | K90: Movie [Early Show]: Snowed Under (1936) | N90: The Better Half | O90: The Life of Riley | P90: Restless Gun (ABC) | Q90: Love That Bob! (ABC) | R90: About Faces (ABC) | S90: Tugboat Annie | T90: Day in Court (ABC) | U90: Gale Storm (ABC) | V90: Beat the Clock (ABC) | W90: Who Do You Trust? (ABC) | X90: American Bandstand (ABC) | Y90: High Time | Z90: Three Stooges | AA90: My Friend Flicka (ABC) | AB90: Cartoons--Uncle Charlie; [6:15] News--John Salisbury | AC90: Seven League Boots | AD90: Silent Service | AE90: Cheyenne (ABC) | AG90: Bourbon Street Beat (ABC) | AI90: Adventures in Paradise (ABC) | AK90: Man with a Camera (ABC) | AL90: News; [11:15] Movie [Academy Theater]: Crash of Slence (English; 1953) | AX90: =A90 -> 21940
A91: 21947 | F91: OMSI Presents | G91: Eye Opener | H91: Uncle Charlie's Roundhouse | J91: Romper Room | K91: Movie [Early Show]: Invaders From Mars (1953) | N91: The Better Half | O91: The Life of Riley | P91: Restless Gun (ABC) | Q91: Love That Bob! (ABC) | R91: About Faces (ABC) | S91: Tugboat Annie | T91: Day in Court (ABC) | U91: Gale Storm (ABC) | V91: Beat the Clock (ABC) | W91: Who Do You Trust? (ABC) | X91: American Bandstand (ABC) | Y91: High Time | Z91: Three Stooges | AA91: My Friend Flicka (ABC) | AB91: Cartoons--Uncle Charlie; [6:15] News--John Salisbury | AC91: Seven League Boots | AD91: Silent Service | AE91: Cheyenne (ABC) | AG91: Bourbon Street Beat (ABC) | AI91: Adventures in Paradise (ABC) | AK91: Man with a Camera (ABC) | AL91: News; [11:15] Movie [Academy Theater]: In Which We Serve (1942) | AX91: =A91 -> 21947
A92: 21954 | F92: OMSI Presents | G92: Eye Opener | H92: Uncle Charlie's Roundhouse | J92: Romper Room | K92: Movie [Early Show]: Crime By Night (1944) | N92: The Better Half | O92: The Life of Riley | P92: Restless Gun (ABC) | Q92: Love That Bob! (ABC) | R92: About Faces (ABC) | S92: Tugboat Annie | T92: Day in Court (ABC) | U92: Gale Storm (ABC) | V92: Beat the Clock (ABC) | W92: Who Do You Trust? (ABC) | X92: American Bandstand (ABC) | Y92: High Time | Z92: Three Stooges | AA92: My Friend Flicka (ABC) | AB92: Cartoons--Uncle Charlie; [6:15] News--John Salisbury | AC92: Seven League Boots | AD92: Silent Service | AE92: Cheyenne (ABC) | AG92: Bourbon Street Beat (ABC) | AI92: Adventures in Paradise (ABC) | AK92: Man with a Camera (ABC) | AL92: News; [11:15] Movie [Academy Theater]: Jazzy (1947) | AX92: =A92 -> 21954
A93: 21961 | F93: OMSI Presents | G93: Eye Opener | H93: Uncle Charlie's Roundhouse | J93: Romper Room | K93: Movie [Early Show]: Up the River (1938) | N93: The Better Half | O93: Famous Playhouse | P93: Restless Gun (ABC) | Q93: Love That Bob! (ABC) | R93: About Faces (ABC) | S93: Tugboat Annie | T93: Day in Court (ABC) | U93: Gale Storm (ABC) | V93: Beat the Clock (ABC) | W93: Who Do You Trust? (ABC) | X93: American Bandstand (ABC) | Y93: High Time | Z93: Three Stooges | AA93: My Friend Flicka (ABC) | AB93: Cartoons--Uncle Charlie; [6:15] News--John Salisbury | AC93: Seven League Boots | AD93: Silent Service | AE93: Cheyenne (ABC) | AG93: Bourbon Street Beat (ABC) | AI93: Frank Sinatra (ABC) [Special] | AK93: Man with a Camera (ABC) | AL93: News; [11:15] Movie [Academy Theater]: Raiders of the Seven Seas (1953) | AX93: =A93 -> 21961
A94: 21968 | F94: OMSI Presents | G94: Eye Opener | H94: Uncle Charlie's Roundhouse | J94: Romper Room | K94: Movie [Early Show]: Stars Over Broadway (1935) | N94: The Better Half | O94: Famous Playhouse | P94: Restless Gun (ABC) | Q94: Love That Bob! (ABC) | R94: About Faces (ABC) | S94: Tugboat Annie | T94: Day in Court (ABC) | U94: Gale Storm (ABC) | V94: Beat the Clock (ABC) | W94: Who Do You Trust? (ABC) | X94: American Bandstand (ABC) | Y94: High Time | Z94: Three Stooges | AA94: My Friend Flicka (ABC) | AB94: Cartoons--Uncle Charlie; [6:15] News--John Salisbury | AC94: Seven League Boots | AD94: Silent Service | AE94: Cheyenne (ABC) | AG94: Bourbon Street Beat (ABC) | AI94: Adventures in Paradise (ABC) | AK94: Man with a Camera (ABC) | AL94: News; [11:15] Movie [Academy Art Theater]: Ivory Hunter (British; 1952) | AX94: =A94 -> 21968
A95: 21975 | F95: OMSI Presents | G95: Eye Opener | H95: Uncle Charlie's Roundhouse | J95: Romper Room | K95: Movie [Early Show]: Old English (1930) | N95: The Better Half | O95: Famous Playhouse | P95: Restless Gun (ABC) | Q95: Love That Bob! (ABC) | R95: About Faces (ABC) | S95: Tugboat Annie | T95: Day in Court (ABC) | U95: Gale Storm (ABC) | V95: Beat the Clock (ABC) | W95: Who Do You Trust? (ABC) | X95: American Bandstand (ABC) | Y95: High Time | Z95: Three Stooges | AA95: My Friend Flicka (ABC) | AB95: Cartoons--Uncle Charlie; [6:15] News--John Salisbury | AC95: Seven League Boots | AD95: Silent Service | AE95: Cheyenne (ABC) | AG95: Bing Crosby (ABC) [Special] | AI95: Adventures in Paradise (ABC) | AK95: Man with a Camera (ABC) | AL95: News; [11:15] Movie [Academy Art Theater]: The Story of Seabiscuit (1949) | AX95: =A95 -> 21975
A96: 21982 | F96: OMSI Presents | G96: Eye Opener | H96: Uncle Charlie's Roundhouse | J96: Romper Room | K96: Movie [Early Show]: Babies for Sale (1940) | N96: The Better Half | O96: Famous Playhouse | P96: Restless Gun (ABC) | Q96: Love That Bob! (ABC) | R96: About Faces (ABC) | S96: Tugboat Annie | T96: Day in Court (ABC) | U96: Gale Storm (ABC) | V96: Beat the Clock (ABC) | W96: Who Do You Trust? (ABC) | X96: American Bandstand (ABC) | Y96: High Time | Z96: Three Stooges | AA96: Rin Tin Tin (ABC) | AB96: News Central | AC96: Seven League Boots | AD96: Silent Service | AE96: Cheyenne (ABC) | AG96: Bourbon Street Beat (ABC) | AI96: Adventures in Paradise (ABC) | AK96: Ted Mack and the Original Amateur Hour (ABC) | AL96: News; [11:15] Movie [Academy Art Theater]: The Browning Version (English; 1951) | AX96: =A96 -> 21982
A97: 21989 | F97: OMSI Presents | G97: Eye Opener | H97: Uncle Charlie's Roundhouse | J97: Romper Room | K97: Movie [Early Show]: The Hatchet Man (1931) | N97: The Better Half | O97: Famous Playhouse | P97: Restless Gun (ABC) | Q97: Love That Bob! (ABC) | R97: About Faces (ABC) | S97: Tugboat Annie | T97: Day in Court (ABC) | U97: Gale Storm (ABC) | V97: Beat the Clock (ABC) | W97: Who Do You Trust? (ABC) | X97: American Bandstand (ABC) | Y97: High Time | Z97: Three Stooges | AA97: Rin Tin Tin (ABC) | AB97: News Central | AC97: Seven League Boots | AD97: Silent Service | AE97: Cheyenne (ABC) | AG97: Bourbon Street Beat (ABC) | AI97: Adventures in Paradise (ABC) | AK97: Ted Mack and the Original Amateur Hour (ABC) | AL97: News; [11:15] Movie [Academy Art Theater]: The Twonky (1953) | AX97: =A97 -> 21989
A98: 21996 | F98: OMSI Presents | G98: Eye Opener | H98: Uncle Charlie's Roundhouse | J98: Romper Room | K98: Movie [Early Show]: Mr. Dodd Takes the Air (1937) | N98: The Better Half | O98: Famous Playhouse | P98: Restless Gun (ABC) | Q98: Love That Bob! (ABC) | R98: About Faces (ABC) | S98: Tugboat Annie | T98: Day in Court (ABC) | U98: Gale Storm (ABC) | V98: Beat the Clock (ABC) | W98: Who Do You Trust? (ABC) | X98: American Bandstand (ABC) | Y98: High Time | Z98: Three Stooges | AA98: Rin Tin Tin (ABC) | AB98: News Central | AC98: Seven League Boots | AD98: Silent Service | AE98: Cheyenne (ABC) | AG98: Bourbon Street Beat (ABC) | AI98: Adventures in Paradise (ABC) | AK98: Ted Mack and the Original Amateur Hour (ABC) | AL98: News; [11:15] Movie [Academy Art Theater]: The Mikado (English; 1939) | AX98: =A98 -> 21996
A99: 22003 | F99: OMSI Presents | G99: Eye Opener | H99: Uncle Charlie's Roundhouse | J99: Romper Room | K99: Movie [Early Show]: Illegal (?) | N99: The Better Half | O99: Famous Playhouse | P99: Restless Gun (ABC) | Q99: Love That Bob! (ABC) | R99: About Faces (ABC) | S99: Tugboat Annie | T99: Day in Court (ABC) | U99: Gale Storm (ABC) | V99: Beat the Clock (ABC) | W99: Who Do You Trust? (ABC) | X99: American Bandstand (ABC) | Y99: High Time | Z99: Three Stooges | AA99: Rin Tin Tin (ABC) | AB99: News Central | AC99: Seven League Boots | AD99: Silent Service | AE99: Cheyenne (ABC) | AG99: Bourbon Street Beat (ABC) | AI99: Adventures in Paradise (ABC) | AK99: Ted Mack and the Original Amateur Hour (ABC) | AL99: News; [11:15] Movie [Academy Art Theater]: Volcano (Italian; 1949) | AX99: =A99 -> 22003
A100: 22010 | F100: OMSI Presents | G100: Eye Opener | H100: Uncle Charlie's Roundhouse | J100: Romper Room | K100: Movie [Early Show]: TBA | N100: The Better Half | O100: Famous Playhouse | P100: Restless Gun (ABC) | Q100: Love That Bob! (ABC) | R100: About Faces (ABC) | S100: Tugboat Annie | T100: Day in Court (ABC) | U100: Gale Storm (ABC) | V100: Beat the Clock (ABC) | W100: Who Do You Trust? (ABC) | X100: American Bandstand (ABC) | Y100: High Time | Z100: Three Stooges | AA100: Rin Tin Tin (ABC) | AB100: News Central | AC100: Seven League Boots | AD100: Silent Service | AE100: Cheyenne (ABC) | AG100: Bourbon Street Beat (ABC) | AI100: Adventures in Paradise (ABC) | AK100: Ted Mack and the Original Amateur Hour (ABC) | AL100: News; [11:15] Movie [Academy Art Theater]: The Bandits of Corsica (1953) | AX100: =A100 -> 22010
A101: 22017 | F101: OMSI Presents | G101: Eye Opener | H101: Uncle Charlie's Roundhouse | J101: Romper Room | K101: Movie [Early Show]: TBA | N101: The Better Half | O101: Famous Playhouse | P101: Restless Gun (ABC) | Q101: Love That Bob! (ABC) | R101: About Faces (ABC) | S101: Tugboat Annie | T101: Day in Court (ABC) | U101: Gale Storm (ABC) | V101: Beat the Clock (ABC) | W101: Who Do You Trust? (ABC) | X101: American Bandstand (ABC) | Y101: High Time | Z101: Three Stooges | AA101: Rin Tin Tin (ABC) | AB101: News Central | AC101: Seven League Boots | AD101: Silent Service | AE101: Cheyenne (ABC) | AG101: Bourbon Street Beat (ABC) | AI101: Adventures in Paradise (ABC) | AK101: Ted Mack and the Original Amateur Hour (ABC) | AL101: News; [11:15] Movie [Academy Art Theater]: Crossed Swords (1954) | AX101: =A101 -> 22017
A102: 22024 | F102: OMSI Presents | G102: Eye Opener | H102: Uncle Charlie's Roundhouse | J102: Romper Room | K102: Movie [Early Show]: Castle on the Hudson (1940) | N102: The Better Half | O102: Famous Playhouse | P102: Restless Gun (ABC) | Q102: Love That Bob! (ABC) | R102: About Faces (ABC) | S102: Tugboat Annie | T102: Day in Court (ABC) | U102: Gale Storm (ABC) | V102: Beat the Clock (ABC) | W102: Who Do You Trust? (ABC) | X102: American Bandstand (ABC) | Y102: High Time | Z102: Three Stooges | AA102: Rin Tin Tin (ABC) | AB102: News Central | AC102: Seven League Boots | AD102: Silent Service | AE102: Cheyenne (ABC) | AG102: Bourbon Street Beat (ABC) | AI102: Adventures in Paradise (ABC) | AK102: Ted Mack and the Original Amateur Hour (ABC) | AL102: News; [11:15] Movie [Academy Art Theater]: TBA | AX102: =A102 -> 22024
B103: OTHER CITIES SWITCH TO DAYLIGHT SAVINGS TIME; PORTLAND SHOWS AIR ONE HOUR EARLIER | J103: OTHER CITIES SWITCH TO DAYLIGHT SAVINGS TIME; PORTLAND SHOWS AIR ONE HOUR EARLIER | R103: OTHER CITIES SWITCH TO DAYLIGHT SAVINGS TIME; PORTLAND SHOWS AIR ONE HOUR EARLIER | Z103: OTHER CITIES SWITCH TO DAYLIGHT SAVINGS TIME; PORTLAND SHOWS AIR ONE HOUR EARLIER | AH103: OTHER CITIES SWITCH TO DAYLIGHT SAVINGS TIME; PORTLAND SHOWS AIR ONE HOUR EARLIER | AP103: OTHER CITIES SWITCH TO DAYLIGHT SAVINGS TIME; PORTLAND SHOWS AIR ONE HOUR EARLIER
A104: 22031 | F104: OMSI Presents | G104: Eye Opener | H104: Uncle Charlie's Roundhouse | J104: Romper Room | K104: Burns and Allen | L104: Rosemary Clooney | M104: The Better Half | N104: Restless Gun (ABC) | O104: Love That Bob! (ABC) | P104: About Faces (ABC) | Q104: Tugboat Annie | R104: Day in Court (ABC) | S104: Gale Storm (ABC) | T104: Beat the Clock (ABC) | U104: Who Do You Trust? (ABC) | V104: American Bandstand (ABC) | W104: High Time | X104: Uncle Charlie's Den | Z104: Three Stooges | AA104: My Friend Flicka (ABC) | AB104: News Central | AC104: Cheyenne (ABC) | AE104: Bourbon Street Beat (ABC) | AG104: Adventures in Paradise (ABC) | AI104: Ted Mack and the Original Amateur Hour (ABC) | AJ104: Silent Service | AK104: Seven League Boots | AL104: News--John Salisbury; [11:15] Movie [Academy Art Theater]: Under the Southern Cross (1956) | AX104: =A104 -> 22031
A105: 22038 | F105: OMSI Presents | G105: Eye Opener | H105: Uncle Charlie's Roundhouse | J105: Romper Room | K105: Burns and Allen | L105: Rosemary Clooney | M105: The Better Half | N105: Restless Gun (ABC) | O105: Love That Bob! (ABC) | P105: About Faces (ABC) | Q105: Tugboat Annie | R105: Day in Court (ABC) | S105: Gale Storm (ABC) | T105: Beat the Clock (ABC) | U105: Who Do You Trust? (ABC) | V105: American Bandstand (ABC) | W105: High Time | X105: Uncle Charlie's Den | Z105: Three Stooges | AA105: Rin Tin Tin (ABC) | AB105: News Central | AC105: Cheyenne (ABC) | AE105: Bourbon Street Beat (ABC) | AG105: Adventures in Paradise (ABC) | AI105: Ted Mack and the Original Amateur Hour (ABC) | AJ105: Silent Service | AK105: Seven League Boots | AL105: News--John Salisbury; [11:15] Movie [Academy Art Theater]: TBA | AX105: =A105 -> 22038
A106: 22045 | F106: OMSI Presents | G106: Eye Opener | H106: Uncle Charlie's Roundhouse | J106: Romper Room | K106: Burns and Allen | L106: Rosemary Clooney | M106: The Better Half | N106: Restless Gun (ABC) | O106: Love That Bob! (ABC) | P106: About Faces (ABC) | Q106: Tugboat Annie | R106: Day in Court (ABC) | S106: Gale Storm (ABC) | T106: Beat the Clock (ABC) | U106: Who Do You Trust? (ABC) | V106: American Bandstand (ABC) | W106: High Time | X106: Uncle Charlie's Den | Z106: Three Stooges | AA106: Rin Tin Tin (ABC) | AB106: News Central | AC106: Cheyenne (ABC) | AE106: Bourbon Street Beat (ABC) | AG106: Adventures in Paradise (ABC) | AI106: Ted Mack and the Original Amateur Hour (ABC) | AJ106: Silent Service | AK106: Seven League Boots | AL106: News--John Salisbury; [11:15] Movie [Monday Academy Theater]: Four Men and a Prayer (1938) | AX106: =A106 -> 22045
A107: 22052 | F107: OMSI Presents | G107: Eye Opener | H107: Uncle Charlie's Roundhouse | J107: Romper Room | K107: Burns and Allen | L107: Rosemary Clooney | M107: The Better Half | N107: Restless Gun (ABC) | O107: Love That Bob! (ABC) | P107: About Faces (ABC) | Q107: Tugboat Annie | R107: Day in Court (ABC) | S107: Gale Storm (ABC) | T107: Beat the Clock (ABC) | U107: Who Do You Trust? (ABC) | V107: American Bandstand (ABC) | W107: High Time | X107: Uncle Charlie's Den | Z107: Three Stooges | AA107: Rin Tin Tin (ABC) | AB107: News Central | AC107: Cheyenne (ABC) | AE107: Bourbon Street Beat (ABC) | AG107: Adventures in Paradise (ABC) | AI107: Ted Mack and the Original Amateur Hour (ABC) | AJ107: Silent Service | AK107: Seven League Boots | AL107: News--John Salisbury; [11:15] Movie [Monday Academy Theater]: Wee Geordie (English; 1955) | AX107: =A107 -> 22052
A108: 22059 | F108: OMSI Presents | G108: Eye Opener | H108: Uncle Charlie's Roundhouse | J108: Romper Room | K108: Burns and Allen | L108: Rosemary Clooney | M108: The Better Half | N108: Restless Gun (ABC) | O108: Love That Bob! (ABC) | P108: About Faces (ABC) | Q108: Tugboat Annie | R108: Day in Court (ABC) | S108: Gale Storm (ABC) | T108: Beat the Clock (ABC) | U108: Who Do You Trust? (ABC) | V108: American Bandstand (ABC) | W108: High Time | X108: Uncle Charlie's Den | Z108: Three Stooges | AA108: Rin Tin Tin (ABC) | AB108: News Central | AC108: Cheyenne (ABC) | AE108: Bourbon Street Beat (ABC) | AG108: Adventures in Paradise (ABC) | AI108: Ted Mack and the Original Amateur Hour (ABC) | AJ108: Silent Service | AK108: Seven League Boots | AL108: News--John Salisbury; [11:15] Movie [Movie 12]: Alexander Graham Bell (1939) | AX108: =A108 -> 22059
A110: 22073 | F110: OMSI Presents | G110: Eye Opener | H110: Uncle Charlie's Roundhouse | J110: Romper Room | K110: Burns and Allen | L110: Rosemary Clooney | M110: The Better Half | N110: Restless Gun (ABC) | O110: Love That Bob! (ABC) | P110: About Faces (ABC) | Q110: Tugboat Annie | R110: Day in Court (ABC) | S110: Gale Storm (ABC) | T110: Beat the Clock (ABC) | U110: Who Do You Trust? (ABC) | V110: American Bandstand (ABC) | W110: High Time | X110: Uncle Charlie's Den | Z110: Three Stooges | AA110: Captain Gallant (ABC) | AB110: News Central | AC110: Cheyenne (ABC) | AE110: Bourbon Street Beat (ABC) | AG110: Adventures in Paradise (ABC) | AI110: Ted Mack and the Original Amateur Hour (ABC) | AJ110: Silent Service | AK110: Seven League Boots | AL110: News--John Salisbury; [11:15] Movie [Movie 12]: Where Danger Lives (1950) | AX110: =A110 -> 22073
A111: 22080 | F111: OMSI Presents | G111: Eye Opener | H111: Uncle Charlie's Roundhouse | J111: Romper Room | K111: Burns and Allen | L111: Rosemary Clooney | M111: The Better Half | N111: Restless Gun (ABC) | O111: Love That Bob! (ABC) | P111: About Faces (ABC) | Q111: Tugboat Annie | R111: Day in Court (ABC) | S111: Gale Storm (ABC) | T111: Beat the Clock (ABC) | U111: Who Do You Trust? (ABC) | V111: American Bandstand (ABC) | W111: High Time | X111: Uncle Charlie's Den | Z111: Three Stooges | AA111: Captain Gallant (ABC) | AB111: News Central | AC111: Cheyenne (ABC) | AE111: Bourbon Street Beat (ABC) | AG111: Adventures in Paradise (ABC) | AI111: Ted Mack and the Original Amateur Hour (ABC) | AJ111: Silent Service | AK111: Seven League Boots | AL111: News--John Salisbury; [11:15] Movie [Movie 12]: In Name Only (1939) | AX111: =A111 -> 22080
A112: 22087 | F112: OMSI Presents | G112: Eye Opener | H112: Uncle Charlie's Roundhouse | J112: Romper Room | K112: Burns and Allen | L112: Rosemary Clooney | M112: The Better Half | N112: Restless Gun (ABC) | O112: Love That Bob! (ABC) | P112: About Faces (ABC) | Q112: Tugboat Annie | R112: Day in Court (ABC) | S112: Gale Storm (ABC) | T112: Beat the Clock (ABC) | U112: Who Do You Trust? (ABC) | V112: American Bandstand (ABC) | W112: High Time | X112: Uncle Charlie's Den | Z112: Three Stooges | AA112: Captain Gallant (ABC) | AB112: News Central | AC112: Cheyenne (ABC) | AE112: Bourbon Street Beat (ABC) | AG112: Adventures in Paradise (ABC) | AI112: Ted Mack and the Original Amateur Hour (ABC) | AJ112: Silent Service | AK112: Seven League Boots | AL112: News--John Salisbury; [11:15] Movie [Movie 12]: The Highwayman (1951) | AX112: =A112 -> 22087
A113: 22094 | F113: OMSI Presents | G113: Eye Opener | H113: Uncle Charlie's Roundhouse | J113: Romper Room | K113: It's a Great Life | L113: Rosemary Clooney | M113: The Better Half | N113: Restless Gun (ABC) | O113: Love That Bob! (ABC) | P113: About Faces (ABC) | Q113: Topper | R113: Day in Court (ABC) | S113: Gale Storm (ABC) | T113: Beat the Clock (ABC) | U113: Who Do You Trust? (ABC) | V113: American Bandstand (ABC) | W113: High Time | X113: Uncle Charlie's Den | Z113: Three Stooges | AA113: Captain Gallant (ABC) | AB113: News Central | AC113: Cheyenne (ABC) | AE113: Bourbon Street Beat (ABC) | AG113: Coke Time (ABC) [Special] | AI113: Ted Mack and the Original Amateur Hour (ABC) | AJ113: Silent Service | AK113: Seven League Boots | AL113: News--John Salisbury; [11:15] Movie [Movie 12]: Primrose Path (1940) | AX113: =A113 -> 22094
A114: 22101 | F114: OMSI Presents | G114: Eye Opener | H114: Uncle Charlie's Roundhouse | J114: Romper Room | K114: It's a Great Life | L114: Rosemary Clooney | M114: The Better Half | N114: Restless Gun (ABC) | O114: Love That Bob! (ABC) | P114: About Faces (ABC) | Q114: Topper | R114: Day in Court (ABC) | S114: Gale Storm (ABC) | T114: Beat the Clock (ABC) | U114: Who Do You Trust? (ABC) | V114: American Bandstand (ABC) | W114: High Time | X114: Uncle Charlie's Den | Z114: Three Stooges | AA114: Captain Gallant (ABC) | AB114: News Central | AC114: Cheyenne (ABC) | AE114: Bourbon Street Beat (ABC) | AG114: Adventures in Paradise (ABC) | AI114: Ted Mack and the Original Amateur Hour (ABC) | AJ114: Silent Service | AK114: Seven League Boots | AL114: News--John Salisbury; [11:15] Movie [Movie 12]: Yankee Doodle Dandy (1942) | AX114: =A114 -> 22101
A116: 22115 | F116: OMSI Presents | G116: Eye Opener | H116: Uncle Charlie's Roundhouse | J116: Romper Room | K116: It's a Great Life | L116: Rosemary Clooney | M116: The Better Half | N116: Restless Gun (ABC) | O116: Love That Bob! (ABC) | P116: About Faces (ABC) | Q116: Topper | R116: Day in Court (ABC) | S116: Gale Storm (ABC) | T116: Beat the Clock (ABC) | U116: Who Do You Trust? (ABC) | V116: American Bandstand (ABC) | W116: High Time | X116: Uncle Charlie's Den | Z116: Three Stooges | AA116: Captain Gallant (ABC) | AB116: News Central | AC116: Cheyenne (ABC) | AE116: Bourbon Street Beat (ABC) | AG116: Adventures in Paradise (ABC) | AI116: Ted Mack and the Original Amateur Hour (ABC) | AJ116: Silent Service | AK116: Seven League Boots | AL116: News--John Salisbury; [11:15] Movie [Movie 12]: Underground (1941) | AX116: =A116 -> 22115
A117: 22122 | F117: Republican Convention (ABC) | L117: Rosemary Clooney | M117: The Better Half | N117: TBA | P117: About Faces (ABC) | Q117: Topper | R117: Day in Court (ABC) | S117: Gale Storm (ABC) | T117: Beat the Clock (ABC) | U117: Who Do You Trust? (ABC) | V117: American Bandstand (ABC) | W117: Republican Convention (ABC) | AD117: Cheyenne (ABC) | AF117: Bourbon Street Beat (ABC) | AH117: TBA | AJ117: Silent Service | AK117: Seven League Boots | AL117: News--John Salisbury; [11:15] Movie [Movie 12]: The Seventh Veil (English; 1945) | AX117: =A117 -> 22122
A118: 22129 | F118: OMSI Presents | G118: Eye Opener | H118: Uncle Charlie's Roundhouse | J118: Romper Room | K118: It's a Great Life | L118: Rosemary Clooney | M118: The Better Half | N118: Restless Gun (ABC) | O118: Love That Bob! (ABC) | P118: About Faces (ABC) | Q118: Topper | R118: Day in Court (ABC) | S118: Gale Storm (ABC) | T118: Beat the Clock (ABC) | U118: Who Do You Trust? (ABC) | V118: American Bandstand (ABC) | W118: High Time | X118: Uncle Charlie's Den | Z118: Three Stooges | AA118: Captain Gallant (ABC) | AB118: News Central | AC118: Cheyenne (ABC) | AE118: Bourbon Street Beat (ABC) | AG118: Adventures in Paradise (ABC) | AI118: Ted Mack and the Original Amateur Hour (ABC) | AJ118: Silent Service | AK118: Seven League Boots | AL118: News--John Salisbury; [11:15] Movie [Movie 12]: The Mystery of Edwin Drood (1935) | AX118: =A118 -> 22129
A119: 22136 | F119: OMSI Presents | G119: Eye Opener | H119: Uncle Charlie's Roundhouse | J119: Romper Room | K119: It's a Great Life | L119: Rosemary Clooney | M119: The Better Half | N119: Restless Gun (ABC) | O119: Love That Bob! (ABC) | P119: About Faces (ABC) | Q119: Topper | R119: Day in Court (ABC) | S119: Gale Storm (ABC) | T119: Beat the Clock (ABC) | U119: Who Do You Trust? (ABC) | V119: American Bandstand (ABC) | W119: High Time | X119: Uncle Charlie's Den | Z119: Three Stooges | AA119: Captain Gallant (ABC) | AB119: News Central | AC119: Cheyenne (ABC) | AE119: Bourbon Street Beat (ABC) | AG119: Adventures in Paradise (ABC) | AI119: Ted Mack and the Original Amateur Hour (ABC) | AJ119: Silent Service | AK119: Seven League Boots | AL119: News--John Salisbury; [11:15] Movie [Movie 12]: Perfect Specimen (1937) | AX119: =A119 -> 22136
A120: 22143 | F120: OMSI Presents | G120: Eye Opener | H120: Uncle Charlie's Roundhouse | J120: Romper Room | K120: It's a Great Life | L120: Abbott and Costello | M120: The Better Half | N120: Restless Gun (ABC) | O120: Love That Bob! (ABC) | P120: About Faces (ABC) | Q120: Topper | R120: Day in Court (ABC) | S120: Gale Storm (ABC) | T120: Beat the Clock (ABC) | U120: Who Do You Trust? (ABC) | V120: American Bandstand (ABC) | W120: High Time | X120: Uncle Charlie's Den | Z120: Three Stooges | AA120: Captain Gallant (ABC) | AB120: News Central | AC120: Cheyenne (ABC) | AE120: Bourbon Street Beat (ABC) | AG120: Adventures in Paradise (ABC) | AI120: Ted Mack and the Original Amateur Hour (ABC) | AJ120: Silent Service | AK120: Seven League Boots | AL120: News--John Salisbury; [11:15] Movie [Movie 12]: Out of the Blue (1947) | AX120: =A120 -> 22143
A121: 22150 | F121: OMSI Presents | G121: Eye Opener | H121: Uncle Charlie's Roundhouse | J121: Romper Room | K121: It's a Great Life | L121: Abbott and Costello | M121: The Better Half | N121: Restless Gun (ABC) | O121: Love That Bob! (ABC) | P121: About Faces (ABC) | Q121: Topper | R121: Day in Court (ABC) | S121: Gale Storm (ABC) | T121: Beat the Clock (ABC) | U121: Who Do You Trust? (ABC) | V121: American Bandstand (ABC) | W121: High Time | X121: Uncle Charlie's Den | Z121: Three Stooges | AA121: Captain Gallant (ABC) | AB121: News Central | AC121: Cheyenne (ABC) | AE121: Bourbon Street Beat (ABC) | AG121: Adventures in Paradise (ABC) | AI121: Ted Mack and the Original Amateur Hour (ABC) | AJ121: Silent Service | AK121: Seven League Boots | AL121: News--John Salisbury; [11:15] Movie [Movie 12]: The Mummy (1932) | AX121: =A121 -> 22150
A122: 22157 | F122: OMSI Presents | G122: Eye Opener | H122: Uncle Charlie's Roundhouse | J122: Romper Room | K122: It's a Great Life | L122: Abbott and Costello | M122: The Better Half | N122: Restless Gun (ABC) | O122: Love That Bob! (ABC) | P122: About Faces (ABC) | Q122: Topper | R122: Day in Court (ABC) | S122: Gale Storm (ABC) | T122: Beat the Clock (ABC) | U122: Who Do You Trust? (ABC) | V122: American Bandstand (ABC) | W122: High Time | X122: Uncle Charlie's Den | Z122: Three Stooges | AA122: Captain Gallant (ABC) | AB122: News Central | AC122: Cheyenne (ABC) | AE122: Bourbon Street Beat (ABC) | AG122: Adventures in Paradise (ABC) | AI122: Ted Mack and the Original Amateur Hour (ABC) | AJ122: Silent Service | AK122: Seven League Boots | AL122: News--John Salisbury; [11:15] Movie [Movie 12]: The Finger Points (1931) | AX122: =A122 -> 22157
A123: 22164 | F123: OMSI Presents | G123: Eye Opener | H123: Uncle Charlie's Roundhouse | J123: Romper Room | K123: It's a Great Life | L123: Abbott and Costello | M123: The Better Half | N123: Restless Gun (ABC) | O123: Queen for a Day (ABC) | P123: About Faces (ABC) | Q123: Martin Kane | R123: Day in Court (ABC) | S123: Gale Storm (ABC) | T123: Beat the Clock (ABC) | U123: Who Do You Trust? (ABC) | V123: American Bandstand (ABC) | W123: High Time | X123: Uncle Charlie's Den | Z123: Three Stooges | AA123: Captain Gallant (ABC) | AB123: News Central | AC123: Cheyenne (ABC) | AE123: Bourbon Street Beat (ABC) | AG123: Adventures in Paradise (ABC) | AI123: Ted Mack and the Original Amateur Hour (ABC) | AJ123: Silent Service | AK123: Seven League Boots | AL123: News--John Salisbury; [11:15] Movie [Movie 12]: Love and Learn (1947) | AX123: =A123 -> 22164
A124: 22171 | F124: OMSI Presents | G124: Eye Opener | H124: Uncle Charlie's Roundhouse | J124: Romper Room | K124: It's a Great Life | L124: Abbott and Costello | M124: The Better Half | N124: Restless Gun (ABC) | O124: Queen for a Day (ABC) | P124: About Faces (ABC) | Q124: Martin Kane | R124: Day in Court (ABC) | S124: Gale Storm (ABC) | T124: Beat the Clock (ABC) | U124: Who Do You Trust? (ABC) | V124: American Bandstand (ABC) | W124: High Time | X124: Uncle Charlie's Den | Z124: Three Stooges | AA124: Captain Gallant (ABC) | AB124: News Central | AC124: Cheyenne (ABC) | AE124: Bourbon Street Beat (ABC) | AG124: Adventures in Paradise (ABC) | AI124: Ted Mack and the Original Amateur Hour (ABC) | AJ124: Silent Service | AK124: Seven League Boots | AL124: News--John Salisbury; [11:15] Movie [Movie 12]: Son of Dracula (1943) | AX124: =A124 -> 22171
A125: 22178 | F125: OMSI Presents | G125: Eye Opener | H125: Uncle Charlie's Roundhouse | J125: Romper Room | K125: It's a Great Life | L125: Abbott and Costello | M125: The Better Half | N125: Restless Gun (ABC) | O125: Queen for a Day (ABC) | P125: About Faces (ABC) | Q125: Martin Kane | R125: Day in Court (ABC) | S125: Gale Storm (ABC) | T125: Beat the Clock (ABC) | U125: Who Do You Trust? (ABC) | V125: American Bandstand (ABC) | W125: High Time | X125: Uncle Charlie's Den | Z125: Three Stooges | AA125: Captain Gallant (ABC) | AB125: News Central | AC125: Cheyenne (ABC) | AE125: Bourbon Street Beat (ABC) | AG125: Adventures in Paradise (ABC) | AI125: Ted Mack and the Original Amateur Hour (ABC) | AJ125: Silent Service | AK125: Seven League Boots | AL125: News--John Salisbury; [11:15] Movie [Movie 12]: A Yank in the R.A.F. (1941) | AX125: =A125 -> 22178
B126: OTHER CITIES SWITCH TO STANDARD TIME; PORTLAND SHOWS AIR ONE HOUR LATER | J126: OTHER CITIES SWITCH TO STANDARD TIME; PORTLAND SHOWS AIR ONE HOUR LATER | R126: OTHER CITIES SWITCH TO STANDARD TIME; PORTLAND SHOWS AIR ONE HOUR LATER | Z126: OTHER CITIES SWITCH TO STANDARD TIME; PORTLAND SHOWS AIR ONE HOUR LATER | AH126: OTHER CITIES SWITCH TO STANDARD TIME; PORTLAND SHOWS AIR ONE HOUR LATER | AP126: OTHER CITIES SWITCH TO STANDARD TIME; PORTLAND SHOWS AIR ONE HOUR LATER
A127: 22185 | F127: OMSI Presents | G127: Eye Opener | H127: Uncle Charlie's Roundhouse | J127: Romper Room | K127: The Better Half | L127: It's a Great Life | M127: Medic | N127: Court U.S.A. | O127: The Life of Riley | P127: Restless Gun (ABC) | Q127: Queen for a Day (ABC) | R127: About Faces (ABC) | S127: Decoy | T127: Day in Court (ABC) | U127: Gale Storm (ABC) | V127: Beat the Clock (ABC) | W127: Who Do You Trust? (ABC) | X127: American Bandstand (ABC) | Y127: Uncle Charlie's Den | Z127: Three Stooges | AA127: Captain Gallant (ABC) | AB127: Topper | AC127: News Central | AD127: Silent Service | AE127: Cheyenne (ABC) | AG127: Bourbon Street Beat (ABC) | AI127: Nixon-Kennedy Debate (ABC) [Special] | AK127: Ted Mack and the Original Amateur Hour (ABC) | AL127: News [11:15] Movie [Movie 12]: Framed (1947) | AX127: =A127 -> 22185
A128: 22192 | F128: OMSI Presents | G128: Eye Opener | H128: Uncle Charlie's Roundhouse | J128: Romper Room | K128: The Better Half | L128: It's a Great Life | M128: Medic | N128: Court U.S.A. | O128: The Life of Riley | P128: The Texan (ABC) | Q128: Queen for a Day (ABC) | R128: About Faces (ABC) | S128: Decoy | T128: Day in Court (ABC) | U128: Gale Storm (ABC) | V128: Beat the Clock (ABC) | W128: Who Do You Trust? (ABC) | X128: American Bandstand (ABC) | Y128: Uncle Charlie's Den | Z128: Three Stooges | AA128: Captain Gallant (ABC) | AB128: Topper | AC128: News Central | AD128: Silent Service | AE128: Cheyenne (ABC) | AG128: Surfside 6 (ABC) | AI128: Adventures in Paradise (ABC) | AK128: Peter Gunn (ABC) | AL128: News [11:15] Movie [Movie 12]: The Homestretch (1947) | AX128: =A128 -> 22192
A129: 22199 | F129: OMSI Presents | G129: Eye Opener | H129: Uncle Charlie's Roundhouse | J129: Romper Room | K129: The Better Half | L129: It's a Great Life | M129: Medic | N129: Morning Court (ABC) | O129: Love That Bob! (ABC) | P129: The Texan (ABC) | Q129: Queen for a Day (ABC) | R129: About Faces (ABC) | S129: Decoy | T129: Day in Court (ABC) | U129: Gale Storm (ABC) | V129: Beat the Clock (ABC) | W129: Who Do You Trust? (ABC) | X129: American Bandstand (ABC) | Y129: Uncle Charlie's Den | Z129: Three Stooges | AA129: Captain Gallant (ABC) | AB129: Topper | AC129: News Central | AD129: Silent Service | AE129: Cheyenne (ABC) | AG129: Surfside 6 (ABC) | AI129: Adventures in Paradise (ABC) | AK129: Peter Gunn (ABC) | AL129: News [11:15] Movie [Movie 12]: Secret Beyond the Door (1948) | AX129: =A129 -> 22199
A130: 22206 | F130: OMSI Presents | G130: Eye Opener | H130: Uncle Charlie's Roundhouse | J130: Romper Room | K130: The Better Half | L130: It's a Great Life | M130: Medic | N130: Morning Court (ABC) | O130: Love That Bob! (ABC) | P130: The Texan (ABC) | Q130: Queen for a Day (ABC) | R130: About Faces (ABC) | S130: Decoy | T130: Day in Court (ABC) | U130: Road to Reality (ABC) | V130: Beat the Clock (ABC) | W130: Who Do You Trust? (ABC) | X130: American Bandstand (ABC) | Y130: Uncle Charlie's Den | Z130: Three Stooges | AA130: Captain Gallant (ABC) | AB130: Topper | AC130: News Central | AD130: Silent Service | AE130: Cheyenne (ABC) | AG130: Surfside 6 (ABC) | AI130: Adventures in Paradise (ABC) | AK130: Peter Gunn (ABC) | AL130: News [11:15] Movie [Movie 12]: TBA | AX130: =A130 -> 22206
A131: 22213 | F131: OMSI Presents | G131: Eye Opener | H131: Uncle Charlie's Roundhouse | J131: Romper Room | K131: The Better Half | L131: It's a Great Life | M131: Medic | N131: Morning Court (ABC) | O131: Love That Bob! (ABC) | P131: The Texan (ABC) | Q131: Queen for a Day (ABC) | R131: About Faces (ABC) | S131: Decoy | T131: Day in Court (ABC) | U131: Road to Reality (ABC) | V131: Beat the Clock (ABC) | W131: Who Do You Trust? (ABC) | X131: American Bandstand (ABC) | Y131: Uncle Charlie's Den | Z131: Three Stooges | AA131: Captain Gallant (ABC) | AB131: Topper | AC131: News Central | AD131: Silent Service | AE131: Cheyenne (ABC) | AG131: Surfside 6 (ABC) | AI131: Adventures in Paradise (ABC) | AK131: Peter Gunn (ABC) | AL131: News [11:15] Movie [Movie 12]: Ramrod (1947) | AX131: =A131 -> 22213
A132: 22220 | F132: OMSI Presents | G132: Eye Opener | H132: Uncle Charlie's Roundhouse | J132: Romper Room | K132: The Better Half | L132: It's a Great Life | M132: Medic | N132: Morning Court (ABC) | O132: Love That Bob! (ABC) | P132: The Texan (ABC) | Q132: Queen for a Day (ABC) | R132: About Faces (ABC) | S132: Decoy | T132: Day in Court (ABC) | U132: Road to Reality (ABC) | V132: Beat the Clock (ABC) | W132: Who Do You Trust? (ABC) | X132: American Bandstand (ABC) | Y132: Uncle Charlie's Den | Z132: Three Stooges | AA132: Captain Gallant (ABC) | AB132: Topper | AC132: News Central | AD132: Silent Service | AE132: Cheyenne (ABC) | AG132: Surfside 6 (ABC) | AI132: Adventures in Paradise (ABC) | AK132: Peter Gunn (ABC) | AL132: News [11:15] Movie [Movie 12]: Ramrod (1947) | AX132: =A132 -> 22220
A133: 22227 | F133: OMSI Presents | G133: Eye Opener | H133: Uncle Charlie's Roundhouse | J133: Romper Room | K133: The Better Half | L133: It's a Great Life | M133: Medic | N133: Morning Court (ABC) | O133: Love That Bob! (ABC) | P133: The Texan (ABC) | Q133: Queen for a Day (ABC) | R133: About Faces (ABC) | S133: Decoy | T133: Day in Court (ABC) | U133: Road to Reality (ABC) | V133: Beat the Clock (ABC) | W133: Who Do You Trust? (ABC) | X133: American Bandstand (ABC) | Y133: Uncle Charlie's Den | Z133: Three Stooges | AA133: Captain Gallant (ABC) | AB133: Topper | AC133: News Central | AD133: Silent Service | AE133: Cheyenne (ABC) | AG133: Surfside 6 (ABC) | AI133: Adventures in Paradise (ABC) | AK133: Peter Gunn (ABC) | AL133: Political Talk--Republican | AX133: =A133 -> 22227
A134: 22234 | F134: OMSI Presents | G134: Eye Opener | H134: Uncle Charlie's Roundhouse | J134: Romper Room | K134: The Better Half | L134: It's a Great Life | M134: Medic | N134: Morning Court (ABC) | O134: Love That Bob! (ABC) | P134: The Texan (ABC) | Q134: Beat the Clock (ABC) | R134: About Faces (ABC) | S134: Decoy | T134: Day in Court (ABC) | U134: Road to Reality (ABC) | V134: Queen for a Day (ABC) | W134: Who Do You Trust? (ABC) | X134: American Bandstand (ABC) | Y134: Uncle Charlie's Den | Z134: Three Stooges | AA134: Captain Gallant (ABC) | AB134: Topper | AC134: News Central | AD134: Silent Service | AE134: Cheyenne (ABC) | AG134: Surfside 6 (ABC) | AI134: Spirit of the Alamo (ABC) [Special] | AK134: Peter Gunn (ABC) | AL134: News [11:15] Movie [Movie 12]: Finger of Guilt (English; 1956) | AX134: =A134 -> 22234
A135: 22241 | F135: OMSI Presents | G135: Eye Opener | H135: Uncle Charlie's Roundhouse | J135: Romper Room | K135: The Better Half | L135: It's a Great Life | M135: Medic | N135: Morning Court (ABC) | O135: Love That Bob! (ABC) | P135: The Texan (ABC) | Q135: Beat the Clock (ABC) | R135: About Faces (ABC) | S135: Decoy | T135: Day in Court (ABC) | U135: Road to Reality (ABC) | V135: Queen for a Day (ABC) | W135: Who Do You Trust? (ABC) | X135: American Bandstand (ABC) | Y135: Uncle Charlie's Den | Z135: Three Stooges | AA135: Captain Gallant (ABC) | AB135: Topper | AC135: News Central | AD135: Silent Service | AE135: Cheyenne (ABC) | AG135: Surfside 6 (ABC) | AI135: Adventures in Paradise (ABC) | AK135: Peter Gunn (ABC) | AL135: News [11:15] Movie [Movie 12]: Dragoon Wells Massacre (1957) | AX135: =A135 -> 22241
A136: 22248 | F136: OMSI Presents | G136: Eye Opener | H136: Uncle Charlie's Roundhouse | J136: Romper Room | K136: The Better Half | L136: It's a Great Life | M136: Medic | N136: Morning Court (ABC) | O136: Love That Bob! (ABC) | P136: The Texan (ABC) | Q136: Beat the Clock (ABC) | R136: About Faces (ABC) | S136: Decoy | T136: Day in Court (ABC) | U136: Road to Reality (ABC) | V136: Queen for a Day (ABC) | W136: Who Do You Trust? (ABC) | X136: American Bandstand (ABC) | Y136: Uncle Charlie's Den | Z136: Three Stooges | AA136: Captain Gallant (ABC) | AB136: Topper | AC136: News Central | AD136: Silent Service | AE136: Cheyenne (ABC) | AG136: Surfside 6 (ABC) | AI136: Adventures in Paradise (ABC) | AK136: Peter Gunn (ABC) | AL136: News [11:15] Movie [Movie 12]: The Very Thought of You (1944) | AX136: =A136 -> 22248
A137: 22255 | F137: OMSI Presents | G137: Eye Opener | H137: Jeff's Collie | I137: Jeff's Collie | J137: Romper Room | K137: The Better Half | L137: It's a Great Life | M137: Medic | N137: Morning Court (ABC) | O137: Love That Bob! (ABC) | P137: The Texan (ABC) | Q137: Beat the Clock (ABC) | R137: About Faces (ABC) | S137: Decoy | T137: Day in Court (ABC) | U137: Road to Reality (ABC) | V137: Queen for a Day (ABC) | W137: Who Do You Trust? (ABC) | X137: American Bandstand (ABC) | Y137: Uncle Charlie's Den | Z137: Three Stooges | AA137: Captain Gallant (ABC) | AB137: Topper | AC137: News Central | AD137: Silent Service | AE137: Cheyenne (ABC) | AG137: Surfside 6 (ABC) | AI137: Adventures in Paradise (ABC) | AK137: Peter Gunn (ABC) | AL137: News [11:15] Movie [Movie 12]: The Broken Star (1956) | AX137: =A137 -> 22255
A138: 22262 | F138: OMSI Presents | G138: Eye Opener | H138: Jeff's Collie | I138: Jeff's Collie | J138: Romper Room | K138: The Better Half | L138: It's a Great Life | M138: Medic | N138: Morning Court (ABC) | O138: Love That Bob! (ABC) | P138: The Texan (ABC) | Q138: Beat the Clock (ABC) | R138: About Faces (ABC) | S138: Decoy | T138: Day in Court (ABC) | U138: Road to Reality (ABC) | V138: Queen for a Day (ABC) | W138: Who Do You Trust? (ABC) | X138: American Bandstand (ABC) | Y138: Uncle Charlie's Den | Z138: Three Stooges | AA138: Captain Gallant (ABC) | AB138: Topper | AC138: News Central | AD138: Silent Service | AE138: Cheyenne (ABC) | AG138: Surfside 6 (ABC) | AI138: Adventures in Paradise (ABC) | AK138: Peter Gunn (ABC) | AL138: News [11:15] Movie [Movie 12]: Christmas Holiday (1944) | AX138: =A138 -> 22262
A139: 22269 | F139: OMSI Presents | G139: Eye Opener | H139: Jeff's Collie | I139: Jeff's Collie | J139: Romper Room | K139: The Better Half | L139: It's a Great Life | M139: Medic | N139: Morning Court (ABC) | O139: Love That Bob! (ABC) | P139: The Texan (ABC) | Q139: Beat the Clock (ABC) | R139: About Faces (ABC) | S139: Decoy | T139: Day in Court (ABC) | U139: Road to Reality (ABC) | V139: Queen for a Day (ABC) | W139: Who Do You Trust? (ABC) | X139: American Bandstand (ABC) | Y139: Uncle Charlie's Den | Z139: Three Stooges | AA139: Captain Gallant (ABC) | AB139: Topper | AC139: News Central | AD139: Silent Service | AE139: Cheyenne (ABC) | AG139: Surfside 6 (ABC) | AI139: Adventures in Paradise (ABC) | AK139: Peter Gunn (ABC) | AL139: News [11:15] Movie [Movie 12]: Portrait of Jennie (1949) | AX139: =A139 -> 22269
A140: 22276 | F140: OMSI Presents | G140: Eye Opener | H140: Jeff's Collie | I140: Jeff's Collie | J140: Jeff's Collie | K140: Movie: I'll Be Seeing You (1944) | N140: Morning Court (ABC) | O140: Love That Bob! (ABC) | P140: The Texan (ABC) | Q140: Beat the Clock (ABC) | R140: About Faces (ABC) | S140: Decoy | T140: Day in Court (ABC) | U140: Road to Reality (ABC) | V140: Queen for a Day (ABC) | W140: Who Do You Trust? (ABC) | X140: American Bandstand (ABC) | Y140: Uncle Charlie's Den | Z140: Three Stooges | AA140: Captain Gallant (ABC) | AB140: Topper | AC140: News Central | AD140: Silent Service | AE140: Cheyenne (ABC) | AG140: Surfside 6 (ABC) | AI140: Adventures in Paradise (ABC) | AK140: Peter Gunn (ABC) | AL140: News--William Lambert [11:15] Movie [Movie 12]: Never to Love (1940) | AX140: =A140 -> 22276
A141: 1961 | AX141: =A141 -> 1961
A142: 22283 | F142: OMSI Presents | G142: Eye Opener | H142: Uncle Charlie's Roundhouse | I142: Tournament of Roses Parade (ABC) | N142: Morning Court (ABC) | O142: TBA | P142: TBA | Q142: Beat the Clock (ABC) | R142: About Faces (ABC) | S142: Decoy | T142: Day in Court (ABC) | U142: Road to Reality (ABC) | V142: Queen for a Day (ABC) | W142: Who Do You Trust? (ABC) | X142: American Bandstand (ABC) | Y142: Uncle Charlie's Den | Z142: Three Stooges | AA142: Captain Gallant (ABC) | AB142: Topper | AC142: News Central | AD142: Silent Service | AE142: Cheyenne (ABC) | AG142: Surfside 6 (ABC) | AI142: Adventures in Paradise (ABC) | AK142: Peter Gunn (ABC) | AL142: News [11:15] Movie [Movie 12]: The Purple Plain (English; 1954) | AX142: =A142 -> 22283
A146: 1962 | AX146: =A146 -> 1962
A148: 1963 | AX148: =A148 -> 1963
A150: 23165 | E150: [6:45] Telecourse | G150: Cartoon Capers; [7:45] Dr. Zoom's Cartoons; [8:15] King Leonardo | I150: Romper Room | J150: Jack LaLanne | K150: News--Ed Arndt; [9:35] Movie: M'Liss (1936) | N150: The Life of Riley | O150: Seven Keys (ABC) | P150: Ernie Ford | Q150: Father Knows Best | R150: General Hospital (ABC) | S150: Girl Talk | T150: Day in Court; [2:25] News | U150: Jayne Wyman | V150: Queen for a Day | W150: Who Do You Trust? | X150: American Bandstand (ABC) | Y150: Discovery '63; [4:55] American Newsstand | Z150: Three Stooges | AA150: Popeye Theater | AB150: Cartoon Castle | AC150: News--Sanders, Arndt; [6:45] ABC News | AD150: The Lawman | AE150: Dakotas (ABC) | AG150: Rifleman (ABC) | AH150: Stoney Burke (ABC) | AJ150: Ben Casey (ABC) | AL150: News, Sports | AM150: Movie: Don't Bother to Knock (1952) | AP150: Movie: She Wore a Yellow Ribbon (1949) | AX150: 23165
A152: 1964 | AX152: 1964
A153: 23431 | G153: Cartoon Capers; [7:45] Dr. Zoom's Cartoons; [8:15] King Leonardo | I153: Cartoon Castle | J153: Jack LaLanne | K153: Way of Life | L153: The Life of Riley | M153: Burns and Allen | N153: The Price is Right (ABC) | O153: The Object Is (ABC) | P153: Seven Keys (ABC) | Q153: Father Knows Best (ABC) | R153: Tennessee Ernie Ford (ABC) | S153: Girl Talk | T153: Peter Gunn | U153: Day in Court (ABC); [2:55] News (ABC) | V153: General Hospital (ABC) | W153: Queen for a Day (ABC) | X153: The Trailmaster (ABC | Z153: The Mickey Mouse Club | AA153: Popeye's Pier 12 | AB153: The Rifleman | AC153: Wanted--Dead or Alive | AD153: The Lawman | AE153: The Outer Limits (ABC) | AG153: Wagon Train (ABC) | AJ153: Breaking Point (ABC) | AL153: News | AM153: Movie: The Monster and the Girl (1941) | AX153: =A153 -> 23431
B154: KPTV BECOMES INDEPENDENT | J154: KPTV BECOMES INDEPENDENT | R154: KPTV BECOMES INDEPENDENT | Z154: KPTV BECOMES INDEPENDENT | AH154: KPTV BECOMES INDEPENDENT | AP154: KPTV BECOMES INDEPENDENT
A155: 23437 | G155: The Three Stooges; [7:45] Dr. Zoom's Cartoons; [8:15] King Leonardo | I155: Cartoon Castle | J155: Jack LaLanne | K155: Movie: TBA | O155: Ramar of the Jungle | P155: Robin Hood | Q155: Burns and Allen | R155: The Life of Riley | S155: Girl Talk | T155: Movie: The Great McGinty (1940) | X155: News Central--Ed Arndt; [4:15] People Are Funny | Y155: [4:45] The Mickey Mouse Club | Z155: [5:15] Rocky and His Friends | AA155: Popeye's Pier 12 | AB155: The Rifleman | AC155: Wanted--Dead or Alive | AD155: The Lawman | AE155: Dick Powell Theater | AG155: The Detectives | AI155: News Central--Ed Arndt | AJ155: Movie: Blue Skies (1946) | AX155: =A155 -> 23437
A156: 23444 | G156: The Three Stooges; [7:45] Dr. Zoom's Cartoons; [8:15] King Leonardo | I156: Cartoon Castle | J156: Jack LaLanne | K156: Movie: TBA | O156: Ramar of the Jungle | P156: Robin Hood | Q156: Burns and Allen | R156: The Life of Riley | S156: Girl Talk | T156: Movie: Kiss the Boys Goodbye (1941) | X156: News Central--Ed Arndt; [4:15] People Are Funny | Y156: [4:45] The Mickey Mouse Club | Z156: [5:15] Rocky and His Friends | AA156: Popeye's Pier 12 | AB156: The Rifleman | AC156: Wanted--Dead or Alive | AD156: The Lawman | AE156: Dick Powell Theater | AG156: The Detectives | AI156: News Central--Ed Arndt | AJ156: Movie: Here Come the WAVES (1944) | AX156: =A156 -> 23444
AX157: =A157 -> 0
A158: 1965 | AX158: 1965
A159: 23998 | K159: [9:45] News, Weather | L159: Film Feature--Education | M159: Jack La Lanne | N159: 12 in the Morning | O159: Sergeant Preston | P159: Cartoon Castle [Dr. Zoom] | R159: Girl Talk | S159: Movie: Adventures of a Rookie (1943) | V159: [3:15] News--Duane Bock | W159: Touch Turtle | X159: [4:15] Rocky and Friends | Y159: Popeye's Pier 12 | Z159: Lloyd Thaxton | AB159: Woody Woodpecker | AC159: Trackdown | AD159: The Rifleman | AE159: Vagabond | AF159: Cheyenne | AH159: Dick Powell Theater | AJ159: Let's Go Golfing | AK159: Movie: Two Tickets to Broadway (1951) | AX159: =A159 -> 23998
A160: 24005 | K160: [9:45] News, Weather | L160: Public Service | M160: Jack La Lanne | N160: 12 in the Morning | O160: Sergeant Preston | P160: Cartoon Castle [Dr. Zoom] | R160: Girl Talk | S160: Movie: Sooky (1931) | V160: [3:15] News--Duane Bock | W160: Touch Turtle | X160: [4:15] Rocky and Friends | Y160: Popeye's Pier 12 | Z160: Lloyd Thaxton | AB160: Woody Woodpecker | AC160: Trackdown | AD160: The Rifleman | AE160: Vagabond | AF160: Cheyenne | AH160: Dick Powell Theater | AJ160: Let's Go Golfing | AK160: Auto Racing | AL160: Sports Final; [11:05] Movie: Till the End of Time (1946) | AX160: =A160 -> 24005
A163: 1970 | AX163: 1970
A164: 25573 | F164: Telecourse | G164: The Flintstones | H164: Hobo Kelly | J164: The Patty Duke Show | K164: The Wonderful World of Women | L164: Movie [Morning Movie 12]: Carson City (1952) | O164: Fashions in Sewing; [11:40] 12 in the Morning; [11:50] News--Don Stellges | P164: Rusty Nails' Cartoons | R164: The Movie Game | S164: Portrait | U164: The Galloping Gourmet | V164: The Three O'Clock News--Don Stellges/ Jimmy Jones/ Bill Swing | W164: He Said! She Said! | X164: Beat the Clock | Y164: Popeye's Pier 12 | Z164: The Flintstones | AA164: Sea Hunt | AB164: Gilligan's Island | AC164: The Invaders | AE164: Perry Mason | AG164: The David Frost Show | AJ164: The 10 O'Clock News--Don Stellges | AK164: Felony Squad | AL164: Movie [Movie 12]: Underwater Warrior (1958) | AX164: 25573
A165: =A164+7 -> 25580 | F165: Telecourse | G165: The Flintstones | H165: Hobo Kelly | J165: The Patty Duke Show | K165: The Wonderful World of Women | L165: Movie [Morning Movie 12]: That Lady in Ermine (1948) | O165: Fashions in Sewing; [11:40] 12 in the Morning; [11:50] News--Don Stellges | P165: Rusty Nails' Cartoons | R165: The Movie Game | S165: Run for Your Life | U165: The Galloping Gourmet | V165: The Three O'Clock News--Don Stellges/ Jimmy Jones/ Bill Swing | W165: He Said! She Said! | X165: Beat the Clock | Y165: Popeye's Pier 12 | Z165: The Flintstones | AA165: Sea Hunt | AB165: Gilligan's Island | AC165: Star Trek | AE165: Perry Mason | AG165: The David Frost Show | AJ165: The 10 O'Clock News--Don Stellges | AK165: Felony Squad | AL165: Movie [Movie 12]: The Camp on Blood Island (1958) | AX165: =A165 -> 25580
A166: =A165+7 -> 25587
A167: =A166+7 -> 25594 | F167: Telecourse | G167: The Flintstones | H167: Hobo Kelly | J167: The Patty Duke Show | K167: The Wonderful World of Women | L167: Movie [Morning Movie 12]: The Tanks Are Coming (1951) | O167: Fashions in Sewing; [11:40] 12 in the Morning; [11:50] News--Don Stellges | P167: Rusty Nails' Cartoons | R167: The Movie Game | S167: Run for Your Life | U167: The Galloping Gourmet | V167: The Three O'Clock News--Don Stellges/ Jimmy Jones/ Bill Swing | W167: He Said! She Said! | X167: Beat the Clock | Y167: Popeye's Pier 12 | Z167: The Flintstones | AA167: Sea Hunt | AB167: Gilligan's Island | AC167: Star Trek | AE167: Perry Mason | AG167: The David Frost Show | AJ167: The 10 O'Clock News-- Don Stellges/ Michael Hartfield/ Jimmy Jones | AK167: Felony Squad | AL167: Movie [Movie 12]: Force of Arms (1951) | AX167: =A167 -> 25594
A168: =A167+7 -> 25601 | F168: Telecourse | G168: The Flintstones | H168: Hobo Kelly | J168: The Patty Duke Show | K168: The Wonderful World of Women | L168: Movie [Morning Movie 12]: Dressed to Kill (1946) | O168: Fashions in Sewing; [11:40] 12 in the Morning; [11:50] News--Don Stellges | P168: Rusty Nails' Cartoons | R168: The Movie Game | S168: Run for Your Life | U168: The Galloping Gourmet | V168: The Three O'Clock News--Don Stellges/ Jimmy Jones/ Bill Swing | W168: He Said! She Said! | X168: Beat the Clock | Y168: Popeye's Pier 12 | Z168: The Flintstones | AA168: Sea Hunt | AB168: Gilligan's Island | AC168: Star Trek | AE168: Perry Mason | AG168: The David Frost Show | AJ168: The 10 O'Clock News-- Don Stellges/ Michael Hartfield/ Jimmy Jones | AK168: Felony Squad | AL168: Movie [Movie 12]: Fixed Bayonets (1951) | AX168: =A168 -> 25601
A169: =A168+7 -> 25608 | F169: Telecourse | G169: The Flintstones | H169: Hobo Kelly | J169: The Patty Duke Show | K169: The Wonderful World of Women | L169: Movie [Morning Movie 12]: Return of the Texan (1952) | O169: Fashions in Sewing; [11:40] 12 in the Morning; [11:50] News--Don Stellges | P169: Rusty Nails' Cartoons | R169: The Movie Game | S169: Run for Your Life | U169: The Galloping Gourmet | V169: The Three O'Clock News--Don Stellges/ Jimmy Jones/ Bill Swing | W169: He Said! She Said! | X169: Beat the Clock | Y169: Popeye's Pier 12 | Z169: The Flintstones | AA169: Sea Hunt | AB169: Gilligan's Island | AC169: Star Trek | AE169: Perry Mason | AG169: The David Frost Show | AJ169: The 10 O'Clock News-- Don Stellges/ Michael Hartfield/ Jimmy Jones | AK169: Felony Squad | AL169: Movie [Movie 12]: The Wings of Eagles (1957) | AX169: =A169 -> 25608
A170: =A169+7 -> 25615 | F170: Telecourse | G170: The Flintstones | H170: Hobo Kelly | J170: The Patty Duke Show | K170: The Wonderful World of Women | L170: Movie [Morning Movie 12]: Rocky Mountain (1950) | O170: Fashions in Sewing; [11:40] 12 in the Morning; [11:50] News--Don Stellges | P170: Rusty Nails' Cartoons | R170: The Movie Game | S170: Run for Your Life | U170: The Galloping Gourmet | V170: The Three O'Clock News--Don Stellges/ Jimmy Jones/ Bill Swing | W170: He Said! She Said! | X170: Beat the Clock | Y170: Popeye's Pier 12 | Z170: The Flintstones | AA170: Sea Hunt | AB170: Gilligan's Island | AC170: Star Trek | AE170: Perry Mason | AG170: The David Frost Show | AJ170: The 10 O'Clock News-- Don Stellges/ Michael Hartfield/ Jimmy Jones | AK170: Felony Squad | AL170: Movie [Movie 12]: 36 Hours (1964) | AX170: =A170 -> 25615
A171: =A170+7 -> 25622 | F171: Telecourse | G171: The Flintstones | H171: Hobo Kelly | J171: The Patty Duke Show | K171: The Wonderful World of Women | L171: Movie [Morning Movie 12]: Holiday Inn (1942) | O171: Fashions in Sewing; [11:40] 12 in the Morning; [11:50] News--Don Stellges | P171: Rusty Nails' Cartoons | R171: The Movie Game | S171: Run for Your Life | U171: The Galloping Gourmet | V171: The Three O'Clock News--Don Stellges/ Jimmy Jones/ Bill Swing | W171: He Said! She Said! | X171: Beat the Clock | Y171: Popeye's Pier 12 | Z171: The Flintstones | AA171: Sea Hunt | AB171: Gilligan's Island | AC171: Star Trek | AE171: Felony Squad | AF171: WHL Hockey: Portland Buckaroos vs Seattle Totems | AK171: The 10 O'Clock News-- Don Stellges/ Michael Hartfield/ Jimmy Jones | AL171: Movie [Movie 12]: A Gathering of Eagles (1962) | AX171: =A171 -> 25622
A172: =A171+7 -> 25629
A173: =A172+7 -> 25636 | F173: Telecourse | G173: The Flintstones | H173: Hobo Kelly | J173: The Patty Duke Show | K173: The Wonderful World of Women | L173: Movie [Morning Movie 12]: Land of the Pharaohs (1955) | O173: Fashions in Sewing; [11:40] 12 in the Morning; [11:50] News--Don Stellges | P173: Rusty Nails' Cartoons | R173: The Movie Game | S173: Run for Your Life | U173: The Galloping Gourmet | V173: The Three O'Clock News--Don Stellges/ Jimmy Jones/ Bill Swing | W173: He Said! She Said! | X173: Beat the Clock | Y173: Popeye's Pier 12 | Z173: The Flintstones | AA173: Sea Hunt | AB173: Gilligan's Island | AC173: Star Trek | AE173: Perry Mason | AG173: The David Frost Show | AJ173: The 10 O'Clock News-- Don Stellges/ Michael Hartfield/ Jimmy Jones | AK173: Felony Squad | AL173: Movie [Movie 12]: The Enemy General (1960) | AX173: =A173 -> 25636
A174: =A173+7 -> 25643 | F174: Telecourse | G174: The Flintstones | H174: Hobo Kelly | J174: The Patty Duke Show | K174: The Wonderful World of Women | L174: Movie [Morning Movie 12]: Lullaby of Broadway (1951) | O174: Fashions in Sewing; [11:40] 12 in the Morning; [11:55] News--Larry Curran | P174: Rusty Nails' Cartoons | R174: The Movie Game | S174: Hawaii Calls | T174: Faces and Places | U174: The Galloping Gourmet | V174: The Three O'Clock News--Don Stellges/ Jimmy Jones/ Bill Swing | W174: He Said! She Said! | X174: Beat the Clock | Y174: Popeye's Pier 12 | Z174: The Flintstones | AA174: Sea Hunt | AB174: Gilligan's Island | AC174: Star Trek | AE174: Perry Mason | AG174: The David Frost Show | AJ174: The 10 O'Clock News-- Don Stellges/ Michael Hartfield/ Jimmy Jones | AK174: Felony Squad | AL174: Movie [Movie 12]: Lafayette Escadrille (1958) | AX174: =A174 -> 25643
A175: =A174+7 -> 25650 | F175: Telecourse | G175: The Flintstones | H175: Hobo Kelly | J175: The Patty Duke Show | K175: The Wonderful World of Women | L175: Movie [Morning Movie 12]: Satellite in the Sky (1956) | O175: Fashions in Sewing; [11:40] 12 in the Morning; [11:50] News--Larry Curran | P175: Rusty Nails' Cartoons | R175: The Movie Game | S175: Hawaii Calls | T175: Faces and Places | U175: The Galloping Gourmet | V175: The Three O'Clock News--Don Stellges/ Jimmy Jones/ Bill Swing | W175: He Said! She Said! | X175: Beat the Clock | Y175: Popeye's Pier 12 | Z175: The Flintstones | AA175: Sea Hunt | AB175: Gilligan's Island | AC175: Star Trek | AE175: Perry Mason | AG175: The David Frost Show | AJ175: The 10 O'Clock News-- Don Stellges/ Michael Hartfield/ Jimmy Jones | AK175: Felony Squad | AL175: Movie [Movie 12]: Operation Pacific (1951) | AX175: =A175 -> 25650
A176: =A175+7 -> 25657 | F176: Telecourse | G176: The Flintstones | H176: Hobo Kelly | J176: The Patty Duke Show | K176: The Wonderful World of Women | L176: Income Tax (Special) | O176: Fashions in Sewing; [11:40] 12 in the Morning; [11:50] News--Larry Curran | P176: Rusty Nails' Cartoons | R176: The Movie Game | S176: Hawaii Calls | T176: Faces and Places | U176: The Galloping Gourmet | V176: The Three O'Clock News--Don Stellges/ Jimmy Jones/ Bill Swing | W176: He Said! She Said! | X176: Beat the Clock | Y176: Popeye's Pier 12 | Z176: The Flintstones | AA176: Sea Hunt | AB176: Gilligan's Island | AC176: Star Trek | AE176: Perry Mason | AG176: The David Frost Show | AJ176: The 10 O'Clock News-- Don Stellges/ Michael Hartfield/ Jimmy Jones | AK176: Felony Squad | AL176: Movie [Movie 12]: The D.I. (no date) | AX176: =A176 -> 25657
A177: =A176+7 -> 25664
A178: =A177+7 -> 25671 | F178: Telecourse | G178: The Flintstones | H178: Hobo Kelly | J178: The Patty Duke Show | K178: The Wonderful World of Women | L178: Movie [Morning Movie 12]: The Green-Eyed Blonde (1957) | O178: Fashions in Sewing; [11:40] 12 in the Morning; [11:50] News--Larry Curran | P178: Rusty Nails' Cartoons | R178: The Movie Game | S178: The Naked City | U178: The Galloping Gourmet | V178: The Three O'Clock News--Don Stellges/ Jimmy Jones/ Bill Swing | W178: Portland Schools (Special) | Y178: Popeye's Pier 12 | Z178: The Addams Family | AA178: Sea Hunt | AB178: Gilligan's Island | AC178: Star Trek | AE178: Portland Schools (Special) | AG178: The David Frost Show | AJ178: The 10 O'Clock News-- Don Stellges/ Michael Hartfield/ Jimmy Jones | AK178: Felony Squad | AL178: Movie [Movie 12]: Backfire (1950) | AX178: =A178 -> 25671
A179: =A178+7 -> 25678 | F179: Telecourse | G179: The Flintstones | H179: Hobo Kelly | J179: The Patty Duke Show | K179: The Wonderful World of Women | L179: Movie [Morning Movie 12]: Don't Bother to Knock (1952) | O179: Fashions in Sewing; [11:40] 12 in the Morning; [11:50] News--Larry Curran | P179: Rusty Nails' Cartoons | R179: The Movie Game | S179: The Naked City | U179: The Galloping Gourmet | V179: The Three O'Clock News--Don Stellges/ Jimmy Jones/ Bill Swing | W179: He Said! She Said! | X179: Beat the Clock | Y179: Popeye's Pier 12 | Z179: The Addams Family | AA179: Sea Hunt | AB179: Gilligan's Island | AC179: Star Trek | AE179: Perry Mason | AG179: The David Frost Show | AJ179: The 10 O'Clock News-- Don Stellges/ Michael Hartfield/ Jimmy Jones | AK179: Felony Squad | AL179: Movie [Movie 12]: Hannibal (1960) | AX179: =A179 -> 25678
A180: =A179+7 -> 25685
A181: =A180+7 -> 25692 | F181: Telecourse | G181: The Flintstones | H181: Hobo Kelly | J181: The Patty Duke Show | K181: The Wonderful World of Women | L181: Movie [Morning Movie 12]: That Night in Rio (1941) | O181: Fashions in Sewing; [11:40] 12 in the Morning; [11:50] News--Larry Curran | P181: Rusty Nails' Cartoons | R181: The Movie Game | S181: The Naked City | U181: The Galloping Gourmet | V181: The Three O'Clock News--Don Stellges/ Jimmy Jones/ Bill Swing | W181: He Said! She Said! | X181: Beat the Clock | Y181: Popeye's Pier 12 | Z181: The Addams Family | AA181: Sea Hunt | AB181: Gilligan's Island | AC181: Star Trek | AE181: Perry Mason | AG181: The David Frost Show | AJ181: The 10 O'Clock News-- Don Stellges/ Michael Hartfield/ Jimmy Jones | AK181: Felony Squad | AL181: Movie [Movie 12]: Band of Angels (1957) | AX181: =A181 -> 25692
A182: =A181+7 -> 25699 | F182: Telecourse | G182: The Flintstones | H182: Hobo Kelly | J182: The Patty Duke Show | K182: The Wonderful World of Women | L182: Movie [Morning Movie 12]: Buck Privates (1941) | O182: Fashions in Sewing; [11:40] 12 in the Morning; [11:50] News--Larry Curran | P182: Rusty Nails' Cartoons | R182: The Movie Game | S182: The Naked City | U182: The Galloping Gourmet | V182: The Three O'Clock News--Don Stellges/ Jimmy Jones/ Bill Swing | W182: He Said! She Said! | X182: Beat the Clock | Y182: Popeye's Pier 12 | Z182: The Addams Family | AA182: Gilligan's Island | AB182: Star Trek | AD182: Boxing: Marcel Cerdan Jr. vs Donato Paduano from New York | AF182: McHale's Navy | AG182: The David Frost Show | AJ182: The 10 O'Clock News-- Don Stellges/ Michael Hartfield/ Jimmy Jones | AK182: The Honey-mooners | AL182: Movie [Movie 12]: Andy (1965) | AX182: =A182 -> 25699
A183: =A182+7 -> 25706
A184: =A183+7 -> 25713 | F184: Telecourse | G184: The Flintstones | H184: Hobo Kelly | J184: The Patty Duke Show | K184: The Wonderful World of Women | L184: Movie [Morning Movie 12]: In Society (1944) | O184: Fashions in Sewing; [11:40] 12 in the Morning; [11:50] News--Larry Curran | P184: Rusty Nails' Cartoons | R184: The Movie Game | S184: The Naked City | U184: The Galloping Gourmet | V184: The Three O'Clock News--Don Stellges/ Jimmy Jones/ Bill Swing | W184: He Said! She Said! | X184: Beat the Clock | Y184: Popeye's Pier 12 | Z184: The Addams Family | AA184: Sea Hunt | AB184: Gilligan's Island | AC184: Star Trek | AE184: Perry Mason | AG184: The David Frost Show | AJ184: The 10 O'Clock News-- Don Stellges/ Michael Hartfield/ Jimmy Jones | AK184: The Honey-mooners | AL184: Movie [Movie 12]: Lizzie (1957) | AX184: =A184 -> 25713
A185: =A184+7 -> 25720 | F185: Telecourse | G185: The Flintstones | H185: Hobo Kelly | J185: The Patty Duke Show | K185: The Wonderful World of Women | L185: Movie [Morning Movie 12]: Belles on Their Toes (1952) | O185: 12 in the Morning; [11:40] News--Larry Curran | P185: Rusty Nails' Cartoons | R185: The Movie Game | S185: The Untouchables | U185: The Galloping Gourmet | V185: The Three O'Clock News--Don Stellges/ Jimmy Jones/ Bill Swing; [3:20] Fashions in Sewing | W185: Intergroup Relations | X185: Beat the Clock | Y185: Popeye's Pier 12 | Z185: The Addams Family | AA185: Sea Hunt | AB185: Gilligan's Island | AC185: Star Trek | AE185: Perry Mason | AG185: The David Frost Show | AJ185: The 10 O'Clock News-- Don Stellges/ Michael Hartfield/ Jimmy Jones | AK185: The Honey-mooners | AL185: Movie [Movie 12]: Bright Leaf (1950) | AX185: =A185 -> 25720
A186: =A185+7 -> 25727 | F186: Telecourse | G186: The Flintstones | H186: Hobo Kelly | J186: The Patty Duke Show | K186: The Wonderful World of Women | L186: Movie [Morning Movie 12]: Goodbye, My Lady (1956) | O186: 12 in the Morning; [11:40] News--Larry Curran | P186: Rusty Nails' Cartoons | R186: The Movie Game | S186: The Untouchables | U186: The Galloping Gourmet | V186: The Three O'Clock News--Don Stellges/ Jimmy Jones [3:20] Fashions in Sewing | W186: He Said! She Said! | X186: Beat the Clock | Y186: Popeye's Pier 12 | Z186: The Addams Family | AA186: Sea Hunt | AB186: Gilligan's Island | AC186: Star Trek | AE186: Perry Mason | AG186: The David Frost Show | AJ186: The 10 O'Clock News-- Don Stellges/ Michael Hartfield/ Jimmy Jones | AK186: The Honey-mooners | AL186: Movie [Movie 12]: Fear in the Night (1947) | AX186: =A186 -> 25727
A187: =A186+7 -> 25734 | F187: Telecourse | G187: The Flintstones | H187: Hobo Kelly | J187: The Patty Duke Show | K187: The Wonderful World of Women | L187: Movie [Morning Movie 12]: Pretty Baby (1950) | O187: 12 in the Morning; [11:40] News--Larry Curran/ Bill Swing | P187: Rusty Nails' Cartoons | R187: The Movie Game | S187: The Untouchables | U187: The Galloping Gourmet | V187: The Three O'Clock News--Don Stellges/ Jimmy Jones [3:20] Fashions in Sewing | W187: He Said! She Said! | X187: Beat the Clock | Y187: Popeye's Pier 12 | Z187: The Addams Family | AA187: Sea Hunt | AB187: Gilligan's Island | AC187: Star Trek | AE187: Perry Mason | AG187: The David Frost Show | AJ187: The 10 O'Clock News-- Don Stellges/ Michael Hartfield/ Jimmy Jones | AK187: Film-- Auto Race: 1970 Indianapolis 500 | AL187: Movie [Movie 12]: Criss Cross (1949) | AX187: =A187 -> 25734
A188: =A187+7 -> 25741 | F188: Telecourse | G188: The Flintstones | H188: Hobo Kelly | J188: The Patty Duke Show | K188: The Wonderful World of Women | L188: Movie [Morning Movie 12]: 13 Ghosts (1960) | O188: 12 in the Morning; [11:40] News--Larry Curran/ Bill Swing | P188: Rusty Nails' Cartoons | R188: The Movie Game | S188: Faces and Places | U188: The Galloping Gourmet | V188: The Three O'Clock News--Don Stellges/ Jimmy Jones [3:20] Fashions in Sewing | W188: He Said! She Said! | X188: Beat the Clock | Y188: Popeye's Pier 12 | Z188: The Addams Family | AA188: Sea Hunt | AB188: Gilligan's Island | AC188: Star Trek | AE188: Billy Graham (Special) | AG188: The David Frost Show | AJ188: The 10 O'Clock News-- Don Stellges/ Michael Hartfield/ Jimmy Jones | AK188: The Honey-mooners | AL188: Movie [Movie 12]: Take It Big (1944) | AX188: =A188 -> 25741
A189: =A188+7 -> 25748 | F189: Telecourse | G189: The Flintstones | H189: Hobo Kelly | J189: The Patty Duke Show | K189: The Wonderful World of Women | L189: Movie [Morning Movie 12]: Going Steady (1960) | O189: 12 in the Morning; [11:40] News--Larry Curran/ Bill Swing | P189: Rusty Nails' Cartoons | R189: The Movie Game | S189: Faces and Places | U189: The Galloping Gourmet | V189: The Three O'Clock News--Don Stellges/ Jimmy Jones [3:20] Fashions in Sewing | W189: He Said! She Said! | X189: Beat the Clock | Y189: Popeye's Pier 12 | Z189: Rex Humbard | AB189: Gilligan's Island | AC189: Star Trek | AE189: The Real Tom Kennedy Show (may actually premiere 7/13/70) | AG189: The David Frost Show | AJ189: The 10 O'Clock News-- Don Stellges/ Michael Hartfield/ Jimmy Jones | AK189: Film-- Auto Race: 1969 Sebring 12-Hour Grand Prix of Endurance | AL189: Movie [Movie 12]: Phantom of the Opera (1943) | AX189: =A189 -> 25748
A190: =A189+7 -> 25755 | F190: Telecourse | G190: Cartoon Castle | H190: Hobo Kelly | J190: The Patty Duke Show | K190: The Wonderful World of Women | L190: Movie [Morning Movie 12]: Triumph of the Ten Gladiators (Italian; 1964) | O190: 12 in the Morning; [11:40] News--Larry Curran/ Bill Swing | P190: Rusty Nails' Cartoons | R190: The Movie Game | S190: Faces and Places | U190: The Galloping Gourmet | V190: The Three O'Clock News--Don Stellges/ Jimmy Jones [3:20] Fashions in Sewing | W190: He Said! She Said! | X190: Beat the Clock | Y190: Popeye's Pier 12 | Z190: Mister Ed | AA190: Sea Hunt | AB190: Gilligan's Island | AC190: Star Trek | AE190: Perry Mason | AG190: The David Frost Show | AJ190: The 10 O'Clock News-- Don Stellges/ Michael Hartfield/ Jimmy Jones | AK190: The Honey-mooners | AL190: Movie [Movie 12]: Golden Girl (1951) | AX190: =A190 -> 25755
A197: 1974 | AX197: 1974
A199: 27393 | F199: Government Story | G199: The Flintstones | H199: Big Blue Marble | I199: Nanny and the Professor | J199: Name That Tune (NBC) | K199: News--Larry Curran/Young | L199: Now You See It (CBS) | M199: It Takes a Thief | O199: Search for Tomorrow (CBS) | P199: Jeopardy! (NBC) | Q199: The Bold Ones | S199: Movie [Matinee 12]: Pillars of the Sky (1956) | W199: Gomer Pyle, USMC | X199: Ramblin' Rod | Y199: Batman | Z199: I Dream of Jeannie | AA199: Courtship of Eddie's Father | AB199: The Mod Squad | AD199: The FBI | AF199: Movie: The Lady Takes a Flyer (1957) | AJ199: The 10 O'Clock News | AL199: Night Gallery | AM199: Night Gallery | AN199: Night Gallery | AX199: 27393
A200: 1975 | AX200: 1975
A201: 27400 | F201: Government Story | G201: The Flintstones | H201: Big Blue Marble | I201: Nanny and the Professor | J201: Celebrity Sweepstakes (NBC) | K201: News--Larry Curran/Young | L201: Now You See It (CBS) | M201: It Takes a Thief | O201: Search for Tomorrow (CBS) | P201: How to Survive a Marriage (NBC) | R201: Petticoat Junction | S201: Movie [Matinee 12]: City Across the River (1949) | W201: Gomer Pyle, USMC | X201: Ramblin' Rod | Y201: Batman | Z201: I Dream of Jeannie | AA201: Courtship of Eddie's Father | AB201: The Mod Squad | AD201: The FBI | AF201: Movie: One Desire (1955) | AJ201: The 10 O'Clock News | AL201: Night Gallery | AM201: Night Gallery | AN201: The Sixth Sense (Night Gallery) | AX201: 27400
A202: =A201+7 -> 27407 | F202: Government Story | G202: The Flintstones | H202: Big Blue Marble | I202: Petticoat Junction | J202: Celebrity Sweepstakes (NBC) | K202: Nanny and the Professor | L202: Now You See It (CBS) | M202: Bold Ones | O202: Search for Tomorrow (CBS) | P202: How to Survive a Marriage (NBC) | Q202: Movie [Matinee 12]: Imitation of Life (1959) | V202: Gomer Pyle, USMC | W202: Batman | X202: Ramblin' Rod | Y202: I Dream of Jeannie | Z202: The Mod Squad | AB202: Star Trek | AD202: The FBI | AF202: Movie: Never Say Goodbye (1956) | AJ202: The 10 O'Clock News | AL202: Night Gallery | AM202: Night Gallery | AN202: The Sixth Sense (Night Gallery) | AX202: =AX201+7 -> 27407
A203: =A202+7 -> 27414 | F203: Government Story | G203: The Flintstones | H203: Big Blue Marble | I203: Petticoat Junction | J203: Celebrity Sweepstakes (NBC) | K203: Nanny and the Professor | L203: Now You See It (CBS) | M203: Bold Ones | O203: Search for Tomorrow (CBS) | P203: How to Survive a Marriage (NBC) | Q203: Movie [Matinee 12]: Night and Day (1946) | V203: Gomer Pyle, USMC | W203: Batman | X203: Ramblin' Rod | Y203: I Dream of Jeannie | Z203: The Mod Squad | AB203: Star Trek | AD203: The FBI | AF203: Movie: The Unguarded Moment (1956) | AJ203: The 10 O'Clock News | AL203: Night Gallery | AM203: Night Gallery | AN203: The Sixth Sense (Night Gallery) | AX203: =AX202+7 -> 27414
A204: =A203+7 -> 27421 | F204: Government Story | G204: The Flintstones | H204: Big Blue Marble | I204: Petticoat Junction | J204: Celebrity Sweepstakes (NBC) | K204: Nanny and the Professor | L204: Now You See It (CBS) | M204: Bold Ones | O204: Search for Tomorrow (CBS) | P204: How to Survive a Marriage (NBC) | Q204: Movie [Matinee 12]: Mr. Skeffington (1944) | V204: Gomer Pyle, USMC | W204: Batman | X204: Ramblin' Rod | Y204: I Dream of Jeannie | Z204: The Mod Squad | AB204: Star Trek | AD204: The FBI | AF204: College Basketball: Air Force Falcons vs Oregon Ducks | AJ204: The 10 O'Clock News | AL204: Night Gallery | AM204: Night Gallery | AN204: Night Gallery | AX204: =AX203+7 -> 27421
A205: 27428 | F205: Government Story | G205: The Flintstones | H205: Big Blue Marble | I205: Petticoat Junction | J205: Celebrity Sweepstakes (NBC) | K205: Nanny and the Professor | L205: Now You See It (CBS) | M205: Bold Ones | O205: Search for Tomorrow (CBS) | P205: How to Survive a Marriage (NBC) | Q205: Movie [Matinee 12]: Summer and Smoke (1961) | V205: Gomer Pyle, USMC | W205: Batman | X205: Ramblin' Rod | Y205: I Dream of Jeannie | Z205: The Mod Squad | AB205: Star Trek | AD205: The FBI | AF205: Movie: Secret of the Incas (1954) | AJ205: The 10 O'Clock News | AL205: Night Gallery | AM205: Perry Mason | AX205: 27428
A206: =A205+7 -> 27435 | F206: Government Story | G206: The Flintstones | H206: Big Blue Marble | I206: Petticoat Junction | J206: Celebrity Sweepstakes (NBC) | K206: Nanny and the Professor | L206: Now You See It (CBS) | M206: Bold Ones | O206: Search for Tomorrow (CBS) | P206: How to Survive a Marriage (NBC) | Q206: Movie [Matinee 12]: The Glenn Miller Story (1954) | V206: Gomer Pyle, USMC | W206: Batman | X206: Ramblin' Rod | Y206: I Dream of Jeannie | Z206: The Mod Squad | AB206: Star Trek | AD206: The FBI | AF206: Movie: Two-Lane Blacktop (1971) | AJ206: The 10 O'Clock News | AL206: The Sixth Sense (Night Gallery) | AM206: Perry Mason | AX206: =AX205+7 -> 27435
A207: =A206+7 -> 27442 | F207: Government Story | G207: The Flintstones | H207: Big Blue Marble | I207: Petticoat Junction | J207: Celebrity Sweepstakes (NBC) | K207: Nanny and the Professor | L207: Now You See It (CBS) | M207: Bold Ones | O207: Search for Tomorrow (CBS) | P207: How to Survive a Marriage (NBC) | Q207: Movie [Matinee 12]: Prince and the Pauper (1937) | V207: Gomer Pyle, USMC | W207: Batman | X207: Ramblin' Rod | Y207: I Dream of Jeannie | Z207: The Mod Squad | AB207: Star Trek | AD207: The FBI | AF207: Movie: The Hired Hand (1971) | AJ207: The 10 O'Clock News | AL207: Night Gallery | AM207: Perry Mason | AX207: =AX206+7 -> 27442
A208: =A207+7 -> 27449 | F208: Government Story | G208: The Flintstones | H208: Big Blue Marble | I208: Petticoat Junction | J208: Celebrity Sweepstakes (NBC) | K208: Nanny and the Professor | L208: Now You See It (CBS) | M208: Bold Ones | O208: Search for Tomorrow (CBS) | P208: How to Survive a Marriage (NBC) | Q208: Movie [Matinee 12]: The Benny Goodman Story (1955) | V208: Gomer Pyle, USMC | W208: Batman | X208: Ramblin' Rod | Y208: I Dream of Jeannie | Z208: The Mod Squad | AB208: Star Trek | AD208: The FBI | AF208: Movie: Bunny Lake is Missing (1965) | AJ208: The 10 O'Clock News | AL208: Night Gallery | AM208: Perry Mason | AX208: =AX207+7 -> 27449
A209: =A208+7 -> 27456 | F209: Government Story | G209: The Flintstones | H209: Big Blue Marble | I209: Petticoat Junction | J209: Celebrity Sweepstakes (NBC) | K209: Nanny and the Professor | L209: Now You See It (CBS) | M209: Bold Ones | O209: Search for Tomorrow (CBS) | P209: How to Survive a Marriage (NBC) | Q209: Movie [Matinee 12]: Roman Holiday (1953) | V209: Gomer Pyle, USMC | W209: Batman | X209: Ramblin' Rod | Y209: The Mickey Mouse Club | Z209: The Mod Squad | AB209: Star Trek | AD209: The FBI | AF209: Movie: The Mating Season (1951) | AJ209: The 10 O'Clock News | AL209: Night Gallery | AM209: Night Gallery | AN209: Night Gallery | AX209: =AX208+7 -> 27456
A210: =A209+7 -> 27463 | F210: Government Story | G210: The Flintstones | H210: Big Blue Marble | I210: Petticoat Junction | J210: Celebrity Sweepstakes (NBC) | K210: Nanny and the Professor | L210: Now You See It (CBS) | M210: Sarge (Bold Ones) | O210: Search for Tomorrow (CBS) | P210: How to Survive a Marriage (NBC) | Q210: Movie [Matinee 12]: The Glory Guys (1965) | V210: Gomer Pyle, USMC | W210: Batman | X210: Ramblin' Rod | Y210: The Mickey Mouse Club | Z210: The Mod Squad | AB210: Star Trek | AD210: The FBI | AF210: Kopykats | AH210: Billy Graham Crusade | AJ210: The 10 O'Clock News | AL210: Night Gallery | AM210: Perry Mason | AX210: =AX209+7 -> 27463
A211: =A210+7 -> 27470 | F211: Government Story | G211: The Flintstones | H211: Big Blue Marble | I211: Petticoat Junction | J211: Celebrity Sweepstakes (NBC) | K211: Nanny and the Professor | L211: Now You See It (CBS) | M211: Ballad of the Iron Horse | O211: Search for Tomorrow (CBS) | P211: How to Survive a Marriage (NBC) | Q211: Movie [Matinee 12]: The Secret Ways (1961) | V211: Gomer Pyle, USMC | W211: Batman | X211: Ramblin' Rod | Y211: The Mickey Mouse Club | Z211: The Mod Squad | AB211: Star Trek | AD211: The FBI | AF211: Movie: The Truth About Spring (1965) | AJ211: The 10 O'Clock News | AL211: Night Gallery | AM211: Perry Mason | AX211: =AX210+7 -> 27470
A212: =A211+7 -> 27477 | F212: Government Story | G212: The Flintstones | H212: Big Blue Marble | I212: Petticoat Junction | J212: Celebrity Sweepstakes (NBC) | K212: Nanny and the Professor | L212: Now You See It (CBS) | M212: Kitty Hawk to Paris | O212: Search for Tomorrow (CBS) | P212: How to Survive a Marriage (NBC) | Q212: Movie [Matinee 12]: A Hole in the Head (1959) | V212: Gomer Pyle, USMC | W212: Batman | X212: Ramblin' Rod | Y212: The Mickey Mouse Club | Z212: The Mod Squad | AB212: Star Trek | AD212: The FBI | AF212: Movie: A Matter of Innocence (1967) | AJ212: The 10 O'Clock News | AL212: Night Gallery | AM212: Perry Mason | AX212: =AX211+7 -> 27477
A213: =A212+7 -> 27484 | F213: Government Story | G213: The Flintstones | H213: Big Blue Marble | I213: Petticoat Junction | J213: Celebrity Sweepstakes (NBC) | K213: Nanny and the Professor | L213: Now You See It (CBS) | M213: Golden Age of the Automobile | O213: Search for Tomorrow (CBS) | P213: How to Survive a Marriage (NBC) | Q213: Movie [Matinee 12]: Taras Bulba (1962) | V213: Gomer Pyle, USMC | W213: Batman | X213: Ramblin' Rod | Y213: The Mickey Mouse Club | Z213: The Mod Squad | AB213: Star Trek | AD213: The FBI | AF213: Movie: Interlude (1957) | AJ213: The 10 O'Clock News | AL213: Night Gallery | AM213: Perry Mason | AX213: =AX212+7 -> 27484
A214: =A213+7 -> 27491 | F214: Government Story | G214: The Flintstones | H214: Big Blue Marble | I214: Petticoat Junction | J214: Celebrity Sweepstakes (NBC) | K214: Nanny and the Professor | L214: Now You See It (CBS) | M214: Discover America with Jose Jiminez | O214: Search for Tomorrow (CBS) | P214: How to Survive a Marriage (NBC) | Q214: Movie [Matinee 12]: To Kill a Mockingbird (1962) | V214: Gomer Pyle, USMC | W214: Batman | X214: Ramblin' Rod | Y214: The Mickey Mouse Club | Z214: The Mod Squad | AB214: Star Trek | AD214: The FBI | AF214: Bacharach in the Park | AH214: Backstage in Hollywood | AI214: Backstage in Hollywood | AJ214: The 10 O'Clock News | AL214: Night Gallery | AM214: Perry Mason | AX214: =AX213+7 -> 27491
A215: =A214+7 -> 27498 | F215: Government Story | G215: The Flintstones | H215: Big Blue Marble | I215: Petticoat Junction | J215: Celebrity Sweepstakes (NBC) | K215: Nanny and the Professor | L215: Now You See It (CBS) | M215: Bill Dana | O215: Search for Tomorrow (CBS) | P215: How to Survive a Marriage (NBC) | Q215: Movie [Matinee 12]: Up Periscope (1959) | V215: Gomer Pyle, USMC | W215: Batman | X215: Ramblin' Rod | Y215: The Mickey Mouse Club | Z215: The Mod Squad | AB215: Star Trek | AD215: The FBI | AF215: Movie: The Second Greatest Sex (1955) | AJ215: The 10 O'Clock News | AL215: Night Gallery | AM215: Perry Mason | AX215: =AX214+7 -> 27498
A216: =A215+7 -> 27505 | F216: Government Story | G216: The Flintstones | H216: Big Blue Marble | I216: Cartoon Castle | J216: Celebrity Sweepstakes (NBC) | K216: Petticoat Junction | L216: Now You See It (CBS) | M216: Mister Ed | N216: I Dream of Jeannie | O216: Search for Tomorrow (CBS) | P216: Perry Mason | R216: Movie [Matinee 12]: Bright Victory (1951) | V216: Gomer Pyle, USMC | W216: Gentle Ben | X216: Ramblin' Rod | Y216: The Mickey Mouse Club | Z216: World Missions--Special | AJ216: The 10 O'Clock News | AL216: It Takes a Thief | AN216: Night Gallery | AX216: =AX215+7 -> 27505
A217: =A216+7 -> 27512 | F217: Government Story | G217: The Flintstones | H217: Big Blue Marble | I217: Cartoon Castle | J217: Celebrity Sweepstakes (NBC) | K217: Petticoat Junction | L217: Now You See It (CBS) | M217: Mister Ed | N217: I Dream of Jeannie | O217: Search for Tomorrow (CBS) | P217: Perry Mason | R217: Movie [Matinee 12]: The Judge and Jake Wyler (1972) | V217: Gomer Pyle, USMC | W217: Gentle Ben | X217: Ramblin' Rod | Y217: The Mickey Mouse Club | Z217: The Mod Squad | AB217: Star Trek | AD217: The FBI | AF217: Movie [The Movie]: Bell, Book and Candle (1958) | AJ217: The 10 O'Clock News | AL217: It Takes a Thief | AN217: Night Gallery | AX217: =AX216+7 -> 27512
A218: =A217+7 -> 27519 | F218: Government Story | G218: The Flintstones | H218: Big Blue Marble | I218: Cartoon Castle | J218: Celebrity Sweepstakes (NBC) | K218: Petticoat Junction | L218: Now You See It (CBS) | M218: Mister Ed | N218: I Dream of Jeannie | O218: Search for Tomorrow (CBS) | P218: Perry Mason | R218: Movie [Matinee 12]: The World in His Arms (1952) | V218: Gomer Pyle, USMC | W218: Gentle Ben | X218: Ramblin' Rod | Y218: The Mickey Mouse Club | Z218: The Mod Squad | AB218: Star Trek | AD218: The FBI | AF218: Movie [The Movie]: Operation Mad Ball (1957) | AJ218: The 10 O'Clock News | AL218: It Takes a Thief | AN218: Night Gallery | AX218: =AX217+7 -> 27519
A219: =A218+7 -> 27526 | F219: Government Story | G219: The Flintstones | H219: Big Blue Marble | I219: Cartoon Castle | J219: Celebrity Sweepstakes (NBC) | K219: Petticoat Junction | L219: Now You See It (CBS) | M219: Mister Ed | N219: I Dream of Jeannie | O219: Search for Tomorrow (CBS) | P219: Perry Mason | R219: Movie [Matinee 12]: A Matter of Humanities (1969) | V219: Gomer Pyle, USMC | W219: Gentle Ben | X219: Ramblin' Rod | Y219: The Mickey Mouse Club | Z219: The Mod Squad | AB219: Star Trek | AD219: The FBI | AF219: Movie [The Movie]: You Can't Run Away from It (1956) | AJ219: The 10 O'Clock News | AL219: It Takes a Thief | AN219: The Sixth Sense (Night Gallery) | AX219: =AX218+7 -> 27526
A220: =A219+7 -> 27533 | F220: Government Story | G220: The Flintstones | H220: Big Blue Marble | I220: Cartoon Castle | J220: Celebrity Sweepstakes (NBC) | K220: Petticoat Junction | L220: Now You See It (CBS) | M220: Mister Ed | N220: I Dream of Jeannie | O220: Search for Tomorrow (CBS) | P220: Perry Mason | R220: Movie [Matinee 12]: Female Instinct (1972) | V220: Gomer Pyle, USMC | W220: Gentle Ben | X220: Ramblin' Rod | Y220: The Mickey Mouse Club | Z220: The Mod Squad | AB220: Star Trek | AD220: The FBI | AF220: Movie [The Movie]: My Sister Eileen (1955) | AJ220: The 10 O'Clock News | AL220: It Takes a Thief | AN220: The Sixth Sense (Night Gallery) | AX220: =AX219+7 -> 27533
A221: =A220+7 -> 27540 | F221: Government Story | G221: The Flintstones | H221: Big Blue Marble | I221: Cartoon Castle | J221: Celebrity Sweepstakes (NBC) | K221: Petticoat Junction | L221: Now You See It (CBS) | M221: Mister Ed | N221: I Dream of Jeannie | O221: Search for Tomorrow (CBS) | P221: Perry Mason | R221: Movie [Matinee 12]: Francis Joins the WACS (1954) | V221: Gomer Pyle, USMC | W221: Gentle Ben | X221: Ramblin' Rod | Y221: The Mickey Mouse Club | Z221: The Mod Squad | AB221: Star Trek | AD221: The FBI | AF221: Movie [The Movie]: The Perfect Furlough (1959) | AJ221: The 10 O'Clock News | AL221: It Takes a Thief | AN221: The Sixth Sense (Night Gallery) | AX221: =AX220+7 -> 27540
A222: =A221+7 -> 27547 | F222: Government Story | G222: The Flintstones | H222: Big Blue Marble | I222: Cartoon Castle | J222: Celebrity Sweepstakes (NBC) | K222: Petticoat Junction | L222: Now You See It (CBS) | M222: Mister Ed | N222: I Dream of Jeannie | O222: Search for Tomorrow (CBS) | P222: Perry Mason | R222: Movie [Matinee 12]: Never Say Goodbye (1956) | V222: Gomer Pyle, USMC | W222: Batman | X222: Ramblin' Rod | Y222: The Mickey Mouse Club | Z222: The Mod Squad | AB222: Star Trek | AD222: Billy Graham Crusade | AF222: Movie [The Movie]: Written on the Wind (1956) | AJ222: The 10 O'Clock News | AL222: It Takes a Thief | AN222: The Sixth Sense (Night Gallery) | AX222: =AX221+7 -> 27547
A223: =A222+7 -> 27554 | F223: Government Story | G223: The Flintstones | H223: Big Blue Marble | I223: Cartoon Castle | J223: Celebrity Sweepstakes (NBC) | K223: Petticoat Junction | L223: Now You See It (CBS) | M223: Mister Ed | N223: I Dream of Jeannie | O223: Search for Tomorrow (CBS) | P223: Perry Mason | R223: Movie [Matinee 12]: Sword in the Desert (1949) | V223: Gomer Pyle, USMC | W223: Batman | X223: Ramblin' Rod | Y223: The Mickey Mouse Club | Z223: The Mod Squad | AB223: Star Trek | AD223: The FBI | AF223: Movie [The Movie]: 40 Pounds of Trouble (1962) | AJ223: The 10 O'Clock News | AL223: It Takes a Thief | AN223: Night Gallery | AX223: =AX222+7 -> 27554
A224: =A223+7 -> 27561 | F224: Government Story | G224: The Flintstones | H224: Big Blue Marble | I224: Cartoon Castle | J224: Celebrity Sweepstakes (NBC) | K224: Petticoat Junction | L224: Tattletales (CBS) | M224: Mister Ed | N224: I Dream of Jeannie | O224: Search for Tomorrow (CBS) | P224: Perry Mason | R224: Movie [Matinee 12]: You Gotta Stay Happy (1948) | V224: Gomer Pyle, USMC | W224: Batman | X224: Ramblin' Rod | Y224: The Mickey Mouse Club | Z224: The Mod Squad | AB224: Star Trek | AD224: The FBI | AF224: Movie [The Movie]: If a Man Answers (1962) | AJ224: The 10 O'Clock News | AL224: It Takes a Thief | AN224: Night Gallery | AX224: =AX223+7 -> 27561
A225: =A224+7 -> 27568 | F225: Government Story | G225: The Flintstones | H225: Big Blue Marble | I225: Cartoon Castle | J225: Celebrity Sweepstakes (NBC) | K225: Petticoat Junction | L225: Tattletales (CBS) | M225: Mister Ed | N225: I Dream of Jeannie | O225: Search for Tomorrow (CBS) | P225: Perry Mason | R225: Movie [Matinee 12]: Magic Carpet (1972) | V225: Land of the Giants | X225: Ramblin' Rod | Y225: The Mickey Mouse Club | Z225: The Mod Squad | AB225: Star Trek | AD225: The FBI | AF225: Movie [The Movie]: Bedtime Story (1964) | AJ225: The 10 O'Clock News--Michael Hartfield/Sylvia Stinson | AL225: It Takes a Thief | AN225: The Sixth Sense (Night Gallery) | AX225: =AX224+7 -> 27568
A226: =A225+7 -> 27575 | F226: Government Story | G226: The Flintstones | H226: Big Blue Marble | I226: Cartoon Castle | J226: Celebrity Sweepstakes (NBC) | K226: Petticoat Junction | L226: Tattletales (CBS) | M226: Mister Ed | N226: I Dream of Jeannie | O226: Search for Tomorrow (CBS) | P226: Perry Mason | R226: Movie [Matinee 12]: Mask of Marcella (1972) | V226: Land of the Giants | X226: Ramblin' Rod | Y226: The Mickey Mouse Club | Z226: The Mod Squad | AB226: Star Trek | AD226: The FBI | AF226: Movie [The Movie]: I'd Rather Be Rich (1964) | AJ226: The 10 O'Clock News--Michael Hartfield/Sylvia Stinson | AL226: It Takes a Thief | AN226: Night Gallery | AX226: =AX225+7 -> 27575
A227: =A226+7 -> 27582 | F227: Government Story | G227: The Flintstones | H227: Big Blue Marble | I227: Cartoon Castle | J227: Celebrity Sweepstakes (NBC) | K227: Petticoat Junction | L227: Tattletales (CBS) | M227: Mister Ed | N227: Safari to Adventure | O227: Search for Tomorrow (CBS) | P227: Perry Mason | R227: Movie [Matinee 12]: My Six Loves (1963) | V227: Bill Daily's Hocus Pocus Gang | X227: Ramblin' Rod | Y227: The Mickey Mouse Club | Z227: Mission: Impossible | AB227: Star Trek | AD227: The FBI | AF227: Movie [The Movie]: Six Bridges to Cross (1955) | AJ227: The 10 O'Clock News--Michael Hartfield/Sylvia Stinson | AL227: It Takes a Thief | AN227: Night Gallery | AX227: =AX226+7 -> 27582
A228: =A227+7 -> 27589 | F228: Government Story | G228: Cartoon Castle | H228: Big Blue Marble | I228: Nanny and the Professor | J228: Celebrity Sweepstakes (NBC) | K228: Audubon Wildlife Theatre | L228: Tattletales (CBS) | M228: Gomer Pyle, USMC | N228: Safari to Adventure | O228: Search for Tomorrow (CBS) | P228: Perry Mason | R228: Movie [Matinee 12]: But Not for Me (1959) | V228: Bill Daily's Hocus Pocus Gang | X228: Ramblin' Rod | Y228: The Mickey Mouse Club | Z228: Mission: Impossible | AB228: Star Trek | AD228: The FBI | AF228: Movie [The Movie]: Thunder Bay (1953) | AJ228: The 10 O'Clock News--Michael Hartfield/Sylvia Stinson | AL228: It Takes a Thief | AN228: The Sixth Sense (Night Gallery) | AX228: =AX227+7 -> 27589
A229: =A228+7 -> 27596 | F229: Government Story | G229: Cartoon Castle | H229: Big Blue Marble | I229: Nanny and the Professor | J229: Celebrity Sweepstakes (NBC) | K229: Audubon Wildlife Theatre | L229: Tattletales (CBS) | M229: Gomer Pyle, USMC | N229: Safari to Adventure | O229: Search for Tomorrow (CBS) | P229: Perry Mason | R229: Movie [Matinee 12]: Breakout (1967) | V229: Bill Daily's Hocus Pocus Gang | X229: Ramblin' Rod | Y229: The Mickey Mouse Club | Z229: Mission: Impossible | AB229: Star Trek | AD229: The FBI | AF229: Movie [The Movie]: Mister Cory (1957) | AJ229: The 10 O'Clock News--Michael Hartfield/Sylvia Stinson | AL229: It Takes a Thief | AN229: Night Gallery | AX229: =AX228+7 -> 27596
A230: =A229+7 -> 27603 | F230: Government Story | G230: Cartoon Castle | H230: Big Blue Marble | I230: Nanny and the Professor | J230: Celebrity Sweepstakes (NBC) | K230: Audubon Wildlife Theatre | L230: Tattletales (CBS) | M230: Gomer Pyle, USMC | N230: Safari to Adventure | O230: Search for Tomorrow (CBS) | P230: Perry Mason | R230: Movie [Matinee 12]: The Son of Cleopatra (1964) | V230: World of Sid and Marty Kroft at the Hollywood Bowl | X230: Ramblin' Rod | Y230: The Mickey Mouse Club | Z230: Mission: Impossible | AB230: Star Trek | AD230: The FBI | AF230: Movie [The Movie]: That Funny Feeling (1965) | AJ230: The 10 O'Clock News--Michael Hartfield/Sylvia Stinson | AL230: It Takes a Thief | AN230: The Sixth Sense (Night Gallery) | AX230: =AX229+7 -> 27603
A231: =A230+7 -> 27610 | F231: Government Story | G231: Cartoon Castle | H231: Big Blue Marble | I231: Nanny and the Professor | J231: Celebrity Sweepstakes (NBC) | K231: Audubon Wildlife Theatre | L231: Tattletales (CBS) | M231: Gomer Pyle, USMC | N231: Safari to Adventure | O231: Search for Tomorrow (CBS) | P231: Perry Mason | R231: Movie [Matinee 12]: Yankee Buccaneer (1952) | V231: Canterville Ghost | X231: Ramblin' Rod | Y231: The Mickey Mouse Club | Z231: Mission: Impossible | AB231: Star Trek | AD231: The FBI | AF231: Movie [The Movie]: The Far Country (1955) | AJ231: The 10 O'Clock News--Michael Hartfield/Sylvia Stinson | AL231: It Takes a Thief | AN231: Night Gallery | AX231: =AX230+7 -> 27610
A232: =A231+7 -> 27617 | F232: Government Story | G232: Cartoon Castle | H232: Big Blue Marble | I232: Nanny and the Professor | J232: Celebrity Sweepstakes (NBC) | K232: Audubon Wildlife Theatre | L232: Tattletales (CBS) | M232: Gomer Pyle, USMC | N232: Safari to Adventure | O232: Search for Tomorrow (CBS) | P232: Perry Mason | R232: Movie [Matinee 12]: Madame X (1966) | V232: Sleeping Beauty | X232: Ramblin' Rod | Y232: The Mickey Mouse Club | Z232: Mission: Impossible | AB232: Star Trek | AD232: The FBI | AF232: Movie [The Movie]: Man Without a Star (1955) | AJ232: The 10 O'Clock News--Michael Hartfield/Sylvia Stinson | AL232: It Takes a Thief | AN232: The Sixth Sense (Night Gallery) | AX232: =AX231+7 -> 27617
A233: =A232+7 -> 27624 | F233: Government Story | G233: Cartoon Castle | H233: Big Blue Marble | I233: Nanny and the Professor | J233: Petticoat Junction | K233: Movie [The Morning Movie]: Pillars of the Sky (1956) | O233: Search for Tomorrow (CBS) | P233: Perry Mason | R233: Movie [Matinee 12]: Winchester for Hire (1967) | V233: Midnight Ride of Paul Revere | X233: Ramblin' Rod | Y233: The Mickey Mouse Club | Z233: Mission: Impossible | AB233: Star Trek | AD233: The FBI | AF233: Movie [The Movie]: Tammy Tell Me True (1961) | AJ233: The 10 O'Clock News--Michael Hartfield/Sylvia Stinson | AL233: It Takes a Thief | AN233: The Sixth Sense (Night Gallery) | AX233: =AX232+7 -> 27624
A234: =A233+7 -> 27631 | F234: Government Story | G234: Cartoon Castle | H234: Big Blue Marble | I234: Nanny and the Professor | J234: Petticoat Junction | K234: Movie [The Morning Movie]: Hired Wife (1940) | O234: Search for Tomorrow (CBS) | P234: Perry Mason | R234: Movie [Matinee 12]: Anastasia (1956) | V234: I Dream of Jeannie | W234: Speed Racer | X234: Ramblin' Rod | Y234: The Mickey Mouse Club | Z234: Mission: Impossible | AB234: Star Trek | AD234: The FBI | AF234: Movie [The Movie]: The Mississippi Gambler (1953) | AJ234: The 10 O'Clock News--Michael Hartfield/Sylvia Stinson | AL234: It Takes a Thief | AN234: Night Gallery | AX234: =AX233+7 -> 27631
A235: =A234+7 -> 27638 | B235: Jerry Lewis Muscular Distrophy Telethon Continues | H235: Jerry Lewis Muscular Distrophy Telethon Continues | P235: Jerry Lewis Muscular Distrophy Telethon Continues | W235: The Mickey Mouse Club | X235: All-American Futurity Preview | Z235: Mission: Impossible | AB235: Star Trek | AD235: The FBI | AF235: Movie [The Movie]: Beaau Geste (1966) | AJ235: The 10 O'Clock News--Michael Hartfield/Sylvia Stinson | AL235: It Takes a Thief | AN235: Night Gallery | AX235: =AX234+7 -> 27638
A236: =A235+7 -> 27645 | F236: Government Story | G236: Ramblin' Rod | I236: Gomer Pyle, USMC | J236: Petticoat Junction | K236: Movie [The Morning Movie]: Female on the Beach (1955) | O236: Search for Tomorrow (CBS) | P236: Perry Mason | R236: Movie [Matinee 12]: One Man's Way (1964) | V236: I Dream of Jeannie | W236: Speed Racer | X236: The Flintstones | Y236: The Mickey Mouse Club | Z236: Good News Tonight Telethon | AJ236: The 10 O'Clock News | AL236: Mission: Impossible | AX236: =AX235+7 -> 27645
A237: =A236+7 -> 27652 | F237: Government Story | G237: Ramblin' Rod | H237: Big Blue Marble | I237: Gomer Pyle, USMC | J237: Petticoat Junction | K237: Movie [The Morning Movie]: The House of Seven Gables (1940) | O237: Search for Tomorrow (CBS) | P237: Perry Mason | R237: Movie [Matinee 12]: Steel Town (1952) | V237: I Dream of Jeannie | W237: Speed Racer | X237: The Flintstones | Y237: The Mickey Mouse Club | Z237: The Courtship of Eddie's Father | AA237: Room 222 | AB237: Adam-12 | AC237: Adam-12 | AD237: The FBI | AF237: Movie [The Movie]: Corvette K-225 (1943) | AJ237: The 10 O'Clock News | AL237: Mission: Impossible | AX237: =AX236+7 -> 27652
A238: =A237+7 -> 27659 | F238: Government Story | G238: Ramblin' Rod | H238: Big Blue Marble | I238: Gomer Pyle, USMC | J238: Petticoat Junction | K238: Movie [The Morning Movie]: The Raging Tide (1951) | O238: Search for Tomorrow (CBS) | P238: Perry Mason | R238: Movie [Matinee 12]: Yankee Pasha (1954) | V238: I Dream of Jeannie | W238: Speed Racer | X238: The Flintstones | Y238: The Mickey Mouse Club | Z238: The Courtship of Eddie's Father | AA238: Room 222 | AB238: Adam-12 | AC238: Adam-12 | AD238: The FBI | AF238: Movie [The Movie]: It Happened to Jane (1959) | AJ238: The 10 O'Clock News | AL238: Mission: Impossible | AX238: =AX237+7 -> 27659
A239: =A238+7 -> 27666 | F239: Government Story | G239: Ramblin' Rod | I239: Gomer Pyle, USMC | J239: Petticoat Junction | K239: Movie [The Morning Movie]: All My Sons (1948) | O239: Search for Tomorrow (CBS) | P239: Perry Mason | R239: Movie [Matinee 12]: Criss Cross (1949) | V239: I Dream of Jeannie | W239: Speed Racer | X239: The Flintstones | Y239: The Mickey Mouse Club | Z239: The Courtship of Eddie's Father | AA239: Room 222 | AB239: Adam-12 | AC239: Adam-12 | AD239: The FBI | AF239: Movie [The Movie]: The Last of the Powerseekers (1969) | AJ239: The 10 O'Clock News | AL239: Mission: Impossible | AN239: Jimmy Swaggart | AX239: =AX238+7 -> 27666
A240: =A239+7 -> 27673 | F240: Government Story | G240: Ramblin' Rod | I240: Gomer Pyle, USMC | J240: Petticoat Junction | K240: Movie [The Morning Movie]: All I Desire (1953) | N240: Not for Women Only | O240: Search for Tomorrow (CBS) | P240: Perry Mason | R240: Movie [Matinee 12]: Ride the Pink Horse (1957) | V240: I Dream of Jeannie | W240: Speed Racer | X240: The Flintstones | Y240: The Mickey Mouse Club | Z240: The Courtship of Eddie's Father | AA240: Room 222 | AB240: Adam-12 | AC240: Adam-12 | AD240: The FBI | AF240: Movie [The Movie]: Only Two Can Play (1962) | AJ240: The 10 O'Clock News | AL240: Mission: Impossible | AN240: Jimmy Swaggart | AX240: =AX239+7 -> 27673
A241: =A240+7 -> 27680 | F241: Government Story | G241: Ramblin' Rod | I241: Gomer Pyle, USMC | J241: Petticoat Junction | K241: Movie [The Morning Movie]: The Duel at Silver Creek (1952) | N241: Not for Women Only | O241: Search for Tomorrow (CBS) | P241: Perry Mason | R241: Movie [Matinee 12]: Billie (1965) | V241: I Dream of Jeannie | W241: Speed Racer | X241: The Flintstones | Y241: The Mickey Mouse Club | Z241: The Courtship of Eddie's Father | AA241: Room 222 | AB241: Adam-12 | AC241: Adam-12 | AD241: The FBI | AF241: Movie [The Movie]: Air Cadet (1951) | AJ241: The 10 O'Clock News | AL241: Mission: Impossible | AN241: Jimmy Swaggart | AX241: =AX240+7 -> 27680
A242: =A241+7 -> 27687 | F242: Government Story | G242: Ramblin' Rod | I242: Gomer Pyle, USMC | J242: Petticoat Junction | K242: Movie [The Morning Movie]: River Lady (1948) | N242: Not for Women Only | O242: Search for Tomorrow (CBS) | P242: Perry Mason | R242: Movie [Matinee 12]: A Clear and Present Danger (1970) | V242: I Dream of Jeannie | W242: Speed Racer | X242: The Flintstones | Y242: The Mickey Mouse Club | Z242: The Courtship of Eddie's Father | AA242: Room 222 | AB242: Adam-12 | AC242: Adam-12 | AD242: The FBI | AF242: Movie [The Movie]: The Challengers (1970) | AJ242: The 10 O'Clock News | AL242: Mission: Impossible | AN242: Jimmy Swaggart | AX242: =AX241+7 -> 27687
A243: =A242+7 -> 27694 | F243: Government Story | G243: Ramblin' Rod | I243: Gomer Pyle, USMC | J243: Petticoat Junction | K243: Movie [The Morning Movie]: Sudan (1945) | N243: Not for Women Only | O243: Search for Tomorrow (CBS) | P243: Perry Mason | R243: Movie [Matinee 12]: All That Heaven Allows (1955) | V243: I Dream of Jeannie | W243: Speed Racer | X243: The Flintstones | Y243: The Mickey Mouse Club | Z243: The Courtship of Eddie's Father | AA243: Room 222 | AB243: Adam-12 | AC243: Adam-12 | AD243: The FBI | AF243: Movie [The Movie]: The Perfect Furlough (1959) | AJ243: The 10 O'Clock News | AL243: Mission: Impossible | AN243: Jimmy Swaggart | AX243: =AX242+7 -> 27694
A244: =A243+7 -> 27701 | F244: Government Story | G244: Ramblin' Rod | I244: Gomer Pyle, USMC | J244: Petticoat Junction | K244: Movie [The Morning Movie]: The Golden Blade (1953) | N244: Not for Women Only | O244: Search for Tomorrow (CBS) | P244: Perry Mason | R244: Movie [Matinee 12]: Target Unknown (1951) | V244: I Dream of Jeannie | W244: Speed Racer | X244: The Flintstones | Y244: The Mickey Mouse Club | Z244: The Courtship of Eddie's Father | AA244: Room 222 | AB244: Adam-12 | AC244: Adam-12 | AD244: The FBI | AF244: Movie [The Movie]: Rally 'Round the Flag, Boys! (1958) | AJ244: The 10 O'Clock News | AL244: Mission: Impossible | AN244: Jimmy Swaggart | AX244: =AX243+7 -> 27701
A245: =A244+7 -> 27708 | F245: Government Story | G245: Ramblin' Rod | I245: Gomer Pyle, USMC | J245: Petticoat Junction | K245: Movie [The Morning Movie]: The Kid from Texas (1950) | N245: Not for Women Only | O245: Search for Tomorrow (CBS) | P245: Perry Mason | R245: Movie [Matinee 12]: When Lovers Meet (1946) | V245: I Dream of Jeannie | W245: Speed Racer | X245: The Flintstones | Y245: The Mickey Mouse Club | Z245: The Courtship of Eddie's Father | AA245: Room 222 | AB245: Adam-12 | AC245: Adam-12 | AD245: The FBI | AF245: Movie [The Movie]: The Seven Year Itch (1955) | AJ245: The 10 O'Clock News | AL245: Mission: Impossible | AN245: Jimmy Swaggart | AX245: =AX244+7 -> 27708
A246: =A245+7 -> 27715 | F246: Government Story | G246: Ramblin' Rod | I246: Gomer Pyle, USMC | J246: Petticoat Junction | K246: Movie [The Morning Movie]: It Happens Every Thursday (1953) | N246: Not for Women Only | O246: Search for Tomorrow (CBS) | P246: Perry Mason | R246: Movie [Matinee 12]: Invitation to a Gunfighter (1964) | V246: I Dream of Jeannie | W246: Speed Racer | X246: The Flintstones | Y246: The Mickey Mouse Club | Z246: The Courtship of Eddie's Father | AA246: Room 222 | AB246: Adam-12 | AC246: Adam-12 | AD246: The FBI | AF246: Movie [The Movie]: Gentlemen Prefer Blondes (1953) | AJ246: The 10 O'Clock News | AL246: Mission: Impossible | AN246: Jimmy Swaggart | AX246: =AX245+7 -> 27715
A247: =A246+7 -> 27722 | F247: Government Story | G247: Ramblin' Rod | I247: Gomer Pyle, USMC | J247: Petticoat Junction | K247: Movie [The Morning Movie]: The Desert Hawk (1950) | N247: Not for Women Only | O247: Search for Tomorrow (CBS) | P247: Perry Mason | R247: Movie [Matinee 12]: You Gotta Stay Happy (1948) | V247: I Dream of Jeannie | W247: Speed Racer | X247: The Flintstones | Y247: The Mickey Mouse Club | Z247: The Courtship of Eddie's Father | AA247: Room 222 | AB247: Adam-12 | AC247: Adam-12 | AD247: The FBI | AF247: Movie [The Movie]: Love is a Many-Splendored Thing (1955) | AJ247: The 10 O'Clock News | AL247: Mission: Impossible | AN247: Jimmy Swaggart | AX247: =AX246+7 -> 27722
A248: =A247+7 -> 27729 | F248: Government Story | G248: Ramblin' Rod | I248: Gomer Pyle, USMC | J248: Petticoat Junction | K248: Movie [The Morning Movie]: The Tall T (1957) | N248: Not for Women Only | O248: Search for Tomorrow (CBS) | P248: Perry Mason | R248: Movie [Matinee 12]: The Tarnished Angels (1957) | V248: I Dream of Jeannie | W248: Speed Racer | X248: The Flintstones | Y248: The Mickey Mouse Club | Z248: The Courtship of Eddie's Father | AA248: Room 222 | AB248: Adam-12 | AC248: Adam-12 | AD248: The FBI | AF248: Movie [The Movie]: If a Man Answers (1962) | AJ248: The 10 O'Clock News | AL248: Mission: Impossible | AN248: Jimmy Swaggart | AX248: =AX247+7 -> 27729
A249: =A248+7 -> 27736 | F249: Government Story | G249: Ramblin' Rod | I249: Gomer Pyle, USMC | J249: Petticoat Junction | K249: Movie [The Morning Movie]: Gunsmoke (1953) | N249: Not for Women Only | O249: Search for Tomorrow (CBS) | P249: Perry Mason | R249: Movie [Matinee 12]: Foxfire (1955) | V249: I Dream of Jeannie | W249: Speed Racer | X249: The Flintstones | Y249: The Mickey Mouse Club | Z249: The Courtship of Eddie's Father | AA249: Room 222 | AB249: Adam-12 | AC249: Adam-12 | AD249: The FBI | AF249: Movie [The Movie]: The Chalk Garden (1964) | AJ249: The 10 O'Clock News | AL249: Mission: Impossible | AN249: Jimmy Swaggart | AX249: =AX248+7 -> 27736
A250: =A249+7 -> 27743 | F250: Government Story | G250: Ramblin' Rod | I250: Gomer Pyle, USMC | J250: Petticoat Junction | K250: Movie [The Morning Movie]: Joe Dakota (1957) | N250: Not for Women Only | O250: Search for Tomorrow (CBS) | P250: Perry Mason | R250: Movie [Matinee 12]: Never Say Goodbye (1956) | V250: I Dream of Jeannie | W250: Speed Racer | X250: The Flintstones | Y250: The Mickey Mouse Club | Z250: The Courtship of Eddie's Father | AA250: Room 222 | AB250: Adam-12 | AC250: Adam-12 | AD250: The FBI | AF250: Movie [The Movie]: A Matter of Humanities (1969) | AJ250: The 10 O'Clock News | AL250: Mission: Impossible | AN250: Jimmy Swaggart | AX250: =AX249+7 -> 27743
A251: =A250+7 -> 27750 | F251: Government Story | G251: Ramblin' Rod | I251: Gomer Pyle, USMC | J251: Petticoat Junction | K251: Movie [The Morning Movie]: When the Daltons Rode (1940) | N251: Not for Women Only | O251: Search for Tomorrow (CBS) | P251: Perry Mason | R251: Movie [Matinee 12]: Interlude (1957) | V251: I Dream of Jeannie | W251: Speed Racer | X251: The Flintstones | Y251: The Mickey Mouse Club | Z251: The Courtship of Eddie's Father | AA251: Room 222 | AB251: Adam-12 | AC251: Adam-12 | AD251: The FBI | AF251: Movie [The Movie]: This Happy Feeling (1958) | AJ251: The 10 O'Clock News | AL251: Mission: Impossible | AN251: Jimmy Swaggart | AX251: =AX250+7 -> 27750
A252: =A251+7 -> 27757 | F252: Government Story | G252: Ramblin' Rod | I252: Gomer Pyle, USMC | J252: Petticoat Junction | K252: Movie [The Morning Movie]: Buchanan Rides Alone (1958) | N252: Not for Women Only | O252: Search for Tomorrow (CBS) | P252: Perry Mason | R252: Movie [Matinee 12]: Kiss of Fire (1955) | V252: I Dream of Jeannie | W252: Speed Racer | X252: The Flintstones | Y252: The Mickey Mouse Club | Z252: The Courtship of Eddie's Father | AA252: Room 222 | AB252: Adam-12 | AC252: Adam-12 | AD252: Tribute to Melodyland | AF252: Movie [The Movie]: The Lady Takes a Flyer (1957) | AJ252: The 10 O'Clock News | AL252: Mission: Impossible | AN252: Jimmy Swaggart | AX252: =AX251+7 -> 27757
A253: 1976 | AX253: =A253 -> 1976
A256: 1977 | AX256: =A256 -> 1977
A259: 1978 | AX259: =A259 -> 1978
A262: 1979 | AX262: =A262 -> 1979
A265: 1980 | AX265: =A265 -> 1980
A266: 29227 | E266: Health Field | F266: Big Blue Marble | G266: Ramblin' Rod | I266: Krofft Superstars | J266: Marcus Welby, M.D. | L266: Bonanza | N266: Match Game | O266: The New Joker's Wild | P266: Perry Mason | R266: Movie [Matinee 12]: Drive Hard, Drive Fast (1969) | V266: Room 222 | W266: Bugs Bunny & Friends | X266: The Flintstones | Y266: Gilligan's Island | Z266: The Brady Bunch | AA266: Bewitched | AB266: The Bionic Woman | AD266: Happy Days Again | AE266: I Love Lucy | AF266: College Basketball: USC Trojans vs. Oregon Ducks [LIVE] | AJ266: The 10 O'Clock News | AL266: The Benny Hill Show | AM266: The Odd Couple | AN266: Mission: Impossible | AX266: =AX265+7 -> 1987
A267: 29234 | E267: Health Field | F267: Big Blue Marble | G267: Ramblin' Rod | I267: Krofft Superstars | J267: Marcus Welby, M.D. | L267: Bonanza | N267: Match Game | O267: The New Joker's Wild | P267: Perry Mason | R267: Movie [Matinee 12]: Another Part of the Forest (1948) | V267: Bewitched | W267: Bugs Bunny & Friends | X267: The Flintstones | Y267: The Brady Bunch | Z267: Star Trek | AB267: Emergency One! | AD267: Happy Days Again | AE267: Hogan's Heroes | AF267: College Basketball: California Golden Bears vs. Washington State Cougars [LIVE] | AJ267: The 10 O'Clock News | AL267: The Benny Hill Show | AM267: The Odd Couple | AN267: Mission: Impossible | AX267: =AX266+7 -> 1994
A268: 29241 | E268: Health Field | F268: Big Blue Marble | G268: Ramblin' Rod | I268: Krofft Superstars | J268: Marcus Welby, M.D. | L268: Bonanza | N268: Match Game | O268: The New Joker's Wild | P268: Perry Mason | R268: Movie [Matinee 12]: Tokyo Joe (1949) | V268: Bewitched | W268: Bugs Bunny & Friends | X268: The Flintstones | Y268: The Fisherman's Son [Special] | Z268: Star Trek | AB268: Emergency One! | AD268: Happy Days Again | AE268: Hogan's Heroes | AF268: College Basketball: Arizona Wildcats vs. UCLA Bruins [LIVE] | AJ268: The 10 O'Clock News | AL268: The Benny Hill Show | AM268: The Odd Couple | AN268: Mission: Impossible | AX268: =AX267+7 -> 2001
A269: 29248 | E269: Health Field | F269: Big Blue Marble | G269: Ramblin' Rod | I269: Krofft Superstars | J269: Marcus Welby, M.D. | L269: Bonanza | N269: Match Game | O269: The New Joker's Wild | P269: Perry Mason | R269: Movie [Matinee 12]: Johnny Dark (1954) | V269: Bewitched | W269: Bugs Bunny & Friends | X269: The Flintstones | Y269: The Brady Bunch | Z269: Star Trek | AB269: Emergency One! | AD269: Happy Days Again | AE269: Hogan's Heroes | AF269: College Basketball: Oregon State Beavers vs. Stanford Cardinals [LIVE] | AJ269: The 10 O'Clock News | AL269: The Benny Hill Show | AM269: The Odd Couple | AN269: Mission: Impossible | AX269: =AX268+7 -> 2008