A1: WEDNESDAY | B1: 05:00AM | C1: 05:30AM | D1: 06:00AM | E1: 06:30AM | F1: 07:00AM | G1: 07:30AM | H1: 08:00AM | I1: 08:30AM | J1: 09:00AM | K1: 09:30AM | L1: 10:00AM | M1: 10:30AM | N1: 11:00AM | O1: 11:30AM | P1: 12:00N | Q1: 12:30PM | R1: 01:00PM | S1: 01:30PM | T1: 02:00PM | U1: 02:30PM | V1: 03:00PM | W1: 03:30PM | X1: 04:00PM | Y1: 04:30PM | Z1: 05:00PM | AA1: 05:30PM | AB1: 06:00PM | AC1: 06:30PM | AD1: 07:00PM | AE1: 07:30PM | AF1: 08:00PM | AG1: 08:30PM | AH1: 09:00PM | AI1: 09:30PM | AJ1: 10:00PM | AK1: 10:30PM | AL1: 11:00PM | AM1: 11:30PM | AN1: 12:00M | AO1: 12:30AM | AP1: 01:00AM | AQ1: 01:30AM | AR1: 02:00AM | AS1: 02:30AM | AT1: 03:00AM | AU1: 03:30AM | AV1: 04:00AM | AW1: 04:30AM | AX1: WEDNESDAY
A3: 1953 | AX3: =A3 -> 1953
A4: 19415 | O4: [11:45] The Garry Moore Show (CBS) | P4: The Big Payoff (NBC) | Q4: Welcome Travelers (NBC) | R4: The Kate Smith Hour (NBC) | T4: Double or Nothing (CBS) | U4: Strike It Rich (CBS) | V4: Movie [Matinee Theater]: X Marks the Spot | X4: [4:15] Search For Tomorrow (CBS) | Y4: Love of Life (CBS); [4:45] TBA | Z4: TBA | AA4: Tootsie Hippodrome (ABC) | AB4: Strike It Rich (CBS) | AC4: The CBS Evening News --Douglas Edwards (CBS); [6:45] Time for Beany | AD4: Pabst Blue Ribbon Bouts (CBS); [7:45] Camel News Caravan (NBC) | AF4: Hollywood Opening Night (NBC) | AG4: Arthur Godfrey and His Friends (CBS) | AH4: I Married Joan (NBC) | AI4: This is Your Life (NBC) | AJ4: Kraft Television Theatre (NBC) | AL4: March of Time | AM4: Movie [Nite Owl Theater]: False Faces | AX4: =A4 -> 19415
A5: =A4+7 -> 19422 | O5: [11:45] The Garry Moore Show (CBS) | P5: The Big Payoff (NBC) | Q5: Welcome Travelers (NBC) | R5: The Kate Smith Hour (NBC) | T5: Double or Nothing (CBS) | U5: Strike It Rich (CBS) | V5: Movie [Matinee Theater]: Man From Frisco | X5: [4:15] Search For Tomorrow (CBS) | Y5: Love of Life (CBS); [4:45] TBA | Z5: Howdy Doody (NBC) | AA5: Tootsie Hippodrome (ABC) | AB5: Strike It Rich (CBS) | AC5: The CBS Evening News --Douglas Edwards (CBS); [6:45] Time for Beany | AD5: Pabst Blue Ribbon Bouts (CBS); [7:45] Camel News Caravan (NBC) | AF5: Hollywood Opening Night (NBC) | AG5: Arthur Godfrey and His Friends (CBS) | AH5: I Married Joan (NBC) | AI5: This is Your Life (NBC) | AJ5: Kraft Television Theatre (NBC) | AL5: March of Time | AM5: Movie [Nite Owl Theater]: Who Killed Aunt Maggie? | AX5: =A5 -> 19422
A6: =A5+7 -> 19429 | H6: United Nations General Assembly (NBC) | O6: Comedy Carnival; [11:45] The Garry Moore Show (CBS) | P6: The Big Payoff (NBC) | Q6: Welcome Travelers (NBC) | R6: The Kate Smith Hour (NBC) | T6: Double or Nothing (CBS) | U6: Strike It Rich (CBS) | V6: Movie [Matinee Theater]: Larceny on the Air | X6: [4:15] Search For Tomorrow (CBS) | Y6: Love of Life (CBS); [4:45] TBA | Z6: Howdy Doody (NBC) | AA6: Tootsie Hippodrome (ABC) | AB6: Strike It Rich (CBS) | AC6: The CBS Evening News --Douglas Edwards (CBS); [6:45] Time for Beany | AD6: Pabst Blue Ribbon Bouts (CBS); [7:45] Camel News Caravan (NBC) | AF6: Hollywood Opening Night (NBC) | AG6: Arthur Godfrey and His Friends (CBS) | AH6: I Married Joan (NBC) | AI6: This is Your Life (NBC) | AJ6: Kraft Television Theatre (NBC) | AL6: March of Time | AM6: Movie [Nite Owl Theater]: King of the Circus | AX6: =A6 -> 19429
A7: =A6+7 -> 19436 | H7: United Nations General Assembly (NBC) | O7: Comedy Carnival; [11:45] The Garry Moore Show (CBS) | P7: The Big Payoff (NBC) | Q7: Welcome Travelers (NBC) | R7: The Kate Smith Hour (NBC) | T7: Double or Nothing (CBS) | U7: Strike It Rich (CBS) | V7: Movie [Matinee Theater]: I Stand Accused | X7: [4:15] Search For Tomorrow (CBS) | Y7: Love of Life (CBS); [4:45] TBA | Z7: Howdy Doody (NBC) | AA7: Tootsie Hippodrome (ABC) | AB7: Strike It Rich (CBS) | AC7: The CBS Evening News --Douglas Edwards (CBS); [6:45] Time for Beany | AD7: Pabst Blue Ribbon Bouts (CBS); [7:45] Camel News Caravan (NBC) | AF7: Hollywood Opening Night (NBC) | AG7: Arthur Godfrey and His Friends (CBS) | AH7: I Married Joan (NBC) | AI7: This is Your Life (NBC) | AJ7: Kraft Television Theatre (NBC) | AL7: March of Time | AM7: Movie [Nite Owl Theater]: Bowery Boy | AX7: =A7 -> 19436
A8: =A7+7 -> 19443 | H8: United Nations General Assembly (NBC) | O8: Comedy Carnival; [11:45] The Garry Moore Show (CBS) | P8: The Big Payoff (NBC) | Q8: Welcome Travelers (NBC) | R8: The Kate Smith Hour (NBC) | T8: Double or Nothing (CBS) | U8: Strike It Rich (CBS) | V8: Movie [Matinee Theater]: Grandpa Goes to Town | X8: [4:15] Search For Tomorrow (CBS) | Y8: Love of Life (CBS); [4:45] TBA | Z8: Howdy Doody (NBC) | AA8: Tootsie Hippodrome (ABC) | AB8: Strike It Rich (CBS) | AC8: The CBS Evening News --Douglas Edwards (CBS); [6:45] Time for Beany | AD8: Pabst Blue Ribbon Bouts (CBS); [7:45] Camel News Caravan (NBC) | AF8: Hollywood Opening Night (NBC) | AG8: Arthur Godfrey and His Friends (CBS) | AH8: I Married Joan (NBC) | AI8: This is Your Life (NBC) | AJ8: Kraft Television Theatre (NBC) | AL8: March of Time | AM8: Movie [Nite Owl Theater]: Whispering Footsteps | AX8: =A8 -> 19443
A9: =A8+7 -> 19450 | O9: [11:45] The Garry Moore Show (CBS) | P9: The Big Payoff (NBC) | Q9: Welcome Travelers (NBC) | R9: The Kate Smith Hour (NBC) | T9: Double or Nothing (CBS) | U9: Strike It Rich (CBS) | V9: Movie [Matinee Theater]: TBA | X9: [4:15] Search For Tomorrow (CBS) | Y9: Love of Life (CBS); [4:45] TBA | Z9: Howdy Doody (NBC) | AA9: Tootsie Hippodrome (ABC) | AB9: Strike It Rich (CBS) | AC9: The CBS Evening News --Douglas Edwards (CBS); [6:45] Time for Beany | AD9: Pabst Blue Ribbon Bouts (CBS); [7:45] Camel News Caravan (NBC) | AF9: Hollywood Opening Night (NBC) | AG9: Arthur Godfrey and His Friends (CBS) | AH9: I Married Joan (NBC) | AI9: This is Your Life (NBC) | AJ9: Kraft Television Theatre (NBC) | AL9: Crusade in the Pacific | AM9: Movie [Nite Owl Theater]: TBA | AX9: =A9 -> 19450
A10: =A9+7 -> 19457 | O10: [11:45] The Garry Moore Show (CBS) | P10: The Big Payoff (NBC) | Q10: Welcome Travelers (NBC) | R10: The Kate Smith Hour (NBC) | T10: Double or Nothing (CBS) | U10: Strike It Rich (CBS) | V10: Movie [Matinee Theater]: The Great Train Robbery | X10: [4:15] Search For Tomorrow (CBS) | Y10: Love of Life (CBS); [4:45] TBA | Z10: Howdy Doody (NBC) | AA10: Tootsie Hippodrome (ABC) | AB10: Strike It Rich (CBS) | AC10: The CBS Evening News --Douglas Edwards (CBS); [6:45] Time for Beany | AD10: Pabst Blue Ribbon Bouts (CBS); [7:45] Camel News Caravan (NBC) | AF10: Hollywood Opening Night (NBC) | AG10: Arthur Godfrey and His Friends (CBS) | AH10: I Married Joan (NBC) | AI10: This is Your Life (NBC) | AJ10: Kraft Television Theatre (NBC) | AL10: Crusade in the Pacific | AM10: Movie [Nite Owl Theater]: True Glory | AX10: =A10 -> 19457
A11: =A10+7 -> 19464 | O11: [11:45] The Garry Moore Show (CBS) | P11: The Big Payoff (NBC) | Q11: Welcome Travelers (NBC) | R11: The Kate Smith Hour (NBC) | T11: Double or Nothing (CBS) | U11: Strike It Rich (CBS) | V11: Movie [Matinee Theater]: Silent Partner | X11: [4:15] Search For Tomorrow (CBS) | Y11: Love of Life (CBS); [4:45] TBA | Z11: Howdy Doody (NBC) | AA11: Tootsie Hippodrome (ABC) | AB11: Strike It Rich (CBS) | AC11: The CBS Evening News --Douglas Edwards (CBS); [6:45] Time for Beany | AD11: Pabst Blue Ribbon Bouts (CBS); [7:45] Camel News Caravan (NBC) | AF11: Hollywood Opening Night (NBC) | AG11: Arthur Godfrey and His Friends (CBS) | AH11: I Married Joan (NBC) | AI11: This is Your Life (NBC) | AJ11: Kraft Television Theatre (NBC) | AL11: Crusade in the Pacific | AM11: Movie [Nite Owl Theater]: Melody Master | AX11: =A11 -> 19464
A12: =A11+7 -> 19471 | O12: [11:45] The Garry Moore Show (CBS) | P12: The Big Payoff (NBC) | Q12: Welcome Travelers (NBC) | R12: The Kate Smith Hour (NBC) | T12: Double or Nothing (CBS) | U12: Strike It Rich (CBS) | V12: Movie [Matinee Theater]: The Purple V | X12: [4:15] Search For Tomorrow (CBS) | Y12: Love of Life (CBS); [4:45] TBA | Z12: Howdy Doody (NBC) | AA12: Tootsie Hippodrome (ABC) | AB12: Strike It Rich (CBS) | AC12: The CBS Evening News --Douglas Edwards (CBS); [6:45] Time for Beany | AD12: Pabst Blue Ribbon Bouts (CBS); [7:45] Camel News Caravan (NBC) | AF12: Liberace | AG12: Arthur Godfrey and His Friends (CBS) | AH12: I Married Joan (NBC) | AI12: This is Your Life (NBC) | AJ12: Kraft Television Theatre (NBC) | AL12: Crusade in the Pacific | AM12: Movie [Nite Owl Theater]: Remedy for Riches | AX12: =A12 -> 19471
B13: OTHER CITIES SWITCH TO DAYLIGHT SAVINGS TIME; PORTLAND SHOWS AIR ONE HOUR EARLIER | J13: OTHER CITIES SWITCH TO DAYLIGHT SAVINGS TIME; PORTLAND SHOWS AIR ONE HOUR EARLIER | R13: OTHER CITIES SWITCH TO DAYLIGHT SAVINGS TIME; PORTLAND SHOWS AIR ONE HOUR EARLIER | Z13: OTHER CITIES SWITCH TO DAYLIGHT SAVINGS TIME; PORTLAND SHOWS AIR ONE HOUR EARLIER | AH13: OTHER CITIES SWITCH TO DAYLIGHT SAVINGS TIME; PORTLAND SHOWS AIR ONE HOUR EARLIER | AP13: OTHER CITIES SWITCH TO DAYLIGHT SAVINGS TIME; PORTLAND SHOWS AIR ONE HOUR EARLIER
A14: =A12+7 -> 19478 | K14: What's Cooking? | L14: Local Film | M14: [10:45] The Garry Moore Show (CBS) | N14: The Big Payoff (NBC) | O14: Welcome Travelers (NBC) | P14: The Kate Smith Hour (NBC) | R14: Double or Nothing (CBS) | S14: Strike It Rich (CBS) | T14: Movie [Matinee Theater]: Mystery Broadcast | V14: [3:15] Search For Tomorrow (CBS) | W14: Love of Life (CBS); [3:45] TBA | X14: Howdy Doody (NBC) | Y14: Tootsie Hippodrome (ABC) | Z14: Strike It Rich (CBS) | AA14: The CBS Evening News --Douglas Edwards (CBS); [5:45] Time for Beany | AB14: Pabst Blue Ribbon Bouts (CBS); [6:45] Camel News Caravan (NBC) | AD14: Liberace | AE14: Arthur Godfrey and His Friends (CBS) | AF14: I Married Joan (NBC) | AG14: This is Your Life (NBC) | AH14: Kraft Television Theatre (NBC) | AJ14: Crusade in the Pacific | AK14: Movie [Nite Owl Theater]: TBA | AX14: =A14 -> 19478
A15: =A14+7 -> 19485 | K15: What's Cooking? | L15: Local Film | M15: [10:45] The Garry Moore Show (CBS) | N15: The Big Payoff (NBC) | O15: Welcome Travelers (NBC) | P15: The Kate Smith Hour (NBC) | R15: Double or Nothing (CBS) | S15: Strike It Rich (CBS) | T15: Movie [Matinee Theater]: TBA | V15: [3:15] Search For Tomorrow (CBS) | W15: Love of Life (CBS); [3:45] TBA | X15: Howdy Doody (NBC) | Y15: Tootsie Hippodrome (ABC) | Z15: Strike It Rich (CBS) | AA15: The CBS Evening News --Douglas Edwards (CBS); [5:45] Time for Beany | AB15: Pabst Blue Ribbon Bouts (CBS); [6:45] Camel News Caravan (NBC) | AD15: Liberace | AE15: Arthur Godfrey and His Friends (CBS) | AF15: I Married Joan (NBC) | AG15: This is Your Life (NBC) | AH15: Kraft Television Theatre (NBC) | AJ15: Crusade in the Pacific | AK15: Movie [Nite Owl Theater]: TBA | AX15: =A15 -> 19485
A16: =A15+7 -> 19492 | K16: What's Cooking? | L16: Local Film | M16: [10:45] The Garry Moore Show (CBS) | N16: The Big Payoff (NBC) | O16: Welcome Travelers (NBC) | P16: The Kate Smith Hour (NBC) | R16: Double or Nothing (CBS) | S16: Strike It Rich (CBS) | T16: Movie [Matinee Theater]: Rythym in the Clouds | V16: [3:15] Search For Tomorrow (CBS) | W16: Love of Life (CBS); [3:45] The Toymaker | X16: Howdy Doody (NBC) | Y16: Tootsie Hippodrome (ABC) | Z16: Strike It Rich (CBS) | AA16: The CBS Evening News --Douglas Edwards (CBS); [5:45] Time for Beany | AB16: Pabst Blue Ribbon Bouts (CBS); [6:45] Camel News Caravan (NBC) | AD16: Liberace | AE16: Arthur Godfrey and His Friends (CBS) | AF16: I Married Joan (NBC) | AG16: This is Your Life (NBC) | AH16: Kraft Television Theatre (NBC) | AJ16: Crusade in the Pacific | AK16: Movie [Nite Owl Theater]: Police Bullets | AX16: =A16 -> 19492
A17: =A16+7 -> 19499 | K17: What's Cooking? | L17: Local Film | M17: [10:45] The Garry Moore Show (CBS) | N17: The Big Payoff (NBC) | O17: Welcome Travelers (NBC) | P17: The Kate Smith Hour (NBC) | R17: Double or Nothing (CBS) | S17: Strike It Rich (CBS) | T17: Movie [Matinee Theater]: Hitchhike Lady | V17: [3:15] Search For Tomorrow (CBS) | W17: Love of Life (CBS); [3:45] The Toymaker | X17: Howdy Doody (NBC) | Y17: Tootsie Hippodrome (ABC) | Z17: Strike It Rich (CBS) | AA17: The CBS Evening News --Douglas Edwards (CBS); [5:45] Time for Beany | AB17: Pabst Blue Ribbon Bouts (CBS); [6:45] Camel News Caravan (NBC) | AD17: Liberace | AE17: Arthur Godfrey and His Friends (CBS) | AF17: I Married Joan (NBC) | AG17: This is Your Life (NBC) | AH17: Kraft Television Theatre (NBC) | AJ17: Crusade in the Pacific | AK17: Movie [Nite Owl Theater]: Borrowed Hero | AX17: =A17 -> 19499
A18: =A17+7 -> 19506 | K18: What's Cooking? | L18: Local Film | M18: [10:45] The Garry Moore Show (CBS) | N18: The Big Payoff (NBC) | O18: Welcome Travelers (NBC) | P18: The Kate Smith Hour (NBC) | R18: Double or Nothing (CBS) | S18: Strike It Rich (CBS) | T18: Movie [Matinee Theater]: Circus Girl | V18: [3:15] Search For Tomorrow (CBS) | W18: Love of Life (CBS); [3:45] The Toymaker | X18: Howdy Doody (NBC) | Y18: Tootsie Hippodrome (ABC) | Z18: Strike It Rich (CBS) | AA18: The CBS Evening News --Douglas Edwards (CBS); [5:45] Time for Beany | AB18: Pabst Blue Ribbon Bouts (CBS); [6:45] Camel News Caravan (NBC) | AD18: Liberace | AE18: Arthur Godfrey and His Friends (CBS) | AF18: I Married Joan (NBC) | AG18: This is Your Life (NBC) | AH18: Kraft Television Theatre (NBC) | AJ18: Crusade in the Pacific | AK18: Movie [Nite Owl Theater]: Oh What a Night | AX18: =A18 -> 19506
B19: KPTV BECOMES NBC AFFILIATE | J19: KPTV BECOMES NBC AFFILIATE | R19: KPTV BECOMES NBC AFFILIATE | Z19: KPTV BECOMES NBC AFFILIATE | AH19: KPTV BECOMES NBC AFFILIATE | AP19: KPTV BECOMES NBC AFFILIATE
A20: =A18+7 -> 19513 | K20: What's Cooking? | L20: Local Film | M20: [10:45] The Garry Moore Show (CBS) | N20: The Big Payoff (NBC) | O20: Welcome Travelers (NBC) | P20: The Kate Smith Hour (NBC) | R20: Double or Nothing (CBS) | S20: Strike It Rich (CBS) | T20: Movie [Matinee Theater]: Mama Runs Wild | V20: [3:15] Search For Tomorrow (CBS) | W20: Love of Life (CBS); [3:45] The Toymaker | X20: Howdy Doody (NBC) | Y20: Tootsie Hippodrome (ABC) | Z20: Strike It Rich (CBS) | AA20: The CBS Evening News --Douglas Edwards (CBS); [5:45] Time for Beany | AB20: Pabst Blue Ribbon Bouts (CBS); [6:45] Camel News Caravan (NBC) | AD20: Liberace | AE20: Arthur Godfrey and His Friends (CBS) | AF20: I Married Joan (NBC) | AG20: This is Your Life (NBC) | AH20: Kraft Television Theatre (NBC) | AJ20: Crusade in the Pacific | AK20: Movie [Nite Owl Theater]: Woman's Man | AX20: =A20 -> 19513
A21: =A20+7 -> 19520 | K21: What's Cooking? | L21: Local Film | M21: [10:45] The Garry Moore Show (CBS) | N21: The Big Payoff (NBC) | O21: Welcome Travelers (NBC) | P21: On Your Account (NBC) | Q21: Ladie's Choice (NBC) | R21: Double or Nothing (CBS) | S21: Strike It Rich (CBS) | T21: Movie [Matinee Theater]: Laughing Irish Eyes | V21: [3:15] Search For Tomorrow (CBS) | W21: Love of Life (CBS); [3:45] The Toymaker | X21: Howdy Doody (NBC) | Y21: Tootsie Hippodrome (ABC) | Z21: Strike It Rich (CBS) | AA21: The CBS Evening News --Douglas Edwards (CBS); [5:45] Time for Beany | AB21: Pabst Blue Ribbon Bouts (CBS); [6:45] Camel News Caravan (NBC) | AD21: Liberace | AE21: Arthur Godfrey and His Friends (CBS) | AF21: I Married Joan (NBC) | AG21: This is Your Life (NBC) | AH21: Kraft Television Theatre (NBC) | AJ21: Crusade in the Pacific | AK21: Movie [Nite Owl Theater]: Riot Squad | AX21: =A21 -> 19520
A22: =A21+7 -> 19527 | K22: What's Cooking? | L22: Local Film | M22: [10:45] The Garry Moore Show (CBS) | N22: The Big Payoff (NBC) | O22: Welcome Travelers (NBC) | P22: On Your Account (NBC) | Q22: Ladie's Choice (NBC) | R22: Double or Nothing (CBS) | S22: Strike It Rich (CBS) | T22: Movie [Matinee Theater]: Lady Behave | V22: [3:15] Search For Tomorrow (CBS) | W22: Love of Life (CBS); [3:45] The Toymaker | X22: Howdy Doody (NBC) | Y22: Tootsie Hippodrome (ABC) | Z22: Strike It Rich (CBS) | AA22: The CBS Evening News --Douglas Edwards (CBS); [5:45] Time for Beany | AB22: Pabst Blue Ribbon Bouts (CBS); [6:45] Camel News Caravan (NBC) | AD22: Liberace | AE22: Arthur Godfrey and His Friends (CBS) | AF22: I Married Joan (NBC) | AG22: This is Your Life (NBC) | AH22: My Son Jeep | AI22: TBA | AJ22: Crusade in the Pacific | AK22: Rose Festival Ski Run; [10:45] Movie [Nite Owl Theater]: Rythym Parade | AX22: =A22 -> 19527
A23: =A22+7 -> 19534 | K23: What's Cooking? | L23: Local Film | M23: [10:45] The Garry Moore Show (CBS) | N23: The Big Payoff (NBC) | O23: Welcome Travelers (NBC) | P23: On Your Account (NBC) | Q23: Ladie's Choice (NBC) | R23: Double or Nothing (CBS) | S23: Strike It Rich (CBS) | T23: Movie [Matinee Theater]: Main Street Lawyer | V23: [3:15] Search For Tomorrow (CBS) | W23: Love of Life (CBS); [3:45] The Toymaker | X23: Howdy Doody (NBC) | Y23: Tootsie Hippodrome (ABC) | Z23: Strike It Rich (CBS) | AA23: The CBS Evening News --Douglas Edwards (CBS); [5:45] Time for Beany | AB23: Pabst Blue Ribbon Bouts (CBS); [6:45] Camel News Caravan (NBC) | AD23: Liberace | AE23: Arthur Godfrey and His Friends (CBS) | AF23: I Married Joan (NBC) | AG23: This is Your Life (NBC) | AH23: Kraft Television Theatre (NBC) | AJ23: Orient Express | AK23: League of Women Voters (Live) | AL23: Crusade in the Pacific | AM23: Movie [Nite Owl Theater]: Girl of My Dreams | AX23: =A23 -> 19534
A24: =A23+7 -> 19541 | K24: What's Cooking? | L24: Local Film | M24: [10:45] The Garry Moore Show (CBS) | N24: The Big Payoff (NBC) | O24: Welcome Travelers (NBC) | P24: On Your Account (NBC) | Q24: Ladie's Choice (NBC) | R24: Double or Nothing (CBS) | S24: Strike It Rich (CBS) | T24: Movie [Matinee Theater]: Main Street Lawyer | V24: [3:15] Search For Tomorrow (CBS) | W24: Love of Life (CBS); [3:45] The Toymaker | X24: Howdy Doody (NBC) | Y24: Tootsie Hippodrome (ABC) | Z24: Strike It Rich (CBS) | AA24: The CBS Evening News --Douglas Edwards (CBS); [5:45] Time for Beany | AB24: Pabst Blue Ribbon Bouts (CBS); [6:45] Camel News Caravan (NBC) | AD24: Liberace | AE24: Arthur Godfrey and His Friends (CBS) | AF24: I Married Joan (NBC) | AG24: This is Your Life (NBC) | AH24: Kraft Television Theatre (NBC) | AJ24: Orient Express | AK24: Drama Playhouse | AL24: Crusade in the Pacific | AM24: Movie [Nite Owl Theater]: Isle of Missing Men | AX24: =A24 -> 19541
A25: =A24+7 -> 19548 | K25: What's Cooking? | L25: Local Film | M25: [10:45] The Garry Moore Show (CBS) | N25: The Big Payoff (NBC) | O25: Welcome Travelers (NBC) | P25: On Your Account (NBC) | Q25: Ladie's Choice (NBC) | R25: Double or Nothing (CBS) | S25: Strike It Rich (CBS) | T25: Movie [Matinee Theater]: One Thousand Dollars a Minute | V25: [3:15] Search For Tomorrow (CBS) | W25: Love of Life (CBS); [3:45] The Toymaker | X25: Howdy Doody (NBC) | Y25: Tootsie Hippodrome (ABC) | Z25: Strike It Rich (CBS) | AA25: The CBS Evening News --Douglas Edwards (CBS); [5:45] Time for Beany | AB25: Pabst Blue Ribbon Bouts (CBS); [6:45] Camel News Caravan (NBC) | AD25: Liberace | AE25: Place the Face (NBC) | AF25: I Married Joan (NBC) | AG25: This is Your Life (NBC) | AH25: Kraft Television Theatre (NBC) | AJ25: Orient Express | AK25: Drama Playhouse | AL25: Crusade in the Pacific | AM25: Movie [Nite Owl Theater]: Shock | AX25: =A25 -> 19548
A26: =A25+7 -> 19555 | K26: What's Cooking? | L26: Local Film | M26: [10:45] The Garry Moore Show (CBS) | N26: The Big Payoff (NBC) | O26: Welcome Travelers (NBC) | P26: On Your Account (NBC) | Q26: Ladie's Choice (NBC) | R26: Double or Nothing (CBS) | S26: Strike It Rich (CBS) | T26: Movie [Matinee Theater]: Mickey the Kid | V26: [3:15] Search For Tomorrow (CBS) | W26: Love of Life (CBS); [3:45] The Toymaker | X26: Howdy Doody (NBC) | Y26: Tootsie Hippodrome (ABC) | Z26: Strike It Rich (CBS) | AA26: The CBS Evening News --Douglas Edwards (CBS); [5:45] Time for Beany | AB26: Pabst Blue Ribbon Bouts (CBS); [6:45] Camel News Caravan (NBC) | AD26: Liberace | AE26: Place the Face (NBC) | AF26: I Married Joan (NBC) | AG26: Candid Camera (NBC) | AH26: Kraft Television Theatre (NBC) | AJ26: Orient Express | AK26: Drama Playhouse | AL26: Crusade in the Pacific | AM26: Movie [Nite Owl Theater]: Great God Gold | AX26: =A26 -> 19555
A27: =A26+7 -> 19562 | K27: What's Cooking? | L27: Local Film | M27: [10:45] TBA | N27: The Big Payoff (NBC) | O27: Welcome Travelers (NBC) | P27: On Your Account (NBC) | Q27: Ladie's Choice (NBC) | R27: Double or Nothing (CBS) | S27: Strike It Rich (CBS) | T27: Movie [Matinee Theater]: Higgins Family | V27: [3:15] Search For Tomorrow (CBS) | W27: Love of Life (CBS); [3:45] The Toymaker | X27: Howdy Doody (NBC) | Y27: Tootsie Hippodrome (ABC) | Z27: Strike It Rich (CBS) | AA27: Alka-Seltzer Newspaper of the Air; [5:45] Time for Beany | AB27: Pabst Blue Ribbon Bouts (CBS); [6:45] Camel News Caravan (NBC) | AD27: Liberace | AE27: TBA | AF27: I Married Joan (NBC) | AG27: Candid Camera (NBC) | AH27: Kraft Television Theatre (NBC) | AJ27: Orient Express | AK27: Half-Hour Theater | AL27: Crusade in the Pacific | AM27: Movie [Nite Owl Theater]: Haunted House | AX27: =A27 -> 19562
A28: =A27+7 -> 19569 | K28: What's Cooking? | L28: Local Film | M28: [10:45] TBA | N28: The Big Payoff (NBC) | O28: Welcome Travelers (NBC) | P28: On Your Account (NBC) | Q28: Ladie's Choice (NBC) | R28: Double or Nothing (CBS) | S28: Strike It Rich (CBS) | T28: Movie [Matinee Theater]: Country Gentleman | V28: [3:15] Search For Tomorrow (CBS) | W28: Love of Life (CBS); [3:45] The Toymaker | X28: Howdy Doody (NBC) | Y28: Tootsie Hippodrome (ABC) | Z28: Strike It Rich (CBS) | AA28: Northwest News Digest; [5:40] Alka-Seltzer Newspaper of the Air; [5:45] Time for Beany | AB28: Pabst Blue Ribbon Bouts (CBS); [6:45] Camel News Caravan (NBC) | AD28: Liberace | AE28: TBA | AF28: I Married Joan (NBC) | AG28: Candid Camera (NBC) | AH28: Kraft Television Theatre (NBC) | AJ28: Orient Express | AK28: Half-Hour Theater | AL28: Crusade in the Pacific | AM28: Movie [Nite Owl Theater]: Chinese Cat | AX28: =A28 -> 19569
A29: =A28+7 -> 19576 | K29: What's Cooking? | L29: Local Film | M29: [10:45] TBA | N29: The Big Payoff (NBC) | O29: Welcome Travelers (NBC) | P29: On Your Account (NBC) | Q29: Ladie's Choice (NBC) | R29: Double or Nothing (CBS) | S29: Strike It Rich (CBS) | T29: Movie [Matinee Theater]: SOS Tidal Wave | V29: [3:15] Search For Tomorrow (CBS) | W29: Love of Life (CBS); [3:45] The Toymaker | X29: Howdy Doody (NBC) | Y29: TBA | Z29: Strike It Rich (CBS) | AA29: Northwest News Digest; [5:40] Alka-Seltzer Newspaper of the Air; [5:45] Time for Beany | AB29: Pabst Blue Ribbon Bouts (CBS); [6:45] Camel News Caravan (NBC) | AD29: Liberace | AE29: TBA | AF29: I Married Joan (NBC) | AG29: Candid Camera (NBC) | AH29: Kraft Television Theatre (NBC) | AJ29: Orient Express | AK29: Half-Hour Theater | AL29: Crusade in the Pacific | AM29: Movie [Nite Owl Theater]: Queen of the Yukon | AX29: =A29 -> 19576
A30: =A29+7 -> 19583 | K30: What's Cooking? | L30: Local Film | M30: [10:45] TBA | N30: The Big Payoff (NBC) | O30: Welcome Travelers (NBC) | P30: On Your Account (NBC) | Q30: Ladie's Choice (NBC) | R30: Double or Nothing (CBS) | S30: Strike It Rich (CBS) | T30: Movie [Matinee Theater]: Gangs of New York | V30: [3:15] Search For Tomorrow (CBS) | W30: Love of Life (CBS); [3:45] The Toymaker | X30: Howdy Doody (NBC) | Y30: Oops It's Daisy | Z30: Strike It Rich (CBS) | AA30: Northwest News Digest; [5:40] Alka-Seltzer Newspaper of the Air; [5:45] Time for Beany | AB30: Pabst Blue Ribbon Bouts (CBS); [6:45] Camel News Caravan (NBC) | AD30: Liberace | AE30: Scott Music Hall (NBC) | AF30: I Married Joan (NBC) | AG30: This is Your Life (NBC) | AH30: Kraft Television Theatre (NBC) | AJ30: Orient Express | AK30: Half-Hour Theater | AL30: Crusade in the Pacific | AM30: Movie [Nite Owl Theater]: Meeting at Midnight | AX30: =A30 -> 19583
A31: =A30+7 -> 19590 | K31: What's Cooking? | L31: Local Film | M31: [10:45] TBA | N31: The Big Payoff (NBC) | O31: Welcome Travelers (NBC) | P31: On Your Account (NBC) | Q31: United Nations General Assembly (NBC) | R31: Double or Nothing (CBS) | S31: Strike It Rich (CBS) | T31: Movie [Matinee Theater]: Covered Trailer | V31: [3:15] Search For Tomorrow (CBS) | W31: Love of Life (CBS); [3:45] The Toymaker | X31: Howdy Doody (NBC) | Y31: TBA | Z31: Strike It Rich (CBS) | AA31: Northwest News Digest; [5:40] Alka-Seltzer Newspaper of the Air; [5:45] Time for Beany | AB31: Pabst Blue Ribbon Bouts (CBS); [6:45] Camel News Caravan (NBC) | AD31: Liberace | AE31: TBA | AF31: I Married Joan (NBC) | AG31: This is Your Life (NBC) | AH31: Kraft Television Theatre (NBC) | AJ31: Orient Express | AK31: Half-Hour Theater | AL31: Crusade in the Pacific | AM31: Movie [Nite Owl Theater]: The Jade Mask | AX31: =A31 -> 19590
A32: =A31+7 -> 19597 | K32: What's Cooking? | L32: Local Film | M32: [10:45] TBA | N32: The Big Payoff (NBC) | O32: Welcome Travelers (NBC) | P32: On Your Account (NBC) | Q32: United Nations General Assembly (NBC) | R32: Double or Nothing (CBS) | S32: Strike It Rich (CBS) | T32: Movie [Matinee Theater]: Woman Doctor | V32: [3:15] Search For Tomorrow (CBS) | W32: Love of Life (CBS); [3:45] The Toymaker | X32: Howdy Doody (NBC) | Y32: TBA | Z32: Strike It Rich (CBS) | AA32: TBA; [5:45] Northwest News Digest; [5:55] Alka-Seltzer Newspaper of the Air | AB32: Pabst Blue Ribbon Bouts (CBS); [6:45] Camel News Caravan (NBC) | AD32: Liberace | AE32: Scott Music Hall (NBC) | AF32: I Married Joan (NBC) | AG32: This is Your Life (NBC) | AH32: Kraft Television Theatre (NBC) | AJ32: Orient Express | AK32: Half-Hour Theater | AL32: Crusade in the Pacific | AM32: Movie [Nite Owl Theater]: Right Man | AX32: =A32 -> 19597
A33: =A32+7 -> 19604 | K33: What's Cooking? | L33: Local Film | M33: [10:45] TBA | N33: The Big Payoff (NBC) | O33: Welcome Travelers (NBC) | P33: On Your Account (NBC) | Q33: United Nations General Assembly (NBC) | R33: Double or Nothing (CBS) | S33: Strike It Rich (CBS) | T33: Movie [Matinee Theater]: The Gentleman from Louisiana (1936) | V33: [3:15] Search For Tomorrow (CBS) | W33: Love of Life (CBS); [3:45] The Toymaker | X33: Howdy Doody (NBC) | Y33: TBA | Z33: Strike It Rich (CBS) | AA33: TBA; [5:45] Northwest News Digest; [5:55] Alka-Seltzer Newspaper of the Air | AB33: Pabst Blue Ribbon Bouts (CBS); [6:45] Camel News Caravan (NBC) | AD33: Liberace | AE33: Scott Music Hall (NBC) | AF33: I Married Joan (NBC) | AG33: This is Your Life (NBC) | AH33: Kraft Television Theatre (NBC) | AJ33: Orient Express | AK33: Half-Hour Theater | AL33: Crusade in the Pacific | AM33: Movie [Nite Owl Theater]: Melody for Three | AX33: =A33 -> 19604
A34: =A33+7 -> 19611 | K34: What's Cooking? | L34: Local Film | M34: [10:45] TBA | N34: The Big Payoff (NBC) | O34: Welcome Travelers (NBC) | P34: On Your Account (NBC) | Q34: United Nations General Assembly (NBC) | R34: Double or Nothing (CBS) | S34: Strike It Rich (CBS) | T34: Movie [Matinee Theater]: Earl of Puddlestone (1940) | V34: [3:15] Search For Tomorrow (CBS) | W34: Love of Life (CBS); [3:45] The Toymaker | X34: Howdy Doody (NBC) | Y34: TBA | Z34: Strike It Rich (CBS) | AA34: TBA; [5:45] Northwest News Digest; [5:55] Alka-Seltzer Newspaper of the Air | AB34: Pabst Blue Ribbon Bouts (CBS); [6:45] Camel News Caravan (NBC) | AD34: Liberace | AE34: My Little Margie (NBC) | AF34: I Married Joan (NBC) | AG34: This is Your Life (NBC) | AH34: Kraft Television Theatre (NBC) | AJ34: Orient Express | AK34: Half-Hour Theater | AL34: Crusade in the Pacific | AM34: Movie [Nite Owl Theater]: Cheers for Miss Bishop (1941) | AX34: =A34 -> 19611
A35: =A34+7 -> 19618 | K35: What's Cooking? | L35: Local Film | M35: [10:45] TBA | N35: The Big Payoff (NBC) | O35: Welcome Travelers (NBC) | P35: On Your Account (NBC) | Q35: United Nations General Assembly (NBC) | R35: Double or Nothing (CBS) | S35: Strike It Rich (CBS) | T35: Movie [Matinee Theater]: Hearts in Bondage (1936) | V35: [3:15] Search For Tomorrow (CBS) | W35: Love of Life (CBS); [3:45] The Toymaker | X35: Howdy Doody (NBC) | Y35: TBA | Z35: Strike It Rich (CBS) | AA35: TBA; [5:45] Northwest News Digest; [5:55] Alka-Seltzer Newspaper of the Air | AB35: Pabst Blue Ribbon Bouts (CBS); [6:45] Camel News Caravan (NBC) | AD35: Liberace | AE35: My Little Margie (NBC) | AF35: I Married Joan (NBC) | AG35: This is Your Life (NBC) | AH35: Kraft Television Theatre (NBC) | AJ35: Orient Express | AK35: Half-Hour Theater | AL35: Crusade in the Pacific | AM35: Movie [Nite Owl Theater]: Shadow of Suspicion (1944) | AX35: =A35 -> 19618
A36: =A35+7 -> 19625 | K36: What's Cooking? | L36: Ding Dong School (NBC) | M36: [10:45] TBA | N36: The Big Payoff (NBC) | O36: Welcome Travelers (NBC) | P36: On Your Account (NBC) | Q36: Movie [Matinee Theater]: Hearts in Bondage (1936) | S36: Strike It Rich (CBS) | T36: Double or Nothing (CBS) | U36: The Kate Smith Hour (NBC) | V36: [3:15] Search For Tomorrow (CBS) | W36: Love of Life (CBS); [3:45] The Toymaker | X36: Howdy Doody (NBC) | Y36: TBA | Z36: Strike It Rich (CBS) | AA36: TBA; [5:45] Northwest News Digest; [5:55] Alka-Seltzer Newspaper of the Air | AB36: Pabst Blue Ribbon Bouts (CBS); [6:45] Camel News Caravan (NBC) | AD36: Liberace | AE36: My Little Margie (NBC) | AF36: I Married Joan (NBC) | AG36: This is Your Life (NBC) | AH36: Kraft Television Theatre (NBC) | AJ36: Half-Hour Theater | AK36: Death Valley Days | AL36: Crusade in the Pacific | AM36: Movie [Nite Owl Theater]: Prison Shadows (1936) | AX36: =A36 -> 19625
A37: =A36+7 -> 19632 | J37: [9:15] What's Cooking? | K37: [9:45] World Series Baseball: Brooklyn Dodgers vs. New York Yankees (Game 1) (NBC) | Q37: [12:45] Hawkins Falls (NBC) | R37: Movie [Matinee Theater]: Meet the Missus (1940) | U37: On Your Account (NBC) | V37: The Kate Smith Hour (NBC) | X37: Welcome Travelers (NBC) | Y37: The Toymaker | Z37: Howdy Doody (NBC) | AA37: TBA | AB37: The Name's The Same (ABC) | AC37: Sid Porter; [6:45] Northwest News Digest; [6:50] Spors on View; [6:55] Alka-Seltzer Newspaper of the Air | AD37: Candy Theater | AE37: Coke Time (NBC); [7:45] Camel News Caravan (NBC) | AF37: I Married Joan (NBC) | AG37: My Little Margie (NBC) | AH37: Kraft Television Theatre (NBC) | AJ37: This is Your Life (NBC) | AK37: Cavalcade of America (ABC) | AL37: News; [11:15] Movie: [Nite Owl Theater]: I'll Name the Murderer (1936) | AX37: =A37 -> 19632
A39: 1960 | AX39: 1960
A40: 21921 | F40: OMSI Presents | G40: Eye Opener | H40: Uncle Charlie's Roundhouse | J40: Romper Room | K40: Movie [Early Show]: When Were You Born? (1938) | N40: The Better Half | O40: The Life of Riley | P40: Restless Gun (ABC) | Q40: Love That Bob! (ABC) | R40: About Faces (ABC) | S40: Big Story | T40: Day in Court (ABC) | U40: Gale Storm (ABC) | V40: Beat the Clock (ABC) | W40: Who Do You Trust? (ABC) | X40: American Bandstand (ABC) | Y40: High Time | Z40: Three Stooges | AA40: My Friend Flicka (ABC) | AB40: Cartoons--Uncle Charlie; [6:15] News--John Salisbury; [6:25] Sports Roundup--Charlie LaFranchise | AC40: Danger is My Business | AD40: The Wednesday Night Fights (Boxing) (ABC) | AE40: Boxing (ABC); [7:45] Sports By-Line--Sanders | AF40: The Charley Weaver Show (ABC) | AG40: The Adventures of Ozzie and Harriet (ABC) | AH40: Hawaiian Eye (ABC) | AJ40: Badge 714 | AK40: Mike Hammer | AL40: News; [11:15] Movie [Academy Theater]: Broadway Gondolier (1935) | AX40: =A40 -> 21921
A41: 21928 | F41: OMSI Presents | G41: Eye Opener | H41: Uncle Charlie's Roundhouse | J41: Romper Room | K41: Movie [Early Show]: A Very Honorable Guy (1934) | N41: The Better Half | O41: The Life of Riley | P41: Restless Gun (ABC) | Q41: Love That Bob! (ABC) | R41: About Faces (ABC) | S41: Big Story | T41: Day in Court (ABC) | U41: Gale Storm (ABC) | V41: Beat the Clock (ABC) | W41: Who Do You Trust? (ABC) | X41: American Bandstand (ABC) | Y41: High Time | Z41: Three Stooges | AA41: My Friend Flicka (ABC) | AB41: Cartoons--Uncle Charlie; [6:15] News--John Salisbury; [6:25] Sports Roundup--Charlie LaFranchise | AC41: Danger is My Business | AD41: The Wednesday Night Fights (Boxing) (ABC) | AE41: Boxing (ABC); [7:45] Sports By-Line--Sanders | AF41: The Charley Weaver Show (ABC) | AG41: The Adventures of Ozzie and Harriet (ABC) | AH41: Hawaiian Eye (ABC) | AJ41: Badge 714 | AK41: Mike Hammer | AL41: News; [11:15] Movie [Academy Theater]: Flamingo Road (1949) | AX41: =A41 -> 21928
A42: 21935 | F42: OMSI Presents | G42: Eye Opener | H42: Uncle Charlie's Roundhouse | J42: Romper Room | K42: Movie [Early Show]: Spy Ship (1942) | N42: The Better Half | O42: The Life of Riley | P42: Restless Gun (ABC) | Q42: Love That Bob! (ABC) | R42: About Faces (ABC) | S42: Big Story | T42: Day in Court (ABC) | U42: Gale Storm (ABC) | V42: Beat the Clock (ABC) | W42: Who Do You Trust? (ABC) | X42: American Bandstand (ABC) | Y42: High Time | Z42: Three Stooges | AA42: My Friend Flicka (ABC) | AB42: Cartoons--Uncle Charlie; [6:15] News--John Salisbury | AC42: Danger is My Business | AD42: The Wednesday Night Fights (Boxing) (ABC) | AE42: Boxing (ABC); [7:45] Sports By-Line--Sanders | AF42: The Charley Weaver Show (ABC) | AG42: The Adventures of Ozzie and Harriet (ABC) | AH42: Hawaiian Eye (ABC) | AJ42: Badge 714 | AK42: Mike Hammer | AL42: News; [11:15] Movie [Academy Theater]: The Very Thought of You (1944) | AX42: =A42 -> 21935
A43: 21942 | F43: OMSI Presents | G43: Eye Opener | H43: Uncle Charlie's Roundhouse | J43: Romper Room | K43: Movie [Early Show]: Sing Me a Love Song (1936) | N43: The Better Half | O43: The Life of Riley | P43: Restless Gun (ABC) | Q43: Love That Bob! (ABC) | R43: About Faces (ABC) | S43: Big Story | T43: Day in Court (ABC) | U43: Gale Storm (ABC) | V43: Beat the Clock (ABC) | W43: Who Do You Trust? (ABC) | X43: American Bandstand (ABC) | Y43: High Time | Z43: Three Stooges | AA43: My Friend Flicka (ABC) | AB43: Cartoons--Uncle Charlie; [6:15] News--John Salisbury | AC43: Danger is My Business | AD43: The Wednesday Night Fights (Boxing) (ABC) | AE43: Boxing (ABC); [7:45] Sports By-Line--Sanders | AF43: The Charley Weaver Show (ABC) | AG43: The Adventures of Ozzie and Harriet (ABC) | AH43: Hawaiian Eye (ABC) | AJ43: Badge 714 | AK43: Mike Hammer | AL43: News; [11:15] Movie [Academy Theater]: The Great Garrick (1937) | AX43: =A43 -> 21942
A44: 21949 | F44: OMSI Presents | G44: Eye Opener | H44: Uncle Charlie's Roundhouse | J44: Romper Room | K44: Movie [Early Show]: The Black Ship ( ? ) | N44: The Better Half | O44: The Life of Riley | P44: Restless Gun (ABC) | Q44: Love That Bob! (ABC) | R44: About Faces (ABC) | S44: Big Story | T44: Day in Court (ABC) | U44: Gale Storm (ABC) | V44: Beat the Clock (ABC) | W44: Who Do You Trust? (ABC) | X44: American Bandstand (ABC) | Y44: High Time | Z44: Three Stooges | AA44: My Friend Flicka (ABC) | AB44: Cartoons--Uncle Charlie; [6:15] News--John Salisbury | AC44: Danger is My Business | AD44: The Wednesday Night Fights (Boxing) (ABC) | AE44: Boxing (ABC); [7:45] Sports By-Line--Sanders | AF44: The Charley Weaver Show (ABC) | AG44: The Adventures of Ozzie and Harriet (ABC) | AH44: Hawaiian Eye (ABC) | AJ44: Badge 714 | AK44: Mike Hammer | AL44: News; [11:15] Movie [Academy Theater]: The Red House (1947) | AX44: =A44 -> 21949
A45: 21956 | F45: OMSI Presents | G45: Eye Opener | H45: Uncle Charlie's Roundhouse | J45: Romper Room | K45: Movie [Early Show]: Black Friday (1940) | N45: The Better Half | O45: The Life of Riley | P45: Restless Gun (ABC) | Q45: Love That Bob! (ABC) | R45: About Faces (ABC) | S45: Big Story | T45: Day in Court (ABC) | U45: Gale Storm (ABC) | V45: Beat the Clock (ABC) | W45: Who Do You Trust? (ABC) | X45: American Bandstand (ABC) | Y45: High Time | Z45: Three Stooges | AA45: My Friend Flicka (ABC) | AB45: Cartoons--Uncle Charlie; [6:15] News--John Salisbury | AC45: Danger is My Business | AD45: The Wednesday Night Fights (Boxing) (ABC) | AE45: Boxing (ABC); [7:45] Sports By-Line--Sanders | AF45: The Charley Weaver Show (ABC) | AG45: The Adventures of Ozzie and Harriet (ABC) | AH45: Hawaiian Eye (ABC) | AJ45: Not for Hire | AK45: Mike Hammer | AL45: News; [11:15] Movie [Academy Theater]: The Unfaithful (1947) | AX45: =A45 -> 21956
A46: 21963 | F46: OMSI Presents | G46: Eye Opener | H46: Uncle Charlie's Roundhouse | J46: Romper Room | K46: Movie [Early Show]: The Secret Bride (1934) | N46: The Better Half | O46: Heart of the City | P46: Restless Gun (ABC) | Q46: Love That Bob! (ABC) | R46: About Faces (ABC) | S46: Big Story | T46: Day in Court (ABC) | U46: Gale Storm (ABC) | V46: Beat the Clock (ABC) | W46: Who Do You Trust? (ABC) | X46: American Bandstand (ABC) | Y46: High Time | Z46: Three Stooges | AA46: My Friend Flicka (ABC) | AB46: Cartoons--Uncle Charlie; [6:15] News--John Salisbury | AC46: Danger is My Business | AD46: The Wednesday Night Fights (Boxing) (ABC) | AE46: Boxing (ABC); [7:45] Sports By-Line--Sanders | AF46: The Charley Weaver Show (ABC) | AG46: The Adventures of Ozzie and Harriet (ABC) | AH46: Hawaiian Eye (ABC) | AJ46: Not for Hire | AK46: Mike Hammer | AL46: News; [11:15] Movie [Academy Theater]: White Corridors (English; 1952) | AX46: =A46 -> 21963
A47: 21970 | F47: OMSI Presents | G47: Eye Opener | H47: Uncle Charlie's Roundhouse | J47: Romper Room | K47: Movie [Early Show]: The Man Who Cried Wolf (1937) | N47: The Better Half | O47: Heart of the City | P47: Restless Gun (ABC) | Q47: Love That Bob! (ABC) | R47: About Faces (ABC) | S47: Big Story | T47: Day in Court (ABC) | U47: Gale Storm (ABC) | V47: Beat the Clock (ABC) | W47: Who Do You Trust? (ABC) | X47: American Bandstand (ABC) | Y47: High Time | Z47: Three Stooges | AA47: My Friend Flicka (ABC) | AB47: Cartoons--Uncle Charlie; [6:15] News--John Salisbury | AC47: Danger is My Business | AD47: The Wednesday Night Fights (Boxing) (ABC) | AE47: Boxing (ABC); [7:45] Sports By-Line--Sanders | AF47: The Charley Weaver Show (ABC) | AG47: The Adventures of Ozzie and Harriet (ABC) | AH47: Hawaiian Eye (ABC) | AJ47: Not for Hire | AK47: Mike Hammer | AL47: News; [11:15] Movie [Academy Theater]: TBA | AX47: =A47 -> 21970
A48: 21977 | F48: OMSI Presents | G48: Eye Opener | H48: Uncle Charlie's Roundhouse | J48: Romper Room | K48: Movie [Early Show]: Man About Town (French; 1947) | N48: The Better Half | O48: Heart of the City | P48: Restless Gun (ABC) | Q48: Love That Bob! (ABC) | R48: About Faces (ABC) | S48: Big Story | T48: Day in Court (ABC) | U48: Gale Storm (ABC) | V48: Beat the Clock (ABC) | W48: Who Do You Trust? (ABC) | X48: American Bandstand (ABC) | Y48: High Time | Z48: Three Stooges | AA48: My Friend Flicka (ABC) | AB48: Cartoons--Uncle Charlie; [6:15] News--John Salisbury | AC48: Danger is My Business | AD48: The Wednesday Night Fights (Boxing) (ABC) | AE48: Boxing (ABC); [7:45] Sports By-Line--Sanders | AF48: The Charley Weaver Show (ABC) | AG48: The Adventures of Ozzie and Harriet (ABC) | AH48: Hawaiian Eye (ABC) | AJ48: Not for Hire | AK48: Mike Hammer | AL48: News; [11:15] Movie [Academy Theater]: The African Queen (1952) | AX48: =A48 -> 21977
A49: 21984 | F49: OMSI Presents | G49: Eye Opener | H49: Uncle Charlie's Roundhouse | J49: Romper Room | K49: Movie [Early Show]: Lawyer Man (1932) | N49: The Better Half | O49: Heart of the City | P49: Restless Gun (ABC) | Q49: Love That Bob! (ABC) | R49: About Faces (ABC) | S49: Big Story | T49: Day in Court (ABC) | U49: Gale Storm (ABC) | V49: Beat the Clock (ABC) | W49: Who Do You Trust? (ABC) | X49: American Bandstand (ABC) | Y49: High Time | Z49: Three Stooges | AA49: My Friend Flicka (ABC) | AB49: News Central | AC49: Danger is My Business | AD49: The Wednesday Night Fights (Boxing) (ABC) | AE49: Boxing (ABC); [7:45] Sports By-Line--Sanders | AF49: The Charley Weaver Show (ABC) | AG49: The Adventures of Ozzie and Harriet (ABC) | AH49: Hawaiian Eye (ABC) | AJ49: Not for Hire | AK49: Mike Hammer | AL49: News; [11:15] Movie [Academy Theater]: Return to Paradise (1953) | AX49: =A49 -> 21984
A50: 21991 | F50: OMSI Presents | G50: Eye Opener | H50: Uncle Charlie's Roundhouse | J50: Romper Room | K50: Movie [Early Show]: Invaders from Mars (1953) | N50: The Better Half | O50: Heart of the City | P50: Restless Gun (ABC) | Q50: Love That Bob! (ABC) | R50: About Faces (ABC) | S50: Big Story | T50: Day in Court (ABC) | U50: Gale Storm (ABC) | V50: Beat the Clock (ABC) | W50: Who Do You Trust? (ABC) | X50: American Bandstand (ABC) | Y50: High Time | Z50: Three Stooges | AA50: My Friend Flicka (ABC) | AB50: News Central | AC50: Danger is My Business | AD50: The Wednesday Night Fights (Boxing) (ABC) | AE50: Boxing (ABC); [7:45] Sports By-Line--Sanders | AF50: The Charley Weaver Show (ABC) | AG50: The Adventures of Ozzie and Harriet (ABC) | AH50: Hawaiian Eye (ABC) | AJ50: Not for Hire | AK50: Mike Hammer | AL50: News; [11:15] Movie [Academy Theater]: The Purple Plain (English; 1954) | AX50: =A50 -> 21991
A51: 21998 | F51: OMSI Presents | G51: Eye Opener | H51: Uncle Charlie's Roundhouse | J51: Romper Room | K51: Movie [Early Show]: The Working Man (1933) | N51: The Better Half | O51: Heart of the City | P51: Restless Gun (ABC) | Q51: Love That Bob! (ABC) | R51: About Faces (ABC) | S51: Big Story | T51: Day in Court (ABC) | U51: Gale Storm (ABC) | V51: Beat the Clock (ABC) | W51: Who Do You Trust? (ABC) | X51: American Bandstand (ABC) | Y51: High Time | Z51: Three Stooges | AA51: My Friend Flicka (ABC) | AB51: News Central | AC51: Danger is My Business | AD51: The Wednesday Night Fights (Boxing) (ABC) | AE51: Boxing (ABC); [7:45] Sports By-Line--Sanders | AF51: The Charley Weaver Show (ABC) | AG51: The Adventures of Ozzie and Harriet (ABC) | AH51: Hawaiian Eye (ABC) | AJ51: Not for Hire | AK51: Mike Hammer | AL51: News; [11:15] Movie [Academy Theater]: Desert Sands (1955) | AX51: =A51 -> 21998
A52: 22005 | F52: OMSI Presents | G52: Eye Opener | H52: Uncle Charlie's Roundhouse | J52: Romper Room | K52: Movie [Early Show]: The Ghost of Frankenstein (1942) | N52: The Better Half | O52: Heart of the City | P52: Restless Gun (ABC) | Q52: Love That Bob! (ABC) | R52: About Faces (ABC) | S52: Big Story | T52: Day in Court (ABC) | U52: Gale Storm (ABC) | V52: Beat the Clock (ABC) | W52: Who Do You Trust? (ABC) | X52: American Bandstand (ABC) | Y52: High Time | Z52: Three Stooges | AA52: My Friend Flicka (ABC) | AB52: News Central | AC52: Danger is My Business | AD52: The Wednesday Night Fights (Boxing) (ABC) | AE52: Boxing (ABC); [7:45] Sports By-Line--Sanders | AF52: Topper | AG52: The Adventures of Ozzie and Harriet (ABC) | AH52: Hawaiian Eye (ABC) | AJ52: Not for Hire | AK52: Mike Hammer | AL52: News; [11:15] Movie [Academy Theater]: A Woman's Vengeance (1948) | AX52: =A52 -> 22005
A53: 22012 | F53: OMSI Presents | G53: Eye Opener | H53: Uncle Charlie's Roundhouse | J53: Romper Room | K53: Movie [Early Show]: TBA | N53: The Better Half | O53: Heart of the City | P53: Restless Gun (ABC) | Q53: Love That Bob! (ABC) | R53: About Faces (ABC) | S53: Big Story | T53: Day in Court (ABC) | U53: Gale Storm (ABC) | V53: Beat the Clock (ABC) | W53: Who Do You Trust? (ABC) | X53: American Bandstand (ABC) | Y53: High Time | Z53: Three Stooges | AA53: My Friend Flicka (ABC) | AB53: News Central | AC53: Danger is My Business | AD53: The Wednesday Night Fights (Boxing) (ABC) | AE53: Boxing (ABC); [7:45] Sports By-Line--Sanders | AF53: Topper | AG53: The Adventures of Ozzie and Harriet (ABC) | AH53: Hawaiian Eye (ABC) | AJ53: Not for Hire | AK53: Mike Hammer | AL53: News; [11:15] Movie [Academy Theater]: The Night of the Hunter (1955) | AX53: =A53 -> 22012
A54: 22019 | F54: OMSI Presents | G54: Eye Opener | H54: Uncle Charlie's Roundhouse | J54: Romper Room | K54: Movie [Early Show]: TBA | N54: The Better Half | O54: Heart of the City | P54: Restless Gun (ABC) | Q54: Love That Bob! (ABC) | R54: About Faces (ABC) | S54: Big Story | T54: Day in Court (ABC) | U54: Gale Storm (ABC) | V54: Beat the Clock (ABC) | W54: Who Do You Trust? (ABC) | X54: American Bandstand (ABC) | Y54: High Time | Z54: Three Stooges | AA54: My Friend Flicka (ABC) | AB54: News Central | AC54: Danger is My Business | AD54: The Wednesday Night Fights (Boxing) (ABC) | AE54: Boxing (ABC); [7:45] Sports By-Line--Sanders | AF54: Topper | AG54: The Adventures of Ozzie and Harriet (ABC) | AH54: Hawaiian Eye (ABC) | AJ54: Not for Hire | AK54: Mike Hammer | AL54: News; [11:15] Movie [Academy Theater]: Summertime (1955) | AX54: =A54 -> 22019
A55: 22026 | F55: OMSI Presents | G55: Eye Opener | H55: Uncle Charlie's Roundhouse | J55: Romper Room | K55: Movie [Early Show]: Always Together (1948) | N55: The Better Half | O55: Heart of the City | P55: Restless Gun (ABC) | Q55: Love That Bob! (ABC) | R55: About Faces (ABC) | S55: Big Story | T55: Day in Court (ABC) | U55: Gale Storm (ABC) | V55: Beat the Clock (ABC) | W55: Who Do You Trust? (ABC) | X55: American Bandstand (ABC) | Y55: High Time | Z55: Three Stooges | AA55: My Friend Flicka (ABC) | AB55: News Central | AC55: Danger is My Business | AD55: The Wednesday Night Fights (Boxing) (ABC) | AE55: Boxing (ABC); [7:45] Sports By-Line--Sanders | AF55: Topper | AG55: Special Tonight: Ninotchka (ABC) | AJ55: Not for Hire | AK55: Mike Hammer | AL55: News; [11:15] Movie [Academy Theater]: TBA | AX55: =A55 -> 22026
B56: OTHER CITIES SWITCH TO DAYLIGHT SAVINGS TIME; PORTLAND SHOWS AIR ONE HOUR EARLIER | J56: OTHER CITIES SWITCH TO DAYLIGHT SAVINGS TIME; PORTLAND SHOWS AIR ONE HOUR EARLIER | R56: OTHER CITIES SWITCH TO DAYLIGHT SAVINGS TIME; PORTLAND SHOWS AIR ONE HOUR EARLIER | Z56: OTHER CITIES SWITCH TO DAYLIGHT SAVINGS TIME; PORTLAND SHOWS AIR ONE HOUR EARLIER | AH56: OTHER CITIES SWITCH TO DAYLIGHT SAVINGS TIME; PORTLAND SHOWS AIR ONE HOUR EARLIER | AP56: OTHER CITIES SWITCH TO DAYLIGHT SAVINGS TIME; PORTLAND SHOWS AIR ONE HOUR EARLIER
A57: 22033 | F57: OMSI Presents | G57: Eye Opener | H57: Uncle Charlie's Roundhouse | J57: Romper Room | K57: Burns and Allen | L57: Rosemary Clooney | M57: The Better Half | N57: Restless Gun (ABC) | O57: Love That Bob! (ABC) | P57: About Faces (ABC) | Q57: Heart of the City | R57: Day in Court (ABC) | S57: Gale Storm (ABC) | T57: Beat the Clock (ABC) | U57: Who Do You Trust? (ABC) | V57: American Bandstand (ABC) | X57: Uncle Charlie's Den | Z57: Three Stooges | AA57: My Friend Flicka (ABC) | AB57: Invitation to Paris (ABC) [Special] | AD57: News Central | AE57: The Adventures of Ozzie and Harriet (ABC) | AF57: Hawaiian Eye (ABC) | AH57: Coronado 9 | AI57: San Francisco Beat | AJ57: Not for Hire | AK57: Mike Hammer | AL57: News--John Salisbury; [11:15] Movie [Academy Theater]: The Hunchback of Notre Dame (1939) | AX57: =A57 -> 22033
A58: 22040 | F58: OMSI Presents | G58: Eye Opener | H58: Uncle Charlie's Roundhouse | J58: Romper Room | K58: Burns and Allen | L58: Rosemary Clooney | M58: The Better Half | N58: Restless Gun (ABC) | O58: Love That Bob! (ABC) | P58: About Faces (ABC) | Q58: Heart of the City | R58: Day in Court (ABC) | S58: Gale Storm (ABC) | T58: Beat the Clock (ABC) | U58: Who Do You Trust? (ABC) | V58: American Bandstand (ABC) | X58: Uncle Charlie's Den | Z58: Three Stooges | AA58: My Friend Flicka (ABC) | AB58: The Wednesday Night Fights (Boxing) (ABC) | AC58: Boxing (ABC); [6:45] Sports By-Line--Sanders | AD58: News Central | AE58: The Adventures of Ozzie and Harriet (ABC) | AF58: Hawaiian Eye (ABC) | AH58: Coronado 9 | AI58: San Francisco Beat | AJ58: Not for Hire | AK58: Mike Hammer | AL58: News--John Salisbury; [11:15] Movie [Academy Theater]: I Am a Camera (English; 1955) | AX58: =A58 -> 22040
A59: 22047 | F59: OMSI Presents | G59: Eye Opener | H59: Uncle Charlie's Roundhouse | J59: Romper Room | K59: Burns and Allen | L59: Rosemary Clooney | M59: The Better Half | N59: Restless Gun (ABC) | O59: Love That Bob! (ABC) | P59: About Faces (ABC) | Q59: Heart of the City | R59: Day in Court (ABC) | S59: Gale Storm (ABC) | T59: Beat the Clock (ABC) | U59: Who Do You Trust? (ABC) | V59: American Bandstand (ABC) | X59: Uncle Charlie's Den | Z59: Three Stooges | AA59: My Friend Flicka (ABC) | AB59: The Wednesday Night Fights (Boxing) (ABC) | AC59: Boxing (ABC); [6:45] Sports By-Line--Sanders | AD59: News Central | AE59: The Adventures of Ozzie and Harriet (ABC) | AF59: Hawaiian Eye (ABC) | AH59: Coronado 9 | AI59: San Francisco Beat | AJ59: Not for Hire | AK59: Mike Hammer | AL59: News--John Salisbury; [11:15] Movie [Academy Theater]: Call Northside 777 (1948) | AX59: =A59 -> 22047
A60: 22054 | F60: OMSI Presents | G60: Eye Opener | H60: Uncle Charlie's Roundhouse | J60: Romper Room | K60: Burns and Allen | L60: Rosemary Clooney | M60: The Better Half | N60: Restless Gun (ABC) | O60: Love That Bob! (ABC) | P60: About Faces (ABC) | Q60: Heart of the City | R60: Day in Court (ABC) | S60: Gale Storm (ABC) | T60: Beat the Clock (ABC) | U60: Who Do You Trust? (ABC) | V60: American Bandstand (ABC) | X60: Uncle Charlie's Den | Z60: Three Stooges | AA60: My Friend Flicka (ABC) | AB60: The Wednesday Night Fights (Boxing) (ABC) | AC60: Boxing (ABC); [6:45] Sports By-Line--Sanders | AD60: News Central | AE60: The Adventures of Ozzie and Harriet (ABC) | AF60: Hawaiian Eye (ABC) | AH60: Coronado 9 | AI60: San Francisco Beat | AJ60: Not for Hire | AK60: Mike Hammer | AL60: News--John Salisbury; [11:15] Movie [Movie 12]: Destination Moon (1950) | AX60: =A60 -> 22054
A61: 22061 | F61: OMSI Presents | G61: Eye Opener | H61: Uncle Charlie's Roundhouse | J61: Romper Room | K61: Burns and Allen | L61: Rosemary Clooney | M61: The Better Half | N61: Restless Gun (ABC) | O61: Love That Bob! (ABC) | P61: About Faces (ABC) | Q61: Heart of the City | R61: Day in Court (ABC) | S61: Gale Storm (ABC) | T61: Beat the Clock (ABC) | U61: Who Do You Trust? (ABC) | V61: American Bandstand (ABC) | W61: High Time | X61: Uncle Charlie's Den | Z61: Three Stooges | AA61: My Friend Flicka (ABC) | AB61: The Wednesday Night Fights (Boxing) (ABC) | AC61: Boxing (ABC); [6:45] Sports By-Line--Sanders | AD61: News Central | AE61: The Adventures of Ozzie and Harriet (ABC) | AF61: Hawaiian Eye (ABC) | AH61: Coronado 9 | AI61: San Francisco Beat | AJ61: Not for Hire | AK61: Mike Hammer | AL61: News--John Salisbury; [11:15] Movie [Movie 12]: Out of the Past (1947) | AX61: =A61 -> 22061
A63: 22075 | F63: OMSI Presents | G63: Eye Opener | H63: Uncle Charlie's Roundhouse | J63: Romper Room | K63: Burns and Allen | L63: Rosemary Clooney | M63: The Better Half | N63: Restless Gun (ABC) | O63: Love That Bob! (ABC) | P63: About Faces (ABC) | Q63: Heart of the City | R63: Day in Court (ABC) | S63: Gale Storm (ABC) | T63: Beat the Clock (ABC) | U63: Who Do You Trust? (ABC) | V63: American Bandstand (ABC) | W63: High Time | X63: Uncle Charlie's Den | Z63: Three Stooges | AA63: My Friend Flicka (ABC) | AB63: The Wednesday Night Fights (Boxing) (ABC) | AC63: Boxing (ABC); [6:45] Sports By-Line--Sanders | AD63: News Central | AE63: The Adventures of Ozzie and Harriet (ABC) | AF63: Hawaiian Eye (ABC) | AH63: Coronado 9 | AI63: San Francisco Beat | AJ63: Not for Hire | AK63: Mike Hammer | AL63: News--John Salisbury; [11:15] Movie [Movie 12]: From This Day Forward (1946) | AX63: =A63 -> 22075
A64: 22082 | F64: OMSI Presents | G64: Eye Opener | H64: Uncle Charlie's Roundhouse | J64: Romper Room | K64: Burns and Allen | L64: Rosemary Clooney | M64: The Better Half | N64: Restless Gun (ABC) | O64: Love That Bob! (ABC) | P64: About Faces (ABC) | Q64: Heart of the City | R64: Day in Court (ABC) | S64: Gale Storm (ABC) | T64: Beat the Clock (ABC) | U64: Who Do You Trust? (ABC) | V64: American Bandstand (ABC) | W64: High Time | X64: Uncle Charlie's Den | Z64: Three Stooges | AA64: My Friend Flicka (ABC) | AB64: The Wednesday Night Fights (Boxing) (ABC) | AC64: Boxing (ABC); [6:45] Sports By-Line--Sanders | AD64: News Central | AE64: The Adventures of Ozzie and Harriet (ABC) | AF64: Hawaiian Eye (ABC) | AH64: Coronado 9 | AI64: San Francisco Beat | AJ64: Not for Hire | AK64: Mike Hammer | AL64: News--John Salisbury; [11:15] Movie [Movie 12]: Double Dynamite (1951) | AX64: =A64 -> 22082
A65: 22089 | F65: OMSI Presents | G65: Eye Opener | H65: Uncle Charlie's Roundhouse | J65: Romper Room | K65: Burns and Allen | L65: Rosemary Clooney | M65: The Better Half | N65: Restless Gun (ABC) | O65: Love That Bob! (ABC) | P65: About Faces (ABC) | Q65: Heart of the City | R65: Day in Court (ABC) | S65: Gale Storm (ABC) | T65: Beat the Clock (ABC) | U65: Who Do You Trust? (ABC) | V65: American Bandstand (ABC) | W65: High Time | X65: Uncle Charlie's Den | Z65: Three Stooges | AA65: My Friend Flicka (ABC) | AB65: The Wednesday Night Fights (Boxing) (ABC) | AC65: Boxing (ABC); [6:45] Sports By-Line--Sanders | AD65: News Central | AE65: The Adventures of Ozzie and Harriet (ABC) | AF65: Hawaiian Eye (ABC) | AH65: Coronado 9 | AI65: San Francisco Beat | AJ65: Not for Hire | AK65: Mike Hammer | AL65: News--John Salisbury; [11:15] Movie [Movie 12]: Homeward Borne (1957) | AX65: =A65 -> 22089
A66: 22096 | F66: OMSI Presents | G66: Eye Opener | H66: Uncle Charlie's Roundhouse | J66: Romper Room | K66: It's a Great Life | L66: Rosemary Clooney | M66: The Better Half | N66: Restless Gun (ABC) | O66: Love That Bob! (ABC) | P66: About Faces (ABC) | Q66: Heart of the City | R66: Day in Court (ABC) | S66: Gale Storm (ABC) | T66: Beat the Clock (ABC) | U66: Who Do You Trust? (ABC) | V66: American Bandstand (ABC) | W66: High Time | X66: Uncle Charlie's Den | Z66: Three Stooges | AA66: My Friend Flicka (ABC) | AB66: The Wednesday Night Fights (Boxing) (ABC) | AC66: Boxing (ABC); [6:45] Sports By-Line--Sanders | AD66: News Central | AE66: The Adventures of Ozzie and Harriet (ABC) | AF66: Hawaiian Eye (ABC) | AH66: Coronado 9 | AI66: San Francisco Beat | AJ66: Not for Hire | AK66: Mike Hammer | AL66: News--John Salisbury; [11:15] Movie [Movie 12]: A Girl in Every Port (1952) | AX66: =A66 -> 22096
A67: 22103 | F67: OMSI Presents | G67: Eye Opener | H67: Uncle Charlie's Roundhouse | J67: Romper Room | K67: It's a Great Life | L67: Rosemary Clooney | M67: The Better Half | N67: Restless Gun (ABC) | O67: Love That Bob! (ABC) | P67: About Faces (ABC) | Q67: Heart of the City | R67: Day in Court (ABC) | S67: Gale Storm (ABC) | T67: Beat the Clock (ABC) | U67: Who Do You Trust? (ABC) | V67: American Bandstand (ABC) | W67: High Time | X67: Uncle Charlie's Den | Z67: Three Stooges | AA67: My Friend Flicka (ABC) | AB67: The Wednesday Night Fights (Boxing) (ABC) | AC67: Boxing (ABC); [6:45] Sports By-Line--Sanders | AD67: News Central | AE67: The Adventures of Ozzie and Harriet (ABC) | AF67: Hawaiian Eye (ABC) | AH67: Coronado 9 | AI67: San Francisco Beat | AJ67: Not for Hire | AK67: Mike Hammer | AL67: News--John Salisbury; [11:15] Movie [Movie 12]: Three Strangers (1946) | AX67: =A67 -> 22103
A69: 22117 | F69: OMSI Presents | G69: Eye Opener | H69: Uncle Charlie's Roundhouse | J69: Romper Room | K69: It's a Great Life | L69: Rosemary Clooney | M69: The Better Half | N69: Restless Gun (ABC) | O69: Love That Bob! (ABC) | P69: About Faces (ABC) | Q69: Heart of the City | R69: Day in Court (ABC) | S69: Gale Storm (ABC) | T69: Beat the Clock (ABC) | U69: Who Do You Trust? (ABC) | V69: American Bandstand (ABC) | W69: High Time | X69: Uncle Charlie's Den | Z69: Three Stooges | AA69: My Friend Flicka (ABC) | AB69: The Wednesday Night Fights (Boxing) (ABC) | AC69: Boxing (ABC); [6:45] Sports By-Line--Sanders | AD69: News Central | AE69: The Adventures of Ozzie and Harriet (ABC) | AF69: Hawaiian Eye (ABC) | AH69: Coronado 9 | AI69: San Francisco Beat | AJ69: Not for Hire | AK69: Mike Hammer | AL69: News--John Salisbury; [11:15] Movie [Movie 12]: Payment on Demand (1951) | AX69: =A69 -> 22117
A70: 22124 | F70: OMSI Presents | G70: Eye Opener | H70: Uncle Charlie's Roundhouse | J70: Romper Room | K70: It's a Great Life | L70: Rosemary Clooney | M70: The Better Half | N70: Restless Gun (ABC) | O70: Love That Bob! (ABC) | P70: About Faces (ABC) | Q70: Heart of the City | R70: Day in Court (ABC) | S70: Gale Storm (ABC) | T70: Beat the Clock (ABC) | U70: Who Do You Trust? (ABC) | V70: American Bandstand (ABC) | W70: Republican Convention (ABC) | AD70: Republican Convention (ABC) | AH70: Coronado 9 | AI70: San Francisco Beat | AJ70: Not for Hire | AK70: Mike Hammer | AL70: News--John Salisbury; [11:15] Movie [Movie 12]: Love From a Stranger (1947) | AX70: =A70 -> 22124
A71: 22131 | F71: OMSI Presents | G71: Eye Opener | H71: Uncle Charlie's Roundhouse | J71: Romper Room | K71: It's a Great Life | L71: Rosemary Clooney | M71: The Better Half | N71: Restless Gun (ABC) | O71: Love That Bob! (ABC) | P71: About Faces (ABC) | Q71: Heart of the City | R71: Day in Court (ABC) | S71: Gale Storm (ABC) | T71: Beat the Clock (ABC) | U71: Who Do You Trust? (ABC) | V71: American Bandstand (ABC) | W71: High Time | X71: Uncle Charlie's Den | Z71: Three Stooges | AA71: My Friend Flicka (ABC) | AB71: The Wednesday Night Fights (Boxing) (ABC) | AC71: Boxing (ABC); [6:45] Sports By-Line--Sanders | AD71: News Central | AE71: The Adventures of Ozzie and Harriet (ABC) | AF71: Hawaiian Eye (ABC) | AH71: Coronado 9 | AI71: San Francisco Beat | AJ71: Not for Hire | AK71: Mike Hammer | AL71: News--John Salisbury; [11:15] Movie [Movie 12]: The Secret Fury (1950) | AX71: =A71 -> 22131
A72: 22138 | F72: OMSI Presents | G72: Eye Opener | H72: Uncle Charlie's Roundhouse | J72: Romper Room | K72: It's a Great Life | L72: Rosemary Clooney | M72: The Better Half | N72: Restless Gun (ABC) | O72: Love That Bob! (ABC) | P72: About Faces (ABC) | Q72: Heart of the City | R72: Day in Court (ABC) | S72: Gale Storm (ABC) | T72: Beat the Clock (ABC) | U72: Who Do You Trust? (ABC) | V72: American Bandstand (ABC) | W72: High Time | X72: Uncle Charlie's Den | Z72: Three Stooges | AA72: My Friend Flicka (ABC) | AB72: The Wednesday Night Fights (Boxing) (ABC) | AC72: Boxing (ABC); [6:45] Sports By-Line--Sanders | AD72: News Central | AE72: The Adventures of Ozzie and Harriet (ABC) | AF72: Hawaiian Eye (ABC) | AH72: Coronado 9 | AI72: San Francisco Beat | AJ72: Not for Hire | AK72: Mike Hammer | AL72: News--John Salisbury; [11:15] Movie [Movie 12]: Rage at Dawn (1955) | AX72: =A72 -> 22138
A73: 22145 | F73: OMSI Presents | G73: Eye Opener | H73: Uncle Charlie's Roundhouse | J73: Romper Room | K73: It's a Great Life | L73: Abbott and Costello | M73: The Better Half | N73: Restless Gun (ABC) | O73: Love That Bob! (ABC) | P73: About Faces (ABC) | Q73: Heart of the City | R73: Day in Court (ABC) | S73: Gale Storm (ABC) | T73: Beat the Clock (ABC) | U73: Who Do You Trust? (ABC) | V73: American Bandstand (ABC) | W73: High Time | X73: Uncle Charlie's Den | Z73: Three Stooges | AA73: My Friend Flicka (ABC) | AB73: The Wednesday Night Fights (Boxing) (ABC) | AC73: Boxing (ABC); [6:45] Sports By-Line--Sanders | AD73: News Central | AE73: The Adventures of Ozzie and Harriet (ABC) | AF73: Hawaiian Eye (ABC) | AH73: Coronado 9 | AI73: San Francisco Beat | AJ73: Not for Hire | AK73: Mike Hammer | AL73: News--John Salisbury; [11:15] Movie [Movie 12]: Big House, U.S.A. (1955) | AX73: =A73 -> 22145
A74: 22152 | F74: OMSI Presents | G74: Eye Opener | H74: Uncle Charlie's Roundhouse | J74: Romper Room | K74: It's a Great Life | L74: Abbott and Costello | M74: The Better Half | N74: Restless Gun (ABC) | O74: Love That Bob! (ABC) | P74: About Faces (ABC) | Q74: Heart of the City | R74: Day in Court (ABC) | S74: Gale Storm (ABC) | T74: Beat the Clock (ABC) | U74: Who Do You Trust? (ABC) | V74: American Bandstand (ABC) | W74: High Time | X74: Uncle Charlie's Den | Z74: Three Stooges | AA74: My Friend Flicka (ABC) | AB74: The Wednesday Night Fights (Boxing) (ABC) | AC74: Boxing (ABC); [6:45] Sports By-Line--Sanders | AD74: News Central | AE74: The Adventures of Ozzie and Harriet (ABC) | AF74: Hawaiian Eye (ABC) | AH74: Coronado 9 | AI74: San Francisco Beat | AJ74: Not for Hire | AK74: Mike Hammer | AL74: News--John Salisbury; [11:15] Movie [Movie 12]: The Naked Street (1955) | AX74: =A74 -> 22152
A75: 22159 | F75: OMSI Presents | G75: Eye Opener | H75: Uncle Charlie's Roundhouse | J75: Romper Room | K75: It's a Great Life | L75: Abbott and Costello | M75: The Better Half | N75: Restless Gun (ABC) | O75: Love That Bob! (ABC) | P75: About Faces (ABC) | Q75: Heart of the City | R75: Day in Court (ABC) | S75: Gale Storm (ABC) | T75: Beat the Clock (ABC) | U75: Who Do You Trust? (ABC) | V75: American Bandstand (ABC) | W75: High Time | X75: Uncle Charlie's Den | Z75: Three Stooges | AA75: My Friend Flicka (ABC) | AB75: The Wednesday Night Fights (Boxing) (ABC) | AC75: Boxing (ABC); [6:45] Sports By-Line--Sanders | AD75: News Central | AE75: The Adventures of Ozzie and Harriet (ABC) | AF75: Hawaiian Eye (ABC) | AH75: Coronado 9 | AI75: San Francisco Beat | AJ75: Not for Hire | AK75: Mike Hammer | AL75: News--John Salisbury; [11:15] Movie [Movie 12]: Postmarked for Danger (?) | AX75: =A75 -> 22159
A76: 22166 | F76: OMSI Presents | G76: Eye Opener | H76: Uncle Charlie's Roundhouse | J76: Romper Room | K76: It's a Great Life | L76: Abbott and Costello | M76: The Better Half | N76: Restless Gun (ABC) | O76: Queen for a Day (ABC) | P76: About Faces (ABC) | Q76: Heart of the City | R76: Day in Court (ABC) | S76: Gale Storm (ABC) | T76: Beat the Clock (ABC) | U76: Who Do You Trust? (ABC) | V76: American Bandstand (ABC) | W76: High Time | X76: Uncle Charlie's Den | Z76: Three Stooges | AA76: My Friend Flicka (ABC) | AB76: TBA | AD76: News Central | AE76: The Adventures of Ozzie and Harriet (ABC) | AF76: Hawaiian Eye (ABC) | AH76: Coronado 9 | AI76: San Francisco Beat | AJ76: Not for Hire | AK76: Mike Hammer | AL76: News--John Salisbury; [11:15] Movie [Movie 12]: The Ex-Mrs. Bradford (1936) | AX76: =A76 -> 22166
A77: 22173 | F77: OMSI Presents | G77: Eye Opener | H77: Uncle Charlie's Roundhouse | J77: Romper Room | K77: It's a Great Life | L77: Abbott and Costello | M77: The Better Half | N77: Restless Gun (ABC) | O77: Queen for a Day (ABC) | P77: About Faces (ABC) | Q77: Heart of the City | R77: Day in Court (ABC) | S77: Gale Storm (ABC) | T77: Beat the Clock (ABC) | U77: Who Do You Trust? (ABC) | V77: American Bandstand (ABC) | W77: High Time | X77: Uncle Charlie's Den | Z77: Three Stooges | AA77: My Friend Flicka (ABC) | AB77: The Wednesday Night Fights (Boxing) (ABC) | AC77: Boxing (ABC); [6:45] Sports By-Line | AD77: News Central | AE77: The Adventures of Ozzie and Harriet (ABC) | AF77: Hawaiian Eye (ABC) | AH77: Coronado 9 | AI77: San Francisco Beat | AJ77: Not for Hire | AK77: Mike Hammer | AL77: News--John Salisbury; [11:15] Movie [Movie 12]: The Golden Mask (English; 1954) | AX77: =A77 -> 22173
A78: 39712 | F78: OMSI Presents | G78: Eye Opener | H78: Uncle Charlie's Roundhouse | J78: Romper Room | K78: It's a Great Life | L78: Abbott and Costello | M78: The Better Half | N78: Restless Gun (ABC) | O78: Queen for a Day (ABC) | P78: About Faces (ABC) | Q78: Heart of the City | R78: Day in Court (ABC) | S78: Gale Storm (ABC) | T78: Beat the Clock (ABC) | U78: Who Do You Trust? (ABC) | V78: American Bandstand (ABC) | W78: High Time | X78: Uncle Charlie's Den | Z78: Three Stooges | AA78: My Friend Flicka (ABC) | AB78: The Wednesday Night Fights (Boxing) (ABC) | AC78: Boxing (ABC); [6:45] Sports By-Line--Jones | AD78: News Central | AE78: The Adventures of Ozzie and Harriet (ABC) | AF78: Hawaiian Eye (ABC) | AH78: Coronado 9 | AI78: San Francisco Beat | AJ78: Not for Hire | AK78: Mike Hammer | AL78: News--John Salisbury; [11:15] Movie [Movie 12]: The Affairs of Annabel (1938) | AX78: =A78 -> 39712
B79: OTHER CITIES SWITCH TO STANDARD TIME; PORTLAND SHOWS AIR ONE HOUR LATER | J79: OTHER CITIES SWITCH TO STANDARD TIME; PORTLAND SHOWS AIR ONE HOUR LATER | R79: OTHER CITIES SWITCH TO STANDARD TIME; PORTLAND SHOWS AIR ONE HOUR LATER | Z79: OTHER CITIES SWITCH TO STANDARD TIME; PORTLAND SHOWS AIR ONE HOUR LATER | AH79: OTHER CITIES SWITCH TO STANDARD TIME; PORTLAND SHOWS AIR ONE HOUR LATER | AP79: OTHER CITIES SWITCH TO STANDARD TIME; PORTLAND SHOWS AIR ONE HOUR LATER
A80: 22187 | F80: OMSI Presents | G80: Eye Opener | H80: Uncle Charlie's Roundhouse | J80: Romper Room | K80: The Better Half | L80: It's a Great Life | M80: Medic | N80: Court U.S.A. | O80: The Life of Riley | P80: Restless Gun (ABC) | Q80: Queen for a Day (ABC) | R80: About Faces (ABC) | S80: Mike Hammer | T80: Day in Court (ABC) | U80: Gale Storm (ABC) | V80: Beat the Clock (ABC) | W80: Who Do You Trust? (ABC) | X80: American Bandstand (ABC) | Y80: Uncle Charlie's Den | Z80: Three Stooges | AA80: The Lone Ranger (ABC) | AB80: Topper | AC80: News Central | AD80: Coronado 9 | AE80: Hong Kong (ABC) | AG80: The Adventures of Ozzie and Harriet (ABC) | AH80: Hawaiian Eye (ABC) | AJ80: Not for Hire | AK80: Sheriff of Cochise | AL80: News; [11:15] Movie [Movie 12]: Death of a Scoundrel (1956) | AX80: =A80 -> 22187
A81: 22194 | F81: OMSI Presents | G81: Eye Opener | H81: Uncle Charlie's Roundhouse | J81: Romper Room | K81: The Better Half | L81: It's a Great Life | M81: Medic | N81: Court U.S.A. | O81: The Life of Riley | P81: The Texan (ABC) | Q81: Queen for a Day (ABC) | R81: About Faces (ABC) | S81: Mike Hammer | T81: Day in Court (ABC) | U81: Gale Storm (ABC) | V81: Beat the Clock (ABC) | W81: Who Do You Trust? (ABC) | X81: American Bandstand (ABC) | Y81: Uncle Charlie's Den | Z81: Three Stooges | AA81: The Lone Ranger (ABC) | AB81: Topper | AC81: News Central | AD81: Coronado 9 | AE81: Hong Kong (ABC) | AG81: The Adventures of Ozzie and Harriet (ABC) | AH81: Hawaiian Eye (ABC) | AJ81: The Bing Crosby Show (ABC) [Special] | AL81: News; [11:15] Movie [Movie 12]: The Ambassador's Daughter (1956) | AX81: =A81 -> 22194
A82: 22201 | F82: OMSI Presents | G82: Eye Opener | H82: Uncle Charlie's Roundhouse | J82: Romper Room | K82: The Better Half | L82: It's a Great Life | M82: Medic | N82: Morning Court (ABC) | O82: Love That Bob! (ABC) | P82: The Texan (ABC) | Q82: Queen for a Day (ABC) | R82: About Faces (ABC) | S82: Mike Hammer | T82: Day in Court (ABC) | U82: Gale Storm (ABC) | V82: Beat the Clock (ABC) | W82: Who Do You Trust? (ABC) | X82: American Bandstand (ABC) | Y82: Uncle Charlie's Den | Z82: Three Stooges | AA82: The Lone Ranger (ABC) | AB82: Topper | AC82: News Central | AD82: Coronado 9 | AE82: Hong Kong (ABC) | AG82: The Adventures of Ozzie and Harriet (ABC) | AH82: Hawaiian Eye (ABC) | AJ82: Naked City (ABC) | AL82: News; [11:15] Movie [Movie 12]: Home, Sweet Homicide (1946) | AX82: =A82 -> 22201
A83: 22208 | F83: OMSI Presents | G83: Eye Opener | H83: Uncle Charlie's Roundhouse | J83: Romper Room | K83: The Better Half | L83: It's a Great Life | M83: Medic | N83: Morning Court (ABC) | O83: Love That Bob! (ABC) | P83: The Texan (ABC) | Q83: Queen for a Day (ABC) | R83: About Faces (ABC) | S83: Mike Hammer | T83: Day in Court (ABC) | U83: Road to Reality (ABC) | V83: Beat the Clock (ABC) | W83: Who Do You Trust? (ABC) | X83: American Bandstand (ABC) | Y83: Uncle Charlie's Den | Z83: Three Stooges | AA83: The Lone Ranger (ABC) | AB83: Topper | AC83: News Central | AD83: Coronado 9 | AE83: Hong Kong (ABC) | AG83: The Adventures of Ozzie and Harriet (ABC) | AH83: Hawaiian Eye (ABC) | AJ83: Naked City (ABC) | AL83: News; [11:15] Movie [Movie 12]: Centennial Summer (1946) | AX83: =A83 -> 22208
A84: 22215 | F84: OMSI Presents | G84: Eye Opener | H84: Uncle Charlie's Roundhouse | J84: Romper Room | K84: The Better Half | L84: It's a Great Life | M84: Medic | N84: Morning Court (ABC) | O84: Love That Bob! (ABC) | P84: The Texan (ABC) | Q84: Queen for a Day (ABC) | R84: About Faces (ABC) | S84: Mike Hammer | T84: Day in Court (ABC) | U84: Road to Reality (ABC) | V84: Beat the Clock (ABC) | W84: Who Do You Trust? (ABC) | X84: American Bandstand (ABC) | Y84: Uncle Charlie's Den | Z84: Three Stooges | AA84: The Lone Ranger (ABC) | AB84: Topper | AC84: News Central | AD84: Coronado 9 | AE84: Hong Kong (ABC) | AG84: The Adventures of Ozzie and Harriet (ABC) | AH84: Hawaiian Eye (ABC) | AJ84: Naked City (ABC) | AL84: News; [11:15] Movie [Movie 12]: A Double Life (1948) | AX84: =A84 -> 22215
A85: 22222 | F85: OMSI Presents | G85: Eye Opener | H85: Uncle Charlie's Roundhouse | J85: Romper Room | K85: The Better Half | L85: It's a Great Life | M85: Medic | N85: Morning Court (ABC) | O85: Love That Bob! (ABC) | P85: The Texan (ABC) | Q85: Queen for a Day (ABC) | R85: About Faces (ABC) | S85: Mike Hammer | T85: Day in Court (ABC) | U85: Road to Reality (ABC) | V85: Beat the Clock (ABC) | W85: Who Do You Trust? (ABC) | X85: American Bandstand (ABC) | Y85: Uncle Charlie's Den | Z85: Three Stooges | AA85: The Lone Ranger (ABC) | AB85: Topper | AC85: News Central | AD85: Coronado 9 | AE85: Hong Kong (ABC) | AG85: The Adventures of Ozzie and Harriet (ABC) | AH85: Hawaiian Eye (ABC) | AJ85: Naked City (ABC) | AL85: News; [11:15] Movie [Movie 12]: My Outlaw Brother (1951) | AX85: =A85 -> 22222
A86: 22229 | F86: OMSI Presents | G86: Eye Opener | H86: Uncle Charlie's Roundhouse | J86: Romper Room | K86: The Better Half | L86: It's a Great Life | M86: Medic | N86: Morning Court (ABC) | O86: Love That Bob! (ABC) | P86: The Texan (ABC) | Q86: Queen for a Day (ABC) | R86: About Faces (ABC) | S86: Mike Hammer | T86: Day in Court (ABC) | U86: Road to Reality (ABC) | V86: Beat the Clock (ABC) | W86: Who Do You Trust? (ABC) | X86: American Bandstand (ABC) | Y86: Uncle Charlie's Den | Z86: Three Stooges | AA86: The Lone Ranger (ABC) | AB86: Topper | AC86: News Central | AD86: Coronado 9 | AE86: Hong Kong (ABC) | AG86: The Adventures of Ozzie and Harriet (ABC) | AH86: Hawaiian Eye (ABC) | AJ86: Naked City (ABC) | AL86: News; [11:15] Movie [Movie 12]: The Story of Seabiscuit (1949) | AX86: =A86 -> 22229
A87: 22236 | F87: OMSI Presents | G87: Eye Opener | H87: Uncle Charlie's Roundhouse | J87: Romper Room | K87: The Better Half | L87: It's a Great Life | M87: Medic | N87: Morning Court (ABC) | O87: Love That Bob! (ABC) | P87: The Texan (ABC) | Q87: Beat the Clock (ABC) | R87: About Faces (ABC) | S87: Mike Hammer | T87: Day in Court (ABC) | U87: Road to Reality (ABC) | V87: Queen for a Day (ABC) | W87: Who Do You Trust? (ABC) | X87: American Bandstand (ABC) | Y87: Uncle Charlie's Den | Z87: Three Stooges | AA87: The Lone Ranger (ABC) | AB87: Topper | AC87: News Central | AD87: Coronado 9 | AE87: Hong Kong (ABC) | AG87: The Adventures of Ozzie and Harriet (ABC) | AH87: Hawaiian Eye (ABC) | AJ87: Naked City (ABC) | AL87: News; [11:15] Movie [Movie 12]: UFO (1956) | AX87: =A87 -> 22236
A88: 22243 | F88: OMSI Presents | G88: Eye Opener | H88: Uncle Charlie's Roundhouse | J88: Romper Room | K88: The Better Half | L88: It's a Great Life | M88: Medic | N88: Morning Court (ABC) | O88: Love That Bob! (ABC) | P88: The Texan (ABC) | Q88: Beat the Clock (ABC) | R88: About Faces (ABC) | S88: Mike Hammer | T88: Day in Court (ABC) | U88: Road to Reality (ABC) | V88: Queen for a Day (ABC) | W88: Who Do You Trust? (ABC) | X88: American Bandstand (ABC) | Y88: Uncle Charlie's Den | Z88: Three Stooges | AA88: The Lone Ranger (ABC) | AB88: Topper | AC88: News Central | AD88: Coronado 9 | AE88: Hong Kong (ABC) | AG88: The Adventures of Ozzie and Harriet (ABC) | AH88: Hawaiian Eye (ABC) | AJ88: Naked City (ABC) | AL88: News; [11:15] Movie [Movie 12]: The Bigamist (1953) | AX88: =A88 -> 22243
A89: 22250 | F89: OMSI Presents | G89: Eye Opener | H89: Uncle Charlie's Roundhouse | J89: Romper Room | K89: The Better Half | L89: It's a Great Life | M89: Medic | N89: Morning Court (ABC) | O89: Love That Bob! (ABC) | P89: The Texan (ABC) | Q89: Beat the Clock (ABC) | R89: About Faces (ABC) | S89: Mike Hammer | T89: Day in Court (ABC) | U89: Road to Reality (ABC) | V89: Queen for a Day (ABC) | W89: Who Do You Trust? (ABC) | X89: American Bandstand (ABC) | Y89: Uncle Charlie's Den | Z89: Three Stooges | AA89: The Lone Ranger (ABC) | AB89: Topper | AC89: News Central | AD89: Coronado 9 | AE89: Hong Kong (ABC) | AG89: The Adventures of Ozzie and Harriet (ABC) | AH89: Hawaiian Eye (ABC) | AJ89: Naked City (ABC) | AL89: News; [11:15] Movie [Movie 12]: Ain't No Time for Glory (1957) | AX89: =A89 -> 22250
A90: 22257 | F90: OMSI Presents | G90: Eye Opener | H90: Uncle Charlie's Roundhouse | J90: Romper Room | K90: The Better Half | L90: It's a Great Life | M90: Medic | N90: Morning Court (ABC) | O90: Love That Bob! (ABC) | P90: The Texan (ABC) | Q90: Beat the Clock (ABC) | R90: About Faces (ABC) | S90: Mike Hammer | T90: Day in Court (ABC) | U90: Road to Reality (ABC) | V90: Queen for a Day (ABC) | W90: Who Do You Trust? (ABC) | X90: American Bandstand (ABC) | Y90: Uncle Charlie's Den | Z90: Three Stooges | AA90: The Lone Ranger (ABC) | AB90: Topper | AC90: News Central | AD90: Coronado 9 | AE90: Hong Kong (ABC) | AG90: The Adventures of Ozzie and Harriet (ABC) | AH90: Hawaiian Eye (ABC) | AJ90: CloseUp! (ABC) [Special] | AL90: News; [11:15] Movie [Movie 12]: Wake Island (1942) | AX90: =A90 -> 22257
A91: 22264 | F91: OMSI Presents | G91: Eye Opener | H91: Uncle Charlie's Roundhouse | J91: Romper Room | K91: The Better Half | L91: It's a Great Life | M91: Medic | N91: Morning Court (ABC) | O91: Love That Bob! (ABC) | P91: The Texan (ABC) | Q91: Beat the Clock (ABC) | R91: About Faces (ABC) | S91: Mike Hammer | T91: Day in Court (ABC) | U91: Road to Reality (ABC) | V91: Queen for a Day (ABC) | W91: Who Do You Trust? (ABC) | X91: American Bandstand (ABC) | Y91: Uncle Charlie's Den | Z91: Three Stooges | AA91: The Lone Ranger (ABC) | AB91: Topper | AC91: News Central | AD91: Coronado 9 | AE91: Hong Kong (ABC) | AG91: The Adventures of Ozzie and Harriet (ABC) | AH91: Hawaiian Eye (ABC) | AJ91: Naked City (ABC) | AL91: News; [11:15] Movie [Movie 12]: The Ghost Goes West (English; 1936) | AX91: =A91 -> 22264
A92: 22271 | F92: OMSI Presents | G92: Eye Opener | H92: Uncle Charlie's Roundhouse | J92: Romper Room | K92: The Better Half | L92: It's a Great Life | M92: Medic | N92: Morning Court (ABC) | O92: Love That Bob! (ABC) | P92: The Texan (ABC) | Q92: Beat the Clock (ABC) | R92: About Faces (ABC) | S92: Mike Hammer | T92: Day in Court (ABC) | U92: Road to Reality (ABC) | V92: Queen for a Day (ABC) | W92: Who Do You Trust? (ABC) | X92: American Bandstand (ABC) | Y92: Uncle Charlie's Den | Z92: Three Stooges | AA92: The Lone Ranger (ABC) | AB92: Topper | AC92: News Central | AD92: Coronado 9 | AE92: Hong Kong (ABC) | AG92: The Adventures of Ozzie and Harriet (ABC) | AH92: Hawaiian Eye (ABC) | AJ92: Naked City (ABC) | AL92: News; [11:15] Movie [Movie 12]: Raiders of the Seven Seas (1953) | AX92: =A92 -> 22271
A93: 22278 | F93: OMSI Presents | G93: Eye Opener | H93: Uncle Charlie's Roundhouse | J93: Romper Room | K93: The Better Half | L93: It's a Great Life | M93: Medic | N93: Morning Court (ABC) | O93: Love That Bob! (ABC) | P93: The Texan (ABC) | Q93: Beat the Clock (ABC) | R93: About Faces (ABC) | S93: Mike Hammer | T93: Day in Court (ABC) | U93: Road to Reality (ABC) | V93: Queen for a Day (ABC) | W93: Who Do You Trust? (ABC) | X93: American Bandstand (ABC) | Y93: Uncle Charlie's Den | Z93: Three Stooges | AA93: The Lone Ranger (ABC) | AB93: Topper | AC93: News Central | AD93: Coronado 9 | AE93: Hong Kong (ABC) | AG93: The Adventures of Ozzie and Harriet (ABC) | AH93: Hawaiian Eye (ABC) | AJ93: Naked City (ABC) | AL93: News; [11:15] Movie [Movie 12]: Whiplash (1948) | AX93: =A93 -> 22278
A94: 1961 | AX94: =A94 -> 1961
A95: 22285 | F95: OMSI Presents | G95: Eye Opener | H95: Uncle Charlie's Roundhouse | J95: Romper Room | K95: The Better Half | L95: It's a Great Life | M95: Medic | N95: Morning Court (ABC) | O95: Love That Bob! (ABC) | P95: The Texan (ABC) | Q95: Beat the Clock (ABC) | R95: About Faces (ABC) | S95: Mike Hammer | T95: Day in Court (ABC) | U95: Road to Reality (ABC) | V95: Queen for a Day (ABC) | W95: Who Do You Trust? (ABC) | X95: American Bandstand (ABC) | Y95: Uncle Charlie's Den | Z95: Three Stooges | AA95: The Lone Ranger (ABC) | AB95: Topper | AC95: News Central | AD95: Coronado 9 | AE95: Hong Kong (ABC) | AG95: The Adventures of Ozzie and Harriet (ABC) | AH95: Hawaiian Eye (ABC) | AJ95: Naked City (ABC) | AL95: News; [11:15] Movie [Movie 12]: The Garden of Allah (1936) | AX95: =A95 -> 22285
A99: 1962 | AX99: =A99 -> 1962
A101: 1963 | AX101: =A101 -> 1963
A103: 23167 | E103: [6:45] Telecourse | G103: Cartoon Capers; [7:45] Dr. Zoom's Cartoons; [8:15] King Leonardo | I103: Romper Room | J103: Jack LaLanne | K103: News--Ed Arndt; [9:35] Portland Panorama | L103: Movie: The Perfect Snob (1941) | N103: Life of Riley | O103: Seven Keys (ABC) | P103: Ernie Ford | Q103: Father Knows Best | R103: General Hospital (ABC) | S103: Girl Talk | T103: Day in Court; [2:25] News | U103: Jayne Wyman | V103: Queen for a Day | W103: Who Do You Trust? | X103: American Bandstand (ABC) | Y103: Discovery '63; [4:55] American Newsstand | Z103: Three Stooges | AA103: Popeye Theater | AB103: Cartoon Castle | AC103: News--Sanders, Arndt; [6:45] ABC News | AD103: Hennesey | AE103: Wagon Train (ABC) | AG103: Going My Way (ABC) | AI103: Our Man Higgins (ABC) | AJ103: Naked City (ABC) | AL103: News, Sports | AM103: Movie: Reap the Wild Wind (1942) | AQ103: [1:45] Movie: The Fallen Sparrow (1943) | AX103: 23167
A105: 1965 | AX105: 1965
A106: 24000 | K106: [9:45] News, Weather | L106: Northwest Indians | M106: Jack La Lanne | N106: 12 in the Morning | O106: Sergeant Preston | P106: Cartoon Castle [Dr. Zoom] | R106: Girl Talk | S106: Movie: Bring 'Em Back Alive (1952) | V106: [3:15] News--Duane Bock | W106: Touch Turtle | X106: [4:15] Rocky and Friends | Y106: Popeye's Pier 12 | Z106: Lloyd Thaxton | AB106: Magilla Gorilla | AC106: Trackdown | AD106: The Rifleman | AE106: Treasure | AF106: Hollywood A Go Go | AH106: Movie: Soldier of Fortune (1955) | AL106: Sports Final; [11:05] Movie: Made for Each Other (1939) | AX106: =A106 -> 24000
A107: 24007 | K107: [9:45] News, Weather | L107: Northwest Indians | M107: Jack La Lanne | N107: 12 in the Morning | O107: Sergeant Preston | P107: Cartoon Castle [Dr. Zoom] | R107: Girl Talk | S107: Movie: The Company She Keeps (1950) | V107: [3:15] News--Duane Bock | W107: Touch Turtle | X107: [4:15] Rocky and Friends | Y107: Popeye's Pier 12 | Z107: Lloyd Thaxton | AB107: Magilla Gorilla | AC107: Trackdown | AD107: The Rifleman | AE107: Treasure | AF107: Hollywood A Go Go | AH107: Movie: The Roots of Heaven (1958) | AL107: Sports Final; [11:05] Movie: Intermezzo (1939) | AX107: =A107 -> 24007
A111: 1970 | AX111: 1970
A112: 25575 | F112: Telecourse | G112: The Flintstones | H112: Hobo Kelly | J112: The Patty Duke Show | K112: The Wonderful World of Women | L112: Movie [Morning Movie 12]: Sea Wife (1957) | O112: Fashions in Sewing; [11:40] 12 in the Morning; [11:50] News--Don Stellges | P112: Rusty Nails' Cartoons | R112: The Movie Game | S112: Pearl Harbor | U112: The Galloping Gourmet | V112: The Three O'Clock News--Don Stellges/ Jimmy Jones/ Bill Swing | W112: He Said! She Said! | X112: Beat the Clock | Y112: Popeye's Pier 12 | Z112: The Flintstones | AA112: Sea Hunt | AB112: Gilligan's Island | AC112: The Invaders | AE112: Perry Mason | AG112: The David Frost Show | AJ112: The 10 O'Clock News--Don Stellges | AK112: Felony Squad | AL112: Movie [Movie 12]: Rebel Without a Cause (1955) | AX112: 25575
A113: =A112+7 -> 25582 | F113: Telecourse | G113: The Flintstones | H113: Hobo Kelly | J113: The Patty Duke Show | K113: The Wonderful World of Women | L113: Movie [Morning Movie 12]: Simon and Laura (1955) | O113: Fashions in Sewing; [11:40] 12 in the Morning; [11:50] News--Don Stellges | P113: Rusty Nails' Cartoons | R113: The Movie Game | S113: Run for Your Life | U113: The Galloping Gourmet | V113: The Three O'Clock News--Don Stellges/ Jimmy Jones/ Bill Swing | W113: He Said! She Said! | X113: Beat the Clock | Y113: Popeye's Pier 12 | Z113: The Flintstones | AA113: Sea Hunt | AB113: Gilligan's Island | AC113: Star Trek | AE113: Perry Mason | AG113: The David Frost Show | AJ113: The 10 O'Clock News--Don Stellges | AK113: Felony Squad | AL113: Movie [Movie 12]: A Star is Born (1955) | AX113: =A113 -> 25582
A114: =A113+7 -> 25589
A115: =A114+7 -> 25596 | F115: Telecourse | G115: The Flintstones | H115: Hobo Kelly | J115: The Patty Duke Show | K115: The Wonderful World of Women | L115: Movie [Morning Movie 12]: Do You Love Me? (1946) | O115: Fashions in Sewing; [11:40] 12 in the Morning; [11:50] News--Don Stellges | P115: Rusty Nails' Cartoons | R115: The Movie Game | S115: Run for Your Life | U115: The Galloping Gourmet | V115: The Three O'Clock News--Don Stellges/ Jimmy Jones/ Bill Swing | W115: He Said! She Said! | X115: Beat the Clock | Y115: Popeye's Pier 12 | Z115: The Flintstones | AA115: Sea Hunt | AB115: Gilligan's Island | AC115: Star Trek | AE115: Perry Mason | AG115: The David Frost Show | AJ115: The 10 O'Clock News-- Don Stellges/ Michael Hartfield/ Jimmy Jones | AK115: Felony Squad | AL115: Movie [Movie 12]: The True Story of Lynn Stuart (1958) | AX115: =A115 -> 25596
A116: =A115+7 -> 25603 | F116: Telecourse | G116: The Flintstones | H116: Hobo Kelly | J116: The Patty Duke Show | K116: The Wonderful World of Women | L116: Movie [Morning Movie 12]: Belles on Their Toes (1952) | O116: Fashions in Sewing; [11:40] 12 in the Morning; [11:50] News--Don Stellges | P116: Rusty Nails' Cartoons | R116: The Movie Game | S116: Run for Your Life | U116: The Galloping Gourmet | V116: The Three O'Clock News--Don Stellges/ Jimmy Jones/ Bill Swing | W116: He Said! She Said! | X116: Beat the Clock | Y116: Popeye's Pier 12 | Z116: The Flintstones | AA116: Sea Hunt | AB116: Gilligan's Island | AC116: Star Trek | AE116: Perry Mason | AG116: The David Frost Show | AJ116: The 10 O'Clock News-- Don Stellges/ Michael Hartfield/ Jimmy Jones | AK116: Felony Squad | AL116: Movie [Movie 12]: The Doomsday Flight (1966) | AX116: =A116 -> 25603
A117: =A116+7 -> 25610 | F117: Telecourse | G117: The Flintstones | H117: Hobo Kelly | J117: The Patty Duke Show | K117: The Wonderful World of Women | L117: Movie [Morning Movie 12]: Sherlock Holmes in Washington (1942) | O117: Fashions in Sewing; [11:40] 12 in the Morning; [11:50] News--Don Stellges | P117: Rusty Nails' Cartoons | R117: The Movie Game | S117: Run for Your Life | U117: The Galloping Gourmet | V117: The Three O'Clock News--Don Stellges/ Jimmy Jones/ Bill Swing | W117: He Said! She Said! | X117: Beat the Clock | Y117: Popeye's Pier 12 | Z117: The Flintstones | AA117: Sea Hunt | AB117: Gilligan's Island | AC117: Star Trek | AE117: Perry Mason | AG117: The David Frost Show | AJ117: The 10 O'Clock News-- Don Stellges/ Michael Hartfield/ Jimmy Jones | AK117: Felony Squad | AL117: Movie [Movie 12]: The Lions Are Loose (1961) | AX117: =A117 -> 25610
A118: =A117+7 -> 25617 | F118: Telecourse | G118: The Flintstones | H118: Hobo Kelly | J118: The Patty Duke Show | K118: The Wonderful World of Women | L118: Movie [Morning Movie 12]: Dick Tracy Meets Gruesome (1947) | O118: Fashions in Sewing; [11:40] 12 in the Morning; [11:50] News--Don Stellges | P118: Rusty Nails' Cartoons | R118: The Movie Game | S118: Run for Your Life | U118: The Galloping Gourmet | V118: The Three O'Clock News--Don Stellges/ Jimmy Jones/ Bill Swing | W118: He Said! She Said! | X118: Beat the Clock | Y118: Popeye's Pier 12 | Z118: The Flintstones | AA118: Sea Hunt | AB118: Gilligan's Island | AC118: Star Trek | AE118: Perry Mason | AG118: The David Frost Show | AJ118: The 10 O'Clock News-- Don Stellges/ Michael Hartfield/ Jimmy Jones | AK118: Felony Squad | AL118: Movie [Movie 12]: The Three Faces of Eve (1957) | AX118: =A118 -> 25617
A119: =A118+7 -> 25624 | F119: Telecourse | G119: The Flintstones | H119: Hobo Kelly | J119: The Patty Duke Show | K119: The Wonderful World of Women | L119: Movie [Morning Movie 12]: The Shocking Miss Pilgrim (1947) | O119: Fashions in Sewing; [11:40] 12 in the Morning; [11:50] News--Don Stellges | P119: Rusty Nails' Cartoons | R119: The Movie Game | S119: Run for Your Life | U119: The Galloping Gourmet | V119: The Three O'Clock News--Don Stellges/ Jimmy Jones/ Bill Swing | W119: He Said! She Said! | X119: Beat the Clock | Y119: Popeye's Pier 12 | Z119: The Flintstones | AA119: Sea Hunt | AB119: Gilligan's Island | AC119: Star Trek | AE119: Perry Mason | AG119: The David Frost Show | AJ119: The 10 O'Clock News-- Don Stellges/ Michael Hartfield/ Jimmy Jones | AK119: Felony Squad | AL119: Movie [Movie 12]: Freud (1962) | AX119: =A119 -> 25624
A120: =A119+7 -> 25631
A121: =A120+7 -> 25638 | F121: Telecourse | G121: The Flintstones | H121: Hobo Kelly | J121: The Patty Duke Show | K121: The Wonderful World of Women | L121: Movie [Morning Movie 12]: Powder River (1953) | O121: Fashions in Sewing; [11:40] 12 in the Morning; [11:50] News--Don Stellges | P121: Rusty Nails' Cartoons | R121: The Movie Game | S121: Run for Your Life | U121: The Galloping Gourmet | V121: The Three O'Clock News--Don Stellges/ Jimmy Jones/ Bill Swing | W121: He Said! She Said! | X121: Beat the Clock | Y121: Popeye's Pier 12 | Z121: The Flintstones | AA121: Sea Hunt | AB121: Star Trek | AD121: Boxing: Emile Griffith vs Dick Tiger from New York | AF121: Hawaii Calls | AG121: The David Frost Show | AJ121: The 10 O'Clock News-- Don Stellges/ Michael Hartfield/ Jimmy Jones | AK121: Felony Squad | AL121: Movie [Movie 12]: The Silver Chalice (1955) | AX121: =A121 -> 25638
A122: =A121+7 -> 25645 | F122: Telecourse | G122: The Flintstones | H122: Hobo Kelly | J122: The Patty Duke Show | K122: The Wonderful World of Women | L122: Movie [Morning Movie 12]: Goodbye, My Lady (1956) | O122: Fashions in Sewing; [11:40] 12 in the Morning; [11:55] News--Larry Curran | P122: Rusty Nails' Cartoons | R122: The Movie Game | S122: Hawaii Calls | T122: Faces and Places | U122: The Galloping Gourmet | V122: The Three O'Clock News--Don Stellges/ Jimmy Jones/ Bill Swing | W122: He Said! She Said! | X122: Beat the Clock | Y122: Popeye's Pier 12 | Z122: The Flintstones | AA122: Sea Hunt | AB122: Gilligan's Island | AC122: Star Trek | AE122: Perry Mason | AG122: The David Frost Show | AJ122: The 10 O'Clock News-- Don Stellges/ Michael Hartfield/ Jimmy Jones | AK122: Felony Squad | AL122: Movie [Movie 12]: Catherine of Russia (1962) | AX122: =A122 -> 25645
A123: =A122+7 -> 25652 | F123: Telecourse | G123: The Flintstones | H123: Hobo Kelly | J123: The Patty Duke Show | K123: The Wonderful World of Women | L123: Movie [Morning Movie 12]: You're My Everything (1949) | O123: Fashions in Sewing; [11:40] 12 in the Morning; [11:50] News--Larry Curran | P123: Rusty Nails' Cartoons | R123: The Movie Game | S123: Hawaii Calls | T123: Faces and Places | U123: The Galloping Gourmet | V123: The Three O'Clock News--Don Stellges/ Jimmy Jones/ Bill Swing | W123: He Said! She Said! | X123: Beat the Clock | Y123: Popeye's Pier 12 | Z123: The Flintstones | AA123: Sea Hunt | AB123: Gilligan's Island | AC123: Star Trek | AE123: Perry Mason | AG123: The David Frost Show | AJ123: The 10 O'Clock News-- Don Stellges/ Michael Hartfield/ Jimmy Jones | AK123: Felony Squad | AL123: Movie [Movie 12]: Wilson (1945) | AX123: =A123 -> 25652
A124: =A123+7 -> 25659 | F124: Telecourse | G124: The Flintstones | H124: Hobo Kelly | J124: The Patty Duke Show | K124: The Wonderful World of Women | L124: Movie [Morning Movie 12]: Dick Tracy's Dilemma (1947) | O124: Fashions in Sewing; [11:40] 12 in the Morning; [11:50] News--Larry Curran | P124: Rusty Nails' Cartoons | R124: The Movie Game | S124: Hawaii Calls | T124: Faces and Places | U124: The Galloping Gourmet | V124: The Three O'Clock News--Don Stellges/ Jimmy Jones/ Bill Swing | W124: He Said! She Said! | X124: Beat the Clock | Y124: Popeye's Pier 12 | Z124: The Flintstones | AA124: Sea Hunt | AB124: Gilligan's Island | AC124: Star Trek | AE124: Perry Mason | AG124: The David Frost Show | AJ124: The 10 O'Clock News-- Don Stellges/ Michael Hartfield/ Jimmy Jones | AK124: Felony Squad | AL124: Movie [Movie 12]: Dial M for Murder (1954) | AX124: =A124 -> 25659
A125: =A124+7 -> 25666
A126: =A125+7 -> 25673 | F126: Telecourse | G126: The Flintstones | H126: Hobo Kelly | J126: The Patty Duke Show | K126: The Wonderful World of Women | L126: Movie [Morning Movie 12]: Shoot-Out at Medicine Bend (1957) | O126: Fashions in Sewing; [11:40] 12 in the Morning; [11:50] News--Larry Curran | P126: Rusty Nails' Cartoons | R126: The Movie Game | S126: The Naked City | U126: The Galloping Gourmet | V126: The Three O'Clock News--Don Stellges/ Jimmy Jones/ Bill Swing | W126: He Said! She Said! | X126: Beat the Clock | Y126: Popeye's Pier 12 | Z126: The Addams Family | AA126: Sea Hunt | AB126: Gilligan's Island | AC126: Star Trek | AE126: Perry Mason | AG126: The David Frost Show | AJ126: The 10 O'Clock News-- Don Stellges/ Michael Hartfield/ Jimmy Jones | AK126: Felony Squad | AL126: Movie [Movie 12]: Shadow on the Wall (1949) | AX126: =A126 -> 25673
A127: =A126+7 -> 25680 | F127: Telecourse | G127: The Flintstones | H127: Hobo Kelly | J127: The Patty Duke Show | K127: The Wonderful World of Women | L127: Movie [Morning Movie 12]: The Corsican Brothers (1960) | O127: Fashions in Sewing; [11:40] 12 in the Morning; [11:50] News--Larry Curran | P127: Rusty Nails' Cartoons | R127: The Movie Game | S127: The Naked City | U127: The Galloping Gourmet | V127: The Three O'Clock News--Don Stellges/ Jimmy Jones/ Bill Swing | W127: He Said! She Said! | X127: Beat the Clock | Y127: Popeye's Pier 12 | Z127: The Addams Family | AA127: Sea Hunt | AB127: Gilligan's Island | AC127: Star Trek | AE127: Perry Mason | AG127: The David Frost Show | AJ127: The 10 O'Clock News-- Don Stellges/ Michael Hartfield/ Jimmy Jones | AK127: Felony Squad | AL127: Movie [Movie 12]: Prisoner of War (1954) | AX127: =A127 -> 25680
A128: =A127+7 -> 25687
A129: =A128+7 -> 25694 | F129: Telecourse | G129: The Flintstones | H129: Hobo Kelly | J129: The Patty Duke Show | K129: The Wonderful World of Women | L129: Movie [Morning Movie 12]: Wake Up and Dream (1946) | O129: Fashions in Sewing; [11:40] 12 in the Morning; [11:50] News--Larry Curran | P129: Rusty Nails' Cartoons | R129: The Movie Game | S129: The Naked City | U129: The Galloping Gourmet | V129: The Three O'Clock News--Don Stellges/ Jimmy Jones/ Bill Swing | W129: He Said! She Said! | X129: Beat the Clock | Y129: Popeye's Pier 12 | Z129: The Addams Family | AA129: Sea Hunt | AB129: Gilligan's Island | AC129: Star Trek | AE129: Perry Mason | AG129: The David Frost Show | AJ129: The 10 O'Clock News-- Don Stellges/ Michael Hartfield/ Jimmy Jones | AK129: Felony Squad | AL129: Movie [Movie 12]: The Hanged Man (1964) | AX129: =A129 -> 25694
A130: =A129+7 -> 25701 | F130: Telecourse | G130: The Flintstones | H130: Hobo Kelly | J130: The Patty Duke Show | K130: The Wonderful World of Women | L130: Movie [Morning Movie 12]: Going Steady (1960) | O130: Fashions in Sewing; [11:40] 12 in the Morning; [11:50] News--Larry Curran | P130: Rusty Nails' Cartoons | R130: The Movie Game | S130: The Naked City | U130: The Galloping Gourmet | V130: The Three O'Clock News--Don Stellges/ Jimmy Jones/ Bill Swing | W130: He Said! She Said! | X130: Beat the Clock | Y130: Popeye's Pier 12 | Z130: The Addams Family | AA130: Sea Hunt | AB130: Gilligan's Island | AC130: Star Trek | AE130: Perry Mason | AG130: The David Frost Show | AJ130: The 10 O'Clock News-- Don Stellges/ Michael Hartfield/ Jimmy Jones | AK130: The Honey-mooners | AL130: Movie [Movie 12]: Mystery Submarine (1962) | AX130: =A130 -> 25701
A131: =A130+7 -> 25708
A132: =A131+7 -> 25715 | F132: Telecourse | G132: The Flintstones | H132: Hobo Kelly | J132: The Patty Duke Show | K132: The Wonderful World of Women | L132: Movie [Morning Movie 12]: Down Argentine Way (1940) | O132: Fashions in Sewing; [11:40] 12 in the Morning; [11:50] News--Larry Curran | P132: Rusty Nails' Cartoons | R132: The Movie Game | S132: The Naked City | U132: The Galloping Gourmet | V132: The Three O'Clock News--Don Stellges/ Jimmy Jones/ Bill Swing | W132: He Said! She Said! | X132: Beat the Clock | Y132: Popeye's Pier 12 | Z132: The Addams Family | AA132: Sea Hunt | AB132: Gilligan's Island | AC132: Star Trek | AE132: Perry Mason | AG132: The David Frost Show | AJ132: The 10 O'Clock News-- Don Stellges/ Michael Hartfield/ Jimmy Jones | AK132: The Honey-mooners | AL132: Movie [Movie 12]: Storm Warning (1951) | AX132: =A132 -> 25715
A133: =A132+7 -> 25722 | F133: Telecourse | G133: The Flintstones | H133: Hobo Kelly | J133: The Patty Duke Show | K133: The Wonderful World of Women | L133: Movie [Morning Movie 12]: Hot Blood (1956) | O133: 12 in the Morning; [11:40] News--Larry Curran | P133: Rusty Nails' Cartoons | R133: The Movie Game | S133: The Untouchables | U133: The Galloping Gourmet | V133: The Three O'Clock News--Don Stellges/ Jimmy Jones/ Bill Swing; [3:20] Fashions in Sewing | W133: He Said! She Said! | X133: Beat the Clock | Y133: Popeye's Pier 12 | Z133: The Addams Family | AA133: Sea Hunt | AB133: Gilligan's Island | AC133: Star Trek | AE133: Perry Mason | AG133: The David Frost Show | AJ133: The 10 O'Clock News-- Don Stellges/ Michael Hartfield/ Jimmy Jones | AK133: The Honey-mooners | AL133: Movie [Movie 12]: Tower of London (1939) | AX133: =A133 -> 25722
A134: =A133+7 -> 25729 | F134: Telecourse | G134: The Flintstones | H134: Hobo Kelly | J134: The Patty Duke Show | K134: The Wonderful World of Women | L134: Movie [Morning Movie 12]: Comanche Station (1960) | O134: 12 in the Morning; [11:40] News--Larry Curran | P134: Rusty Nails' Cartoons | R134: The Movie Game | S134: The Untouchables | U134: The Galloping Gourmet | V134: The Three O'Clock News--Don Stellges/ Jimmy Jones [3:20] Fashions in Sewing | W134: He Said! She Said! | X134: Beat the Clock | Y134: Popeye's Pier 12 | Z134: The Addams Family | AA134: Sea Hunt | AB134: Gilligan's Island | AC134: Star Trek | AE134: Oral Roberts (Special) | AG134: The David Frost Show | AJ134: The 10 O'Clock News-- Don Stellges/ Michael Hartfield/ Jimmy Jones | AK134: The Honey-mooners | AL134: Movie [Movie 12]: Rebel in the Ring (1964) | AX134: =A134 -> 25729
A135: =A134+7 -> 25736 | F135: Telecourse | G135: The Flintstones | H135: Hobo Kelly | J135: The Patty Duke Show | K135: The Wonderful World of Women | L135: Movie [Morning Movie 12]: Buchanan Rides Alone (1958) | O135: 12 in the Morning; [11:40] News--Larry Curran/ Bill Swing | P135: Rusty Nails' Cartoons | R135: The Movie Game | S135: The Untouchables | U135: The Galloping Gourmet | V135: The Three O'Clock News--Don Stellges/ Jimmy Jones [3:20] Fashions in Sewing | W135: He Said! She Said! | X135: Beat the Clock | Y135: Popeye's Pier 12 | Z135: The Addams Family | AA135: Gilligan's Island | AB135: Star Trek | AD135: Boxing: Jerry Quarry vs Mac Foster from New York (Live) | AF135: McHale's Navy | AG135: The David Frost Show | AJ135: The 10 O'Clock News-- Don Stellges/ Michael Hartfield/ Jimmy Jones | AK135: The Honey-mooners | AL135: Movie [Movie 12]: Stopover Tokyo (1957) | AX135: =A135 -> 25736
A136: =A135+7 -> 25743 | F136: Telecourse | G136: The Flintstones | H136: Hobo Kelly | J136: The Patty Duke Show | K136: The Wonderful World of Women | L136: Movie [Morning Movie 12]: Terror of the Red Mask (Italian; 1961) | O136: 12 in the Morning; [11:40] News--Larry Curran/ Bill Swing | P136: Rusty Nails' Cartoons | R136: The Movie Game | S136: Faces and Places | U136: The Galloping Gourmet | V136: The Three O'Clock News--Don Stellges/ Jimmy Jones [3:20] Fashions in Sewing | W136: He Said! She Said! | X136: Beat the Clock | Y136: Popeye's Pier 12 | Z136: The Addams Family | AA136: Sea Hunt | AB136: Gilligan's Island | AC136: Star Trek | AE136: The Fabulous Sixties (Special) | AG136: The David Frost Show | AJ136: The 10 O'Clock News-- Don Stellges/ Michael Hartfield/ Jimmy Jones | AK136: The Honey-mooners | AL136: Movie [Movie 12]: The Damned Don't Cry (1950) | AX136: =A136 -> 25743
A137: =A136+7 -> 25750 | F137: Telecourse | G137: The Flintstones | H137: Hobo Kelly | J137: The Patty Duke Show | K137: The Wonderful World of Women | L137: Movie [Morning Movie 12]: The Little Savage (1959) | O137: 12 in the Morning; [11:40] News--Larry Curran/ Bill Swing | P137: Rusty Nails' Cartoons | R137: The Movie Game | S137: Faces and Places | U137: The Galloping Gourmet | V137: The Three O'Clock News--Don Stellges/ Jimmy Jones [3:20] Fashions in Sewing | W137: He Said! She Said! | X137: Beat the Clock | Y137: Popeye's Pier 12 | Z137: The Addams Family | AA137: Sea Hunt | AB137: Gilligan's Island | AC137: Star Trek | AE137: The Real Tom Kennedy Show | AG137: The David Frost Show | AJ137: The 10 O'Clock News-- Don Stellges/ Michael Hartfield/ Jimmy Jones | AK137: The Honey-mooners | AL137: Movie [Movie 12]: Operation Pacific (1951) | AX137: =A137 -> 25750
A138: =A137+7 -> 25757 | F138: Telecourse | G138: Cartoon Castle | H138: Hobo Kelly | J138: The Patty Duke Show | K138: The Wonderful World of Women | L138: Movie [Morning Movie 12]: The System (1953) | O138: 12 in the Morning; [11:40] News--Larry Curran/ Bill Swing | P138: Rusty Nails' Cartoons | R138: The Movie Game | S138: Faces and Places | U138: The Galloping Gourmet | V138: The Three O'Clock News--Don Stellges/ Jimmy Jones [3:20] Fashions in Sewing | W138: He Said! She Said! | X138: Beat the Clock | Y138: Popeye's Pier 12 | Z138: Mister Ed | AA138: Sea Hunt | AB138: Gilligan's Island | AC138: Star Trek | AE138: Perry Mason | AG138: The David Frost Show | AJ138: The 10 O'Clock News-- Don Stellges/ Michael Hartfield/ Jimmy Jones | AK138: The Honey-mooners | AL138: Movie [Movie 12]: The D.I. (1957) | AX138: =A138 -> 25757
A145: 1975 | AX145: 1975
A146: 27395 | F146: Government Story | G146: The Flintstones | H146: Cartoon Castle | I146: Nanny and the Professor | J146: The Bill Cosby Show | K146: Super Bowl Highlights: Super Bowl IV, 1970 | L146: The Flintstones | M146: It Takes a Thief | O146: World of Survival | P146: I Dream of Jeannie | Q146: Bold Ones | S146: Movie [Matinee 12]: Robinson Crusoe on Mars (1964) | W146: Gomer Pyle, USMC | X146: Ramblin' Rod | Y146: Batman | Z146: I Dream of Jeannie | AA146: Courtship of Eddie's Father | AB146: The Mod Squad | AD146: The FBI | AF146: Pop! Goes the Country | AG146: The Bobby Goldsboro Show | AH146: Hank Thompson | AI146: The Porter Wagoner Show | AJ146: The 10 O'Clock News | AL146: Movie: The Birds (1963) | AX146: 27395
A147: =A146+7 -> 27402 | F147: Government Story | G147: The Flintstones | H147: Cartoon Castle | I147: Nanny and the Professor | J147: Celebrity Sweepstakes (NBC) | K147: News--Curran/Young | L147: Now You See It (CBS) | M147: It Takes a Thief | O147: Search for Tomorrow (CBS) | P147: How to Survive a Marriage (NBC) | Q147: Bold Ones | S147: Movie [Matinee 12]: The Square Jungle (1955) | W147: Gomer Pyle, USMC | X147: Ramblin' Rod | Y147: Batman | Z147: I Dream of Jeannie | AA147: Courtship of Eddie's Father | AB147: The Mod Squad | AD147: The FBI | AF147: Pop! Goes the Country | AG147: The Bobby Goldsboro Show | AH147: Hank Thompson | AI147: The Porter Wagoner Show | AJ147: The 10 O'Clock News | AL147: Movie: The Runaround (1946) | AX147: =AX146+7 -> 27402
A148: =A147+7 -> 27409 | F148: Government Story | G148: The Flintstones | H148: Cartoon Castle | I148: Petticoat Junction | J148: Celebrity Sweepstakes (NBC) | K148: Nanny and the Professor | L148: Now You See It (CBS) | M148: Bold Ones | O148: Search for Tomorrow (CBS) | P148: How to Survive a Marriage (NBC) | Q148: Movie [Matinee 12]: The Devil at 4 O'clock (1961) | V148: Gomer Pyle, USMC | W148: Batman | X148: Ramblin' Rod | Y148: I Dream of Jeannie | Z148: The Mod Squad | AB148: Star Trek | AD148: The FBI | AF148: Pop! Goes the Country | AG148: The Bobby Goldsboro Show | AH148: Hank Thompson | AI148: Jimmy Dean | AJ148: The 10 O'Clock News | AL148: Movie: Theodora Goes Wild (1936) | AX148: =AX147+7 -> 27409
A149: =A148+7 -> 27416 | F149: Government Story | G149: The Flintstones | H149: Cartoon Castle | I149: Petticoat Junction | J149: Celebrity Sweepstakes (NBC) | K149: Nanny and the Professor | L149: Now You See It (CBS) | M149: Bold Ones | O149: Search for Tomorrow (CBS) | P149: How to Survive a Marriage (NBC) | Q149: Movie [Matinee 12]: Inherit the Wind (1960) | V149: Gomer Pyle, USMC | W149: Batman | X149: Ramblin' Rod | Y149: I Dream of Jeannie | Z149: The Mod Squad | AB149: Star Trek | AD149: The FBI | AF149: Pop! Goes the Country | AG149: The Bobby Goldsboro Show | AH149: That Good Ole Nashville Music | AI149: Jimmy Dean | AJ149: The 10 O'Clock News | AL149: Movie: Up Front (1951) | AX149: =AX148+7 -> 27416
A150: =A149+7 -> 27423 | F150: Government Story | G150: The Flintstones | H150: Cartoon Castle | I150: Petticoat Junction | J150: Celebrity Sweepstakes (NBC) | K150: Nanny and the Professor | L150: Bill Cosby | M150: Bold Ones | O150: Search for Tomorrow (CBS) | P150: How to Survive a Marriage (NBC) | Q150: Movie [Matinee 12]: Santa Fe Trail (1940) | V150: Gomer Pyle, USMC | W150: Batman | X150: Ramblin' Rod | Y150: I Dream of Jeannie | Z150: The Mod Squad | AB150: Star Trek | AD150: The FBI | AF150: Pop! Goes the Country | AG150: The Bobby Goldsboro Show | AH150: That Good Ole Nashville Music | AI150: Jimmy Dean | AJ150: The 10 O'Clock News | AL150: Movie: Only Two Can Play (1962) | AX150: =AX149+7 -> 27423
A151: =A150+7 -> 27430 | F151: Government Story | G151: The Flintstones | H151: Cartoon Castle | I151: Petticoat Junction | J151: Celebrity Sweepstakes (NBC) | K151: Nanny and the Professor | L151: Now You See It (CBS) | M151: Bold Ones | O151: Search for Tomorrow (CBS) | P151: How to Survive a Marriage (NBC) | Q151: Movie [Matinee 12]: The Joker is Wild (1957) | V151: Gomer Pyle, USMC | W151: Batman | X151: Ramblin' Rod | Y151: I Dream of Jeannie | Z151: The Mod Squad | AB151: Star Trek | AD151: The FBI | AF151: Pop! Goes the Country | AG151: The Bobby Goldsboro Show | AH151: That Good Ole Nashville Music | AI151: Jimmy Dean | AJ151: The 10 O'Clock News | AL151: Movie: Meet Me at the Fair (1952) | AX151: =AX150+7 -> 27430
A152: =A151+7 -> 27437 | F152: Government Story | G152: The Flintstones | H152: Cartoon Castle | I152: Petticoat Junction | J152: Celebrity Sweepstakes (NBC) | K152: Nanny and the Professor | L152: Now You See It (CBS) | M152: Bold Ones | O152: Search for Tomorrow (CBS) | P152: How to Survive a Marriage (NBC) | Q152: Movie [Matinee 12]: Khartoum (1966) | V152: Gomer Pyle, USMC | W152: Batman | X152: Ramblin' Rod | Y152: I Dream of Jeannie | Z152: The Mod Squad | AB152: Star Trek | AD152: The FBI | AF152: Pop! Goes the Country | AG152: The Bobby Goldsboro Show | AH152: That Good Ole Nashville Music | AI152: Jimmy Dean | AJ152: The 10 O'Clock News | AL152: Movie: The Outsider (1961) | AX152: =AX151+7 -> 27437
A153: =A152+7 -> 27444 | F153: Government Story | G153: The Flintstones | H153: Cartoon Castle | I153: Petticoat Junction | J153: Celebrity Sweepstakes (NBC) | K153: Nanny and the Professor | L153: Now You See It (CBS) | M153: Bold Ones | O153: Search for Tomorrow (CBS) | P153: How to Survive a Marriage (NBC) | Q153: Movie [Matinee 12]: The Great Imposter (1961) | V153: Gomer Pyle, USMC | W153: Batman | X153: Ramblin' Rod | Y153: I Dream of Jeannie | Z153: The Mod Squad | AB153: Star Trek | AD153: The FBI | AF153: Pop! Goes the Country | AG153: The Bobby Goldsboro Show | AH153: That Good Ole Nashville Music | AI153: Jimmy Dean | AJ153: The 10 O'Clock News | AL153: Movie: Portrait in Black (1960) | AX153: =AX152+7 -> 27444
A154: =A153+7 -> 27451 | F154: Government Story | G154: The Flintstones | H154: Cartoon Castle | I154: Petticoat Junction | J154: Celebrity Sweepstakes (NBC) | K154: Nanny and the Professor | L154: Now You See It (CBS) | M154: Bold Ones | O154: Search for Tomorrow (CBS) | P154: How to Survive a Marriage (NBC) | Q154: Movie [Matinee 12]: Captain Newman, M.D. (1964) | V154: Gomer Pyle, USMC | W154: Batman | X154: Ramblin' Rod | Y154: I Dream of Jeannie | Z154: The Mod Squad | AB154: Star Trek | AD154: The FBI | AF154: NBA Basketball: Portland Trail Blazers vs Los Angeles Lakers | AJ154: The 10 O'Clock News | AL154: Movie: The Rawhide Years (1956) | AX154: =AX153+7 -> 27451
A155: =A154+7 -> 27458 | F155: Government Story | G155: The Flintstones | H155: Cartoon Castle | I155: Petticoat Junction | J155: Celebrity Sweepstakes (NBC) | K155: Nanny and the Professor | L155: Now You See It (CBS) | M155: Bold Ones | O155: Search for Tomorrow (CBS) | P155: How to Survive a Marriage (NBC) | Q155: Movie [Matinee 12]: Picnic (1955) | V155: Gomer Pyle, USMC | W155: Batman | X155: Ramblin' Rod | Y155: The Mickey Mouse Club | Z155: The Mod Squad | AB155: Star Trek | AD155: The FBI | AF155: Pop! Goes the Country | AG155: The Bobby Goldsboro Show | AH155: That Good Ole Nashville Music | AI155: Jimmy Dean | AJ155: The 10 O'Clock News | AL155: Movie: TBA | AX155: =AX154+7 -> 27458
A156: =A155+7 -> 27465 | F156: Government Story | G156: The Flintstones | H156: Cartoon Castle | I156: Petticoat Junction | J156: Celebrity Sweepstakes (NBC) | K156: Nanny and the Professor | L156: Now You See It (CBS) | M156: Sarge (Bold Ones) | O156: Search for Tomorrow (CBS) | P156: How to Survive a Marriage (NBC) | Q156: Movie [Matinee 12]: Freud (1962) | V156: Gomer Pyle, USMC | W156: Batman | X156: Ramblin' Rod | Y156: The Mickey Mouse Club | Z156: The Mod Squad | AB156: Star Trek | AD156: The FBI | AF156: Pop! Goes the Country | AG156: The Bobby Goldsboro Show | AH156: That Good Ole Nashville Music | AI156: Jimmy Dean | AJ156: The 10 O'Clock News | AL156: Movie: This Island Earth (1955) | AX156: =AX155+7 -> 27465
A157: =A156+7 -> 27472 | F157: Government Story | G157: The Flintstones | H157: Cartoon Castle | I157: Petticoat Junction | J157: Celebrity Sweepstakes (NBC) | K157: Nanny and the Professor | L157: Now You See It (CBS) | M157: Sarge (Bold Ones) | O157: Search for Tomorrow (CBS) | P157: How to Survive a Marriage (NBC) | Q157: Movie [Matinee 12]: Impact (1949) | V157: Gomer Pyle, USMC | W157: Batman | X157: Ramblin' Rod | Y157: The Mickey Mouse Club | Z157: The Mod Squad | AB157: Star Trek | AD157: The FBI | AF157: Pop! Goes the Country | AG157: The Bobby Goldsboro Show | AH157: That Good Ole Nashville Music | AI157: Jimmy Dean | AJ157: The 10 O'Clock News | AL157: Movie: Psyche '59 (1964) | AX157: =AX156+7 -> 27472
A158: =A157+7 -> 27479 | F158: Government Story | G158: The Flintstones | H158: Cartoon Castle | I158: Petticoat Junction | J158: Celebrity Sweepstakes (NBC) | K158: Nanny and the Professor | L158: Now You See It (CBS) | M158: Sarge (Bold Ones) | O158: Search for Tomorrow (CBS) | P158: How to Survive a Marriage (NBC) | Q158: Movie [Matinee 12]: Song of Scheherazade (1947) | V158: Gomer Pyle, USMC | W158: Batman | X158: Ramblin' Rod | Y158: The Mickey Mouse Club | Z158: The Mod Squad | AB158: Star Trek | AD158: The FBI | AF158: Pop! Goes the Country | AG158: The Bobby Goldsboro Show | AH158: That Good Ole Nashville Music | AI158: Jimmy Dean | AJ158: The 10 O'Clock News | AL158: Spring Event '75 with Oral Roberts | AX158: =AX157+7 -> 27479
A159: =A158+7 -> 27486 | F159: Government Story | G159: The Flintstones | H159: Cartoon Castle | I159: Petticoat Junction | J159: Celebrity Sweepstakes (NBC) | K159: Nanny and the Professor | L159: Now You See It (CBS) | M159: Bold Ones | O159: Search for Tomorrow (CBS) | P159: How to Survive a Marriage (NBC) | Q159: Movie [Matinee 12]: The Sea Hawk (1940) | V159: Gomer Pyle, USMC | W159: Batman | X159: Ramblin' Rod | Y159: The Mickey Mouse Club | Z159: The Mod Squad | AB159: Star Trek | AD159: The FBI | AF159: Pop! Goes the Country | AG159: The Bobby Goldsboro Show | AH159: That Good Ole Nashville Music | AI159: Jimmy Dean | AJ159: The 10 O'Clock News | AL159: Movie: The Colossus of New York (1958) | AX159: =AX158+7 -> 27486
A160: =A159+7 -> 27493 | F160: Government Story | G160: The Flintstones | H160: Cartoon Castle | I160: Petticoat Junction | J160: Celebrity Sweepstakes (NBC) | K160: Nanny and the Professor | L160: Now You See It (CBS) | M160: Bold Ones | O160: Search for Tomorrow (CBS) | P160: How to Survive a Marriage (NBC) | Q160: Movie [Matinee 12]: Fahrenheit 451 (1966) | V160: Gomer Pyle, USMC | W160: Batman | X160: Ramblin' Rod | Y160: The Mickey Mouse Club | Z160: The Mod Squad | AB160: Star Trek | AD160: The FBI | AF160: Pop! Goes the Country | AG160: The Bobby Goldsboro Show | AH160: That Good Ole Nashville Music | AI160: Jimmy Dean | AJ160: The 10 O'Clock News | AL160: Movie: Night Creatures (1962) | AX160: =AX159+7 -> 27493
A161: =A160+7 -> 27500 | F161: Government Story | G161: The Flintstones | H161: Cartoon Castle | I161: Petticoat Junction | J161: Celebrity Sweepstakes (NBC) | K161: Nanny and the Professor | L161: Now You See It (CBS) | M161: Bold Ones | O161: Search for Tomorrow (CBS) | P161: How to Survive a Marriage (NBC) | Q161: Movie [Matinee 12]: For Love or Money (1963) | V161: Gomer Pyle, USMC | W161: Batman | X161: Ramblin' Rod | Y161: The Mickey Mouse Club | Z161: The Mod Squad | AB161: Star Trek | AD161: The FBI | AF161: Pop! Goes the Country | AG161: The Bobby Goldsboro Show | AH161: That Good Ole Nashville Music | AI161: Jimmy Dean | AJ161: The 10 O'Clock News | AL161: Movie: The Killing Game (1967) | AX161: =AX160+7 -> 27500
A162: =A161+7 -> 27507 | F162: Government Story | G162: The Flintstones | H162: Cartoon Castle | J162: Celebrity Sweepstakes (NBC) | K162: Petticoat Junction | L162: Now You See It (CBS) | M162: Mister Ed | N162: I Dream of Jeannie | O162: Search for Tomorrow (CBS) | P162: Perry Mason | R162: Movie [Matinee 12]: So This is Paris (1954) | V162: Gomer Pyle, USMC | W162: Gentle Ben | X162: Ramblin' Rod | Y162: The Mickey Mouse Club | Z162: The Mod Squad | AB162: Star Trek | AD162: The FBI | AF162: Pop! Goes the Country | AG162: The Bobby Goldsboro Show | AH162: That Good Ole Nashville Music | AI162: Jimmy Dean | AJ162: The 10 O'Clock News | AL162: It Takes a Thief | AN162: Night Gallery | AX162: =AX161+7 -> 27507
A163: =A162+7 -> 27514 | F163: Government Story | G163: The Flintstones | H163: Cartoon Castle | J163: Celebrity Sweepstakes (NBC) | K163: Petticoat Junction | L163: Now You See It (CBS) | M163: Mister Ed | N163: I Dream of Jeannie | O163: Search for Tomorrow (CBS) | P163: Perry Mason | R163: Movie [Matinee 12]: Canyon Passage (1946) | V163: Gomer Pyle, USMC | W163: Gentle Ben | X163: Ramblin' Rod | Y163: The Mickey Mouse Club | Z163: The Mod Squad | AB163: Star Trek | AD163: The FBI | AF163: Pop! Goes the Country | AG163: The Bobby Goldsboro Show | AH163: That Good Ole Nashville Music | AI163: Jimmy Dean | AJ163: The 10 O'Clock News | AL163: It Takes a Thief | AN163: Night Gallery | AX163: =AX162+7 -> 27514
A164: =A163+7 -> 27521 | F164: Government Story | G164: The Flintstones | H164: Cartoon Castle | J164: Celebrity Sweepstakes (NBC) | K164: Petticoat Junction | L164: Now You See It (CBS) | M164: Mister Ed | N164: I Dream of Jeannie | O164: Search for Tomorrow (CBS) | P164: Perry Mason | R164: Movie [Matinee 12]: Once More, My Darling (1949) | V164: Gomer Pyle, USMC | W164: Gentle Ben | X164: Ramblin' Rod | Y164: The Mickey Mouse Club | Z164: The Mod Squad | AB164: Star Trek | AD164: The FBI | AF164: Pop! Goes the Country | AG164: The Bobby Goldsboro Show | AH164: That Good Ole Nashville Music | AI164: Jimmy Dean | AJ164: The 10 O'Clock News | AL164: It Takes a Thief | AN164: Night Gallery | AX164: =AX163+7 -> 27521
A165: =A164+7 -> 27528 | F165: Government Story | G165: The Flintstones | H165: Cartoon Castle | J165: Celebrity Sweepstakes (NBC) | K165: Petticoat Junction | L165: Now You See It (CBS) | M165: Mister Ed | N165: I Dream of Jeannie | O165: Search for Tomorrow (CBS) | P165: Perry Mason | R165: Movie [Matinee 12]: Joe Butterfly (1957) | V165: Gomer Pyle, USMC | W165: Gentle Ben | X165: Ramblin' Rod | Y165: The Mickey Mouse Club | Z165: The Mod Squad | AB165: Star Trek | AD165: The FBI | AF165: Pop! Goes the Country | AG165: The Bobby Goldsboro Show | AH165: That Good Ole Nashville Music | AI165: Jimmy Dean | AJ165: The 10 O'Clock News | AL165: It Takes a Thief | AN165: Night Gallery | AX165: =AX164+7 -> 27528
A166: =A165+7 -> 27535 | F166: Government Story | G166: The Flintstones | H166: Cartoon Castle | J166: Celebrity Sweepstakes (NBC) | K166: Petticoat Junction | L166: Now You See It (CBS) | M166: Mister Ed | N166: I Dream of Jeannie | O166: Search for Tomorrow (CBS) | P166: Perry Mason | R166: Movie [Matinee 12]: The Lady Takes a Flyer (1957) | V166: Gomer Pyle, USMC | W166: Gentle Ben | X166: Ramblin' Rod | Y166: The Mickey Mouse Club | Z166: The Mod Squad | AB166: Star Trek | AD166: The FBI | AF166: Pop! Goes the Country | AG166: The Bobby Goldsboro Show | AH166: That Good Ole Nashville Music | AI166: Jimmy Dean | AJ166: The 10 O'Clock News | AL166: It Takes a Thief | AN166: Sixth Sense (Night Gallery) | AX166: =AX165+7 -> 27535
A167: =A166+7 -> 27542 | F167: Government Story | G167: The Flintstones | H167: Cartoon Castle | J167: Celebrity Sweepstakes (NBC) | K167: Petticoat Junction | L167: Now You See It (CBS) | M167: Mister Ed | N167: I Dream of Jeannie | O167: Search for Tomorrow (CBS) | P167: Perry Mason | R167: Movie [Matinee 12]: The House of Seven Gables (1940) | V167: Gomer Pyle, USMC | W167: Gentle Ben | X167: Ramblin' Rod | Y167: The Mickey Mouse Club | Z167: The Mod Squad | AB167: Star Trek | AD167: The FBI | AF167: Pop! Goes the Country | AG167: The Bobby Goldsboro Show | AH167: That Good Ole Nashville Music | AI167: Jimmy Dean | AJ167: The 10 O'Clock News | AL167: It Takes a Thief | AN167: Night Gallery | AX167: =AX166+7 -> 27542
A168: =A167+7 -> 27549 | F168: Government Story | G168: The Flintstones | H168: Cartoon Castle | J168: Celebrity Sweepstakes (NBC) | K168: Petticoat Junction | L168: Now You See It (CBS) | M168: Mister Ed | N168: I Dream of Jeannie | O168: Search for Tomorrow (CBS) | P168: Perry Mason | R168: Movie [Matinee 12]: The Sun Never Sets (1939) | V168: Gomer Pyle, USMC | W168: Batman | X168: Ramblin' Rod | Y168: The Mickey Mouse Club | Z168: The Mod Squad | AB168: Star Trek | AD168: Billy Graham Crusade | AF168: Pop! Goes the Country | AG168: The Bobby Goldsboro Show | AH168: That Good Ole Nashville Music | AI168: Jimmy Dean | AJ168: The 10 O'Clock News | AL168: It Takes a Thief | AN168: Night Gallery | AX168: =AX167+7 -> 27549
A169: =A168+7 -> 27556 | F169: Government Story | G169: The Flintstones | H169: Cartoon Castle | J169: Celebrity Sweepstakes (NBC) | K169: Petticoat Junction | L169: Now You See It (CBS) | M169: Mister Ed | N169: I Dream of Jeannie | O169: Search for Tomorrow (CBS) | P169: Perry Mason | R169: Movie [Matinee 12]: A Woman's Vengeance (1947) | V169: Gomer Pyle, USMC | W169: Batman | X169: Ramblin' Rod | Y169: The Mickey Mouse Club | Z169: The Mod Squad | AB169: Star Trek | AD169: The FBI | AF169: Pop! Goes the Country | AG169: The Bobby Goldsboro Show | AH169: That Good Ole Nashville Music | AI169: Jimmy Dean | AJ169: The 10 O'Clock News | AL169: It Takes a Thief | AN169: Night Gallery | AX169: =AX168+7 -> 27556
A170: =A169+7 -> 27563 | F170: Government Story | G170: The Flintstones | H170: Cartoon Castle | J170: Celebrity Sweepstakes (NBC) | K170: Petticoat Junction | L170: Tattletales (CBS) | M170: Mister Ed | N170: I Dream of Jeannie | O170: Search for Tomorrow (CBS) | P170: Perry Mason | R170: Movie [Matinee 12]: Posse from Hell (1961) | V170: Gomer Pyle, USMC | W170: Batman | X170: Ramblin' Rod | Y170: The Mickey Mouse Club | Z170: The Mod Squad | AB170: Star Trek | AD170: The FBI | AF170: Burt Bacharach: Close to You | AH170: That Good Ole Nashville Music | AI170: Jimmy Dean | AJ170: The 10 O'Clock News | AL170: It Takes a Thief | AN170: Sixth Sense (Night Gallery) | AX170: =AX169+7 -> 27563
A171: =A170+7 -> 27570 | F171: Government Story | G171: The Flintstones | H171: Cartoon Castle | J171: Celebrity Sweepstakes (NBC) | K171: Petticoat Junction | L171: Tattletales (CBS) | M171: Mister Ed | N171: I Dream of Jeannie | O171: Search for Tomorrow (CBS) | P171: Perry Mason | R171: Movie [Matinee 12]: Target Unknown (1951) | V171: Land of the Giants | X171: Ramblin' Rod | Y171: The Mickey Mouse Club | Z171: The Mod Squad | AB171: Star Trek | AD171: The FBI | AF171: Pop! Goes the Country | AG171: The Bobby Goldsboro Show | AH171: That Good Ole Nashville Music | AI171: Jimmy Dean | AJ171: The 10 O'Clock News--Michael Hartfield/Sylvia Stinson | AL171: It Takes a Thief | AN171: Night Gallery | AX171: =AX170+7 -> 27570
A172: =A171+7 -> 27577 | F172: Government Story | G172: The Flintstones | H172: Cartoon Castle | J172: Celebrity Sweepstakes (NBC) | K172: Petticoat Junction | L172: Tattletales (CBS) | M172: Mister Ed | N172: I Dream of Jeannie | O172: Search for Tomorrow (CBS) | P172: Perry Mason | R172: Movie [Matinee 12]: The Boss (1956) | V172: Land of the Giants | X172: Ramblin' Rod | Y172: The Mickey Mouse Club | Z172: The Mod Squad | AB172: Star Trek | AD172: The FBI | AF172: Pop! Goes the Country | AG172: The Bobby Goldsboro Show | AH172: That Good Ole Nashville Music | AI172: Jimmy Dean | AJ172: The 10 O'Clock News--Michael Hartfield/Sylvia Stinson | AL172: It Takes a Thief | AN172: Night Gallery | AX172: =AX171+7 -> 27577
A173: =A172+7 -> 27584 | F173: Government Story | G173: The Flintstones | H173: Cartoon Castle | J173: Celebrity Sweepstakes (NBC) | K173: Petticoat Junction | L173: Tattletales (CBS) | M173: Mister Ed | N173: Safari to Adventure | O173: Search for Tomorrow (CBS) | P173: Perry Mason | R173: Movie [Matinee 12]: Paid in Full (1949) | V173: Land of the Giants | X173: Ramblin' Rod | Y173: The Mickey Mouse Club | Z173: Mission: Impossible | AB173: Star Trek | AD173: The FBI | AF173: Pop! Goes the Country | AG173: The Bobby Goldsboro Show | AH173: That Good Ole Nashville Music | AI173: Jimmy Dean | AJ173: The 10 O'Clock News--Michael Hartfield/Sylvia Stinson | AL173: It Takes a Thief | AN173: Night Gallery | AX173: =AX172+7 -> 27584
A174: =A173+7 -> 27591 | F174: Government Story | G174: Cartoon Castle | I174: Nanny and the Professor | J174: Celebrity Sweepstakes (NBC) | K174: Audubon Wildlife Theatre | L174: Tattletales (CBS) | M174: Gomer Pyle, USMC | N174: Safari to Adventure | O174: Search for Tomorrow (CBS) | P174: Perry Mason | R174: Movie [Matinee 12]: Naked Alibi (1954) | V174: Land of the Giants | X174: Ramblin' Rod | Y174: The Mickey Mouse Club | Z174: Mission: Impossible | AB174: Star Trek | AD174: The FBI | AF174: Pop! Goes the Country | AG174: The Bobby Goldsboro Show | AH174: That Good Ole Nashville Music | AI174: Jimmy Dean | AJ174: The 10 O'Clock News--Michael Hartfield/Sylvia Stinson | AL174: It Takes a Thief | AN174: Night Gallery | AX174: =AX173+7 -> 27591
A175: =A174+7 -> 27598 | F175: Government Story | G175: Cartoon Castle | I175: Nanny and the Professor | J175: Celebrity Sweepstakes (NBC) | K175: Audubon Wildlife Theatre | L175: Tattletales (CBS) | M175: Gomer Pyle, USMC | N175: Safari to Adventure | O175: Search for Tomorrow (CBS) | P175: Perry Mason | R175: Movie [Matinee 12]: The Great Man (1956) | V175: Land of the Giants | X175: Ramblin' Rod | Y175: The Mickey Mouse Club | Z175: Mission: Impossible | AB175: Star Trek | AD175: The FBI | AF175: Pop! Goes the Country | AG175: The Bobby Goldsboro Show | AH175: That Good Ole Nashville Music | AI175: Jimmy Dean | AJ175: The 10 O'Clock News--Michael Hartfield/Sylvia Stinson | AL175: It Takes a Thief | AN175: Sixth Sense (Night Gallery) | AX175: =AX174+7 -> 27598
A176: =A175+7 -> 27605 | F176: Government Story | G176: Cartoon Castle | I176: Nanny and the Professor | J176: Celebrity Sweepstakes (NBC) | K176: Audubon Wildlife Theatre | L176: Tattletales (CBS) | M176: Gomer Pyle, USMC | N176: Safari to Adventure | O176: Search for Tomorrow (CBS) | P176: Perry Mason | R176: Movie [Matinee 12]: Family Honeymoon (1948) | V176: Land of the Giants | X176: Ramblin' Rod | Y176: The Mickey Mouse Club | Z176: Mission: Impossible | AB176: Star Trek | AD176: The FBI | AF176: Pop! Goes the Country | AG176: The Bobby Goldsboro Show | AH176: That Good Ole Nashville Music | AI176: Jimmy Dean | AJ176: The 10 O'Clock News--Michael Hartfield/Sylvia Stinson | AL176: It Takes a Thief | AN176: Night Gallery | AX176: =AX175+7 -> 27605
A177: =A176+7 -> 27612 | F177: Government Story | G177: Cartoon Castle | I177: Nanny and the Professor | J177: Celebrity Sweepstakes (NBC) | K177: Audubon Wildlife Theatre | L177: Tattletales (CBS) | M177: Gomer Pyle, USMC | N177: Safari to Adventure | O177: Search for Tomorrow (CBS) | P177: Perry Mason | R177: Movie [Matinee 12]: Kid Galahad (1962) | V177: Land of the Giants | X177: Ramblin' Rod | Y177: The Mickey Mouse Club | Z177: Mission: Impossible | AB177: Star Trek | AD177: The FBI | AF177: Pop! Goes the Country | AG177: The Bobby Goldsboro Show | AH177: That Good Ole Nashville Music | AI177: Jimmy Dean | AJ177: The 10 O'Clock News--Michael Hartfield/Sylvia Stinson | AL177: It Takes a Thief | AN177: Night Gallery | AX177: =AX176+7 -> 27612
A178: =A177+7 -> 27619 | F178: Government Story | G178: Cartoon Castle | I178: Nanny and the Professor | J178: Celebrity Sweepstakes (NBC) | K178: Audubon Wildlife Theatre | L178: Tattletales (CBS) | M178: Gomer Pyle, USMC | N178: Safari to Adventure | O178: Search for Tomorrow (CBS) | P178: Perry Mason | R178: Movie [Matinee 12]: The Dream Maker (1963) | V178: Land of the Giants | X178: Ramblin' Rod | Y178: The Mickey Mouse Club | Z178: Mission: Impossible | AB178: Star Trek | AD178: The FBI | AF178: Pop! Goes the Country | AG178: The Bobby Goldsboro Show | AH178: That Good Ole Nashville Music | AI178: Jimmy Dean | AJ178: The 10 O'Clock News--Michael Hartfield/Sylvia Stinson | AL178: It Takes a Thief | AN178: Night Gallery | AX178: =AX177+7 -> 27619
A179: =A178+7 -> 27626 | F179: Government Story | G179: Cartoon Castle | I179: Nanny and the Professor | J179: Petticoat Junction | K179: Movie [The Morning Movie]: Gidget Goes Hawaiian (1961) | O179: Search for Tomorrow (CBS) | P179: Perry Mason | R179: Movie [Matinee 12]: The Second Greatest Sex (1955) | V179: Land of the Giants | X179: Ramblin' Rod | Y179: The Mickey Mouse Club | Z179: Mission: Impossible | AB179: Star Trek | AD179: The FBI | AF179: Pop! Goes the Country | AG179: The Bobby Goldsboro Show | AH179: That Good Ole Nashville Music | AI179: Jimmy Dean | AJ179: The 10 O'Clock News--Michael Hartfield/Sylvia Stinson | AL179: It Takes a Thief | AN179: Night Gallery | AX179: =AX178+7 -> 27626
A180: =A179+7 -> 27633 | F180: Government Story | G180: Cartoon Castle | I180: Nanny and the Professor | J180: Petticoat Junction | K180: Movie [The Morning Movie]: The Tarnished Angels (1957) | O180: Search for Tomorrow (CBS) | P180: Perry Mason | R180: Movie [Matinee 12]: Interlude (1957) | V180: I Dream of Jeannie | W180: Speed Racer | X180: Ramblin' Rod | Y180: The Mickey Mouse Club | Z180: Mission: Impossible | AB180: Star Trek | AD180: The FBI | AF180: Pop! Goes the Country | AG180: The Bobby Goldsboro Show | AH180: That Good Ole Nashville Music | AI180: Jimmy Dean | AJ180: The 10 O'Clock News--Michael Hartfield/Sylvia Stinson | AL180: It Takes a Thief | AN180: Night Gallery | AX180: =AX179+7 -> 27633
A181: =A180+7 -> 27640 | F181: Government Story | G181: Cartoon Castle | I181: Nanny and the Professor | J181: Petticoat Junction | K181: Movie [The Morning Movie]: Kelly and Me (1957) | O181: Search for Tomorrow (CBS) | P181: Perry Mason | R181: Movie [Matinee 12]: Hot Spell (1958) | V181: I Dream of Jeannie | W181: Speed Racer | X181: Ramblin' Rod | Y181: The Mickey Mouse Club | Z181: Mission: Impossible | AB181: Star Trek | AD181: Billy Graham Crusade | AF181: Pop! Goes the Country | AG181: Nashville on the Road | AH181: That Good Ole Nashville Music | AI181: The Porter Wagoner Show | AJ181: The 10 O'Clock News--Michael Hartfield/Sylvia Stinson | AL181: It Takes a Thief | AN181: Night Gallery | AX181: =AX180+7 -> 27640
A182: =A181+7 -> 27647 | F182: Government Story | G182: Ramblin' Rod | I182: Gomer Pyle, USMC | J182: Petticoat Junction | K182: Movie [The Morning Movie]: Because of You (1952) | O182: Search for Tomorrow (CBS) | P182: Perry Mason | R182: Movie [Matinee 12]: LISTING MISSING | V182: I Dream of Jeannie LISTING MISSING | W182: Speed Racer LISTING MISSING | X182: The Flintstones | Y182: The Mickey Mouse Club | Z182: The Courtship of Eddie's Father | AA182: Room 222 | AB182: Adam-12 | AC182: Adam-12 | AD182: The FBI | AF182: Pop! Goes the Country | AG182: Nashville on the Road | AH182: That Good Ole Nashville Music | AI182: The Porter Wagoner Show | AJ182: The 10 O'Clock News | AL182: Mission: Impossible | AX182: =AX181+7 -> 27647
A183: =A182+7 -> 27654 | F183: Government Story | G183: Ramblin' Rod | I183: Gomer Pyle, USMC | J183: Petticoat Junction | K183: Movie [The Morning Movie]: Song of Scheherazade (1947) | O183: Search for Tomorrow (CBS) | P183: Perry Mason | R183: Movie [Matinee 12|: Congo Crossing (1956) | V183: I Dream of Jeannie | W183: Speed Racer | X183: The Flintstones | Y183: The Mickey Mouse Club | Z183: The Courtship of Eddie's Father | AA183: Room 222 | AB183: Adam-12 | AC183: Adam-12 | AD183: The FBI | AF183: Pop! Goes the Country | AG183: Nashville on the Road | AH183: That Good Ole Nashville Music | AI183: The Porter Wagoner Show | AJ183: The 10 O'Clock News | AL183: Mission: Impossible | AX183: =AX182+7 -> 27654
A184: =A183+7 -> 27661 | F184: Government Story | G184: Ramblin' Rod | I184: Gomer Pyle, USMC | J184: Petticoat Junction | K184: Movie [The Morning Movie]: Kiss of Fire (1955) | O184: Search for Tomorrow (CBS) | P184: Perry Mason | R184: Movie [Matinee 12|: The Sleeping City (1950) | V184: I Dream of Jeannie | W184: Speed Racer | X184: The Flintstones | Y184: The Mickey Mouse Club | Z184: The Courtship of Eddie's Father | AA184: Room 222 | AB184: Adam-12 | AC184: Adam-12 | AD184: The FBI | AF184: Pop! Goes the Country | AG184: Nashville on the Road | AH184: That Good Ole Nashville Music | AI184: The Porter Wagoner Show | AJ184: The 10 O'Clock News | AL184: Mission: Impossible | AX184: =AX183+7 -> 27661
A185: =A184+7 -> 27668 | F185: Government Story | G185: Ramblin' Rod | I185: Gomer Pyle, USMC | J185: Petticoat Junction | K185: Movie [The Morning Movie]: Kathy O' (1958) | O185: Search for Tomorrow (CBS) | P185: Perry Mason | R185: Movie [Matinee 12|: The All American (1953) | V185: I Dream of Jeannie | W185: Speed Racer | X185: The Flintstones | Y185: The Mickey Mouse Club | Z185: The Courtship of Eddie's Father | AA185: Room 222 | AB185: Adam-12 | AC185: Adam-12 | AD185: The FBI | AF185: Pop! Goes the Country | AG185: Nashville on the Road | AH185: That Good Ole Nashville Music | AI185: The Porter Wagoner Show | AJ185: The 10 O'Clock News | AL185: Mission: Impossible | AX185: =AX184+7 -> 27668
A186: =A185+7 -> 27675 | F186: Government Story | G186: Ramblin' Rod | I186: Gomer Pyle, USMC | J186: Petticoat Junction | K186: Movie [The Morning Movie]: Comanche Territory (1950) | N186: Not for Women Only | O186: Search for Tomorrow (CBS) | P186: Perry Mason | R186: Movie [Matinee 12|: Flesh and Fury (1952) | V186: I Dream of Jeannie | W186: Speed Racer | X186: The Flintstones | Y186: The Mickey Mouse Club | Z186: The Courtship of Eddie's Father | AA186: Room 222 | AB186: Adam-12 | AC186: Adam-12 | AD186: The FBI | AF186: Pop! Goes the Country | AG186: Nashville on the Road | AH186: That Good Ole Nashville Music | AI186: The Porter Wagoner Show | AJ186: The 10 O'Clock News | AL186: Mission: Impossible | AX186: =AX185+7 -> 27675
A187: =A186+7 -> 27682 | F187: Government Story | G187: Ramblin' Rod | I187: Gomer Pyle, USMC | J187: Petticoat Junction | K187: Movie [The Morning Movie]: Flame of Araby (1951) | N187: Not for Women Only | O187: Search for Tomorrow (CBS) | P187: Perry Mason | R187: Movie [Matinee 12|: The Borgia Stick (1967) | V187: I Dream of Jeannie | W187: Speed Racer | X187: The Flintstones | Y187: The Mickey Mouse Club | Z187: The Courtship of Eddie's Father | AA187: Room 222 | AB187: Adam-12 | AC187: Adam-12 | AD187: The FBI | AF187: That Good Ole Nashville Music | AG187: NBA Basketball: Portland Trail Blazers vs San Diego Sails | AL187: The 10 O'Clock News | AN187: Mission: Impossible | AX187: =AX186+7 -> 27682
A188: =A187+7 -> 27689 | F188: Government Story | G188: Ramblin' Rod | I188: Gomer Pyle, USMC | J188: Petticoat Junction | K188: Movie [The Morning Movie]: Son of Ali Baba (1952) | N188: Not for Women Only | O188: Search for Tomorrow (CBS) | P188: Perry Mason | R188: Movie [Matinee 12|: Bus Riley's Back in Town (1965) | V188: I Dream of Jeannie | W188: Speed Racer | X188: The Flintstones | Y188: The Mickey Mouse Club | Z188: The Courtship of Eddie's Father | AA188: Room 222 | AB188: Adam-12 | AC188: Adam-12 | AD188: The FBI | AF188: Pop! Goes the Country | AG188: Nashville on the Road | AH188: That Good Ole Nashville Music | AI188: The Porter Wagoner Show | AJ188: The 10 O'Clock News | AL188: Mission: Impossible | AX188: =AX187+7 -> 27689
A189: =A188+7 -> 27696 | F189: Government Story | G189: Ramblin' Rod | I189: Gomer Pyle, USMC | J189: Petticoat Junction | K189: Movie [The Morning Movie]: Tumbleweeds (1953) | N189: Not for Women Only | O189: Search for Tomorrow (CBS) | P189: Perry Mason | R189: Movie [Matinee 12|: Woman in Hiding (1949) | V189: I Dream of Jeannie | W189: Speed Racer | X189: The Flintstones | Y189: The Mickey Mouse Club | Z189: The Courtship of Eddie's Father | AA189: Room 222 | AB189: Adam-12 | AC189: Adam-12 | AD189: The FBI | AF189: Pop! Goes the Country | AG189: Nashville on the Road | AH189: That Good Ole Nashville Music | AI189: The Porter Wagoner Show | AJ189: The 10 O'Clock News | AL189: Mission: Impossible | AN189: Night Gallery | AX189: =AX188+7 -> 27696
A190: =A189+7 -> 27703 | F190: Government Story | G190: Ramblin' Rod | I190: Gomer Pyle, USMC | J190: Petticoat Junction | K190: Movie [The Morning Movie]: Wild Heritage (1958) | N190: Not for Women Only | O190: Search for Tomorrow (CBS) | P190: Perry Mason | R190: Movie [Matinee 12|: Thunder on the Hill (1951) | V190: I Dream of Jeannie | W190: Speed Racer | X190: The Flintstones | Y190: The Mickey Mouse Club | Z190: The Courtship of Eddie's Father | AA190: Room 222 | AB190: Adam-12 | AC190: Adam-12 | AD190: The FBI | AF190: Pop! Goes the Country | AG190: Nashville on the Road | AH190: That Good Ole Nashville Music | AI190: The Porter Wagoner Show | AJ190: The 10 O'Clock News | AL190: Mission: Impossible | AN190: Night Gallery | AX190: =AX189+7 -> 27703
A191: =A190+7 -> 27710 | F191: Government Story | G191: Ramblin' Rod | I191: Gomer Pyle, USMC | J191: Petticoat Junction | K191: Movie [The Morning Movie]: Escort West (1959) | N191: Not for Women Only | O191: Search for Tomorrow (CBS) | P191: Perry Mason | R191: Movie [Matinee 12|: Man Afraid (1957) | V191: I Dream of Jeannie | W191: Speed Racer | X191: The Flintstones | Y191: The Mickey Mouse Club | Z191: The Courtship of Eddie's Father | AA191: Room 222 | AB191: Adam-12 | AC191: Adam-12 | AD191: The FBI | AF191: Pop! Goes the Country | AG191: Nashville on the Road | AH191: That Good Ole Nashville Music | AI191: The Porter Wagoner Show | AJ191: The 10 O'Clock News | AL191: Mission: Impossible | AN191: Night Gallery | AX191: =AX190+7 -> 27710
A192: =A191+7 -> 27717 | F192: Government Story | G192: Ramblin' Rod | I192: Gomer Pyle, USMC | J192: Petticoat Junction | K192: Movie [The Morning Movie]: Gypsy Wildcat (1944) | N192: Not for Women Only | O192: Search for Tomorrow (CBS) | P192: Perry Mason | R192: Movie [Matinee 12|: Wings of Fire (1967) | V192: I Dream of Jeannie | W192: The Mickey Mouse Club | X192: The Flintstones | Y192: NBA Basketball: Portland Trail Blazers vs Detroit Pistons | AD192: The FBI | AF192: Pop! Goes the Country | AG192: Nashville on the Road | AH192: That Good Ole Nashville Music | AI192: The Porter Wagoner Show | AJ192: The 10 O'Clock News | AL192: Mission: Impossible | AN192: The Persuaders | AX192: =AX191+7 -> 27717
A193: =A192+7 -> 27724 | F193: Government Story | G193: Ramblin' Rod | I193: Gomer Pyle, USMC | J193: Petticoat Junction | K193: Movie [The Morning Movie]: The Land Unknown (1957) | N193: Not for Women Only | O193: Search for Tomorrow (CBS) | P193: Perry Mason | R193: Movie [Matinee 12|: So This is Paris (1954) | V193: I Dream of Jeannie | W193: Speed Racer | X193: The Flintstones | Y193: The Mickey Mouse Club | Z193: The Courtship of Eddie's Father | AA193: Room 222 | AB193: Adam-12 | AC193: Adam-12 | AD193: The FBI | AF193: Pop! Goes the Country | AG193: Nashville on the Road | AH193: That Good Ole Nashville Music | AI193: The Porter Wagoner Show | AJ193: The 10 O'Clock News | AL193: Mission: Impossible | AN193: The Persuaders | AX193: =AX192+7 -> 27724
A194: =A193+7 -> 27731 | F194: Government Story | G194: Ramblin' Rod | I194: Gomer Pyle, USMC | J194: Petticoat Junction | K194: Movie [The Morning Movie]: A Day of Fury (1956) | N194: Not for Women Only | O194: Search for Tomorrow (CBS) | P194: Perry Mason | R194: Movie [Matinee 12|: Fluffy (1965) | V194: I Dream of Jeannie | W194: Speed Racer | X194: The Flintstones | Y194: The Mickey Mouse Club | Z194: The Courtship of Eddie's Father | AA194: Room 222 | AB194: Adam-12 | AC194: Adam-12 | AD194: The FBI | AF194: Pop! Goes the Country | AG194: Nashville on the Road | AH194: That Good Ole Nashville Music | AI194: The Porter Wagoner Show | AJ194: The 10 O'Clock News | AL194: Mission: Impossible | AN194: The Persuaders | AX194: =AX193+7 -> 27731
A195: =A194+7 -> 27738 | F195: Government Story | G195: Ramblin' Rod | I195: Gomer Pyle, USMC | J195: Petticoat Junction | K195: Movie [The Morning Movie]: Comanche Station (1960) | N195: Not for Women Only | O195: Search for Tomorrow (CBS) | P195: Perry Mason | R195: Movie [Matinee 12|: Unfinished Woman (1941) | V195: I Dream of Jeannie | W195: Speed Racer | X195: The Flintstones | Y195: The Mickey Mouse Club | Z195: The Courtship of Eddie's Father | AA195: Room 222 | AB195: Adam-12 | AC195: Adam-12 | AD195: The FBI | AF195: Pop! Goes the Country | AG195: Nashville on the Road | AH195: That Good Ole Nashville Music | AI195: The Porter Wagoner Show | AJ195: The 10 O'Clock News | AL195: College Basketball: Montata State Bobcats vs Oregon Ducks | AX195: =AX194+7 -> 27738
A196: =A195+7 -> 27745 | F196: Government Story | G196: Ramblin' Rod | I196: Gomer Pyle, USMC | J196: Petticoat Junction | K196: Movie [The Morning Movie]: Dawn at Socorro (1954) | N196: Not for Women Only | O196: Search for Tomorrow (CBS) | P196: Perry Mason | R196: Movie [Matinee 12|: Bengal Brigade (1954) | V196: I Dream of Jeannie | W196: Speed Racer | X196: The Flintstones | Y196: The Mickey Mouse Club | Z196: The Courtship of Eddie's Father | AA196: Room 222 | AB196: Adam-12 | AC196: Adam-12 | AD196: The FBI | AF196: Pop! Goes the Country | AG196: Nashville on the Road | AH196: That Good Ole Nashville Music | AI196: The Porter Wagoner Show | AJ196: The 10 O'Clock News | AL196: Mission: Impossible | AN196: The Persuaders | AX196: =AX195+7 -> 27745
A197: =A196+7 -> 27752 | F197: Government Story | G197: Ramblin' Rod | I197: Gomer Pyle, USMC | J197: Petticoat Junction | K197: Movie [The Morning Movie]: The Three Stooges Meet Hercules (1961) | N197: Not for Women Only | O197: Search for Tomorrow (CBS) | P197: Perry Mason | R197: Movie [Matinee 12|: The Toy Tiger (1956) | V197: I Dream of Jeannie | W197: Speed Racer | X197: The Flintstones | Y197: The Mickey Mouse Club | Z197: The Courtship of Eddie's Father | AA197: Room 222 | AB197: Adam-12 | AC197: Adam-12 | AD197: The FBI | AF197: Pop! Goes the Country | AG197: Nashville on the Road | AH197: That Good Ole Nashville Music | AI197: The Porter Wagoner Show | AJ197: The 10 O'Clock News | AL197: Movie [Movie 12}: Pocketful of Miracles (1961) | AX197: =AX196+7 -> 27752
A198: =A197+7 -> 27759 | F198: Government Story | G198: Ramblin' Rod | I198: Gomer Pyle, USMC | J198: Petticoat Junction | K198: Movie [The Morning Movie]: The Veils of Bagdad (1953) | N198: Not for Women Only | O198: The Peach Bowl: West Virginia Mountaineers vs North Carolina State Wolfpack in Atlanta, Georgia | U198: World of Survival | V198: I Dream of Jeannie | W198: Speed Racer | X198: The Flintstones | Y198: The Mickey Mouse Club | Z198: The Courtship of Eddie's Father | AA198: Room 222 | AB198: Adam-12 | AC198: Adam-12 | AD198: The FBI | AF198: Pop! Goes the Country | AG198: Nashville on the Road | AH198: That Good Ole Nashville Music | AI198: The Porter Wagoner Show | AJ198: The 10 O'Clock News | AL198: Night Gallery | AM198: Billy Graham | AN198: Movie [Movie 12}: The Joker is Wild (1957) | AX198: =AX197+7 -> 27759
A199: 1976 | AX199: =A199 -> 1976
A202: 1977 | AX202: =A202 -> 1977
A205: 1978 | AX205: =A205 -> 1978
A208: 1979 | AX208: =A208 -> 1979
A211: 1980 | AX211: =A211 -> 1980
A212: 29229 | E212: Health Field | F212: Marlo and the Magic Movie Machine | G212: Ramblin' Rod | I212: Krofft Superstars | J212: Marcus Welby, M.D. | L212: Bonanza | N212: Match Game | O212: The New Joker's Wild | P212: Perry Mason | R212: Movie [Matinee 12]: My Girl Tisa (1948) | V212: Room 222 | W212: Bugs Bunny & Friends | X212: The Flintstones | Y212: Gilligan's Island | Z212: The Brady Bunch | AA212: Bewitched | AB212: The Bionic Woman | AD212: Happy Days Again | AE212: I Love Lucy | AF212: Movie [The Movie]: The Blue Knight (1973) | AJ212: The 10 O'Clock News | AL212: The Benny Hill Show | AM212: The Odd Couple | AN212: Mission: Impossible | AX212: =AX211+7 -> 1987
A213: 29236 | E213: Health Field | F213: Marlo and the Magic Movie Machine | G213: Ramblin' Rod | I213: Krofft Superstars | J213: Marcus Welby, M.D. | L213: Bonanza | N213: Match Game | O213: The New Joker's Wild | P213: Perry Mason | R213: Movie [Matinee 12]: Diplomatic Courier (1952) | V213: Bewitched | W213: Bugs Bunny & Friends | X213: The Flintstones | Y213: The Brady Bunch | Z213: NBA Basketball: Portland Trail Blazers vs. Philadelphia 76ers [LIVE] | AE213: Hogan's Heroes | AF213: Movie [The Movie]: The Ceremony (1964) | AJ213: The 10 O'Clock News | AL213: The Benny Hill Show | AM213: The Odd Couple | AN213: Mission: Impossible | AX213: =AX212+7 -> 1994
A214: 29243 | E214: Health Field | F214: Marlo and the Magic Movie Machine | G214: Ramblin' Rod | I214: Krofft Superstars | J214: Marcus Welby, M.D. | L214: Bonanza | N214: Match Game | O214: The New Joker's Wild | P214: Perry Mason | R214: Movie [Matinee 12]: Dial Hot Line (1970) | V214: Bewitched | W214: Bugs Bunny & Friends | X214: The Flintstones | Y214: The Brady Bunch | Z214: Star Trek | AB214: Emergency One! | AD214: Happy Days Again | AE214: Hogan's Heroes | AF214: Movie [The Movie]: Doctors' Wives (1971) | AJ214: The 10 O'Clock News | AL214: The Benny Hill Show | AM214: The Odd Couple | AN214: Mission: Impossible | AX214: =AX213+7 -> 2001
A215: 29250 | E215: Health Field | F215: Marlo and the Magic Movie Machine | G215: Ramblin' Rod | I215: Krofft Superstars | J215: Marcus Welby, M.D. | L215: Bonanza | N215: Match Game | O215: The New Joker's Wild | P215: Perry Mason | R215: Movie [Matinee 12]: Elephant Walk (1954) | V215: Bewitched | W215: Bugs Bunny & Friends | X215: The Flintstones | Y215: The Brady Bunch | Z215: Star Trek | AB215: Emergency One! | AD215: Happy Days Again | AE215: Hogan's Heroes | AF215: Movie [The Movie]: Duel (1971) | AJ215: The 10 O'Clock News | AL215: The Benny Hill Show | AM215: The Odd Couple | AN215: Mission: Impossible | AX215: =AX214+7 -> 2008