A1: TUESDAY | B1: 05:00AM | C1: 05:30AM | D1: 06:00AM | E1: 06:30AM | F1: 07:00AM | G1: 07:30AM | H1: 08:00AM | I1: 08:30AM | J1: 09:00AM | K1: 09:30AM | L1: 10:00AM | M1: 10:30AM | N1: 11:00AM | O1: 11:30AM | P1: 12:00N | Q1: 12:30PM | R1: 01:00PM | S1: 01:30PM | T1: 02:00PM | U1: 02:30PM | V1: 03:00PM | W1: 03:30PM | X1: 04:00PM | Y1: 04:30PM | Z1: 05:00PM | AA1: 05:30PM | AB1: 06:00PM | AC1: 06:30PM | AD1: 07:00PM | AE1: 07:30PM | AF1: 08:00PM | AG1: 08:30PM | AH1: 09:00PM | AI1: 09:30PM | AJ1: 10:00PM | AK1: 10:30PM | AL1: 11:00PM | AM1: 11:30PM | AN1: 12:00M | AO1: 12:30AM | AP1: 01:00AM | AQ1: 01:30AM | AR1: 02:00AM | AS1: 02:30AM | AT1: 03:00AM | AU1: 03:30AM | AV1: 04:00AM | AW1: 04:30AM | AX1: TUESDAY
A3: 1953 | AX3: =A3 -> 1953
A4: 19414 | P4: The Big Payoff (NBC) | Q4: Welcome Travelers (NBC) | R4: The Kate Smith Hour (NBC) | T4: Meet Betty Furness (CBS); [2:15] Arthur Godfrey Time (CBS) | U4: Strike It Rich (CBS) | V4: Movie [Matinee Theater]: Tragedy at Midnight | X4: [4:15] Search For Tomorrow (CBS) | Y4: Love of Life (CBS); [4:45] TBA | Z4: TBA | AA4: TBA | AB4: The Name's the Same (ABC) | AC4: The CBS Evening News --Douglas Edwards (CBS); [6:45] Time for Beany | AD4: Two for the Money (NBC) | AE4: The Dinah Shore Show (NBC); [7:45] Camel News Caravan (NBC) | AF4: Texaco Star Theater (NBC) | AH4: Fireside Theater (NBC) | AI4: Armstrong Circle Theater (NBC) | AJ4: The Alan Young Show (CBS) | AK4: Scott Music Hall (NBC) | AL4: My Little Margie (CBS) | AM4: Movie [Nite Owl Theater]: Melody and Moonlight | AX4: =A4 -> 19414
A5: =A4+7 -> 19421 | N5: Freedom Rings (CBS) | O5: TBA | P5: The Big Payoff (NBC) | Q5: Welcome Travelers (NBC) | R5: The Kate Smith Hour (NBC) | T5: Meet Betty Furness (CBS); [2:15] Arthur Godfrey Time (CBS) | U5: Strike It Rich (CBS) | V5: Movie [Matinee Theater]: London Blackout Murders | X5: [4:15] Search For Tomorrow (CBS) | Y5: Love of Life (CBS); [4:45] TBA | Z5: Howdy Doody (NBC) | AA5: TBA | AB5: The Name's the Same (ABC) | AC5: The CBS Evening News --Douglas Edwards (CBS); [6:45] Time for Beany | AD5: Two for the Money (NBC) | AE5: The Dinah Shore Show (NBC); [7:45] Camel News Caravan (NBC) | AF5: Texaco Star Theater (NBC) | AH5: Fireside Theater (NBC) | AI5: Armstrong Circle Theater (NBC) | AJ5: The Ken Murray Show (CBS) | AK5: American Forum of the Air (NBC) | AL5: My Little Margie (CBS) | AM5: Movie [Nite Owl Theater]: Tunisian Victory | AX5: =A5 -> 19421
A6: =A5+7 -> 19428 | H6: United Nations General Assembly (NBC) | N6: Freedom Rings (CBS) | O6: Local Film | P6: The Big Payoff (NBC) | Q6: Welcome Travelers (NBC) | R6: The Kate Smith Hour (NBC) | T6: Meet Betty Furness (CBS); [2:15] Arthur Godfrey Time (CBS) | U6: Strike It Rich (CBS) | V6: Movie [Matinee Theater]: Frisco Waterfront | X6: [4:15] Search For Tomorrow (CBS) | Y6: Love of Life (CBS); [4:45] TBA | Z6: Howdy Doody (NBC) | AA6: Children's Program | AB6: The Name's the Same (ABC) | AC6: The CBS Evening News --Douglas Edwards (CBS); [6:45] Time for Beany | AD6: Two for the Money (NBC) | AE6: The Dinah Shore Show (NBC); [7:45] Camel News Caravan (NBC) | AF6: Buick Circus Hour | AH6: Fireside Theater (NBC) | AI6: Armstrong Circle Theater (NBC) | AJ6: The Alan Young Show (CBS) | AK6: Scott Music Hall (NBC) | AL6: My Little Margie (CBS) | AM6: Movie [Nite Owl Theater]: Fangs of the Wild | AX6: =A6 -> 19428
A7: =A6+7 -> 19435 | H7: United Nations General Assembly (NBC) | N7: Freedom Rings (CBS) | O7: Local Film | P7: The Big Payoff (NBC) | Q7: Welcome Travelers (NBC) | R7: The Kate Smith Hour (NBC) | T7: Meet Betty Furness (CBS); [2:15] Arthur Godfrey Time (CBS) | U7: Strike It Rich (CBS) | V7: Movie [Matinee Theater]: Melody Maker | X7: [4:15] Search For Tomorrow (CBS) | Y7: Love of Life (CBS); [4:45] TBA | Z7: Howdy Doody (NBC) | AA7: Children's Program | AB7: The Name's the Same (ABC) | AC7: The CBS Evening News --Douglas Edwards (CBS); [6:45] Time for Beany | AD7: Two for the Money (NBC) | AE7: The Dinah Shore Show (NBC); [7:45] Camel News Caravan (NBC) | AF7: Texaco Star Theater (NBC) | AH7: Fireside Theater (NBC) | AI7: Armstrong Circle Theater (NBC) | AJ7: The Ken Murray Show (CBS) | AK7: American Forum of the Air (NBC) | AL7: My Little Margie (CBS) | AM7: Movie [Nite Owl Theater]: Trapped Freddie | AX7: =A7 -> 19435
A8: =A7+7 -> 19442 | H8: United Nations General Assembly (NBC) | N8: Freedom Rings (CBS) | O8: Local Film | P8: The Big Payoff (NBC) | Q8: Welcome Travelers (NBC) | R8: The Kate Smith Hour (NBC) | T8: Meet Betty Furness (CBS); [2:15] Arthur Godfrey Time (CBS) | U8: Strike It Rich (CBS) | V8: Movie [Matinee Theater]: Vampire's Ghost | X8: [4:15] Search For Tomorrow (CBS) | Y8: Love of Life (CBS); [4:45] TBA | Z8: Howdy Doody (NBC) | AA8: Children's Program | AB8: The Name's the Same (ABC) | AC8: The CBS Evening News --Douglas Edwards (CBS); [6:45] Time for Beany | AD8: Two for the Money (NBC) | AE8: The Dinah Shore Show (NBC); [7:45] Camel News Caravan (NBC) | AF8: Texaco Star Theater (NBC) | AH8: Fireside Theater (NBC) | AI8: Armstrong Circle Theater (NBC) | AJ8: The Alan Young Show (CBS) | AK8: Scott Music Hall (NBC) | AL8: My Little Margie (CBS) | AM8: Movie [Nite Owl Theater]: The Girl Who Dared | AX8: =A8 -> 19442
A9: =A8+7 -> 19449 | N9: Freedom Rings (CBS) | O9: Local Film | P9: The Big Payoff (NBC) | Q9: Welcome Travelers (NBC) | R9: The Kate Smith Hour (NBC) | T9: Meet Betty Furness (CBS); [2:15] Arthur Godfrey Time (CBS) | U9: Strike It Rich (CBS) | V9: Movie [Matinee Theater]: It Could Happen to You | X9: [4:15] Search For Tomorrow (CBS) | Y9: Love of Life (CBS); [4:45] TBA | Z9: Howdy Doody (NBC) | AA9: TBA | AB9: The Name's the Same (ABC) | AC9: The CBS Evening News --Douglas Edwards (CBS); [6:45] Time for Beany | AD9: Two for the Money (NBC) | AE9: The Dinah Shore Show (NBC); [7:45] Camel News Caravan (NBC) | AF9: Texaco Star Theater (NBC) | AH9: Fireside Theater (NBC) | AI9: Armstrong Circle Theater (NBC) | AJ9: The Ken Murray Show (CBS) | AK9: American Forum of the Air (NBC) | AL9: My Little Margie (CBS) | AM9: Movie [Nite Owl Theater]: Frisco Waterfront | AX9: =A9 -> 19449
A10: =A9+7 -> 19456 | N10: Freedom Rings (CBS) | O10: Local Film | P10: The Big Payoff (NBC) | Q10: Welcome Travelers (NBC) | R10: The Kate Smith Hour (NBC) | T10: Meet Betty Furness (CBS); [2:15] Arthur Godfrey Time (CBS) | U10: Strike It Rich (CBS) | V10: Movie [Matinee Theater]: What Price Crime | X10: [4:15] Search For Tomorrow (CBS) | Y10: Love of Life (CBS); [4:45] TBA | Z10: Howdy Doody (NBC) | AA10: TBA | AB10: The Name's the Same (ABC) | AC10: The CBS Evening News --Douglas Edwards (CBS); [6:45] Time for Beany | AD10: Two for the Money (NBC) | AE10: The Dinah Shore Show (NBC); [7:45] Camel News Caravan (NBC) | AF10: Buick Circus Hour | AH10: Fireside Theater (NBC) | AI10: Armstrong Circle Theater (NBC) | AJ10: The Alan Young Show (CBS) | AK10: Scott Music Hall (NBC) | AL10: My Little Margie (CBS) | AM10: Movie [Nite Owl Theater]: Little Men | AX10: =A10 -> 19456
A11: =A10+7 -> 19463 | N11: Freedom Rings (CBS) | O11: Local Film | P11: The Big Payoff (NBC) | Q11: Welcome Travelers (NBC) | R11: The Kate Smith Hour (NBC) | T11: Meet Betty Furness (CBS); [2:15] Arthur Godfrey Time (CBS) | U11: Strike It Rich (CBS) | V11: Movie [Matinee Theater]: I Cover Chinatown | X11: [4:15] Search For Tomorrow (CBS) | Y11: Love of Life (CBS); [4:45] TBA | Z11: Howdy Doody (NBC) | AA11: TBA; [5:45] Vacationland America (Sightseeing with the Swayzes) | AB11: The Name's the Same (ABC) | AC11: The CBS Evening News --Douglas Edwards (CBS); [6:45] Time for Beany | AD11: Two for the Money (NBC) | AE11: The Dinah Shore Show (NBC); [7:45] Camel News Caravan (NBC) | AF11: Texaco Star Theater (NBC) | AH11: Fireside Theater (NBC) | AI11: Armstrong Circle Theater (NBC) | AJ11: The Ken Murray Show (CBS) | AK11: American Forum of the Air (NBC) | AL11: My Little Margie (CBS) | AM11: Movie [Nite Owl Theater]: Red Lights Ahead | AX11: =A11 -> 19463
A12: =A11+7 -> 19470 | N12: Freedom Rings (CBS) | O12: Local Film | P12: The Big Payoff (NBC) | Q12: Welcome Travelers (NBC) | R12: The Kate Smith Hour (NBC) | T12: Meet Betty Furness (CBS); [2:15] Arthur Godfrey Time (CBS) | U12: Strike It Rich (CBS) | V12: TBA | X12: [4:15] Search For Tomorrow (CBS) | Y12: Love of Life (CBS); [4:45] TBA | Z12: Howdy Doody (NBC) | AA12: TBA; [5:45] Vacationland America (Sightseeing with the Swayzes) | AB12: The Name's the Same (ABC) | AC12: The CBS Evening News --Douglas Edwards (CBS); [6:45] Time for Beany | AD12: Two for the Money (NBC) | AE12: The Dinah Shore Show (NBC); [7:45] Camel News Caravan (NBC) | AF12: Texaco Star Theater (NBC) | AH12: Fireside Theater (NBC) | AI12: Armstrong Circle Theater (NBC) | AJ12: The Alan Young Show (CBS) | AK12: Scott Music Hall (NBC) | AL12: My Little Margie (CBS) | AM12: Movie [Nite Owl Theater]: Tunisian Victory | AX12: =A12 -> 19470
B13: OTHER CITIES SWITCH TO DAYLIGHT SAVINGS TIME; PORTLAND SHOWS AIR ONE HOUR EARLIER | J13: OTHER CITIES SWITCH TO DAYLIGHT SAVINGS TIME; PORTLAND SHOWS AIR ONE HOUR EARLIER | R13: OTHER CITIES SWITCH TO DAYLIGHT SAVINGS TIME; PORTLAND SHOWS AIR ONE HOUR EARLIER | Z13: OTHER CITIES SWITCH TO DAYLIGHT SAVINGS TIME; PORTLAND SHOWS AIR ONE HOUR EARLIER | AH13: OTHER CITIES SWITCH TO DAYLIGHT SAVINGS TIME; PORTLAND SHOWS AIR ONE HOUR EARLIER | AP13: OTHER CITIES SWITCH TO DAYLIGHT SAVINGS TIME; PORTLAND SHOWS AIR ONE HOUR EARLIER
A14: =A12+7 -> 19477 | K14: What's Cooking? | L14: Freedom Rings (CBS) | M14: Local Film; [10:45] News from KPTV | N14: The Big Payoff (NBC) | O14: Welcome Travelers (NBC) | P14: The Kate Smith Hour (NBC) | R14: Meet Betty Furness (CBS); [1:15] Arthur Godfrey Time (CBS) | S14: Strike It Rich (CBS) | T14: Movie [Matinee Theater]: TBA | V14: [3:15] Search For Tomorrow (CBS) | W14: Love of Life (CBS); [3:45] TBA | X14: Howdy Doody (NBC) | Y14: TBA; [4:45] Vacationland America (Sightseeing with the Swayzes) | Z14: The Name's the Same (ABC) | AA14: The CBS Evening News --Douglas Edwards (CBS); [5:45] Time for Beany | AB14: Two for the Money (NBC) | AC14: The Dinah Shore Show (NBC); [6:45] Camel News Caravan (NBC) | AD14: Texaco Star Theater (NBC) | AF14: Fireside Theater (NBC) | AG14: Armstrong Circle Theater (NBC) | AH14: The Life of Riley (NBC) | AI14: American Forum of the Air (NBC) | AJ14: My Little Margie (CBS) | AK14: Movie [Nite Owl Theater]: House of Secrets | AX14: =AX12+7 -> 19477
A15: =A14+7 -> 19484 | K15: What's Cooking? | L15: Freedom Rings (CBS) | M15: Local Film; [10:45] News from KPTV | N15: The Big Payoff (NBC) | O15: Welcome Travelers (NBC) | P15: The Kate Smith Hour (NBC) | R15: Meet Betty Furness (CBS); [1:15] Arthur Godfrey Time (CBS) | S15: Strike It Rich (CBS) | T15: Movie [Matinee Theater]: TBA | V15: [3:15] Search For Tomorrow (CBS) | W15: Love of Life (CBS); [3:45] TBA | X15: Howdy Doody (NBC) | Y15: TBA; [4:45] Vacationland America (Sightseeing with the Swayzes) | Z15: The Name's the Same (ABC) | AA15: The CBS Evening News --Douglas Edwards (CBS); [5:45] Time for Beany | AB15: Two for the Money (NBC) | AC15: The Dinah Shore Show (NBC); [6:45] Camel News Caravan (NBC) | AD15: Buick Circus Hour | AF15: Fireside Theater (NBC) | AG15: Armstrong Circle Theater (NBC) | AH15: The Life of Riley (NBC) | AI15: Scott Music Hall (NBC) | AJ15: My Little Margie (CBS) | AK15: Movie [Nite Owl Theater]: TBA | AX15: =AX13+7 -> 7
A16: =A15+7 -> 19491 | K16: What's Cooking? | L16: Freedom Rings (CBS) | M16: Local Film; [10:45] News from KPTV | N16: The Big Payoff (NBC) | O16: Welcome Travelers (NBC) | P16: The Kate Smith Hour (NBC) | R16: Meet Betty Furness (CBS); [1:15] Arthur Godfrey Time (CBS) | S16: Strike It Rich (CBS) | T16: Movie [Matinee Theater]: Drums of the Desert | V16: [3:15] Search For Tomorrow (CBS) | W16: Love of Life (CBS); [3:45] The Toymaker | X16: Howdy Doody (NBC) | Y16: TBA; [4:45] Vacationland America (Sightseeing with the Swayzes) | Z16: The Name's the Same (ABC) | AA16: The CBS Evening News --Douglas Edwards (CBS); [5:45] Time for Beany | AB16: Two for the Money (NBC) | AC16: The Dinah Shore Show (NBC); [6:45] Camel News Caravan (NBC) | AD16: Texaco Star Theater (NBC) | AF16: Fireside Theater (NBC) | AG16: Armstrong Circle Theater (NBC) | AH16: The Life of Riley (NBC) | AI16: American Forum of the Air (NBC) | AJ16: My Little Margie (CBS) | AK16: Movie [Nite Owl Theater]: The Mystery | AX16: =AX14+7 -> 19484
A17: =A16+7 -> 19498 | K17: What's Cooking? | L17: Freedom Rings (CBS) | M17: Local Film; [10:45] Northwest News Digest | N17: The Big Payoff (NBC) | O17: Welcome Travelers (NBC) | P17: The Kate Smith Hour (NBC) | R17: Meet Betty Furness (CBS); [1:15] Arthur Godfrey Time (CBS) | S17: Strike It Rich (CBS) | T17: Movie [Matinee Theater]: Paradise Isle | V17: [3:15] Search For Tomorrow (CBS) | W17: Love of Life (CBS); [3:45] The Toymaker | X17: Howdy Doody (NBC) | Y17: TBA; [4:45] Vacationland America (Sightseeing with the Swayzes) | Z17: The Name's the Same (ABC) | AA17: The CBS Evening News --Douglas Edwards (CBS); [5:45] Time for Beany | AB17: Two for the Money (NBC) | AC17: The Dinah Shore Show (NBC); [6:45] Camel News Caravan (NBC) | AD17: Texaco Star Theater (NBC) | AF17: Fireside Theater (NBC) | AG17: Armstrong Circle Theater (NBC) | AH17: The Life of Riley (NBC) | AI17: Scott Music Hall (NBC) | AJ17: My Little Margie (CBS) | AK17: Movie [Nite Owl Theater]: Shanghai Cobra | AX17: =AX15+7 -> 14
A18: =A17+7 -> 19505 | K18: What's Cooking? | L18: Freedom Rings (CBS) | M18: Local Film; [10:45] Northwest News Digest | N18: The Big Payoff (NBC) | O18: Welcome Travelers (NBC) | P18: The Kate Smith Hour (NBC) | R18: Meet Betty Furness (CBS); [1:15] Arthur Godfrey Time (CBS) | S18: Strike It Rich (CBS) | T18: Movie [Matinee Theater]: Hoosier Schoolmaster | V18: [3:15] Search For Tomorrow (CBS) | W18: Love of Life (CBS); [3:45] The Toymaker | X18: Howdy Doody (NBC) | Y18: Stranger Than Fiction; [4:45] Vacationland America (Sightseeing with the Swayzes) | Z18: The Name's the Same (ABC) | AA18: The CBS Evening News --Douglas Edwards (CBS); [5:45] Time for Beany | AB18: Two for the Money (NBC) | AC18: The Dinah Shore Show (NBC); [6:45] Camel News Caravan (NBC) | AD18: Texaco Star Theater (NBC) | AF18: Fireside Theater (NBC) | AG18: Armstrong Circle Theater (NBC) | AH18: The Life of Riley (NBC) | AI18: American Forum of the Air (NBC) | AJ18: My Little Margie (CBS) | AK18: Movie [Nite Owl Theater]: Skyway | AX18: =AX16+7 -> 19491
B19: KPTV BECOMES NBC AFFILIATE | J19: KPTV BECOMES NBC AFFILIATE | R19: KPTV BECOMES NBC AFFILIATE | Z19: KPTV BECOMES NBC AFFILIATE | AH19: KPTV BECOMES NBC AFFILIATE | AP19: KPTV BECOMES NBC AFFILIATE
A20: =A18+7 -> 19512 | K20: What's Cooking? | L20: Freedom Rings (CBS) | M20: Local Film; [10:45] Northwest News Digest | N20: The Big Payoff (NBC) | O20: Welcome Travelers (NBC) | P20: The Kate Smith Hour (NBC) | R20: Meet Betty Furness (CBS); [1:15] Arthur Godfrey Time (CBS) | S20: Freezer Fancies; [1:45] Hollywood Reel | T20: Coronation of Queen Elizabeth II (Special) | V20: [3:15] Search For Tomorrow (CBS) | W20: Love of Life (CBS); [3:45] The Toymaker | X20: Howdy Doody (NBC) | Y20: Stranger Than Fiction; [4:45] Vacationland America (Sightseeing with the Swayzes) | Z20: The Name's the Same (ABC) | AA20: The CBS Evening News --Douglas Edwards (CBS); [5:45] Time for Beany | AB20: Coronation of Queen Elizabeth II (Special) | AF20: Fireside Theater (NBC) | AG20: Armstrong Circle Theater (NBC) | AH20: The Life of Riley (NBC) | AI20: Scott Music Hall (NBC) | AJ20: My Little Margie (CBS) | AK20: TBA | AL20: Frosty Frolics | AM20: Movie [Nite Owl Theater]: Tomboy | AX20: =AX17+7 -> 21
A21: =A20+7 -> 19519 | K21: What's Cooking? | L21: Freedom Rings (CBS) | M21: Local Film; [10:45] Northwest News Digest | N21: The Big Payoff (NBC) | O21: Welcome Travelers (NBC) | P21: On Your Account (NBC) | Q21: Ladie's Choice (NBC) | R21: Meet Betty Furness (CBS); [1:15] Arthur Godfrey Time (CBS) | S21: Freezer Fancies; [1:45] Hollywood Reel | T21: Movie [Matinee Theater]: Lure of the Islands | V21: [3:15] Search For Tomorrow (CBS) | W21: Love of Life (CBS); [3:45] The Toymaker | X21: Howdy Doody (NBC) | Y21: Stranger Than Fiction; [4:45] TBA | Z21: The Name's the Same (ABC) | AA21: The CBS Evening News --Douglas Edwards (CBS); [5:45] Time for Beany | AB21: Two for the Money (NBC) | AC21: The Dinah Shore Show (NBC); [6:45] Camel News Caravan (NBC) | AD21: Texaco Star Theater (NBC) | AF21: Fireside Theater (NBC) | AG21: Armstrong Circle Theater (NBC) | AH21: The Life of Riley (NBC) | AI21: American Forum of the Air (NBC) | AJ21: My Little Margie (CBS) | AK21: TBA | AL21: Frosty Frolics | AM21: Movie [Nite Owl Theater]: Man with Two Lives | AX21: =AX18+7 -> 19498
A22: =A21+7 -> 19526 | K22: What's Cooking? | L22: Freedom Rings (CBS) | M22: Local Film; [10:45] Northwest News Digest | N22: The Big Payoff (NBC) | O22: Welcome Travelers (NBC) | P22: On Your Account (NBC) | Q22: Ladie's Choice (NBC) | R22: Meet Betty Furness (CBS); [1:15] Arthur Godfrey Time (CBS) | S22: Freezer Fancies; [1:45] Hollywood Reel | T22: Movie [Matinee Theater]: Flirting with Danger | V22: [3:15] Search For Tomorrow (CBS) | W22: Love of Life (CBS); [3:45] The Toymaker | X22: Howdy Doody (NBC) | Y22: Stranger Than Fiction; [4:45] TBA | Z22: The Name's the Same (ABC) | AA22: The CBS Evening News --Douglas Edwards (CBS); [5:45] Time for Beany | AB22: Two for the Money (NBC) | AC22: The Dinah Shore Show (NBC); [6:45] Camel News Caravan (NBC) | AD22: Texaco Star Theater (NBC) | AF22: Fireside Theater (NBC) | AG22: Armstrong Circle Theater (NBC) | AH22: The Life of Riley (NBC) | AI22: Scott Music Hall (NBC) | AJ22: My Little Margie (CBS) | AK22: TBA | AL22: Frosty Frolics | AM22: Movie [Nite Owl Theater]: Monte Carlo Nights | AX22: =AX19+7 -> 7
A23: =A22+7 -> 19533 | K23: What's Cooking? | L23: Freedom Rings (CBS) | M23: Local Film; [10:45] Northwest News Digest | N23: The Big Payoff (NBC) | O23: Welcome Travelers (NBC) | P23: On Your Account (NBC) | Q23: Ladie's Choice (NBC) | R23: Meet Betty Furness (CBS); [1:15] Arthur Godfrey Time (CBS) | S23: Freezer Fancies; [1:45] Hollywood Reel | T23: Movie [Matinee Theater]: Beggars in Ermine | V23: [3:15] Search For Tomorrow (CBS) | W23: Love of Life (CBS); [3:45] The Toymaker | X23: Howdy Doody (NBC) | Y23: Stranger Than Fiction; [4:45] TBA | Z23: The Name's the Same (ABC) | AA23: The CBS Evening News --Douglas Edwards (CBS); [5:45] Time for Beany | AB23: Two for the Money (NBC) | AC23: The Dinah Shore Show (NBC); [6:45] Camel News Caravan (NBC) | AD23: Texaco Star Theater (NBC) | AF23: Fireside Theater (NBC) | AG23: Candid Camera (NBC) | AH23: The Life of Riley (NBC) | AI23: American Forum of the Air (NBC) | AJ23: My Little Margie (CBS) | AK23: TBA | AL23: Frosty Frolics | AM23: Movie [Nite Owl Theater]: King of the Zombies | AX23: =AX20+7 -> 28
A24: =A23+7 -> 19540 | K24: What's Cooking? | L24: Freedom Rings (CBS) | M24: Local Film; [10:45] Northwest News Digest | N24: The Big Payoff (NBC) | O24: Welcome Travelers (NBC) | P24: On Your Account (NBC) | Q24: Ladie's Choice (NBC) | R24: Meet Betty Furness (CBS); [1:15] Arthur Godfrey Time (CBS) | S24: Freezer Fancies; [1:45] Hollywood Reel | T24: Movie [Matinee Theater]: Allotment Wives | V24: [3:15] Search For Tomorrow (CBS) | W24: Love of Life (CBS); [3:45] The Toymaker | X24: Howdy Doody (NBC) | Y24: Stranger Than Fiction; [4:45] TBA | Z24: The Name's the Same (ABC) | AA24: The CBS Evening News --Douglas Edwards (CBS); [5:45] Time for Beany | AB24: Two for the Money (NBC) | AC24: The Dinah Shore Show (NBC); [6:45] Camel News Caravan (NBC) | AD24: Buick Circus Hour | AF24: Fireside Theater (NBC) | AG24: Candid Camera (NBC) | AH24: The Life of Riley (NBC) | AI24: Scott Music Hall (NBC) | AJ24: My Little Margie (CBS) | AK24: Drama Playhouse | AL24: Frosty Frolics | AM24: Movie [Nite Owl Theater]: Boys Reformatory | AX24: =AX21+7 -> 19505
A25: =A24+7 -> 19547 | K25: What's Cooking? | L25: Freedom Rings (CBS) | M25: Local Film; [10:45] Northwest News Digest | N25: The Big Payoff (NBC) | O25: Welcome Travelers (NBC) | P25: On Your Account (NBC) | Q25: Ladie's Choice (NBC) | R25: Meet Betty Furness (CBS); [1:15] Arthur Godfrey Time (CBS) | S25: Freezer Fancies; [1:45] Hollywood Reel | T25: Movie [Matinee Theater]: The Ape | V25: [3:15] Search For Tomorrow (CBS) | W25: Love of Life (CBS); [3:45] The Toymaker | X25: Howdy Doody (NBC) | Y25: Stranger Than Fiction; [4:45] TBA | Z25: The Name's the Same (ABC) | AA25: The CBS Evening News --Douglas Edwards (CBS); [5:45] Time for Beany | AB25: Two for the Money (NBC) | AC25: The Dinah Shore Show (NBC); [6:45] Camel News Caravan (NBC) | AD25: Revlon Mirror Theater (NBC) | AE25: Break the Bank (NBC) | AF25: Nothing But the Best (NBC) | AG25: Candid Camera (NBC) | AH25: My Favorite Story | AI25: TBA | AJ25: My Little Margie (CBS) | AK25: Drama Playhouse | AL25: Frosty Frolics | AM25: Movie [Nite Owl Theater]: Divorce | AX25: =AX22+7 -> 14
A26: =A25+7 -> 19554 | K26: What's Cooking? | L26: Freedom Rings (CBS); [10:15] Major League Baseball: All-Star Game | S26: Freezer Fancies; [1:45] Hollywood Reel | T26: Movie [Matinee Theater]: Girl from Rio | V26: [3:15] Search For Tomorrow (CBS) | W26: Love of Life (CBS); [3:45] The Toymaker | X26: Howdy Doody (NBC) | Y26: Stranger Than Fiction; [4:45] TBA | Z26: The Name's the Same (ABC) | AA26: The CBS Evening News --Douglas Edwards (CBS); [5:45] Time for Beany | AB26: Two for the Money (NBC) | AC26: TBA; [6:45] Camel News Caravan (NBC) | AD26: Revlon Mirror Theater (NBC) | AE26: Break the Bank (NBC) | AF26: Nothing But the Best (NBC) | AG26: This is Your Life (NBC) | AH26: My Favorite Story | AI26: Scott Music Hall (NBC) | AJ26: My Little Margie (CBS) | AK26: Drama Playhouse | AL26: Frosty Frolics | AM26: Movie [Nite Owl Theater]: Manhattan Love Song | AX26: =AX23+7 -> 35
A27: =A26+7 -> 19561 | K27: What's Cooking? | L27: Freedom Rings (CBS) | M27: Local Film; [10:45] Northwest News Digest | N27: The Big Payoff (NBC) | O27: Welcome Travelers (NBC) | P27: On Your Account (NBC) | Q27: Ladie's Choice (NBC) | R27: TBA; [1:15] Arthur Godfrey Time (CBS) | S27: Freezer Fancies; [1:45] Hollywood Reel | T27: Movie [Matinee Theater]: Atlantic Flight | V27: [3:15] Search For Tomorrow (CBS) | W27: Love of Life (CBS); [3:45] The Toymaker | X27: Howdy Doody (NBC) | Y27: Stranger Than Fiction; [4:45] TBA | Z27: The Name's the Same (ABC) | AA27: Alka-Seltzer Newspaper of the Air; [5:45] Time for Beany | AB27: Two for the Money (NBC) | AC27: TBA; [6:45] Camel News Caravan (NBC) | AD27: Revlon Mirror Theater (NBC) | AE27: Break the Bank (NBC) | AF27: Nothing But the Best (NBC) | AG27: This is Your Life (NBC) | AH27: My Favorite Story | AI27: Scott Music Hall (NBC) | AJ27: My Little Margie (CBS) | AK27: Half-Hour Theater | AL27: Frosty Frolics | AM27: Movie [Nite Owl Theater]: Freckles Comes Home | AX27: =AX24+7 -> 19512
A28: =A27+7 -> 19568 | K28: What's Cooking? | L28: Freedom Rings (CBS) | M28: Local Film; [10:45] TBA | N28: The Big Payoff (NBC) | O28: Welcome Travelers (NBC) | P28: On Your Account (NBC) | Q28: Ladie's Choice (NBC) | R28: TBA; [1:15] Arthur Godfrey Time (CBS) | S28: Freezer Fancies; [1:45] Hollywood Reel | T28: Movie [Matinee Theater]: Midnight Limited | V28: [3:15] Search For Tomorrow (CBS) | W28: Love of Life (CBS); [3:45] The Toymaker | X28: Howdy Doody (NBC) | Y28: Stranger Than Fiction; [4:45] TBA | Z28: The Name's the Same (ABC) | AA28: Northwest News Digest; [5:40] Alka-Seltzer Newspaper of the Air; [5:45] Time for Beany | AB28: Two for the Money (NBC) | AC28: TBA; [6:45] Camel News Caravan (NBC) | AD28: Revlon Mirror Theater (NBC) | AE28: Break the Bank (NBC) | AF28: Nothing But the Best (NBC) | AG28: This is Your Life (NBC) | AH28: My Favorite Story | AI28: Scott Music Hall (NBC) | AJ28: My Little Margie (CBS) | AK28: Half-Hour Theater | AL28: Frosty Frolics | AM28: Movie [Nite Owl Theater]: Detective Kitty O'Day | AX28: =AX25+7 -> 21
A29: =A28+7 -> 19575 | K29: What's Cooking? | L29: Freedom Rings (CBS) | M29: Local Film; [10:45] TBA | N29: The Big Payoff (NBC) | O29: Welcome Travelers (NBC) | P29: On Your Account (NBC) | Q29: Ladie's Choice (NBC) | R29: TBA; [1:15] Arthur Godfrey Time (CBS) | S29: Freezer Fancies; [1:45] Hollywood Reel | T29: Movie [Matinee Theater]: Missing Lady | V29: [3:15] Search For Tomorrow (CBS) | W29: Love of Life (CBS); [3:45] The Toymaker | X29: Howdy Doody (NBC) | Y29: Stranger Than Fiction; [4:45] TBA | Z29: The Name's the Same (ABC) | AA29: Northwest News Digest; [5:40] Alka-Seltzer Newspaper of the Air; [5:45] Time for Beany | AB29: Two for the Money (NBC) | AC29: TBA; [6:45] Camel News Caravan (NBC) | AD29: Revlon Mirror Theater (NBC) | AE29: Break the Bank (NBC) | AF29: Nothing But the Best (NBC) | AG29: This is Your Life (NBC) | AH29: My Favorite Story | AI29: Zero Freeze Theater | AJ29: My Little Margie (CBS) | AK29: Half-Hour Theater | AL29: Frosty Frolics | AM29: Movie [Nite Owl Theater]: My Old Kentucky Home | AX29: =AX26+7 -> 42
A30: =A29+7 -> 19582 | K30: What's Cooking? | L30: Freedom Rings (CBS) | M30: Local Film; [10:45] TBA | N30: The Big Payoff (NBC) | O30: Welcome Travelers (NBC) | P30: On Your Account (NBC) | Q30: Ladie's Choice (NBC) | R30: TBA; [1:15] Arthur Godfrey Time (CBS) | S30: Freezer Fancies; [1:45] Hollywood Reel | T30: Movie [Matinee Theater]: Mystery Liner | V30: [3:15] Search For Tomorrow (CBS) | W30: Love of Life (CBS); [3:45] The Toymaker | X30: Howdy Doody (NBC) | Y30: Stranger Than Fiction; [4:45] TBA | Z30: The Name's the Same (ABC) | AA30: Northwest News Digest; [5:40] Alka-Seltzer Newspaper of the Air; [5:45] Time for Beany | AB30: Two for the Money (NBC) | AC30: It Happened in Sports (NBC); [6:45] Camel News Caravan (NBC) | AD30: Revlon Mirror Theater (NBC) | AE30: Break the Bank (NBC) | AF30: Nothing But the Best (NBC) | AG30: This is Your Life (NBC) | AH30: My Favorite Story | AI30: Zero Freeze Theater | AJ30: Pentagon Confidential (CBS) | AK30: Half-Hour Theater | AL30: Frosty Frolics | AM30: Movie [Nite Owl Theater]: Mr. Wong in Chinatown | AX30: =AX27+7 -> 19519
A31: =A30+7 -> 19589 | K31: What's Cooking? | L31: Freedom Rings (CBS) | M31: Local Film; [10:45] TBA | N31: The Big Payoff (NBC) | O31: Welcome Travelers (NBC) | P31: On Your Account (NBC) | Q31: United Nations General Assembly (NBC) | R31: TBA; [1:15] Arthur Godfrey Time (CBS) | S31: Freezer Fancies; [1:45] Hollywood Reel | T31: Movie [Matinee Theater]: Convict's Code | V31: [3:15] Search For Tomorrow (CBS) | W31: Love of Life (CBS); [3:45] The Toymaker | X31: Howdy Doody (NBC) | Y31: Stranger Than Fiction; [4:45] TBA | Z31: The Name's the Same (ABC) | AA31: Northwest News Digest; [5:40] Alka-Seltzer Newspaper of the Air; [5:45] Time for Beany | AB31: Two for the Money (NBC) | AC31: It Happened in Sports (NBC); [6:45] Camel News Caravan (NBC) | AD31: Revlon Mirror Theater (NBC) | AE31: Break the Bank (NBC) | AF31: Nothing But the Best (NBC) | AG31: This is Your Life (NBC) | AH31: My Favorite Story | AI31: Candy Theater | AJ31: Pentagon U.S.A. (CBS) | AK31: Half-Hour Theater | AL31: Frosty Frolics | AM31: Movie [Nite Owl Theater]: Top Sgt. Mulligan | AX31: =AX28+7 -> 28
A32: =A31+7 -> 19596 | K32: What's Cooking? | L32: Freedom Rings (CBS) | M32: Local Film; [10:45] TBA | N32: The Big Payoff (NBC) | O32: Welcome Travelers (NBC) | P32: On Your Account (NBC) | Q32: United Nations General Assembly (NBC) | R32: TBA; [1:15] Arthur Godfrey Time (CBS) | S32: Freezer Fancies; [1:45] Hollywood Reel | T32: Movie [Matinee Theater]: The Mystery Man | V32: [3:15] Search For Tomorrow (CBS) | W32: Love of Life (CBS); [3:45] The Toymaker | X32: Howdy Doody (NBC) | Y32: Stranger Than Fiction; [4:45] TBA | Z32: The Name's the Same (ABC) | AA32: TBA; [5:45] Northwest News Digest; [5:55] Alka-Seltzer Newspaper of the Air | AB32: Two for the Money (NBC) | AC32: It Happened in Sports (NBC); [6:45] Camel News Caravan (NBC) | AD32: Revlon Mirror Theater (NBC) | AE32: Break the Bank (NBC) | AF32: Nothing But the Best (NBC) | AG32: This is Your Life (NBC) | AH32: My Favorite Story | AI32: TBA | AJ32: TBA | AK32: Half-Hour Theater | AL32: Frosty Frolics | AM32: Movie [Nite Owl Theater]: Old Swimmin' Hole | AX32: =AX29+7 -> 49
A33: =A32+7 -> 19603 | K33: What's Cooking? | L33: Freedom Rings (CBS) | M33: Local Film; [10:45] TBA | N33: The Big Payoff (NBC) | O33: Welcome Travelers (NBC) | P33: On Your Account (NBC) | Q33: United Nations General Assembly (NBC) | R33: TBA; [1:15] Arthur Godfrey Time (CBS) | S33: Freezer Fancies; [1:45] Hollywood Reel | T33: Movie [Matinee Theater]: Searlet Clue | V33: [3:15] Search For Tomorrow (CBS) | W33: Love of Life (CBS); [3:45] The Toymaker | X33: Howdy Doody (NBC) | Y33: Stranger Than Fiction; [4:45] TBA | Z33: The Name's the Same (ABC) | AA33: TBA; [5:45] Northwest News Digest; [5:55] Alka-Seltzer Newspaper of the Air | AB33: TBA | AC33: It Happened in Sports (NBC); [6:45] Camel News Caravan (NBC) | AD33: Revlon Mirror Theater (NBC) | AE33: Break the Bank (NBC) | AF33: Fireside Theater (NBC) | AG33: This is Your Life (NBC) | AH33: My Favorite Story | AI33: TBA | AJ33: Judge for Yourself (NBC) | AK33: Half-Hour Theater | AL33: Frosty Frolics | AM33: Movie [Nite Owl Theater]: Silent Witness (1943) | AX33: =AX30+7 -> 19526
A34: =A33+7 -> 19610 | K34: What's Cooking? | L34: Freedom Rings (CBS) | M34: Local Film; [10:45] TBA | N34: The Big Payoff (NBC) | O34: Welcome Travelers (NBC) | P34: On Your Account (NBC) | Q34: United Nations General Assembly (NBC) | R34: TBA; [1:15] Arthur Godfrey Time (CBS) | S34: Freezer Fancies; [1:45] Hollywood Reel | T34: Movie [Matinee Theater]: Heroes in Blue | V34: [3:15] Search For Tomorrow (CBS) | W34: Love of Life (CBS); [3:45] The Toymaker | X34: Howdy Doody (NBC) | Y34: Stranger Than Fiction; [4:45] TBA | Z34: The Name's the Same (ABC) | AA34: TBA; [5:45] Northwest News Digest; [5:55] Alka-Seltzer Newspaper of the Air | AB34: TBA | AC34: It Happened in Sports (NBC); [6:45] Camel News Caravan (NBC) | AD34: Revlon Mirror Theater (NBC) | AE34: Break the Bank (NBC) | AF34: Fireside Theater (NBC) | AG34: This is Your Life (NBC) | AH34: My Favorite Story | AI34: Operation Doorstep | AJ34: Judge for Yourself (NBC) | AK34: Half-Hour Theater | AL34: Frosty Frolics | AM34: Movie [Nite Owl Theater]: Cheers for Miss Bishop (1941) | AX34: =AX31+7 -> 35
A35: =A34+7 -> 19617 | K35: What's Cooking? | L35: Freedom Rings (CBS) | M35: Local Film; [10:45] TBA | N35: The Big Payoff (NBC) | O35: Welcome Travelers (NBC) | P35: On Your Account (NBC) | Q35: United Nations General Assembly (NBC) | R35: TBA; [1:15] Arthur Godfrey Time (CBS) | S35: TBA [1:45] Hollywood Reel | T35: Movie [Matinee Theater]: Up in the Air (1940) | V35: [3:15] Search For Tomorrow (CBS) | W35: Love of Life (CBS); [3:45] The Toymaker | X35: Howdy Doody (NBC) | Y35: Stranger Than Fiction; [4:45] TBA | Z35: The Name's the Same (ABC) | AA35: TBA; [5:45] Northwest News Digest; [5:55] Alka-Seltzer Newspaper of the Air | AB35: Western Football | AC35: Strange Adventure; [6:45] Camel News Caravan (NBC) | AD35: Revlon Mirror Theater (NBC) | AE35: Break the Bank (NBC) | AF35: Fireside Theater (NBC) | AG35: This is Your Life (NBC) | AH35: My Favorite Story | AI35: Candy Theater | AJ35: Judge for Yourself (NBC) | AK35: I Led Three Lives | AL35: Frosty Frolics | AM35: Movie [Nite Owl Theater]: Sarong Girl (1943) | AX35: =AX32+7 -> 56
A36: =A35+7 -> 19624 | K36: What's Cooking? | L36: Ding Dong School (NBC) | M36: Local Film; [10:45] TBA | N36: The Big Payoff (NBC) | O36: Welcome Travelers (NBC) | P36: On Your Account (NBC) | Q36: Movie [Matinee Theater]: Rip Roarin' Riley (1935) | T36: Hollywood Reel; [2:15] Arthur Godfrey Time (CBS) | U36: The Kate Smith Hour (NBC) | V36: [3:15] Search For Tomorrow (CBS) | W36: Love of Life (CBS); [3:45] The Toymaker | X36: Howdy Doody (NBC) | Y36: Stranger Than Fiction; [4:45] TBA | Z36: The Name's the Same (ABC) | AA36: TBA; [5:45] Northwest News Digest; [5:55] Alka-Seltzer Newspaper of the Air | AB36: Western Football: Highlights of Oregon State vs UCLA | AC36: Strange Adventure; [6:45] Camel News Caravan (NBC) | AD36: My Son Jeep (NBC) | AE36: Wonderful John Action (NBC) | AF36: Fireside Theater (NBC) | AG36: Armstrong Circle Theater (NBC) | AH36: My Favorite Story | AI36: Half Hour Theater | AJ36: Judge for Yourself (NBC) | AK36: I Led Three Lives | AL36: TBA | AM36: Movie [Nite Owl Theater]: The Reckless Way (1936) | AX36: =AX33+7 -> 19533
A37: =A36+7 -> 19631 | J37: [9:15] Movie [Morning Movie]: TBA | M37: What's Cooking? | N37: Hawkins Falls (NBC); [11:15] TBA | O37: TBA | P37: TBA | Q37: TBA | R37: Movie [Matinee Theater]: Sunbonnet Sue (1945) | U37: On Your Account (NBC) | V37: The Kate Smith Hour (NBC) | X37: Welcome Travelers (NBC) | Y37: The Toymaker | Z37: Howdy Doody (NBC) | AA37: TBA | AB37: Western Football: Highlights of Oregon vs Stanford | AC37: Strange Adventure; [6:45] Northwest News Digest; [6:50] Spors on View; [6:55] Alka-Seltzer Newspaper of the Air | AD37: Liberace | AE37: Armchair Adventure; [7:45] Camel News Caravan (NBC) | AF37: Texaco Star Theater (NBC) | AH37: Fireside Theater (NBC) | AI37: Armstrong Circle Theater (NBC) | AJ37: Judge for Yourself (NBC) | AK37: I Led Three Lives | AL37: Chuck Foster's Newscene; [11:05] News; [11:15] Movie: [Nite Owl Theater]: Rubber Racketeers (1942) | AX37: =A37 -> 19631
A40: 1960 | AX40: 1960
A41: 21920 | F41: OMSI Presents | G41: Eye Opener | H41: Uncle Charlie's Roundhouse | J41: Romper Room | K41: Movie [Early Show]: You Said a Mouthful (1932) | N41: The Better Half | O41: The Life of Riley | P41: Restless Gun (ABC) | Q41: Love That Bob! (ABC) | R41: About Faces (ABC) | S41: Martin Kane | T41: Day in Court (ABC) | U41: Gale Storm (ABC) | V41: Beat the Clock (ABC) | W41: Who Do You Trust? (ABC) | X41: American Bandstand (ABC) | Y41: High Time | Z41: Three Stooges | AA41: Rin Tin Tin (ABC) | AB41: Cartoons--Uncle Charlie; [6:15] News--John Salisbury; [6:25] Sports Roundup--Charlie LaFranchise | AC41: Big Camera--Bob Brown | AD41: Flight | AE41: Sugarfoot (ABC) | AG41: The Life and Legend of Wyatt Earp (ABC) | AH41: The Rifleman (ABC) | AI41: Philip Marlowe (ABC) | AJ41: Alcoa Presents (ABC) | AK41: Keep Talking (ABC) | AL41: News; [11:15] Movie [Academy Mystery Theater]: Mr. Denning Drives North (English, 1953) | AX41: =A41 -> 21920
A42: 21927 | F42: OMSI Presents | G42: Eye Opener | H42: Uncle Charlie's Roundhouse | J42: Romper Room | K42: Movie [Early Show]: Three Sons o' Guns (1941) | N42: The Better Half | O42: The Life of Riley | P42: Restless Gun (ABC) | Q42: Love That Bob! (ABC) | R42: About Faces (ABC) | S42: Martin Kane | T42: Day in Court (ABC) | U42: Gale Storm (ABC) | V42: Beat the Clock (ABC) | W42: Who Do You Trust? (ABC) | X42: American Bandstand (ABC) | Y42: High Time | Z42: Three Stooges | AA42: Rin Tin Tin (ABC) | AB42: Cartoons--Uncle Charlie; [6:15] News--John Salisbury; [6:25] Sports Roundup--Charlie LaFranchise | AC42: Big Camera--Bob Brown | AD42: Flight | AE42: Bronco (ABC) | AG42: The Life and Legend of Wyatt Earp (ABC) | AH42: The Rifleman (ABC) | AI42: Philip Marlowe (ABC) | AJ42: Alcoa Presents (ABC) | AK42: Keep Talking (ABC) | AL42: News; [11:15] Movie [Academy Mystery Theater]: The Mystery of Edwin Drood (1935) | AX42: =A42 -> 21927
A43: 21934 | F43: OMSI Presents | G43: Eye Opener | H43: Uncle Charlie's Roundhouse | J43: Romper Room | K43: Movie [Early Show]: Private Detective (1939) | N43: The Better Half | O43: The Life of Riley | P43: Restless Gun (ABC) | Q43: Love That Bob! (ABC) | R43: About Faces (ABC) | S43: Martin Kane | T43: Day in Court (ABC) | U43: Gale Storm (ABC) | V43: Beat the Clock (ABC) | W43: Who Do You Trust? (ABC) | X43: American Bandstand (ABC) | Y43: High Time | Z43: Three Stooges | AA43: Rin Tin Tin (ABC) | AB43: Cartoons--Uncle Charlie; [6:15] News--John Salisbury | AC43: Big Camera--Bob Brown | AD43: Flight | AE43: Sugarfoot (ABC) | AG43: The Life and Legend of Wyatt Earp (ABC) | AH43: The Rifleman (ABC) | AI43: Philip Marlowe (ABC) | AJ43: Alcoa Presents (ABC) | AK43: Keep Talking (ABC) | AL43: News; [11:15] Movie [Academy Mystery Theater]: The Great Impersonation (1935) | AX43: =A43 -> 21934
A44: 21941 | F44: OMSI Presents | G44: Eye Opener | H44: Uncle Charlie's Roundhouse | J44: Romper Room | K44: Movie [Early Show]: Play Girl (1932) | N44: The Better Half | O44: The Life of Riley | P44: Restless Gun (ABC) | Q44: Love That Bob! (ABC) | R44: About Faces (ABC) | S44: Martin Kane | T44: Day in Court (ABC) | U44: Gale Storm (ABC) | V44: Beat the Clock (ABC) | W44: Who Do You Trust? (ABC) | X44: American Bandstand (ABC) | Y44: High Time | Z44: Three Stooges | AA44: Rin Tin Tin (ABC) | AB44: Cartoons--Uncle Charlie; [6:15] News--John Salisbury | AC44: Big Camera--Bob Brown | AD44: Flight | AE44: Bronco (ABC) | AG44: The Life and Legend of Wyatt Earp (ABC) | AH44: The Rifleman (ABC) | AI44: Philip Marlowe (ABC) | AJ44: Alcoa Presents (ABC) | AK44: Keep Talking (ABC) | AL44: News; [11:15] Movie [Academy Mystery Theater]: Cry Wolf (1947) | AX44: =A44 -> 21941
A45: 21948 | F45: OMSI Presents | G45: Eye Opener | H45: Uncle Charlie's Roundhouse | J45: Romper Room | K45: Movie [Early Show]: The Man in the White Suit (English; 1952) | N45: The Better Half | O45: The Life of Riley | P45: Restless Gun (ABC) | Q45: Love That Bob! (ABC) | R45: About Faces (ABC) | S45: Martin Kane | T45: Day in Court (ABC) | U45: Gale Storm (ABC) | V45: Beat the Clock (ABC) | W45: Who Do You Trust? (ABC) | X45: American Bandstand (ABC) | Y45: High Time | Z45: Three Stooges | AA45: Rin Tin Tin (ABC) | AB45: Cartoons--Uncle Charlie; [6:15] News--John Salisbury | AC45: Big Camera--Bob Brown | AD45: Flight | AE45: Sugarfoot (ABC) | AG45: The Life and Legend of Wyatt Earp (ABC) | AH45: The Rifleman (ABC) | AI45: Philip Marlowe (ABC) | AJ45: Alcoa Presents (ABC) | AK45: Keep Talking (ABC) | AL45: News; [11:15] Movie [Academy Mystery Theater]: The Spaniard's Curse (English; 1957) | AX45: =A45 -> 21948
A46: 21955 | F46: OMSI Presents | G46: Eye Opener | H46: Uncle Charlie's Roundhouse | J46: Romper Room | K46: Movie [Early Show]: The Horn Blows at Midnight (1945) | N46: The Better Half | O46: The Life of Riley | P46: Restless Gun (ABC) | Q46: Love That Bob! (ABC) | R46: About Faces (ABC) | S46: Martin Kane | T46: Day in Court (ABC) | U46: Gale Storm (ABC) | V46: Beat the Clock (ABC) | W46: Who Do You Trust? (ABC) | X46: American Bandstand (ABC) | Y46: High Time | Z46: Three Stooges | AA46: Rin Tin Tin (ABC) | AB46: Cartoons--Uncle Charlie; [6:15] News--John Salisbury | AC46: Big Camera--Bob Brown | AD46: Flight | AE46: Bronco (ABC) | AG46: The Life and Legend of Wyatt Earp (ABC) | AH46: The Rifleman (ABC) | AI46: Philip Marlowe (ABC) | AJ46: Alcoa Presents (ABC) | AK46: Keep Talking (ABC) | AL46: News; [11:15] Movie [Academy Mystery Theater]: The Black Forest (1954) | AX46: =A46 -> 21955
A47: 21962 | F47: OMSI Presents | G47: Eye Opener | H47: Uncle Charlie's Roundhouse | J47: Romper Room | K47: Movie [Early Show]: The Frozen Ghost (1945) | N47: The Better Half | O47: Way of Life | P47: Restless Gun (ABC) | Q47: Love That Bob! (ABC) | R47: About Faces (ABC) | S47: Martin Kane | T47: Day in Court (ABC) | U47: Gale Storm (ABC) | V47: Beat the Clock (ABC) | W47: Who Do You Trust? (ABC) | X47: American Bandstand (ABC) | Y47: High Time | Z47: Three Stooges | AA47: Rin Tin Tin (ABC) | AB47: Cartoons--Uncle Charlie; [6:15] News--John Salisbury | AC47: Big Camera--Bob Brown | AD47: Flight | AE47: Sugarfoot (ABC) | AG47: The Life and Legend of Wyatt Earp (ABC) | AH47: The Rifleman (ABC) | AI47: Philip Marlowe (ABC) | AJ47: Alcoa Presents (ABC) | AK47: Keep Talking (ABC) | AL47: News; [11:15] Movie [Academy Mystery Theater]: TBA | AX47: =A47 -> 21962
A48: 21969 | F48: OMSI Presents | G48: Eye Opener | H48: Uncle Charlie's Roundhouse | J48: Romper Room | K48: Movie [Early Show]: Out of the Fog (1941) | N48: The Better Half | O48: Way of Life | P48: Restless Gun (ABC) | Q48: Love That Bob! (ABC) | R48: About Faces (ABC) | S48: Martin Kane | T48: Day in Court (ABC) | U48: Gale Storm (ABC) | V48: Beat the Clock (ABC) | W48: Who Do You Trust? (ABC) | X48: American Bandstand (ABC) | Y48: High Time | Z48: Three Stooges | AA48: Rin Tin Tin (ABC) | AB48: Cartoons--Uncle Charlie; [6:15] News--John Salisbury | AC48: Big Camera--Bob Brown | AD48: Flight | AE48: Bronco (ABC) | AG48: The Life and Legend of Wyatt Earp (ABC) | AH48: The Rifleman (ABC) | AI48: Philip Marlowe (ABC) | AJ48: Alcoa Presents (ABC) | AK48: Keep Talking (ABC) | AL48: News; [11:15] Movie [Academy Mystery Theater]: TBA | AX48: =A48 -> 21969
A49: 21976 | F49: OMSI Presents | G49: Eye Opener | H49: Uncle Charlie's Roundhouse | J49: Romper Room | K49: Movie [Early Show]: Pillow of Death (1945) | N49: The Better Half | O49: Way of Life | P49: Restless Gun (ABC) | Q49: Love That Bob! (ABC) | R49: About Faces (ABC) | S49: Martin Kane | T49: Day in Court (ABC) | U49: Gale Storm (ABC) | V49: Beat the Clock (ABC) | W49: Who Do You Trust? (ABC) | X49: American Bandstand (ABC) | Y49: High Time | Z49: Three Stooges | AA49: Rin Tin Tin (ABC) | AB49: Cartoons--Uncle Charlie; [6:15] News--John Salisbury | AC49: Big Camera--Bob Brown | AD49: Flight | AE49: Sugarfoot (ABC) | AG49: The Life and Legend of Wyatt Earp (ABC) | AH49: The Rifleman (ABC) | AI49: Philip Marlowe (ABC) | AJ49: Alcoa Presents (ABC) | AK49: Keep Talking (ABC) | AL49: News; [11:15] Movie [Academy Mystery Theater]: Tiger in the Smoke (English; 1956) | AX49: =A49 -> 21976
A50: 21983 | F50: OMSI Presents | G50: Eye Opener | H50: Uncle Charlie's Roundhouse | J50: Romper Room | K50: Movie [Early Show]: Killer's Kiss (1955) | N50: The Better Half | O50: Way of Life | P50: Restless Gun (ABC) | Q50: Love That Bob! (ABC) | R50: About Faces (ABC) | S50: Martin Kane | T50: Day in Court (ABC) | U50: Gale Storm (ABC) | V50: Beat the Clock (ABC) | W50: Who Do You Trust? (ABC) | X50: American Bandstand (ABC) | Y50: High Time | Z50: Three Stooges | AA50: Rocky and His Friends (ABC) | AB50: News Central | AC50: Big Camera--Bob Brown | AD50: Flight | AE50: Bronco (ABC) | AG50: The Life and Legend of Wyatt Earp (ABC) | AH50: The Rifleman (ABC) | AI50: Philip Marlowe (ABC) | AJ50: Alcoa Presents (ABC) | AK50: Keep Talking (ABC) | AL50: News; [11:15] Movie [Academy Mystery Theater]: The Finger Points (1931) | AX50: =A50 -> 21983
A51: 21990 | F51: OMSI Presents | G51: Eye Opener | H51: Uncle Charlie's Roundhouse | J51: Romper Room | K51: Movie [Early Show]: The Flirting Widow (1930) | N51: The Better Half | O51: Way of Life | P51: Restless Gun (ABC) | Q51: Love That Bob! (ABC) | R51: About Faces (ABC) | S51: Martin Kane | T51: Day in Court (ABC) | U51: Gale Storm (ABC) | V51: Beat the Clock (ABC) | W51: Who Do You Trust? (ABC) | X51: American Bandstand (ABC) | Y51: High Time | Z51: Three Stooges | AA51: Rocky and His Friends (ABC) | AB51: News Central | AC51: Big Camera--Bob Brown | AD51: Flight | AE51: Sugarfoot (ABC) | AG51: The Life and Legend of Wyatt Earp (ABC) | AH51: The Rifleman (ABC) | AI51: Philip Marlowe (ABC) | AJ51: Alcoa Presents (ABC) | AK51: Keep Talking (ABC) | AL51: News; [11:15] Playboy's Penthouse | AX51: =A51 -> 21990
A52: 21997 | F52: OMSI Presents | G52: Eye Opener | H52: Uncle Charlie's Roundhouse | J52: Romper Room | K52: Movie [Early Show]: TBA | N52: The Better Half | O52: Way of Life | P52: Restless Gun (ABC) | Q52: Love That Bob! (ABC) | R52: About Faces (ABC) | S52: Martin Kane | T52: Day in Court (ABC) | U52: Gale Storm (ABC) | V52: Beat the Clock (ABC) | W52: Who Do You Trust? (ABC) | X52: American Bandstand (ABC) | Y52: High Time | Z52: Three Stooges | AA52: Rocky and His Friends (ABC) | AB52: News Central | AC52: Big Camera--Bob Brown | AD52: Flight | AE52: Bronco (ABC) | AG52: The Life and Legend of Wyatt Earp (ABC) | AH52: The Rifleman (ABC) | AI52: Philip Marlowe (ABC) | AJ52: Alcoa Presents (ABC) | AK52: Keep Talking (ABC) | AL52: News; [11:15] Playboy's Penthouse | AX52: =A52 -> 21997
A53: 22004 | F53: OMSI Presents | G53: Eye Opener | H53: Uncle Charlie's Roundhouse | J53: Romper Room | K53: Movie [Early Show]: The Magnet (English; 1950) | N53: The Better Half | O53: Way of Life | P53: Restless Gun (ABC) | Q53: Love That Bob! (ABC) | R53: About Faces (ABC) | S53: Martin Kane | T53: Day in Court (ABC) | U53: Gale Storm (ABC) | V53: Beat the Clock (ABC) | W53: Who Do You Trust? (ABC) | X53: American Bandstand (ABC) | Y53: High Time | Z53: Three Stooges | AA53: Rocky and His Friends (ABC) | AB53: News Central | AC53: Big Camera--Bob Brown | AD53: Flight | AE53: Sugarfoot (ABC) | AG53: The Life and Legend of Wyatt Earp (ABC) | AH53: The Rifleman (ABC) | AI53: Philip Marlowe (ABC) | AJ53: Korea--No Parallel (ABC) [Special] | AL53: News; [11:15] Movie [Mystery Theater]: The Invisible Ray (1935) | AX53: =A53 -> 22004
A54: 22011 | F54: OMSI Presents | G54: Eye Opener | H54: Uncle Charlie's Roundhouse | J54: Romper Room | K54: Movie [Early Show]: TBA | N54: The Better Half | O54: Way of Life | P54: Restless Gun (ABC) | Q54: Love That Bob! (ABC) | R54: About Faces (ABC) | S54: Martin Kane | T54: Day in Court (ABC) | U54: Gale Storm (ABC) | V54: Beat the Clock (ABC) | W54: Who Do You Trust? (ABC) | X54: American Bandstand (ABC) | Y54: High Time | Z54: Three Stooges | AA54: Rocky and His Friends (ABC) | AB54: News Central | AC54: Big Camera--Bob Brown | AD54: Flight | AE54: Bronco (ABC) | AG54: The Life and Legend of Wyatt Earp (ABC) | AH54: The Rifleman (ABC) | AI54: Colt .45 (ABC) | AJ54: Alcoa Presents (ABC) | AK54: Keep Talking (ABC) | AL54: News; [11:15] Playboy's Penthouse | AX54: =A54 -> 22011
A55: 22018 | F55: OMSI Presents | G55: Eye Opener | H55: Uncle Charlie's Roundhouse | J55: Romper Room | K55: Movie [Early Show]: TBA | N55: The Better Half | O55: Way of Life | P55: Restless Gun (ABC) | Q55: Love That Bob! (ABC) | R55: About Faces (ABC) | S55: Martin Kane | T55: Day in Court (ABC) | U55: Gale Storm (ABC) | V55: Beat the Clock (ABC) | W55: Who Do You Trust? (ABC) | X55: American Bandstand (ABC) | Y55: High Time | Z55: Three Stooges | AA55: Rocky and His Friends (ABC) | AB55: News Central | AC55: Big Camera--Bob Brown | AD55: Flight | AE55: Sugarfoot (ABC) | AG55: The Life and Legend of Wyatt Earp (ABC) | AH55: The Rifleman (ABC) | AI55: Colt .45 (ABC) | AJ55: Alcoa Presents (ABC) | AK55: Keep Talking (ABC) | AL55: News; [11:15] Playboy's Penthouse | AX55: =A55 -> 22018
A56: 22025 | F56: OMSI Presents | G56: Eye Opener | H56: Uncle Charlie's Roundhouse | J56: Romper Room | K56: Movie [Early Show]: The Stork Club (1951) | N56: The Better Half | O56: Way of Life | P56: Restless Gun (ABC) | Q56: Love That Bob! (ABC) | R56: About Faces (ABC) | S56: Martin Kane | T56: Day in Court (ABC) | U56: Gale Storm (ABC) | V56: Beat the Clock (ABC) | W56: Who Do You Trust? (ABC) | X56: American Bandstand (ABC) | Y56: High Time | Z56: Three Stooges | AA56: Rocky and His Friends (ABC) | AB56: News Central | AC56: Big Camera--Bob Brown | AD56: Flight | AE56: Bronco (ABC) | AG56: The Life and Legend of Wyatt Earp (ABC) | AH56: The Rifleman (ABC) | AI56: Colt .45 (ABC) | AJ56: Alcoa Presents (ABC) | AK56: Keep Talking (ABC) | AL56: News; [11:15] Playboy's Penthouse | AX56: =A56 -> 22025
B57: OTHER CITIES SWITCH TO DAYLIGHT SAVINGS TIME; PORTLAND SHOWS AIR ONE HOUR EARLIER | J57: OTHER CITIES SWITCH TO DAYLIGHT SAVINGS TIME; PORTLAND SHOWS AIR ONE HOUR EARLIER | R57: OTHER CITIES SWITCH TO DAYLIGHT SAVINGS TIME; PORTLAND SHOWS AIR ONE HOUR EARLIER | Z57: OTHER CITIES SWITCH TO DAYLIGHT SAVINGS TIME; PORTLAND SHOWS AIR ONE HOUR EARLIER | AH57: OTHER CITIES SWITCH TO DAYLIGHT SAVINGS TIME; PORTLAND SHOWS AIR ONE HOUR EARLIER | AP57: OTHER CITIES SWITCH TO DAYLIGHT SAVINGS TIME; PORTLAND SHOWS AIR ONE HOUR EARLIER
A58: 22032 | F58: OMSI Presents | G58: Eye Opener | H58: Uncle Charlie's Roundhouse | J58: Romper Room | K58: Burns and Allen | L58: Rosemary Clooney | M58: The Better Half | N58: Restless Gun (ABC) | O58: Love That Bob! (ABC) | P58: About Faces (ABC) | Q58: Martin Kane | R58: Day in Court (ABC) | S58: Gale Storm (ABC) | T58: Beat the Clock (ABC) | U58: Who Do You Trust? (ABC) | V58: American Bandstand (ABC) | W58: High Time | X58: Uncle Charlie's Den | Z58: Three Stooges | AA58: Rocky and His Friends (ABC) | AB58: News Central | AC58: Sugarfoot (ABC) | AE58: The Life and Legend of Wyatt Earp (ABC) | AF58: The Rifleman (ABC) | AG58: Colt .45 (ABC) | AH58: Alcoa Presents (ABC) | AI58: Keep Talking (ABC) | AJ58: Flight | AK58: Big Camera--Bob Brown | AL58: News--John Salisbury; [11:15] Playboy's Penthouse | AX58: =A58 -> 22032
A59: 22039 | F59: OMSI Presents | G59: Eye Opener | H59: Uncle Charlie's Roundhouse | J59: Romper Room | K59: Burns and Allen | L59: OFF THE AIR Nationwide Conelrad Civil Defense Test | M59: The Better Half | N59: Restless Gun (ABC) | O59: Love That Bob! (ABC) | P59: About Faces (ABC) | Q59: Martin Kane | R59: Day in Court (ABC) | S59: Gale Storm (ABC) | T59: Beat the Clock (ABC) | U59: Who Do You Trust? (ABC) | V59: American Bandstand (ABC) | W59: High Time | X59: Uncle Charlie's Den | Z59: Three Stooges | AA59: Rocky and His Friends (ABC) | AB59: News Central | AC59: Bronco (ABC) | AE59: The Life and Legend of Wyatt Earp (ABC) | AF59: The Rifleman (ABC) | AG59: Colt .45 (ABC) | AH59: Alcoa Presents (ABC) | AI59: Keep Talking (ABC) | AJ59: Flight | AK59: Big Camera--Bob Brown | AL59: News--John Salisbury; [11:15] Playboy's Penthouse | AX59: =A59 -> 22039
A60: 22046 | F60: OMSI Presents | G60: Eye Opener | H60: Uncle Charlie's Roundhouse | J60: Romper Room | K60: Burns and Allen | L60: Rosemary Clooney | M60: The Better Half | N60: Restless Gun (ABC) | O60: Love That Bob! (ABC) | P60: About Faces (ABC) | Q60: Martin Kane | R60: Day in Court (ABC) | S60: Gale Storm (ABC) | T60: Beat the Clock (ABC) | U60: Who Do You Trust? (ABC) | V60: American Bandstand (ABC) | W60: High Time | X60: Uncle Charlie's Den | Z60: Three Stooges | AA60: Rocky and His Friends (ABC) | AB60: News Central | AC60: Sugarfoot (ABC) | AE60: The Life and Legend of Wyatt Earp (ABC) | AF60: The Rifleman (ABC) | AG60: Colt .45 (ABC) | AH60: Alcoa Presents (ABC) | AI60: San Francisco Beat | AJ60: Flight | AK60: Big Camera--Bob Brown | AL60: News--John Salisbury; [11:15] Playboy's Penthouse | AX60: =A60 -> 22046
A61: 22053 | F61: OMSI Presents | G61: Eye Opener | H61: Uncle Charlie's Roundhouse | J61: Romper Room | K61: Burns and Allen | L61: Rosemary Clooney | M61: The Better Half | N61: Restless Gun (ABC) | O61: Love That Bob! (ABC) | P61: About Faces (ABC) | Q61: Martin Kane | R61: Day in Court (ABC) | S61: Gale Storm (ABC) | T61: Beat the Clock (ABC) | U61: Who Do You Trust? (ABC) | V61: American Bandstand (ABC) | W61: High Time | X61: Uncle Charlie's Den | Z61: Three Stooges | AA61: Rocky and His Friends (ABC) | AB61: News Central | AC61: Bronco (ABC) | AE61: The Life and Legend of Wyatt Earp (ABC) | AF61: The Rifleman (ABC) | AG61: Colt .45 (ABC) | AH61: Alcoa Presents (ABC) | AI61: San Francisco Beat | AJ61: Flight | AK61: Big Camera--Bob Brown | AL61: News--John Salisbury; [11:15] Playboy's Penthouse | AX61: =A61 -> 22053
A62: 22060 | F62: OMSI Presents | G62: Eye Opener | H62: Uncle Charlie's Roundhouse | J62: Romper Room | K62: Burns and Allen | L62: Rosemary Clooney | M62: The Better Half | N62: Restless Gun (ABC) | O62: Love That Bob! (ABC) | P62: About Faces (ABC) | Q62: Martin Kane | R62: Day in Court (ABC) | S62: Gale Storm (ABC) | T62: Beat the Clock (ABC) | U62: Who Do You Trust? (ABC) | V62: American Bandstand (ABC) | W62: High Time | X62: Uncle Charlie's Den | Z62: Three Stooges | AA62: Rocky and His Friends (ABC) | AB62: News Central | AC62: Sugarfoot (ABC) | AE62: The Life and Legend of Wyatt Earp (ABC) | AF62: The Rifleman (ABC) | AG62: Colt .45 (ABC) | AH62: Alcoa Presents (ABC) | AI62: San Francisco Beat | AJ62: Flight | AK62: Big Camera--Bob Brown | AL62: News--John Salisbury; [11:15] Playboy's Penthouse | AX62: =A62 -> 22060
A64: 22074 | F64: OMSI Presents | G64: Eye Opener | H64: Uncle Charlie's Roundhouse | J64: Romper Room | K64: Burns and Allen | L64: Rosemary Clooney | M64: The Better Half | N64: Restless Gun (ABC) | O64: Love That Bob! (ABC) | P64: About Faces (ABC) | Q64: Martin Kane | R64: Day in Court (ABC) | S64: Gale Storm (ABC) | T64: Beat the Clock (ABC) | U64: Who Do You Trust? (ABC) | V64: American Bandstand (ABC) | W64: High Time | X64: Uncle Charlie's Den | Z64: Three Stooges | AA64: Rocky and His Friends (ABC) | AB64: News Central | AC64: Sugarfoot (ABC) | AE64: The Life and Legend of Wyatt Earp (ABC) | AF64: The Rifleman (ABC) | AG64: Colt .45 (ABC) | AH64: Alcoa Presents (ABC) | AI64: San Francisco Beat | AJ64: Flight | AK64: Sheriff of Cochise | AL64: News--John Salisbury; [11:15] Movie [Movie 12]: Government Girl (1943) | AX64: =A64 -> 22074
A65: 22081 | F65: OMSI Presents | G65: Eye Opener | H65: Uncle Charlie's Roundhouse | J65: Romper Room | K65: Burns and Allen | L65: Rosemary Clooney | M65: The Better Half | N65: Restless Gun (ABC) | O65: Love That Bob! (ABC) | P65: About Faces (ABC) | Q65: Martin Kane | R65: Day in Court (ABC) | S65: Gale Storm (ABC) | T65: Beat the Clock (ABC) | U65: Who Do You Trust? (ABC) | V65: American Bandstand (ABC) | W65: High Time | X65: Uncle Charlie's Den | Z65: Three Stooges | AA65: Rocky and His Friends (ABC) | AB65: News Central | AC65: Bronco (ABC) | AE65: The Life and Legend of Wyatt Earp (ABC) | AF65: The Rifleman (ABC) | AG65: Colt .45 (ABC) | AH65: Alcoa Presents (ABC) | AI65: San Francisco Beat | AJ65: Flight | AK65: Sheriff of Cochise | AL65: News--John Salisbury; [11:15] Movie [Movie 12]: Never a Dull Moment (1950) | AX65: =A65 -> 22081
A66: 22088 | F66: OMSI Presents | G66: Eye Opener | H66: Uncle Charlie's Roundhouse | J66: Romper Room | K66: Burns and Allen | L66: Rosemary Clooney | M66: The Better Half | N66: Restless Gun (ABC) | O66: Love That Bob! (ABC) | P66: About Faces (ABC) | Q66: Martin Kane | R66: Day in Court (ABC) | S66: Gale Storm (ABC) | T66: Beat the Clock (ABC) | U66: Who Do You Trust? (ABC) | V66: American Bandstand (ABC) | W66: High Time | X66: Uncle Charlie's Den | Z66: Three Stooges | AA66: Rocky and His Friends (ABC) | AB66: News Central | AC66: Sugarfoot (ABC) | AE66: The Life and Legend of Wyatt Earp (ABC) | AF66: The Rifleman (ABC) | AG66: Colt .45 (ABC) | AH66: Alcoa Presents (ABC) | AI66: San Francisco Beat | AJ66: Flight | AK66: Sheriff of Cochise | AL66: News--John Salisbury; [11:15] Movie [Movie 12]: The Country Husband (1956) | AX66: =A66 -> 22088
A67: 22095 | F67: OMSI Presents | G67: Eye Opener | H67: Uncle Charlie's Roundhouse | J67: Romper Room | K67: It's a Great Life | L67: Rosemary Clooney | M67: The Better Half | N67: Restless Gun (ABC) | O67: Love That Bob! (ABC) | P67: About Faces (ABC) | Q67: Martin Kane | R67: Day in Court (ABC) | S67: Gale Storm (ABC) | T67: Beat the Clock (ABC) | U67: Who Do You Trust? (ABC) | V67: American Bandstand (ABC) | W67: High Time | X67: Uncle Charlie's Den | Z67: Three Stooges | AA67: Rocky and His Friends (ABC) | AB67: News Central | AC67: Bronco (ABC) | AE67: The Life and Legend of Wyatt Earp (ABC) | AF67: The Rifleman (ABC) | AG67: Colt .45 (ABC) | AH67: Alcoa Presents (ABC) | AI67: San Francisco Beat | AJ67: Flight | AK67: Sheriff of Cochise | AL67: News--John Salisbury; [11:15] Movie [Movie 12]: Higher and Higher (1943) | AX67: =A67 -> 22095
A68: 22102 | F68: OMSI Presents | G68: Eye Opener | H68: Uncle Charlie's Roundhouse | J68: Romper Room | K68: It's a Great Life | L68: Rosemary Clooney | M68: The Better Half | N68: Restless Gun (ABC) | O68: Love That Bob! (ABC) | P68: About Faces (ABC) | Q68: Martin Kane | R68: Day in Court (ABC) | S68: Gale Storm (ABC) | T68: Beat the Clock (ABC) | U68: Who Do You Trust? (ABC) | V68: American Bandstand (ABC) | W68: High Time | X68: Uncle Charlie's Den | Z68: Three Stooges | AA68: Rocky and His Friends (ABC) | AB68: News Central | AC68: Sugarfoot (ABC) | AE68: The Life and Legend of Wyatt Earp (ABC) | AF68: The Rifleman (ABC) | AG68: Colt .45 (ABC) | AH68: Alcoa Presents (ABC) | AI68: San Francisco Beat | AJ68: Flight | AK68: Sheriff of Cochise | AL68: News--John Salisbury; [11:15] Movie [Movie 12]: Weird Woman (1944) | AX68: =A68 -> 22102
A70: 22116 | F70: OMSI Presents | G70: Eye Opener | H70: Uncle Charlie's Roundhouse | J70: Romper Room | K70: It's a Great Life | L70: Rosemary Clooney | M70: The Better Half | N70: Restless Gun (ABC) | O70: Love That Bob! (ABC) | P70: About Faces (ABC) | Q70: Martin Kane | R70: Day in Court (ABC) | S70: Gale Storm (ABC) | T70: Beat the Clock (ABC) | U70: Who Do You Trust? (ABC) | V70: American Bandstand (ABC) | W70: High Time | X70: Uncle Charlie's Den | Z70: Three Stooges | AA70: Rocky and His Friends (ABC) | AB70: News Central | AC70: Sugarfoot (ABC) | AE70: The Life and Legend of Wyatt Earp (ABC) | AF70: The Rifleman (ABC) | AG70: Colt .45 (ABC) | AH70: Alcoa Presents (ABC) | AI70: San Francisco Beat | AJ70: Flight | AK70: Sheriff of Cochise | AL70: News--John Salisbury; [11:15] Movie [Movie 12]: The Mayor of Hell (1933) | AX70: =A70 -> 22116
A71: 22123 | F71: OMSI Presents | G71: Eye Opener | H71: Uncle Charlie's Roundhouse | J71: Romper Room | K71: It's a Great Life | L71: Rosemary Clooney | M71: The Better Half | N71: Restless Gun (ABC) | O71: Love That Bob! (ABC) | P71: About Faces (ABC) | Q71: Martin Kane | R71: Day in Court (ABC) | S71: Gale Storm (ABC) | T71: Beat the Clock (ABC) | U71: Who Do You Trust? (ABC) | V71: American Bandstand (ABC) | W71: Republican Convention (ABC) | AE71: TBA | AF71: TBA | AG71: Intolerable Portrait [Special] | AH71: Wings to Britain [Special] | AI71: San Francisco Beat | AJ71: Flight | AK71: Sheriff of Cochise | AL71: News--John Salisbury; [11:15] Movie [Movie 12]: The Mikado (English; 1939) | AX71: =A71 -> 22123
A72: 22130 | F72: OMSI Presents | G72: Eye Opener | H72: Uncle Charlie's Roundhouse | J72: Romper Room | K72: It's a Great Life | L72: Rosemary Clooney | M72: The Better Half | N72: Restless Gun (ABC) | O72: Love That Bob! (ABC) | P72: About Faces (ABC) | Q72: Martin Kane | R72: Day in Court (ABC) | S72: Gale Storm (ABC) | T72: Beat the Clock (ABC) | U72: Who Do You Trust? (ABC) | V72: American Bandstand (ABC) | W72: High Time | X72: Uncle Charlie's Den | Z72: Three Stooges | AA72: Rocky and His Friends (ABC) | AB72: News Central | AC72: Sugarfoot (ABC) | AE72: The Life and Legend of Wyatt Earp (ABC) | AF72: The Rifleman (ABC) | AG72: Colt .45 (ABC) | AH72: Alcoa Presents (ABC) | AI72: San Francisco Beat | AJ72: Flight | AK72: Sheriff of Cochise | AL72: News--John Salisbury; [11:15] Movie [Movie 12]: To the Victor (1948) | AX72: =A72 -> 22130
A73: 22137 | F73: OMSI Presents | G73: Eye Opener | H73: Uncle Charlie's Roundhouse | J73: Romper Room | K73: It's a Great Life | L73: Rosemary Clooney | M73: The Better Half | N73: Restless Gun (ABC) | O73: Love That Bob! (ABC) | P73: About Faces (ABC) | Q73: Martin Kane | R73: Day in Court (ABC) | S73: Gale Storm (ABC) | T73: Beat the Clock (ABC) | U73: Who Do You Trust? (ABC) | V73: American Bandstand (ABC) | W73: High Time | X73: Uncle Charlie's Den | Z73: Three Stooges | AA73: Rocky and His Friends (ABC) | AB73: News Central | AC73: Bronco (ABC) | AE73: The Life and Legend of Wyatt Earp (ABC) | AF73: The Rifleman (ABC) | AG73: Colt .45 (ABC) | AH73: Alcoa Presents (ABC) | AI73: San Francisco Beat | AJ73: Flight | AK73: Sheriff of Cochise | AL73: News--John Salisbury; [11:15] Movie [Movie 12]: Before I Hang (1940) | AX73: =A73 -> 22137
A74: 22144 | F74: OMSI Presents | G74: Eye Opener | H74: Uncle Charlie's Roundhouse | J74: Romper Room | K74: It's a Great Life | L74: Abbott and Costello | M74: The Better Half | N74: Restless Gun (ABC) | O74: Love That Bob! (ABC) | P74: About Faces (ABC) | Q74: Martin Kane | R74: Day in Court (ABC) | S74: Gale Storm (ABC) | T74: Beat the Clock (ABC) | U74: Who Do You Trust? (ABC) | V74: American Bandstand (ABC) | W74: High Time | X74: Uncle Charlie's Den | Z74: Three Stooges | AA74: Rocky and His Friends (ABC) | AB74: News Central | AC74: Sugarfoot (ABC) | AE74: The Life and Legend of Wyatt Earp (ABC) | AF74: The Rifleman (ABC) | AG74: Colt .45 (ABC) | AH74: Alcoa Presents (ABC) | AI74: San Francisco Beat | AJ74: Flight | AK74: Sheriff of Cochise | AL74: News--John Salisbury; [11:15] Movie [Movie 12]: Each Dawn I Die (1939) | AX74: =A74 -> 22144
A75: 22151 | F75: OMSI Presents | G75: Eye Opener | H75: Uncle Charlie's Roundhouse | J75: Romper Room | K75: It's a Great Life | L75: Abbott and Costello | M75: The Better Half | N75: Restless Gun (ABC) | O75: Love That Bob! (ABC) | P75: About Faces (ABC) | Q75: Martin Kane | R75: Day in Court (ABC) | S75: Gale Storm (ABC) | T75: Beat the Clock (ABC) | U75: Who Do You Trust? (ABC) | V75: American Bandstand (ABC) | W75: High Time | X75: Uncle Charlie's Den | Z75: Three Stooges | AA75: Rocky and His Friends (ABC) | AB75: News Central | AC75: Bronco (ABC) | AE75: The Life and Legend of Wyatt Earp (ABC) | AF75: The Rifleman (ABC) | AG75: Colt .45 (ABC) | AH75: Alcoa Presents (ABC) | AI75: San Francisco Beat | AJ75: Flight | AK75: Sheriff of Cochise | AL75: News--John Salisbury; [11:15] Movie [Movie 12]: Behave Yourself (1951) | AX75: =A75 -> 22151
A76: 22158 | F76: OMSI Presents | G76: Eye Opener | H76: Uncle Charlie's Roundhouse | J76: Romper Room | K76: It's a Great Life | L76: Abbott and Costello | M76: The Better Half | N76: Restless Gun (ABC) | O76: Love That Bob! (ABC) | P76: About Faces (ABC) | Q76: Martin Kane | R76: Day in Court (ABC) | S76: Gale Storm (ABC) | T76: Beat the Clock (ABC) | U76: Who Do You Trust? (ABC) | V76: American Bandstand (ABC) | W76: High Time | X76: Uncle Charlie's Den | Z76: Three Stooges | AA76: Rocky and His Friends (ABC) | AB76: News Central | AC76: Sugarfoot (ABC) | AE76: The Life and Legend of Wyatt Earp (ABC) | AF76: The Rifleman (ABC) | AG76: Colt .45 (ABC) | AH76: Alcoa Presents (ABC) | AI76: Know Your Candidates | AJ76: Flight | AK76: Sheriff of Cochise | AL76: News--John Salisbury; [11:15] Movie [Movie 12]: Werewolf of London (1935) | AX76: =A76 -> 22158
A77: 22165 | F77: OMSI Presents | G77: Eye Opener | H77: Uncle Charlie's Roundhouse | J77: Romper Room | K77: It's a Great Life | L77: Abbott and Costello | M77: The Better Half | N77: Restless Gun (ABC) | O77: Queen for a Day (ABC) | P77: About Faces (ABC) | Q77: Martin Kane | R77: Day in Court (ABC) | S77: Gale Storm (ABC) | T77: Beat the Clock (ABC) | U77: Who Do You Trust? (ABC) | V77: American Bandstand (ABC) | W77: High Time | X77: Uncle Charlie's Den | Z77: Three Stooges | AA77: Rocky and His Friends (ABC) | AB77: News Central | AC77: Bronco (ABC) | AE77: The Life and Legend of Wyatt Earp (ABC) | AF77: The Rifleman (ABC) | AG77: Colt .45 (ABC) | AH77: Alcoa Presents (ABC) | AI77: Know Your Candidates | AJ77: Flight | AK77: Sheriff of Cochise | AL77: News--John Salisbury; [11:15] Movie [Movie 12]: Son of Frankenstein (1939) | AX77: =A77 -> 22165
A78: 22172 | F78: OMSI Presents | G78: Eye Opener | H78: Uncle Charlie's Roundhouse | J78: Romper Room | K78: It's a Great Life | L78: Abbott and Costello | M78: The Better Half | N78: Restless Gun (ABC) | O78: Queen for a Day (ABC) | P78: About Faces (ABC) | Q78: Martin Kane | R78: Day in Court (ABC) | S78: Gale Storm (ABC) | T78: Beat the Clock (ABC) | U78: Who Do You Trust? (ABC) | V78: American Bandstand (ABC) | W78: High Time | X78: Uncle Charlie's Den | Z78: Three Stooges | AA78: Rin Tin Tin (ABC) | AB78: News Central | AC78: Bronco (ABC) | AE78: The Life and Legend of Wyatt Earp (ABC) | AF78: The Rifleman (ABC) | AG78: Colt .45 (ABC) | AH78: Alcoa Presents (ABC) | AI78: San Francisco Beat | AJ78: Flight | AK78: Sheriff of Cochise | AL78: News--John Salisbury; [11:15] Movie [Movie 12]: It's a Great Feeling (1949) | AX78: =A78 -> 22172
A79: 22179 | F79: OMSI Presents | G79: Eye Opener | H79: Uncle Charlie's Roundhouse | J79: Romper Room | K79: It's a Great Life | L79: Abbott and Costello | M79: The Better Half | N79: Restless Gun (ABC) | O79: Queen for a Day (ABC) | P79: About Faces (ABC) | Q79: Martin Kane | R79: Day in Court (ABC) | S79: Gale Storm (ABC) | T79: Beat the Clock (ABC) | U79: Who Do You Trust? (ABC) | V79: American Bandstand (ABC) | W79: High Time | X79: Uncle Charlie's Den | Z79: Three Stooges | AA79: Rin Tin Tin (ABC) | AB79: News Central | AC79: Sugarfoot (ABC) | AE79: Politcal Talk (ABC) | AF79: The Rifleman (ABC) | AG79: Colt .45 (ABC) | AH79: Alcoa Presents (ABC) | AI79: San Francisco Beat | AJ79: Flight | AK79: Sheriff of Cochise | AL79: News--John Salisbury; [11:15] Movie [Movie 12]: Black Friday (1940) | AX79: =A79 -> 22179
B80: OTHER CITIES SWITCH TO STANDARD TIME; PORTLAND SHOWS AIR ONE HOUR LATER | J80: OTHER CITIES SWITCH TO STANDARD TIME; PORTLAND SHOWS AIR ONE HOUR LATER | R80: OTHER CITIES SWITCH TO STANDARD TIME; PORTLAND SHOWS AIR ONE HOUR LATER | Z80: OTHER CITIES SWITCH TO STANDARD TIME; PORTLAND SHOWS AIR ONE HOUR LATER | AH80: OTHER CITIES SWITCH TO STANDARD TIME; PORTLAND SHOWS AIR ONE HOUR LATER | AP80: OTHER CITIES SWITCH TO STANDARD TIME; PORTLAND SHOWS AIR ONE HOUR LATER
A81: 22186 | F81: OMSI Presents | G81: Eye Opener | H81: Uncle Charlie's Roundhouse | J81: Romper Room | K81: The Better Half | L81: It's a Great Life | M81: San Francisco Beat | N81: Court U.S.A. | O81: The Life of Riley | P81: Restless Gun (ABC) | Q81: Queen for a Day (ABC) | R81: About Faces (ABC) | S81: Court U.S.A. | T81: Day in Court (ABC) | U81: Gale Storm (ABC) | V81: Beat the Clock (ABC) | W81: Who Do You Trust? (ABC) | X81: American Bandstand (ABC) | Y81: Uncle Charlie's Den | Z81: Three Stooges | AA81: Rin Tin Tin (ABC) | AB81: Topper | AC81: News Central | AD81: Expedition! (ABC) | AE81: TBA | AF81: The Rifleman (ABC) | AG81: The Life and Legend of Wyatt Earp (ABC) | AH81: Close-Up (ABC) [Special] | AJ81: Alcoa Presents (ABC) | AK81: Know Your Candidate | AL81: News; [11:15] Movie [Movie 12]: Lydia (1941) | AX81: =A81 -> 22186
A82: 22193 | F82: OMSI Presents | G82: Eye Opener | H82: Uncle Charlie's Roundhouse | J82: Romper Room | K82: The Better Half | L82: It's a Great Life | M82: San Francisco Beat | N82: Court U.S.A. | O82: The Life of Riley | P82: The Texan (ABC) | Q82: Queen for a Day (ABC) | R82: About Faces (ABC) | S82: Court U.S.A. | T82: Day in Court (ABC) | U82: Gale Storm (ABC) | V82: Beat the Clock (ABC) | W82: Who Do You Trust? (ABC) | X82: American Bandstand (ABC) | Y82: Uncle Charlie's Den | Z82: Three Stooges | AA82: Rin Tin Tin (ABC) | AB82: Topper | AC82: News Central | AD82: Expedition!--Local | AE82: World Series Special (ABC) [Special] | AF82: The Rifleman (ABC) | AG82: The Life and Legend of Wyatt Earp (ABC) | AH82: Stagecoach West (ABC) | AJ82: Alcoa Presents (ABC) | AK82: Know Your Candidate | AL82: News; [11:15] Movie [Movie 12]: Private Hell 36 (1954) | AX82: =A82 -> 22193
A83: 22200 | F83: OMSI Presents | G83: Eye Opener | H83: Uncle Charlie's Roundhouse | J83: Romper Room | K83: The Better Half | L83: It's a Great Life | M83: San Francisco Beat | N83: Morning Court (ABC) | O83: Love That Bob! (ABC) | P83: The Texan (ABC) | Q83: Queen for a Day (ABC) | R83: About Faces (ABC) | S83: Court U.S.A. | T83: Day in Court (ABC) | U83: Gale Storm (ABC) | V83: Beat the Clock (ABC) | W83: Who Do You Trust? (ABC) | X83: American Bandstand (ABC) | Y83: Uncle Charlie's Den | Z83: Three Stooges | AA83: Rin Tin Tin (ABC) | AB83: Topper | AC83: News Central | AD83: Expedition! (ABC) | AE83: The Bugs Bunny Show (ABC) | AF83: The Rifleman (ABC) | AG83: The Life and Legend of Wyatt Earp (ABC) | AH83: Stagecoach West (ABC) | AJ83: Alcoa Presents (ABC) | AK83: Not for Hire | AL83: News; [11:15] Movie [Movie 12]: Daisy Kenyon (1947) | AX83: =A83 -> 22200
A84: 22207 | F84: OMSI Presents | G84: Eye Opener | H84: Uncle Charlie's Roundhouse | J84: Romper Room | K84: The Better Half | L84: It's a Great Life | M84: San Francisco Beat | N84: Morning Court (ABC) | O84: Love That Bob! (ABC) | P84: The Texan (ABC) | Q84: Queen for a Day (ABC) | R84: About Faces (ABC) | S84: Court U.S.A. | T84: Day in Court (ABC) | U84: Road to Reality (ABC) | V84: Beat the Clock (ABC) | W84: Who Do You Trust? (ABC) | X84: American Bandstand (ABC) | Y84: Uncle Charlie's Den | Z84: Three Stooges | AA84: Rin Tin Tin (ABC) | AB84: Topper | AC84: News Central | AD84: Expedition! (ABC) | AE84: The Bugs Bunny Show (ABC) | AF84: The Rifleman (ABC) | AG84: The Life and Legend of Wyatt Earp (ABC) | AH84: Stagecoach West (ABC) | AJ84: Alcoa Presents (ABC) | AK84: Not for Hire | AL84: News; [11:15] Movie [Movie 12]: Kansas City Confidential (1953) | AX84: =A84 -> 22207
A85: 22214 | F85: OMSI Presents | G85: Eye Opener | H85: Uncle Charlie's Roundhouse | J85: Romper Room | K85: The Better Half | L85: It's a Great Life | M85: San Francisco Beat | N85: Morning Court (ABC) | O85: Love That Bob! (ABC) | P85: The Texan (ABC) | Q85: Queen for a Day (ABC) | R85: About Faces (ABC) | S85: Court U.S.A. | T85: Day in Court (ABC) | U85: Road to Reality (ABC) | V85: Beat the Clock (ABC) | W85: Who Do You Trust? (ABC) | X85: American Bandstand (ABC) | Y85: Uncle Charlie's Den | Z85: Three Stooges | AA85: Rin Tin Tin (ABC) | AB85: Topper | AC85: News Central | AD85: Expedition!--Local | AE85: The Bugs Bunny Show (ABC) | AF85: The Rifleman (ABC) | AG85: The Life and Legend of Wyatt Earp (ABC) | AH85: Stagecoach West (ABC) | AJ85: Alcoa Presents (ABC) | AK85: Not for Hire | AL85: News; [11:15] Movie [Movie 12]: The Call of the Wild (1935) | AX85: =A85 -> 22214
A86: 22221 | F86: OMSI Presents | G86: Eye Opener | H86: Uncle Charlie's Roundhouse | J86: Romper Room | K86: The Better Half | L86: It's a Great Life | M86: San Francisco Beat | N86: Morning Court (ABC) | O86: Love That Bob! (ABC) | P86: The Texan (ABC) | Q86: Queen for a Day (ABC); [12:55] Political Talk--Democratic | R86: About Faces (ABC) | S86: Court U.S.A. | T86: Day in Court (ABC); [2:25] Political Talk--Republican | U86: Road to Reality (ABC) | V86: Beat the Clock (ABC) | W86: Who Do You Trust? (ABC) | X86: American Bandstand (ABC) | Y86: Uncle Charlie's Den | Z86: Three Stooges | AA86: Rin Tin Tin (ABC) | AB86: Topper | AC86: News Central | AD86: Expedition! (ABC) | AE86: The Bugs Bunny Show (ABC) | AF86: The Rifleman (ABC) | AG86: The Life and Legend of Wyatt Earp (ABC) | AH86: Stagecoach West (ABC) | AJ86: Alcoa Presents (ABC) | AK86: Not for Hire | AL86: News; [11:15] Movie [Movie 12]: Always Leave Them Laughing (1949) | AX86: =A86 -> 22221
A87: 22228 | F87: OMSI Presents | G87: Eye Opener | H87: Uncle Charlie's Roundhouse | J87: Romper Room | K87: The Better Half | L87: It's a Great Life | M87: San Francisco Beat | N87: Morning Court (ABC) | O87: Love That Bob! (ABC) | P87: The Texan (ABC) | Q87: Queen for a Day (ABC) | R87: About Faces (ABC) | S87: Court U.S.A. | T87: Day in Court (ABC) | U87: Road to Reality (ABC) | V87: Beat the Clock (ABC) | W87: Who Do You Trust? (ABC) | X87: American Bandstand (ABC) | Y87: Uncle Charlie's Den | Z87: Three Stooges | AA87: Rin Tin Tin (ABC) | AB87: Election Coverage (ABC) | AF87: Election Coverage (ABC) | AL87: Election Coverage | AX87: =A87 -> 22228
A88: 22235 | F88: OMSI Presents | G88: Eye Opener | H88: Uncle Charlie's Roundhouse | J88: Romper Room | K88: The Better Half | L88: It's a Great Life | M88: San Francisco Beat | N88: Morning Court (ABC) | O88: Love That Bob! (ABC) | P88: The Texan (ABC) | Q88: Beat the Clock (ABC) | R88: About Faces (ABC) | S88: Court U.S.A. | T88: Day in Court (ABC) | U88: Road to Reality (ABC) | V88: Queen for a Day (ABC) | W88: Who Do You Trust? (ABC) | X88: American Bandstand (ABC) | Y88: Uncle Charlie's Den | Z88: Three Stooges | AA88: Rin Tin Tin (ABC) | AB88: Topper | AC88: News Central | AD88: Expedition!--Local | AE88: The Bugs Bunny Show (ABC) | AF88: The Rifleman (ABC) | AG88: The Life and Legend of Wyatt Earp (ABC) | AH88: Stagecoach West (ABC) | AJ88: Alcoa Presents (ABC) | AK88: Not for Hire | AL88: News; [11:15] Movie [Movie 12]: The Las Vegas Story (1952) | AX88: =A88 -> 22235
A89: 22242 | F89: OMSI Presents | G89: Eye Opener | H89: Uncle Charlie's Roundhouse | J89: Romper Room | K89: The Better Half | L89: It's a Great Life | M89: San Francisco Beat | N89: Morning Court (ABC) | O89: Love That Bob! (ABC) | P89: The Texan (ABC) | Q89: Beat the Clock (ABC) | R89: About Faces (ABC) | S89: Court U.S.A. | T89: Day in Court (ABC) | U89: Road to Reality (ABC) | V89: Queen for a Day (ABC) | W89: Who Do You Trust? (ABC) | X89: American Bandstand (ABC) | Y89: Uncle Charlie's Den | Z89: Three Stooges | AA89: Rin Tin Tin (ABC) | AB89: Topper | AC89: News Central | AD89: Expedition! (ABC) | AE89: The Bugs Bunny Show (ABC) | AF89: The Rifleman (ABC) | AG89: The Life and Legend of Wyatt Earp (ABC) | AH89: Stagecoach West (ABC) | AJ89: Alcoa Presents (ABC) | AK89: Not for Hire | AL89: News; [11:15] Movie [Movie 12]: Footlight Parade (1933) | AX89: =A89 -> 22242
A90: 22249 | F90: OMSI Presents | G90: Eye Opener | H90: Uncle Charlie's Roundhouse | J90: Romper Room | K90: The Better Half | L90: It's a Great Life | M90: San Francisco Beat | N90: Morning Court (ABC) | O90: Love That Bob! (ABC) | P90: The Texan (ABC) | Q90: Beat the Clock (ABC) | R90: About Faces (ABC) | S90: Court U.S.A. | T90: Day in Court (ABC) | U90: Road to Reality (ABC) | V90: Queen for a Day (ABC) | W90: Who Do You Trust? (ABC) | X90: American Bandstand (ABC) | Y90: Uncle Charlie's Den | Z90: Three Stooges | AA90: Rin Tin Tin (ABC) | AB90: Topper | AC90: News Central | AD90: Expedition! (ABC) | AE90: The Bugs Bunny Show (ABC) | AF90: The Rifleman (ABC) | AG90: The Life and Legend of Wyatt Earp (ABC) | AH90: Stagecoach West (ABC) | AJ90: Alcoa Presents (ABC) | AK90: Not for Hire | AL90: News; [11:15] Movie [Movie 12]: Destination Moon (1950) | AX90: =A90 -> 22249
A91: 22256 | F91: OMSI Presents | G91: Eye Opener | H91: Jeff's Collie | I91: Jeff's Collie | J91: Romper Room | K91: The Better Half | L91: It's a Great Life | M91: San Francisco Beat | N91: Morning Court (ABC) | O91: Love That Bob! (ABC) | P91: The Texan (ABC) | Q91: Beat the Clock (ABC) | R91: About Faces (ABC) | S91: Court U.S.A. | T91: Day in Court (ABC) | U91: Road to Reality (ABC) | V91: Queen for a Day (ABC) | W91: Who Do You Trust? (ABC) | X91: American Bandstand (ABC) | Y91: Uncle Charlie's Den | Z91: Three Stooges | AA91: Rin Tin Tin (ABC) | AB91: Topper | AC91: News Central | AD91: Expedition!--Local | AE91: The Bugs Bunny Show (ABC) | AF91: The Rifleman (ABC) | AG91: The Life and Legend of Wyatt Earp (ABC) | AH91: Stagecoach West (ABC) | AJ91: Alcoa Presents (ABC) | AK91: Not for Hire | AL91: News; [11:15] Movie [Movie 12]: The Big Bluff (1955) | AX91: =A91 -> 22256
A92: 22263 | F92: OMSI Presents | G92: Eye Opener | H92: Jeff's Collie | I92: Jeff's Collie | J92: Romper Room | K92: The Better Half | L92: It's a Great Life | M92: San Francisco Beat | N92: Morning Court (ABC) | O92: Love That Bob! (ABC) | P92: The Texan (ABC) | Q92: Beat the Clock (ABC) | R92: About Faces (ABC) | S92: Court U.S.A. | T92: Day in Court (ABC) | U92: Road to Reality (ABC) | V92: Queen for a Day (ABC) | W92: Who Do You Trust? (ABC) | X92: American Bandstand (ABC) | Y92: Uncle Charlie's Den | Z92: Three Stooges | AA92: Rin Tin Tin (ABC) | AB92: Topper | AC92: News Central | AD92: Expedition! (ABC) | AE92: The Bugs Bunny Show (ABC) | AF92: The Rifleman (ABC) | AG92: The Life and Legend of Wyatt Earp (ABC) | AH92: Stagecoach West (ABC) | AJ92: Alcoa Presents (ABC) | AK92: Not for Hire | AL92: News; [11:15] Movie [Movie 12]: Bermuda Affair (1957) | AX92: =A92 -> 22263
A93: 22270 | F93: OMSI Presents | G93: Eye Opener | H93: Jeff's Collie | I93: Jeff's Collie | J93: Romper Room | K93: The Better Half | L93: It's a Great Life | M93: San Francisco Beat | N93: Morning Court (ABC) | O93: Love That Bob! (ABC) | P93: The Texan (ABC) | Q93: Beat the Clock (ABC) | R93: About Faces (ABC) | S93: Court U.S.A. | T93: Day in Court (ABC) | U93: Road to Reality (ABC) | V93: Queen for a Day (ABC) | W93: Who Do You Trust? (ABC) | X93: American Bandstand (ABC) | Y93: Uncle Charlie's Den | Z93: Three Stooges | AA93: Rin Tin Tin (ABC) | AB93: Topper | AC93: News Central | AD93: Expedition! (ABC) | AE93: The Bugs Bunny Show (ABC) | AF93: The Rifleman (ABC) | AG93: The Life and Legend of Wyatt Earp (ABC) | AH93: Stagecoach West (ABC) | AJ93: Alcoa Presents (ABC) | AK93: Not for Hire | AL93: News; [11:15] Movie [Movie 12]: The Prime Minister (1941) | AX93: =A93 -> 22270
A94: 22277 | F94: OMSI Presents | G94: Eye Opener | H94: Jeff's Collie | I94: Jeff's Collie | J94: Romper Room | K94: The Better Half | L94: It's a Great Life | M94: San Francisco Beat | N94: Morning Court (ABC) | O94: Love That Bob! (ABC) | P94: The Texan (ABC) | Q94: Beat the Clock (ABC) | R94: About Faces (ABC) | S94: Court U.S.A. | T94: Day in Court (ABC) | U94: Road to Reality (ABC) | V94: Queen for a Day (ABC) | W94: Who Do You Trust? (ABC) | X94: American Bandstand (ABC) | Y94: Uncle Charlie's Den | Z94: Three Stooges | AA94: Rin Tin Tin (ABC) | AB94: Topper | AC94: News Central | AD94: Expedition!--Local | AE94: The Bugs Bunny Show (ABC) | AF94: The Rifleman (ABC) | AG94: The Life and Legend of Wyatt Earp (ABC) | AH94: Stagecoach West (ABC) | AJ94: Alcoa Presents (ABC) | AK94: Not for Hire | AL94: News; [11:15] Movie [Movie 12]: Flirtation Walk (1934) | AX94: =A94 -> 22277
A95: 1961 | AX95: =A95 -> 1961
A96: 22284 | F96: OMSI Presents | G96: Eye Opener | H96: Uncle Charlie's Roundhouse | J96: Romper Room | K96: The Better Half | L96: It's a Great Life | M96: San Francisco Beat | N96: Morning Court (ABC) | O96: Love That Bob! (ABC) | P96: The Texan (ABC) | Q96: Beat the Clock (ABC) | R96: About Faces (ABC) | S96: Court U.S.A. | T96: Day in Court (ABC) | U96: Road to Reality (ABC) | V96: Queen for a Day (ABC) | W96: Who Do You Trust? (ABC) | X96: American Bandstand (ABC) | Y96: Uncle Charlie's Den | Z96: Three Stooges | AA96: Rocky and His Friends (ABC) | AB96: Topper | AC96: News Central | AD96: Expedition! (ABC) | AE96: The Bugs Bunny Show (ABC) | AF96: The Rifleman (ABC) | AG96: The Life and Legend of Wyatt Earp (ABC) | AH96: Stagecoach West (ABC) | AJ96: Alcoa Presents (ABC) | AK96: Not for Hire | AL96: News; [11:15] Movie [Movie 12]: Dangerous Blondes (1943) | AX96: =A96 -> 22284
A99: 1962 | AX99: =A99 -> 1962
A101: 1963 | AX101: =A101 -> 1963
A103: 23166 | F103: Telecourse | G103: Cartoon Capers; [7:45] Dr. Zoom's Cartoons; [8:15] King Leonardo | I103: Romper Room | J103: Jack LaLanne | K103: News--Ed Arndt; [9:35] Movie: Don't Bother to Knock (1952) | N103: Life of Riley | O103: Seven Keys (ABC) | P103: Ernie Ford | Q103: Father Knows Best | R103: General Hospital (ABC) | S103: Girl Talk | T103: Day in Court; [2:25] News | U103: Jayne Wyman | V103: Queen for a Day | W103: Who Do You Trust? | X103: American Bandstand (ABC) | Y103: Discovery '63; [4:55] American Newsstand | Z103: Three Stooges | AA103: Popeye Theater | AB103: Cartoon Castle | AC103: News--Sanders, Arndt; [6:45] ABC News | AD103: People Are Funny | AE103: Combat (ABC) | AG103: Hawaiian Eye (ABC) | AI103: Untouchables (ABC) | AK103: Close-Up! (ABC) | AL103: News, Sports | AM103: Suspicion | AO103: Movie: One Minute to Zero (1952) | AX103: 23166
A105: 1965 | AX105: 1965
A106: 23999 | K106: [9:45] News, Weather | L106: Medieval Romances | M106: Jack La Lanne | N106: 12 in the Morning | O106: Sergeant Preston | P106: Cartoon Castle [Dr. Zoom] | R106: Girl Talk | S106: Movie: Great Day (1945) | V106: [3:15] News--Duane Bock | W106: Touch Turtle | X106: [4:15] Rocky and Friends | Y106: Popeye's Pier 12 | Z106: Lloyd Thaxton | AB106: Yogi Bear | AC106: Trackdown | AD106: The Rifleman | AE106: American West | AF106: High and Wild | AG106: Arrest and Trial | AJ106: Dick Powell Theater | AL106: News, Weather; [11:05] Movie: A Dangerous Profession (1949)
A107: 24006 | K107: [9:45] News, Weather | L107: Medieval Romances | M107: Jack La Lanne | N107: 12 in the Morning | O107: Sergeant Preston | P107: Cartoon Castle [Dr. Zoom] | R107: Girl Talk | S107: Movie: Hotel Reserve (English, 1944) | V107: [3:15] News--Duane Bock | W107: Touch Turtle | X107: [4:15] Rocky and Friends | Y107: Popeye's Pier 12 | Z107: Lloyd Thaxton | AB107: Yogi Bear | AC107: Trackdown | AD107: The Rifleman | AE107: American West | AF107: High and Wild | AG107: Arrest and Trial | AJ107: Dick Powell Theater | AL107: News, Weather; [11:05] Movie: The Sign of the Cross (1932)
A112: 1970 | AX112: 1970
A113: 25574 | F113: Telecourse | G113: The Flintstones | H113: Hobo Kelly | J113: The Patty Duke Show | K113: The Wonderful World of Women | L113: Movie [Morning Movie 12]: Let's Make it Legal (1951) | O113: Fashions in Sewing; [11:40] 12 in the Morning; [11:50] News--Don Stellges | P113: Rusty Nails' Cartoons | R113: The Movie Game | S113: Portrait | U113: The Galloping Gourmet | V113: The Three O'Clock News--Don Stellges/ Jimmy Jones/ Bill Swing | W113: He Said! She Said! | X113: Beat the Clock | Y113: Popeye's Pier 12 | Z113: The Flintstones | AA113: Sea Hunt | AB113: Gilligan's Island | AC113: The Invaders | AE113: Perry Mason | AG113: The David Frost Show | AJ113: The 10 O'Clock News--Don Stellges | AK113: Felony Squad | AL113: Movie [Movie 12]: The Hour of 13 (1952) | AX113: 25574
A114: =A113+7 -> 25581 | F114: Telecourse | G114: The Flintstones | H114: Hobo Kelly | J114: The Patty Duke Show | K114: The Wonderful World of Women | L114: Movie [Morning Movie 12]: Fort Worth (1951) | O114: Fashions in Sewing; [11:40] 12 in the Morning; [11:50] News--Don Stellges | P114: Rusty Nails' Cartoons | R114: The Movie Game | S114: Run for Your Life | U114: The Galloping Gourmet | V114: The Three O'Clock News--Don Stellges/ Jimmy Jones/ Bill Swing | W114: He Said! She Said! | X114: Beat the Clock | Y114: Popeye's Pier 12 | Z114: The Flintstones | AA114: Sea Hunt | AB114: Gilligan's Island | AC114: Star Trek | AE114: Perry Mason | AG114: The David Frost Show | AJ114: The 10 O'Clock News--Don Stellges | AK114: Felony Squad | AL114: Movie [Movie 12]: Key Witness (1960) | AX114: =A114 -> 25581
A115: =A114+7 -> 25588
A116: =A115+7 -> 25595 | F116: Telecourse | G116: The Flintstones | H116: Hobo Kelly | J116: The Patty Duke Show | K116: The Wonderful World of Women | L116: Movie [Morning Movie 12]: Cattle Empire (1958) | O116: Fashions in Sewing; [11:40] 12 in the Morning; [11:50] News--Don Stellges | P116: Rusty Nails' Cartoons | R116: The Movie Game | S116: Run for Your Life | U116: The Galloping Gourmet | V116: The Three O'Clock News--Don Stellges/ Jimmy Jones/ Bill Swing | W116: He Said! She Said! | X116: Beat the Clock | Y116: Popeye's Pier 12 | Z116: The Flintstones | AA116: Sea Hunt | AB116: Gilligan's Island | AC116: Star Trek | AE116: Felony Squad | AF116: WHL Hockey: Portland Buckaroos vs San Diego Gulls | AK116: The 10 O'Clock News-- Don Stellges/ Michael Hartfield/ Jimmy Jones | AL116: Movie [Movie 12]: Tomorrow is Another Day (1951) | AX116: =A116 -> 25595
A117: =A116+7 -> 25602 | F117: Telecourse | G117: The Flintstones | H117: Hobo Kelly | J117: The Patty Duke Show | K117: The Wonderful World of Women | L117: Movie [Morning Movie 12]: That Uncertain Feeling (1941) | O117: Fashions in Sewing; [11:40] 12 in the Morning; [11:50] News--Don Stellges | P117: Rusty Nails' Cartoons | R117: The Movie Game | S117: Run for Your Life | U117: The Galloping Gourmet | V117: The Three O'Clock News--Don Stellges/ Jimmy Jones/ Bill Swing | W117: He Said! She Said! | X117: Beat the Clock | Y117: Popeye's Pier 12 | Z117: The Flintstones | AA117: Sea Hunt | AB117: Gilligan's Island | AC117: Star Trek | AE117: Perry Mason | AG117: The David Frost Show | AJ117: The 10 O'Clock News-- Don Stellges/ Michael Hartfield/ Jimmy Jones | AK117: Felony Squad | AL117: Movie [Movie 12]: The Snorkel (1958) | AX117: =A117 -> 25602
A118: =A117+7 -> 25609 | F118: Telecourse | G118: The Flintstones | H118: Hobo Kelly | J118: The Patty Duke Show | K118: The Wonderful World of Women | L118: Movie [Morning Movie 12]: Give My Regards to Broadway (1948) | O118: Fashions in Sewing; [11:40] 12 in the Morning; [11:50] News--Don Stellges | P118: Rusty Nails' Cartoons | R118: The Movie Game | S118: Run for Your Life | U118: The Galloping Gourmet | V118: The Three O'Clock News--Don Stellges/ Jimmy Jones/ Bill Swing | W118: He Said! She Said! | X118: Beat the Clock | Y118: Popeye's Pier 12 | Z118: The Flintstones | AA118: Sea Hunt | AB118: Gilligan's Island | AC118: Star Trek | AE118: Perry Mason | AG118: The David Frost Show | AJ118: The 10 O'Clock News-- Don Stellges/ Michael Hartfield/ Jimmy Jones | AK118: Felony Squad | AL118: Movie [Movie 12]: Murder at 45 R.P.M. (1960) | AX118: =A118 -> 25609
A119: =A118+7 -> 25616 | F119: Telecourse | G119: The Flintstones | H119: Hobo Kelly | J119: The Patty Duke Show | K119: The Wonderful World of Women | L119: Movie [Morning Movie 12]: Sherlock Holmes and the Scarlet Claw (1944) | O119: Fashions in Sewing; [11:40] 12 in the Morning; [11:50] News--Don Stellges | P119: Rusty Nails' Cartoons | R119: The Movie Game | S119: Run for Your Life | U119: The Galloping Gourmet | V119: The Three O'Clock News--Don Stellges/ Jimmy Jones/ Bill Swing | W119: He Said! She Said! | X119: Beat the Clock | Y119: Popeye's Pier 12 | Z119: The Flintstones | AA119: Sea Hunt | AB119: Gilligan's Island | AC119: Star Trek | AE119: Perry Mason | AG119: The David Frost Show | AJ119: The 10 O'Clock News-- Don Stellges/ Michael Hartfield/ Jimmy Jones | AK119: Felony Squad | AL119: Movie [Movie 12]: Pickup on South Street (1953) | AX119: =A119 -> 25616
A120: =A119+7 -> 25623 | F120: Telecourse | G120: The Flintstones | H120: Hobo Kelly | J120: The Patty Duke Show | K120: The Wonderful World of Women | L120: Movie [Morning Movie 12]: About Face (1952) | O120: Fashions in Sewing; [11:40] 12 in the Morning; [11:50] News--Don Stellges | P120: Rusty Nails' Cartoons | R120: The Movie Game | S120: Run for Your Life | U120: The Galloping Gourmet | V120: The Three O'Clock News--Don Stellges/ Jimmy Jones/ Bill Swing | W120: He Said! She Said! | X120: Beat the Clock | Y120: Popeye's Pier 12 | Z120: The Flintstones | AA120: Sea Hunt | AB120: Gilligan's Island | AC120: Star Trek | AE120: Perry Mason | AG120: The David Frost Show | AJ120: The 10 O'Clock News-- Don Stellges/ Michael Hartfield/ Jimmy Jones | AK120: Felony Squad | AL120: Movie [Movie 12]: The List of Adrian Messenger (1963) | AX120: =A120 -> 25623
A121: =A120+7 -> 25630
A122: =A121+7 -> 25637 | F122: Telecourse | G122: The Flintstones | H122: Hobo Kelly | J122: The Patty Duke Show | K122: The Wonderful World of Women | L122: Movie [Morning Movie 12]: Carnival in Costa Rica (1947) | O122: Fashions in Sewing; [11:40] 12 in the Morning; [11:50] News--Don Stellges | P122: Rusty Nails' Cartoons | R122: The Movie Game | S122: Run for Your Life | U122: The Galloping Gourmet | V122: The Three O'Clock News--Don Stellges/ Jimmy Jones/ Bill Swing | W122: He Said! She Said! | X122: Beat the Clock | Y122: Popeye's Pier 12 | Z122: The Flintstones | AA122: Sea Hunt | AB122: Gilligan's Island | AC122: Star Trek | AE122: Perry Mason | AG122: The David Frost Show | AJ122: The 10 O'Clock News-- Don Stellges/ Michael Hartfield/ Jimmy Jones | AK122: Felony Squad | AL122: Movie [Movie 12]: Fame is the Name of the Game (1966) | AX122: =A122 -> 25637
A123: =A122+7 -> 25644 | F123: Telecourse | G123: The Flintstones | H123: Hobo Kelly | J123: The Patty Duke Show | K123: The Wonderful World of Women | L123: Movie [Morning Movie 12]: Intent to Kill (1959) | O123: Fashions in Sewing; [11:40] 12 in the Morning; [11:55] News--Larry Curran | P123: Rusty Nails' Cartoons | R123: The Movie Game | S123: Hawaii Calls | T123: Faces and Places | U123: The Galloping Gourmet | V123: The Three O'Clock News--Don Stellges/ Jimmy Jones/ Bill Swing | W123: He Said! She Said! | X123: Beat the Clock | Y123: Popeye's Pier 12 | Z123: The Flintstones | AA123: Sea Hunt | AB123: Gilligan's Island | AC123: Star Trek | AE123: Perry Mason | AG123: The David Frost Show | AJ123: The 10 O'Clock News-- Don Stellges/ Michael Hartfield/ Jimmy Jones | AK123: Felony Squad | AL123: Movie [Movie 12]: Over-exposed (1956) | AX123: =A123 -> 25644
A124: =A123+7 -> 25651 | F124: Telecourse | G124: The Flintstones | H124: Hobo Kelly | J124: The Patty Duke Show | K124: The Wonderful World of Women | L124: Movie [Morning Movie 12]: Dick Tracy, Detective (1945) | O124: Fashions in Sewing; [11:40] 12 in the Morning; [11:50] News--Larry Curran | P124: Rusty Nails' Cartoons | R124: The Movie Game | S124: Hawaii Calls | T124: Faces and Places | U124: The Galloping Gourmet | V124: The Three O'Clock News--Don Stellges/ Jimmy Jones/ Bill Swing | W124: He Said! She Said! | X124: Beat the Clock | Y124: Popeye's Pier 12 | Z124: The Flintstones | AA124: Sea Hunt | AB124: Gilligan's Island | AC124: Star Trek | AE124: Perry Mason | AG124: The David Frost Show | AJ124: The 10 O'Clock News-- Don Stellges/ Michael Hartfield/ Jimmy Jones | AK124: Felony Squad | AL124: Movie [Movie 12]: Agent for H.A.R.M. (1966) | AX124: =A124 -> 25651
A125: =A124+7 -> 25658 | F125: Telecourse | G125: The Flintstones | H125: Hobo Kelly | J125: The Patty Duke Show | K125: The Wonderful World of Women | L125: Movie [Morning Movie 12]: The Pearl of Death (1944) | O125: Fashions in Sewing; [11:40] 12 in the Morning; [11:50] News--Larry Curran | P125: Rusty Nails' Cartoons | R125: The Movie Game | S125: Hawaii Calls | T125: Faces and Places | U125: The Galloping Gourmet | V125: The Three O'Clock News--Don Stellges/ Jimmy Jones/ Bill Swing | W125: He Said! She Said! | X125: Beat the Clock | Y125: Popeye's Pier 12 | Z125: The Flintstones | AA125: Sea Hunt | AB125: Gilligan's Island | AC125: Star Trek | AE125: Perry Mason | AG125: The David Frost Show | AJ125: The 10 O'Clock News-- Don Stellges/ Michael Hartfield/ Jimmy Jones | AK125: Felony Squad | AL125: Movie [Movie 12]: Phantom of the Rue Morgue (1954) | AX125: =A125 -> 25658
A126: =A125+7 -> 25665
A127: =A126+7 -> 25672 | F127: Telecourse | G127: The Flintstones | H127: Hobo Kelly | J127: The Patty Duke Show | K127: The Wonderful World of Women | L127: Movie [Morning Movie 12]: Let's Rock (1958) | O127: Fashions in Sewing; [11:40] 12 in the Morning; [11:50] News--Larry Curran | P127: Rusty Nails' Cartoons | R127: The Movie Game | S127: The Naked City | U127: The Galloping Gourmet | V127: The Three O'Clock News--Don Stellges/ Jimmy Jones/ Bill Swing | W127: He Said! She Said! | X127: Beat the Clock | Y127: Popeye's Pier 12 | Z127: The Addams Family | AA127: Sea Hunt | AB127: Gilligan's Island | AC127: Star Trek | AE127: Perry Mason | AG127: The David Frost Show | AJ127: The 10 O'Clock News-- Don Stellges/ Michael Hartfield/ Jimmy Jones | AK127: Felony Squad | AL127: Movie [Movie 12]: Breakthrough (1950) | AX127: =A127 -> 25672
A128: =A127+7 -> 25679 | F128: Telecourse | G128: The Flintstones | H128: Hobo Kelly | J128: The Patty Duke Show | K128: The Wonderful World of Women | L128: Movie [Morning Movie 12]: Sherlock Holmes and the Secret Weapon (1942) | O128: Fashions in Sewing; [11:40] 12 in the Morning; [11:50] News--Larry Curran | P128: Rusty Nails' Cartoons | R128: The Movie Game | S128: The Naked City | U128: The Galloping Gourmet | V128: The Three O'Clock News--Don Stellges/ Jimmy Jones/ Bill Swing | W128: He Said! She Said! | X128: Beat the Clock | Y128: Popeye's Pier 12 | Z128: The Addams Family | AA128: Sea Hunt | AB128: Gilligan's Island | AC128: Star Trek | AE128: Perry Mason | AG128: The David Frost Show | AJ128: The 10 O'Clock News-- Don Stellges/ Michael Hartfield/ Jimmy Jones | AK128: Felony Squad | AL128: Movie [Movie 12]: Maru Maru (1952) | AX128: =A128 -> 25679
A129: =A128+7 -> 25686
A130: =A129+7 -> 25693 | F130: Telecourse | G130: The Flintstones | H130: Hobo Kelly | J130: The Patty Duke Show | K130: The Wonderful World of Women | L130: Movie [Morning Movie 12]: Caged (1950) | O130: Fashions in Sewing; [11:40] 12 in the Morning; [11:50] News--Larry Curran | P130: Rusty Nails' Cartoons | R130: The Movie Game | S130: The Naked City | U130: The Galloping Gourmet | V130: The Three O'Clock News--Don Stellges/ Jimmy Jones/ Bill Swing | W130: He Said! She Said! | X130: Beat the Clock | Y130: Popeye's Pier 12 | Z130: The Addams Family | AA130: Sea Hunt | AB130: Gilligan's Island | AC130: Star Trek | AE130: Perry Mason | AG130: The David Frost Show | AJ130: The 10 O'Clock News-- Don Stellges/ Michael Hartfield/ Jimmy Jones | AK130: Felony Squad | AL130: Movie [Movie 12]: Crime Wave (1954) | AX130: =A130 -> 25693
A131: =A130+7 -> 25700 | F131: Telecourse | G131: The Flintstones | H131: Hobo Kelly | J131: The Patty Duke Show | K131: The Wonderful World of Women | L131: Movie [Morning Movie 12]: Buck Privates Come Home (1947) | O131: Fashions in Sewing; [11:40] 12 in the Morning; [11:50] News--Larry Curran | P131: Rusty Nails' Cartoons | R131: The Movie Game | S131: The Naked City | U131: The Galloping Gourmet | V131: The Three O'Clock News--Don Stellges/ Jimmy Jones/ Bill Swing | W131: He Said! She Said! | X131: Beat the Clock | Y131: Popeye's Pier 12 | Z131: The Addams Family | AA131: Sea Hunt | AB131: Gilligan's Island | AC131: Star Trek | AE131: Perry Mason | AG131: The David Frost Show | AJ131: The 10 O'Clock News-- Don Stellges/ Michael Hartfield/ Jimmy Jones | AK131: The Honey-mooners | AL131: Movie [Movie 12]: Jump into Hell (1955) | AX131: =A131 -> 25700
A132: =A131+7 -> 25707
A133: =A132+7 -> 25714 | F133: Telecourse | G133: The Flintstones | H133: Hobo Kelly | J133: The Patty Duke Show | K133: The Wonderful World of Women | L133: Movie [Morning Movie 12]: Hit the Ice (1943) | O133: Fashions in Sewing; [11:40] 12 in the Morning; [11:50] News--Larry Curran | P133: Rusty Nails' Cartoons | R133: The Movie Game | S133: The Naked City | U133: The Galloping Gourmet | V133: The Three O'Clock News--Don Stellges/ Jimmy Jones/ Bill Swing | W133: He Said! She Said! | X133: Beat the Clock | Y133: Popeye's Pier 12 | Z133: The Addams Family | AA133: Sea Hunt | AB133: Gilligan's Island | AC133: Star Trek | AE133: Perry Mason | AG133: The David Frost Show | AJ133: Election Returns-- Don Stellges/ Michael Hartfield/ Larry Curran/ Frank Bonnema/ Gerry Pratt | AL133: Movie [Movie 12]: Lover Come Back (1946) | AX133: =A133 -> 25714
A134: =A133+7 -> 25721 | F134: Telecourse | G134: The Flintstones | H134: Hobo Kelly | J134: The Patty Duke Show | K134: The Wonderful World of Women | L134: Movie [Morning Movie 12]: Land of the Pharaohs (1955) | O134: 12 in the Morning; [11:40] News--Larry Curran | P134: Rusty Nails' Cartoons | R134: The Movie Game | S134: The Untouchables | U134: The Galloping Gourmet | V134: The Three O'Clock News--Don Stellges/ Jimmy Jones/ Bill Swing; [3:20] Fashions in Sewing | W134: He Said! She Said! | X134: Beat the Clock | Y134: Popeye's Pier 12 | Z134: The Addams Family | AA134: Sea Hunt | AB134: Gilligan's Island | AC134: Star Trek | AE134: Oral Roberts (Special) | AG134: The David Frost Show | AJ134: The 10 O'Clock News-- Don Stellges/ Michael Hartfield/ Jimmy Jones | AK134: The Honey-mooners | AL134: Movie [Movie 12]: Calling Bulldog Drummond (1951) | AX134: =A134 -> 25721
A135: =A134+7 -> 25728 | F135: Telecourse | G135: The Flintstones | H135: Hobo Kelly | J135: The Patty Duke Show | K135: The Wonderful World of Women | L135: Movie [Morning Movie 12]: Over-exposed (1956) | O135: 12 in the Morning; [11:40] News--Larry Curran | P135: Rusty Nails' Cartoons | R135: The Movie Game | S135: The Untouchables | U135: The Galloping Gourmet | V135: The Three O'Clock News--Don Stellges/ Jimmy Jones [3:20] Fashions in Sewing | W135: He Said! She Said! | X135: Beat the Clock | Y135: Popeye's Pier 12 | Z135: The Addams Family | AA135: Sea Hunt | AB135: Gilligan's Island | AC135: Star Trek | AE135: Perry Mason | AG135: The David Frost Show | AJ135: The 10 O'Clock News-- Don Stellges/ Michael Hartfield/ Jimmy Jones | AK135: The Honey-mooners | AL135: Movie [Movie 12]: The Lineup (1958) | AX135: =A135 -> 25728
A136: =A135+7 -> 25735 | F136: Telecourse | G136: The Flintstones | H136: Hobo Kelly | J136: The Patty Duke Show | K136: The Wonderful World of Women | L136: Movie [Morning Movie 12]: Don't Knock the Rock (1956) | O136: 12 in the Morning; [11:40] News--Larry Curran/ Bill Swing | P136: Rusty Nails' Cartoons | R136: The Movie Game | S136: The Untouchables | U136: The Galloping Gourmet | V136: The Three O'Clock News--Don Stellges/ Jimmy Jones [3:20] Fashions in Sewing | W136: He Said! She Said! | X136: Beat the Clock | Y136: Popeye's Pier 12 | Z136: The Addams Family | AA136: Sea Hunt | AB136: Gilligan's Island | AC136: Star Trek | AE136: Perry Mason | AG136: The David Frost Show | AJ136: The 10 O'Clock News-- Don Stellges/ Michael Hartfield/ Jimmy Jones | AK136: The Honey-mooners | AL136: Movie [Movie 12]: Kiss the Blood Off My Hands (1948) | AX136: =A136 -> 25735
A137: =A136+7 -> 25742 | F137: Telecourse | G137: The Flintstones | H137: Hobo Kelly | J137: The Patty Duke Show | K137: The Wonderful World of Women | L137: Movie [Morning Movie 12]: Illegal (1955) | O137: 12 in the Morning; [11:40] News--Larry Curran/ Bill Swing | P137: Rusty Nails' Cartoons | R137: The Movie Game | S137: Faces and Places | U137: The Galloping Gourmet | V137: The Three O'Clock News--Don Stellges/ Jimmy Jones [3:20] Fashions in Sewing | W137: He Said! She Said! | X137: Beat the Clock | Y137: Popeye's Pier 12 | Z137: The Addams Family | AA137: Sea Hunt | AB137: Gilligan's Island | AC137: Star Trek | AE137: Billy Graham (Special) | AG137: The David Frost Show | AJ137: The 10 O'Clock News-- Don Stellges/ Michael Hartfield/ Jimmy Jones | AK137: The Honey-mooners | AL137: Movie [Movie 12]: Strangers on a Train (1951) | AX137: =A137 -> 25742
A138: =A137+7 -> 25749 | F138: Telecourse | G138: The Flintstones | H138: Hobo Kelly | J138: The Patty Duke Show | K138: The Wonderful World of Women | L138: Movie [Morning Movie 12]: Ghost of the China Sea (1958) | O138: 12 in the Morning; [11:40] News--Larry Curran/ Bill Swing | P138: Rusty Nails' Cartoons | R138: The Movie Game | S138: Faces and Places | U138: The Galloping Gourmet | V138: The Three O'Clock News--Don Stellges/ Jimmy Jones [3:20] Fashions in Sewing | W138: He Said! She Said! | X138: Beat the Clock | Y138: Popeye's Pier 12 | Z138: The Addams Family | AA138: Sea Hunt | AB138: Gilligan's Island | AC138: Star Trek | AE138: The Real Tom Kennedy Show | AG138: The David Frost Show | AJ138: The 10 O'Clock News-- Don Stellges/ Michael Hartfield/ Jimmy Jones | AK138: The Honey-mooners | AL138: Movie [Movie 12]: The Enemy General (1960) | AX138: =A138 -> 25749
A139: =A138+7 -> 25756 | F139: Telecourse | G139: Cartoon Castle | H139: Hobo Kelly | J139: The Patty Duke Show | K139: The Wonderful World of Women | L139: Movie [Morning Movie 12]: As Young as You Feel (1951) | O139: 12 in the Morning; [11:40] News--Larry Curran/ Bill Swing | P139: Rusty Nails' Cartoons | R139: The Movie Game | S139: Faces and Places | U139: The Galloping Gourmet | V139: The Three O'Clock News--Don Stellges/ Jimmy Jones [3:20] Fashions in Sewing | W139: He Said! She Said! | X139: Beat the Clock | Y139: Popeye's Pier 12 | Z139: Mister Ed | AA139: Sea Hunt | AB139: Gilligan's Island | AC139: Star Trek | AE139: Perry Mason | AG139: The David Frost Show | AJ139: The 10 O'Clock News-- Don Stellges/ Michael Hartfield/ Jimmy Jones | AK139: The Honey-mooners | AL139: Movie [Movie 12]: Force of Arms (1951) | AX139: =A139 -> 25756
A144: 1974 | AX144: 1974
A146: 27394 | F146: Government Story | G146: The Flintstones | H146: Cartoon Castle | I146: Nanny and the Professor | J146: Name That Tune (NBC) | K146: News--Larry Curran/Young | L146: Now You See It (CBS) | M146: It Takes a Thief | O146: Search for Tomorrow (CBS) | P146: Jeopardy! (NBC) | Q146: The Bold Ones | S146: Movie [Matinee 12]: The Three Worlds of Gulliver (1960) | W146: Gomer Pyle, USMC | X146: Ramblin' Rod | Y146: Batman | Z146: I Dream of Jeannie | AA146: Courtship of Eddie's Father | AB146: The Mod Squad | AD146: The FBI | AF146: News--Michael Hartfield/ Jimmy Jones | AG146: Movie [The Movie]: The Five Pennies (1959) | AK146: KPTV Preview '75--Jimmy Jones; [10:45] Movie: Never Give a Sucker an Even Break (1941) | AM146: [11:55] Movie: You Can't Cheat an Honest Man (1939) | AX146: 27394
A147: 1975 | AX147: 1975
A148: 27401 | F148: Government Story | G148: The Flintstones | H148: Cartoon Castle | I148: Nanny and the Professor | J148: Celebrity Sweepstakes (NBC) | K148: News--Curran/Young | L148: Now You See It (CBS) | M148: It Takes a Thief | O148: Search for Tomorrow (CBS) | P148: How to Survive a Marriage (NBC) | Q148: The Bold Ones | S148: Movie [Matinee 12]: The Longest Hundred Miles (1966) | W148: Gomer Pyle, USMC | X148: Ramblin' Rod | Y148: Batman | Z148: I Dream of Jeannie | AA148: Courtship of Eddie's Father | AB148: The Mod Squad | AD148: The FBI | AF148: Movie [The Movie]: One Desire (1955) | AJ148: The 10 O'Clock News | AL148: Flash Gordon; [11:15] Movie [Movie 12]: The Three Musketeers (1939) | AX148: 27401
A149: =A148+7 -> 27408 | F149: Government Story | G149: The Flintstones | H149: Cartoon Castle | I149: Petticoat Junction | J149: Celebrity Sweepstakes (NBC) | K149: Nanny and the Professor | L149: Now You See It (CBS) | M149: Bold Ones | O149: Search for Tomorrow (CBS) | P149: How to Survive a Marriage (NBC) | Q149: Movie [Matinee 12]: Mr. Skeffington (1944) | V149: Gomer Pyle, USMC | W149: Batman | X149: Ramblin' Rod | Y149: I Dream of Jeannie | Z149: The Mod Squad | AB149: Star Trek | AD149: The FBI | AF149: Movie [The Movie]: Never Say Goodbye (1956) | AJ149: The 10 O'Clock News | AL149: Flash Gordon; [11:15] Movie [Movie 12]: Captain Mephisto and the Transformation Machine (1945) | AX149: =AX148+7 -> 27408
A150: =A149+7 -> 27415 | F150: Government Story | G150: The Flintstones | H150: Cartoon Castle | I150: Petticoat Junction | J150: Celebrity Sweepstakes (NBC) | K150: Nanny and the Professor | L150: Now You See It (CBS) | M150: Bold Ones | O150: Search for Tomorrow (CBS) | P150: How to Survive a Marriage (NBC) | Q150: Movie [Matinee 12]: A Time to Love and a Time to Die (1958) | V150: Gomer Pyle, USMC | W150: Batman | X150: Ramblin' Rod | Y150: I Dream of Jeannie | Z150: Courtship of Eddie's Father | AA150: NBA Basketball: Portland Trail Blazers vs Omaha Kings--Jimmy Jones reports | AE150: Night Gallery | AF150: Movie [The Movie]: The Unguarded Moment (1956) | AJ150: The 10 O'Clock News | AL150: Flash Gordon; [11:15] Movie [Movie 12]: The Three Musketeers (1939) | AX150: =AX149+7 -> 27415
A151: =A150+7 -> 27422 | F151: Government Story | G151: The Flintstones | H151: Cartoon Castle | I151: Petticoat Junction | J151: Celebrity Sweepstakes (NBC) | K151: Nanny and the Professor | L151: Now You See It (CBS) | M151: Bold Ones | O151: Search for Tomorrow (CBS) | P151: How to Survive a Marriage (NBC) | Q151: Movie [Matinee 12]: The Corn is Green (1945) | V151: Gomer Pyle, USMC | W151: Batman | X151: Ramblin' Rod | Y151: I Dream of Jeannie | Z151: The Mod Squad | AB151: Star Trek | AD151: The FBI | AF151: Movie [The Movie]: The Ipcress File (1965) | AJ151: The 10 O'Clock News | AL151: Flash Gordon; [11:15] Movie [Movie 12]: The Torpedo of Doom (1938) | AX151: =AX150+7 -> 27422
A152: =A151+7 -> 27429 | F152: Government Story | G152: The Flintstones | H152: Cartoon Castle | I152: Petticoat Junction | J152: Celebrity Sweepstakes (NBC) | K152: Nanny and the Professor | L152: Now You See It (CBS) | M152: Bold Ones | O152: Search for Tomorrow (CBS) | P152: How to Survive a Marriage (NBC) | Q152: Movie [Matinee 12]: Mister Moses (1965) | V152: Gomer Pyle, USMC | W152: Batman | X152: Ramblin' Rod | Y152: I Dream of Jeannie | Z152: The Mod Squad | AB152: Star Trek | AD152: The FBI | AF152: Movie [The Movie]: Secret of the Incas (1954) | AJ152: The 10 O'Clock News | AL152: Flash Gordon; [11:15] Movie [Movie 12]: Hit the Saddle (1937) | AX152: =AX151+7 -> 27429
A153: =A152+7 -> 27436 | F153: Government Story | G153: The Flintstones | H153: Cartoon Castle | I153: Petticoat Junction | J153: Celebrity Sweepstakes (NBC) | K153: Nanny and the Professor | L153: Now You See It (CBS) | M153: Bold Ones | O153: Search for Tomorrow (CBS) | P153: How to Survive a Marriage (NBC) | Q153: Movie [Matinee 12]: Man's Favorite Sport? (1964) | V153: Gomer Pyle, USMC | W153: Batman | X153: Ramblin' Rod | Y153: I Dream of Jeannie | Z153: The Mod Squad | AB153: Star Trek | AD153: The FBI | AF153: Movie [The Movie]: Two-Lane Blacktop (1971) | AJ153: The 10 O'Clock News | AL153: Flash Gordon; [11:20] Movie [Movie 12]: Sheriff of Cimarron (1945) | AX153: =AX152+7 -> 27436
A154: =A153+7 -> 27443 | F154: Government Story | G154: The Flintstones | H154: Cartoon Castle | I154: Petticoat Junction | J154: Celebrity Sweepstakes (NBC) | K154: Nanny and the Professor | L154: Now You See It (CBS) | M154: Bold Ones | O154: Search for Tomorrow (CBS) | P154: How to Survive a Marriage (NBC) | Q154: Movie [Matinee 12]: The Vikings (1958) | V154: Gomer Pyle, USMC | W154: Batman | X154: Ramblin' Rod | Y154: I Dream of Jeannie | Z154: The Mod Squad | AB154: Star Trek | AD154: The FBI | AF154: Movie [The Movie]: The Hired Hand (1971) | AJ154: The 10 O'Clock News | AL154: Flash Gordon; [11:20] Movie [Movie 12]: Neutron vs. the Amazing Dr Caronte (1960) | AX154: =AX153+7 -> 27443
A155: =A154+7 -> 27450 | F155: Government Story | G155: The Flintstones | H155: Cartoon Castle | I155: Petticoat Junction | J155: Celebrity Sweepstakes (NBC) | K155: Nanny and the Professor | L155: Now You See It (CBS) | M155: Bold Ones | O155: Search for Tomorrow (CBS) | P155: How to Survive a Marriage (NBC) | Q155: Movie [Matinee 12]: Away All Boats (1956) | V155: Gomer Pyle, USMC | W155: Batman | X155: Ramblin' Rod | Y155: I Dream of Jeannie | Z155: The Mod Squad | AB155: Star Trek | AD155: The FBI | AF155: Movie [The Movie]: Bunny Lake is Missing (1965) | AJ155: The 10 O'Clock News | AL155: Flash Gordon; [11:20] Movie [Movie 12]: Swamp Fire (1946) | AX155: =AX154+7 -> 27450
A156: =A155+7 -> 27457 | F156: Government Story | G156: The Flintstones | H156: Cartoon Castle | I156: Petticoat Junction | J156: Celebrity Sweepstakes (NBC) | K156: Nanny and the Professor | L156: Now You See It (CBS) | M156: Bold Ones | O156: Search for Tomorrow (CBS) | P156: How to Survive a Marriage (NBC) | Q156: Movie [Matinee 12]: Father Goose (1964) | V156: Gomer Pyle, USMC | W156: Batman | X156: Ramblin' Rod | Y156: The Mickey Mouse Club | Z156: The Mod Squad | AB156: Star Trek | AD156: The FBI | AF156: Movie [The Movie]: The Mating Season (1951) | AJ156: The 10 O'Clock News | AL156: Flash Gordon; [11:20] Movie [Movie 12]: The Jazz Singer (1927) | AX156: =AX155+7 -> 27457
A157: =A156+7 -> 27464 | F157: Government Story | G157: The Flintstones | H157: Cartoon Castle | I157: Petticoat Junction | J157: Celebrity Sweepstakes (NBC) | K157: Nanny and the Professor | L157: Now You See It (CBS) | M157: Sarge (Bold Ones) | O157: Search for Tomorrow (CBS) | P157: How to Survive a Marriage (NBC) | Q157: Movie [Matinee 12]: TBA | V157: Gomer Pyle, USMC | W157: Batman | X157: Ramblin' Rod | Y157: The Mickey Mouse Club | Z157: The Mod Squad | AB157: Star Trek | AD157: The FBI | AF157: Sammy Davis Jr. | AH157: Billy Graham Crusade | AJ157: The 10 O'Clock News | AL157: Flash Gordon; [11:20] Movie [Movie 12]: Hollywood Canteen (1944) | AX157: =AX156+7 -> 27464
A158: =A157+7 -> 27471 | F158: Government Story | G158: The Flintstones | H158: Cartoon Castle | I158: Petticoat Junction | J158: Celebrity Sweepstakes (NBC) | K158: Nanny and the Professor | L158: Now You See It (CBS) | M158: Sarge (Bold Ones) | O158: Search for Tomorrow (CBS) | P158: How to Survive a Marriage (NBC) | Q158: Movie [Matinee 12]: Pal Joey (1957) | V158: Gomer Pyle, USMC | W158: Batman | X158: Ramblin' Rod | Y158: The Mickey Mouse Club | Z158: The Mod Squad | AB158: Star Trek | AD158: The FBI | AF158: Movie [The Movie]: The Truth About Spring (1965) | AJ158: The 10 O'Clock News | AL158: Flash Gordon; [11:20] Movie [Movie 12]: Devil Dogs of the Air (1935) | AX158: =AX157+7 -> 27471
A159: =A158+7 -> 27478 | F159: Government Story | G159: The Flintstones | H159: Cartoon Castle | I159: Petticoat Junction | J159: Celebrity Sweepstakes (NBC) | K159: Nanny and the Professor | L159: Now You See It (CBS) | M159: Sarge (Bold Ones) | O159: Search for Tomorrow (CBS) | P159: How to Survive a Marriage (NBC) | Q159: Movie [Matinee 12]: Two Rode Together (1961) | V159: Gomer Pyle, USMC | W159: Batman | X159: Ramblin' Rod | Y159: The Mickey Mouse Club | Z159: The Mod Squad | AB159: Star Trek | AD159: The FBI | AF159: Movie [The Movie]: A Matter of Innocence (1967) | AJ159: The 10 O'Clock News | AL159: Flash Gordon; [11:20] Movie [Movie 12]: The Great Man Votes (1939) | AX159: =AX158+7 -> 27478
A160: =A159+7 -> 27485 | F160: Government Story | G160: The Flintstones | H160: Cartoon Castle | I160: Petticoat Junction | J160: Celebrity Sweepstakes (NBC) | K160: Nanny and the Professor | L160: Now You See It (CBS) | M160: Bold Ones | O160: Search for Tomorrow (CBS) | P160: How to Survive a Marriage (NBC) | Q160: Movie [Matinee 12]: Woman of Straw (1964) | V160: Gomer Pyle, USMC | W160: Batman | X160: Ramblin' Rod | Y160: The Mickey Mouse Club | Z160: The Mod Squad | AB160: Star Trek | AD160: The FBI | AF160: Movie [The Movie]: Interlude (1957) | AJ160: The 10 O'Clock News | AL160: Flash Gordon; [11:20] Movie [Movie 12]: Captured (1933) | AX160: =AX159+7 -> 27485
A161: =A160+7 -> 27492 | F161: Government Story | G161: The Flintstones | H161: Cartoon Castle | I161: Petticoat Junction | J161: Celebrity Sweepstakes (NBC) | K161: Nanny and the Professor | L161: Now You See It (CBS) | M161: Bold Ones | O161: Search for Tomorrow (CBS) | P161: How to Survive a Marriage (NBC) | Q161: Movie [Matinee 12]: Adventures of Don Juan (1948) | V161: Gomer Pyle, USMC | W161: Batman | X161: Ramblin' Rod | Y161: The Mickey Mouse Club | Z161: The Mod Squad | AB161: Star Trek | AD161: The FBI | AF161: Movie [The Movie]: Magnificent Thief (1967) | AJ161: The 10 O'Clock News | AL161: Flash Gordon; [11:20] Movie [Movie 12]: The Dawn Patrol (1938) | AX161: =AX160+7 -> 27492
A162: =A161+7 -> 27499 | F162: Government Story | G162: The Flintstones | H162: Cartoon Castle | I162: Petticoat Junction | J162: Celebrity Sweepstakes (NBC) | K162: Nanny and the Professor | L162: Now You See It (CBS) | M162: Bold Ones | O162: Search for Tomorrow (CBS) | P162: How to Survive a Marriage (NBC) | Q162: Movie [Matinee 12]: Marnie (1964) | V162: Gomer Pyle, USMC | W162: Batman | X162: Ramblin' Rod | Y162: The Mickey Mouse Club | Z162: The Mod Squad | AB162: Star Trek | AD162: The FBI | AF162: Movie [The Movie]: The Second Greatest Sex (1955) | AJ162: The 10 O'Clock News | AL162: Night Gallery | AM162: College Basketball All-Star Game | AX162: =AX161+7 -> 27499
A163: =A162+7 -> 27506 | F163: Government Story | G163: The Flintstones | H163: Cartoon Castle | J163: Celebrity Sweepstakes (NBC) | K163: Pat Boone and the Little Ones | L163: Now You See It (CBS) | M163: Mister Ed | N163: I Dream of Jeannie | O163: Search for Tomorrow (CBS) | P163: Perry Mason | R163: Movie [Matinee 12]: The Lady Gambles (1949) | V163: Gomer Pyle, USMC | W163: Gentle Ben | X163: Ramblin' Rod | Y163: The Mickey Mouse Club | Z163: The Mod Squad | AB163: Star Trek | AD163: The FBI | AF163: Movie [The Movie]: Three for the Show (1955) | AJ163: The 10 O'Clock News | AL163: Flash Gordon; [11:20] Movie [Movie 12]: Morning Glory (1933) | AX163: =AX162+7 -> 27506
A164: =A163+7 -> 27513 | F164: Government Story | G164: The Flintstones | H164: Cartoon Castle | J164: Celebrity Sweepstakes (NBC) | K164: Petticoat Junction | L164: Now You See It (CBS) | M164: Mister Ed | N164: I Dream of Jeannie | O164: Search for Tomorrow (CBS) | P164: Perry Mason | R164: Movie [Matinee 12]: Marty (1955) | V164: Gomer Pyle, USMC | W164: Gentle Ben | X164: Ramblin' Rod | Y164: The Mickey Mouse Club | Z164: The Mod Squad | AB164: Star Trek | AD164: The FBI | AF164: Movie [The Movie]: The Neon Ceiling (1971) | AJ164: The 10 O'Clock News | AL164: Flash Gordon; [11:20] Movie [Movie 12]: A Girl in Every Port (1951) | AX164: =AX163+7 -> 27513
A165: =A164+7 -> 27520 | F165: Government Story | G165: The Flintstones | H165: Cartoon Castle | J165: Celebrity Sweepstakes (NBC) | K165: Petticoat Junction | L165: Now You See It (CBS) | M165: Mister Ed | N165: I Dream of Jeannie | O165: Search for Tomorrow (CBS) | P165: Perry Mason | R165: Movie [Matinee 12]: Cowboy (1958) | V165: Gomer Pyle, USMC | W165: Gentle Ben | X165: Ramblin' Rod | Y165: The Mickey Mouse Club | Z165: The Mod Squad | AB165: Star Trek | AD165: The FBI | AF165: Movie [The Movie]: The Toy Tiger (1956) | AJ165: The 10 O'Clock News | AL165: Flash Gordon; [11:20] Movie [Movie 12]: Bring 'Em Back Alive (1932) | AX165: =AX164+7 -> 27520
A166: =A165+7 -> 27527 | F166: Government Story | G166: The Flintstones | H166: Cartoon Castle | J166: Celebrity Sweepstakes (NBC) | K166: Petticoat Junction | L166: Now You See It (CBS) | M166: Mister Ed | N166: I Dream of Jeannie | O166: Search for Tomorrow (CBS) | P166: Perry Mason | R166: Movie [Matinee 12]: The Web (1947) | V166: Gomer Pyle, USMC | W166: Gentle Ben | X166: Ramblin' Rod | Y166: The Mickey Mouse Club | Z166: The Mod Squad | AB166: Star Trek | AD166: The FBI | AF166: Movie [The Movie]: Night Passage (1957) | AJ166: The 10 O'Clock News | AL166: Flash Gordon; [11:20] Movie [Movie 12]: Disraeli (1929) | AX166: =AX165+7 -> 27527
A167: =A166+7 -> 27534 | F167: Government Story | G167: The Flintstones | H167: Cartoon Castle | J167: Celebrity Sweepstakes (NBC) | K167: Petticoat Junction | L167: Now You See It (CBS) | M167: Mister Ed | N167: I Dream of Jeannie | O167: Search for Tomorrow (CBS) | P167: Perry Mason | R167: Movie [Matinee 12]: Beat the Devil (1953) | V167: Gomer Pyle, USMC | W167: Gentle Ben | X167: Ramblin' Rod | Y167: The Mickey Mouse Club | Z167: The Mod Squad | AB167: Star Trek | AD167: The FBI | AF167: Movie [The Movie]: Walk the Proud Land (1956) | AJ167: The 10 O'Clock News | AL167: Flash Gordon; [11:20] Movie [Movie 12]: Sinbad the Sailor (1946) | AX167: =AX166+7 -> 27534
A168: =A167+7 -> 27541 | F168: Government Story | G168: The Flintstones | H168: Cartoon Castle | J168: Celebrity Sweepstakes (NBC) | K168: Petticoat Junction | L168: Now You See It (CBS) | M168: Mister Ed | N168: I Dream of Jeannie | O168: Search for Tomorrow (CBS) | P168: Perry Mason | R168: Movie [Matinee 12]: Kelly and Me (1957) | V168: Gomer Pyle, USMC | W168: Gentle Ben | X168: Ramblin' Rod | Y168: The Mickey Mouse Club | Z168: The Mod Squad | AB168: Star Trek | AD168: The FBI | AF168: Movie [The Movie]: Captain Lightfoot (1955) | AJ168: The 10 O'Clock News | AL168: Flash Gordon; [11:20] Movie [Movie 12]: Confessions of a Nazi Spy (1939) | AX168: =AX167+7 -> 27541
A169: =A168+7 -> 27548 | F169: Government Story | G169: The Flintstones | H169: Cartoon Castle | J169: Celebrity Sweepstakes (NBC) | K169: Petticoat Junction | L169: Now You See It (CBS) | M169: Mister Ed | N169: I Dream of Jeannie | O169: Search for Tomorrow (CBS) | P169: Perry Mason | R169: Movie [Matinee 12]: Pittsburgh (1942) | V169: Gomer Pyle, USMC | W169: Batman | X169: Ramblin' Rod | Y169: The Mickey Mouse Club | Z169: The Mod Squad | AB169: Star Trek | AD169: Billy Graham Crusade | AF169: Movie [The Movie]: Sarge: the Badge or the Cross (1971) | AJ169: The 10 O'Clock News | AL169: It Takes a Thief | AN169: The Sixth Sense (Night Gallery) | AX169: =AX168+7 -> 27548
A170: =A169+7 -> 27555 | F170: Government Story | G170: The Flintstones | H170: Cartoon Castle | J170: Celebrity Sweepstakes (NBC) | K170: Petticoat Junction | L170: Now You See It (CBS) | M170: Mister Ed | N170: I Dream of Jeannie | O170: Search for Tomorrow (CBS) | P170: Perry Mason | R170: Movie [Matinee 12]: Woman in Hiding (1949) | V170: Gomer Pyle, USMC | W170: Batman | X170: Ramblin' Rod | Y170: The Mickey Mouse Club | Z170: The Mod Squad | AB170: Star Trek | AD170: The FBI | AF170: Movie [The Movie]: The Black Orchid (1959) | AJ170: The 10 O'Clock News | AL170: It Takes a Thief | AN170: The Sixth Sense (Night Gallery) | AX170: =AX169+7 -> 27555
A171: =A170+7 -> 27562 | F171: Government Story | G171: The Flintstones | H171: Cartoon Castle | J171: Celebrity Sweepstakes (NBC) | K171: Petticoat Junction | L171: Tattletales (CBS) | M171: Mister Ed | N171: I Dream of Jeannie | O171: Search for Tomorrow (CBS) | P171: Perry Mason | R171: Movie [Matinee 12]: The Lady from Cheyenne (1941) | V171: Gomer Pyle, USMC | W171: Batman | X171: Ramblin' Rod | Y171: The Mickey Mouse Club | Z171: The Mod Squad | AB171: Star Trek | AD171: The FBI | AF171: Movie [The Movie]: Omar Khayyam (1957) | AJ171: The 10 O'Clock News | AL171: It Takes a Thief | AN171: The Sixth Sense (Night Gallery) | AX171: =AX170+7 -> 27562
A172: =A171+7 -> 27569 | F172: Government Story | G172: The Flintstones | H172: Cartoon Castle | J172: Celebrity Sweepstakes (NBC) | K172: Petticoat Junction | L172: Tattletales (CBS) | M172: Mister Ed | N172: I Dream of Jeannie | O172: Search for Tomorrow (CBS) | P172: Perry Mason | R172: Movie [Matinee 12]: Louisa (1950) | V172: Land of the Giants | X172: Ramblin' Rod | Y172: The Mickey Mouse Club | Z172: The Mod Squad | AB172: Star Trek | AD172: The FBI | AF172: Movie [The Movie]: Requiem for a Heavyweight (1962) | AJ172: The 10 O'Clock News--Michael Hartfield/Sylvia Stinson | AL172: It Takes a Thief | AN172: Night Gallery | AX172: =AX171+7 -> 27569
A173: =A172+7 -> 27576 | F173: Government Story | G173: The Flintstones | H173: Cartoon Castle | J173: Celebrity Sweepstakes (NBC) | K173: Petticoat Junction | L173: Tattletales (CBS) | M173: Mister Ed | N173: I Dream of Jeannie | O173: Search for Tomorrow (CBS) | P173: Perry Mason | R173: Movie [Matinee 12]: It Happened to Jane (1959) | V173: Land of the Giants | X173: Ramblin' Rod | Y173: The Mickey Mouse Club | Z173: The Mod Squad | AB173: Star Trek | AD173: The FBI | AF173: Movie [The Movie]: Phantom of the Opera (1943) | AJ173: The 10 O'Clock News--Michael Hartfield/Sylvia Stinson | AL173: It Takes a Thief | AN173: Night Gallery | AX173: =AX172+7 -> 27576
A174: =A173+7 -> 27583 | F174: Government Story | G174: The Flintstones | H174: Cartoon Castle | J174: Celebrity Sweepstakes (NBC) | K174: Petticoat Junction | L174: Tattletales (CBS) | M174: Mister Ed | N174: Safari to Adventure | O174: Search for Tomorrow (CBS) | P174: Perry Mason | R174: Movie [Matinee 12]: East of Sudan (1964) | V174: Land of the Giants | X174: Ramblin' Rod | Y174: The Mickey Mouse Club | Z174: Mission: Impossible | AB174: Star Trek | AD174: The FBI | AF174: Movie [The Movie]: Voice in the Mirror (1958) | AJ174: The 10 O'Clock News--Michael Hartfield/Sylvia Stinson | AL174: It Takes a Thief | AN174: The Sixth Sense (Night Gallery) | AX174: =AX173+7 -> 27583
A175: =A174+7 -> 27590 | F175: Government Story | G175: Cartoon Castle | I175: Nanny and the Professor | J175: Celebrity Sweepstakes (NBC) | K175: Audubon Wildlife Theatre | L175: Tattletales (CBS) | M175: Gomer Pyle, USMC | N175: Safari to Adventure | O175: Search for Tomorrow (CBS) | P175: Perry Mason | R175: Movie [Matinee 12]: Wild and Wonderful (1964) | V175: Land of the Giants | X175: Ramblin' Rod | Y175: The Mickey Mouse Club | Z175: Mission: Impossible | AB175: Star Trek | AD175: The FBI | AF175: Movie [The Movie]: Another Time, Another Place (1958) | AJ175: The 10 O'Clock News--Michael Hartfield/Sylvia Stinson | AL175: It Takes a Thief | AN175: The Sixth Sense (Night Gallery) | AX175: =AX174+7 -> 27590
A176: =A175+7 -> 27597 | F176: Government Story | G176: Cartoon Castle | I176: Nanny and the Professor | J176: Celebrity Sweepstakes (NBC) | K176: Audubon Wildlife Theatre | L176: Tattletales (CBS) | M176: Gomer Pyle, USMC | N176: Safari to Adventure | O176: Search for Tomorrow (CBS) | P176: Perry Mason | R176: Movie [Matinee 12]: When Lovers Meet (1946) | V176: Land of the Giants | X176: Ramblin' Rod | Y176: The Mickey Mouse Club | Z176: Mission: Impossible | AB176: Star Trek | AD176: The FBI | AF176: Movie [The Movie]: The Happening (1967) | AJ176: The 10 O'Clock News--Michael Hartfield/Sylvia Stinson | AL176: It Takes a Thief | AN176: Night Gallery | AX176: =AX175+7 -> 27597
A177: =A176+7 -> 27604 | F177: Government Story | G177: Cartoon Castle | I177: Nanny and the Professor | J177: Celebrity Sweepstakes (NBC) | K177: Audubon Wildlife Theatre | L177: Tattletales (CBS) | M177: Gomer Pyle, USMC | N177: Safari to Adventure | O177: Search for Tomorrow (CBS) | P177: Perry Mason | R177: Movie [Matinee 12]: Temptation (1946) | V177: Land of the Giants | X177: Ramblin' Rod | Y177: The Mickey Mouse Club | Z177: Mission: Impossible | AB177: Star Trek | AD177: The FBI | AF177: Burt Bacharach Opus No. 3 | AH177: Pop! Goes the Country | AI177: Bobby Goldsboro | AJ177: The 10 O'Clock News--Michael Hartfield/Sylvia Stinson | AL177: It Takes a Thief | AN177: Night Gallery | AX177: =AX176+7 -> 27604
A178: =A177+7 -> 27611 | F178: Government Story | G178: Cartoon Castle | I178: Nanny and the Professor | J178: Celebrity Sweepstakes (NBC) | K178: Audubon Wildlife Theatre | L178: Tattletales (CBS) | M178: Gomer Pyle, USMC | N178: Safari to Adventure | O178: Search for Tomorrow (CBS) | P178: Perry Mason | R178: Movie [Matinee 12]: Four Girls in Town (1956) | V178: Land of the Giants | X178: Ramblin' Rod | Y178: The Mickey Mouse Club | Z178: Mission: Impossible | AB178: Star Trek | AD178: The FBI | AF178: Movie [The Movie]: The Naked Jungle (1957) | AJ178: The 10 O'Clock News--Michael Hartfield/Sylvia Stinson | AL178: It Takes a Thief | AN178: Night Gallery | AX178: =AX177+7 -> 27611
A179: =A178+7 -> 27618 | F179: Government Story | G179: Cartoon Castle | I179: Nanny and the Professor | J179: Celebrity Sweepstakes (NBC) | K179: Audubon Wildlife Theatre | L179: Tattletales (CBS) | M179: Gomer Pyle, USMC | N179: Safari to Adventure | O179: Search for Tomorrow (CBS) | P179: Perry Mason | R179: Movie [Matinee 12]: Love and Kisses (1965) | V179: Land of the Giants | X179: Ramblin' Rod | Y179: The Mickey Mouse Club | Z179: Mission: Impossible | AB179: Star Trek | AD179: The FBI | AF179: Movie [The Movie]: Siege of the Saxons (1963) | AJ179: The 10 O'Clock News--Michael Hartfield/Sylvia Stinson | AL179: It Takes a Thief | AN179: Night Gallery | AX179: =AX178+7 -> 27618
A180: =A179+7 -> 27625 | F180: Government Story | G180: Cartoon Castle | I180: Nanny and the Professor | J180: Petticoat Junction | K180: Movie [The Morning Movie]: The Big Wheel (1949) | O180: Search for Tomorrow (CBS) | P180: Perry Mason | R180: Movie [Matinee 12]: Denver & Rio Grande (1952) | V180: Land of the Giants | X180: Ramblin' Rod | Y180: The Mickey Mouse Club | Z180: Mission: Impossible | AB180: Star Trek | AD180: The FBI | AF180: Movie [The Movie]: Theodora Goes Wild (1936) | AJ180: The 10 O'Clock News--Michael Hartfield/Sylvia Stinson | AL180: It Takes a Thief | AN180: The Sixth Sense (Night Gallery) | AX180: =AX179+7 -> 27625
A181: =A180+7 -> 27632 | F181: Government Story | G181: Cartoon Castle | I181: Nanny and the Professor | J181: Petticoat Junction | K181: Movie [The Morning Movie]: Never Say Goodbye (1946) | O181: Search for Tomorrow (CBS) | P181: Perry Mason | R181: Movie [Matinee 12]: City Beneath the Sea (1953) | V181: I Dream of Jeannie | W181: Speed Racer | X181: Ramblin' Rod | Y181: The Mickey Mouse Club | Z181: Mission: Impossible | AB181: Star Trek | AD181: The FBI | AF181: Movie [The Movie]: The Priest Killer (1971) | AJ181: The 10 O'Clock News--Michael Hartfield/Sylvia Stinson | AL181: It Takes a Thief | AN181: Night Gallery | AX181: =AX180+7 -> 27632
A182: =A181+7 -> 27639 | F182: Government Story | G182: Cartoon Castle | I182: Nanny and the Professor | J182: Petticoat Junction | K182: Movie [The Morning Movie]: Raw Wind in Eden (1958) | O182: Search for Tomorrow (CBS) | P182: Perry Mason | R182: Movie [Matinee 12]: Joe Butterfly (1957) | V182: I Dream of Jeannie | W182: Speed Racer | X182: Ramblin' Rod | Y182: The Mickey Mouse Club | Z182: Mission: Impossible | AB182: Star Trek | AD182: Billy Graham Crusade | AF182: Movie [The Movie]: The Prince Who Was a Thief (1951) | AJ182: The 10 O'Clock News--Michael Hartfield/Sylvia Stinson | AL182: It Takes a Thief | AN182: Night Gallery | AX182: =AX181+7 -> 27639
A183: =A182+7 -> 27646 | F183: Government Story | G183: Ramblin' Rod | I183: Gomer Pyle, USMC | J183: Petticoat Junction | K183: Movie [The Morning Movie]: The Toy Tiger (1956) | O183: Search for Tomorrow (CBS) | P183: Perry Mason | R183: Movie [Matinee 12]: Psyche '59 (1964) | V183: I Dream of Jeannie | W183: Speed Racer | X183: The Flintstones | Y183: The Mickey Mouse Club | Z183: The Courtship of Eddie's Father | AA183: Room 222 | AB183: Adam-12 | AC183: Adam-12 | AD183: The FBI | AF183: Movie [The Movie]: I Love a Mystery (1966) | AJ183: The 10 O'Clock News | AL183: Mission: Impossible | AX183: =AX182+7 -> 27646
A184: =A183+7 -> 27653 | F184: Government Story | G184: Ramblin' Rod | I184: Gomer Pyle, USMC | J184: Petticoat Junction | K184: Movie [The Morning Movie]: All Quiet on the Western Front (1930) | O184: Search for Tomorrow (CBS) | P184: Perry Mason | R184: Movie [Matinee 12]: It Grows on Trees (1952) | V184: I Dream of Jeannie | W184: Speed Racer | X184: The Flintstones | Y184: The Mickey Mouse Club | Z184: The Courtship of Eddie's Father | AA184: Room 222 | AB184: Adam-12 | AC184: Adam-12 | AD184: The FBI | AF184: Movie [The Movie]: Houseboat (1958) | AJ184: The 10 O'Clock News | AL184: Mission: Impossible | AX184: =AX183+7 -> 27653
A185: =A184+7 -> 27660 | F185: Government Story | G185: Ramblin' Rod | I185: Gomer Pyle, USMC | J185: Petticoat Junction | K185: Movie [The Morning Movie]: The Midnight Story (1957) | O185: Search for Tomorrow (CBS) | P185: Perry Mason | R185: Movie [Matinee 12]: The Thief (1952) | V185: I Dream of Jeannie | W185: Speed Racer | X185: The Flintstones | Y185: The Mickey Mouse Club | Z185: The Courtship of Eddie's Father | AA185: Room 222 | AB185: Adam-12 | AC185: Adam-12 | AD185: The FBI | AF185: Movie [The Movie]: Midnight Lace (1960) | AJ185: The 10 O'Clock News | AL185: Mission: Impossible | AX185: =AX184+7 -> 27660
A186: =A185+7 -> 27667 | F186: Government Story | G186: Ramblin' Rod | I186: Gomer Pyle, USMC | J186: Petticoat Junction | K186: Movie [The Morning Movie]: Back Street (1941) | O186: Search for Tomorrow (CBS) | P186: Perry Mason | R186: Movie [Matinee 12]: Pittsburgh (1942) | V186: I Dream of Jeannie | W186: Speed Racer | X186: The Flintstones | Y186: The Mickey Mouse Club | Z186: The Courtship of Eddie's Father | AA186: Room 222 | AB186: Adam-12 | AC186: Adam-12 | AD186: The FBI | AF186: Movie [The Movie]: Escape to Mindanao (1968) | AJ186: The 10 O'Clock News | AL186: Mission: Impossible | AX186: =AX185+7 -> 27667
A187: =A186+7 -> 27674 | F187: Government Story | G187: Ramblin' Rod | I187: Gomer Pyle, USMC | J187: Petticoat Junction | K187: Movie [The Morning Movie]: Buccaneer's Girl (1950) | N187: Not for Women Only | O187: Search for Tomorrow (CBS) | P187: Perry Mason | R187: Movie [Matinee 12]: Forbidden (1953) | V187: I Dream of Jeannie | W187: Speed Racer | X187: The Flintstones | Y187: The Mickey Mouse Club | Z187: The Courtship of Eddie's Father | AA187: Room 222 | AB187: Adam-12 | AC187: Adam-12 | AD187: The FBI | AF187: Movie [The Movie]: After the Fox (1966) | AJ187: The 10 O'Clock News | AL187: Mission: Impossible | AX187: =AX186+7 -> 27674
A188: =A187+7 -> 27681 | F188: Government Story | G188: Ramblin' Rod | I188: Gomer Pyle, USMC | J188: Petticoat Junction | K188: Movie [The Morning Movie]: The Golden Horde (1951) | N188: Not for Women Only | O188: Search for Tomorrow (CBS) | P188: Perry Mason | R188: Movie [Matinee 12]: The Impatient Heart (1971) | V188: I Dream of Jeannie | W188: Speed Racer | X188: The Flintstones | Y188: The Mickey Mouse Club | Z188: The Courtship of Eddie's Father | AA188: Room 222 | AB188: Adam-12 | AC188: Adam-12 | AD188: The FBI | AF188: Movie [The Movie]: San Francisco International Airport (1970) | AJ188: The 10 O'Clock News | AL188: Mission: Impossible | AX188: =AX187+7 -> 27681
A189: =A188+7 -> 27688 | F189: Government Story | G189: Ramblin' Rod | I189: Gomer Pyle, USMC | J189: Petticoat Junction | K189: Movie [The Morning Movie]: The Saga of Hemp Brown (1958) | N189: Not for Women Only | O189: Search for Tomorrow (CBS) | P189: Perry Mason | R189: Movie [Matinee 12]: Magic Carpet (1972) | V189: I Dream of Jeannie | W189: Speed Racer | X189: The Flintstones | Y189: The Mickey Mouse Club | Z189: The Courtship of Eddie's Father | AA189: Room 222 | AB189: Adam-12 | AC189: Adam-12 | AD189: The FBI | AF189: Movie [The Movie]: Drive Hard, Drive Fast (1969) | AJ189: The 10 O'Clock News | AL189: Mission: Impossible | AX189: =AX188+7 -> 27688
A190: =A189+7 -> 27695 | F190: Government Story | G190: Ramblin' Rod | I190: Gomer Pyle, USMC | J190: Petticoat Junction | K190: Movie [The Morning Movie]: Taza, Son of Cochise (1954) | N190: Not for Women Only | O190: Search for Tomorrow (CBS) | P190: Perry Mason | R190: Movie [Matinee 12]: A Woman's Vengeance (1948) | V190: I Dream of Jeannie | W190: Speed Racer | X190: The Flintstones | Y190: The Mickey Mouse Club | Z190: The Courtship of Eddie's Father | AA190: Room 222 | AB190: Adam-12 | AC190: Adam-12 | AD190: The FBI | AF190: Movie [The Movie]: The Egg and I (1947) | AJ190: The 10 O'Clock News | AL190: Mission: Impossible | AN190: Night Gallery | AX190: =AX189+7 -> 27695
A191: =A190+7 -> 27702 | F191: Government Story | G191: Ramblin' Rod | I191: Gomer Pyle, USMC | J191: Petticoat Junction | K191: Movie [The Morning Movie]: The Redhead from Wyoming (1952) | N191: Not for Women Only | O191: Search for Tomorrow (CBS) | P191: Perry Mason | R191: Movie [Matinee 12]: The Tattered Dress (1957) | V191: I Dream of Jeannie | W191: Speed Racer | X191: The Flintstones | Y191: The Mickey Mouse Club | Z191: The Courtship of Eddie's Father | AA191: Room 222 | AB191: Adam-12 | AC191: Adam-12 | AD191: The FBI | AF191: Movie [The Movie]: King of the Khyber Rifles (1954) | AJ191: The 10 O'Clock News | AL191: Mission: Impossible | AN191: Night Gallery | AX191: =AX190+7 -> 27702
A192: =A191+7 -> 27709 | F192: Government Story | G192: Ramblin' Rod | I192: Gomer Pyle, USMC | J192: Petticoat Junction | K192: Movie [The Morning Movie]: Back to God's Country (1953) | N192: Not for Women Only | O192: Search for Tomorrow (CBS) | P192: Perry Mason | R192: Movie [Matinee 12]: Another Time, Another Place (1958) | V192: I Dream of Jeannie | W192: Speed Racer | X192: The Flintstones | Y192: The Mickey Mouse Club | Z192: The Courtship of Eddie's Father | AA192: Room 222 | AB192: Adam-12 | AC192: Adam-12 | AD192: The FBI | AF192: Movie [The Movie]: The Rains of Ranchipur (1955) | AJ192: The 10 O'Clock News | AL192: Mission: Impossible | AN192: The Sixth Sense (Night Gallery) | AX192: =AX191+7 -> 27709
A193: =A192+7 -> 27716 | F193: Government Story | G193: Ramblin' Rod | I193: Gomer Pyle, USMC | J193: Petticoat Junction | K193: Movie [The Morning Movie]: Star in the Dust (1956) | N193: Not for Women Only | O193: Search for Tomorrow (CBS) | P193: Perry Mason | R193: Movie [Matinee 12]: Posse from Hell (1961) | V193: I Dream of Jeannie | W193: Speed Racer | X193: The Flintstones | Y193: The Mickey Mouse Club | Z193: The Courtship of Eddie's Father | AA193: Room 222 | AB193: Adam-12 | AC193: Adam-12 | AD193: The FBI | AF193: Movie [The Movie]: Beneath the 12-Mile Reef (1953) | AJ193: The 10 O'Clock News | AL193: Mission: Impossible | AN193: The Persuaders | AX193: =AX192+7 -> 27716
A194: =A193+7 -> 27723 | F194: Government Story | G194: Ramblin' Rod | I194: Gomer Pyle, USMC | J194: Petticoat Junction | K194: Movie [The Morning Movie]: Showdown at Abilene (1956) | N194: Not for Women Only | O194: Search for Tomorrow (CBS) | P194: Perry Mason | R194: Movie [Matinee 12]: Up Front (1951) | V194: I Dream of Jeannie | W194: Speed Racer | X194: The Flintstones | Y194: The Mickey Mouse Club | Z194: The Courtship of Eddie's Father | AA194: Room 222 | AB194: Adam-12 | AC194: Adam-12 | AD194: The FBI | AF194: Movie [The Movie]: Black Widow (1954) | AJ194: The 10 O'Clock News | AL194: Mission: Impossible | AN194: The Persuaders | AX194: =AX193+7 -> 27723
A195: =A194+7 -> 27730 | F195: Government Story | G195: Ramblin' Rod | I195: Gomer Pyle, USMC | J195: Petticoat Junction | K195: Movie [The Morning Movie]: Man in the Shadow (1957) | N195: Not for Women Only | O195: Search for Tomorrow (CBS) | P195: Perry Mason | R195: Movie [Matinee 12]: The Raging Tide (1951) | V195: I Dream of Jeannie | W195: Speed Racer | X195: The Flintstones | Y195: The Mickey Mouse Club | Z195: The Courtship of Eddie's Father | AA195: Room 222 | AB195: Adam-12 | AC195: Adam-12 | AD195: The FBI | AF195: Movie [The Movie]: Asylum for a Spy (1967) | AJ195: The 10 O'Clock News | AL195: Mission: Impossible | AN195: The Persuaders | AX195: =AX194+7 -> 27730
A196: =A195+7 -> 27737 | F196: Government Story | G196: Ramblin' Rod | I196: Gomer Pyle, USMC | J196: Petticoat Junction | K196: Movie [The Morning Movie]: Wings of the Hawk (1953) | N196: Not for Women Only | O196: Search for Tomorrow (CBS) | P196: Perry Mason | R196: Movie [Matinee 12]: The Mountain Road (1960) | V196: I Dream of Jeannie | W196: Speed Racer | X196: The Flintstones | Y196: The Mickey Mouse Club | Z196: The Courtship of Eddie's Father | AA196: Room 222 | AB196: Adam-12 | AC196: Adam-12 | AD196: The FBI | AF196: Movie [The Movie]: One Desire (1955) | AJ196: The 10 O'Clock News | AL196: Mission: Impossible | AN196: The Persuaders | AX196: =AX195+7 -> 27737
A197: =A196+7 -> 27744 | F197: Government Story | G197: Ramblin' Rod | I197: Gomer Pyle, USMC | J197: Petticoat Junction | K197: Movie [The Morning Movie]: Day of the Badman (1958) | N197: Not for Women Only | O197: Search for Tomorrow (CBS) | P197: Perry Mason | R197: Movie [Matinee 12]: Because of You (1952) | V197: I Dream of Jeannie | W197: Speed Racer | X197: The Flintstones | Y197: The Mickey Mouse Club | Z197: The Courtship of Eddie's Father | AA197: Room 222 | AB197: Adam-12 | AC197: Adam-12 | AD197: The FBI | AF197: Movie [The Movie]: Town Tamer (1965) | AJ197: The 10 O'Clock News | AL197: Mission: Impossible | AN197: The Persuaders | AX197: =AX196+7 -> 27744
A198: =A197+7 -> 27751 | F198: Government Story | G198: Ramblin' Rod | I198: Gomer Pyle, USMC | J198: Petticoat Junction | K198: Movie [The Morning Movie]: The Suspect (1944) | N198: Not for Women Only | O198: Search for Tomorrow (CBS) | P198: Perry Mason | R198: Movie [Matinee 12]: The Runaround (1946) | V198: I Dream of Jeannie | W198: Speed Racer | X198: The Flintstones | Y198: The Mickey Mouse Club | Z198: The Courtship of Eddie's Father | AA198: Room 222 | AB198: Adam-12 | AC198: Adam-12 | AD198: The FBI | AF198: Movie [The Movie]: Fraulein (1958) | AJ198: The 10 O'Clock News | AL198: Mission: Impossible | AN198: The Persuaders | AX198: =AX197+7 -> 27751
A199: =A198+7 -> 27758 | F199: Government Story | G199: Ramblin' Rod | I199: Gomer Pyle, USMC | J199: Petticoat Junction | K199: Movie [The Morning Movie]: Ride Clear of Diablo (1954) | N199: Not for Women Only | O199: Search for Tomorrow (CBS) | P199: Perry Mason | R199: Movie [Matinee 12]: The Prince Who Was a Thief (1951) | V199: I Dream of Jeannie | W199: Speed Racer | X199: The Flintstones | Y199: The Mickey Mouse Club | Z199: The Courtship of Eddie's Father | AA199: Room 222 | AB199: Adam-12 | AC199: Adam-12 | AD199: College Basketball: Consolation Game of the Far West Classic from Portland, Oregon | AH199: College Basketball: Championship Game of the Far West Classic from Portland, Oregon | AL199: TBA | AM199: The 10 O'Clock News | AN199: The Persuaders | AX199: =AX198+7 -> 27758
A200: 1976 | AX200: =A200 -> 1976
A203: 1977 | AX203: =A203 -> 1977
A206: 1978 | AX206: =A206 -> 1978
A209: 1979 | AX209: =A209 -> 1979
A212: 1980 | AX212: =A212 -> 1980
A213: 29228 | E213: Health Field | F213: Gigglesnort Hotel | G213: Ramblin' Rod | I213: Krofft Superstars | J213: Marcus Welby, M.D. | L213: Bonanza | N213: Match Game | O213: The New Joker's Wild | P213: Perry Mason | R213: Movie [Matinee 12]: Escape of the Birdmen (1971) | V213: Room 222 | W213: Bugs Bunny & Friends | X213: The Flintstones | Y213: Gilligan's Island | Z213: The Brady Bunch | AA213: Bewitched | AB213: The Bionic Woman | AD213: Happy Days Again | AE213: I Love Lucy | AF213: Movie [The Movie]: Notorious (1946) | AJ213: The 10 O'Clock News | AL213: The Benny Hill Show | AM213: The Odd Couple | AN213: Mission: Impossible | AX213: =AX212+7 -> 1987
A214: 29235 | E214: Health Field | F214: Gigglesnort Hotel | G214: Ramblin' Rod | I214: Krofft Superstars | J214: Marcus Welby, M.D. | L214: Bonanza | N214: Match Game | O214: The New Joker's Wild | P214: Perry Mason | R214: Movie [Matinee 12]: Only the Valiant (1951) | V214: Bewitched | W214: Bugs Bunny & Friends | X214: The Flintstones | Y214: The Brady Bunch | Z214: Star Trek | AB214: Emergency One! | AD214: Happy Days Again | AE214: Hogan's Heroes | AF214: Movie [The Movie]: How Do I Love Thee? (1970) | AJ214: The 10 O'Clock News | AL214: The Benny Hill Show | AM214: The Odd Couple | AN214: Mission: Impossible | AX214: =AX213+7 -> 1994
A215: 29242 | E215: Health Field | F215: Gigglesnort Hotel | G215: Ramblin' Rod | I215: Krofft Superstars | J215: Marcus Welby, M.D. | L215: Bonanza | N215: Match Game | O215: The New Joker's Wild | P215: Perry Mason | R215: Movie [Matinee 12]: The Harness (1971) | V215: Bewitched | W215: Bugs Bunny & Friends | X215: The Flintstones | Y215: The Brady Bunch | Z215: Star Trek | AB215: Emergency One! | AD215: Happy Days Again | AE215: A Friend in Deed [Special] | AF215: Movie [The Movie]: The Great Northfield, Minnesota Raid (1972) | AJ215: The 10 O'Clock News | AL215: The Benny Hill Show | AM215: The Odd Couple | AN215: Mission: Impossible | AX215: =AX214+7 -> 2001
A216: 29249 | E216: Health Field | F216: Gigglesnort Hotel | G216: Ramblin' Rod | I216: Krofft Superstars | J216: Marcus Welby, M.D. | L216: Bonanza | N216: Match Game | O216: The New Joker's Wild | P216: Perry Mason | R216: Movie [Matinee 12]: The Profane Comedy (1969) | V216: Bewitched | W216: Bugs Bunny & Friends | X216: The Flintstones | Y216: The Brady Bunch | Z216: Star Trek | AB216: Emergency One! | AD216: Happy Days Again | AE216: A Friend in Deed [Special] | AF216: Movie [The Movie]: Indict and Convict (1974) | AJ216: The 10 O'Clock News | AL216: The Benny Hill Show | AM216: The Odd Couple | AN216: Mission: Impossible | AX216: =AX215+7 -> 2008