A1: SATURDAY | B1: 05:00AM | C1: 05:30AM | D1: 06:00AM | E1: 06:30AM | F1: 07:00AM | G1: 07:30AM | H1: 08:00AM | I1: 08:30AM | J1: 09:00AM | K1: 09:30AM | L1: 10:00AM | M1: 10:30AM | N1: 11:00AM | O1: 11:30AM | P1: 12:00N | Q1: 12:30PM | R1: 01:00PM | S1: 01:30PM | T1: 02:00PM | U1: 02:30PM | V1: 03:00PM | W1: 03:30PM | X1: 04:00PM | Y1: 04:30PM | Z1: 05:00PM | AA1: 05:30PM | AB1: 06:00PM | AC1: 06:30PM | AD1: 07:00PM | AE1: 07:30PM | AF1: 08:00PM | AG1: 08:30PM | AH1: 09:00PM | AI1: 09:30PM | AJ1: 10:00PM | AK1: 10:30PM | AL1: 11:00PM | AM1: 11:30PM | AN1: 12:00M | AO1: 12:30AM | AP1: 01:00AM | AQ1: 01:30AM | AR1: 02:00AM | AS1: 02:30AM | AT1: 03:00AM | AU1: 03:30AM | AV1: 04:00AM | AW1: 04:30AM | AX1: SATURDAY
A4: 1953 | AX4: =A4 -> 1953
A5: 19418 | N5: Kids and Company | O5: Sky King (ABC) | P5: TBA | Q5: TBA | R5: TBA | S5: TBA | T5: You Are There (CBS) | U5: Victory at Sea (NBC) | V5: The Lone Ranger (ABC) | W5: TBA | X5: TV Teen Club (ABC) | Y5: Life is Worth Living-- Bishop Sheen (DUM) | Z5: All Star Revue (NBC) | AB5: Your Show of Shows (NBC) | AE5: Your Hit Parade (NBC) | AF5: The Jackie Gleason Show (CBS) | AH5: Dangerous Assignment | AI5: Wrestling Headliners | AJ5: I've Got a Secret (CBS) | AK5: Rocky King, Detective (DUM) | AL5: Boston Blackie | AM5: Movie [Premiere Theater]: The Wooden Horse | AX5: =A5 -> 19418
A6: =A5+7 -> 19425 | N6: Kids and Company | O6: TBA | P6: TBA | Q6: TBA | R6: Talent Patrol (ABC) | S6: My Hero (NBC) | T6: TBA | U6: Victory at Sea (NBC) | V6: The Lone Ranger (ABC) | W6: Arthur Godfrey and His Friends (CBS) | X6: TV Teen Club (ABC) | Y6: Life is Worth Living-- Bishop Sheen (DUM) | Z6: All Star Revue (NBC) | AB6: Your Show of Shows (NBC) | AE6: Your Hit Parade (NBC) | AF6: The Jackie Gleason Show (CBS) | AH6: Dangerous Assignment | AI6: Wrestling Headliners | AJ6: Balance Your Budget (CBS) | AK6: Rocky King, Detective (DUM) | AL6: Boston Blackie | AM6: Movie [Premiere Theater]: Abroad with Two Yanks | AX6: =A6 -> 19425
A7: =A6+7 -> 19432 | N7: Kids and Company | O7: Sky King (ABC) | P7: TBA | Q7: TBA | R7: TBA | S7: Talent Patrol (ABC) | T7: My Friend Irma (CBS) | U7: Victory at Sea (NBC) | V7: The Lone Ranger (ABC) | W7: You Are There (CBS) | X7: TV Teen Club (ABC) | Y7: Life is Worth Living-- Bishop Sheen (DUM) | Z7: All Star Revue (NBC) | AB7: Your Show of Shows (NBC) | AE7: Your Hit Parade (NBC) | AF7: The Jackie Gleason Show (CBS) | AH7: Dangerous Assignment | AI7: NCAA Regional Playoffs-- From Corvallis, Oregon | AL7: Boston Blackie | AM7: Movie [Premiere Theater]: The Man in the Iron Mask | AX7: =A7 -> 19432
A8: =A7+7 -> 19439 | N8: Kids and Company | O8: TBA | P8: TBA | Q8: TBA | R8: Talent Patrol (ABC) | S8: TBA | T8: TBA | U8: Victory at Sea (NBC) | V8: The Lone Ranger (ABC) | W8: Arthur Godfrey and His Friends (CBS) | X8: TV Teen Club (ABC) | Y8: Life is Worth Living-- Bishop Sheen (DUM) | Z8: All Star Revue (NBC) | AB8: Your Show of Shows (NBC) | AE8: Your Hit Parade (NBC) | AF8: The Jackie Gleason Show (CBS) | AH8: Dangerous Assignment | AI8: Wrestling Headliners | AJ8: Balance Your Budget (CBS) | AK8: Rocky King, Detective (DUM) | AL8: Boston Blackie | AM8: Movie [Premiere Theater]: Miss Annie Rooney | AX8: =A8 -> 19439
A9: =A8+7 -> 19446 | N9: Kids and Company | O9: Sky King (ABC) | P9: TBA | Q9: TBA | R9: Talent Patrol (ABC) | S9: TBA | T9: TBA | U9: Victory at Sea (NBC) | V9: The Lone Ranger (ABC) | W9: You Are There (CBS) | X9: TV Teen Club (ABC) | Y9: Life is Worth Living-- Bishop Sheen (DUM) | Z9: All Star Revue (NBC) | AB9: Your Show of Shows (NBC) | AE9: Your Hit Parade (NBC) | AF9: The Jackie Gleason Show (CBS) | AH9: Dangerous Assignment | AI9: Wrestling Headliners | AJ9: I've Got a Secret (CBS) | AK9: Rocky King, Detective (DUM) | AL9: Boston Blackie | AM9: Movie [Premiere Theater]: TBA | AX9: =A9 -> 19446
A10: =A9+7 -> 19453 | N10: Kids and Company | O10: TBA | P10: TBA | Q10: TBA | R10: Talent Patrol (ABC) | S10: TBA | T10: TBA | U10: Victory at Sea (NBC) | V10: The Lone Ranger (ABC) | W10: Arthur Godfrey and His Friends (CBS) | X10: TV Teen Club (ABC) | Y10: Life is Worth Living-- Bishop Sheen (DUM) | Z10: All Star Revue (NBC) | AB10: Your Show of Shows (NBC) | AE10: Your Hit Parade (NBC) | AF10: The Jackie Gleason Show (CBS) | AH10: Dangerous Assignment | AI10: Wrestling Headliners | AJ10: Balance Your Budget (CBS) | AK10: Rocky King, Detective (DUM) | AL10: Boston Blackie | AM10: Movie [Nash Premiere Theater]: Twin Beds | AX10: =A10 -> 19453
A11: =A10+7 -> 19460 | N11: Kids and Company | O11: Sky King (ABC) | P11: TBA | Q11: TBA | R11: Talent Patrol (ABC) | S11: TBA | T11: A Date with Judy (ABC) | U11: Victory at Sea (NBC) | V11: The Lone Ranger (ABC) | W11: You Are There (CBS) | X11: TV Teen Club (ABC) | Y11: Life is Worth Living-- Bishop Sheen (DUM) | Z11: All Star Revue (NBC) | AB11: Your Show of Shows (NBC) | AE11: Your Hit Parade (NBC) | AF11: The Jackie Gleason Show (CBS) | AH11: Dangerous Assignment | AI11: Wrestling Headliners | AJ11: I've Got a Secret (CBS) | AK11: Boston Blackie | AL11: Mr. and Mrs. North (CBS) | AM11: Movie [Nash Premiere Theater]: King of the Turf | AX11: =A11 -> 19460
A12: =A11+7 -> 19467 | N12: Kids and Company | O12: TBA | P12: TBA | Q12: TBA | R12: Gilette Cavalcade of Sports (NBC) | S12: Talent Patrol (ABC) | T12: A Date with Judy (ABC) | U12: Victory at Sea (NBC) | V12: The Lone Ranger (ABC) | W12: Arthur Godfrey and His Friends (CBS) | X12: TV Teen Club (ABC) | Y12: Life is Worth Living-- Bishop Sheen (DUM) | Z12: All Star Revue (NBC) | AB12: Your Show of Shows (NBC) | AE12: Your Hit Parade (NBC) | AF12: The Jackie Gleason Show (CBS) | AH12: Dangerous Assignment | AI12: Wrestling Headliners | AJ12: Balance Your Budget (CBS) | AK12: Boston Blackie | AL12: Mr. and Mrs. North (CBS) | AM12: Movie [Nash Premiere Theater]: Intrigue | AX12: =A12 -> 19467
A13: =A12+7 -> 19474 | N13: Kids and Company | O13: TBA | P13: TBA | Q13: TBA | R13: Gilette Cavalcade of Sports (NBC) | S13: Talent Patrol (ABC) | T13: A Date with Judy (ABC) | U13: Victory at Sea (NBC) | V13: The Lone Ranger (ABC) | W13: Arthur Godfrey and His Friends (CBS) | X13: TV Teen Club (ABC) | Y13: Life is Worth Living-- Bishop Sheen (DUM) | Z13: TBA | AA13: TV Theater | AB13: Your Show of Shows (NBC) | AE13: Your Hit Parade (NBC) | AF13: The Jackie Gleason Show (CBS) | AH13: Dangerous Assignment | AI13: Wrestling Headliners | AJ13: I've Got a Secret (CBS) | AK13: Boston Blackie | AL13: Mr. and Mrs. North (CBS) | AM13: Movie [Nash Premiere Theater]: Brewster's Millions | AX13: =A13 -> 19474
B14: OTHER CITIES SWITCH TO DAYLIGHT SAVINGS TIME; PORTLAND SHOWS AIR ONE HOUR EARLIER | J14: OTHER CITIES SWITCH TO DAYLIGHT SAVINGS TIME; PORTLAND SHOWS AIR ONE HOUR EARLIER | R14: OTHER CITIES SWITCH TO DAYLIGHT SAVINGS TIME; PORTLAND SHOWS AIR ONE HOUR EARLIER | Z14: OTHER CITIES SWITCH TO DAYLIGHT SAVINGS TIME; PORTLAND SHOWS AIR ONE HOUR EARLIER | AH14: OTHER CITIES SWITCH TO DAYLIGHT SAVINGS TIME; PORTLAND SHOWS AIR ONE HOUR EARLIER | AP14: OTHER CITIES SWITCH TO DAYLIGHT SAVINGS TIME; PORTLAND SHOWS AIR ONE HOUR EARLIER
A15: =A13+7 -> 19481 | L15: Kids and Company | M15: TBA | N15: Talent Patrol (ABC) | O15: Victory at Sea (NBC) | P15: Gilette Cavalcade of Sports (NBC): Golden Horse Shoe Sweepstakes from Jamaica, NY | Q15: A Date with Judy (ABC) | R15: Sport Show; [1:15] Kentucky Derby | T15: The Lone Ranger (ABC) | U15: Arthur Godfrey and His Friends (CBS) | V15: TV Teen Club (ABC) | W15: Life is Worth Living-- Bishop Sheen (DUM) | X15: Life Begins at 80 (DUM) | Y15: TV Theater | Z15: Your Show of Shows (NBC) | AC15: Your Hit Parade (NBC) | AD15: The Jackie Gleason Show (CBS) | AF15: Dangerous Assignment | AG15: Wrestling Headliners | AH15: Balance Your Budget (CBS) | AI15: Schlitz Playhouse of Stars (CBS) | AJ15: Mr. and Mrs. North (CBS) | AK15: Movie [Nash Premiere Theater]: TBA | AX15: =A15 -> 19481
A16: =A15+7 -> 19488 | L16: Kids and Company | M16: Sky King (ABC) | N16: TBA | O16: TBA | P16: Gilette Cavalcade of Sports (NBC): The Acorn from Belmont, NY | Q16: Talent Patrol (ABC) | R16: A Date with Judy (ABC) | S16: Victory at Sea (NBC) | T16: The Lone Ranger (ABC) | U16: You Are There (CBS) | V16: TV Teen Club (ABC) | W16: Life is Worth Living-- Bishop Sheen (DUM) | X16: Life Begins at 80 (DUM) | Y16: Superman | Z16: Your Show of Shows (NBC) | AC16: Your Hit Parade (NBC) | AD16: The Jackie Gleason Show (CBS) | AF16: Dangerous Assignment | AG16: Wrestling Headliners | AH16: I've Got a Secret (CBS) | AI16: Schlitz Playhouse of Stars (CBS) | AJ16: Mr. and Mrs. North (CBS) | AK16: Movie [Nash Premiere Theater]: Getting Gertie's Garter | AX16: =A16 -> 19488
A17: =A16+7 -> 19495 | L17: Kids and Company | M17: Sky King (ABC) | N17: TBA | O17: TBA | P17: Gilette Cavalcade of Sports (NBC): The Withers from Belmont, NY | Q17: Talent Patrol (ABC) | R17: A Date with Judy (ABC) | S17: Victory at Sea (NBC) | T17: The Lone Ranger (ABC) | U17: You Are There (CBS) | V17: TV Teen Club (ABC) | W17: Life is Worth Living-- Bishop Sheen (DUM) | X17: Life Begins at 80 (DUM) | Y17: Superman | Z17: Your Show of Shows (NBC) | AC17: Your Hit Parade (NBC) | AD17: The Jackie Gleason Show (CBS) | AF17: Dangerous Assignment | AG17: Wrestling Headliners | AH17: I've Got a Secret (CBS) | AI17: Schlitz Playhouse of Stars (CBS) | AJ17: Mr. and Mrs. North (CBS) | AK17: Movie [Nash Premiere Theater]: Son of Monte Cristo | AX17: =A17 -> 19495
A18: =A17+7 -> 19502 | L18: Kids and Company | M18: Sky King (ABC) | N18: TBA | O18: TBA | P18: Gilette Cavalcade of Sports (NBC): Metropolitan Handicap from Belmont, NY | Q18: Talent Patrol (ABC) | R18: A Date with Judy (ABC) | S18: Horse Racing: The Preakness Stakes from Baltimore, MD | T18: The Lone Ranger (ABC) | U18: You Are There (CBS) | V18: Victory at Sea (NBC) | W18: Life is Worth Living-- Bishop Sheen (DUM) | X18: Life Begins at 80 (DUM) | Y18: Superman | Z18: Your Show of Shows (NBC) | AC18: Your Hit Parade (NBC) | AD18: The Jackie Gleason Show (CBS) | AF18: Dangerous Assignment | AG18: Wrestling Headliners | AH18: I've Got a Secret (CBS) | AI18: Schlitz Playhouse of Stars (CBS) | AJ18: Mr. and Mrs. North (CBS) | AK18: Movie [Nash Premiere Theater]: Twin Beds | AM18: Celebrity Parade for Cerebral Palsy | AP18: Cerebral Palsy Telethon Continues | AX18: =A18 -> 19502
A19: =A18+7 -> 19509 | L19: Kids and Company | M19: TBA | N19: TBA | O19: TBA | P19: Gilette Cavalcade of Sports (NBC): Suburban Handicap from Belmont, NY | Q19: Talent Patrol (ABC) | R19: A Date with Judy (ABC) | S19: TBA | T19: The Lone Ranger (ABC) | U19: Arthur Godfrey and His Friends (CBS) | V19: TBA | W19: Life is Worth Living-- Bishop Sheen (DUM) | X19: Life Begins at 80 (DUM) | Y19: Superman | Z19: Your Show of Shows (NBC) | AC19: Your Hit Parade (NBC) | AD19: The Jackie Gleason Show (CBS) | AF19: Dangerous Assignment | AG19: Wrestling Headliners | AH19: Death Valley Days | AI19: Schlitz Playhouse of Stars (CBS) | AJ19: Mr. and Mrs. North (CBS) | AK19: Movie [Nash Premiere Theater]: The Hideout | AX19: =A19 -> 19509
B20: KPTV BECOMES NBC AFFILIATE | J20: KPTV BECOMES NBC AFFILIATE | R20: KPTV BECOMES NBC AFFILIATE | Z20: KPTV BECOMES NBC AFFILIATE | AH20: KPTV BECOMES NBC AFFILIATE | AP20: KPTV BECOMES NBC AFFILIATE
A21: =A19+7 -> 19516 | L21: Kids and Company | M21: Sky King (ABC) | N21: TBA | O21: TBA | P21: Gilette Cavalcade of Sports (NBC): Coaching Club American Oaks from Belmont, NY | Q21: Talent Patrol (ABC) | R21: A Date with Judy (ABC) | S21: TBA | T21: The Lone Ranger (ABC) | U21: You Are There (CBS) | V21: TBA | W21: Your Big Moment (DUM) | X21: Life Begins at 80 (DUM) | Y21: Superman | Z21: Saturday Night Revue (NBC) | AC21: Your Hit Parade (NBC) | AD21: The Jackie Gleason Show (CBS) | AF21: Dangerous Assignment | AG21: Wrestling Headliners | AH21: I've Got a Secret (CBS) | AI21: Schlitz Playhouse of Stars (CBS) | AJ21: Mr. and Mrs. North (CBS) | AK21: Movie [Nash Premiere Theater]: Kit Carson | AX21: =A21 -> 19516
A22: =A21+7 -> 19523 | L22: Kids and Company | M22: TBA | N22: TBA | O22: TBA | P22: Gilette Cavalcade of Sports (NBC): Kent Stakes from Delaware Park | Q22: Talent Patrol (ABC) | R22: A Date with Judy (ABC) | S22: TBA | T22: The Lone Ranger (ABC) | U22: Arthur Godfrey and His Friends (CBS) | V22: TBA | W22: TBA | X22: Life Begins at 80 (DUM) | Y22: Superman | Z22: Saturday Night Revue (NBC) | AC22: Your Hit Parade (NBC) | AD22: The Jackie Gleason Show (CBS) | AF22: Dangerous Assignment | AG22: Wrestling Headliners | AH22: Death Valley Days | AI22: Schlitz Playhouse of Stars (CBS) | AJ22: Mr. and Mrs. North (CBS) | AK22: Movie [Nash Premiere Theater]: Bonnie Prince Charlie | AX22: =A22 -> 19523
A23: =A22+7 -> 19530 | L23: TBA | M23: Sky King (ABC) | N23: TBA | O23: TBA | P23: Gilette Cavalcade of Sports (NBC): Queens County Handicap from Aqueduct Track, NY | Q23: Talent Patrol (ABC) | R23: A Date with Judy (ABC) | S23: TBA | T23: The Lone Ranger (ABC) | U23: You Are There (CBS) | V23: TBA | W23: TBA | X23: Life Begins at 80 (DUM) | Y23: Superman | Z23: Saturday Night Revue (NBC) | AC23: Private Secretary (CBS) | AD23: The Jackie Gleason Show (CBS) | AF23: Dangerous Assignment | AG23: Wrestling Headliners | AH23: I've Got a Secret (CBS) | AI23: Schlitz Playhouse of Stars (CBS) | AJ23: Mr. and Mrs. North (CBS) | AK23: Movie [Nash Premiere Theater]: South of Pago Pago | AX23: =A23 -> 19530
A24: =A23+7 -> 19537 | L24: TBA | M24: TBA | N24: TBA | O24: TBA | P24: TBA | Q24: Talent Patrol (ABC) | R24: A Date with Judy (ABC) | S24: TBA | T24: The Lone Ranger (ABC) | U24: Arthur Godfrey and His Friends (CBS) | V24: TBA | W24: TBA | X24: Life Begins at 80 (DUM) | Y24: Superman | Z24: Saturday Night Revue (NBC) | AC24: Private Secretary (CBS) | AD24: The Jackie Gleason Show (CBS) | AF24: Dangerous Assignment | AG24: Wrestling Headliners | AH24: Death Valley Days | AI24: Schlitz Playhouse of Stars (CBS) | AJ24: Mr. and Mrs. North (CBS) | AK24: Movie [Nash Premiere Theater]: Man in the Dinghy | AX24: =A24 -> 19537
A25: =A24+7 -> 19544 | L25: TBA | M25: Sky King (ABC) | N25: Movie [Double Barrel Playhouse] | Q25: Talent Patrol (ABC) | R25: A Date with Judy (ABC) | S25: TBA | T25: The Lone Ranger (ABC) | U25: You Are There (CBS) | V25: Beat the Clock (CBS) | W25: TBA | X25: Life Begins at 80 (DUM) | Y25: Superman | Z25: Saturday Night Revue (NBC) | AC25: Private Secretary (CBS) | AD25: The Jackie Gleason Show (CBS) | AF25: Dangerous Assignment | AG25: Wrestling Headliners | AH25: I've Got a Secret (CBS) | AI25: Schlitz Playhouse of Stars (CBS) | AJ25: Mr. and Mrs. North (CBS) | AK25: Movie [Nash Premiere Theater]: International Lady | AX25: =A25 -> 19544
A26: =A25+7 -> 19551 | L26: TBA | M26: TBA | N26: Movie [Double Barrel Playhouse] | Q26: Talent Patrol (ABC) | R26: A Date with Judy (ABC) | S26: TBA | T26: The Lone Ranger (ABC) | U26: Arthur Godfrey and His Friends (CBS) | V26: Beat the Clock (CBS) | W26: TBA | X26: Life Begins at 80 (DUM) | Y26: Superman | Z26: Saturday Night Revue (NBC) | AC26: Private Secretary (CBS) | AD26: The Jackie Gleason Show (CBS) | AF26: Dangerous Assignment | AG26: Wrestling Headliners | AH26: Death Valley Days | AI26: Schlitz Playhouse of Stars (CBS) | AJ26: Mr. and Mrs. North (CBS) | AK26: Movie [Nash Premiere Theater]: Small Back Room | AX26: =A26 -> 19551
A27: =A26+7 -> 19558 | J27: Dog Tales; [9:15] TBA | K27: TBA | L27: TBA | M27: TBA | N27: Movie [Double Barrel Playhouse] | Q27: Talent Patrol (ABC) | R27: A Date with Judy (ABC) | S27: TBA | T27: The Lone Ranger (ABC) | U27: TBA | V27: Beat the Clock (CBS) | W27: Horse Racing from Portland Meadows | X27: Life Begins at 80 (DUM) | Y27: Superman | Z27: Saturday Night Revue (NBC) | AC27: Private Secretary (CBS) | AD27: Ted Mack's Original Amateur Hour (NBC) | AE27: TBA | AF27: Dangerous Assignment | AG27: Wrestling Headliners | AH27: City Hospital (CBS) | AI27: Schlitz Playhouse of Stars (CBS) | AJ27: Mr. and Mrs. North (CBS) | AK27: Movie [Nash Premiere Theater]: Flesh and Blood | AX27: =A27 -> 19558
A28: =A27+7 -> 19565 | J28: Dog Tales; [9:15] TBA | K28: Talent Patrol (ABC) | L28: TBA; [10:25] Major League Baseball: Philadelphia vs Chicago | R28: A Date with Judy (ABC) | S28: TBA | T28: The Lone Ranger (ABC) | U28: TBA | V28: Beat the Clock (CBS) | W28: Horse Racing from Portland Meadows | X28: Life Begins at 80 (DUM) | Y28: Superman | Z28: Saturday Night Revue (NBC) | AC28: Private Secretary (CBS) | AD28: Ted Mack's Original Amateur Hour (NBC) | AE28: My Hero (NBC) | AF28: Dangerous Assignment | AG28: Wrestling Headliners | AH28: Death Valley Days | AI28: Schlitz Playhouse of Stars (CBS) | AJ28: Mr. and Mrs. North (CBS) | AK28: Movie [Nash Premiere Theater]: The Challenge | AX28: =A28 -> 19565
A29: =A28+7 -> 19572 | J29: Dog Tales; [9:15] TBA | K29: TBA; [9:55] Major League Baseball: Cleveland vs Philadelphia | Q29: Talent Patrol (ABC) | R29: A Date with Judy (ABC) | S29: TBA | T29: The Lone Ranger (ABC) | U29: TBA | V29: Beat the Clock (CBS) | W29: Horse Racing from Portland Meadows | X29: Life Begins at 80 (DUM) | Y29: Superman | Z29: Saturday Night Revue (NBC) | AC29: Private Secretary (CBS) | AD29: Ted Mack's Original Amateur Hour (NBC) | AE29: My Hero (NBC) | AF29: Dangerous Assignment | AG29: Wrestling Headliners | AH29: TBA | AI29: Schlitz Playhouse of Stars (CBS) | AJ29: Mr. and Mrs. North (CBS) | AK29: Movie [Nash Premiere Theater]: Woman of Dolwyn | AX29: =A29 -> 19572
A30: =A29+7 -> 19579 | J30: Dog Tales; [9:15] The Toymaker and His Friends | K30: [9:55] Major League Baseball: Detroit vs Philadelphia | Q30: Talent Patrol (ABC) | R30: A Date with Judy (ABC) | S30: TBA | T30: The Lone Ranger (ABC) | U30: Arthur Godfrey and His Friends (CBS) | V30: Beat the Clock (CBS) | W30: Horse Racing from Portland Meadows | X30: Life Begins at 80 (DUM) | Y30: Superman | Z30: Saturday Night Revue (NBC) | AC30: Private Secretary (CBS) | AD30: Ted Mack's Original Amateur Hour (NBC) | AE30: My Hero (NBC) | AF30: Dangerous Assignment | AG30: Wrestling Headliners | AH30: Death Valley Days | AI30: Schlitz Playhouse of Stars (CBS) | AJ30: Mr. and Mrs. North (CBS) | AK30: Movie [Nash Premiere Theater]: My Son, My Son | AX30: =A30 -> 19579
A31: =A30+7 -> 19586 | J31: Dog Tales; [9:15] The Toymaker and His Friends | K31: [9:55] Major League Baseball: New York vs Philadelphia | Q31: Talent Patrol (ABC) | R31: A Date with Judy (ABC) | S31: TBA | T31: The Lone Ranger (ABC) | U31: Sky King (ABC) | V31: Beat the Clock (CBS) | W31: Horse Racing from Portland Meadows | X31: Life Begins at 80 (DUM) | Y31: Superman | Z31: Saturday Night Revue (NBC) | AC31: Private Secretary (CBS) | AD31: Ted Mack's Original Amateur Hour (NBC) | AE31: Sammy Kaye Show (NBC) | AF31: Dangerous Assignment | AG31: Wrestling Headliners | AH31: TBA | AI31: Schlitz Playhouse of Stars (CBS) | AJ31: Mr. and Mrs. North (CBS) | AK31: Movie [Nash Premiere Theater]: A Gentleman After Dark | AX31: =A31 -> 19586
A32: =A31+7 -> 19593 | J32: Dog Tales; [9:15] The Toymaker and His Friends | K32: [9:45] TBA | L32: [10:15] Major League Baseball: Detroit vs Chicago | Q32: Talent Patrol (ABC) | R32: A Date with Judy (ABC) | S32: Smilin' Ed's Gang (ABC) | T32: The Lone Ranger (ABC) | U32: Sky King (ABC) | V32: Beat the Clock (CBS) | W32: Horse Racing from Portland Meadows | X32: Life Begins at 80 (DUM) | Y32: Superman | Z32: Saturday Night Revue (NBC) | AC32: Private Secretary (CBS) | AD32: Ted Mack's Original Amateur Hour (NBC) | AE32: Sammy Kaye Show (NBC) | AF32: Dangerous Assignment | AG32: Wrestling Headliners | AH32: Death Valley Days | AI32: Schlitz Playhouse of Stars (CBS) | AJ32: Mr. and Mrs. North (CBS) | AK32: Movie [Nash Premiere Theater]: Friendly Enemies | AX32: =A32 -> 19593
A33: =A32+7 -> 19600 | J33: Dog Tales; [9:15] The Toymaker and His Friends | K33: [9:45] TBA; [9:55] Major League Baseball: New York vs Cleveland | R33: A Date with Judy (ABC) | S33: Smilin' Ed's Gang (ABC) | T33: The Lone Ranger (ABC) | U33: Sky King (ABC) | V33: Beat the Clock (CBS) | W33: Horse Racing from Portland Meadows | X33: Life Begins at 80 (DUM) | Y33: Superman | Z33: Saturday Night Revue (NBC) | AC33: Private Secretary (CBS) | AD33: Ted Mack's Original Amateur Hour (NBC) | AE33: Sammy Kaye Show (NBC) | AF33: Dangerous Assignment | AG33: TBA | AH33: TBA | AI33: Schlitz Playhouse of Stars (CBS) | AJ33: Mr. and Mrs. North (CBS) | AK33: Movie [Nash Premiere Theater]: Count of Monte Cristo | AX33: =A33 -> 19600
A34: =A33+7 -> 19607 | J34: Dog Tales; [9:15] The Toymaker and His Friends | K34: [9:45] TBA | L34: Pro Tennis: from West Side Tennis Cub, Forest Hills, NY | R34: A Date with Judy (ABC) | S34: Smilin' Ed's Gang (ABC) | T34: The Lone Ranger (ABC) | U34: Arthur Godfrey and His Friends (CBS) | V34: Beat the Clock (CBS) | W34: TBA | X34: Johnny Jupiter (ABC) | Y34: Superman | Z34: Saturday Night Revue (NBC) | AC34: Private Secretary (CBS) | AD34: Ted Mack's Original Amateur Hour (NBC) | AE34: Sammy Kaye Show (NBC) | AF34: Dangerous Assignment | AG34: TBA | AH34: Death Valley Days | AI34: Schlitz Playhouse of Stars (CBS) | AJ34: Mr. and Mrs. North (CBS) | AK34: Movie [Nash Premiere Theater]: 13 Lead Soldiers | AX34: =A34 -> 19607
A35: =A34+7 -> 19614 | J35: Dog Tales; [9:15] The Toymaker and His Friends | K35: [9:45] TBA; [9:55] Major League Baseball: Chicago White Sox vs Philadelphia Athletics | R35: A Date with Judy (ABC) | S35: Smilin' Ed's Gang (ABC) | T35: The Lone Ranger (ABC) | U35: Sky King (ABC) | V35: Beat the Clock (CBS) | W35: Space Patrol (ABC) | X35: Johnny Jupiter (ABC) | Y35: Superman | Z35: Movie [Variety Playhouse]: TBA | AB35: Local Sports Show; [6:15] Sid Porter | AC35: Your Hit Parade (NBC) | AD35: Ted Mack's Original Amateur Hour (NBC) | AE35: Sammy Kaye Show (NBC) | AF35: Your Show of Shows (NBC) | AI35: Schlitz Playhouse of Stars (CBS) | AJ35: Mr. and Mrs. North (CBS) | AK35: Dangerous Assignment | AL35: Movie [Nash Premiere Theater]: The Interrupted Journey (British, 1949) | AX35: =A35 -> 19614
A36: =A35+7 -> 19621 | J36: Dog Tales; [9:15] The Toymaker and His Friends | K36: [9:45] TBA | L36: Tom Corbett, Space Cadet (DUM) | M36: Space Patrol (ABC) | N36: Smilin' Ed's Gang (ABC) | O36: NCAA College Football: Oregon vs Nebraska | V36: Tootsie Hippodrome (ABC) | W36: The Lone Ranger (ABC) | X36: Johnny Jupiter (ABC) | Y36: Superman | Z36: Movie [Variety Playhouse]: Tomboy (1940) | AB36: Local Sports Show; [6:15] Sid Porter | AC36: Your Hit Parade (NBC) | AD36: Ted Mack's Original Amateur Hour (NBC) | AE36: Bonino (NBC) | AF36: Your Show of Shows (NBC) | AI36: Schlitz Playhouse of Stars (CBS) | AJ36: Mr. and Mrs. North (CBS) | AK36: Dangerous Assignment | AL36: Movie [Nash Premiere Theater]: The Creeper (1948) | AX36: =A36 -> 19621
A37: =A36+7 -> 19628 | J37: Dog Tales; [9:15] TBA | K37: Oldsmoblie Pre-Game; [9:45] NCAA College Football: Dartmouth vs Holy Cross | R37: The Toymaker and His Friends | S37: Smilin' Ed's Gang (ABC) | T37: Space Patrol (ABC) | U37: Sky King (ABC) | V37: Tootsie Hippodrome (ABC) | W37: The Lone Ranger (ABC) | X37: Johnny Jupiter (ABC) | Y37: Superman | Z37: Your Show of Shows (NBC) | AC37: Your Hit Parade (NBC) | AD37: Ted Mack's Original Amateur Hour (NBC) | AE37: Bonino (NBC) | AF37: Dangerous Assignment | AG37: Variety Playhouse | AI37: Schlitz Playhouse of Stars (CBS) | AJ37: Mr. and Mrs. North (CBS) | AK37: Movie [Nash Premiere Theater]: Wonder Boy (1951) aka The Wonder Kid | AX37: =A37 -> 19628
A38: =A37+7 -> 19635 | J38: Dog Tales; [9:15] The Toymaker and His Friends | K38: [9:45] World Series Baseball: New York Yankees vs. Brooklyn Dodgers (Game 4) (NBC) | P38: Space Patrol (ABC) | Q38: Smilin' Ed's Gang (ABC) | R38: The Lone Ranger (ABC) | S38: Oldsmoblie Pre-Game; [1:45] NCAA College Football: California vs. Ohio State | X38: Johnny Jupiter (ABC) | Y38: TBA | Z38: TBA | AA38: Superman | AB38: All Star Revue (NBC) | AE38: Ethel and Albert (NBC) | AF38: Bonino (NBC) | AG38: Ted Mack's Original Amateur Hour (NBC) | AH38: The Gene Autry Show (CBS) | AI38: Dangerous Assignment | AJ38: TBA | AK38: Your Hit Parade (NBC) | AL38: Movie [Nash Premiere Theater]: The Counterfeiters (1948) | AX38: =A38 -> 19635
A40: 1955 | AX40: 1960
A42: 20335 | J42: Pinky Lee | K42: The Children's Corner | L42: Commando Cody | M42: Movie: TBA | N42: The Big Picture | O42: Travelog | Q42: Movie [Double Barrel Playhouse]: Ghost of Hidden Valley; Border Badmen | U42: Movie: [Horse Opera]: Ambush Trail; Shadow of Death | Y42: Buster Crabbe | Z42: Movie [Playhouse 27]: Winter Wonderland (1947) | AC42: The Show Wagon | AD42: The Soldiers | AE42: The Dunninger Show | AF42: Musical Chairs (NBC) | AG42: Jimmy Durante (NBC) | AH42: Here's the Show (NBC) | AI42: Your Play Time (NBC) | AJ42: Championship Bowling (NBC) | AX42: =A42 -> 20335
AX43: =A43 -> 0
AX44: =A44 -> 0
AX45: =A45 -> 0
AX46: =A46 -> 0
AX47: =A47 -> 0
AX48: =A48 -> 0
AX49: =A49 -> 0
A51: 1960 | AX51: 1960
A52: 21917 | H52: Breadbasket, U.S.A. | I52: Jet Jackson | J52: Jeff's Collie | K52: Movie [Block Buster]: Knute Rockne--All American (1940) | N52: Rusty's Hour | P52: Soupy Sales (ABC) | Q52: Movie [Wild West Theater]: Bullet Code (1940) | T52: Boots and Saddles | U52: Movie: The Street with No Name (1948) | X52: Championship Bowling | Z52: All-Star Golf (ABC) | AB52: Movie | AE52: Dick Clark (ABC) | AF52: High Road (ABC) | AG52: Leave it to Beaver (ABC) | AH52: The Lawrence Welk Show (ABC) | AJ52: Jubilee, U.S.A. (ABC) | AL52: News; [11:15] Movie [Action]: Flying Leathernecks (1951) | AX52: =A52 -> 21917
A53: 21924 | H53: Breadbasket, U.S.A. | I53: Jet Jackson | J53: William Tell | K53: Jungle Jim | L53: Movie: Lady Killer (1933) | P53: Soupy Sales (ABC) | Q53: Movie [Wild West Theater]: The Half-Breed (1952) | T53: Boots and Saddles | U53: Movie: [Movie Showcase]: The Secret Fury (1950) | X53: Championship Bowling | Z53: All-Star Golf (ABC) | AB53: Movie [Major Studio Preview]: The Lost Moment (1947) | AE53: Dick Clark (ABC) | AF53: High Road (ABC) | AG53: Leave it to Beaver (ABC) | AH53: The Lawrence Welk Show (ABC) | AJ53: Jubilee, U.S.A. (ABC) | AL53: News; [11:15] Movie [Big Western]: Station West (1948) | AX53: =A53 -> 21924
A54: 21931 | H54: Breadbasket, U.S.A. | I54: Jet Jackson | J54: William Tell | K54: Jungle Jim | L54: Movie [Cinema 12]: The Mayor of Hell (1933) | P54: Soupy Sales (ABC) | Q54: Movie [Wild West Theater]: The Sundowners (1949) | T54: Boots and Saddles | U54: Movie: [Movie Showcase]: Suddenly (1954) | X54: Championship Bowling | Z54: All-Star Golf (ABC) | AB54: Movie [Major Studio Preview]: Please Murder Me (1956) | AE54: Dick Clark (ABC) | AF54: High Road (ABC) | AG54: Leave it to Beaver (ABC) | AH54: The Lawrence Welk Show (ABC) | AJ54: Jubilee, U.S.A. (ABC) | AL54: News; [11:15] Movie [Action]: Private Hell 36 (1954) | AX54: =A54 -> 21931
A55: 21938 | H55: Breadbasket, U.S.A. | I55: Jet Jackson | J55: William Tell | K55: Jungle Jim | L55: Movie [Cinema 12]: Notorious Gentleman (English; 1947) | P55: Soupy Sales (ABC) | Q55: Movie [Wild West Theater]: Wagonmaster (1950) | T55: Boots and Saddles | U55: Movie: [Movie Showcase]: Southwest Passage (1954) | X55: Championship Bowling | Z55: All-Star Golf (ABC) | AB55: Movie [Major Studio Preview]: High Terrace (English; 1956) | AE55: Dick Clark (ABC) | AF55: High Road (ABC) | AG55: Leave it to Beaver (ABC) | AH55: The Lawrence Welk Show (ABC) | AJ55: Jubilee, U.S.A. (ABC) | AL55: News; [11:15] Movie [Action]: Run for the Sun (1956) | AX55: =A55 -> 21938
A56: 21945 | H56: Breadbasket, U.S.A. | I56: Jet Jackson | J56: William Tell | K56: Jungle Jim | L56: Movie [Cinema 12]: Elizabeth and Essex (1939) | P56: Soupy Sales (ABC) | Q56: Movie [Wild West Theater]: Roughshod (1949) | T56: Boots and Saddles | U56: Movie: [Movie Showcase]: Violent Stranger (English; 1958) | X56: Championship Bowling | Z56: All-Star Golf (ABC) | AB56: Movie [Major Studio Preview]: Mad at the World (1953) | AE56: Dick Clark (ABC) | AF56: High Road (ABC) | AG56: Leave it to Beaver (ABC) | AH56: The Lawrence Welk Show (ABC) | AJ56: Jubilee, U.S.A. (ABC) | AL56: News; [11:15] Movie [Action]: Back to Bataan (1945) | AX56: =A56 -> 21945
A57: 21952 | H57: Breadbasket, U.S.A. | I57: Jet Jackson | J57: William Tell | K57: Jungle Jim | L57: Movie [Cinema 12]: My Reputation (1946) | P57: Soupy Sales (ABC) | Q57: Movie [Wild West Theater]: Rancho Notorious (1952) | T57: Boots and Saddles | U57: Movie: [Movie Showcase]: Black Tuesday (1954) | X57: Championship Bowling | Z57: All-Star Golf (ABC) | AB57: Movie [Major Studio Preview]: Wiretapper (1955) | AE57: Dick Clark (ABC) | AF57: High Road (ABC) | AG57: Leave it to Beaver (ABC) | AH57: The Lawrence Welk Show (ABC) | AJ57: Jubilee, U.S.A. (ABC) | AL57: News; [11:15] Movie [Action]: Storm Fear (1955) | AX57: =A57 -> 21952
A58: 21959 | H58: Breadbasket, U.S.A. | I58: Jet Jackson | J58: William Tell | K58: Jungle Jim | L58: Movie [Cinerama 12]: Hollywood Hotel (1937) | P58: Soupy Sales (ABC) | Q58: Movie [Wild West Theater]: Stakkuib Riad (1947) | T58: Boots and Saddles | U58: Movie: [Movie Showcase]: The Come On (1956) | X58: Championship Bowling | Z58: All-Star Golf (ABC) | AB58: Movie [Major Studio Preview]: The Senator Was Indiscreet (1948) | AE58: Dick Clark (ABC) | AF58: High Road (ABC) | AG58: Leave it to Beaver (ABC) | AH58: The Lawrence Welk Show (ABC) | AJ58: Jubilee, U.S.A. (ABC) | AL58: News; [11:15] Movie [Action]: She Wore a Yellow Ribbon (1949) | AX58: =A58 -> 21959
A59: 21966 | H59: Breadbasket, U.S.A. | I59: Jet Jackson | J59: William Tell | K59: Jungle Jim | L59: Movie [Cinema 12]: Daughters Courageous (1939) | P59: Soupy Sales (ABC) | Q59: Movie [Wild West Theater]: Frontier Marshal (1939) | T59: Boots and Saddles | U59: Movie: [Movie Showcase]: Rage at Dawn (1955) | X59: Championship Bowling | Z59: All-Star Golf (ABC) | AB59: Movie [Major Studio Preview]: The Soldier and the Lady (1937) | AE59: Dick Clark (ABC) | AF59: High Road (ABC) | AG59: Leave it to Beaver (ABC) | AH59: The Lawrence Welk Show (ABC) | AJ59: Jubilee, U.S.A. (ABC) | AL59: News; [11:15] Movie [Big Western]: The Killer is Loose (1956) | AX59: =A59 -> 21966
A60: 21973 | H60: Breadbasket, U.S.A. | I60: Jet Jackson | J60: William Tell | K60: Jungle Jim | L60: Movie [Cinema 12]: That Girl from Paris (1937) | P60: Soupy Sales (ABC) | Q60: Movie [Wild West Theater]: Powdersmoke Range (1935) | T60: Boots and Saddles | U60: Movie: [Movie Showcase]: Jack Slade (1953) | X60: Championship Bowling | Z60: All-Star Golf (ABC) | AB60: Movie [Major Studio Preview]: Sail into Danger (English; 1957) | AE60: Dick Clark (ABC) | AF60: High Road (ABC) | AG60: Leave it to Beaver (ABC) | AH60: The Lawrence Welk Show (ABC) | AJ60: Jubilee, U.S.A. (ABC) | AL60: News; [11:15] Movie [Big Western]: Red River (1948) | AX60: =A60 -> 21973
A61: 21980 | H61: Breadbasket, U.S.A. | I61: Jet Jackson | J61: William Tell | K61: Jungle Jim | L61: Movie [Cinema 12]: Quartet (English; 1948) | P61: Soupy Sales (ABC) | Q61: Movie [Wild West Theater]: The Arizonian (1935) | T61: Boots and Saddles | U61: Movie: [Movie Showcase]: Battle Taxi (1955) | X61: Championship Bowling | Z61: All-Star Golf (ABC) | AB61: Movie [Major Studio Preview]: Burmuda Affair (1957) | AE61: Dick Clark (ABC) | AF61: High Road (ABC) | AG61: Leave it to Beaver (ABC) | AH61: The Lawrence Welk Show (ABC) | AJ61: Jubilee, U.S.A. (ABC) | AL61: News; [11:15] Movie [Big Western]: Last of the Desperadoes (1956) | AX61: =A61 -> 21980
A62: 21987 | H62: Breadbasket, U.S.A. | I62: Jet Jackson | J62: William Tell | K62: Jungle Jim | L62: Movie [Cinema 12]: Always Leave Them Laughing (1949) | P62: Soupy Sales (ABC) | Q62: Movie [Wild West Theater]: The Three Outlaws (1956) | T62: Boots and Saddles | U62: Movie: [Movie Showcase]: Down Three Dark Streets (1954) | X62: Championship Bowling | Z62: All-Star Golf (ABC) | AB62: Movie [Major Studio Preview]: The Naked Street (1955) | AE62: Dick Clark (ABC) | AF62: High Road (ABC) | AG62: Leave it to Beaver (ABC) | AH62: The Lawrence Welk Show (ABC) | AJ62: Jubilee, U.S.A. (ABC) | AL62: News; [11:15] Movie [Action]: Cry Vengeance (1954) | AX62: =A62 -> 21987
A63: 21994 | H63: Breadbasket, U.S.A. | I63: Jet Jackson | J63: William Tell | K63: Jungle Jim | L63: Movie [Cinema 12]: Stairway to Heaven (English; 1946) | P63: Soupy Sales (ABC) | Q63: Movie [Wild West Theater]: Montana Belle (1952) | T63: Boots and Saddles | U63: Movie: [Movie Showcase]: The Sea Devils (1953) | X63: Championship Bowling | Z63: All-Star Golf (ABC) | AB63: Movie [Major Studio Preview]: Target Earth (1954) | AE63: Dick Clark (ABC) | AF63: High Road (ABC) | AG63: Leave it to Beaver (ABC) | AH63: The Lawrence Welk Show (ABC) | AJ63: Story of the X-15 (ABC) [Special] | AL63: News; [11:15] Movie [Action]: Crossfire (1947) | AX63: =A63 -> 21994
A64: 22001 | H64: Breadbasket, U.S.A. | I64: Jet Jackson | J64: William Tell | K64: Jungle Jim | L64: Movie [Cinema 12]: Without Reservations (1946) | P64: Soupy Sales (ABC) | Q64: Movie [Wild West Theater]: The Painted Desert (1931) | T64: Boots and Saddles | U64: Movie: [Showcase Theater]: Loophole (1954) | X64: Championship Bowling | Z64: All-Star Golf (ABC) | AB64: Movie [Major Studio Preview]: The Dark Mirror (1946) | AE64: Dick Clark (ABC) | AF64: High Road (ABC) | AG64: Leave it to Beaver (ABC) | AH64: The Lawrence Welk Show (ABC) | AJ64: Jubilee, U.S.A. (ABC) | AL64: News; [11:15] Movie [Big Western]: The Yellow Tomahawk (1954) | AX64: =A64 -> 22001
A65: 22008 | H65: Breadbasket, U.S.A. | I65: Jet Jackson | J65: William Tell | K65: Jungle Jim | L65: Movie [Cinema 12]: The Life of Emile Zola (1937) | P65: Soupy Sales (ABC) | Q65: Movie [Wild West Theater]: The Ox-Bow Incident (1943) | T65: Boots and Saddles | U65: Movie: [Showcase Theater]: One Touch of Venus (1948) | X65: Championship Bowling | Z65: All-Star Golf (ABC) | AB65: Movie [Major Studio Preview]: Return to Treasure Island (1954) | AE65: Dick Clark (ABC) | AF65: High Road (ABC) | AG65: Leave it to Beaver (ABC) | AH65: The Lawrence Welk Show (ABC) | AJ65: Jubilee, U.S.A. (ABC) | AL65: News; [11:15] Movie [Big Western]: Belle Starr (1941) | AX65: =A65 -> 22008
A66: 22015 | H66: Breadbasket, U.S.A. | I66: Jet Jackson | J66: William Tell | K66: Jungle Jim | L66: Movie [Cinema 12]: In Our Time (1944) | P66: Soupy Sales (ABC) | Q66: Movie [Wild West Theater]: The Ox-Bow Incident (1943) | T66: Boots and Saddles | U66: Movie: [Showcase Theater]: The Big Bluff (1955) | X66: Championship Bowling | Z66: TBA | AB66: Movie [Major Studio Preview]: Jennifer (1953) | AE66: Dick Clark (ABC) | AF66: High Road (ABC) | AG66: Leave it to Beaver (ABC) | AH66: The Lawrence Welk Show (ABC) | AJ66: Jubilee, U.S.A. (ABC) | AL66: News; [11:15] Movie [Action]: 99 River Street (1953) | AX66: =A66 -> 22015
A67: 22022 | H67: Breadbasket, U.S.A. | I67: Jet Jackson | J67: William Tell | K67: Jungle Jim | L67: Movie [Cinema 12]: The Lady Takes a Sailor (1949) | P67: Soupy Sales (ABC) | Q67: Rendezvous with Adventure | R67: [12:55] Baseball (ABC) Chicago Cubs vs. San Francisco Giants | W67: Ranch Party | X67: Championship Bowling | Z67: All-Star Golf (ABC) | AB67: Movie [Major Studio Preview]: Star of India (1956) | AE67: Dick Clark (ABC) | AF67: High Road (ABC) | AG67: Leave it to Beaver (ABC) | AH67: The Lawrence Welk Show (ABC) | AJ67: Jubilee, U.S.A. (ABC) | AL67: News; [11:15] Movie [Big Western]: Robber's Roost (1955) | AX67: =A67 -> 22022
A68: 22029 | H68: Breadbasket, U.S.A. | I68: Jet Jackson | J68: William Tell | K68: Jungle Jim | L68: Movie [Cinema 12]: Nora Prentiss (1947) | P68: Soupy Sales (ABC) | Q68: Rendezvous with Adventure | R68: [12:55] Baseball (ABC) Cleveland Indians vs. Kansas City Athletics | W68: Guy Lombardo | X68: Championship Bowling | Z68: Top Pro Golf (ABC) | AB68: Movie [Major Studio Preview]: The Case of the Red Monkey (English; 1955) | AE68: Dick Clark (ABC) | AF68: High Road (ABC) | AG68: Leave it to Beaver (ABC) | AH68: The Lawrence Welk Show (ABC) | AJ68: Jubilee, U.S.A. (ABC) | AL68: News; [11:15] Movie [Action Theater]: The Two Mrs. Carrolls (1947) | AX68: =A68 -> 22029
B69: OTHER CITIES SWITCH TO DAYLIGHT SAVINGS TIME; PORTLAND SHOWS AIR ONE HOUR EARLIER | J69: OTHER CITIES SWITCH TO DAYLIGHT SAVINGS TIME; PORTLAND SHOWS AIR ONE HOUR EARLIER | R69: OTHER CITIES SWITCH TO DAYLIGHT SAVINGS TIME; PORTLAND SHOWS AIR ONE HOUR EARLIER | Z69: OTHER CITIES SWITCH TO DAYLIGHT SAVINGS TIME; PORTLAND SHOWS AIR ONE HOUR EARLIER | AH69: OTHER CITIES SWITCH TO DAYLIGHT SAVINGS TIME; PORTLAND SHOWS AIR ONE HOUR EARLIER | AP69: OTHER CITIES SWITCH TO DAYLIGHT SAVINGS TIME; PORTLAND SHOWS AIR ONE HOUR EARLIER
A70: 22036 | H70: Breadbasket, U.S.A. | I70: Jet Jackson | J70: William Tell | K70: Movie: TBA | O70: Fun in the Sun | P70: [11:55] Baseball (ABC) San Francisco Giants vs. Los Angeles Dodgers | T70: [2:15] Press Box--Jimmy Jones | U70: Guy Lombardo | V70: Championship Billiards | X70: Championship Bowling | Z70: Top Pro Golf (ABC) | AB70: Home Run Derby | AC70: Dick Clark (ABC) | AD70: High Road (ABC) | AE70: Leave it to Beaver (ABC) | AF70: The Lawrence Welk Show (ABC) | AH70: Jubilee, U.S.A. (ABC) | AI70: Portland Amateur Boxing | AK70: Danger is My Business | AL70: News; [11:15] Movie [Action]: Rogues' Regiment (1948) | AX70: =A70 -> 22036
A71: 22043 | H71: Breadbasket, U.S.A. | I71: Jet Jackson | J71: William Tell | K71: Movie [Cinema 12]: Thunder in the Valley (1947) | O71: Fun in the Sun | P71: [11:55] Baseball (ABC) Pittsburgh Pirates vs. San Francisco Giants | T71: [2:15] Press Box--Jimmy Jones | U71: Guy Lombardo | V71: Championship Billiards | X71: Championship Bowling | Z71: Top Pro Golf (ABC) | AB71: Home Run Derby | AC71: Dick Clark (ABC) | AD71: High Road (ABC) | AE71: Leave it to Beaver (ABC) | AF71: The Lawrence Welk Show (ABC) | AH71: Jubilee, U.S.A. (ABC) | AI71: Portland Amateur Boxing | AK71: Danger is My Business | AL71: News; [11:15] Movie [Action Theater]: Dilinger (1945) | AX71: =A71 -> 22043
A72: 22050 | H72: Breadbasket, U.S.A. | I72: Jet Jackson | J72: William Tell | K72: Movie [Cinema 12]: The Hard Way (1942) | O72: Fun in the Sun | P72: [11:55] Baseball (ABC) Los Angeles Dodgers vs. San Francisco Giants | T72: [2:15] Press Box--Jimmy Jones | U72: Guy Lombardo | V72: Championship Billiards | X72: Championship Bowling | Z72: Top Pro Golf (ABC) | AB72: Home Run Derby | AC72: Dick Clark (ABC) | AD72: High Road (ABC) | AE72: Leave it to Beaver (ABC) | AF72: The Lawrence Welk Show (ABC) | AH72: Jubilee, U.S.A. (ABC) | AI72: Portland Amateur Boxing; [10:25] Baseball Roundup | AK72: Danger is My Business | AL72: News; [11:15] Movie [Action Theater]: Hudson's Bay (1940) | AX72: =A72 -> 22050
A73: 22057 | H73: Breadbasket, U.S.A. | I73: Jet Jackson | J73: William Tell | K73: Charlie Chan | L73: Movie [Cinema 12]: The Time, the Place and the Girl (?) | P73: [11:55] Baseball (ABC) Washington Senators vs. Kansas City Athletics | T73: [2:15] Press Box--Jimmy Jones | U73: Guy Lombardo | V73: Championship Billiards | X73: Championship Bowling | Z73: Top Pro Golf (ABC) | AB73: Home Run Derby | AC73: Dick Clark (ABC) | AD73: High Road (ABC) | AE73: Leave it to Beaver (ABC) | AF73: The Lawrence Welk Show (ABC) | AH73: Jubilee, U.S.A. (ABC) | AI73: Portland Amateur Boxing; [10:25] Baseball Roundup | AK73: Danger is My Business | AL73: News; [11:15] Movie [Action Theater]: Back to Bataan (1945) | AX73: =A73 -> 22057
A75: 22071 | H75: Breadbasket, U.S.A. | I75: Jet Jackson | J75: William Tell | K75: Charlie Chan | L75: [9:45] Movie [Cinema 12]: TBA | P75: [11:55] Baseball (ABC) St. Louis Cardinals vs. San Francisco Giants | T75: [2:15] Press Box--Jimmy Jones | U75: Guy Lombardo | V75: Championship Billiards | X75: Championship Bowling | Z75: Top Pro Golf (ABC) | AB75: Home Run Derby | AC75: Dick Clark (ABC) | AD75: High Road (ABC) | AE75: Leave it to Beaver (ABC) | AF75: The Lawrence Welk Show (ABC) | AH75: Jubilee, U.S.A. (ABC) | AI75: Portland Amateur Boxing; [10:25] Baseball Roundup | AK75: Danger is My Business | AL75: News; [11:15] Movie [Action Theater]: TBA | AX75: =A75 -> 22071
A76: 22078 | H76: Breadbasket, U.S.A. | I76: Jet Jackson | J76: William Tell | K76: Charlie Chan | L76: [9:45] Movie [Cinema 12]: African Queen (1952) | P76: [11:55] Baseball (ABC) Milwaukee Braves vs. San Francisco Giants | T76: [2:15] Press Box--Jimmy Jones | U76: Guy Lombardo | V76: Championship Billiards | X76: Championship Bowling | Z76: Top Pro Golf (ABC) | AB76: Home Run Derby | AC76: Dick Clark (ABC) | AD76: High Road (ABC) | AE76: Leave it to Beaver (ABC) | AF76: The Lawrence Welk Show (ABC) | AH76: Jubilee, U.S.A. (ABC) | AI76: Portland Amateur Boxing; [10:25] Baseball Roundup | AK76: Danger is My Business | AL76: News; [11:15] Movie [Action Theater]: The Iriquois Trail (1950) | AX76: =A76 -> 22078
A77: 22085 | H77: Breadbasket, U.S.A. | I77: Jet Jackson | J77: William Tell | K77: Charlie Chan | L77: [9:45] Movie [Cinema 12]: Irene (1940) | P77: [11:55] Baseball (ABC) Philadelphia Phillies vs. San Francisco Giants | T77: [2:15] Press Box--Jimmy Jones | U77: Guy Lombardo | V77: Championship Billiards | X77: Championship Bowling | Z77: Top Pro Golf (ABC) | AB77: Home Run Derby | AC77: Dick Clark (ABC) | AD77: High Road (ABC) | AE77: Leave it to Beaver (ABC) | AF77: The Lawrence Welk Show (ABC) | AH77: Jubilee, U.S.A. (ABC) | AI77: Portland Amateur Boxing; [10:25] Baseball Roundup | AK77: Danger is My Business | AL77: News; [11:15] Movie [Action Theater]: The Prowler (1951) | AX77: =A77 -> 22085
A78: 22092 | H78: Breadbasket, U.S.A. | I78: Jet Jackson | J78: William Tell | K78: Charlie Chan | L78: [9:45] Movie [Cinema 12]: Return to Paradise (1953) | P78: [11:55] Baseball (ABC) Baltimore Orioles vs. Kansas City Athletics | T78: [2:15] Press Box--Jimmy Jones | U78: Guy Lombardo | V78: Championship Billiards | X78: Championship Bowling | Z78: Top Pro Golf (ABC) | AB78: Home Run Derby | AC78: Dick Clark (ABC) | AD78: High Road (ABC) | AE78: Leave it to Beaver (ABC) | AF78: The Lawrence Welk Show (ABC) | AH78: Jubilee, U.S.A. (ABC) | AI78: Portland Amateur Boxing; [10:25] Baseball Roundup | AK78: The Crusader | AL78: News; [11:15] Movie [Action Theater]: Crashout (1955) | AX78: =A78 -> 22092
A79: 22099 | H79: Breadbasket, U.S.A. | I79: Jet Jackson | J79: William Tell | K79: Boots and Saddles | L79: Movie [Cinema 12]: In Which We Serve (1942) | P79: [11:55] Baseball (ABC) Cleveland Indians vs. Washington Senators | T79: [2:15] Press Box--Jimmy Jones | U79: Guy Lombardo | V79: Top Plays | W79: Famous Playhouse | X79: Championship Bowling | Z79: Top Pro Golf (ABC) | AB79: Home Run Derby | AC79: Dick Clark (ABC) | AD79: High Road (ABC) | AE79: Leave it to Beaver (ABC) | AF79: The Lawrence Welk Show (ABC) | AH79: Jubilee, U.S.A. (ABC) | AI79: Portland Amateur Boxing; [10:25] Baseball Roundup | AK79: The Crusader | AL79: News; [11:15] Movie [Action Theater]: White Heat (1949) | AX79: =A79 -> 22099
A81: 21962 | H81: Breadbasket, U.S.A. | I81: Jet Jackson | J81: William Tell | K81: Boots and Saddles | L81: Movie [Cinema 12]: The Life of Emile Zola (1932) | P81: [11:55] Baseball (ABC) Los Angeles Dodgers vs. San Francisco Giants | U81: Guy Lombardo | V81: Top Plays | W81: Famous Playhouse | X81: Championship Bowling | Z81: Top Pro Golf (ABC) | AB81: Home Run Derby | AC81: Dick Clark (ABC) | AD81: High Road (ABC) | AE81: Leave it to Beaver (ABC) | AF81: The Lawrence Welk Show (ABC) | AH81: Jubilee, U.S.A. (ABC) | AI81: Portland Amateur Boxing; [10:25] Baseball Roundup | AK81: The Crusader | AL81: News; [11:15] Movie [Action Theater]: Shield for Murder (1954) | AX81: =A81 -> 21962
A82: 22120 | H82: Breadbasket, U.S.A. | I82: Jet Jackson | J82: Hawkeye | K82: Boots and Saddles | L82: Movie [Cinema 12]: Stairway to Heaven (English; 1946) | P82: [11:55] Baseball (ABC) Pittsburgh Pirates vs. San Francisco Giants | U82: Guy Lombardo | V82: Top Plays | W82: Famous Playhouse | X82: Championship Bowling | Z82: Top Pro Golf (ABC) | AB82: Home Run Derby | AC82: Dick Clark (ABC) | AD82: High Road (ABC) | AE82: Leave it to Beaver (ABC) | AF82: The Lawrence Welk Show (ABC) | AH82: Jubilee, U.S.A. (ABC) | AI82: Portland Amateur Boxing; [10:25] Baseball Roundup | AK82: The Crusader | AL82: News; [11:15] Movie [Action Theater]: Gold is Where You Find It (1938) | AX82: =A82 -> 22120
A83: 22127 | H83: Breadbasket, U.S.A. | I83: Jet Jackson | J83: Hawkeye | K83: Boots and Saddles | L83: Movie [Cinema 12]: Great Expectations (English; 1947) | P83: [11:55] Baseball (ABC) Cincinnati Reds vs. San Francisco Giants | U83: Guy Lombardo | V83: Top Plays | W83: Famous Playhouse | X83: Championship Bowling | Z83: Top Pro Golf (ABC) | AB83: Home Run Derby | AC83: Dick Clark (ABC) | AD83: High Road (ABC) | AE83: Leave it to Beaver (ABC) | AF83: The Lawrence Welk Show (ABC) | AH83: Jubilee, U.S.A. (ABC) | AI83: Portland Amateur Boxing; [10:25] Baseball Roundup | AK83: The Crusader | AL83: News; [11:15] Movie [Action Theater]: The Lusty Men (1952) | AX83: =A83 -> 22127
A84: 22134 | H84: Breadbasket, U.S.A. | I84: Jet Jackson | J84: Hawkeye | K84: Boots and Saddles | L84: Movie [Cinema 12]: Always Leave Them Laughing (1949) | P84: [11:55] Baseball (ABC) New York Yankees vs. Kansas City Athletics | U84: Guy Lombardo | V84: Top Plays | W84: Famous Playhouse | X84: Championship Bowling | Z84: Top Pro Golf (ABC) | AB84: Home Run Derby | AC84: Dick Clark (ABC) | AD84: High Road (ABC) | AE84: Leave it to Beaver (ABC) | AF84: The Lawrence Welk Show (ABC) | AH84: Fashion Show | AI84: Portland Amateur Boxing; [10:25] Baseball Roundup | AK84: The Crusader | AL84: News; [11:15] Movie [Action Theater]: Adventures of Robin Crusoe (1954) | AX84: =A84 -> 22134
A85: 22141 | H85: Breadbasket, U.S.A. | I85: Jet Jackson | J85: Hawkeye | K85: Boots and Saddles | L85: Movie [Cinema 12]: Always Leave Them Laughing (1949) | P85: [11:55] Baseball (ABC) New York Yankees vs. Kansas City Athletics | U85: Guy Lombardo | V85: Top Plays | W85: Famous Playhouse | X85: Championship Bowling | Z85: Top Pro Golf (ABC) | AB85: Home Run Derby | AC85: Dick Clark (ABC) | AD85: High Road (ABC) | AE85: Leave it to Beaver (ABC) | AF85: The Lawrence Welk Show (ABC) | AH85: Jubilee, U.S.A. (ABC) | AI85: Portland Amateur Boxing; [10:25] Baseball Roundup | AK85: The Crusader | AL85: News; [11:15] Movie [Action Theater]: Adventures of Robin Crusoe (1954) | AX85: =A85 -> 22141
A86: 22148 | H86: Breadbasket, U.S.A. | I86: Jet Jackson | J86: Hawkeye | K86: Boots and Saddles | L86: Movie [Cinema 12]: That Hamilton Woman (1941) | P86: [11:55] Baseball (ABC) Chicago Cubs vs. Philadelphia Phillies | U86: Guy Lombardo | V86: Top Plays | W86: Famous Playhouse | X86: Championship Bowling | Z86: Top Pro Golf (ABC) | AB86: Home Run Derby | AC86: Dick Clark (ABC) | AD86: High Road (ABC) | AE86: Leave it to Beaver (ABC) | AF86: The Lawrence Welk Show (ABC) | AH86: Jubilee, U.S.A. (ABC) | AI86: Portland Amateur Boxing; [10:25] Baseball Roundup | AK86: The Crusader | AL86: News; [11:15] Movie [Action Theater]: They Won't Forget (1937) | AX86: =A86 -> 22148
A87: 22155 | H87: Breadbasket, U.S.A. | I87: Jet Jackson | J87: Hawkeye | K87: Sports Greatest Thrills; [9:45] Little League World Series (ABC) | P87: [11:55] Baseball (ABC) Milwaukee Braves vs. San Francisco Giants | U87: Guy Lombardo | V87: Top Plays | W87: Famous Playhouse | X87: Championship Bowling | Z87: Top Pro Golf (ABC) | AB87: Home Run Derby | AC87: Dick Clark (ABC) | AD87: High Road (ABC) | AE87: Leave it to Beaver (ABC) | AF87: The Lawrence Welk Show (ABC) | AH87: Jubilee, U.S.A. (ABC) | AI87: Portland Amateur Boxing; [10:25] Baseball Roundup | AK87: The Crusader | AL87: News; [11:15] Movie [Action Theater]: The Long Wait (1954) | AX87: =A87 -> 22155
A88: 22162 | H88: Breadbasket, U.S.A. | I88: Jet Jackson | J88: Hawkeye | K88: Boots and Saddles | L88: Movie [Cinema 12]: The Road to Glory (1936) | P88: [11:55] Baseball (ABC) Los Angeles Dodgers vs. San Francisco Giants | U88: Guy Lombardo | V88: Top Plays | W88: Famous Playhouse | X88: Championship Bowling | Z88: Top Pro Golf (ABC) | AB88: Home Run Derby | AC88: Dick Clark (ABC) | AD88: High Road (ABC) | AE88: Leave it to Beaver (ABC) | AF88: The Lawrence Welk Show (ABC) | AH88: Jubilee, U.S.A. (ABC) | AI88: Portland Amateur Boxing; [10:25] Baseball Roundup | AK88: The Crusader | AL88: News; [11:15] Movie [Action Theater]: Janie Gets Married (1946) | AX88: =A88 -> 22162
A89: 22169 | H89: Breadbasket, U.S.A. | I89: Jet Jackson | J89: Hawkeye | K89: Boots and Saddles | L89: Movie [Cinema 12]: The Good Die Young (English; 1954) | P89: [11:55] Baseball (ABC) St. Louis Cardinals vs. Philadelphia Phillies | U89: Guy Lombardo | V89: Top Plays | W89: Famous Playhouse | X89: Championship Bowling | Z89: Top Pro Golf (ABC) | AB89: Home Run Derby | AC89: Dick Clark (ABC) | AD89: High Road (ABC) | AE89: Leave it to Beaver (ABC) | AF89: The Lawrence Welk Show (ABC) | AH89: Jubilee, U.S.A. (ABC) | AI89: Portland Amateur Boxing; [10:25] Baseball Roundup | AK89: The Crusader | AL89: News; [11:15] Movie [Action Theater]: The Brain Machine (English; 1956) | AX89: =A89 -> 22169
A90: 22176 | H90: Breadbasket, U.S.A. | I90: Ranch Party | J90: [8:55] Baseball (ABC) Boston Red Sox vs. Washington Senators | O90: [11:45] NCAA College Football (ABC) Georgia vs. Alabama | V90: Championship Bowling | X90: TV Showcase of Homes | Z90: Top Pro Golf (ABC) | AB90: Home Run Derby | AC90: Rendezvous with Adventure | AD90: High Road (ABC) | AE90: Leave it to Beaver (ABC) | AF90: The Lawrence Welk Show (ABC) | AH90: Jubilee, U.S.A. (ABC) | AI90: Portland Amateur Boxing; [10:25] Baseball Roundup | AK90: The Crusader | AL90: News; [11:15] Movie [Action Theater]: An Act of Murder (1948) | AX90: =A90 -> 22176
A91: 22183 | H91: Abbott and Costello | I91: Football Kickoff (ABC) | J91: [8:45] College Football (ABC) Michigan State vs. Pittsburgh | P91: [11:55] Baseball (ABC) Baltimore Orioles vs. Washington Senators | U91: Guy Lombardo | V91: Championship Bowling | X91: TV Showcase of Homes | Z91: Top Pro Golf (ABC) | AB91: Home Run Derby | AC91: Campaign Roundup (ABC) | AD91: Vagabond | AE91: Leave it to Beaver (ABC) | AF91: The Lawrence Welk Show (ABC) | AH91: Jubilee, U.S.A. (ABC) | AI91: Portland Amateur Boxing; [10:25] Baseball Roundup | AK91: The Crusader | AL91: News; [11:15] Movie [Action Theater]: Two Years Before the Mast (1946) | AX91: =A91 -> 22183
B92: OTHER CITIES SWITCH TO STANDARD TIME; PORTLAND SHOWS AIR ONE HOUR LATER | J92: OTHER CITIES SWITCH TO STANDARD TIME; PORTLAND SHOWS AIR ONE HOUR LATER | R92: OTHER CITIES SWITCH TO STANDARD TIME; PORTLAND SHOWS AIR ONE HOUR LATER | Z92: OTHER CITIES SWITCH TO STANDARD TIME; PORTLAND SHOWS AIR ONE HOUR LATER | AH92: OTHER CITIES SWITCH TO STANDARD TIME; PORTLAND SHOWS AIR ONE HOUR LATER | AP92: OTHER CITIES SWITCH TO STANDARD TIME; PORTLAND SHOWS AIR ONE HOUR LATER
A93: 22190 | H93: Abbott and Costello | I93: Jet Jackson | J93: Sergeant Preston of the Yukon | K93: Robin Hood | L93: Hawkeye | M93: Football Kickoff (ABC) [10:45] College Football (ABC) Syracuse University vs. University of Kansas | T93: Big Camera--Bob Brown | U93: Rendezvous with Adventure | V93: Championship Bowling | X93: TV Showcase of Homes | Z93: Top Pro Golf (ABC) | AB93: Home Run Derby | AC93: Rendezvous with Adventure | AD93: Portland Amateur Boxing; [7:55] Sports Final | AF93: Vagabond | AG93: Leave it to Beaver (ABC) | AH93: The Lawrence Welk Show (ABC) | AJ93: Movie [Movie 12]: Arch of Triumph (1948) | AX93: =A93 -> 22190
A94: 22197 | H94: Abbott and Costello | I94: Jet Jackson | J94: Sergeant Preston of the Yukon | K94: Robin Hood | L94: Movie [Cinema 12]: Three is a Family (1944) | O94: Big Camera--Bob Brown | P94: Home Run Derby | Q94: Football Kickoff (ABC) [12:45] College Football (ABC) Washington Huskies vs. Stanford Indians | X94: TV Showcase of Homes | Z94: Top Pro Golf (ABC) | AB94: Championship Boxing (ABC); [6:45] TBA | AD94: Portland Amateur Boxing; [7:55] Sports Final | AF94: Vagabond | AG94: Leave it to Beaver (ABC) | AH94: The Lawrence Welk Show (ABC) | AJ94: Movie [Movie 12]: Beau Geste (1939) | AX94: =A94 -> 22197
A95: 22204 | H95: Abbott and Costello | I95: Jet Jackson | J95: Football Kickoff (ABC); [9:15] College Football (ABC) Air Force vs. Navy | P95: [12:15] Post Game Scoreboard (ABC) | Q95: Home Run Derby | R95: Big Camera--Bob Brown | S95: Movie [Cinema 12]: The Broken Star (1956) | V95: Championship Bowling | X95: TV Showcase of Homes | Z95: All-Star Golf (ABC) | AB95: Championship Boxing (ABC); [6:45] Make That Spare (ABC) | AD95: Portland Amateur Boxing; [7:55] Sports Final | AF95: Vagabond | AG95: Leave it to Beaver (ABC) | AH95: The Lawrence Welk Show (ABC) | AJ95: The Roaring 20's (ABC) | AL95: News; Movie [Movie 12]: Streets of Laredo (1949) | AX95: =A95 -> 22204
A96: 22211 | H96: Abbott and Costello | I96: Jet Jackson | J96: Sergeant Preston of the Yukon | K96: Robin Hood | L96: Football Kickoff (ABC) [10:15] College Football (ABC) Notre Dame vs. Northwestern | S96: Home Run Derby | T96: Big Camera--Bob Brown | U96: Championship Bridge with Charles Goren (ABC) | V96: Top Plays | X96: TV Showcase of Homes | Z96: All-Star Golf (ABC) | AB96: Championship Boxing (ABC); [6:45] Make That Spare (ABC) | AD96: Portland Amateur Boxing; [7:55] Sports Final | AF96: Vagabond | AG96: Leave it to Beaver (ABC) | AH96: The Lawrence Welk Show (ABC) | AJ96: The Roaring 20's (ABC) | AL96: News; Movie [Movie 12]: The Big Clock (1948) | AX96: =A96 -> 22211
A97: 22218 | H97: Abbott and Costello | I97: Jet Jackson | J97: Sergeant Preston of the Yukon | K97: Robin Hood | L97: TV Showcase of Homes | N97: Top Plays | P97: Championship Bridge with Charles Goren (ABC) | Q97: Heart of the City | R97: Football Kickoff (ABC) [1:15] College Football (ABC) California vs. Oregon State | X97: TV Showcase of Homes | Z97: All-Star Golf (ABC) | AB97: Championship Boxing (ABC); [6:45] Make That Spare (ABC) | AD97: Portland Amateur Boxing; [7:55] Sports Final | AF97: Vagabond | AG97: Leave it to Beaver (ABC) | AH97: The Lawrence Welk Show (ABC) [9:55] Political Talk--Republican (ABC) | AJ97: The Roaring 20's (ABC) | AL97: News; Movie [Movie 12]: The Uninvited (1944) | AX97: =A97 -> 22218
A98: 22225 | H98: Abbott and Costello | I98: Jet Jackson | J98: Sergeant Preston of the Yukon | K98: Robin Hood | L98: Football Kickoff (ABC) [10:15] College Football (ABC) Syracuse vs. Army | S98: Movie: A Foreign Affair (1948) | W98: Championship Bridge with Charles Goren (ABC) | X98: TV Showcase of Homes | Z98: All-Star Golf (ABC) | AB98: Portland Amateur Boxing; [6:55] Sports Final | AD98: Championship Boxing (ABC); [7:45] Make That Spare (ABC) | AF98: Vagabond | AG98: Leave it to Beaver (ABC) | AH98: The Lawrence Welk Show (ABC) [9:55] Political Talk--Republican (ABC) | AJ98: The Roaring 20's (ABC) | AL98: News; Movie [Movie 12]: State of the Union (1948) | AX98: =A98 -> 22225
A99: 22232 | H99: Abbott and Costello | I99: Jet Jackson | J99: Sergeant Preston of the Yukon | K99: Robin Hood | L99: Hawkeye | M99: Charlie Chan | N99: Football Kickoff (ABC) [11:15] College Football (ABC) Ohio State vs Iowa [2:15] Post Game Scoreboard (ABC) | U99: Heart of the City | V99: Championship Bridge with Charles Goren (ABC) | W99: Top Plays | X99: TV Showcase of Homes | Z99: All-Star Golf (ABC) | AB99: Portland Amateur Boxing; [6:55] Sports Final | AD99: Championship Boxing (ABC); [7:45] Make That Spare (ABC) | AF99: Vagabond | AG99: Leave it to Beaver (ABC) | AH99: The Lawrence Welk Show (ABC) | AJ99: The Roaring 20's (ABC) | AL99: News; Movie [Movie 12]: Rangers of Fortune (1940) | AX99: =A99 -> 22232
A100: 22239 | H100: Abbott and Costello | I100: Jet Jackson | J100: Sergeant Preston of the Yukon | K100: Robin Hood | L100: TV Showcase of Homes | N100: Top Plays | P100: Championship Bridge with Charles Goren (ABC) | Q100: Western Square Dance | R100: Football Kickoff (ABC) [1:15] College Football (ABC) Stanford vs. California | X100: TV Showcase of Homes | Z100: All-Star Golf (ABC) | AB100: Portland Amateur Boxing; [6:55] Sports Final | AD100: Championship Boxing (ABC); [7:45] Make That Spare (ABC) | AF100: Vagabond | AG100: Leave it to Beaver (ABC) | AH100: The Lawrence Welk Show (ABC) | AJ100: The Roaring 20's (ABC) | AL100: News; Movie [Movie 12]: Beyond Glory (1948) | AX100: =A100 -> 22239
A101: 22246 | H101: Abbott and Costello | I101: Jet Jackson | J101: Sergeant Preston of the Yukon | K101: Robin Hood | L101: Football Kickoff (ABC) [10:15] College Football (ABC) Army vs. Navy; [1:15] Post Game Scoreboard | S101: Western Square Dance | T101: Movie [Cinema 12]: The Fighting Guardsman (1945) | X101: TV Showcase of Homes | Z101: All-Star Golf (ABC) | AB101: Portland Amateur Boxing; [6:55] Sports Final | AD101: Championship Boxing (ABC); [7:45] Make That Spare (ABC) | AF101: Vagabond | AG101: Leave it to Beaver (ABC) | AH101: The Lawrence Welk Show (ABC) | AJ101: The Roaring 20's (ABC) | AL101: News; Movie [Movie 12]: Murder, He Says (1945) | AX101: =A101 -> 22246
A102: 22253 | H102: Abbott and Costello | I102: Jet Jackson | J102: Sergeant Preston of the Yukon | K102: Robin Hood | L102: TV Showcase of Homes | N102: Top Plays | P102: Championship Bridge with Charles Goren (ABC) | Q102: Western Square Dance | R102: Football Kickoff (ABC) [1:15] College Football (ABC) Duke vs. UCLA; [4:15] Post Game Scoreboard | Y102: TV Showcase of Homes | AB102: Portland Amateur Boxing; [6:55] Sports Final | AD102: Championship Boxing (ABC); [7:45] Make That Spare (ABC) | AF102: Vagabond | AG102: Leave it to Beaver (ABC) | AH102: The Lawrence Welk Show (ABC) | AJ102: The Roaring 20's (ABC) | AL102: News; Movie [Movie 12]: Frenchman's Creek (1944) | AX102: =A102 -> 22253
A103: 22260 | H103: Abbott and Costello | I103: Jet Jackson | J103: Sergeant Preston of the Yukon | K103: Robin Hood | L103: Movie: Sundown Jim (1942) | O103: Movie: Gunfighters (1947) | R103: Movie: So Well Remembered (English; 1947) | U103: Championship Bridge with Charles Goren (ABC) | V103: Top Plays | W103: Western Square Dance | X103: TV Showcase of Homes | Z103: All-Star Golf (ABC) | AB103: Portland Amateur Boxing; [6:55] Sports Final | AD103: Championship Boxing (ABC) [Special] | AF103: Vagabond | AG103: Leave it to Beaver (ABC) | AH103: The Lawrence Welk Show (ABC) | AJ103: The Roaring 20's (ABC) | AL103: News; Movie [Movie 12]: Lady in the Dark (1944) | AX103: =A103 -> 22260
A104: 22267 | H104: Abbott and Costello | I104: Jet Jackson | J104: Sergeant Preston of the Yukon | K104: Robin Hood | L104: Movie: Americano (1954) | O104: Movie: The Call of the Wild (1935) | R104: Movie: The Cruel Tower (1956) | U104: Championship Bridge with Charles Goren (ABC) | V104: Case History Theater | W104: Western Square Dance | X104: TV Showcase of Homes | Z104: All-Star Golf (ABC) | AB104: Portland Amateur Boxing; [6:55] Sports Final | AD104: Championship Boxing (ABC); [7:45] Make That Spare (ABC) | AF104: Vagabond | AG104: Leave it to Beaver (ABC) | AH104: The Lawrence Welk Show (ABC) | AJ104: The Roaring 20's (ABC) | AL104: News; Movie [Movie 12]: Catherine the Great (1954) | AX104: =A104 -> 22267
A105: 22274 | H105: Abbott and Costello | I105: Jet Jackson | J105: Sergeant Preston of the Yukon | K105: Robin Hood | L105: Movie: The Arizona Ranger (1948) | O105: Movie: Please Murder Me (1956) | R105: Movie: The Foxes of Harrow (1947) | U105: Championship Bridge with Charles Goren (ABC) | V105: Case History Theater | W105: Western Square Dance | X105: TV Showcase of Homes | Z105: All-Star Golf (ABC) | AB105: The Night Before Christmas [Special]; [6:55] Sports Final | AD105: Sports Highlights of 1960 (ABC) [Special]; Christmas Carols (ABC) [Special] | AF105: Vagabond | AG105: Leave it to Beaver (ABC) | AH105: The Lawrence Welk Show (ABC) | AJ105: The Roaring 20's (ABC) | AL105: News; Movie [Movie 12]: Nurse Edith Cavell (1939) | AX105: =A105 -> 22274
A106: 22281 | H106: Abbott and Costello | I106: Jet Jackson | J106: Sergeant Preston of the Yukon | K106: Robin Hood | L106: Movie: Bullet Code (1940) | O106: Movie: The Assassin (English; 1952) | R106: Movie: The Paradine Case (1947) | U106: Championship Bridge with Charles Goren (ABC) | V106: Top Plays | W106: Case History Theater | X106: TV Showcase of Homes | Z106: All-Star Golf (ABC) | AB106: Portland Amateur Boxing; [6:55] Sports Final | AD106: College Basketball (ABC) Holiday Festival Basketball Tournament; [7:45] Make That Spare (ABC) | AF106: Vagabond | AG106: Leave it to Beaver (ABC) | AH106: The Lawrence Welk Show (ABC) | AJ106: The Roaring 20's (ABC) | AL106: News; Movie [Movie 12]: One Night in Lisbon (1941) | AX106: =A106 -> 22281
A107: 1961 | AX107: =A107 -> 1961
AX108: =A108 -> 0
A109: 22477 | H109: Hawkeye | I109: The Bengal Lancers | J109: Sergeant Preston | K109: Matty's Funday Funnies | L109: Movie [Action Theater]: The Yellow Tomahawk (1954) | O109: Lake Oswego Jamboree | Q109: TV Showcase of Homes | S109: Dan Smoot; [1:45] Social Security | T109: Movie [Saturday Matinee]: The Country Husband (1956) | W109: Fun in the Sun | X109: Portland Bowling | Z109: Wide World of Sports (ABC) | AD109: Boxing: Rocky Fumerelle vs Don Fullmer (ABC); [7:45] Make That Spare (ABC) | AF109: Matty's Funday Funnies (ABC) | AG109: Leave it to Beaver (ABC) | AH109: The Lawrence Welk Show (ABC) | AJ109: The Roaring 20s (ABC) | AL109: News--William Lambert | AM109: [11:15] Movie [Movie 12]: Payment on Demand (1951)
A111: 23163 | I111: Robin Hood | J111: Burns and Allen | K111: Danger Zone | L111: TV Show of Homes | N111: Cartoonies | O111: Beany and Cecil | P111: Bugs Bunny | Q111: Allakazam | R111: Wide World of Sports (ABC) | U111: Wrestling-San Francisco | W111: Roller Derby: San Francisco Bombers vs. New York Chiefs | Y111: Cimarron City | AA111: My Friend Flicka | AB111: Treasure | AC111: High and Wild | AD111: Boxing: Harold Johnson vs. Willie Pastrano (ABC) | AF111: Tombstone Territory | AG111: Hootenanny (ABC) | AH111: The Lawrence Welk Show (ABC) | AJ111: Gallant Men (ABC) | AL111: Movie: A Foreign Affair (1948) | AX111: =A111 -> 23163
A113: 1964 | AX113: 1964
A114: 23429 | J114: Roller Derby | L114: Spinning Tops | M114: The Jetsons | N114: Casper | O114: Beany and Cecil | P114: Bugs Bunny | Q114: TV Show of Homes | S114: KPTV Hootenanny | T114: Zane Grey | U114: Challenge Golf | W114: Pro Bowler's Tour (ABC) | Z114: Wide World of Sports (ABC) | AC114: Portland Boxing; [7:25] Sports--Jimmy Jones | AE114: Hootenanny (ABC) | AG114: The Lawrence Welk Show (ABC) | AI114: Movie: Diplomatic Courier (1952) | AL114: [11:15] Movie: Broken Arrow (1950)
A118: 1965 | AX118: 1965
A119: 23996 | J119: [9:15] Primitive Arts | K119: [9:45] Cartoon Castle | L119: Movie: Gunga Din (1939) | P119: TV Show of Homes | R119: Sergeant Preston | S119: Movie: Along Came Jones (1945) | W119: Foreign Legionnaire | X119: The Outlaws | Z119: The Detectives | AB119: Hennesey | AC119: People Are Funny | AD119: Billy Graham Crusade--Special | AF119: Movie: The Deep Six (1958) | AJ119: Greatest Fights | AK119: Movie: White Huntress (1957) | AN119: Movie: Bedtime Story (1941)
A120: 24003 | J120: [9:15] Primitive Arts | K120: [9:45] Cartoon Castle | L120: Movie: The Spanish Main (1945) | P120: TV Show of Homes | R120: ? | S120: Roller Derby | T120: The Outlaws | V120: ? | W120: Canadian Pro Football: Ottawa Rough Riders vs. Hamilton Tiger Cats | AB120: Hennesey | AC120: Movie: Three Coins in the Fountain (1954) | AG120: Movie: Invasion of the Saucer Men (1957) | AJ120: Greatest Fights | AK120: Movie: Apache Woman (1955) | AN120: [12:05] Movie: Once Upon a Honeymoon (1942)
A123: 1970 | AX123: 1970
A124: 25571 | H124: Project 12 | I124: News--Don Stellges; [8:45] Social Security | J124: Government Story | K124: Gardening for Fun | M124: Faith to Faith | N124: Oregon at Work | O124: Insight | P124: Movie [Brunch Theater]: The Mummy's Hand (1940); The Mummy's Tomb (1942) | T124: Movie [Saturday Matinee]: The Mummy's Ghost (1944) | W124: Ham's Wide World | Y124: Hawaii Calls | Z124: Passport to Travel | AA124: The Big Valley | AC124: Movie [Hollywood's Best]: Tammy and the Doctor (1963) | AG124: The Don Stellges Report | AH124: The Galloping Gourmet | AI124: Portland Wrestling | AL124: College Basketball: Notre Dame vs UCLA (taped replay) | AP124: Roller Derby | AX124: =A124 -> 25571
A125: =A124+7 -> 25578 | H125: Project 12 | I125: News--Don Stellges; [8:45] Social Security | J125: Government Story | K125: Gardening for Fun | M125: Faith to Faith | N125: Oregon at Work | O125: Insight | P125: Movie [Brunch Theater]: The Man They Could Not Hang (1939); The Ghost of Frankenstein (1942); The Mummy's Curse (1944); [3:55] Film--Writing | X125: Film--Medicine; [4:15] Film--Investment | Y125: Hawaii Calls | Z125: Passport to Travel | AA125: The Big Valley | AC125: Movie [Hollywood's Best]: The Charge at Feather River (1953) | AG125: The Don Stellges Report | AH125: The Galloping Gourmet | AI125: Portland Wrestling | AL125: Roller Derby | AN125: Arrest and Trial | AX125: =A125 -> 25578
A126: =A125+7 -> 25585
A127: =A126+7 -> 25592 | H127: Campfire Girls | I127: News Review--Don Stellges; [8:45] Social Security | J127: Government Story | K127: Gardening for Fun | M127: Faith to Faith | N127: Oregon at Work | O127: Insight | P127: Film-- Medicine; [12:15] Film-- Investment | Q127: College Basketball: Utah Redskins vs BYU Cougars | U127: College Basketball: Oregon Ducks vs Oregon State Beavers | X127: Outdoors | Y127: Horse Racing-- The Royal Palm Handicap from Hialeah, Florida | Z127: Passport to Travel | AA127: The Big Valley | AC127: Movie [Hollywood's Best]: Wild and Wonderful (1964) | AG127: The Don Stellges Report | AH127: The Galloping Gourmet | AI127: Portland Wrestling | AL127: The David Frost Show | AO127: Roller Derby | AX127: =A127 -> 25592
A128: =A127+7 -> 25599 | H128: Project 12 | I128: News Review--Don Stellges; [8:45] Social Security | J128: Government Story | K128: Gardening for Fun | M128: College Basketball: Georgia Tech vs Air Force Academy | Q128: College Basketball: Colorado State vs Arizona State | U128: Roller Derby | W128: Time Machines | X128: Outdoors | Y128: Hawaii Calls | Z128: Passport to Travel | AA128: The Big Valley | AC128: Movie [Hollywood's Best]: Bus Riley's Back in Town (1965) | AG128: The Don Stellges Report | AH128: The Galloping Gourmet | AI128: Portland Wrestling | AL128: The David Frost Show | AO128: The Untouchables | AX128: =A128 -> 25599
A129: =A128+7 -> 25606 | H129: Project 12 | I129: News Review--Don Stellges; [8:45] Social Security | J129: Government Story | K129: Gardening for Fun | M129: Faith to Faith | N129: Oregon at Work | O129: Insight | P129: Film-- Medicine; [12:15] Film-- Investment | Q129: College Basketball: Arizona State vs Arizona | U129: Roller Derby | W129: Salvation Army | X129: Outdoors | Y129: Hawaii Calls | Z129: Passport to Travel | AA129: The Big Valley | AC129: Movie [Hollywood's Best]: Warlock (1959) | AG129: The Don Stellges Report | AH129: The Galloping Gourmet | AI129: Portland Wrestling | AL129: The David Frost Show | AO129: The Untouchables | AX129: =A129 -> 25606
A130: =A129+7 -> 25613 | H130: Project 12 | I130: News Review--Don Stellges; [8:45] Social Security | J130: Government Story | K130: Gardening for Fun | M130: College Basketball: Notre Dame Fighting Irish vs Detroit Titans | Q130: College Basketball: University of Wyoming vs University of New Mexico | U130: Movie [Saturday Matinee]: Gorilla at Large (1954) | X130: Outdoors | Y130: Hawaii Calls | Z130: Passport to Travel | AA130: The Big Valley | AC130: Movie [Hollywood's Best]: The Thrill of It All (1963) | AG130: [8:40] The Don Stellges Report | AH130: The Galloping Gourmet | AI130: Portland Wrestling | AL130: Roller Derby | AN130: The Untouchables | AX130: =A130 -> 25613
A131: =A130+7 -> 25620 | H131: Project 12 | I131: News Review--Don Stellges; [8:45] Social Security | J131: Government Story | K131: Gardening for Fun | M131: Faith to Faith | N131: College Basketball: UCLA Bruins vs Oregon State Beavers (taped replay) | Q131: College Basketball: Kentucky vs LSU | U131: College Basketball: Utah State Aggies vs Seattle Chieftains (taped replay) | Y131: Outdoors | Z131: Passport to Travel | AA131: The Big Valley | AC131: Movie [Hollywood's Best]: Fluffy (1965) | AG131: The Don Stellges Report | AH131: The Galloping Gourmet | AI131: Portland Wrestling | AL131: Roller Derby | AN131: The Untouchables | AX131: =A131 -> 25620
A132: =A131+7 -> 25627
A133: =A132+7 -> 25634 | H133: Project 12 | I133: Film-- Highway Safety Techinques; [8:45] Social Security | J133: Government Story | K133: Gardening for Fun | M133: Faith to Faith | N133: Oregon at Work | O133: Insight | P133: Movie [Brunch Theater]: The Adventures of Hajji Baba (1954) | T133: Movie [Saturday Matinee]: The Brides of Dracula (1960) | X133: Outdoors | Y133: Hawaii Calls | Z133: Passport to Travel | AA133: The Big Valley | AC133: Movie [Hollywood's Best]: The Rare Breed (1966) | AG133: [8:45] The Don Stellges Report | AH133: The Galloping Gourmet | AI133: Portland Wrestling | AL133: Roller Derby | AN133: The Untouchables | AX133: =A133 -> 25634
A134: =A133+7 -> 25641 | H134: Project 12 | I134: News Review--Don Stellges; [8:45] Social Security | J134: Government Story | K134: Gardening for Fun | M134: Faith to Faith | N134: Oregon at Work | O134: Insight | P134: Movie [Brunch Theater]: Gunpoint (1966) | T134: Movie [Saturday Matinee]: 13 Ghosts (1960) | X134: Outdoors | Y134: Hawaii Calls | Z134: Passport to Travel | AA134: The Big Valley | AC134: Movie [Hollywood's Best]: Diane (1955) | AG134: [8:45] The Don Stellges Report | AH134: The Galloping Gourmet | AI134: Portland Wrestling | AL134: Roller Derby | AN134: The Untouchables | AX134: =A134 -> 25641
A135: =A134+7 -> 25648 | H135: Project 12 | I135: News Review--Don Stellges; [8:45] Social Security | J135: Government Story | K135: Gardening for Fun | M135: Faith to Faith | N135: Oregon at Work | O135: Insight | P135: Movie [Brunch Theater]: Sierra Stranger (1957); [1:45] Film-- Investment | T135: Movie [Saturday Matinee]: Beast from 20,000 Fathoms (1953); [3:45] Film-- Investment | X135: Outdoors | Y135: Hawaii Calls | Z135: Passport to Travel | AA135: The Big Valley | AC135: Movie [Hollywood's Best]: Kitten with a Whip (1964) | AG135: Public Welfare -- Don Stellges | AI135: Portland Wrestling | AL135: Roller Derby | AN135: The Untouchables | AX135: =A135 -> 25648
A136: =A135+7 -> 25655 | H136: Salvation Army | I136: News Review--Don Stellges; [8:45] Social Security | J136: Government Story | K136: Gardening for Fun | M136: Faith to Faith | N136: Oregon at Work | O136: Insight | P136: Movie [Brunch Theater]: The Peacemaker (1956); [1:45] Film-- Investment | T136: Faces and Places | U136: Roller Derby | W136: Film-- Rodeo | Y136: Outdoors | Z136: Passport to Travel | AA136: The Big Valley | AC136: Movie [Hollywood's Best]: Fast and Sexy (1960) | AG136: Oral Roberts' Easter Special | AI136: Portland Wrestling | AL136: The David Frost Show | AX136: =A136 -> 25655
A137: =A136+7 -> 25662
A138: =A137+7 -> 25669 | H138: Salvation Army | I138: News Review--Don Stellges; [8:45] Social Security | J138: Government Story | K138: Gardening for Fun | M138: Faith to Faith | N138: Oregon at Work | O138: Insight | P138: Movie [Brunch Theater]: The Raid (1954) | T138: Movie [Saturday Matinee]: Seven Men from Now (1956) | X138: Outdoors | Y138: Hawaii Calls | Z138: Passport to Travel | AA138: The Big Valley | AC138: Movie [Hollywood's Best]: The Captain's Table (1958) | AG138: The Don Stellges Report; [8:45] Horse Race-- Portland | AH138: The Galloping Gourmet | AI138: Portland Wrestling | AL138: Roller Derby | AN138: The Untouchables | AX138: =A138 -> 25669
A139: =A138+7 -> 25676 | H139: The Don Stellges Report | I139: News Review--Don Stellges; [8:45] Social Security | J139: Government Story | K139: Gardening for Fun | M139: Faith to Faith | N139: Oregon at Work | O139: Insight | P139: Movie [Brunch Theater]: Carson City (1952) | T139: Movie [Saturday Matinee]: Santiago(1956) | X139: Outdoors | Y139: Hawaii Calls | Z139: Passport to Travel | AA139: The Big Valley | AC139: Movie [Hollywood's Best]: The Swan (1956) | AG139: The Don Stellges Report; [8:45] Horse Race-- Portland | AH139: The Galloping Gourmet | AI139: Portland Wrestling | AL139: Roller Derby | AN139: The Untouchables | AX139: =A139 -> 25676
A140: =A139+7 -> 25683
A141: =A140+7 -> 25690 | H141: Music Special | I141: News Review--Don Stellges; [8:45] Social Security | J141: Government Story | K141: Gardening for Fun | M141: Faith to Faith | N141: Oregon at Work | O141: Insight | P141: Movie [Brunch Theater]: Wrecking Crew (1942) | T141: Movie [Saturday Matinee]: Corridors of Blood (1958) | X141: Portrait | Z141: Passport to Travel | AA141: The Big Valley | AC141: Movie [Hollywood's Best]: The Last Sunset (1961) | AG141: [8:45] Horse Race-- Portland | AH141: The Galloping Gourmet | AI141: Portland Wrestling | AL141: Roller Derby | AN141: The David Frost Show | AX141: =A141 -> 25690
A142: =A141+7 -> 25697 | H142: The Don Stellges Report | I142: News Review--Don Stellges; [8:45] Social Security | J142: Government Story | K142: Gardening for Fun | M142: Faith to Faith | N142: Oregon at Work | O142: Insight | P142: Movie [Brunch Theater]: Black Bart (1948) | T142: Movie [Saturday Matinee]: The Man Behind the Gun (1953) | X142: Portrait | Z142: Passport to Travel | AA142: The Big Valley | AC142: Movie [Hollywood's Best]: Adam's Rib (1949) | AG142: [8:45] The Don Stellges Report | AH142: The Galloping Gourmet | AI142: Portland Wrestling | AL142: Roller Derby | AN142: Movie [Movie 12]: Shadow of Doubt (1943) | AX142: =A142 -> 25697
A143: =A142+7 -> 25704
A144: =A143+7 -> 25711 | H144: The Don Stellges Report | I144: News Review--Don Stellges; [8:45] Social Security | J144: Government Story | K144: Gardening for Fun | M144: Faith to Faith | N144: Oregon at Work | O144: Insight | P144: Movie [Brunch Theater]: Forever Darling (1956) | T144: Movie [Saturday Matinee]: Ride 'em Cowboyo (1942) | X144: Portrait | Z144: Passport to Travel | AA144: The Big Valley | AC144: Movie [Hollywood's Best]: Killers of Kilimanjaro (1960) | AG144: [8:45] The Don Stellges Report | AH144: The Galloping Gourmet | AI144: Portland Wrestling | AL144: Roller Derby | AN144: Movie [Movie 12]: Saboteur (1942) | AX144: =A144 -> 25711
A145: =A144+7 -> 25718 | H145: The Don Stellges Report | I145: News Review--Don Stellges; [8:45] Social Security | J145: Government Story | K145: Gardening for Fun | M145: Faith to Faith | N145: Oregon at Work | O145: Insight | P145: Faces and Places | Q145: Film-- Prop Plane Speed Record | R145: Man in Space (Special) | T145: Movie [Saturday Matinee]: The Prisoner of Zenda (1952) | X145: Portrait | Z145: Passport to Travel | AA145: The Big Valley | AC145: Movie [Hollywood's Best]: Tammy Tell Me True (1961) | AG145: Judd for the Defense | AI145: Portland Wrestling | AL145: Roller Derby | AN145: Movie [Movie 12]: The Web (1947) | AX145: =A145 -> 25718
A146: =A145+7 -> 25725 | H146: The Don Stellges Report | I146: News Review--Don Stellges; [8:45] Social Security | J146: Government Story | K146: Gardening for Fun | M146: Faith to Faith | N146: Oregon at Work | O146: Insight | P146: Movie [Brunch Theater]: Wildcat (1942) | T146: Movie [Saturday Matinee]: Cattle Empire (1958) | X146: Portrait | Z146: Passport to Travel | AA146: The Big Valley | AC146: Movie [Hollywood's Best]: The Student Prince (1954) | AG146: Judd for the Defense | AI146: Portland Wrestling | AL146: Roller Derby | AN146: Movie [Movie 12]: The Camp on Blood Island (1958) | AX146: =A146 -> 25725
A147: =A146+7 -> 25732 | H147: The Don Stellges Report | I147: News Review--Don Stellges; [8:45] Social Security | J147: Government Story | K147: Gardening for Fun | M147: Faith to Faith | N147: Oregon at Work | O147: Insight | P147: Movie [Brunch Theater]: Fort Dobbs (1958) | T147: Movie [Saturday Matinee]: Sierra Baron (1958) | X147: Portrait | Z147: Passport to Travel | AA147: The Big Valley | AC147: Movie [Hollywood's Best]: Kiss Them for Me (1957) | AG147: Judd for the Defense | AI147: Portland Wrestling | AL147: Roller Derby | AN147: Movie [Movie 12]: The Breaking Point (1950) | AX147: =A147 -> 25732
A148: =A147+7 -> 25739 | H148: The Don Stellges Report | I148: News Review--Don Stellges; [8:45] Social Security | J148: Government Story | K148: Gardening for Fun | M148: Faith to Faith | N148: Oregon at Work | O148: Insight | P148: Man In Space (Special) | R148: Film-- Surfing: Highlights of 1969 US Surfing Championships from Huntington Beach, California | T148: Movie [Saturday Matinee]: Riding Shotgun (1955) | X148: Portrait | Z148: Passport to Travel | AA148: The Big Valley | AC148: Movie [Hollywood's Best]: Rich, Young and Pretty (1951) | AG148: Dialogue-- Don Stellges | AI148: Portland Wrestling | AL148: Roller Derby | AN148: Movie [Movie 12]: Nightmare (1942) | AX148: =A148 -> 25739
A149: =A148+7 -> 25746 | H149: The Don Stellges Report | I149: News Review--Don Stellges; [8:45] Social Security | J149: Government Story | K149: Gardening for Fun | M149: Faith to Faith | N149: Oregon at Work | O149: Insight | P149: Movie [Brunch Theater]: Jim Thorpe--All American (1951) | T149: Movie [Saturday Matinee]: Sherlock Holmes and the Scarlet Claw (1944) | X149: Portrait | Z149: Rex Humbard | AA149: The Big Valley | AC149: Movie [Hollywood's Best]: Ride, Vaquero! (1953) | AG149: Judd for the Defense | AI149: Portland Wrestling | AL149: Roller Derby | AN149: Movie [Movie 12]: Before I Hang (1940) | AX149: =A149 -> 25746
A150: =A149+7 -> 25753 | H150: The Don Stellges Report | I150: News Review--Don Stellges; [8:45] Social Security | J150: Government Story | K150: Gardening for Fun | M150: Faith to Faith | N150: Oregon at Work | O150: Insight | P150: Movie [Brunch Theater]: Brighty of the Grand Canyon (1967) | T150: Movie [Saturday Matinee]: Beast from 20,000 Fathoms (1953) | X150: Portrait | Z150: Passport to Travel | AA150: The Big Valley | AC150: Movie [Hollywood's Best]: Bedtime Story (1964) | AG150: Judd for the Defense | AI150: Portland Wrestling | AL150: Roller Derby | AN150: Movie [Movie 12]: The Strange Case of Doctor Rx (1942) | AX150: =A150 -> 25753
A151: =A150+7 -> 25760 | H151: The Don Stellges Report | I151: News Review--Don Stellges; [8:45] Social Security | J151: Government Story | K151: Gardening for Fun | M151: Faith to Faith | N151: Oregon at Work | O151: Insight | P151: Movie [Brunch Theater]: The Naughty Nineties (1945) | T151: Movie [Saturday Matinee]: Beast from 20,000 Fathoms (1953) | X151: Portrait | Z151: Passport to Travel | AA151: The Big Valley | AC151: Movie [Hollywood's Best]: Bedtime Story (1964) | AG151: Judd for the Defense | AI151: Portland Wrestling | AL151: Roller Derby | AN151: Movie [Movie 12]: The Strange Case of Doctor Rx (1942) | AX151: =A151 -> 25760
A153: 1971 | AX153: =A153 -> 1971
A154: 25942 | E154: [6:45] News--Don Stellges | F154: Don Stellges Reports | G154: Wonderama | I154: Dimension | J154: Government Story | K154: Gardening for Fun | M154: Faith to Faith | N154: Oregon at Work | O154: Insight | P154: Faces and Places | Q154: College Basketball: Oregon State Beavers vs California Bears [FILM] | S154: [1:45] Film | T154: College Basketball: Arizona Wildcats vs. Wyoming Cowboys [LIVE] | X154: Singles Scene | Z154: Animals/ Adventure | AA154: Then Came Bronson | AC154: Movie: Three Guns for Texas (1965) | AG154: Portland Wrestling | AJ154: The 10 O'Clock News | AK154: Roller Derby | AM154: Movie: Harriet Craig (1950) | AX154: =A154 -> 25942
A156: 1972 | AX156: =A156 -> 1972
A159: 1973 | AX159: =A159 -> 1973
A162: 1974 | AX162: 1974
A163: 27392 | F163: [7:15} Columbia Crossroads; [7:45] News | H163: Gardening for Fun | J163: The Peach Bowl: Texas Tech Red Raiders vs Vanderbilt Commodores from Atlanta, Georgia | P163: Movie [Brunch Theater]: Kiss of Fire (1955) | T163: Land of the Giants | V163: Modesto Rios | W163: Audubon Wildlife Theater | X163: Roller Game of the Week | Z163: Jimmy Dean | AA163: That Good Ole Nashville Music | AB163: College Basketball: Championship Game in the Maryland Invitiational Tournament - UCLA vs Maryland | AF163: World of Survival | AG163: Portland Wrestling | AJ163: The 10 O'Clock News --Ted Warren | AK163: The Virginian | AN163: This is Tom Jones | AX163: =A163 -> 27392
A164: 1975 | AX164: 1975
A165: SATURDAY | B165: 05:00AM | C165: 05:30AM | D165: 06:00AM | E165: 06:30AM | F165: 07:00AM | G165: 07:30AM | H165: 08:00AM | I165: 08:30AM | J165: 09:00AM | K165: 09:30AM | L165: 10:00AM | M165: 10:30AM | N165: 11:00AM | O165: 11:30AM | P165: 12:00N | Q165: 12:30PM | R165: 01:00PM | S165: 01:30PM | T165: 02:00PM | U165: 02:30PM | V165: 03:00PM | W165: 03:30PM | X165: 04:00PM | Y165: 04:30PM | Z165: 05:00PM | AA165: 05:30PM | AB165: 06:00PM | AC165: 06:30PM | AD165: 07:00PM | AE165: 07:30PM | AF165: 08:00PM | AG165: 08:30PM | AH165: 09:00PM | AI165: 09:30PM | AJ165: 10:00PM | AK165: 10:30PM | AL165: 11:00PM | AM165: 11:30PM | AN165: 12:00M | AO165: 12:30AM | AP165: 01:00AM | AQ165: 01:30AM | AR165: 02:00AM | AS165: 02:30AM | AT165: 03:00AM | AU165: 03:30AM | AV165: 04:00AM | AW165: 04:30AM | AX165: SATURDAY
A166: 27398 | F166: [7:15} Columbia Crossroads; [7:45] News | H166: Columbia Crossroads | J166: Gardening for Fun | L166: 12 in the Morning | M166: Wally's Workshop | N166: Garner Ted Armstrong | O166: Modesto Rios | P166: Land of the Giants | R166: College Basketball: Notre Dame Fighting Irish vs Maryland Terrapins | V166: College Basketball: Providence Friars vs Oregon Ducks | Z166: Jimmy Dean | AA166: That Good Ole Nashville Music | AB166: CBS News--Dan Rather (CBS) | AC166: The Virginian | AF166: World of Survival | AG166: Portland Wrestling | AJ166: The 10 O'Clock News --Ted Warren | AK166: The Virginian | AN166: This is Tom Jones | AX166: =A166 -> 27398
A167: =A166+7 -> 27405 | F167: [7:15} Columbia Crossroads; [7:45] News | H167: A Year of Laurels | J167: Gardening for Fun | L167: 12 in the Morning | M167: Wally's Workshop | N167: Garner Ted Armstrong | O167: Modesto Rios | P167: Movie [Brunch Theater]: The Fighting O'Flynn (1948) | T167: Land of the Giants | V167: College Basketball: Nevada (Las Vegas) Rebels vs Pepperdine Waves | Z167: Jimmy Dean | AA167: That Good Ole Nashville Music | AB167: CBS News--Dan Rather (CBS) | AC167: The Virginian | AF167: World of Survival | AG167: Portland Wrestling | AJ167: The 10 O'Clock News --Ted Warren | AK167: The Virginian | AN167: This is Tom Jones | AX167: =A167 -> 27405
A168: =A167+7 -> 27412 | F168: [7:15} Columbia Crossroads; [7:45] News | H168: Columbia Crossroads | J168: Gardening for Fun | L168: 12 in the Morning | M168: Wally's Workshop | N168: Garner Ted Armstrong | O168: Modesto Rios | P168: Land of the Giants | R168: College Basketball: North Carolina Tar Heels vs North Carolina State Wolfpack | V168: College Basketball: USF Dons vs Nevada-Reno Wolf Pack | Z168: The Virginian | AC168: Movie [The Saturday Movie]: Wild Heritage (1958) | AF168: College Basketball: Oregon Ducks vs Washington Huskies--Jimmy Jones reports | AJ168: The 10 O'Clock News --Ted Warren | AK168: Portland Wrestling | AN168: Porter Wagoner | AO168: This is Tom Jones | AX168: =A168 -> 27412
A169: =A168+7 -> 27419 | F169: [7:15} Columbia Crossroads; [7:45] News | H169: Columbia Crossroads | J169: Gardening for Fun | L169: 12 in the Morning | M169: Wally's Workshop | N169: Garner Ted Armstrong | O169: Modesto Rios | P169: Land of the Giants | R169: College Basketball: UCLA Bruins vs Notre Dame Fighting Irish | V169: College Basketball: Oregon Ducks vs Oregon State Beavers | Z169: The Virginian | AC169: Movie [The Saturday Movie]: Destry (1954) | AG169: Portland Wrestling | AJ169: The 10 O'Clock News --Ted Warren | AK169: Porter Wagoner | AL169: The Virginian | AO169: Engelbert Humperdinck | AX169: =A169 -> 27419
A170: =A169+7 -> 27426 | F170: [7:15} Audubon Wildlife Theatre; [7:45] News | H170: Columbia Crossroads | J170: Gardening for Fun | L170: 12 in the Morning | M170: Wally's Workshop | N170: Garner Ted Armstrong | O170: Modesto Rios | P170: Land of the Giants | R170: College Basketball: Maryland Terrapins vs North Carolina State Wolfpack | V170: College Basketball: Stanford Cardinals vs California Golden Bears | Z170: The Virginian | AC170: Movie [The Saturday Movie]: Man Without a Star (1955) | AG170: Portland Wrestling | AJ170: The 10 O'Clock News --Ted Warren | AK170: Porter Wagoner | AL170: College Basketball: Hawaii Rainbows vs Oregon Ducks (taped replay) | AX170: =A170 -> 27426
A171: =A170+7 -> 27433 | F171: [7:15} Audubon Wildlife Theatre; [7:45] News | H171: Columbia Crossroads | J171: Gardening for Fun | L171: 12 in the Morning | M171: Wally's Workshop | N171: Garner Ted Armstrong | O171: Modesto Rios | P171: Land of the Giants | R171: Movie [Brunch Theater]: Winchester '73 (1950) | V171: College Basketball: San Diego State Aztecs vs San Jose State Spartans | Z171: The Virginian | AC171: Movie [The Saturday Movie]: Who Killed the Mysterious Mr. Foster? (1971) | AG171: Portland Wrestling | AJ171: The 10 O'Clock News --Ted Warren | AK171: Porter Wagoner | AL171: The Virginian | AO171: Engelbert Humperdinck | AX171: =A171 -> 27433
A172: =A171+7 -> 27440 | F172: [7:15} Audubon Wildlife Theatre; [7:45] News | H172: Columbia Crossroads | J172: Gardening for Fun | L172: 12 in the Morning | M172: Wally's Workshop | N172: Garner Ted Armstrong | O172: Modesto Rios | P172: Movie [Brunch Theater]: The Far Country (1955) | T172: Andy Williams San Diego Open | V172: College Basketball: Washington State Cougars vs Stanford Cardinals | Z172: The Virginian | AC172: Movie [The Saturday Movie]: Gun for a Coward (1957) | AG172: Portland Wrestling | AJ172: The 10 O'Clock News --Ted Warren | AK172: Porter Wagoner | AL172: The Virginian | AO172: Engelbert Humperdinck | AX172: =A172 -> 27440
A173: =A172+7 -> 27447 | F173: [7:15} Audubon Wildlife Theatre; [7:45] News | H173: Columbia Crossroads | J173: Gardening for Fun | L173: 12 in the Morning | M173: Wally's Workshop | N173: Garner Ted Armstrong | O173: Modesto Rios | P173: Land of the Giants | R173: Movie [Brunch Theater]: The King's Pirate (1967) | V173: College Basketball: USF Dons vs Seattle Chieftains | Z173: The Virginian | AC173: Movie [The Saturday Movie]: Ride a Crooked Trail (1958) | AG173: Portland Wrestling | AJ173: The 10 O'Clock News --Ted Warren | AK173: Porter Wagoner | AL173: The Virginian | AO173: Engelbert Humperdinck | AX173: =A173 -> 27447
A174: =A173+7 -> 27454 | F174: [7:15} Audubon Wildlife Theatre; [7:45] News | H174: Columbia Crossroads | J174: Gardening for Fun | L174: Carlos' Talent Search | M174: Wally's Workshop | N174: Garner Ted Armstrong | O174: Modesto Rios | P174: Land of the Giants | R174: Movie [Brunch Theater]: And Now Miguel (1966) | V174: College Basketball: California Golden Bears vs USC Trojans | Z174: The Virginian | AC174: Movie [The Saturday Movie]: Winchester for Hire (1967) | AG174: Portland Wrestling | AJ174: The 10 O'Clock News --Ted Warren | AK174: Porter Wagoner | AL174: The Virginian | AO174: Engelbert Humperdinck | AX174: =A174 -> 27454
A175: =A174+7 -> 27461 | F175: [7:15} Audubon Wildlife Theatre; [7:45] News | H175: Columbia Crossroads | J175: Gardening for Fun | L175: 12 in the Morning | M175: Wally's Workshop | N175: Garner Ted Armstrong | O175: Modesto Rios | P175: Land of the Giants | R175: Movie [Brunch Theater]: A Man Could Get Killed (1966) | V175: College Basketball: UCLA Bruins vs USC Trojans | Z175: The Virginian | AC175: Movie [The Saturday Movie]: Arizona Raiders (1965) | AF175: College Basketball: Oregon State Beavers vs Oregon Ducks | AJ175: The 10 O'Clock News --Ted Warren | AK175: Portland Wrestling | AN175: Porter Wagoner | AO175: Engelbert Humperdinck | AX175: =A175 -> 27461
A176: =A175+7 -> 27468 | F176: [7:15} Audubon Wildlife Theatre; [7:45] News | H176: Columbia Crossroads | J176: Gardening for Fun | L176: 12 in the Morning | M176: Wally's Workshop | N176: Garner Ted Armstrong | O176: Modesto Rios | P176: Land of the Giants | R176: Movie [Brunch Theater]: Backlash (1956) | V176: Pop! Goes the Country | W176: Bobby Goldsboro | X176: That Good Ole Nashville Music | Y176: Hank Thompson | Z176: The Virginian | AC176: Movie [The Saturday Movie]: Good Day for a Hanging (1959) | AG176: Portland Wrestling | AJ176: The 10 O'Clock News --Ted Warren | AK176: Porter Wagoner | AL176: The Virginian | AO176: This is Tom Jones | AX176: =A176 -> 27468
A177: =A176+7 -> 27475 | F177: [7:15} Audubon Wildlife Theatre; [7:45] News | H177: Columbia Crossroads | J177: Gardening for Fun | L177: 12 in the Morning | M177: Wally's Workshop | N177: Garner Ted Armstrong | O177: Modesto Rios | P177: Land of the Giants | R177: Movie [Brunch Theater]: Desert Legion (1953) | V177: Paris on a Shoestring | X177: Jimmy Dean | Y177: Hank Thompson | Z177: The Virginian | AC177: Movie [The Saturday Movie]: The Spoilers (1955) | AG177: Portland Wrestling | AJ177: The 10 O'Clock News --Ted Warren | AK177: Easter Seal Telethon | AR177: Easter Seal Telethon--Continues | AX177: =A177 -> 27475
A178: =A177+7 -> 27482 | F178: [7:15} Audubon Wildlife Theatre; [7:45] News | H178: Columbia Crossroads | J178: Gardening for Fun | L178: 12 in the Morning | M178: Wally's Workshop | N178: Garner Ted Armstrong | O178: Modesto Rios | P178: Land of the Giants | R178: Movie [Brunch Theater]: New York Confidential (1955) | U178: Movie [Saturday Matinee]: Against All Flags (1952) | X178: Safari to Adventure | Y178: Hank Thompson | Z178: The Virginian | AC178: Movie [The Saturday Movie]: Evil Roy Slade (1972) | AG178: Portland Wrestling | AJ178: The 10 O'Clock News --Ted Warren | AK178: Porter Wagoner | AL178: The Virginian | AO178: Engelbert Humperdinck | AX178: =A178 -> 27482
A179: =A178+7 -> 27489 | F179: [7:15} Audubon Wildlife Theatre; [7:45] News | H179: Columbia Crossroads | J179: Gardening for Fun | L179: 12 in the Morning | M179: Wally's Workshop | N179: Garner Ted Armstrong | O179: Modesto Rios | P179: Garner Ted Armstrong | Q179: Petticoat Junction | R179: Movie [Brunch Theater]: Johnny Dark (1954) | U179: Movie [Saturday Matinee]: The Kid from Texas (1950) | X179: Safari to Adventure | Y179: Hank Thompson | Z179: The Virginian | AC179: Movie [The Saturday Movie]: Seminole (1953) | AG179: Portland Wrestling | AJ179: The 10 O'Clock News --Ted Warren | AK179: Porter Wagoner | AL179: The Virginian | AO179: Engelbert Humperdinck | AX179: =A179 -> 27489
A180: =A179+7 -> 27496 | F180: [7:15} Audubon Wildlife Theatre; [7:45] News | H180: Columbia Crossroads | J180: Gardening for Fun | L180: 12 in the Morning | M180: Wally's Workshop | N180: Garner Ted Armstrong | O180: Modesto Rios | P180: Land of the Giants | R180: Movie [Brunch Theater]: The Brigand of Kandahar (1965) | U180: Movie [Saturday Matinee]: Buccaneer's Girl (1950) | X180: Safari to Adventure | Y180: Hank Thompson | Z180: The Virginian | AC180: Movie [The Saturday Movie]: The Indian Fighter (1955) | AG180: Portland Wrestling | AJ180: The 10 O'Clock News --Ted Warren | AK180: Porter Wagoner | AL180: The Virginian | AX180: =A180 -> 27496
A181: =A180+7 -> 27503 | F181: [7:15} Audubon Wildlife Theatre; [7:45] News | H181: Columbia Crossroads | J181: Gardening for Fun | L181: Carlos' Talent Search | M181: Wally's Workshop | N181: Garner Ted Armstrong | O181: Modesto Rios | P181: Land of the Giants | R181: Movie [Brunch Theater]: Criss Cross (1949) | U181: Movie [Saturday Matinee]: Cobra Woman (1944) | X181: Safari to Adventure | Y181: The Virginian | AB181: Movie [The Saturday Movie]: Gunman's Walk (1958) | AF181: Hank Thompson | AG181: Portland Wrestling | AJ181: The 10 O'Clock News --Ted Warren | AK181: Porter Wagoner | AL181: The Virginian | AO181: Movie: Quicksand (1950) | AX181: =A181 -> 27503
A182: =A181+7 -> 27510 | F182: [7:15} Audubon Wildlife Theatre; [7:45] News | H182: Columbia Crossroads | J182: Gardening for Fun | L182: 12 in the Morning | M182: Wally's Workshop | N182: Garner Ted Armstrong | O182: Modesto Rios | P182: Land of the Giants | R182: Movie [Brunch Theater]: The Hangman (1959) | U182: Movie [Saturday Matinee]: Destry Rides Again (1939) | X182: Safari to Adventure | Y182: The Virginian | AB182: Movie [The Saturday Movie]: The Man from Laramie (1955) | AF182: Hank Thompson | AG182: Portland Wrestling | AJ182: The 10 O'Clock News --Ted Warren | AK182: Porter Wagoner | AL182: The Virginian | AO182: Movie: My Dear Secretary (1948) | AX182: =A182 -> 27510
A183: =A182+7 -> 27517 | F183: [7:15} Audubon Wildlife Theatre; [7:45] News | H183: Columbia Crossroads | J183: Gardening for Fun | L183: Carlos' Talent Search | M183: Wally's Workshop | N183: Garner Ted Armstrong | O183: Modesto Rios | P183: Land of the Giants | R183: Movie [Brunch Theater]: Brushfire (1962) | U183: Movie [Saturday Matinee]: Man from the Alamo (1953) | X183: Safari to Adventure | Y183: The Virginian | AB183: Movie [The Saturday Movie]: Jubal (1956) | AF183: Backstage in Hollywood | AG183: Portland Wrestling | AJ183: The 10 O'Clock News --Ted Warren | AK183: Porter Wagoner | AL183: The Virginian | AO183: Movie: The Well (1951) | AX183: =A183 -> 27517
A184: =A183+7 -> 27524 | F184: [7:15} Audubon Wildlife Theatre; [7:45] News | H184: Columbia Crossroads | J184: Gardening for Fun | L184: 12 in the Morning | M184: Wally's Workshop | N184: Garner Ted Armstrong | O184: Modesto Rios | P184: Movie [Brunch Theater]: Kiss of Fire (1955) | T184: Movie [Saturday Matinee]: Town Tamer (1965) | X184: Safari to Adventure | Y184: The Virginian | AB184: Movie [The Saturday Movie]: Count Three and Pray (1955) | AF184: Backstage in Hollywood | AG184: Portland Wrestling | AJ184: The 10 O'Clock News --Ted Warren | AK184: Porter Wagoner | AL184: The Virginian | AO184: Movie: D.O.A. (1949) | AX184: =A184 -> 27524
A185: =A184+7 -> 27531 | F185: [7:15} Audubon Wildlife Theatre; [7:45] News | H185: Ramblin' Rod's Reservations Special | J185: Gardening for Fun | L185: 12 in the Morning | M185: Wally's Workshop | N185: Garner Ted Armstrong | O185: Modesto Rios | P185: Movie [Brunch Theater]: Ali Baba and the Forty Thieves (1944) | T185: Decision at Daytona | U185: Pac-8 Track and Field: USC vs UCLA | X185: Safari to Adventure | Y185: The Virginian | AB185: Movie [The Saturday Movie]: The Violent Men (1954) | AF185: That Good Ole Nashville Music | AG185: Portland Wrestling | AJ185: The 10 O'Clock News --Ted Warren | AK185: Porter Wagoner | AL185: The Virginian | AO185: Movie: Green Hell (1940) | AX185: =A185 -> 27531
A186: =A185+7 -> 27538 | F186: [7:15} Audubon Wildlife Theatre; [7:45] News | H186: Columbia Crossroads | J186: Gardening for Fun | L186: 12 in the Morning | M186: Wally's Workshop | N186: Garner Ted Armstrong | O186: Modesto Rios | P186: Movie [Brunch Theater]: Off Limits (1953) | T186: Movie [Saturday Matinee]: You Never Can Tell (1951) | X186: Safari to Adventure | Y186: The Virginian | AB186: Movie [The Saturday Movie]: 3:10 to Yuma (1957) | AF186: Pop! Goes the Country | AG186: Portland Wrestling | AJ186: The 10 O'Clock News --Ted Warren | AK186: Porter Wagoner | AL186: The Virginian | AO186: Movie: The Big Wheel (1949) | AX186: =A186 -> 27538
A187: =A186+7 -> 27545 | F187: [7:15} Audubon Wildlife Theatre; [7:45] News | H187: Columbia Crossroads | J187: Gardening for Fun | L187: 12 in the Morning | M187: Wally's Workshop | N187: Garner Ted Armstrong | O187: Modesto Rios | P187: Movie [Brunch Theater]: The Prince Who Was a Thief (1951) | T187: Movie [Saturday Matinee]: Pillars of the Sky (1956) | X187: Safari to Adventure | Y187: The Virginian | AB187: Movie [The Saturday Movie]: Tokyo Olympiad (1965) | AF187: Bobby Goldsboro | AG187: Portland Wrestling | AJ187: The 10 O'Clock News --Ted Warren | AK187: Porter Wagoner | AL187: The Virginian | AO187: Movie: The Thief (1952) | AX187: =A187 -> 27545
A188: =A187+7 -> 27552 | F188: [7:15} Audubon Wildlife Theatre; [7:45] News | H188: Columbia Crossroads | J188: Gardening for Fun | L188: 12 in the Morning | M188: Wally's Workshop | N188: Garner Ted Armstrong | O188: Modesto Rios | P188: Movie [Brunch Theater]: And Then There Were None (1945) | T188: Movie [Saturday Matinee]: Wyoming Mail (1950) | X188: Safari to Adventure | Y188: The Virginian | AB188: Movie [The Saturday Movie]: To Have and Have Not (1944) | AF188: Secrets of the Deep | AG188: Portland Wrestling | AJ188: The 10 O'Clock News --Ted Warren | AK188: Porter Wagoner | AL188: The Virginian | AO188: The Persuaders | AX188: =A188 -> 27552
A189: =A188+7 -> 27559 | F189: [7:15} Audubon Wildlife Theatre; [7:45] News | H189: Columbia Crossroads | J189: Gardening for Fun | L189: 12 in the Morning | M189: Wally's Workshop | N189: Garner Ted Armstrong | O189: Modesto Rios | P189: Movie [Brunch Theater]: Mysterious Island (1961) | T189: Movie [Saturday Matinee]: Apache (1954) | X189: Safari to Adventure | Y189: The Virginian | AB189: Movie [The Saturday Movie]: Key Largo (1948) | AF189: Race for Professionals | AG189: Portland Wrestling | AJ189: The 10 O'Clock News --Ted Warren | AK189: Porter Wagoner | AL189: Backstage in Hollywood | AM189: Victor Awards | AP189: The Persuaders | AX189: =A189 -> 27559
A190: =A189+7 -> 27566 | F190: [7:15} Audubon Wildlife Theatre; [7:45] News | H190: Columbia Crossroads | J190: Gardening for Fun | L190: 12 in the Morning | M190: Wally's Workshop | N190: Garner Ted Armstrong | O190: Modesto Rios | P190: Movie [Brunch Theater]: Psyche '59 (1964) | T190: Movie [Saturday Matinee]: Sign of the Pagan (1954) | X190: Safari to Adventure | Y190: The Virginian | AB190: Movie [The Saturday Movie]: Brother Orchid (1940) | AF190: A Reason to Sing | AG190: Portland Wrestling | AJ190: The 10 O'Clock News --Ted Warren | AK190: Night Gallery | AL190: The Virginian | AO190: The Persuaders | AX190: =A190 -> 27566
A191: =A190+7 -> 27573 | F191: [7:15} Audubon Wildlife Theatre; [7:45] News | H191: Columbia Crossroads | J191: Gardening for Fun | L191: 12 in the Morning | M191: Wally's Workshop | N191: Garner Ted Armstrong | O191: Modesto Rios | P191: Movie [Brunch Theater]: This Island Earth (1955) | T191: Movie [Saturday Matinee]: Saskatchewan (1954) | X191: Safari to Adventure | Y191: The Virginian | AB191: Movie [The Saturday Movie]: The Maltese Falcon (1941) | AF191: World of Survival | AG191: Portland Wrestling | AJ191: The 10 O'Clock News --Ted Warren | AK191: Porter Wagoner | AL191: The Virginian | AO191: The Persuaders | AX191: =A191 -> 27573
A192: =A191+7 -> 27580 | F192: [7:15} Audubon Wildlife Theatre; [7:45] News | H192: Columbia Crossroads | J192: Gardening for Fun | L192: 12 in the Morning | M192: Wally's Workshop | N192: Garner Ted Armstrong | O192: Modesto Rios | P192: Movie [Brunch Theater]: The Phantom of Soho (1963) | T192: Movie [Saturday Matinee]: The Rawhide Years (1956) | X192: Safari to Adventure | Y192: The Virginian | AB192: Movie [The Saturday Movie]: High Sierra (1940) | AF192: Motorcycle Classic | AG192: Portland Wrestling | AJ192: The 10 O'Clock News --Ted Warren | AK192: The Virginian | AN192: The Persuaders | AX192: =A192 -> 27580
A193: =A192+7 -> 27587 | F193: [7:15} Audubon Wildlife Theatre; [7:45] News | H193: Columbia Crossroads | J193: Gardening for Fun | L193: 12 in the Morning | M193: Wally's Workshop | N193: Garner Ted Armstrong | O193: Modesto Rios | P193: Movie [Brunch Theater]: The Brides of Dracula (1960); [1:45] Changing Times | T193: Movie [Saturday Matinee]: Raw Wind in Eden (1958) | X193: Safari to Adventure | Y193: The Virginian | AB193: Movie [The Saturday Movie]: Dark Passage (1947) | AF193: Reason to Sing | AG193: Portland Wrestling | AJ193: The 10 O'Clock News --Ted Warren | AK193: Night Gallery | AL193: The Virginian | AO193: The Persuaders | AX193: =A193 -> 27587
A194: =A193+7 -> 27594 | F194: [7:15} Audubon Wildlife Theatre; [7:45] News | H194: Columbia Crossroads | J194: Gardening for Fun | L194: 12 in the Morning | M194: Wally's Workshop | N194: Garner Ted Armstrong | O194: Modesto Rios | P194: Movie [Brunch Theater]: Blood of the Vampire (1958); [1:45] Changing Times | T194: Movie [Saturday Matinee]: Istanbul (1957) | X194: Safari to Adventure | Y194: The Virginian | AB194: Movie [The Saturday Movie]: My Little Chickadee (1940) | AF194: World of Survival | AG194: Portland Wrestling | AJ194: The 10 O'Clock News --Ted Warren | AK194: The Virginian | AN194: The Persuaders | AX194: =A194 -> 27594
A195: =A194+7 -> 27601 | F195: [7:15} Audubon Wildlife Theatre; [7:45] News | H195: Columbia Crossroads | J195: Gardening for Fun | L195: 12 in the Morning | M195: Wally's Workshop | N195: Garner Ted Armstrong | O195: Modesto Rios | P195: Movie [Brunch Theater]: Island of Terror (1966); [1:45] Changing Times | T195: Movie [Saturday Matinee]: Seven Ways from Sundown (1960) | X195: Safari to Adventure | Y195: The Virginian | AB195: Movie [The Saturday Movie]: Dr. Strangelove: Or, How I Learned to Stop Worrying and Love the Bomb (1964) | AF195: World of Survival | AG195: Portland Wrestling | AJ195: The 10 O'Clock News --Ted Warren | AK195: The Virginian | AN195: The Persuaders | AX195: =A195 -> 27601
A196: =A195+7 -> 27608 | F196: [7:15} Audubon Wildlife Theatre; [7:45] News | H196: Columbia Crossroads | J196: Gardening for Fun | L196: 12 in the Morning--Rod Anders | M196: Wally's Workshop | N196: Garner Ted Armstrong | O196: Modesto Rios | P196: Movie [Brunch Theater]: The Curse of the Werewolf (1961); [1:45] Changing Times | T196: Movie [Saturday Matinee]: Calamity Jane and Sam Bass (1949) | X196: Safari to Adventure | Y196: The Virginian | AB196: Movie [The Saturday Movie]: Take One False Step (1949) | AF196: Portrait of a Champion: Roger DeCoster | AG196: Portland Wrestling | AJ196: The 10 O'Clock News --Ted Warren | AK196: The Virginian | AN196: The Persuaders | AX196: =A196 -> 27608
A197: =A196+7 -> 27615 | F197: [7:15} Audubon Wildlife Theatre; [7:45] News | H197: Columbia Crossroads | J197: Gardening for Fun | L197: 12 in the Morning--Rod Anders | M197: Wally's Workshop | N197: Garner Ted Armstrong | O197: Modesto Rios | P197: Movie [Brunch Theater]: Kiss of Evil (1963); [1:45] Changing Times | T197: Movie [Saturday Matinee]: The Cimarron Kid (1951) | X197: Safari to Adventure | Y197: The Virginian | AB197: Movie [The Saturday Movie]: Secret of the Incas (1954) | AF197: Reason to Sing | AG197: Portland Wrestling | AJ197: The 10 O'Clock News --Ted Warren | AK197: The Virginian | AN197: The Persuaders | AX197: =A197 -> 27615
A198: =A197+7 -> 27622 | F198: [7:15} Audubon Wildlife Theatre; [7:45] News | H198: Columbia Crossroads | J198: Gardening for Fun | L198: 12 in the Morning--Rod Anders | M198: Wally's Workshop | N198: Garner Ted Armstrong | O198: Modesto Rios | P198: Movie [Brunch Theater]: Mr. Sardonicus (1961); [1:45] Changing Times | T198: Movie [Saturday Matinee]: Gun for a Coward (1957) | X198: Safari to Adventure | Y198: The Virginian | AB198: Movie [The Saturday Movie]: Incident at Phantom Hill (1966) | AF198: World of Survival | AG198: Portland Wrestling | AJ198: The 10 O'Clock News --Ted Warren | AK198: The Virginian | AN198: The Persuaders | AX198: =A198 -> 27622
A199: =A198+7 -> 27629 | F199: [7:15} Audubon Wildlife Theatre; [7:45] News | H199: Columbia Crossroads | J199: Gardening for Fun | L199: 12 in the Morning--Rod Anders | M199: Wally's Workshop | N199: Garner Ted Armstrong | O199: Modesto Rios | P199: Movie [Brunch Theater]: The Old Dark House (1963); [1:45] Changing Times | T199: Movie [Saturday Matinee]: Ride a Crooked Trail (1958) | X199: Safari to Adventure | Y199: The Virginian | AB199: Movie [The Saturday Movie]: Winchester '73 (1950) | AF199: Toy Pony | AG199: Portland Wrestling | AJ199: The 10 O'Clock News | AK199: The Virginian | AN199: The Persuaders | AX199: =A199 -> 27629
A200: =A199+7 -> 27636 | F200: [7:15} Audubon Wildlife Theatre; [7:45] News | H200: Columbia Crossroads | J200: Gardening for Fun | L200: 12 in the Morning--Rod Anders | M200: Wally's Workshop | N200: Garner Ted Armstrong | O200: Modesto Rios | P200: Movie [Brunch Theater]: Tower of London (1939); [1:45] Changing Times | T200: Movie [Saturday Matinee]: Bend of the River (1952) | X200: Safari to Adventure | Y200: World of Survival | Z200: Oral Roberts in Alaska | AB200: Movie [The Saturday Movie]: Canyon Passage (1946) | AF200: Secret Agent 007 1/2 | AG200: Portland Wrestling | AJ200: The 10 O'Clock News | AK200: The Virginian | AN200: The Persuaders | AX200: =A200 -> 27636
A201: =A200+7 -> 27643 | F201: [7:15} Audubon Wildlife Theatre; [7:45] News | H201: Columbia Crossroads | J201: Gardening for Fun | L201: 12 in the Morning--Rod Anders | M201: Wally's Workshop | N201: Garner Ted Armstrong | O201: Modesto Rios | P201: Movie [Brunch Theater]: Gunpoint (1966); [1:45] Changing Times | T201: Movie [Saturday Matinee]: Chief Crazy Horse (1955) | X201: Safari to Adventure | Y201: The Virginian | AB201: Movie [The Saturday Movie]: The Ghost and Mr. Chicken (1965) | AF201: Porter Wagoner | AG201: Portland Wrestling | AJ201: The 10 O'Clock News | AK201: The Virginian | AN201: The Persuaders | AX201: =A201 -> 27643
A202: =A201+7 -> 27650 | G202: New Approaches to High School Learning | H202: Columbia Crossroads | J202: Gardening for Fun | L202: 12 in the Morning--Rod Anders | M202: Wally's Workshop | N202: Garner Ted Armstrong | O202: Modesto Rios | P202: Movie [Brunch Theater]: Taggart (1965); [1:45] Changing Times | T202: The Virginian | W202: Daniel Boone | Y202: CBS Sports Spectacular (CBS) | AB202: Movie [The Saturday Movie]: The Geisha Boy (1958) | AF202: Night Gallery | AG202: Portland Wrestling | AJ202: The 10 O'Clock News | AK202: The Virginian | AN202: The Persuaders | AX202: =A202 -> 27650
A203: =A202+7 -> 27657 | G203: New Approaches to High School Learning | H203: Columbia Crossroads | J203: Gardening for Fun | L203: 12 in the Morning--Rod Anders | M203: Wally's Workshop | N203: Garner Ted Armstrong | O203: Modesto Rios | P203: Movie [Brunch Theater]: Good Day for a Hanging (1959); [1:45] Changing Times | T203: The Virginian | W203: Daniel Boone | Y203: CBS Sports Spectacular (CBS) | AB203: Movie [The Saturday Movie]: The Errand Boy (1961) | AF203: Night Gallery | AG203: Portland Wrestling | AJ203: The 10 O'Clock News | AK203: The Virginian | AN203: The Persuaders | AX203: =A203 -> 27657
A204: =A203+7 -> 27664 | G204: New Approaches to High School Learning | H204: Columbia Crossroads | J204: Gardening for Fun | L204: 12 in the Morning--Rod Anders | M204: Wally's Workshop | N204: Garner Ted Armstrong | O204: Modesto Rios | P204: Movie [Brunch Theater]: Black Bart (1948) | T204: The Virginian | W204: Daniel Boone | Y204: CBS Sports Spectacular (CBS) | AB204: Movie [The Saturday Movie]: The Delicate Delinquent (1957) | AF204: The Sixth Sense (Night Gallery) | AG204: Portland Wrestling | AJ204: The 10 O'Clock News | AK204: The Virginian | AN204: The Persuaders | AX204: =A204 -> 27664
A205: =A204+7 -> 27671 | G205: New Approaches to High School Learning | H205: Columbia Crossroads | J205: Gardening for Fun | L205: 12 in the Morning--Rod Anders | M205: Wally's Workshop | N205: Garner Ted Armstrong | O205: Modesto Rios | P205: Movie [Brunch Theater]: The Bravos (1972) | T205: The Virginian | W205: Daniel Boone | Y205: CBS Sports Spectacular (CBS) | AB205: Movie [The Saturday Movie]: Rock-a-Bye Baby (1958) | AF205: Night Gallery | AG205: Portland Wrestling | AJ205: The 10 O'Clock News | AK205: The Virginian | AN205: Don Kirshner's Rock Concert | AX205: =A205 -> 27671
A206: =A205+7 -> 27678 | G206: New Approaches to High School Learning | H206: Columbia Crossroads | J206: Gardening for Fun | L206: 12 in the Morning--Rod Anders | M206: Wally's Workshop | N206: Garner Ted Armstrong | O206: Modesto Rios | P206: Movie [Brunch Theater]: The Indian Fighter (1955) | T206: The Virginian | W206: Daniel Boone | Y206: CBS Sports Spectacular (CBS) | AB206: Movie [The Saturday Movie]: The Caddy (1953) | AF206: Night Gallery | AG206: Portland Wrestling | AJ206: The 10 O'Clock News | AK206: The Virginian | AN206: Don Kirshner's Rock Concert | AX206: =A206 -> 27678
A207: =A206+7 -> 27685 | G207: New Approaches to High School Learning | H207: Columbia Crossroads | J207: Gardening for Fun | L207: 12 in the Morning--Rod Anders | M207: Wally's Workshop | N207: Garner Ted Armstrong | O207: Modesto Rios | P207: Movie [Brunch Theater]: The Savage (1953) | T207: The Virginian | W207: Pop! Goes the Country | X207: CBS Sports Spectacular (CBS) | AB207: Movie [The Saturday Movie]: Living it Up (1954) | AF207: Nashville on the Road | AG207: Portland Wrestling | AJ207: The 10 O'Clock News | AK207: The Virginian | AN207: Don Kirshner's Rock Concert | AX207: =A207 -> 27685
A208: =A207+7 -> 27692 | G208: New Approaches to High School Learning | H208: Columbia Crossroads | J208: Gardening for Fun | L208: 12 in the Morning--Rod Anders | M208: Wally's Workshop | N208: Garner Ted Armstrong | O208: Modesto Rios | P208: Movie [Brunch Theater]: The Spoilers (1942) | T208: The Virginian | W208: Daniel Boone | Y208: CBS Sports Spectacular (CBS) | AB208: Movie [The Saturday Movie]: The Bellboy (1960) | AF208: Night Gallery | AG208: Portland Wrestling | AJ208: The 10 O'Clock News | AK208: The Virginian | AN208: Don Kirshner's Rock Concert | AX208: =A208 -> 27692
A209: =A208+7 -> 27699 | G209: New Approaches to High School Learning | H209: Columbia Crossroads | J209: Gardening for Fun | L209: 12 in the Morning--Rod Anders | M209: Wally's Workshop | N209: Garner Ted Armstrong | O209: Modesto Rios | P209: Movie [Brunch Theater]: Arizona Raiders (1965) | T209: The Virginian | W209: Daniel Boone | Y209: CBS Sports Spectacular (CBS) | AB209: Movie [The Saturday Movie]: The Enemy Below (1957) | AF209: Night Gallery | AG209: Portland Wrestling | AJ209: The 10 O'Clock News | AK209: The Virginian | AN209: Don Kirshner's Rock Concert | AX209: =A209 -> 27699
A210: =A209+7 -> 27706 | G210: New Approaches to High School Learning | H210: Columbia Crossroads | J210: Gardening for Fun | L210: 12 in the Morning--Rod Anders | M210: Wally's Workshop | N210: Garner Ted Armstrong | O210: Modesto Rios | P210: Movie [Brunch Theater]: Lonely Are the Brave (1962) | T210: The Virginian | W210: Daniel Boone | Y210: CBS Sports Spectacular (CBS) | AB210: Movie [The Saturday Movie]: The Hunters (1958) | AF210: Night Gallery | AG210: Portland Wrestling | AJ210: The 10 O'Clock News | AK210: The Virginian | AN210: Don Kirshner's Rock Concert | AX210: =A210 -> 27706
A211: =A210+7 -> 27713 | F211: [7:15] News | G211: New Approaches to High School Learning | H211: Columbia Crossroads | J211: Gardening for Fun | L211: 12 in the Morning--Rod Anders | M211: Wally's Workshop | N211: Garner Ted Armstrong | O211: Modesto Rios | P211: Movie [Brunch Theater]: Apache (1954) | T211: The Virginian | W211: Daniel Boone | Y211: CBS Sports Spectacular (CBS) | AB211: Movie [The Saturday Movie]: Heaven Knows Mr. Allison (1957) | AF211: Night Gallery | AG211: Portland Wrestling | AJ211: The 10 O'Clock News | AK211: The Virginian | AN211: Don Kirshner's Rock Concert | AX211: =A211 -> 27713
A212: =A211+7 -> 27720 | F212: [7:15] News | G212: New Approaches to High School Learning | H212: Columbia Crossroads | J212: Gardening for Fun | L212: 12 in the Morning--Rod Anders | M212: Wally's Workshop | N212: Garner Ted Armstrong | O212: Modesto Rios | P212: Movie [Brunch Theater]: Cowboy (1958) | T212: The Virginian | W212: Daniel Boone | Y212: CBS Sports Spectacular (CBS) | AB212: Movie [The Saturday Movie]: The Bravados (1958) | AF212: Night Gallery | AG212: Portland Wrestling | AJ212: The 10 O'Clock News | AK212: The Virginian | AN212: Don Kirshner's Rock Concert | AX212: =A212 -> 27720
A213: =A212+7 -> 27727 | F213: [7:15] News | G213: New Approaches to High School Learning | H213: Columbia Crossroads | J213: Gardening for Fun | L213: 12 in the Morning--Rod Anders | M213: Wally's Workshop | N213: Garner Ted Armstrong | O213: Modesto Rios | P213: Movie [Brunch Theater]: The Hangman (1959) | T213: The Virginian | W213: Daniel Boone | Y213: CBS Sports Spectacular (CBS) | AB213: Bill Daily's Hocus Pocus Gang | AD213: Billy Graham Crusade | AF213: The Sixth Sense (Night Gallery) | AG213: Portland Wrestling | AJ213: The 10 O'Clock News | AK213: The Virginian | AN213: Don Kirshner's Rock Concert | AX213: =A213 -> 27727
A214: =A213+7 -> 27734 | F214: [7:15] News | G214: New Approaches to High School Learning | H214: Columbia Crossroads | J214: Gardening for Fun | L214: 12 in the Morning--Rod Anders | M214: Wally's Workshop | N214: Garner Ted Armstrong | O214: Modesto Rios | P214: Movie [Brunch Theater]: Rawhide (1951) | T214: Daniel Boone | V214: CBS Sports Spectacular (CBS) | Z214: It Takes a Thief | AB214: Movie [The Saturday Movie]: The Best of Enemies (1961) | AF214: Night Gallery | AG214: Portland Wrestling | AJ214: The 10 O'Clock News | AK214: The Virginian | AN214: Don Kirshner's Rock Concert | AX214: =A214 -> 27734
A215: =A214+7 -> 27741 | F215: [7:15] News | G215: New Approaches to High School Learning | H215: Columbia Crossroads | J215: Gardening for Fun | L215: 12 in the Morning--Rod Anders | M215: Wally's Workshop | N215: Garner Ted Armstrong | O215: Modesto Rios | P215: Movie [Brunch Theater]: Kangaroo (1952) | T215: The Virginian | W215: Daniel Boone | Y215: Movie: You Can't Cheat an Honest Man (1939): | AB215: Movie [The Saturday Movie]: The Naked Jungle (1957) | AF215: Night Gallery | AG215: Portland Wrestling | AJ215: The 10 O'Clock News | AK215: The Virginian | AN215: Don Kirshner's Rock Concert | AX215: =A215 -> 27741
A216: =A215+7 -> 27748 | F216: [7:15] News | G216: New Approaches to High School Learning | H216: Columbia Crossroads | J216: Gardening for Fun | L216: 12 in the Morning--Rod Anders | M216: Wally's Workshop | N216: Garner Ted Armstrong | O216: Modesto Rios | P216: Movie [Brunch Theater]: Denver & Rio Grande (1952) | T216: The Virginian | W216: Daniel Boone | Y216: Movie: Never Give a Sucker an Even Break (1941) | AB216: Movie [The Saturday Movie]: Raw Wind in Eden (1958) | AF216: Night Gallery | AG216: Portland Wrestling | AJ216: The 10 O'Clock News | AK216: Oral Roberts' Christmas is Love | AM216: Night Gallery | AN216: Don Kirshner's Rock Concert | AX216: =A216 -> 27748
A217: =A216+7 -> 27755 | F217: [7:15] News | G217: Audubon Wildlife Theater | H217: Columbia Crossroads | J217: Gardening for Fun | L217: 12 in the Morning--Rod Anders | M217: Wally's Workshop | N217: Garner Ted Armstrong | O217: Modesto Rios | P217: Movie [Brunch Theater]: Night Passage (1957) | T217: The Virginian | W217: Daniel Boone | Y217: Movie: The Bank Dick (1940) | AB217: Movie [The Saturday Movie]: The Far Country (1955) | AF217: Pat Boone and the Little Ones | AG217: Portland Wrestling | AJ217: The 10 O'Clock News | AK217: The Virginian | AN217: Don Kirshner's Rock Concert | AX217: =A217 -> 27755
A218: 1976 | AX218: =A218 -> 1976
A221: 1977 | AX221: =A221 -> 1977
A224: 1978 | AX224: =A224 -> 1978
A227: 1979 | AX227: =A227 -> 1979
A230: 1980 | AX230: =A230 -> 1980
A231: 29225 | E231: [6:45] News | F231: Consultation | G231: Dialogue | H231: Hot Fudge | I231: Marlo and the Magic Movie Machine | J231: Gardening for Fun | L231: How To with Pete | M231: 12 in the Morning--Rod Anders | N231: World Tomorrow | O231: Public Affairs | P231: Movie [Brunch Theater]: Posse from Hell (1961) | T231: The Big Valley | V231: Bonanza | X231: Movie [The Saturday Picture Show]: Hail the Conquering Hero (1944) | AB231: Movie [The Saturday Movie]: Situation Hopeless but Not Serious (1965) | AF231: College Basketball: UCLA Bruins vs. Oregon Ducks | AJ231: The 10 O'Clock News | AK231: Newsmakers-Ted Warren | AL231: Portland Wrestling | AO231: The FBI | AX231: =A231 -> 29225
A232: 29232 | E232: [6:45] News | F232: Consultation | G232: Dialogue | H232: Hot Fudge | I232: Marlo and the Magic Movie Machine | J232: Gardening for Fun | L232: How To with Pete | M232: 12 in the Morning--Rod Anders | N232: World Tomorrow | O232: Public Affairs | P232: Movie: [Brunch Theater]: The Tin Star (1957) | T232: The Big Valley | V232: Bonanza | X232: Movie [The Saturday Picture Show]: Rogue Lion (1975) | AB232: Movie [The Saturday Movie]: Cops and Robbers (1973) | AF232: Evening in Byzantium (Part One) | AJ232: The 10 O'Clock News | AK232: Newsmakers-Ted Warren | AL232: Portland Wrestling | AO232: The FBI | AX232: =A232 -> 29232
A233: 29239 | E233: [6:45] News | F233: Consultation | G233: Dialogue | H233: Hot Fudge | I233: Marlo and the Magic Movie Machine | J233: Gardening for Fun | L233: How To with Pete | M233: 12 in the Morning--Rod Anders | N233: World Tomorrow | O233: Public Affairs | P233: Movie: [Brunch Theater]: The Spoilers (1955) | T233: The Big Valley | V233: Bonanza | X233: Movie [The Saturday Picture Show]: The Delphi Bureau (1972) | AB233: Movie [The Saturday Movie]: Return of the Seven (1966) | AF233: Evening in Byzantium (Part Two) | AJ233: The 10 O'Clock News | AK233: Newsmakers-Ted Warren | AL233: Portland Wrestling | AO233: The FBI | AX233: =A233 -> 29239
A234: 29246 | E234: [6:45] News | F234: Consultation | G234: Dialogue | H234: Hot Fudge | I234: Marlo and the Magic Movie Machine | J234: Gardening for Fun | L234: How To with Pete | M234: 12 in the Morning--Rod Anders | N234: World Tomorrow | O234: Public Affairs | P234: Movie: [Brunch Theater]: The Proud and the Damned (1972) | T234: The Big Valley | V234: Bonanza | X234: Movie [The Saturday Picture Show]: A Whale of a Tale (1975) | AB234: Hogan's Heroes | AC234: NBA Basketball: Portland Trail Blazers vs. Denver Nuggets [LIVE] | AH234: Emergency One ! | AJ234: The 10 O'Clock News | AK234: Newsmakers-Ted Warren | AL234: Portland Wrestling | AO234: The FBI | AX234: =A234 -> 29246