A2: E M P L O Y E E S E C T I O N
A4: KPTV Employee List
A6: Below is a list of KPTV employees gathered from phone lists, documents and newspaper and magazine articles. Currently, there are over 750 names of people who have worked at KPTV during its first 50 years. Names are alphabetical by surname. When names changed (due to marriages, etc.) the main information is attached to the name as it first appeared in our sources of information. Subsequent names will refer you to the initial name.
A7: INFORMATION IN YELLOW INDICATES WHAT WE BELIEVE TO BE THE ACTUAL DATE.
A9: Please note that start and end dates listed have been gathered from phone extension lists, address lists, magazine articles and other sources. The dates represent the first and last time the name appears on said list, and may not be anywhere near the actual dates of employment. If you have additional information on any person listed, or if you know of someone who is not listed, please send your information to the webmaster. Thank you.
A10: e-mail the webmaster: yesterdayskptv@gmail.com
A12: KPTV EMPLOYEE LIST 1952 - 2002
A13: =NOW() -> 38873.915323611109
A14: No. | B14: Last | C14: First | D14: last, first | E14: first last | F14: Approx. Start Date | G14: Approx. End Date | H14: Department | I14: Notes
A15: 1 | B15: Achatz | C15: Bill | D15: =B15 & ", " & C15 -> Achatz, Bill | E15: =C15 & " " & B15 -> Bill Achatz | F15: 19287 | G15: 1960
A16: =A15+1 -> 2 | B16: Ackerman | C16: Ken | D16: =B16 & ", " & C16 -> Ackerman, Ken | E16: =C16 & " " & B16 -> Ken Ackerman | F16: 33984 | G16: 37453 | H16: News
A17: =A16+1 -> 3 | B17: Adams | C17: Linda | D17: =B17 & ", " & C17 -> Adams, Linda | E17: =C17 & " " & B17 -> Linda Adams | F17: 28688 | G17: 28688
A18: =A17+1 -> 4 | B18: Aggarwal | C18: Smriti (Sumi) | F18: 37041 | G18: 37321 | H18: News
A19: =A18+1 -> 5 | B19: Ahyakak | C19: Loretta | F19: 26620 | G19: 26620
A20: =A19+1 -> 6 | B20: Alexander | C20: Leslie | D20: =B20 & ", " & C20 -> Alexander, Leslie | E20: =C20 & " " & B20 -> Leslie Alexander | F20: 36844 | G20: 37274 | H20: Sales
A21: =A20+1 -> 7 | B21: Algeciras | C21: Martha | D21: =B21 & ", " & C21 -> Algeciras, Martha | E21: =C21 & " " & B21 -> Martha Algeciras | F21: 29561 | G21: 30477 | H21: Traffic | I21: AKA Martha Schroeder
A22: =A21+1 -> 8 | B22: Allen | C22: Jim | D22: =B22 & ", " & C22 -> Allen, Jim | E22: =C22 & " " & B22 -> Jim Allen | F22: 1967 | G22: 1973 | H22: "Rusty Nails"
A23: =A22+1 -> 9 | B23: Allen | C23: Wendy | D23: =B23 & ", " & C23 -> Allen, Wendy | E23: =C23 & " " & B23 -> Wendy Allen | F23: 29593 | G23: 30477
A24: =A23+1 -> 10 | B24: Altstadt | C24: Roberta | D24: =B24 & ", " & C24 -> Altstadt, Roberta | E24: =C24 & " " & B24 -> Roberta Altstadt | F24: 35153 | G24: 35153 | H24: News
A25: =A24+1 -> 11 | B25: Altstock | C25: Nora | D25: =B25 & ", " & C25 -> Altstock, Nora | E25: =C25 & " " & B25 -> Nora Altstock | F25: 29561 | G25: 33984 | H25: Sales | I25: living in Green Valley, AZ
A26: =A25+1 -> 12 | B26: Amato | C26: Cord | D26: =B26 & ", " & C26 -> Amato, Cord | E26: =C26 & " " & B26 -> Cord Amato | F26: 35153 | G26: 35153 | H26: Traffic
A27: =A26+1 -> 13 | B27: Amato | C27: Julie | D27: =B27 & ", " & C27 -> Amato, Julie | E27: =C27 & " " & B27 -> Julie Amato | F27: 35282 | G27: PRESENT | H27: Production | I27: AKA Julie Laubach; At KPTV (Meredith Corp.)
A28: =A27+1 -> 14 | B28: Ames | C28: Linda S | D28: =B28 & ", " & C28 -> Ames, Linda S | E28: =C28 & " " & B28 -> Linda S Ames | F28: 23498 | G28: 23993 | H28: Traffic Clerk
A29: =A28+1 -> 15 | B29: Amlie-Mayer | C29: Heidi | D29: =B29 & ", " & C29 -> Amlie-Mayer, Heidi | E29: =C29 & " " & B29 -> Heidi Amlie-Mayer | F29: 32909 | G29: 33914 | H29: Traffic/Sales
A30: =A29+1 -> 16 | B30: Amoroso | C30: Bob | D30: =B30 & ", " & C30 -> Amoroso, Bob | E30: =C30 & " " & B30 -> Bob Amoroso | F30: 28795 | G30: 28795 | H30: Engineer
A31: =A30+1 -> 17 | B31: Andersen (Anders) | C31: Rod | D31: =B31 & ", " & C31 -> Andersen (Anders), Rod | E31: =C31 & " " & B31 -> Rod Andersen (Anders) | F31: 23620 | G31: Spring 1997 | H31: Host, "Popeye's Pier 12," "12 in the Morning" | I31: Deceased May 2002
A32: =A31+1 -> 18 | B32: Anderson | C32: Anne | D32: =B32 & ", " & C32 -> Anderson, Anne | E32: =C32 & " " & B32 -> Anne Anderson | F32: 19359 | G32: Spring 1953 | I32: married Charles White
A33: =A32+1 -> 19 | B33: Anderson | C33: Barbara Joan (B.J.) | D33: =B33 & ", " & C33 -> Anderson, Barbara Joan (B.J.) | E33: =C33 & " " & B33 -> Barbara Joan (B.J.) Anderson | F33: +/- 11/17/72 | G33: +/- 11/17/72
A34: =A33+1 -> 20 | B34: Anderson | C34: Kimberly | D34: =B34 & ", " & C34 -> Anderson, Kimberly | E34: =C34 & " " & B34 -> Kimberly Anderson | F34: 29910 | G34: 29910
A35: =A34+1 -> 21 | B35: Angell | C35: Barbara | D35: =B35 & ", " & C35 -> Angell, Barbara | E35: =C35 & " " & B35 -> Barbara Angell | F35: 1953 | G35: 1957 | H35: Host, "What's Cooking"
A36: =A35+1 -> 22 | B36: Apple | C36: David | D36: =B36 & ", " & C36 -> Apple, David | E36: =C36 & " " & B36 -> David Apple | F36: 31079 | G36: 35153 | H36: Weathercaster
A37: =A36+1 -> 23 | B37: Arbour | C37: Bobbie | D37: =B37 & ", " & C37 -> Arbour, Bobbie | E37: =C37 & " " & B37 -> Bobbie Arbour | F37: 1965 | G37: 1965 | H37: P/T Switchboard
A38: =A37+1 -> 24 | B38: Archer | C38: Graham | D38: =B38 & ", " & C38 -> Archer, Graham | E38: =C38 & " " & B38 -> Graham Archer | F38: +/- 11/17/72 | G38: 27521
A39: =A38+1 -> 25 | B39: Arndt | C39: Ed | D39: =B39 & ", " & C39 -> Arndt, Ed | E39: =C39 & " " & B39 -> Ed Arndt | F39: September 1962 | G39: October 1963 | H39: News Anchor
A40: =A39+1 -> 26 | B40: Asner | C40: Liza | D40: =B40 & ", " & C40 -> Asner, Liza | E40: =C40 & " " & B40 -> Liza Asner | F40: 35153 | G40: 35153 | H40: Production/Ex Asst
A41: =A40+1 -> 27 | B41: Ayala | C41: Jose | D41: =B41 & ", " & C41 -> Ayala, Jose | E41: =C41 & " " & B41 -> Jose Ayala | F41: 28795 | G41: 28998 | H41: Floor Director
A42: =A41+1 -> 28 | B42: Badden | C42: Les | D42: =B42 & ", " & C42 -> Badden, Les | E42: =C42 & " " & B42 -> Les Badden | F42: 1966 | G42: mid 1970s | H42: Production, News Photographer
A43: =A42+1 -> 29 | B43: Bailey | C43: Beth | D43: =B43 & ", " & C43 -> Bailey, Beth | E43: =C43 & " " & B43 -> Beth Bailey | F43: 1953 | G43: 1953
A44: =A43+1 -> 30 | B44: Baldwin | C44: Chris | D44: =B44 & ", " & C44 -> Baldwin, Chris | E44: =C44 & " " & B44 -> Chris Baldwin | F44: 36841 | G44: 2003 | H44: Production
A45: =A44+1 -> 31 | B45: Balholm | C45: Cathleen | D45: =B45 & ", " & C45 -> Balholm, Cathleen | E45: =C45 & " " & B45 -> Cathleen Balholm | F45: 32377 | G45: 32428 | H45: News Reporter
A46: =A45+1 -> 32 | B46: Ballantyne | C46: Bob | D46: =B46 & ", " & C46 -> Ballantyne, Bob | E46: =C46 & " " & B46 -> Bob Ballantyne | F46: 1976 | G46: 31495 | H46: News Department Cameraman | I46: in Los Angeles
A47: =A46+1 -> 33 | B47: Barker | C47: Nancy | D47: =B47 & ", " & C47 -> Barker, Nancy | E47: =C47 & " " & B47 -> Nancy Barker | F47: +/- 11/17/72 | G47: +/- 11/17/72
A48: =A47+1 -> 34 | B48: Barnard | C48: Robert H | D48: =B48 & ", " & C48 -> Barnard, Robert H | E48: =C48 & " " & B48 -> Robert H Barnard | F48: 9/28/64 | G48: 23757 | H48: P/T Engineer
A49: =A48+1 -> 35 | B49: Barnett | C49: John | D49: =B49 & ", " & C49 -> Barnett, John | E49: =C49 & " " & B49 -> John Barnett | F49: 29561 | G49: 30477 | H49: Transmitter Engineer
A50: =A49+1 -> 36 | B50: Barnum | C50: Mike | D50: =B50 & ", " & C50 -> Barnum, Mike | E50: =C50 & " " & B50 -> Mike Barnum | F50: +/- 11/17/72 | G50: +/- 11/17/72
A51: =A50+1 -> 37 | B51: Bartchy | C51: Larry | D51: =B51 & ", " & C51 -> Bartchy, Larry | E51: =C51 & " " & B51 -> Larry Bartchy | F51: +/- 11/17/72 | G51: 29593 | H51: Production
A52: =A51+1 -> 38 | B52: Bartholemy | C52: Wayne | D52: =B52 & ", " & C52 -> Bartholemy, Wayne | E52: =C52 & " " & B52 -> Wayne Bartholemy | F52: 19359 | G52: 1953
A53: =A52+1 -> 39 | B53: Barton | C53: Rhonda | D53: =B53 & ", " & C53 -> Barton, Rhonda | E53: =C53 & " " & B53 -> Rhonda Barton | F53: 26676 | G53: 29082 | H53: News Reporter
A54: =A53+1 -> 40 | B54: Bass | C54: Donavin | D54: =B54 & ", " & C54 -> Bass, Donavin | E54: =C54 & " " & B54 -> Donavin Bass | F54: 28331 | G54: 1996 | H54: Production | I54: Deceased 5-28-97
A55: =A54+1 -> 41 | B55: Bates | C55: Wendell E | D55: =B55 & ", " & C55 -> Bates, Wendell E | E55: =C55 & " " & B55 -> Wendell E Bates | F55: 23096 | G55: 1965 | H55: P/T Engineer
A56: =A55+1 -> 42 | B56: Batties | C56: Sylvia | D56: =B56 & ", " & C56 -> Batties, Sylvia | E56: =C56 & " " & B56 -> Sylvia Batties | F56: +/- 11/17/72 | G56: +/- 11/17/72
A57: =A56+1 -> 43 | B57: Batty | C57: Cherryll | D57: =B57 & ", " & C57 -> Batty, Cherryll | E57: =C57 & " " & B57 -> Cherryll Batty | F57: 36844 | G57: 37456 | H57: Traffic | I57: Texas
A58: =A57+1 -> 44 | B58: Bauer | C58: Don | D58: =B58 & ", " & C58 -> Bauer, Don | E58: =C58 & " " & B58 -> Don Bauer | F58: 31329 | G58: 32687 | H58: News
B59: Bausch | C59: Alyssa | D59: =B59 & ", " & C59 -> Bausch, Alyssa | E59: =C59 & " " & B59 -> Alyssa Bausch | F59: SEE JENSEN, ALYSSA
A60: =A58+1 -> 45 | B60: Beadle | C60: Doug | D60: =B60 & ", " & C60 -> Beadle, Doug | E60: =C60 & " " & B60 -> Doug Beadle | F60: 1960 | G60: 1960 | H60: Engineering
A61: =A60+1 -> 46 | B61: Beauchamp | C61: Dennis | D61: =B61 & ", " & C61 -> Beauchamp, Dennis | E61: =C61 & " " & B61 -> Dennis Beauchamp | F61: 32875 | G61: PRESENT | H61: Engineering | I61: At KPTV (Meredith Corp.)
A62: =A61+1 -> 47 | B62: Beck | C62: Gary | D62: =B62 & ", " & C62 -> Beck, Gary | E62: =C62 & " " & B62 -> Gary Beck | F62: 28688 | G62: 29103 | H62: News Photographer
A63: =A62+1 -> 48 | B63: Beck | C63: Steve | D63: =B63 & ", " & C63 -> Beck, Steve | E63: =C63 & " " & B63 -> Steve Beck | F63: 33939 | G63: 38702 | H63: Production
A64: =A63+1 -> 49 | B64: Becker | C64: Tim | D64: =B64 & ", " & C64 -> Becker, Tim | E64: =C64 & " " & B64 -> Tim Becker | F64: 35445 | G64: PRESENT | H64: Talent | I64: At KPTV (Meredith Corp.)
A65: =A64+1 -> 50 | B65: Beebe | C65: Adam | D65: =B65 & ", " & C65 -> Beebe, Adam | E65: =C65 & " " & B65 -> Adam Beebe | F65: 35153 | G65: 37110 | H65: Sales | I65: living in Bend, OR
A66: =A65+1 -> 51 | B66: Behny | C66: Eric | D66: =B66 & ", " & C66 -> Behny, Eric | E66: =C66 & " " & B66 -> Eric Behny | F66: 36844 | G66: 37179 | H66: Sales | I66: now with KBPS
A67: =A66+1 -> 52 | B67: Belluomini | C67: Shirley | D67: =B67 & ", " & C67 -> Belluomini, Shirley | E67: =C67 & " " & B67 -> Shirley Belluomini | F67: 28688 | G67: 28795
A68: =A67+1 -> 53 | B68: Bennington | C68: Cindy | D68: =B68 & ", " & C68 -> Bennington, Cindy | E68: =C68 & " " & B68 -> Cindy Bennington | F68: 36789 | G68: PRESENT | H68: Sales | I68: At KPTV (Meredith Corp.)
A69: =A68+1 -> 54 | B69: Benton | C69: Loretta | D69: =B69 & ", " & C69 -> Benton, Loretta | E69: =C69 & " " & B69 -> Loretta Benton | H69: Traffic
A70: =A69+1 -> 55 | B70: Benza | C70: John | D70: =B70 & ", " & C70 -> Benza, John | E70: =C70 & " " & B70 -> John Benza | F70: 28998 | G70: 29103
A71: =A70+1 -> 56 | B71: Berger | C71: David | D71: =B71 & ", " & C71 -> Berger, David | E71: =C71 & " " & B71 -> David Berger | F71: 29561 | G71: 31079 | H71: Sales | I71: now Via C manager at Nordstrom's downtown Seattle, WA
A72: =A71+1 -> 57 | B72: Bernal | C72: Oswaldo | D72: =B72 & ", " & C72 -> Bernal, Oswaldo | E72: =C72 & " " & B72 -> Oswaldo Bernal | F72: 34169 | G72: 35334 | H72: Shipping
A73: =A72+1 -> 58 | B73: Bernsohn | C73: Bill | D73: =B73 & ", " & C73 -> Bernsohn, Bill | E73: =C73 & " " & B73 -> Bill Bernsohn | F73: 36496 | G73: 36496
A74: =A73+1 -> 59 | B74: Bertlesen | C74: Janis J | D74: =B74 & ", " & C74 -> Bertlesen, Janis J | E74: =C74 & " " & B74 -> Janis J Bertlesen | F74: (2) 12/22/65 | G74: 1965 | H74: P/T Switchboard
A75: =A74+1 -> 60 | B75: Bertrand | C75: Bob | D75: =B75 & ", " & C75 -> Bertrand, Bob | E75: =C75 & " " & B75 -> Bob Bertrand | F75: 28688 | G75: 28688
A76: =A75+1 -> 61 | B76: Betancourt | C76: Ignacio | D76: =B76 & ", " & C76 -> Betancourt, Ignacio | E76: =C76 & " " & B76 -> Ignacio Betancourt | F76: 27347 | G76: 27521
A77: =A76+1 -> 62 | B77: Bingham | C77: Dorothy | D77: =B77 & ", " & C77 -> Bingham, Dorothy | E77: =C77 & " " & B77 -> Dorothy Bingham | F77: 19287 | G77: 19287
A78: =A77+1 -> 63 | B78: Binn | C78: Joyce A | D78: =B78 & ", " & C78 -> Binn, Joyce A | E78: =C78 & " " & B78 -> Joyce A Binn | F78: 23998 | G78: 24008 | H78: P/T Program Assistant
A79: =A78+1 -> 64 | B79: Bixler | C79: Richard | D79: =B79 & ", " & C79 -> Bixler, Richard | E79: =C79 & " " & B79 -> Richard Bixler | F79: +/- 11/17/72 | G79: +/- 11/17/72
A80: =A79+1 -> 65 | B80: Bjaranson | C80: Adam | D80: =B80 & ", " & C80 -> Bjaranson, Adam | E80: =C80 & " " & B80 -> Adam Bjaranson | F80: 37189 | G80: 2005 | H80: Sports Reporter, Anchor | I80: Working for KGW
B81: Blackford | C81: Dan | D81: =B81 & ", " & C81 -> Blackford, Dan | E81: =C81 & " " & B81 -> Dan Blackford | F81: SEE COOK, DAN
A82: =A80+1 -> 66 | B82: Blais | C82: Roberta | D82: =B82 & ", " & C82 -> Blais, Roberta | E82: =C82 & " " & B82 -> Roberta Blais | F82: 30245 | G82: 30272 | H82: Engineer
A83: =A82+1 -> 67 | B83: Bock | C83: Duane | D83: =B83 & ", " & C83 -> Bock, Duane | E83: =C83 & " " & B83 -> Duane Bock | F83: 23319 | H83: News | I83: Deceased 7/1/1998
A84: =A83+1 -> 68 | B84: Boddie | C84: Ken | D84: =B84 & ", " & C84 -> Boddie, Ken | E84: =C84 & " " & B84 -> Ken Boddie | F84: 29910 | G84: 30477 | H84: News Reporter | I84: Now weekend news anchor at KOIN (6) Portland, OR
A85: =A84+1 -> 69 | B85: Bogh | C85: Gwen | D85: =B85 & ", " & C85 -> Bogh, Gwen | E85: =C85 & " " & B85 -> Gwen Bogh | F85: 29561 | G85: 29910 | H85: Traffic
A86: =A85+1 -> 70 | B86: Bolf | C86: Jim | D86: =B86 & ", " & C86 -> Bolf, Jim | E86: =C86 & " " & B86 -> Jim Bolf | F86: +/- 11/17/72 | G86: 9/?/02 | H86: Engineering
A87: =A86+1 -> 71 | B87: Bollinger | C87: Larry | D87: =B87 & ", " & C87 -> Bollinger, Larry | E87: =C87 & " " & B87 -> Larry Bollinger | F87: 28688 | G87: 33984 | H87: Production
A88: =A87+1 -> 72 | B88: Bomarito | C88: Vicki | D88: =B88 & ", " & C88 -> Bomarito, Vicki | E88: =C88 & " " & B88 -> Vicki Bomarito | F88: 26620 | G88: 26620
A89: =A88+1 -> 73 | B89: Bonnema | C89: Franklin D (Frank) | D89: =B89 & ", " & C89 -> Bonnema, Franklin D (Frank) | E89: =C89 & " " & B89 -> Franklin D (Frank) Bonnema | F89: 23671 | G89: 30229 | H89: Host, "Portland Wrestling", Station Announcer | I89: Died 10/5/1982
A90: =A89+1 -> 74 | B90: Bonnes | C90: Lois | D90: =B90 & ", " & C90 -> Bonnes, Lois | E90: =C90 & " " & B90 -> Lois Bonnes | F90: 1955 | G90: 1955 | H90: Promotion
A91: =A90+1 -> 75 | B91: Bossler | C91: Glen | D91: =B91 & ", " & C91 -> Bossler, Glen | E91: =C91 & " " & B91 -> Glen Bossler | F91: 29561 | G91: 9/?/02 | H91: Engineering
A92: =A91+1 -> 76 | B92: Bothe | C92: Deborah | D92: =B92 & ", " & C92 -> Bothe, Deborah | E92: =C92 & " " & B92 -> Deborah Bothe | F92: 29865 | G92: 29910
B93: Boussi | C93: Lynne | D93: =B93 & ", " & C93 -> Boussi, Lynne | E93: =C93 & " " & B93 -> Lynne Boussi | F93: SEE COBB, LYNNE
A94: =A92+1 -> 77 | B94: Boyer | C94: Phil | D94: =B94 & ", " & C94 -> Boyer, Phil | E94: =C94 & " " & B94 -> Phil Boyer | F94: 1960 | G94: 1960 | H94: Announcer/Floor Manager | I94: current President of Aircraft Owners and Pilot's Association in Frederick, MD
A95: =A94+1 -> 78 | B95: Boyles | C95: David M | D95: =B95 & ", " & C95 -> Boyles, David M | E95: =C95 & " " & B95 -> David M Boyles | F95: 22731 | G95: 1996 | H95: Engineering
A96: =A95+1 -> 79 | B96: Brantley | C96: Marty | D96: =B96 & ", " & C96 -> Brantley, Marty | E96: =C96 & " " & B96 -> Marty Brantley | F96: 27521 | G96: Spring 2000 | H96: 4th General Manager
B97: Brasseur | C97: Gina | D97: =B97 & ", " & C97 -> Brasseur, Gina | E97: =C97 & " " & B97 -> Gina Brasseur | F97: SEE WALKER, GINA
A98: =A96+1 -> 80 | B98: Brehm | C98: Gary | D98: =B98 & ", " & C98 -> Brehm, Gary | E98: =C98 & " " & B98 -> Gary Brehm | F98: 25615 | G98: 1/1988 | H98: Engineering
A99: =A98+1 -> 81 | B99: Brendler | C99: Eugene L (Gene) | D99: =B99 & ", " & C99 -> Brendler, Eugene L (Gene) | E99: =C99 & " " & B99 -> Eugene L (Gene) Brendler | F99: 19546 | G99: 33724 | H99: Host, News Anchor, News Director, Production Manager, Public Affairs Director | I99: Deceased 1-17-98
A100: =A99+1 -> 82 | B100: Brenton | C100: Loretta | D100: =B100 & ", " & C100 -> Brenton, Loretta | E100: =C100 & " " & B100 -> Loretta Brenton | F100: 31495 | G100: 31678 | H100: Traffic
A101: =A100+1 -> 83 | B101: Bridge | C101: Charles F. | D101: =B101 & ", " & C101 -> Bridge, Charles F. | E101: =C101 & " " & B101 -> Charles F. Bridge | F101: 29865 | G101: 33402 | H101: Engineering
A102: =A101+1 -> 84 | B102: Brock | C102: Scott | D102: =B102 & ", " & C102 -> Brock, Scott | E102: =C102 & " " & B102 -> Scott Brock | F102: 36031 | G102: PRESENT | H102: Sales | I102: At KPTV (Meredith Corp.)
A103: =A102+1 -> 85 | B103: Broeffle | C103: Sandi | D103: =B103 & ", " & C103 -> Broeffle, Sandi | E103: =C103 & " " & B103 -> Sandi Broeffle | F103: 31383 | G103: 31659 | H103: Traffic
A104: =A103+1 -> 86 | B104: Bronson | C104: Dan | D104: =B104 & ", " & C104 -> Bronson, Dan | E104: =C104 & " " & B104 -> Dan Bronson | F104: 34204 | G104: Summer 2002
A105: =A104+1 -> 87 | B105: Brown | C105: Claudia | D105: =B105 & ", " & C105 -> Brown, Claudia | E105: =C105 & " " & B105 -> Claudia Brown | F105: 29561 | G105: 30477 | H105: News
A106: =A105+1 -> 88 | B106: Brown | C106: Phil | D106: =B106 & ", " & C106 -> Brown, Phil | E106: =C106 & " " & B106 -> Phil Brown | F106: +/- 11/17/72 | G106: 9/?/02 | H106: Engineering
A107: =A106+1 -> 89 | B107: Brownlee | C107: Noreen | D107: =B107 & ", " & C107 -> Brownlee, Noreen | E107: =C107 & " " & B107 -> Noreen Brownlee | F107: 27347 | G107: 27521
A108: =A107+1 -> 90 | B108: Brunson | C108: Alton | D108: =B108 & ", " & C108 -> Brunson, Alton | E108: =C108 & " " & B108 -> Alton Brunson | F108: +/- 11/17/72 | G108: +/- 11/17/72
A109: =A108+1 -> 91 | B109: Buckman | C109: Juliette | D109: =B109 & ", " & C109 -> Buckman, Juliette | E109: =C109 & " " & B109 -> Juliette Buckman | F109: 27892 | G109: 32407 | H109: Sales | I109: AKA Julie Helberg; Now Julie Tierney, account executive for KPTV (Meredith Corp.)
A110: =A109+1 -> 92 | B110: Buller | C110: Fred | D110: =B110 & ", " & C110 -> Buller, Fred | E110: =C110 & " " & B110 -> Fred Buller | F110: 31352 | G110: 31927 | H110: Talent
A111: =A110+1 -> 93 | B111: Burke | C111: Robin | D111: =B111 & ", " & C111 -> Burke, Robin | E111: =C111 & " " & B111 -> Robin Burke | F111: 36844 | G111: PRESENT | H111: News | I111: At KPTV (Meredith Corp.)
A112: =A111+1 -> 94 | B112: Bubak | C112: LaDonna | D112: =B112 & ", " & C112 -> Bubak, LaDonna | E112: =C112 & " " & B112 -> LaDonna Bubak | F112: 34645 | G112: 35031 | H112: Traffic
A113: =A112+1 -> 95 | B113: Busaker | C113: Wayne | D113: =B113 & ", " & C113 -> Busaker, Wayne | E113: =C113 & " " & B113 -> Wayne Busaker | F113: 19483 | G113: 31898 | H113: Engineering
A114: =A113+1 -> 96 | B114: Bushnell | C114: Robert A III (Bob) | D114: =B114 & ", " & C114 -> Bushnell, Robert A III (Bob) | E114: =C114 & " " & B114 -> Robert A III (Bob) Bushnell | F114: 23819 | G114: +/- 11/17/72 | H114: Floorman
A115: =A114+1 -> 97 | B115: Busse | C115: Shari | D115: =B115 & ", " & C115 -> Busse, Shari | E115: =C115 & " " & B115 -> Shari Busse | F115: 1976 | G115: 37456 | H115: Traffic | I115: Albuquerque, NM
A116: =A115+1 -> 98 | B116: Butler | C116: Dick | D116: =B116 & ", " & C116 -> Butler, Dick | E116: =C116 & " " & B116 -> Dick Butler | F116: 28688 | G116: 33984 | H116: Production
A117: =A116+1 -> 99 | B117: Butler | C117: Michael | D117: =B117 & ", " & C117 -> Butler, Michael | E117: =C117 & " " & B117 -> Michael Butler | F117: 36935 | G117: 37383 | H117: News
A118: =A117+1 -> 100 | B118: Buttice | C118: Wayne | D118: =B118 & ", " & C118 -> Buttice, Wayne | E118: =C118 & " " & B118 -> Wayne Buttice | F118: 28688 | G118: 37503 | H118: Traffic/Programming | I118: now at KATU as sales asst.
A119: =A118+1 -> 101 | B119: Byrne | C119: Blake | D119: =B119 & ", " & C119 -> Byrne, Blake | E119: =C119 & " " & B119 -> Blake Byrne | F119: +/- 11/17/72 | G119: +/- 11/17/72
A120: =A119+1 -> 102 | B120: Byun | C120: Mary | D120: =B120 & ", " & C120 -> Byun, Mary | E120: =C120 & " " & B120 -> Mary Byun | H120: Sales | I120: now Account Executive with TeleRep in Seattle, WA
A121: =A120+1 -> 103 | B121: Campbell | C121: John | D121: =B121 & ", " & C121 -> Campbell, John | E121: =C121 & " " & B121 -> John Campbell | F121: 29747 | G121: 31989 | H121: News Photographer | I121: working on films in LA
A122: =A121+1 -> 104 | B122: Campbell | C122: Milton | D122: =B122 & ", " & C122 -> Campbell, Milton | E122: =C122 & " " & B122 -> Milton Campbell | F122: 30477 | G122: 30477
A123: =A122+1 -> 105 | B123: Campbelle | C123: Lillie | D123: =B123 & ", " & C123 -> Campbelle, Lillie | E123: =C123 & " " & B123 -> Lillie Campbelle | F123: +/- 11/17/72 | G123: +/- 11/17/72
A124: =A123+1 -> 106 | B124: Cannon | C124: Jerry D | D124: =B124 & ", " & C124 -> Cannon, Jerry D | E124: =C124 & " " & B124 -> Jerry D Cannon | F124: 22282 | G124: 31495 | H124: Engineering | I124: retired
A125: =A124+1 -> 107 | B125: Carich | C125: Diane | D125: =B125 & ", " & C125 -> Carich, Diane | E125: =C125 & " " & B125 -> Diane Carich | F125: 29865 | G125: 29910 | I125: AKA Diane Pierce
A126: =A125+1 -> 108 | B126: Carl | C126: Kevin | D126: =B126 & ", " & C126 -> Carl, Kevin | E126: =C126 & " " & B126 -> Kevin Carl | F126: 34416 | G126: 35251 | H126: Shipping/Promotion
A127: =A126+1 -> 109 | B127: Carlos | C127: Humberto "Tito" | D127: =B127 & ", " & C127 -> Carlos, Humberto "Tito" | E127: =C127 & " " & B127 -> Humberto "Tito" Carlos | F127: 28795 | G127: PRESENT | H127: Business Manager, Acting General Manager | I127: At KPTV (Meredith Corp.)
A128: =A127+1 -> 110 | B128: Carlson | C128: Dave | D128: =B128 & ", " & C128 -> Carlson, Dave | E128: =C128 & " " & B128 -> Dave Carlson | F128: 1953 | G128: 1953
A129: =A128+1 -> 111 | B129: Carlson-Smith | C129: Melinda | D129: =B129 & ", " & C129 -> Carlson-Smith, Melinda | E129: =C129 & " " & B129 -> Melinda Carlson-Smith | F129: 35662 | G129: PRESENT | H129: News Promotion | I129: At KPTV (Meredith Corp.)
A130: =A129+1 -> 112 | B130: Carmella | C130: Larry | D130: =B130 & ", " & C130 -> Carmella, Larry | E130: =C130 & " " & B130 -> Larry Carmella | F130: 1960 | G130: 1960 | I130: moved to KATU; now living in Portland, OR
A131: =A130+1 -> 113 | B131: Carr | C131: Jan | D131: =B131 & ", " & C131 -> Carr, Jan | E131: =C131 & " " & B131 -> Jan Carr | F131: 31677 | G131: 32024 | H131: Traffic
A132: =A131+1 -> 114 | B132: Carson | C132: Andy | D132: =B132 & ", " & C132 -> Carson, Andy | E132: =C132 & " " & B132 -> Andy Carson | F132: 35275 | G132: PRESENT | H132: Weathercaster, "Good Day Oregon" | I132: At KPTV (Meredith Corp.)
B133: Carsten | C133: Pamela | D133: =B133 & ", " & C133 -> Carsten, Pamela | E133: =C133 & " " & B133 -> Pamela Carsten | F133: SEE NORBURN, PAMELA
A134: =A132+1 -> 115 | B134: Cartwright | C134: Ervin L | D134: =B134 & ", " & C134 -> Cartwright, Ervin L | E134: =C134 & " " & B134 -> Ervin L Cartwright | F134: 23557 | G134: 1965 | H134: General Sales Manager
A135: =A134+1 -> 116 | B135: Carver | C135: Zack | D135: =B135 & ", " & C135 -> Carver, Zack | E135: =C135 & " " & B135 -> Zack Carver | F135: 36844 | G135: 37064 | H135: News
A136: =A135+1 -> 117 | B136: Cassidy | C136: Phil | D136: =B136 & ", " & C136 -> Cassidy, Phil | E136: =C136 & " " & B136 -> Phil Cassidy | F136: 31079 | G136: 37454 | H136: News Dept., Sports Reporter/Anchor, Good Day Oregon Feature Reporter
A137: =A136+1 -> 118 | B137: Cavin | C137: Roger A | D137: =B137 & ", " & C137 -> Cavin, Roger A | E137: =C137 & " " & B137 -> Roger A Cavin | F137: 23929 | G137: 24045 | H137: P/T
A138: =A137+1 -> 119 | B138: Chaffey | C138: Robyn | D138: =B138 & ", " & C138 -> Chaffey, Robyn | E138: =C138 & " " & B138 -> Robyn Chaffey | F138: 26620 | G138: 26620
A139: =A138+1 -> 120 | B139: Chambers | C139: Brenda | D139: =B139 & ", " & C139 -> Chambers, Brenda | E139: =C139 & " " & B139 -> Brenda Chambers | F139: 32407 | G139: 32974 | H139: Production
A140: =A139+1 -> 121 | B140: Chambers | C140: Margo | D140: =B140 & ", " & C140 -> Chambers, Margo | E140: =C140 & " " & B140 -> Margo Chambers | F140: 28998 | G140: 33984 | H140: Sales | I140: Died 4/29/2005
A141: =A140+1 -> 122 | B141: Chappelle | C141: Bob | D141: =B141 & ", " & C141 -> Chappelle, Bob | E141: =C141 & " " & B141 -> Bob Chappelle | F141: Fall 1965 | G141: Fall 1966 | H141: Mail Room; Accounts Payable; Film Editor | I141: Married Linda Hering; living in Santee, CA
B142: Chappelle | C142: Linda | D142: =B142 & ", " & C142 -> Chappelle, Linda | E142: =C142 & " " & B142 -> Linda Chappelle | F142: SEE HERING, LINDA
A143: =A141+1 -> 123 | B143: Chase | C143: Roland | D143: =B143 & ", " & C143 -> Chase, Roland | E143: =C143 & " " & B143 -> Roland Chase | F143: 26925 | G143: 29357 | H143: Production
A144: =A143+1 -> 124 | B144: Chaves | C144: Wilson | D144: =B144 & ", " & C144 -> Chaves, Wilson | E144: =C144 & " " & B144 -> Wilson Chaves | F144: +/- 11/17/72 | G144: +/- 11/17/72
A145: =A144+1 -> 125 | B145: Chipman | C145: Pamela | D145: =B145 & ", " & C145 -> Chipman, Pamela | E145: =C145 & " " & B145 -> Pamela Chipman | F145: 36346 | G145: 2002 | H145: News
A146: =A145+1 -> 126 | B146: Chisholm | C146: Collin Jr. "Bud" | D146: =B146 & ", " & C146 -> Chisholm, Collin Jr. "Bud" | E146: =C146 & " " & B146 -> Collin Jr. "Bud" Chisholm | F146: 22297 | G146: 34089 | H146: Sales
A147: =A146+1 -> 127 | B147: Christopherson | C147: Dan | D147: =B147 & ", " & C147 -> Christopherson, Dan | E147: =C147 & " " & B147 -> Dan Christopherson | F147: 36844 | G147: 37454 | H147: Talent
A148: =A147+1 -> 128 | B148: Chuck | C148: John | D148: =B148 & ", " & C148 -> Chuck, John | E148: =C148 & " " & B148 -> John Chuck | F148: 36496 | G148: 36496
A149: =A148+1 -> 129 | B149: Clark | C149: Alice | D149: =B149 & ", " & C149 -> Clark, Alice | E149: =C149 & " " & B149 -> Alice Clark | F149: 1953 | G149: 1953
A150: =A149+1 -> 130 | B150: Clark | C150: Bob | D150: =B150 & ", " & C150 -> Clark, Bob | E150: =C150 & " " & B150 -> Bob Clark | F150: 31079 | G150: 31329 | H150: Engineering
A151: =A150+1 -> 131 | B151: Clark | C151: Eileen | D151: =B151 & ", " & C151 -> Clark, Eileen | E151: =C151 & " " & B151 -> Eileen Clark | F151: 29561 | G151: 30272
A152: =A151+1 -> 132 | B152: Clayton | C152: Bill | D152: =B152 & ", " & C152 -> Clayton, Bill | E152: =C152 & " " & B152 -> Bill Clayton | F152: 19359 | G152: 1953 | H152: News anchor
A153: =A152+1 -> 133 | B153: Clum | C153: Pam | D153: =B153 & ", " & C153 -> Clum, Pam | E153: =C153 & " " & B153 -> Pam Clum | F153: 27347 | G153: 27521
A154: =A153+1 -> 134 | B154: Cobb | C154: Lynne | D154: =B154 & ", " & C154 -> Cobb, Lynne | E154: =C154 & " " & B154 -> Lynne Cobb | F154: (1) October 1971 (2) August 1979 | G154: (1) January 1976 (2) January 2000 | H154: Sales/Research | I154: AKA Lynne Boussi
A155: =A154+1 -> 135 | B155: Coffey | C155: Marcia | D155: =B155 & ", " & C155 -> Coffey, Marcia | E155: =C155 & " " & B155 -> Marcia Coffey
A156: =A155+1 -> 136 | B156: Coffin | C156: Gordon | D156: =B156 & ", " & C156 -> Coffin, Gordon | E156: =C156 & " " & B156 -> Gordon Coffin | F156: 31716 | G156: PRESENT | H156: News Photographer | I156: At KPTV (Meredith Corp.)
A157: =A156+1 -> 137 | B157: Colasurdo | C157: Bernie | D157: =B157 & ", " & C157 -> Colasurdo, Bernie | E157: =C157 & " " & B157 -> Bernie Colasurdo | F157: 31079 | G157: 31329
A158: =A157+1 -> 138 | B158: Coleman | C158: Marco | D158: =B158 & ", " & C158 -> Coleman, Marco | E158: =C158 & " " & B158 -> Marco Coleman | F158: 37235 | G158: 2005 | H158: Sales
A159: =A158+1 -> 139 | B159: Comfort | C159: Arlen D | D159: =B159 & ", " & C159 -> Comfort, Arlen D | E159: =C159 & " " & B159 -> Arlen D Comfort | F159: 21699 | G159: 12/8/65 | H159: Engineering
B160: Conant | C160: Phyllis | D160: =B160 & ", " & C160 -> Conant, Phyllis | E160: =C160 & " " & B160 -> Phyllis Conant | F160: SEE IVERS, PHYLLIS
A161: =A159+1 -> 140 | B161: Conley | C161: Kasey | D161: =B161 & ", " & C161 -> Conley, Kasey | E161: =C161 & " " & B161 -> Kasey Conley | F161: 28795 | G161: 28795
A162: =A161+1 -> 141 | B162: Connor | C162: Jeff | D162: =B162 & ", " & C162 -> Connor, Jeff | E162: =C162 & " " & B162 -> Jeff Connor | F162: 33521 | G162: PRESENT | H162: News
A163: =A162+1 -> 142 | B163: Cook | C163: Dan | D163: =B163 & ", " & C163 -> Cook, Dan | E163: =C163 & " " & B163 -> Dan Cook | F163: 27881 | G163: 37528 | H163: Engineering Camera, Audio, MCR, Cart Room, LMS, Supervisor and Scheduling | I163: AKA Dan Blackford
A164: =A163+1 -> 143 | B164: Cookingham | C164: Holt | D164: =B164 & ", " & C164 -> Cookingham, Holt | E164: =C164 & " " & B164 -> Holt Cookingham | F164: 19287 | G164: 19287
A165: =A164+1 -> 144 | B165: Cooper | C165: Bill | D165: =B165 & ", " & C165 -> Cooper, Bill | E165: =C165 & " " & B165 -> Bill Cooper | F165: 34490 | G165: 1999 | H165: Reporter | I165: now General Manager of KBPS-AM
A166: =A165+1 -> 145 | B166: Cooper | C166: Roy | D166: =B166 & ", " & C166 -> Cooper, Roy | E166: =C166 & " " & B166 -> Roy Cooper | F166: 11/1958 | G166: 1/1962 | H166: Engineering | I166: went to KATU; retired 1991
A167: =A166+1 -> 146 | B167: Corembaum | C167: John Jr. | D167: =B167 & ", " & C167 -> Corembaum, John Jr. | E167: =C167 & " " & B167 -> John Jr. Corembaum | F167: +/- 11/17/72 | G167: +/- 11/17/72
A168: =A167+1 -> 147 | B168: Cornforth | C168: Angela | D168: =B168 & ", " & C168 -> Cornforth, Angela | E168: =C168 & " " & B168 -> Angela Cornforth | F168: 35051 | G168: 35178 | H168: Sales Assistant
A169: =A168+1 -> 148 | B169: Cosgrove | C169: Kevin | D169: =B169 & ", " & C169 -> Cosgrove, Kevin | E169: =C169 & " " & B169 -> Kevin Cosgrove | F169: 29865 | G169: 30245
A170: =A169+1 -> 149 | B170: Coss | C170: Don | D170: =B170 & ", " & C170 -> Coss, Don | E170: =C170 & " " & B170 -> Don Coss | F170: (1) '+/- 11/17/72 (2) 2/28/1976 | G170: (1) '+/- 11/17/72 (2) 1991 | H170: Booth Announcer, Host of "Portland Wrestling"
A171: =A170+1 -> 150 | B171: Costello | C171: Shannon | D171: =B171 & ", " & C171 -> Costello, Shannon | E171: =C171 & " " & B171 -> Shannon Costello | F171: 31880 | G171: 33557 | H171: Engineering
A172: =A171+1 -> 151 | B172: Cox | C172: Robert L (Bob) | D172: =B172 & ", " & C172 -> Cox, Robert L (Bob) | E172: =C172 & " " & B172 -> Robert L (Bob) Cox | F172: 1953; 10/2/1959; 5/10/1965 | G172: 1960 | H172: Floorman, Director
A173: =A172+1 -> 152 | B173: Coy | C173: Jessica | D173: =B173 & ", " & C173 -> Coy, Jessica | E173: =C173 & " " & B173 -> Jessica Coy | F173: 35283 | G173: PRESENT | H173: Production, Promotion | I173: At KPTV (Meredith Corp.)
A174: =A173+1 -> 153 | B174: Cramer | C174: Bruce | D174: =B174 & ", " & C174 -> Cramer, Bruce | E174: =C174 & " " & B174 -> Bruce Cramer | F174: 31299 | G174: 32539 | H174: News
A175: =A174+1 -> 154 | B175: Crane | C175: Bernard | D175: =B175 & ", " & C175 -> Crane, Bernard | E175: =C175 & " " & B175 -> Bernard Crane | F175: 19287 | G175: 1960 | H175: Engineering
A176: =A175+1 -> 155 | B176: Crim | C176: Peter | D176: =B176 & ", " & C176 -> Crim, Peter | E176: =C176 & " " & B176 -> Peter Crim | F176: 28738 | G176: Summer 2002 | H176: Engineering
A177: =A176+1 -> 156 | B177: Crnich | C177: Larry | D177: =B177 & ", " & C177 -> Crnich, Larry | E177: =C177 & " " & B177 -> Larry Crnich | F177: 32645 | G177: 38359 | H177: News
A178: =A177+1 -> 157 | B178: Crosby | C178: Paul | D178: =B178 & ", " & C178 -> Crosby, Paul | E178: =C178 & " " & B178 -> Paul Crosby | F178: 29605 | G178: PRESENT | H178: Engineering | I178: At KPTV (Meredith Corp.)
A179: =A178+1 -> 158 | B179: Cross | C179: April | D179: =B179 & ", " & C179 -> Cross, April | E179: =C179 & " " & B179 -> April Cross | F179: +/- 11/17/72 | G179: +/- 11/17/72
A180: =A179+1 -> 159 | B180: Crowell | C180: Gina | D180: =B180 & ", " & C180 -> Crowell, Gina | E180: =C180 & " " & B180 -> Gina Crowell | F180: 26620 | G180: 26620
A181: =A180+1 -> 160 | B181: Culver | C181: Jodi | D181: =B181 & ", " & C181 -> Culver, Jodi | E181: =C181 & " " & B181 -> Jodi Culver | F181: 30858 | G181: 32283 | H181: Sales Assistant
A182: =A181+1 -> 161 | B182: Curran | C182: Cathy | D182: =B182 & ", " & C182 -> Curran, Cathy | E182: =C182 & " " & B182 -> Cathy Curran | F182: 32685 | G182: 32787 | H182: Traffic
A183: =A182+1 -> 162 | B183: Curran | C183: Debbie | D183: =B183 & ", " & C183 -> Curran, Debbie | E183: =C183 & " " & B183 -> Debbie Curran | F183: 35261 | G183: PRESENT | H183: News
A184: =A183+1 -> 163 | B184: Curran | C184: Larry | D184: =B184 & ", " & C184 -> Curran, Larry | E184: =C184 & " " & B184 -> Larry Curran | F184: 24563 | G184: 30976 | H184: News | I184: Deceased 10-21-84
A185: =A184+1 -> 164 | B185: Curran | C185: Mike | D185: =B185 & ", " & C185 -> Curran, Mike | E185: =C185 & " " & B185 -> Mike Curran | F185: 35421 | G185: 2004 | H185: News
A186: =A185+1 -> 165 | B186: Curtin | C186: Mike | D186: =B186 & ", " & C186 -> Curtin, Mike | E186: =C186 & " " & B186 -> Mike Curtin | F186: 31523 | G186: 2003 | H186: Engineering | I186: owner of Inday MultiMedia Products
A187: =A186+1 -> 166 | B187: Cutler | C187: Brian | D187: =B187 & ", " & C187 -> Cutler, Brian | E187: =C187 & " " & B187 -> Brian Cutler | F187: 35153 | G187: 36977 | H187: Promotion Producer | I187: now at KIRO-TV in Seattle, WA
A188: =A187+1 -> 167 | B188: Cutler | C188: Debby | D188: =B188 & ", " & C188 -> Cutler, Debby | E188: =C188 & " " & B188 -> Debby Cutler | F188: 28795 | G188: 29103
A189: =A188+1 -> 168 | B189: Cutler | C189: Sue | D189: =B189 & ", " & C189 -> Cutler, Sue | E189: =C189 & " " & B189 -> Sue Cutler | F189: 28688 | G189: 29103
A190: =A189+1 -> 169 | B190: Daly | C190: Toni | D190: =B190 & ", " & C190 -> Daly, Toni | E190: =C190 & " " & B190 -> Toni Daly | F190: 1953 | G190: 1953
A191: =A190+1 -> 170 | B191: Dames | C191: Jenny | D191: =B191 & ", " & C191 -> Dames, Jenny | E191: =C191 & " " & B191 -> Jenny Dames | F191: 28688 | G191: 28688
A192: =A191+1 -> 171 | B192: Danichek | C192: Fred | D192: =B192 & ", " & C192 -> Danichek, Fred | E192: =C192 & " " & B192 -> Fred Danichek | F192: 25812 | G192: 28610 | H192: Engineering
A193: =A192+1 -> 172 | B193: Davidson | C193: Dustine | D193: =B193 & ", " & C193 -> Davidson, Dustine | E193: =C193 & " " & B193 -> Dustine Davidson | F193: +/- 11/17/72 | G193: 28998 | H193: Business Manager
A194: =A193+1 -> 173 | B194: Davis | C194: Carl | D194: =B194 & ", " & C194 -> Davis, Carl | E194: =C194 & " " & B194 -> Carl Davis | F194: 31428 | H194: News Photographer
A195: =A194+1 -> 174 | B195: Davis | C195: Celesta | D195: =B195 & ", " & C195 -> Davis, Celesta | E195: =C195 & " " & B195 -> Celesta Davis | F195: 27347 | G195: 27347
A196: =A195+1 -> 175 | B196: Dawson | C196: Benjamin F | D196: =B196 & ", " & C196 -> Dawson, Benjamin F | E196: =C196 & " " & B196 -> Benjamin F Dawson | F196: 22903 | G196: 1965 | H196: Floorman
A197: =A196+1 -> 176 | B197: Deal | C197: Ryan | D197: =B197 & ", " & C197 -> Deal, Ryan | E197: =C197 & " " & B197 -> Ryan Deal | F197: 37306 | G197: 37383
A198: =A197+1 -> 177 | B198: Dean | C198: Matt | D198: =B198 & ", " & C198 -> Dean, Matt | E198: =C198 & " " & B198 -> Matt Dean | F198: 36844 | G198: 37383 | H198: Production
A199: =A198+1 -> 178 | B199: Deaton | C199: Barbara | D199: =B199 & ", " & C199 -> Deaton, Barbara | E199: =C199 & " " & B199 -> Barbara Deaton | F199: 29561 | G199: 1995 | H199: Promotion | I199: AKA Barbara Giles, now Barbara Sibley
A200: =A199+1 -> 179 | B200: Decker | C200: Gerald | D200: =B200 & ", " & C200 -> Decker, Gerald | E200: =C200 & " " & B200 -> Gerald Decker | F200: 1970 | G200: 1972 | H200: Camera Operator, Sound Booth | I200: living in Lynnwood, WA
A201: =A200+1 -> 180 | B201: Decker | C201: Hunt | D201: =B201 & ", " & C201 -> Decker, Hunt | E201: =C201 & " " & B201 -> Hunt Decker | F201: 1969 | G201: June 2000 | H201: Production | I201: Living in Tucson, AZ
B202: Decker | C202: Lois | D202: =B202 & ", " & C202 -> Decker, Lois | E202: =C202 & " " & B202 -> Lois Decker | F202: SEE KARAS, LOIS
B203: Decker | C203: Sue | D203: =B203 & ", " & C203 -> Decker, Sue | E203: =C203 & " " & B203 -> Sue Decker | F203: SEE KREVANKO, SUE
A204: =A201+1 -> 181 | B204: DeKay | C204: Earl | D204: =B204 & ", " & C204 -> DeKay, Earl | E204: =C204 & " " & B204 -> Earl DeKay | F204: 35270 | G204: PRESENT | H204: News | I204: At KPTV (Meredith Corp.)
A205: =A204+1 -> 182 | B205: Delmarter | C205: Steve | D205: =B205 & ", " & C205 -> Delmarter, Steve | E205: =C205 & " " & B205 -> Steve Delmarter | F205: 31236 | G205: October 2002 | H205: Engineering, Maintenance Supervisor, Broadcast Engineer
A206: =A205+1 -> 183 | B206: Deming | C206: Terry | D206: =B206 & ", " & C206 -> Deming, Terry | E206: =C206 & " " & B206 -> Terry Deming | F206: 36844 | G206: PRESENT | H206: Production | I206: At KPTV (Meredith Corp.)
A207: =A206+1 -> 184 | B207: Dennison | C207: Alan | D207: =B207 & ", " & C207 -> Dennison, Alan | E207: =C207 & " " & B207 -> Alan Dennison | F207: 27813 | G207: PRESENT | H207: Sales | I207: At KPTV (Meredith Corp.)
A208: =A207+1 -> 185 | B208: Derrick | C208: Lindie | D208: =B208 & ", " & C208 -> Derrick, Lindie | E208: =C208 & " " & B208 -> Lindie Derrick | F208: 36808 | G208: PRESENT | H208: Sales
A209: =A208+1 -> 186 | B209: Deutsch | C209: Marilyn | D209: =B209 & ", " & C209 -> Deutsch, Marilyn | E209: =C209 & " " & B209 -> Marilyn Deutsch | F209: 35153 | G209: 35153 | H209: News
A210: =A209+1 -> 187 | B210: DeWeerd | C210: Todd | D210: =B210 & ", " & C210 -> DeWeerd, Todd | E210: =C210 & " " & B210 -> Todd DeWeerd | F210: 31895 | G210: PRESENT | H210: Traffic, Engineering | I210: At KPTV (Meredith Corp.)
A211: =A210+1 -> 188 | B211: Dickey | C211: Bob | D211: =B211 & ", " & C211 -> Dickey, Bob | E211: =C211 & " " & B211 -> Bob Dickey | F211: 33043 | G211: 37587 | H211: News
A212: =A211+1 -> 189 | B212: Digregorio | C212: Anna | D212: =B212 & ", " & C212 -> Digregorio, Anna | E212: =C212 & " " & B212 -> Anna Digregorio | F212: 28688 | G212: 29103
A213: =A212+1 -> 190 | B213: Doane | C213: Jay | D213: =B213 & ", " & C213 -> Doane, Jay | E213: =C213 & " " & B213 -> Jay Doane | F213: +/- 11/17/72 | G213: +/- 11/17/72
A214: =A213+1 -> 191 | B214: Doane | C214: Raymond J | D214: =B214 & ", " & C214 -> Doane, Raymond J | E214: =C214 & " " & B214 -> Raymond J Doane | F214: 22407 | G214: 1965
A215: =A214+1 -> 192 | B215: Dodge | C215: Ian | D215: =B215 & ", " & C215 -> Dodge, Ian | E215: =C215 & " " & B215 -> Ian Dodge | F215: 36083 | G215: PRESENT | H215: News | I215: At KPTV (Meredith Corp.)
A216: =A215+1 -> 193 | B216: Donovan | C216: Jim | D216: =B216 & ", " & C216 -> Donovan, Jim | E216: =C216 & " " & B216 -> Jim Donovan | F216: 31636 | G216: 33724 | H216: News
A217: =A216+1 -> 194 | B217: Dorman | C217: Jim | D217: =B217 & ", " & C217 -> Dorman, Jim | E217: =C217 & " " & B217 -> Jim Dorman | F217: 2/2/1970; 1/7/1985 | G217: 11/1980; PRESENT | H217: Engineering | I217: At KPTV (Meredith Corp.)
A218: =A217+1 -> 195 | B218: Douglass | C218: Merry Ann | D218: =B218 & ", " & C218 -> Douglass, Merry Ann | E218: =C218 & " " & B218 -> Merry Ann Douglass | F218: 19287 | G218: 1953
A219: =A218+1 -> 196 | B219: Doyle | C219: Kathy | D219: =B219 & ", " & C219 -> Doyle, Kathy | E219: =C219 & " " & B219 -> Kathy Doyle | F219: 32685 | G219: 35349 | H219: Traffic | I219: working in Hillsboro
A220: =A219+1 -> 197 | B220: Drain | C220: Donna J | D220: =B220 & ", " & C220 -> Drain, Donna J | E220: =C220 & " " & B220 -> Donna J Drain | F220: 20752 | G220: 1965 | H220: Program Secretary
A221: =A220+1 -> 198 | B221: Drake | C221: Rosalie | D221: =B221 & ", " & C221 -> Drake, Rosalie | E221: =C221 & " " & B221 -> Rosalie Drake | F221: 26371 | G221: 35153 | H221: Traffic/Sales | I221: AKA Rosalie Nolin
A222: =A221+1 -> 199 | B222: Drangsholt | C222: Kent | D222: =B222 & ", " & C222 -> Drangsholt, Kent | E222: =C222 & " " & B222 -> Kent Drangsholt | F222: 28795 | G222: 29103 | H222: Sales
A223: =A222+1 -> 200 | B223: Dugan | C223: Larry R | D223: =B223 & ", " & C223 -> Dugan, Larry R | E223: =C223 & " " & B223 -> Larry R Dugan | F223: 22703 | G223: 1965 | H223: Engineer
A224: =A223+1 -> 201 | B224: Duggan | C224: Pat | D224: =B224 & ", " & C224 -> Duggan, Pat | E224: =C224 & " " & B224 -> Pat Duggan | F224: 31804 | G224: 31966
A225: =A224+1 -> 202 | B225: Duke | C225: Judy | D225: =B225 & ", " & C225 -> Duke, Judy | E225: =C225 & " " & B225 -> Judy Duke | F225: 26620 | G225: 26620
A226: =A225+1 -> 203 | B226: Dunbar | C226: Erin | D226: =B226 & ", " & C226 -> Dunbar, Erin | E226: =C226 & " " & B226 -> Erin Dunbar | F226: 36544 | G226: April 2003 | H226: Sales | I226: AKA Erin Scharf
B227: Duncan | C227: Becky | D227: =B227 & ", " & C227 -> Duncan, Becky | E227: =C227 & " " & B227 -> Becky Duncan | F227: SEE WININGER, BECKY
A228: =A226+1 -> 204 | B228: Duncan | C228: Bill | D228: =B228 & ", " & C228 -> Duncan, Bill | E228: =C228 & " " & B228 -> Bill Duncan | F228: 30245 | G228: 37274 | H228: Production
A229: =A228+1 -> 205 | B229: Dunevant | C229: Ron | D229: =B229 & ", " & C229 -> Dunevant, Ron | E229: =C229 & " " & B229 -> Ron Dunevant | F229: 33700 | G229: PRESENT | H229: Assistant Traffic Manager, Promotion Producer | I229: At KPTV (Meredith Corp.)
A230: =A229+1 -> 206 | B230: Dunne | C230: Anthony | D230: =B230 & ", " & C230 -> Dunne, Anthony | E230: =C230 & " " & B230 -> Anthony Dunne | F230: 34757 | G230: 34837 | H230: Traffic
A231: =A230+1 -> 207 | B231: Ecalbarger | C231: Cathy | D231: =B231 & ", " & C231 -> Ecalbarger, Cathy | E231: =C231 & " " & B231 -> Cathy Ecalbarger | F231: 37422 | G231: 37422 | H231: Production
A232: =A231+1 -> 208 | B232: Eckman | C232: Marie | D232: =B232 & ", " & C232 -> Eckman, Marie | E232: =C232 & " " & B232 -> Marie Eckman | F232: 19287 | G232: 1953 | I232: AKA Marie Steed; Deceased June 1991
A233: =A232+1 -> 209 | B233: Edgers | C233: Peter | D233: =B233 & ", " & C233 -> Edgers, Peter | E233: =C233 & " " & B233 -> Peter Edgers | F233: 35153 | G233: 35153 | H233: Production
A234: =A233+1 -> 210 | B234: Edwards | C234: Dwight | D234: =B234 & ", " & C234 -> Edwards, Dwight | E234: =C234 & " " & B234 -> Dwight Edwards | F234: 28688 | G234: 28688
A235: =A234+1 -> 211 | B235: Effenberger | C235: Susan | D235: =B235 & ", " & C235 -> Effenberger, Susan | E235: =C235 & " " & B235 -> Susan Effenberger | F235: 35261 | G235: 1999 | H235: Graphic Artist | I235: now with KATU (2)
A236: =A235+1 -> 212 | B236: Egan | C236: Mikell | D236: =B236 & ", " & C236 -> Egan, Mikell | E236: =C236 & " " & B236 -> Mikell Egan | F236: 27521 | G236: 27521
A237: =A236+1 -> 213 | B237: Egan | C237: Nancy (Nan) | D237: =B237 & ", " & C237 -> Egan, Nancy (Nan) | E237: =C237 & " " & B237 -> Nancy (Nan) Egan | F237: +/- 11/17/72 | G237: 27347
A238: =A237+1 -> 214 | B238: Egbert | C238: Marjorie | D238: =B238 & ", " & C238 -> Egbert, Marjorie | E238: =C238 & " " & B238 -> Marjorie Egbert | F238: 1953 | G238: 1953
A239: =A238+1 -> 215 | B239: Ehrlin | C239: Hans K | D239: =B239 & ", " & C239 -> Ehrlin, Hans K | E239: =C239 & " " & B239 -> Hans K Ehrlin | F239: 23109 | G239: 31443 | H239: Sales
A240: =A239+1 -> 216 | B240: Elliott | C240: Andrew W (Andy) | D240: =B240 & ", " & C240 -> Elliott, Andrew W (Andy) | E240: =C240 & " " & B240 -> Andrew W (Andy) Elliott | F240: 29865 | G240: 37638 | H240: News
B241: Ellis | C241: Roxan | D241: =B241 & ", " & C241 -> Ellis, Roxan | E241: =C241 & " " & B241 -> Roxan Ellis | F241: SEE ROGERS, ROXAN
B242: Emmerling | C242: Karen | D242: =B242 & ", " & C242 -> Emmerling, Karen | E242: =C242 & " " & B242 -> Karen Emmerling | F242: SEE MALMSTEN, KAREN
A243: =A240+1 -> 217 | B243: English | C243: Beth (Elizebeth) | D243: =B243 & ", " & C243 -> English, Beth (Elizebeth) | E243: =C243 & " " & B243 -> Beth (Elizebeth) English | F243: 36830 | G243: PRESENT | H243: News Photographer
A244: =A243+1 -> 218 | B244: Ermel | C244: Denny | D244: =B244 & ", " & C244 -> Ermel, Denny | E244: =C244 & " " & B244 -> Denny Ermel | F244: +/- 11/17/72 | G244: 27521 | H244: Director
A245: =A244+1 -> 219 | B245: Esguerra | C245: Julie | D245: =B245 & ", " & C245 -> Esguerra, Julie | E245: =C245 & " " & B245 -> Julie Esguerra | F245: 36844 | G245: 37064 | H245: News
A246: =A245+1 -> 220 | B246: Espeseth | C246: Phillip M | D246: =B246 & ", " & C246 -> Espeseth, Phillip M | E246: =C246 & " " & B246 -> Phillip M Espeseth | F246: 23739 | G246: 1965 | H246: Sales
A247: =A246+1 -> 221 | B247: Etheridge | C247: Eugene | D247: =B247 & ", " & C247 -> Etheridge, Eugene | E247: =C247 & " " & B247 -> Eugene Etheridge | F247: 31563 | G247: 31710 | H247: News Photographer
A248: =A247+1 -> 222 | B248: Ettelson | C248: John | D248: =B248 & ", " & C248 -> Ettelson, John | E248: =C248 & " " & B248 -> John Ettelson | F248: 19287 | G248: 1953
A249: =A248+1 -> 223 | B249: Eyers | C249: Kevin | D249: =B249 & ", " & C249 -> Eyers, Kevin | E249: =C249 & " " & B249 -> Kevin Eyers | F249: 32931 | G249: 35153 | H249: News
A250: =A249+1 -> 224 | B250: Fall | C250: Gilbert "Gil" | D250: =B250 & ", " & C250 -> Fall, Gilbert "Gil" | E250: =C250 & " " & B250 -> Gilbert "Gil" Fall | F250: 19287 | G250: 1953
A251: =A250+1 -> 225 | B251: Farrar | C251: Craig | D251: =B251 & ", " & C251 -> Farrar, Craig | E251: =C251 & " " & B251 -> Craig Farrar | F251: 36935 | G251: 37383 | H251: Production
A252: =A251+1 -> 226 | B252: Fawcett | C252: Marilee | D252: =B252 & ", " & C252 -> Fawcett, Marilee | E252: =C252 & " " & B252 -> Marilee Fawcett | F252: 29865 | G252: 29865
A253: =A252+1 -> 227 | B253: Feldman | C253: Andy | D253: =B253 & ", " & C253 -> Feldman, Andy | E253: =C253 & " " & B253 -> Andy Feldman | F253: 35153 | G253: 7/?/02 | H253: General Sales Manager | I253: in San Diego
A254: =A253+1 -> 228 | B254: Ferdig | C254: Jenal | D254: =B254 & ", " & C254 -> Ferdig, Jenal | E254: =C254 & " " & B254 -> Jenal Ferdig | F254: 33724 | G254: 35153 | H254: Traffic/Accounting
A255: =A254+1 -> 229 | B255: Fernandez | C255: Melanie | D255: =B255 & ", " & C255 -> Fernandez, Melanie | E255: =C255 & " " & B255 -> Melanie Fernandez | F255: 31495 | G255: 33984 | H255: Sales
A256: =A255+1 -> 230 | B256: Ferryman | C256: Pete | D256: =B256 & ", " & C256 -> Ferryman, Pete | E256: =C256 & " " & B256 -> Pete Ferryman | F256: 36677 | G256: PRESENT | H256: Anchor, Good Day Oregon | I256: At KPTV (Meredith Corp.)
A257: =A256+1 -> 231 | B257: Fiallo | C257: Rosie | D257: =B257 & ", " & C257 -> Fiallo, Rosie | E257: =C257 & " " & B257 -> Rosie Fiallo | F257: 33443 | G257: 34228 | H257: News Reporter
A258: =A257+1 -> 232 | B258: Filler | C258: Eileen | D258: =B258 & ", " & C258 -> Filler, Eileen | E258: =C258 & " " & B258 -> Eileen Filler | F258: 27347 | G258: 27521
A259: =A258+1 -> 233 | B259: Fisher | C259: Bruce | D259: =B259 & ", " & C259 -> Fisher, Bruce | E259: =C259 & " " & B259 -> Bruce Fisher | F259: 29561 | G259: 29593
A260: =A259+1 -> 234 | B260: Fisher | C260: Kathy | D260: =B260 & ", " & C260 -> Fisher, Kathy | E260: =C260 & " " & B260 -> Kathy Fisher | F260: +/- 11/17/72 | G260: +/- 11/17/72
A261: =A260+1 -> 235 | B261: Fitz | C261: Lottie | D261: =B261 & ", " & C261 -> Fitz, Lottie | E261: =C261 & " " & B261 -> Lottie Fitz | F261: +/- 11/17/72 | G261: +/- 11/17/72
A262: =A261+1 -> 236 | B262: Fitzpatrick | C262: Francine | D262: =B262 & ", " & C262 -> Fitzpatrick, Francine | E262: =C262 & " " & B262 -> Francine Fitzpatrick | F262: 27347 | G262: 27521
A263: =A262+1 -> 237 | B263: Flanigan | C263: Dave | D263: =B263 & ", " & C263 -> Flanigan, Dave | E263: =C263 & " " & B263 -> Dave Flanigan | F263: 32781 | G263: PRESENT | H263: News | I263: At KPTV (Meredith Corp.)
B264: Flateau | C264: Hector | D264: =B264 & ", " & C264 -> Flateau, Hector | E264: =C264 & " " & B264 -> Hector Flateau | F264: SEE HARPER, HECK
A265: =A263+1 -> 238 | B265: Foreman | C265: Evelyn | D265: =B265 & ", " & C265 -> Foreman, Evelyn | E265: =C265 & " " & B265 -> Evelyn Foreman | F265: 28795 | G265: 28795
A266: =A265+1 -> 239 | B266: Forrest | C266: Roger | D266: =B266 & ", " & C266 -> Forrest, Roger | E266: =C266 & " " & B266 -> Roger Forrest | F266: 25781 | G266: Summer 2002 | H266: Engineering
A267: =A266+1 -> 240 | B267: Foster | C267: Debbie | D267: =B267 & ", " & C267 -> Foster, Debbie | E267: =C267 & " " & B267 -> Debbie Foster | F267: 29561 | G267: Summer 2002 | H267: Engineering | I267: AKA Debbie Meyers
A268: =A267+1 -> 241 | B268: Freeman | C268: Marilyn | D268: =B268 & ", " & C268 -> Freeman, Marilyn | E268: =C268 & " " & B268 -> Marilyn Freeman | F268: 27347 | G268: 33984 | H268: Traffic/Promotion
A269: =A268+1 -> 242 | B269: Freeze | C269: Amy | D269: =B269 & ", " & C269 -> Freeze, Amy | E269: =C269 & " " & B269 -> Amy Freeze | I269: now with NBC-10 in Philadelphia
A270: =A269+1 -> 243 | B270: Friesner | C270: Larry | D270: =B270 & ", " & C270 -> Friesner, Larry | E270: =C270 & " " & B270 -> Larry Friesner | F270: 31079 | G270: 33984 | H270: News | I270: Deceased 7/26/1995
A271: =A270+1 -> 244 | B271: Fritz | C271: Corrine | D271: =B271 & ", " & C271 -> Fritz, Corrine | E271: =C271 & " " & B271 -> Corrine Fritz | F271: 36844 | G271: 37375 | H271: Shipping
A272: =A271+1 -> 245 | B272: Frutos | C272: Diego | D272: =B272 & ", " & C272 -> Frutos, Diego | E272: =C272 & " " & B272 -> Diego Frutos | F272: 27347 | G272: 27347
A273: =A272+1 -> 246 | B273: Fuller | C273: Victoria | D273: =B273 & ", " & C273 -> Fuller, Victoria | E273: =C273 & " " & B273 -> Victoria Fuller | F273: +/- 11/17/72 | G273: +/- 11/17/72
A274: =A273+1 -> 247 | B274: Funk | C274: Dave | D274: =B274 & ", " & C274 -> Funk, Dave | E274: =C274 & " " & B274 -> Dave Funk | F274: 27521 | G274: 27521
A275: =A274+1 -> 248 | B275: Galinsky | C275: Vicky | D275: =B275 & ", " & C275 -> Galinsky, Vicky | E275: =C275 & " " & B275 -> Vicky Galinsky | F275: 35153 | G275: 35153 | H275: Traffic
A276: =A275+1 -> 249 | B276: Gallant | C276: Nathan | D276: =B276 & ", " & C276 -> Gallant, Nathan | E276: =C276 & " " & B276 -> Nathan Gallant | F276: 36469 | G276: PRESENT | H276: Production
A277: =A276+1 -> 250 | B277: Garcia | C277: Dan | D277: =B277 & ", " & C277 -> Garcia, Dan | E277: =C277 & " " & B277 -> Dan Garcia | F277: 36844 | G277: 37864 | H277: News | I277: Left to go into teaching
A278: =A277+1 -> 251 | B278: Gardner | C278: Joan | D278: =B278 & ", " & C278 -> Gardner, Joan | E278: =C278 & " " & B278 -> Joan Gardner | F278: 26620 | G278: 26620
A279: =A278+1 -> 252 | B279: Gray | C279: Roxanne | D279: =B279 & ", " & C279 -> Gray, Roxanne | E279: =C279 & " " & B279 -> Roxanne Gray | F279: 27347 | G279: 27521
A280: =A279+1 -> 253 | B280: Gersh | C280: Jane | D280: =B280 & ", " & C280 -> Gersh, Jane | E280: =C280 & " " & B280 -> Jane Gersh | F280: 26620 | G280: 26620
A281: =A280+1 -> 254 | B281: Gibson | C281: Lowery | D281: =B281 & ", " & C281 -> Gibson, Lowery | E281: =C281 & " " & B281 -> Lowery Gibson | F281: 29103 | G281: 29593
A282: =A281+1 -> 255 | B282: Gilbert | C282: Ed | D282: =B282 & ", " & C282 -> Gilbert, Ed | E282: =C282 & " " & B282 -> Ed Gilbert | F282: 1957 | I282: First host of "High Time"; Deceased
B283: Giles | C283: Barbara | D283: =B283 & ", " & C283 -> Giles, Barbara | E283: =C283 & " " & B283 -> Barbara Giles | F283: SEE DEATON, BARBARA
A284: =A282+1 -> 256 | B284: Gilley | C284: Lorena D | D284: =B284 & ", " & C284 -> Gilley, Lorena D | E284: =C284 & " " & B284 -> Lorena D Gilley | F284: 23725 | G284: 1965 | H284: Sales Secretary
A285: =A284+1 -> 257 | B285: Gindhard | C285: Bud | D285: =B285 & ", " & C285 -> Gindhard, Bud | E285: =C285 & " " & B285 -> Bud Gindhard | F285: 28795 | G285: 28795
A286: =A285+1 -> 258 | B286: Glendenning | C286: Jim | D286: =B286 & ", " & C286 -> Glendenning, Jim | E286: =C286 & " " & B286 -> Jim Glendenning | F286: 28688 | G286: 29103 | H286: Engineer
A287: =A286+1 -> 259 | B287: Godsil | C287: Harry E | D287: =B287 & ", " & C287 -> Godsil, Harry E | E287: =C287 & " " & B287 -> Harry E Godsil | F287: 2/28/55 | G287: 1960 | H287: Director
A288: =A287+1 -> 260 | B288: Goeglein | C288: Aaron | D288: =B288 & ", " & C288 -> Goeglein, Aaron | E288: =C288 & " " & B288 -> Aaron Goeglein | F288: 36374 | G288: PRESENT | H288: Production | I288: At KPTV (Meredith Corp.)
A289: =A288+1 -> 261 | B289: Goldsberry | C289: Sue | D289: =B289 & ", " & C289 -> Goldsberry, Sue | E289: =C289 & " " & B289 -> Sue Goldsberry | F289: 35387 | G289: 37501 | H289: National Sales Assistant
A290: =A289+1 -> 262 | B290: Gonzalez | C290: Terri | D290: =B290 & ", " & C290 -> Gonzalez, Terri | E290: =C290 & " " & B290 -> Terri Gonzalez | F290: 28998 | G290: 35153 | H290: Engineering
A291: =A290+1 -> 263 | B291: Goode | C291: Harry | D291: =B291 & ", " & C291 -> Goode, Harry | E291: =C291 & " " & B291 -> Harry Goode | F291: 1953 | G291: 1953
A292: =A291+1 -> 264 | B292: Goode | C292: Thomas | D292: =B292 & ", " & C292 -> Goode, Thomas | E292: =C292 & " " & B292 -> Thomas Goode | F292: 29865 | G292: 32687 | H292: Engineer | I292: in Seattle
A293: =A292+1 -> 265 | B293: Gordon | C293: Katie | D293: =B293 & ", " & C293 -> Gordon, Katie | E293: =C293 & " " & B293 -> Katie Gordon | F293: 36496 | G293: 36496
A294: =A293+1 -> 266 | B294: Gose | C294: Thomas | D294: =B294 & ", " & C294 -> Gose, Thomas | E294: =C294 & " " & B294 -> Thomas Gose | F294: 30477 | G294: 30477
A295: =A294+1 -> 267 | B295: Gould | C295: Lorraine | D295: =B295 & ", " & C295 -> Gould, Lorraine | E295: =C295 & " " & B295 -> Lorraine Gould | F295: 19359 | G295: 1953
A296: =A295+1 -> 268 | B296: Graham | C296: Dave | D296: =B296 & ", " & C296 -> Graham, Dave | E296: =C296 & " " & B296 -> Dave Graham | F296: 1953 | G296: 1953
A297: =A296+1 -> 269 | B297: Grant | C297: Kent | D297: =B297 & ", " & C297 -> Grant, Kent | E297: =C297 & " " & B297 -> Kent Grant | F297: +/- 11/17/72 | G297: +/- 11/17/72
A298: =A297+1 -> 270 | B298: Green | C298: Mindy | D298: =B298 & ", " & C298 -> Green, Mindy | E298: =C298 & " " & B298 -> Mindy Green | F298: 37306 | G298: PRESENT | H298: Sales
A299: =A298+1 -> 271 | B299: Gregory | C299: Carol | D299: =B299 & ", " & C299 -> Gregory, Carol | E299: =C299 & " " & B299 -> Carol Gregory | F299: 30245 | G299: 31905 | H299: Accounting
A300: =A299+1 -> 272 | B300: Grimes | C300: Nancy | D300: =B300 & ", " & C300 -> Grimes, Nancy | E300: =C300 & " " & B300 -> Nancy Grimes | F300: 35264 | G300: 37383 | H300: Sales
A301: =A300+1 -> 273 | B301: Grindell | C301: Charles W "Chuck" | D301: =B301 & ", " & C301 -> Grindell, Charles W "Chuck" | E301: =C301 & " " & B301 -> Charles W "Chuck" Grindell | F301: 21669 | G301: 33402 | H301: Production | I301: in Seattle
A302: =A301+1 -> 274 | B302: Gross | C302: Earl | D302: =B302 & ", " & C302 -> Gross, Earl | E302: =C302 & " " & B302 -> Earl Gross | F302: 1957 | G302: 1957 | H302: Engineering
A303: =A302+1 -> 275 | B303: Grossenbacher | C303: Leslie | D303: =B303 & ", " & C303 -> Grossenbacher, Leslie | E303: =C303 & " " & B303 -> Leslie Grossenbacher | F303: 36844 | G303: 37193 | H303: Sales
A304: =A303+1 -> 276 | B304: Grove | C304: Earl | D304: =B304 & ", " & C304 -> Grove, Earl | E304: =C304 & " " & B304 -> Earl Grove | F304: 1953 | G304: 1953
A305: =A304+1 -> 277 | B305: Gudgel | C305: Jon | D305: =B305 & ", " & C305 -> Gudgel, Jon | E305: =C305 & " " & B305 -> Jon Gudgel | F305: 32295 | G305: 35153 | H305: News
A306: =A305+1 -> 278 | B306: Gustin | C306: Jeff | D306: =B306 & ", " & C306 -> Gustin, Jeff | E306: =C306 & " " & B306 -> Jeff Gustin | F306: 31916 | G306: 38702 | H306: Production/News Photographer | I306: Now head of Gustin Creative Group, producing "Garden Time" TV Show
A307: =A306+1 -> 279 | B307: Guza | C307: Monica | D307: =B307 & ", " & C307 -> Guza, Monica | E307: =C307 & " " & B307 -> Monica Guza | F307: 36844 | G307: 37453 | H307: Talent
A308: =A307+1 -> 280 | B308: Hacke | C308: Alva | D308: =B308 & ", " & C308 -> Hacke, Alva | E308: =C308 & " " & B308 -> Alva Hacke | F308: 21025 | G308: 31686 | H308: Floorman | I308: Deceased Dec 1992
A309: =A308+1 -> 281 | B309: Hainds | C309: Jim "Jimmie" | D309: =B309 & ", " & C309 -> Hainds, Jim "Jimmie" | E309: =C309 & " " & B309 -> Jim "Jimmie" Hainds | F309: 19359 | G309: 1953 | H309: Photographer
A310: =A309+1 -> 282 | B310: Hale | C310: Stephany | D310: =B310 & ", " & C310 -> Hale, Stephany | E310: =C310 & " " & B310 -> Stephany Hale | F310: 31636 | G310: 33984 | H310: Promotion
A311: =A310+1 -> 283 | B311: Hall | C311: Melody | D311: =B311 & ", " & C311 -> Hall, Melody | E311: =C311 & " " & B311 -> Melody Hall | F311: March 1974 | G311: February 1979 | H311: Traffic | I311: AKA Melody Hunzeker; Now with Warner Bros. International TV in Los Angeles
A312: =A311+1 -> 284 | B312: Haller | C312: Liz | D312: =B312 & ", " & C312 -> Haller, Liz | E312: =C312 & " " & B312 -> Liz Haller | F312: 33043 | G312: 33043 | H312: Engineer
A313: =A312+1 -> 285 | B313: Halvorson | C313: Tom | D313: =B313 & ", " & C313 -> Halvorson, Tom | E313: =C313 & " " & B313 -> Tom Halvorson | F313: +/- 11/17/72 | G313: 30477 | H313: Talent
A314: =A313+1 -> 286 | B314: Hamill | C314: Cindy | D314: =B314 & ", " & C314 -> Hamill, Cindy | E314: =C314 & " " & B314 -> Cindy Hamill | F314: 35153 | G314: 35153 | H314: News
A315: =A314+1 -> 287 | B315: Hamilton | C315: Konrad | D315: =B315 & ", " & C315 -> Hamilton, Konrad | E315: =C315 & " " & B315 -> Konrad Hamilton | F315: 28688 | G315: 28998
A316: =A315+1 -> 288 | B316: Hamlin | C316: Jan | D316: =B316 & ", " & C316 -> Hamlin, Jan | E316: =C316 & " " & B316 -> Jan Hamlin | F316: 28688 | G316: 28688
A317: =A316+1 -> 289 | B317: Hamm | C317: Sandi | D317: =B317 & ", " & C317 -> Hamm, Sandi | E317: =C317 & " " & B317 -> Sandi Hamm | F317: 29561 | G317: 31079 | H317: News Photographer
A318: =A317+1 -> 290 | B318: Hanemann | C318: Lisa | D318: =B318 & ", " & C318 -> Hanemann, Lisa | E318: =C318 & " " & B318 -> Lisa Hanemann | F318: 31727 | G318: PRESENT | H318: News
A319: =A318+1 -> 291 | B319: Hansen | C319: John S | D319: =B319 & ", " & C319 -> Hansen, John S | E319: =C319 & " " & B319 -> John S Hansen | F319: 21794 | G319: 30560 | H319: General Manager | I319: Deceased 12/01
A320: =A319+1 -> 292 | B320: Hansen | C320: Karen | D320: =B320 & ", " & C320 -> Hansen, Karen | E320: =C320 & " " & B320 -> Karen Hansen | F320: 32063 | G320: 33984 | H320: Sales | I320: Moved to KATU; now Local Sales Manager for Comcast.
A321: =A320+1 -> 293 | B321: Hanson | C321: Amy | D321: =B321 & ", " & C321 -> Hanson, Amy | E321: =C321 & " " & B321 -> Amy Hanson | F321: 36353 | G321: 2004 | H321: Traffic
A322: =A321+1 -> 294 | B322: Harmony | C322: Pam | D322: =B322 & ", " & C322 -> Harmony, Pam | E322: =C322 & " " & B322 -> Pam Harmony | F322: March 1974 | G322: March 1974 | H322: Accounting
A323: =A322+1 -> 295 | B323: Harms | C323: John | D323: =B323 & ", " & C323 -> Harms, John | E323: =C323 & " " & B323 -> John Harms | F323: 19359 | G323: 19359
A324: =A323+1 -> 296 | B324: Harris | C324: Ralph L | D324: =B324 & ", " & C324 -> Harris, Ralph L | E324: =C324 & " " & B324 -> Ralph L Harris | F324: 20474 | G324: 28795 | H324: Transmitter Engineer | I324: Deceased
A325: =A324+1 -> 297 | B325: Harrison | C325: Launni | D325: =B325 & ", " & C325 -> Harrison, Launni | E325: =C325 & " " & B325 -> Launni Harrison | F325: 31079 | G325: 33984 | H325: Engineering | I325: Working for KING/KONG in Seattle
A326: =A325+1 -> 298 | B326: Harper | C326: Heck | D326: =B326 & ", " & C326 -> Harper, Heck | E326: =C326 & " " & B326 -> Heck Harper | F326: 1953 | G326: 1956 | H326: Cowboy Singer, star of "Bar 27 Corral" | I326: AKA Hector Flateau, deceased
A327: =A326+1 -> 299 | B327: Hart | C327: Edwin | D327: =B327 & ", " & C327 -> Hart, Edwin | E327: =C327 & " " & B327 -> Edwin Hart | F327: 1959 | G327: October 1963 | H327: Announcer, News Anchor | I327: News Director for WLNE, Providence, RI
A328: =A327+1 -> 300 | B328: Hartfield | C328: Michael | D328: =B328 & ", " & C328 -> Hartfield, Michael | E328: =C328 & " " & B328 -> Michael Hartfield | F328: +/- 11/17/72 | G328: 27521 | H328: News Anchor
A329: =A328+1 -> 301 | B329: Hartrampf | C329: Olive | D329: =B329 & ", " & C329 -> Hartrampf, Olive | E329: =C329 & " " & B329 -> Olive Hartrampf | F329: 19287 | G329: 1953 | I329: AKA Olive Mae Potthoff
A330: =A329+1 -> 302 | B330: Hasser | C330: Greg | D330: =B330 & ", " & C330 -> Hasser, Greg | E330: =C330 & " " & B330 -> Greg Hasser | F330: 36549 | G330: 37645 | H330: News
A331: =A330+1 -> 303 | B331: Hausotter | C331: Marta | D331: =B331 & ", " & C331 -> Hausotter, Marta | E331: =C331 & " " & B331 -> Marta Hausotter | F331: 32020 | G331: 33662 | H331: Assistant Traffic Manager | I331: AKA Marta McClung
A332: =A331+1 -> 304 | B332: Hazell | C332: Jon | D332: =B332 & ", " & C332 -> Hazell, Jon | E332: =C332 & " " & B332 -> Jon Hazell | F332: 32392 | G332: 32808 | H332: Maintenance Engineer
A333: =A332+1 -> 305 | B333: Heil | C333: Chuck | D333: =B333 & ", " & C333 -> Heil, Chuck | E333: =C333 & " " & B333 -> Chuck Heil | F333: 27300 | G333: September 2002 | H333: Engineering
A334: =A333+1 -> 306 | B334: Heib | C334: Valerie | D334: =B334 & ", " & C334 -> Heib, Valerie | E334: =C334 & " " & B334 -> Valerie Heib | F334: 2001 | G334: 2001
A335: =A334+1 -> 307 | B335: Heiden | C335: Jim | D335: =B335 & ", " & C335 -> Heiden, Jim | E335: =C335 & " " & B335 -> Jim Heiden | F335: +/- 11/17/72 | G335: +/- 11/17/72
A336: =A335+1 -> 308 | B336: Heim | C336: Jim | D336: =B336 & ", " & C336 -> Heim, Jim | E336: =C336 & " " & B336 -> Jim Heim | F336: 1971 | G336: 1976 | H336: Engineering
A337: =A336+1 -> 309 | B337: Heinrich | C337: Mike | D337: =B337 & ", " & C337 -> Heinrich, Mike | E337: =C337 & " " & B337 -> Mike Heinrich | F337: 36074 | G337: PRESENT | H337: News Photographer | I337: At KPTV (Meredith Corp.)
A338: =A337+1 -> 310 | B338: Hellberg | C338: Pat | D338: =B338 & ", " & C338 -> Hellberg, Pat | E338: =C338 & " " & B338 -> Pat Hellberg | F338: 29561 | G338: 29593 | H338: News
B339: Hellberg | C339: Julie | D339: =B339 & ", " & C339 -> Hellberg, Julie | E339: =C339 & " " & B339 -> Julie Hellberg | F339: SEE BUCKMAN, JULIETTE
A340: =A338+1 -> 311 | B340: Hemingway | C340: Mark | D340: =B340 & ", " & C340 -> Hemingway, Mark | E340: =C340 & " " & B340 -> Mark Hemingway | F340: 36496 | G340: 36496
A341: =A340+1 -> 312 | B341: Hennessy | C341: Lois | D341: =B341 & ", " & C341 -> Hennessy, Lois | E341: =C341 & " " & B341 -> Lois Hennessy | F341: 19359 | G341: 1953
A342: =A341+1 -> 313 | B342: Hensley | C342: Joyce E | D342: =B342 & ", " & C342 -> Hensley, Joyce E | E342: =C342 & " " & B342 -> Joyce E Hensley | F342: 22885 | G342: 1965 | H342: Traffic Manager
A343: =A342+1 -> 314 | B343: Henson | C343: Anita | D343: =B343 & ", " & C343 -> Henson, Anita | E343: =C343 & " " & B343 -> Anita Henson | F343: 28688 | G343: 31093 | H343: Accts Receivable, Traffic
A344: =A343+1 -> 315 | B344: Hering | C344: Gene | D344: =B344 & ", " & C344 -> Hering, Gene | E344: =C344 & " " & B344 -> Gene Hering | F344: 29865 | G344: 29910
A345: =A344+1 -> 316 | B345: Hering | C345: Linda M | D345: =B345 & ", " & C345 -> Hering, Linda M | E345: =C345 & " " & B345 -> Linda M Hering | F345: February 1965 | G345: March 1974 | H345: Promotion Assistant | I345: Now Linda Chappelle; living in Santee, CA
A346: =A345+1 -> 317 | B346: Hershiser | C346: Tim | D346: =B346 & ", " & C346 -> Hershiser, Tim | E346: =C346 & " " & B346 -> Tim Hershiser | F346: 30438 | G346: 31416 | H346: Engineering
A347: =A346+1 -> 318 | B347: Hiatt | C347: Robert (Bob) | D347: =B347 & ", " & C347 -> Hiatt, Robert (Bob) | E347: =C347 & " " & B347 -> Robert (Bob) Hiatt | F347: 27347 | G347: 27521
A348: =A347+1 -> 319 | B348: Hicks | C348: Danny | D348: =B348 & ", " & C348 -> Hicks, Danny | E348: =C348 & " " & B348 -> Danny Hicks | F348: 31278 | G348: 32295 | H348: Production
A349: =A348+1 -> 320 | B349: Hieb | C349: Valerie | D349: =B349 & ", " & C349 -> Hieb, Valerie | E349: =C349 & " " & B349 -> Valerie Hieb | F349: 36977 | G349: 37274 | H349: News
A350: =A349+1 -> 321 | B350: Hill | C350: Gary | D350: =B350 & ", " & C350 -> Hill, Gary | E350: =C350 & " " & B350 -> Gary Hill | F350: 28688 | G350: 0/0/1992 | H350: Talent
A351: =A350+1 -> 322 | B351: Hill | C351: Rod | D351: =B351 & ", " & C351 -> Hill, Rod | E351: =C351 & " " & B351 -> Rod Hill | F351: 36269 | G351: 2003 | H351: Weathercaster | I351: Weathercaster for KATU (2)
A352: =A351+1 -> 323 | B352: Hodgdon | C352: Jillian | D352: =B352 & ", " & C352 -> Hodgdon, Jillian | E352: =C352 & " " & B352 -> Jillian Hodgdon | F352: 23986 | G352: 1965 | H352: Traffic Assistant
A353: =A352+1 -> 324 | B353: Holbrook | C353: Sharon | D353: =B353 & ", " & C353 -> Holbrook, Sharon | E353: =C353 & " " & B353 -> Sharon Holbrook | F353: 28688 | G353: 28795
A354: =A353+1 -> 325 | B354: Holland | C354: Sharon | D354: =B354 & ", " & C354 -> Holland, Sharon | E354: =C354 & " " & B354 -> Sharon Holland | F354: 33707 | G354: 34760 | H354: News Reporter
A355: =A354+1 -> 326 | B355: Holloway | C355: Donald | D355: =B355 & ", " & C355 -> Holloway, Donald | E355: =C355 & " " & B355 -> Donald Holloway | F355: 29103 | G355: 29103 | H355: Engineer
A356: =A355+1 -> 327 | B356: Holt | C356: Jeanette | D356: =B356 & ", " & C356 -> Holt, Jeanette | E356: =C356 & " " & B356 -> Jeanette Holt | F356: 27912 | G356: 37575 | H356: Production Dept., Business Dept., Sales Dept.
A357: =A356+1 -> 328 | B357: Hornor | C357: Sarah | D357: =B357 & ", " & C357 -> Hornor, Sarah | E357: =C357 & " " & B357 -> Sarah Hornor | F357: 27521 | G357: 27521
A358: =A357+1 -> 329 | B358: Howe | C358: Patty | D358: =B358 & ", " & C358 -> Howe, Patty | E358: =C358 & " " & B358 -> Patty Howe | F358: 35153 | G358: 35153 | H358: News
A359: =A358+1 -> 330 | B359: Hoyt | C359: Roxan | D359: =B359 & ", " & C359 -> Hoyt, Roxan | E359: =C359 & " " & B359 -> Roxan Hoyt | F359: SEE ROGERS, ROXAN
A360: =A358+1 -> 330 | B360: Hubert | C360: Stan | D360: =B360 & ", " & C360 -> Hubert, Stan | E360: =C360 & " " & B360 -> Stan Hubert | F360: 35153 | G360: 37236 | H360: Sales
A361: =A360+1 -> 331 | B361: Hudson | C361: Lucy | D361: =B361 & ", " & C361 -> Hudson, Lucy | E361: =C361 & " " & B361 -> Lucy Hudson | F361: 1953 | G361: 1953 | I361: married Don Martin
A362: =A361+1 -> 332 | B362: Huey | C362: Linda | D362: =B362 & ", " & C362 -> Huey, Linda | E362: =C362 & " " & B362 -> Linda Huey | F362: 36844 | G362: 37340 | H362: Sales
A363: =A362+1 -> 333 | B363: Hunt | C363: Lawrence E (Larry) | D363: =B363 & ", " & C363 -> Hunt, Lawrence E (Larry) | E363: =C363 & " " & B363 -> Lawrence E (Larry) Hunt | F363: 19260 | G363: 31563 | H363: Engineering | I363: Deceased
A364: =A363+1 -> 334 | B364: Hunzeker | C364: Melody | D364: =B364 & ", " & C364 -> Hunzeker, Melody | E364: =C364 & " " & B364 -> Melody Hunzeker | F364: SEE HALL, MELODY
A365: =A363+1 -> 334 | B365: Huserik | C365: Randy | D365: =B365 & ", " & C365 -> Huserik, Randy | E365: =C365 & " " & B365 -> Randy Huserik | F365: 32503 | G365: 33557 | H365: News
A366: =A365+1 -> 335 | B366: Hutonen | C366: Gladys V | D366: =B366 & ", " & C366 -> Hutonen, Gladys V | E366: =C366 & " " & B366 -> Gladys V Hutonen | F366: 21359 | G366: 1965 | H366: Sales Secretary
A367: =A366+1 -> 336 | B367: Hyatt | C367: Dan | D367: =B367 & ", " & C367 -> Hyatt, Dan | E367: =C367 & " " & B367 -> Dan Hyatt | F367: 35153 | G367: 35153 | H367: Production
A368: =A367+1 -> 337 | B368: Hyde | C368: Jim | D368: =B368 & ", " & C368 -> Hyde, Jim | E368: =C368 & " " & B368 -> Jim Hyde | F368: 33583 | G368: PRESENT | H368: News | I368: At KPTV (Meredith Corp.)
A369: =A368+1 -> 338 | B369: Inhofer | C369: Steve | D369: =B369 & ", " & C369 -> Inhofer, Steve | E369: =C369 & " " & B369 -> Steve Inhofer | F369: +/- 11/17/72 | G369: +/- 11/17/72
A370: =A369+1 -> 339 | B370: Irwin | C370: Janet M | D370: =B370 & ", " & C370 -> Irwin, Janet M | E370: =C370 & " " & B370 -> Janet M Irwin | F370: 23505 | G370: 1965 | H370: Accounts Payable
A371: =A370+1 -> 340 | B371: Ivers | C371: Phyllis | D371: =B371 & ", " & C371 -> Ivers, Phyllis | E371: =C371 & " " & B371 -> Phyllis Ivers | F371: 20363 | G371: 1960s | H371: Sales | I371: AKA Phyllis Conant
A372: =A371+1 -> 341 | B372: Iwakiri | C372: John | D372: =B372 & ", " & C372 -> Iwakiri, John | E372: =C372 & " " & B372 -> John Iwakiri | F372: 19359 | G372: 19359
A373: =A372+1 -> 342 | B373: Jacko | C373: Joseph | D373: =B373 & ", " & C373 -> Jacko, Joseph | E373: =C373 & " " & B373 -> Joseph Jacko | F373: 28688 | G373: 28688
B374: Jackson | C374: Patricia | D374: =B374 & ", " & C374 -> Jackson, Patricia | E374: =C374 & " " & B374 -> Patricia Jackson | F374: SEE SMITH, PATRICIA
A375: =A373+1 -> 343 | B375: Jackson | C375: Verda | D375: =B375 & ", " & C375 -> Jackson, Verda | E375: =C375 & " " & B375 -> Verda Jackson | F375: 28688 | G375: 28998 | I375: Deceased July 1992
A376: =A375+1 -> 344 | B376: Jacobs | C376: Sharon | D376: =B376 & ", " & C376 -> Jacobs, Sharon | E376: =C376 & " " & B376 -> Sharon Jacobs | F376: 28688 | G376: 28688
A377: =A376+1 -> 345 | B377: Janney | C377: Dave | D377: =B377 & ", " & C377 -> Janney, Dave | E377: =C377 & " " & B377 -> Dave Janney | F377: 28688 | G377: 28998 | H377: Engineer
A378: =A377+1 -> 346 | B378: Jefferson | C378: Elaine | D378: =B378 & ", " & C378 -> Jefferson, Elaine | E378: =C378 & " " & B378 -> Elaine Jefferson | F378: 34180 | G378: 34208 | H378: Business Dept
A379: =A378+1 -> 347 | B379: Jenkins | C379: David | D379: =B379 & ", " & C379 -> Jenkins, David | E379: =C379 & " " & B379 -> David Jenkins | F379: 32818 | G379: 34110 | H379: Traffic
A380: =A379+1 -> 348 | B380: Jensen | C380: Alyssa | D380: =B380 & ", " & C380 -> Jensen, Alyssa | E380: =C380 & " " & B380 -> Alyssa Jensen | F380: 8/18/97 | G380: PRESENT | H380: Traffic Log Coordinator | I380: AKA Alyssa Bausch; At KPTV (Meredith Corp.)
A381: =A380+1 -> 349 | B381: Jensen | C381: Lori | D381: =B381 & ", " & C381 -> Jensen, Lori | E381: =C381 & " " & B381 -> Lori Jensen | F381: October 1983 | G381: 37498 | H381: Traffic/Sales | I381: now Administrative Asst. for Staples regional sales office
A382: =A381+1 -> 350 | B382: Johns | C382: Linda | D382: =B382 & ", " & C382 -> Johns, Linda | E382: =C382 & " " & B382 -> Linda Johns | F382: 30826 | G382: PRESENT | H382: Public Affairs | I382: At KPTV (Meredith Corp.)
A383: =A382+1 -> 351 | B383: Johnson | C383: Harold | D383: =B383 & ", " & C383 -> Johnson, Harold | E383: =C383 & " " & B383 -> Harold Johnson | F383: +/- 11/17/72 | G383: +/- 11/17/72
A384: =A383+1 -> 352 | B384: Johnson | C384: Kelly | D384: =B384 & ", " & C384 -> Johnson, Kelly | E384: =C384 & " " & B384 -> Kelly Johnson | F384: 36496 | G384: 36496
A385: =A384+1 -> 353 | B385: Johnson | C385: Nancy | D385: =B385 & ", " & C385 -> Johnson, Nancy | E385: =C385 & " " & B385 -> Nancy Johnson | F385: 30245 | G385: 30477 | H385: Administrative Assistant
A386: =A385+1 -> 354 | B386: Johnson | C386: Stuart | D386: =B386 & ", " & C386 -> Johnson, Stuart | E386: =C386 & " " & B386 -> Stuart Johnson | F386: +/- 11/17/72 | G386: +/- 11/17/72
A387: =A386+1 -> 355 | B387: Johnson | C387: Tracy | D387: =B387 & ", " & C387 -> Johnson, Tracy | E387: =C387 & " " & B387 -> Tracy Johnson | F387: 36844 | G387: 37383 | H387: News
A388: =A387+1 -> 356 | B388: Johnstone | C388: Margaret | D388: =B388 & ", " & C388 -> Johnstone, Margaret | E388: =C388 & " " & B388 -> Margaret Johnstone | F388: 27347 | G388: 27521
A389: =A388+1 -> 357 | B389: Jolibois | C389: Therese | D389: =B389 & ", " & C389 -> Jolibois, Therese | E389: =C389 & " " & B389 -> Therese Jolibois | F389: 37422 | G389: 37422 | H389: Production
A390: =A389+1 -> 358 | B390: Jolly | C390: Andrea | D390: =B390 & ", " & C390 -> Jolly, Andrea | E390: =C390 & " " & B390 -> Andrea Jolly | F390: 31495 | G390: 32407 | H390: Sales
A391: =A390+1 -> 359 | B391: Jones | C391: Darla | D391: =B391 & ", " & C391 -> Jones, Darla | E391: =C391 & " " & B391 -> Darla Jones | F391: 28688 | G391: 28688
A392: =A391+1 -> 360 | B392: Jones | C392: Jimmy | D392: =B392 & ", " & C392 -> Jones, Jimmy | E392: =C392 & " " & B392 -> Jimmy Jones | F392: 22007 | G392: 30589 | H392: Sports Director, Anchor | I392: Deceased 4/26/1995
A393: =A392+1 -> 361 | B393: Jonic | C393: Florence | D393: =B393 & ", " & C393 -> Jonic, Florence | E393: =C393 & " " & B393 -> Florence Jonic | F393: 29865 | G393: 33984 | H393: News
A394: =A393+1 -> 362 | B394: Jordan | C394: Pam | D394: =B394 & ", " & C394 -> Jordan, Pam | E394: =C394 & " " & B394 -> Pam Jordan | F394: 30477 | G394: 31079 | H394: Talent/News
A395: =A394+1 -> 363 | B395: Jorgenson | C395: Theresa | D395: =B395 & ", " & C395 -> Jorgenson, Theresa | E395: =C395 & " " & B395 -> Theresa Jorgenson | F395: 28688 | G395: 28795
A396: =A395+1 -> 364 | B396: Jubb | C396: James M | D396: =B396 & ", " & C396 -> Jubb, James M | E396: =C396 & " " & B396 -> James M Jubb | F396: 23883 | G396: 1965 | H396: P/T Announcer
A397: =A396+1 -> 365 | B397: Jubitz | C397: Gail | D397: =B397 & ", " & C397 -> Jubitz, Gail | E397: =C397 & " " & B397 -> Gail Jubitz | F397: 27196 | G397: 28251 | H397: News Artist/Reporter
A398: =A397+1 -> 366 | B398: Junge | C398: Rod | D398: =B398 & ", " & C398 -> Junge, Rod | E398: =C398 & " " & B398 -> Rod Junge | F398: 1957 | G398: 1960 | H398: Engineering
A399: =A398+1 -> 367 | B399: Karas | C399: Lois | D399: =B399 & ", " & C399 -> Karas, Lois | E399: =C399 & " " & B399 -> Lois Karas | F399: 29561 | G399: 31079 | H399: Production | I399: AKA Lois Decker
A400: =A399+1 -> 368 | B400: Karlson | C400: Johan E "John" | D400: =B400 & ", " & C400 -> Karlson, Johan E "John" | E400: =C400 & " " & B400 -> Johan E "John" Karlson | F400: 1953 | G400: 1965 | H400: Carpenter - Building Maintenance
A401: =A400+1 -> 369 | B401: Katayama | C401: Anna | D401: =B401 & ", " & C401 -> Katayama, Anna | E401: =C401 & " " & B401 -> Anna Katayama | F401: 35153 | G401: 2002 | H401: Reporter, Weekend News Anchor
A402: =A401+1 -> 370 | B402: Kauffman | C402: Jill | D402: =B402 & ", " & C402 -> Kauffman, Jill | E402: =C402 & " " & B402 -> Jill Kauffman | F402: 30245 | G402: 31804
A403: =A402+1 -> 371 | B403: Kaufman | C403: Kasey | D403: =B403 & ", " & C403 -> Kaufman, Kasey | E403: =C403 & " " & B403 -> Kasey Kaufman | F403: 30272 | G403: 30477 | H403: News Anchor
A404: =A403+1 -> 372 | B404: Kellams | C404: Richard C "Dick" | D404: =B404 & ", " & C404 -> Kellams, Richard C "Dick" | E404: =C404 & " " & B404 -> Richard C "Dick" Kellams | F404: 20669 | G404: 31804 | H404: Engineering
A405: =A404+1 -> 373 | B405: Keller-Bernert | C405: Melinda | D405: =B405 & ", " & C405 -> Keller-Bernert, Melinda | E405: =C405 & " " & B405 -> Melinda Keller-Bernert | F405: 33724 | G405: 33984 | H405: News
A406: =A405+1 -> 374 | B406: Kendall | C406: John | D406: =B406 & ", " & C406 -> Kendall, John | E406: =C406 & " " & B406 -> John Kendall | F406: +/- 11/17/72 | G406: 27347
A407: =A406+1 -> 375 | B407: Kennedy | C407: Carol | D407: =B407 & ", " & C407 -> Kennedy, Carol | E407: =C407 & " " & B407 -> Carol Kennedy | F407: +/- 11/17/72 | G407: +/- 11/17/72
A408: =A407+1 -> 376 | B408: Kent | C408: Arlie | D408: =B408 & ", " & C408 -> Kent, Arlie | E408: =C408 & " " & B408 -> Arlie Kent | F408: 22022 | G408: 1965 | H408: Merchandising
A409: =A408+1 -> 377 | B409: Kern | C409: Mike | D409: =B409 & ", " & C409 -> Kern , Mike | E409: =C409 & " " & B409 -> Mike Kern | F409: 34619 | G409: 35244 | H409: Shipping/Production
A410: =A409+1 -> 378 | B410: Kern | C410: Tim | D410: =B410 & ", " & C410 -> Kern , Tim | E410: =C410 & " " & B410 -> Tim Kern | F410: 35153 | G410: 35153 | H410: Engineer
A411: =A410+1 -> 379 | B411: Kerns | C411: Susan | D411: =B411 & ", " & C411 -> Kerns, Susan | E411: =C411 & " " & B411 -> Susan Kerns | F411: 31782 | G411: 32904 | H411: Traffic
A412: =A411+1 -> 380 | B412: Kimmel | C412: Yvonne | D412: =B412 & ", " & C412 -> Kimmel, Yvonne | E412: =C412 & " " & B412 -> Yvonne Kimmel | F412: 36157 | G412: PRESENT | H412: Accounting | I412: At KPTV (Meredith Corp.)
A413: =A412+1 -> 381 | B413: King | C413: Steve | D413: =B413 & ", " & C413 -> King, Steve | E413: =C413 & " " & B413 -> Steve King | F413: 31079 | G413: 33984 | H413: Production
A414: =A413+1 -> 382 | B414: Kirk | C414: Pat | D414: =B414 & ", " & C414 -> Kirk, Pat | E414: =C414 & " " & B414 -> Pat Kirk | F414: 34057 | G414: 34957 | H414: News Anchor
A415: =A414+1 -> 383 | B415: Klawa | C415: Alice | D415: =B415 & ", " & C415 -> Klawa, Alice | E415: =C415 & " " & B415 -> Alice Klawa | F415: 1953 | G415: 1953
A416: =A415+1 -> 384 | B416: Knowlton | C416: Sallie | D416: =B416 & ", " & C416 -> Knowlton, Sallie | E416: =C416 & " " & B416 -> Sallie Knowlton | F416: 35153 | G416: 35153 | H416: Sales | I416: in Los Angeles
A417: =A416+1 -> 385 | B417: Koch | C417: Cathy | D417: =B417 & ", " & C417 -> Koch, Cathy | E417: =C417 & " " & B417 -> Cathy Koch | F417: +/- 11/17/72 | G417: +/- 11/17/72
A418: =A417+1 -> 386 | B418: Koontz | C418: Leah | D418: =B418 & ", " & C418 -> Koontz, Leah | E418: =C418 & " " & B418 -> Leah Koontz | F418: 33984 | G418: 33984 | H418: Sales | I418: AKA Leah Sellars
A419: =A418+1 -> 387 | B419: Kopta | C419: Scott | D419: =B419 & ", " & C419 -> Kopta, Scott | E419: =C419 & " " & B419 -> Scott Kopta | F419: 36844 | G419: 37383 | H419: News
A420: =A419+1 -> 388 | B420: Kosbau | C420: Wayne | D420: =B420 & ", " & C420 -> Kosbau, Wayne | E420: =C420 & " " & B420 -> Wayne Kosbau | F420: 37321 | G420: 37383
A421: =A420+1 -> 389 | B421: Kramer | C421: Bruce | D421: =B421 & ", " & C421 -> Kramer, Bruce | E421: =C421 & " " & B421 -> Bruce Kramer | F421: 31329 | G421: 31678 | H421: News
A422: =A421+1 -> 390 | B422: Krevanko | C422: Sue | D422: =B422 & ", " & C422 -> Krevanko, Sue | E422: =C422 & " " & B422 -> Sue Krevanko | F422: March 1986 | G422: August 2000 | H422: Traffic/Production | I422: AKA Sue Decker; Living in Tucson, AZ
A423: =A422+1 -> 391 | B423: Kubichek | C423: Deborah | D423: =B423 & ", " & C423 -> Kubichek, Deborah | E423: =C423 & " " & B423 -> Deborah Kubichek | F423: 34619 | G423: 34873 | H423: Receptionist
A424: =A423+1 -> 392 | B424: Kuernvik | C424: Andrew | D424: =B424 & ", " & C424 -> Kuernvik, Andrew | E424: =C424 & " " & B424 -> Andrew Kuernvik | F424: 19287 | G424: 1953
A425: =A424+1 -> 393 | B425: Labatte | C425: Letitia | D425: =B425 & ", " & C425 -> Labatte, Letitia | E425: =C425 & " " & B425 -> Letitia Labatte | F425: 23713 | G425: 23877 | H425: Temp
A426: =A425+1 -> 394 | B426: Lacher | C426: Gary | D426: =B426 & ", " & C426 -> Lacher, Gary | E426: =C426 & " " & B426 -> Gary Lacher | F426: 36844 | G426: Fall 2002 | H426: News
A427: =A426+1 -> 395 | B427: LaFranchise | C427: Charlie | D427: =B427 & ", " & C427 -> LaFranchise, Charlie | E427: =C427 & " " & B427 -> Charlie LaFranchise | F427: 1957 | G427: 1964 | H427: Host, "Uncle Charlie's Roundhouse" | I427: Deceased August 1991
B428: Lambert | C428: Beverley | D428: =B428 & ", " & C428 -> Lambert, Beverley | E428: =C428 & " " & B428 -> Beverley Lambert | F428: SEE WILLIAMS, BEVERLEY
A429: =A427+1 -> 396 | B429: Lambert | C429: William | D429: =B429 & ", " & C429 -> Lambert, William | E429: =C429 & " " & B429 -> William Lambert | F429: January 1962 | G429: January 1962 | H429: News Anchor
A430: =A429+1 -> 397 | B430: Lamont | C430: Sue | D430: =B430 & ", " & C430 -> Lamont, Sue | E430: =C430 & " " & B430 -> Sue Lamont | F430: 35153 | G430: 37264 | H430: Sales
A431: =A430+1 -> 398 | B431: Landeen | C431: Marty | D431: =B431 & ", " & C431 -> Landeen, Marty | E431: =C431 & " " & B431 -> Marty Landeen | F431: 31678 | G431: 33724 | H431: Production | I431: Deceased, plane crash Sept 1992
A432: =A431+1 -> 399 | B432: Landreth | C432: Faith | D432: =B432 & ", " & C432 -> Landreth, Faith | E432: =C432 & " " & B432 -> Faith Landreth | F432: +/- 11/17/72 | G432: +/- 11/17/72
A433: =A432+1 -> 400 | B433: Lang | C433: Therese | D433: =B433 & ", " & C433 -> Lang, Therese | E433: =C433 & " " & B433 -> Therese Lang | F433: 36844 | G433: 36977
A434: =A433+1 -> 401 | B434: Lange | C434: Tauna | D434: =B434 & ", " & C434 -> Lange, Tauna | E434: =C434 & " " & B434 -> Tauna Lange | F434: 37064 | G434: 37845 | H434: News | I434: Moved to Hawaii to be news director
A435: =A434+1 -> 402 | B435: Langford | C435: Dale | D435: =B435 & ", " & C435 -> Langford, Dale | E435: =C435 & " " & B435 -> Dale Langford | F435: 27347 | G435: 27347
A436: =A435+1 -> 403 | B436: Larson | C436: Barbara | D436: =B436 & ", " & C436 -> Larson, Barbara | E436: =C436 & " " & B436 -> Barbara Larson | F436: +/- 11/17/72 | G436: +/- 11/17/72
A437: =A436+1 -> 404 | B437: Larson | C437: Darlene | D437: =B437 & ", " & C437 -> Larson, Darlene | E437: =C437 & " " & B437 -> Darlene Larson | F437: +/- 11/17/72 | G437: +/- 11/17/72
A438: =A437+1 -> 405 | B438: Larson | C438: Lars | D438: =B438 & ", " & C438 -> Larson, Lars | E438: =C438 & " " & B438 -> Lars Larson | F438: 31079 | G438: 36124 | H438: Reporter, Weekend News Anchor, Documentary Producer, Anchor and Reporter - "Northwest Reports," Anchor/Managing Editor - Weeknight News | I438: Currently host of "The Lars Larson Show," weekdays 11am-2pm, KXL 750am; also nationally syndicated show on Westwood One Radio Network.
A439: =A438+1 -> 406 | B439: Larson | C439: Ray | D439: =B439 & ", " & C439 -> Larson, Ray | E439: =C439 & " " & B439 -> Ray Larson | F439: 1960 | G439: 1960 | H439: Engineering | I439: moved to KATU; died about 1971
A440: =A439+1 -> 407 | B440: LaRue | C440: John | D440: =B440 & ", " & C440 -> LaRue, John | E440: =C440 & " " & B440 -> John LaRue | F440: 28529 | G440: PRESENT | H440: Production | I440: At KPTV (Meredith Corp.)
B441: Laubach | C441: Julie | D441: =B441 & ", " & C441 -> Laubach, Julie | E441: =C441 & " " & B441 -> Julie Laubach | F441: SEE AMATO, JULIE
A442: =A440+1 -> 408 | B442: Lawrence | C442: John | D442: =B442 & ", " & C442 -> Lawrence, John | E442: =C442 & " " & B442 -> John Lawrence | F442: 35153 | G442: 35153 | H442: Sales | I442: Now at KOIN
A443: =A442+1 -> 409 | B443: Leary | C443: Colleen | D443: =B443 & ", " & C443 -> Leary, Colleen | E443: =C443 & " " & B443 -> Colleen Leary | F443: 29561 | G443: 31678 | H443: Traffic | I443: in Texas (Houston)
A444: =A443+1 -> 410 | B444: Leary | C444: Kathy | D444: =B444 & ", " & C444 -> Leary, Kathy | E444: =C444 & " " & B444 -> Kathy Leary | F444: 28795 | G444: 29910
A445: =A444+1 -> 411 | B445: Leben | C445: John | D445: =B445 & ", " & C445 -> Leben, John | E445: =C445 & " " & B445 -> John Leben | F445: +/- 11/17/72 | G445: +/- 11/17/72
A446: =A445+1 -> 412 | B446: Legen | C446: John | D446: =B446 & ", " & C446 -> Legen, John | E446: =C446 & " " & B446 -> John Legen | F446: 27347 | G446: 27347
A447: =A446+1 -> 413 | B447: Legore | C447: Karen | D447: =B447 & ", " & C447 -> Legore, Karen | E447: =C447 & " " & B447 -> Karen Legore | F447: 27347 | G447: 27521
A448: =A447+1 -> 414 | B448: Leighton | C448: Michael | D448: =B448 & ", " & C448 -> Leighton, Michael | E448: =C448 & " " & B448 -> Michael Leighton | F448: 28688 | G448: 29593
A449: =A448+1 -> 415 | B449: Lesser | C449: Harold E "Hal" | D449: =B449 & ", " & C449 -> Lesser, Harold E "Hal" | E449: =C449 & " " & B449 -> Harold E "Hal" Lesser | F449: 3/29/61 | G449: January 1962 | H449: News Photographer
A450: =A449+1 -> 416 | B450: Levinson | C450: Martin | D450: =B450 & ", " & C450 -> Levinson, Martin | E450: =C450 & " " & B450 -> Martin Levinson | F450: 1953 | G450: 1953
A451: =A450+1 -> 417 | B451: Lewetag | C451: Ken | D451: =B451 & ", " & C451 -> Lewetag, Ken | E451: =C451 & " " & B451 -> Ken Lewetag | F451: 31804 | G451: 32063 | H451: Engineering
A452: =A451+1 -> 418 | B452: Lewis | C452: Arlene | D452: =B452 & ", " & C452 -> Lewis, Arlene | E452: =C452 & " " & B452 -> Arlene Lewis | F452: +/- 11/17/72 | G452: 27521
A453: =A452+1 -> 419 | B453: Lewis | C453: Diane | D453: =B453 & ", " & C453 -> Lewis, Diane | E453: =C453 & " " & B453 -> Diane Lewis | F453: 1990 | G453: 1990
A454: =A453+1 -> 420 | B454: Lewis | C454: Elliott | D454: =B454 & ", " & C454 -> Lewis, Elliott | E454: =C454 & " " & B454 -> Elliott Lewis | F454: 33043 | G454: 33402 | H454: News Reporter
A455: =A454+1 -> 421 | B455: Lewis | C455: John | D455: =B455 & ", " & C455 -> Lewis, John | E455: =C455 & " " & B455 -> John Lewis | F455: 1950s | G455: 1960s | H455: Weatherman, "News Central"
A456: =A455+1 -> 422 | B456: Lienhard | C456: John R (Bob) | D456: =B456 & ", " & C456 -> Lienhard, John R (Bob) | E456: =C456 & " " & B456 -> John R (Bob) Lienhard | F456: 22626 | G456: 31079 | H456: Engineer | I456: Deceased
A457: =A456+1 -> 423 | B457: Lincoln | C457: Roger H | D457: =B457 & ", " & C457 -> Lincoln, Roger H | E457: =C457 & " " & B457 -> Roger H Lincoln | F457: 23998 | G457: 1965 | H457: Receiving Clerk
A458: =A457+1 -> 424 | B458: Linker | C458: Susan | D458: =B458 & ", " & C458 -> Linker, Susan | E458: =C458 & " " & B458 -> Susan Linker | F458: 29561 | G458: 29910
A459: =A458+1 -> 425 | B459: Livingston | C459: Bill | D459: =B459 & ", " & C459 -> Livingston, Bill | E459: =C459 & " " & B459 -> Bill Livingston | F459: 32063 | G459: PRESENT | H459: News
A460: =A459+1 -> 426 | B460: Llewellyn | C460: Susan A | D460: =B460 & ", " & C460 -> Llewellyn, Susan A | E460: =C460 & " " & B460 -> Susan A Llewellyn | F460: 23651 | G460: 1967 | H460: Mailroom, Local Sales Secretary | I460: Now Susan King. Living in Astoria.
A461: =A460+1 -> 427 | B461: Lockard | C461: Murray | D461: =B461 & ", " & C461 -> Lockard, Murray | E461: =C461 & " " & B461 -> Murray Lockard | F461: 1957 | G461: 1957 | H461: Host, "Video Game" | I461: Deceased, August 1990
A462: =A461+1 -> 428 | B462: Lopez | C462: Kai | D462: =B462 & ", " & C462 -> Lopez, Kai | E462: =C462 & " " & B462 -> Kai Lopez | F462: 28688 | G462: 28998 | H462: Booth Announcer
A463: =A462+1 -> 429 | B463: Lovell | C463: Cindy | D463: =B463 & ", " & C463 -> Lovell, Cindy | E463: =C463 & " " & B463 -> Cindy Lovell | F463: 32931 | G463: 33402
A464: =A463+1 -> 430 | B464: Lowe | C464: Rob | D464: =B464 & ", " & C464 -> Lowe, Rob | E464: =C464 & " " & B464 -> Rob Lowe | F464: 28688 | G464: 28688 | H464: Engineer | I464: moved to KATU about 1984 as Maintenance Engineer
A465: =A464+1 -> 431 | B465: Luce | C465: Theresa | D465: =B465 & ", " & C465 -> Luce, Theresa | E465: =C465 & " " & B465 -> Theresa Luce | F465: 33043 | G465: 35153 | H465: News Reporter
A466: =A465+1 -> 432 | B466: Ludlow | C466: Kurt | D466: =B466 & ", " & C466 -> Ludlow, Kurt | E466: =C466 & " " & B466 -> Kurt Ludlow | F466: April 1999 | G466: 37557 | H466: Weeknight News Anchor, Investigative Reporter | I466: returned to Columbus, OH, weekend anchor for WBNS-TV
A467: =A466+1 -> 433 | B467: Luisi | C467: Vicki | D467: =B467 & ", " & C467 -> Luisi, Vicki | E467: =C467 & " " & B467 -> Vicki Luisi | F467: 35153 | G467: 35153 | H467: Sales
A468: =A467+1 -> 434 | B468: LuLay | C468: Jennifer | D468: =B468 & ", " & C468 -> LuLay, Jennifer | E468: =C468 & " " & B468 -> Jennifer LuLay | F468: 29561 | G468: 30477 | H468: Production
A469: =A468+1 -> 435 | B469: Lupton | C469: Linda | D469: =B469 & ", " & C469 -> Lupton, Linda | E469: =C469 & " " & B469 -> Linda Lupton | F469: +/- 11/17/72 | G469: +/- 11/17/72
A470: =A469+1 -> 436 | B470: Lynch | C470: Alex | D470: =B470 & ", " & C470 -> Lynch, Alex | E470: =C470 & " " & B470 -> Alex Lynch | F470: 1996 | G470: 2001 | H470: News Photographer/Editor
A471: =A470+1 -> 437 | B471: MacGowan | C471: Bruce | D471: =B471 & ", " & C471 -> MacGowan, Bruce | E471: =C471 & " " & B471 -> Bruce MacGowan | F471: 28998 | G471: 29103
A472: =A471+1 -> 438 | B472: MacInnis | C472: Alma Jean | D472: =B472 & ", " & C472 -> MacInnis, Alma Jean | E472: =C472 & " " & B472 -> Alma Jean MacInnis | F472: 23732 | G472: 1965 | H472: P/T PBX
A473: =A472+1 -> 439 | B473: Mack | C473: Austin R | D473: =B473 & ", " & C473 -> Mack, Austin R | E473: =C473 & " " & B473 -> Austin R Mack | F473: 23901 | G473: 24002 | H473: Receiving Clerk
A474: =A473+1 -> 440 | B474: Mack | C474: Mark | D474: =B474 & ", " & C474 -> Mack, Mark | E474: =C474 & " " & B474 -> Mark Mack | F474: 29561 | G474: Summer 2002 | H474: Engineering
B475: MacTarnahan | C475: Jean | D475: =B475 & ", " & C475 -> MacTarnahan, Jean | E475: =C475 & " " & B475 -> Jean MacTarnahan | F475: SEE MARTELL, JEAN
A476: =A474+1 -> 441 | B476: Malmsten | C476: Karen | D476: =B476 & ", " & C476 -> Malmsten, Karen | E476: =C476 & " " & B476 -> Karen Malmsten | F476: 27347 | G476: 31966 | H476: Promotion/Sales | I476: AKA Karen Emmerling
A477: =A476+1 -> 442 | B477: Mansker | C477: Steve | D477: =B477 & ", " & C477 -> Mansker, Steve | E477: =C477 & " " & B477 -> Steve Mansker | F477: 35275 | G477: 37383 | H477: News
A478: =A477+1 -> 443 | B478: Marcus | C478: Erlene | D478: =B478 & ", " & C478 -> Marcus, Erlene | E478: =C478 & " " & B478 -> Erlene Marcus | F478: 28688 | G478: 28795 | H478: Engineer
A479: =A478+1 -> 444 | B479: Margolis | C479: Michelle | D479: =B479 & ", " & C479 -> Margolis, Michelle | E479: =C479 & " " & B479 -> Michelle Margolis | H479: News
A480: =A479+1 -> 445 | B480: Marks | C480: Kelly | D480: =B480 & ", " & C480 -> Marks, Kelly | E480: =C480 & " " & B480 -> Kelly Marks | F480: 32687 | G480: 32687
A481: =A480+1 -> 446 | B481: Marlowe | C481: Lucy | D481: =B481 & ", " & C481 -> Marlowe, Lucy | E481: =C481 & " " & B481 -> Lucy Marlowe | F481: 1953 | G481: 1953
A482: =A481+1 -> 447 | B482: Marr | C482: Jim | D482: =B482 & ", " & C482 -> Marr, Jim | E482: =C482 & " " & B482 -> Jim Marr | F482: 32931 | G482: 35153 | H482: News
A483: =A482+1 -> 448 | B483: Marshall | C483: Jerry | D483: =B483 & ", " & C483 -> Marshall, Jerry | E483: =C483 & " " & B483 -> Jerry Marshall | F483: 29561 | G483: 30477 | H483: Shipping
A484: =A483+1 -> 449 | B484: Martell | C484: Jean | D484: =B484 & ", " & C484 -> Martell, Jean | E484: =C484 & " " & B484 -> Jean Martell | F484: July 1974 | G484: June 1990 | H484: Promotion Assistant, Sales Assistant, Sales Assistant Supervisor | I484: AKA Jean MacTarnahan
A485: =A484+1 -> 450 | B485: Martin | C485: Connie D | D485: =B485 & ", " & C485 -> Martin, Connie D | E485: =C485 & " " & B485 -> Connie D Martin | F485: 22096 | G485: 34849 | H485: Sales/General Sales Manager
A486: =A485+1 -> 451 | B486: Martin | C486: Don | D486: =B486 & ", " & C486 -> Martin, Don | E486: =C486 & " " & B486 -> Don Martin | F486: 19287 | G486: 1964 | H486: Engineering | I486: moved to KATU; died about 1969; married Lucy Hudson
A487: =A486+1 -> 452 | B487: Martin | C487: Frank | D487: =B487 & ", " & C487 -> Martin, Frank | E487: =C487 & " " & B487 -> Frank Martin | F487: 29561 | G487: 31329 | H487: Sales
A488: =A487+1 -> 453 | B488: Martinez | C488: Tony | D488: =B488 & ", " & C488 -> Martinez, Tony | E488: =C488 & " " & B488 -> Tony Martinez | F488: 35275 | G488: PRESENT | H488: Traffic Reporter for Good Day Oregon | I488: At KPTV (Meredith Corp.)
A489: =A488+1 -> 454 | B489: Mason | C489: Don | D489: =B489 & ", " & C489 -> Mason, Don | E489: =C489 & " " & B489 -> Don Mason | F489: 1953 | G489: 1953
A490: =A489+1 -> 455 | B490: Mason | C490: Gwen | D490: =B490 & ", " & C490 -> Mason, Gwen | E490: =C490 & " " & B490 -> Gwen Mason | F490: 27347 | G490: 27521
A491: =A490+1 -> 456 | B491: Mason | C491: Terry | D491: =B491 & ", " & C491 -> Mason, Terry | E491: =C491 & " " & B491 -> Terry Mason
A492: =A491+1 -> 457 | B492: Massey | C492: James | D492: =B492 & ", " & C492 -> Massey, James | E492: =C492 & " " & B492 -> James Massey | F492: 27521 | G492: 27521
A493: =A492+1 -> 458 | B493: Matsukawa | C493: Lori | D493: =B493 & ", " & C493 -> Matsukawa, Lori | E493: =C493 & " " & B493 -> Lori Matsukawa | F493: 29103 | G493: 29103 | H493: News Reporter | I493: Working for KING, Seattle
A494: =A493+1 -> 459 | B494: Maus | C494: Kimberly | D494: =B494 & ", " & C494 -> Maus, Kimberly | E494: =C494 & " " & B494 -> Kimberly Maus | F494: 35926 | G494: PRESENT | H494: Good Day Oregon Anchor | I494: At KPTV (Meredith Corp.)
A495: =A494+1 -> 460 | B495: Mayer | C495: Herbert | D495: =B495 & ", " & C495 -> Mayer, Herbert | E495: =C495 & " " & B495 -> Herbert Mayer | F495: 19287 | G495: 19287 | I495: Station Founder
A496: =A495+1 -> 461 | B496: McAllister | C496: Bill | D496: =B496 & ", " & C496 -> McAllister, Bill | E496: =C496 & " " & B496 -> Bill McAllister | F496: 19287 | G496: 1953
A497: =A496+1 -> 462 | B497: McCall | C497: Tom | D497: =B497 & ", " & C497 -> McCall, Tom | E497: =C497 & " " & B497 -> Tom McCall | F497: 1956 | G497: 1956 | H497: News Commentator | I497: Later Governor of Oregon
B498: McClung | C498: Marta | D498: =B498 & ", " & C498 -> McClung, Marta | E498: =C498 & " " & B498 -> Marta McClung | F498: SEE HAUSOTTER, MARTA
A499: =A497+1 -> 463 | B499: McCormick | C499: Patrick C | D499: =B499 & ", " & C499 -> McCormick, Patrick C | E499: =C499 & " " & B499 -> Patrick C McCormick | F499: 23903 | G499: 1965 | H499: Floorman
A500: =A499+1 -> 464 | B500: McDaniel | C500: Pamela | D500: =B500 & ", " & C500 -> McDaniel, Pamela | E500: =C500 & " " & B500 -> Pamela McDaniel | F500: 28998 | G500: 29103
A501: =A500+1 -> 465 | B501: McDonald | C501: Alan | D501: =B501 & ", " & C501 -> McDonald, Alan | E501: =C501 & " " & B501 -> Alan McDonald | F501: +/- 11/17/72 | G501: Summer 2002 | H501: Engineering
A502: =A501+1 -> 466 | B502: McDonald | C502: Alice | D502: =B502 & ", " & C502 -> McDonald, Alice | E502: =C502 & " " & B502 -> Alice McDonald | F502: 31079 | G502: 31079 | H502: Business Dept
B503: McDonald | C503: Rebecca | D503: =B503 & ", " & C503 -> McDonald, Rebecca | E503: =C503 & " " & B503 -> Rebecca McDonald | F503: SEE WININGER, BECKY
A504: =A502+1 -> 467 | B504: McGrew | C504: Ralph "Skeets" | D504: =B504 & ", " & C504 -> McGrew, Ralph "Skeets" | E504: =C504 & " " & B504 -> Ralph "Skeets" McGrew | F504: 1953 | G504: 1956
A505: =A504+1 -> 468 | B505: McIntire | C505: William | D505: =B505 & ", " & C505 -> McIntire, William | E505: =C505 & " " & B505 -> William McIntire | F505: 31866 | G505: 32073 | H505: Engineering
A506: =A505+1 -> 469 | B506: McLaughlin | C506: Albert R (Al) | D506: =B506 & ", " & C506 -> McLaughlin, Albert R (Al) | E506: =C506 & " " & B506 -> Albert R (Al) McLaughlin | F506: 1953 | G506: 1965
A507: =A506+1 -> 470 | B507: McLeod | C507: Betty | D507: =B507 & ", " & C507 -> McLeod, Betty | E507: =C507 & " " & B507 -> Betty McLeod | F507: 30245 | G507: 33724 | H507: Accounting
A508: =A507+1 -> 471 | B508: McRae | C508: Dianne | D508: =B508 & ", " & C508 -> McRae, Dianne | E508: =C508 & " " & B508 -> Dianne McRae | F508: 12/1970 | G508: 37236 | H508: Accounting; Various
A509: =A508+1 -> 472 | B509: McWilliams | C509: Dan | D509: =B509 & ", " & C509 -> McWilliams, Dan | E509: =C509 & " " & B509 -> Dan McWilliams | F509: 26620 | G509: 26620
A510: =A509+1 -> 473 | B510: Meck | C510: Molly | D510: =B510 & ", " & C510 -> Meck, Molly | E510: =C510 & " " & B510 -> Molly Meck | F510: 32931 | G510: 32931
A511: =A510+1 -> 474 | B511: Mecklem | C511: Carrie | D511: =B511 & ", " & C511 -> Mecklem, Carrie | E511: =C511 & " " & B511 -> Carrie Mecklem | F511: 2000 | G511: 2002 | H511: Engineering/Camera | I511: Married to Aaron Wanstall
A512: =A511+1 -> 475 | B512: Mercado | C512: Anthony | D512: =B512 & ", " & C512 -> Mercado, Anthony | E512: =C512 & " " & B512 -> Anthony Mercado | F512: 35153 | G512: 35153 | H512: Floor Director
A513: =A512+1 -> 476 | B513: Messenger | C513: Dick | D513: =B513 & ", " & C513 -> Messenger, Dick | E513: =C513 & " " & B513 -> Dick Messenger | F513: 35153 | G513: 37383 | H513: Sales
B514: Meyers | C514: Debbie | D514: =B514 & ", " & C514 -> Meyers, Debbie | E514: =C514 & " " & B514 -> Debbie Meyers | F514: SEE FOSTER, DEBBIE
A515: =A513+1 -> 477 | B515: Meyers | C515: Molly | D515: =B515 & ", " & C515 -> Meyers, Molly | E515: =C515 & " " & B515 -> Molly Meyers | F515: May 2000 | G515: June 2002 | H515: Salesperson | I515: in Houston, Texas
A516: =A515+1 -> 478 | B516: Meyers | C516: Mark | D516: =B516 & ", " & C516 -> Meyers, Mark | E516: =C516 & " " & B516 -> Mark Meyers | F516: 31329 | G516: 33402 | H516: Production
A517: =A516+1 -> 479 | B517: Mikkelsen | C517: Drew | D517: =B517 & ", " & C517 -> Mikkelsen, Drew | E517: =C517 & " " & B517 -> Drew Mikkelsen | F517: 1999 | G517: 37193 | H517: News
A518: =A517+1 -> 480 | B518: Miller | C518: Craig | D518: =B518 & ", " & C518 -> Miller, Craig | E518: =C518 & " " & B518 -> Craig Miller | F518: 27347 | G518: 37680 | H518: Promotion | I518: Now with Portland Trailblazers
A519: =A518+1 -> 481 | B519: Miller | C519: Jan | D519: =B519 & ", " & C519 -> Miller, Jan | E519: =C519 & " " & B519 -> Jan Miller | F519: +/- 11/17/72 | G519: +/- 11/17/72
A520: =A519+1 -> 482 | B520: Miller | C520: Karen | D520: =B520 & ", " & C520 -> Miller, Karen | E520: =C520 & " " & B520 -> Karen Miller | F520: +/- 11/17/72 | G520: +/- 11/17/72
A521: =A520+1 -> 483 | B521: Miller | C521: Renee | D521: =B521 & ", " & C521 -> Miller, Renee | E521: =C521 & " " & B521 -> Renee Miller | F521: 28998 | G521: 29103 | H521: News | I521: now Renee Klosterman
A522: =A521+1 -> 484 | B522: Miller | C522: Susan | D522: =B522 & ", " & C522 -> Miller, Susan | E522: =C522 & " " & B522 -> Susan Miller | F522: 27347 | G522: 28998
A523: =A522+1 -> 485 | B523: Mitchell | C523: Daryl | D523: =B523 & ", " & C523 -> Mitchell, Daryl | E523: =C523 & " " & B523 -> Daryl Mitchell | F523: 35282 | G523: PRESENT | H523: News Photographer | I523: At KPTV (Meredith Corp.)
A524: =A523+1 -> 486 | B524: Mitchell | C524: Robert | D524: =B524 & ", " & C524 -> Mitchell, Robert | E524: =C524 & " " & B524 -> Robert Mitchell | F524: 29561 | G524: 30477 | H524: Engineer
A525: =A524+1 -> 487 | B525: Mitchell | C525: Sharon | D525: =B525 & ", " & C525 -> Mitchell, Sharon | E525: =C525 & " " & B525 -> Sharon Mitchell | F525: 28795 | G525: 29593 | H525: Booth Announcer
A526: =A525+1 -> 488 | B526: Monroe | C526: Marilyn | D526: =B526 & ", " & C526 -> Monroe, Marilyn | E526: =C526 & " " & B526 -> Marilyn Monroe | F526: 1990 | G526: 1990
A527: =A526+1 -> 489 | B527: Moore | C527: Frederick M | D527: =B527 & ", " & C527 -> Moore, Frederick M | E527: =C527 & " " & B527 -> Frederick M Moore | F527: 24087 | G527: 1965 | H527: P/T Announcer
A528: =A527+1 -> 490 | B528: Moore | C528: Melissa | D528: =B528 & ", " & C528 -> Moore, Melissa | E528: =C528 & " " & B528 -> Melissa Moore | F528: 35153 | G528: 35153 | H528: News
B529: Moreland | C529: Kristi | D529: =B529 & ", " & C529 -> Moreland, Kristi | E529: =C529 & " " & B529 -> Kristi Moreland | F529: SEE SHELDON, KRISTI
A530: =A528+1 -> 491 | B530: Morningstar | C530: Don | D530: =B530 & ", " & C530 -> Morningstar, Don | E530: =C530 & " " & B530 -> Don Morningstar | F530: 31516 | G530: PRESENT | H530: Production | I530: At KPTV (Meredith Corp.)
A531: =A530+1 -> 492 | B531: Morris | C531: Elizabeth V (Liz) | D531: =B531 & ", " & C531 -> Morris, Elizabeth V (Liz) | E531: =C531 & " " & B531 -> Elizabeth V (Liz) Morris | F531: 21352 | G531: +/- 11/17/72 | H531: Promotion Manager
A532: =A531+1 -> 493 | B532: Morris | C532: Lila L | D532: =B532 & ", " & C532 -> Morris, Lila L | E532: =C532 & " " & B532 -> Lila L Morris | F532: (2) 2/27/1964 | G532: 31495 | H532: Executive Secretary, Sales
A533: =A532+1 -> 494 | B533: Mortensen | C533: Kim | D533: =B533 & ", " & C533 -> Mortensen, Kim | E533: =C533 & " " & B533 -> Kim Mortensen | F533: 36977 | G533: 37383 | H533: Accounting
A534: =A533+1 -> 495 | B534: Mortimore | C534: Dan | D534: =B534 & ", " & C534 -> Mortimore, Dan | E534: =C534 & " " & B534 -> Dan Mortimore | F534: 27347 | G534: 27521
A535: =A534+1 -> 496 | B535: Mosebar | C535: Julie | D535: =B535 & ", " & C535 -> Mosebar, Julie | E535: =C535 & " " & B535 -> Julie Mosebar | F535: 35289 | G535: PRESENT | H535: Production | I535: At KPTV (Meredith Corp.)
A536: =A535+1 -> 497 | B536: Moss | C536: Patricia (Trish) | D536: =B536 & ", " & C536 -> Moss, Patricia (Trish) | E536: =C536 & " " & B536 -> Patricia (Trish) Moss | F536: +/- 11/17/72 | G536: 30477 | H536: Weathercaster | I536: AKA Patricia Soika
A537: =A536+1 -> 498 | B537: Moye | C537: Nicole | D537: =B537 & ", " & C537 -> Moye, Nicole | E537: =C537 & " " & B537 -> Nicole Moye | F537: 36844 | G537: 37383 | H537: News
A538: =A537+1 -> 499 | B538: Mueller | C538: Art | D538: =B538 & ", " & C538 -> Mueller, Art | E538: =C538 & " " & B538 -> Art Mueller | F538: 1953 | G538: 1953
A539: =A538+1 -> 500 | B539: Muerth | C539: Hella | D539: =B539 & ", " & C539 -> Muerth, Hella | E539: =C539 & " " & B539 -> Hella Muerth | F539: +/- 11/17/72 | G539: +/- 11/17/72
A540: =A539+1 -> 501 | B540: Mulkey | C540: Jay | D540: =B540 & ", " & C540 -> Mulkey, Jay | E540: =C540 & " " & B540 -> Jay Mulkey | F540: 33724 | G540: 35153 | H540: News
A541: =A540+1 -> 502 | B541: Murphy | C541: Chris | D541: =B541 & ", " & C541 -> Murphy, Chris | E541: =C541 & " " & B541 -> Chris Murphy | F541: 36844 | G541: 37383 | H541: News | I541: in San Francisco, CA
A542: =A541+1 -> 503 | B542: Murray | C542: Linda | D542: =B542 & ", " & C542 -> Murray, Linda | E542: =C542 & " " & B542 -> Linda Murray | F542: 28998 | G542: 36844 | H542: Accounting
A543: =A542+1 -> 504 | B543: Myers | C543: Tom | D543: =B543 & ", " & C543 -> Myers, Tom | E543: =C543 & " " & B543 -> Tom Myers | F543: 19287 | G543: 1956
A544: =A543+1 -> 505 | B544: Neal | C544: Debra | D544: =B544 & ", " & C544 -> Neal, Debra | E544: =C544 & " " & B544 -> Debra Neal | F544: 31804 | G544: 35153 | H544: Accounting
A545: =A544+1 -> 506 | B545: Neale | C545: Brian | D545: =B545 & ", " & C545 -> Neale, Brian | E545: =C545 & " " & B545 -> Brian Neale | F545: 36496 | G545: 36496
A546: =A545+1 -> 507 | B546: Neerman | C546: Mark | D546: =B546 & ", " & C546 -> Neerman, Mark | E546: =C546 & " " & B546 -> Mark Neerman | F546: 36844 | G546: 36844 | H546: News
A547: =A546+1 -> 508 | B547: Neet | C547: Larry | D547: =B547 & ", " & C547 -> Neet, Larry | E547: =C547 & " " & B547 -> Larry Neet | F547: +/- 11/17/72 | G547: 37274 | H547: Production
A548: =A547+1 -> 509 | B548: Neiworth | C548: Trish | D548: =B548 & ", " & C548 -> Neiworth, Trish | E548: =C548 & " " & B548 -> Trish Neiworth | F548: 31495 | G548: 32931 | H548: News
A549: =A548+1 -> 510 | B549: Nelson | C549: Bob | D549: =B549 & ", " & C549 -> Nelson, Bob | E549: =C549 & " " & B549 -> Bob Nelson | F549: 31966 | G549: 33984 | H549: Chief Enginner
A550: =A549+1 -> 511 | B550: Nelson | C550: Larry | D550: =B550 & ", " & C550 -> Nelson, Larry | E550: =C550 & " " & B550 -> Larry Nelson | F550: 31079 | G550: 31329 | H550: Sales
A551: =A550+1 -> 512 | B551: Nelson | C551: Patricia A | D551: =B551 & ", " & C551 -> Nelson, Patricia A | E551: =C551 & " " & B551 -> Patricia A Nelson | F551: 23445 | G551: 1965 | H551: National Billing Clerk
A552: =A551+1 -> 513 | B552: Ness | C552: Berneil M | D552: =B552 & ", " & C552 -> Ness, Berneil M | E552: =C552 & " " & B552 -> Berneil M Ness | F552: 23686 | G552: 24015 | H552: P/T Engineer
A553: =A552+1 -> 514 | B553: Ness | C553: Bill | D553: =B553 & ", " & C553 -> Ness, Bill | E553: =C553 & " " & B553 -> Bill Ness | F553: 29103 | G553: 29103 | H553: Engineer
A554: =A553+1 -> 515 | B554: Newman | C554: Jim | D554: =B554 & ", " & C554 -> Newman, Jim | E554: =C554 & " " & B554 -> Jim Newman | F554: +/- 11/17/72 | G554: +/- 11/17/72 | H554: News Reporter/Anchor
A555: =A554+1 -> 516 | B555: Nickerson | C555: Ron | D555: =B555 & ", " & C555 -> Nickerson, Ron | E555: =C555 & " " & B555 -> Ron Nickerson | F555: 29103 | G555: 29103
A556: =A555+1 -> 517 | B556: Nies | C556: Brian | D556: =B556 & ", " & C556 -> Nies, Brian | E556: =C556 & " " & B556 -> Brian Nies | F556: 29561 | G556: 32063 | H556: Engineer
A557: =A556+1 -> 518 | B557: Nolan | C557: Chris | D557: =B557 & ", " & C557 -> Nolan, Chris | E557: =C557 & " " & B557 -> Chris Nolan | F557: 33984 | G557: 35153 | H557: News
B558: Nolin | C558: Rosalie | D558: =B558 & ", " & C558 -> Nolin, Rosalie | E558: =C558 & " " & B558 -> Rosalie Nolin | F558: SEE DRAKE, ROSALIE
A559: =A557+1 -> 519 | B559: Norburn | C559: Pamela | D559: =B559 & ", " & C559 -> Norburn, Pamela | E559: =C559 & " " & B559 -> Pamela Norburn | F559: 33043 | G559: 33984 | H559: Traffic | I559: AKA Pamela Carsten
A560: =A559+1 -> 520 | B560: Norman | C560: Bill | D560: =B560 & ", " & C560 -> Norman, Bill | E560: =C560 & " " & B560 -> Bill Norman | F560: 19359 | G560: 19359
A561: =A560+1 -> 521 | B561: Norman | C561: Richard "Dick" | D561: =B561 & ", " & C561 -> Norman, Richard "Dick" | E561: =C561 & " " & B561 -> Richard "Dick" Norman | F561: 19287 | G561: 1953
A562: =A561+1 -> 522 | B562: O'Brien | C562: Michael | D562: =B562 & ", " & C562 -> O'Brien, Michael | E562: =C562 & " " & B562 -> Michael O'Brien | F562: 29865 | G562: 35153 | H562: Talent
A563: =A562+1 -> 523 | B563: O'Brien | C563: Walter W | D563: =B563 & ", " & C563 -> O'Brien, Walter W | E563: =C563 & " " & B563 -> Walter W O'Brien | F563: 22451 | G563: 23788 | H563: Engineer
A564: =A563+1 -> 524 | B564: O'Hollaren | C564: Peggy P "Peg" | D564: =B564 & ", " & C564 -> O'Hollaren, Peggy P "Peg" | E564: =C564 & " " & B564 -> Peggy P "Peg" O'Hollaren | F564: 1953 | G564: 1965 | H564: Local Billing Clerk
A565: =A564+1 -> 525 | B565: Oddo | C565: Greg | D565: =B565 & ", " & C565 -> Oddo, Greg | E565: =C565 & " " & B565 -> Greg Oddo | F565: 36445 | G565: 36445 | H565: Traffic | I565: In Salt Lake City, UT
A566: =A565+1 -> 526 | B566: Ohm | C566: Susan | D566: =B566 & ", " & C566 -> Ohm, Susan | E566: =C566 & " " & B566 -> Susan Ohm | F566: +/- 11/17/72 | G566: +/- 11/17/72
A567: =A566+1 -> 527 | B567: Okamoto | C567: Masako | D567: =B567 & ", " & C567 -> Okamoto, Masako | E567: =C567 & " " & B567 -> Masako Okamoto | F567: 36605 | G567: 37680 | H567: Research | I567: Now at KSTW, Renton, WA
A568: =A567+1 -> 528 | B568: Olsen | C568: Russell K. | D568: =B568 & ", " & C568 -> Olsen, Russell K. | E568: =C568 & " " & B568 -> Russell K. Olsen | F568: 19257 | G568: 1955 | H568: Station Manager, General Manager | I568: Now living in Eugene, OR
A569: =A568+1 -> 529 | B569: Olson | C569: Barbara | D569: =B569 & ", " & C569 -> Olson, Barbara | E569: =C569 & " " & B569 -> Barbara Olson | F569: +/- 11/17/72 | G569: +/- 11/17/72
A570: =A569+1 -> 530 | B570: Olson | C570: Lori | D570: =B570 & ", " & C570 -> Olson, Lori | E570: =C570 & " " & B570 -> Lori Olson | F570: 37375 | G570: PRESENT | H570: Sales/Accounting
A571: =A570+1 -> 531 | B571: Opdenweyer | C571: Katie | D571: =B571 & ", " & C571 -> Opdenweyer, Katie | E571: =C571 & " " & B571 -> Katie Opdenweyer | F571: 31329 | G571: 33984 | H571: Floor Director
A572: =A571+1 -> 532 | B572: Opra | C572: Frank | D572: =B572 & ", " & C572 -> Opra, Frank | E572: =C572 & " " & B572 -> Frank Opra | F572: 19287 | G572: 19287
A573: =A572+1 -> 533 | B573: Orth | C573: Robert | D573: =B573 & ", " & C573 -> Orth, Robert | E573: =C573 & " " & B573 -> Robert Orth | F573: 1953 | G573: 1953
A574: =A573+1 -> 534 | B574: Osborn | C574: Barbara P. | D574: =B574 & ", " & C574 -> Osborn, Barbara P. | E574: =C574 & " " & B574 -> Barbara P. Osborn | F574: 29561 | G574: 32687 | H574: Sales
A575: =A574+1 -> 535 | B575: Otterbein | C575: Marc | D575: =B575 & ", " & C575 -> Otterbein, Marc | E575: =C575 & " " & B575 -> Marc Otterbein | F575: 29561 | G575: 29593
A576: =A575+1 -> 536 | B576: Otto | C576: Clare | D576: =B576 & ", " & C576 -> Otto, Clare | E576: =C576 & " " & B576 -> Clare Otto | F576: 36108 | G576: 2004 | H576: News
A577: =A576+1 -> 537 | B577: Paige | C577: Wayne | D577: =B577 & ", " & C577 -> Paige, Wayne | E577: =C577 & " " & B577 -> Wayne Paige | F577: 33724 | G577: 33984 | H577: News
A578: =A577+1 -> 538 | B578: Palanuk | C578: Amy | D578: =B578 & ", " & C578 -> Palanuk, Amy | E578: =C578 & " " & B578 -> Amy Palanuk | F578: 36844 | G578: 37864 | H578: News | I578: AKA Amy Lewin
A579: =A578+1 -> 539 | B579: Parker | C579: Laura | D579: =B579 & ", " & C579 -> Parker, Laura | E579: =C579 & " " & B579 -> Laura Parker | F579: 11/1/1978; 7/31/1996 | G579: 1/17/03 | H579: Switchboard Operator, Floater (traffic, accounting, news, executive secretary), Floor Director, Station Announcer
A580: =A579+1 -> 540 | B580: Parsons | C580: Shauna | D580: =B580 & ", " & C580 -> Parsons, Shauna | E580: =C580 & " " & B580 -> Shauna Parsons | F580: 36844 | G580: PRESENT | H580: News Anchor | I580: At KPTV (Meredith Corp.)
A581: =A580+1 -> 541 | B581: Pastor | C581: Dave | D581: =B581 & ", " & C581 -> Pastor, Dave | E581: =C581 & " " & B581 -> Dave Pastor
A582: =A581+1 -> 542 | B582: Patten | C582: Joanna | D582: =B582 & ", " & C582 -> Patten, Joanna | E582: =C582 & " " & B582 -> Joanna Patten | F582: 33724 | G582: 33984
A583: =A582+1 -> 543 | B583: Patterson | C583: Eric | D583: =B583 & ", " & C583 -> Patterson, Eric | E583: =C583 & " " & B583 -> Eric Patterson | F583: 35153 | G583: 37041 | H583: News
A584: =A583+1 -> 544 | B584: Patzer | C584: John | D584: =B584 & ", " & C584 -> Patzer, John | E584: =C584 & " " & B584 -> John Patzer | F584: 35153 | G584: 35153 | H584: News
A585: =A584+1 -> 545 | B585: Paul | C585: Richard D "Dick" | D585: =B585 & ", " & C585 -> Paul, Richard D "Dick" | E585: =C585 & " " & B585 -> Richard D "Dick" Paul | F585: 1960; 12/4/64 | G585: 1965 | H585: P/T Floorman
A586: =A585+1 -> 546 | B586: Pearson | C586: Karin | D586: =B586 & ", " & C586 -> Pearson, Karin | E586: =C586 & " " & B586 -> Karin Pearson | F586: 27347 | G586: 32295 | H586: Production
A587: =A586+1 -> 547 | B587: Pelot | C587: David W (Dave) | D587: =B587 & ", " & C587 -> Pelot, David W (Dave) | E587: =C587 & " " & B587 -> David W (Dave) Pelot | F587: 23963 | G587: 1973? | H587: Engineering/Camera/MCR
A588: =A587+1 -> 548 | B588: Peterson | C588: Joanne | D588: =B588 & ", " & C588 -> Peterson, Joanne | E588: =C588 & " " & B588 -> Joanne Peterson | F588: August 1956 | G588: August 1956
A589: =A588+1 -> 549 | B589: Peterson | C589: Karl | D589: =B589 & ", " & C589 -> Peterson, Karl | E589: =C589 & " " & B589 -> Karl Peterson | F589: 33724 | G589: 33724
A590: =A589+1 -> 550 | B590: Petrovich | C590: Marge | D590: =B590 & ", " & C590 -> Petrovich, Marge | E590: =C590 & " " & B590 -> Marge Petrovich | F590: +/- 11/17/72 | G590: +/- 11/17/72
A591: =A590+1 -> 551 | B591: Pettinger | C591: Mark | D591: =B591 & ", " & C591 -> Pettinger, Mark | E591: =C591 & " " & B591 -> Mark Pettinger | F591: 36496 | G591: 36496
A592: =A591+1 -> 552 | B592: Petty | C592: John O | D592: =B592 & ", " & C592 -> Petty, John O | E592: =C592 & " " & B592 -> John O Petty | F592: 20837 | G592: 1970s | H592: Sales Manager | I592: Deceased July 2002
A593: =A592+1 -> 553 | B593: Phelps | C593: Gene | D593: =B593 & ", " & C593 -> Phelps, Gene | E593: =C593 & " " & B593 -> Gene Phelps | F593: 19247 | G593: 31905 | H593: Chief Enginner
A594: =A593+1 -> 554 | B594: Pierce | C594: Diane | D594: =B594 & ", " & C594 -> Pierce, Diane | E594: =C594 & " " & B594 -> Diane Pierce | F594: 30245 | G594: 30477
A595: =A594+1 -> 555 | B595: Pierce | C595: George | D595: =B595 & ", " & C595 -> Pierce, George | E595: =C595 & " " & B595 -> George Pierce | F595: 29561 | G595: Summer 2002 | H595: Engineering
A596: =A595+1 -> 556 | B596: Pierce | C596: Lyle | D596: =B596 & ", " & C596 -> Pierce, Lyle | E596: =C596 & " " & B596 -> Lyle Pierce | F596: 27521 | G596: 27521
A597: =A596+1 -> 557 | B597: Piper | C597: Carley | D597: =B597 & ", " & C597 -> Piper, Carley | E597: =C597 & " " & B597 -> Carley Piper | F597: +/- 11/17/72 | G597: 34090 | H597: Programming | I597: Deceased 5-18-00
A598: =A597+1 -> 558 | B598: Pittman | C598: Rick | D598: =B598 & ", " & C598 -> Pittman, Rick | E598: =C598 & " " & B598 -> Rick Pittman | F598: 35282 | G598: Summer 2002 | H598: Production
A599: =A598+1 -> 559 | B599: Plumb | C599: Elizabeth | D599: =B599 & ", " & C599 -> Plumb, Elizabeth | E599: =C599 & " " & B599 -> Elizabeth Plumb | F599: 30477 | G599: 30477
A600: =A599+1 -> 560 | B600: Post | C600: Edward M (Ed) | D600: =B600 & ", " & C600 -> Post, Edward M (Ed) | E600: =C600 & " " & B600 -> Edward M (Ed) Post | F600: 20141 | G600: 1965 | H600: Business Manager
A601: =A600+1 -> 561 | B601: Potthoff | C601: Olive Mae | D601: =B601 & ", " & C601 -> Potthoff, Olive Mae | E601: =C601 & " " & B601 -> Olive Mae Potthoff | F601: SEE HARTRAMPF, OLIVE
A602: =A601+1 -> 562 | B602: Powers | C602: Judy | D602: =B602 & ", " & C602 -> Powers, Judy | E602: =C602 & " " & B602 -> Judy Powers | F602: 32295 | G602: 35153 | H602: Traffic
A603: =A602+1 -> 563 | B603: Powers | C603: Melissa | D603: =B603 & ", " & C603 -> Powers, Melissa | E603: =C603 & " " & B603 -> Melissa Powers | F603: 2001 | G603: 2001
A604: =A603+1 -> 564 | B604: Pratt | C604: Phil | D604: =B604 & ", " & C604 -> Pratt, Phil | E604: =C604 & " " & B604 -> Phil Pratt | F604: 36496 | G604: 36496
A605: =A604+1 -> 565 | B605: Prior | C605: Cheryl | D605: =B605 & ", " & C605 -> Prior, Cheryl | E605: =C605 & " " & B605 -> Cheryl Prior | F605: 29103 | G605: 29910
A606: =A605+1 -> 566 | B606: Prusiewicz | C606: Piotr | D606: =B606 & ", " & C606 -> Prusiewicz, Piotr | E606: =C606 & " " & B606 -> Piotr Prusiewicz | F606: 31079 | G606: 31079 | H606: Shipping
A607: =A606+1 -> 567 | B607: Purifoy | C607: Ray C. | D607: =B607 & ", " & C607 -> Purifoy, Ray C. | E607: =C607 & " " & B607 -> Ray C. Purifoy | F607: 29865 | G607: 30477
A608: =A607+1 -> 568 | B608: Purvis | C608: Christine | D608: =B608 & ", " & C608 -> Purvis, Christine | E608: =C608 & " " & B608 -> Christine Purvis | F608: October 1983 | G608: August 2002 | H608: Executive Assistant to GM/Administration, HR Benefits Manager
A609: =A608+1 -> 569 | B609: Purvis | C609: Jim | D609: =B609 & ", " & C609 -> Purvis, Jim | E609: =C609 & " " & B609 -> Jim Purvis | F609: 31329 | G609: 31905 | H609: Shipping
A610: =A609+1 -> 570 | B610: Quant | C610: Ron | D610: =B610 & ", " & C610 -> Quant, Ron | E610: =C610 & " " & B610 -> Ron Quant | F610: May 1995 | G610: September 2001 | H610: Sports Photographer
A611: =A610+1 -> 571 | B611: Quinn | C611: Matt | D611: =B611 & ", " & C611 -> Quinn, Matt | E611: =C611 & " " & B611 -> Matt Quinn | F611: 12/20/1999 | G611: 37624 | H611: Graphic Designer, News Design Director | I611: in Cleveland, Ohio
A612: =A611+1 -> 572 | B612: Raab | C612: Daniel A | D612: =B612 & ", " & C612 -> Raab, Daniel A | E612: =C612 & " " & B612 -> Daniel A Raab | F612: 5/7/1962 | G612: 1965 | H612: Engineer
A613: =A612+1 -> 573 | B613: Rae | C613: Gertrude | D613: =B613 & ", " & C613 -> Rae, Gertrude | E613: =C613 & " " & B613 -> Gertrude Rae | F613: 29561 | G613: 33043 | H613: Human Resources | I613: Deceased 3/20/2003
A614: =A613+1 -> 574 | B614: Ragle | C614: Gene | D614: =B614 & ", " & C614 -> Ragle, Gene | E614: =C614 & " " & B614 -> Gene Ragle | F614: 1953 | G614: 1953
A615: =A614+1 -> 575 | B615: Ramsey | C615: David E C | D615: =B615 & ", " & C615 -> Ramsey, David E C | E615: =C615 & " " & B615 -> David E C Ramsey | F615: 23018 | G615: +/- 11/17/72 | H615: Floorman
A616: =A615+1 -> 576 | B616: Randall | C616: Theresa | D616: =B616 & ", " & C616 -> Randall, Theresa | E616: =C616 & " " & B616 -> Theresa Randall | F616: 31329 | G616: 31329 | H616: Traffic
A617: =A616+1 -> 577 | B617: Rankins | C617: George | D617: =B617 & ", " & C617 -> Rankins, George | E617: =C617 & " " & B617 -> George Rankins | F617: 27347 | G617: 27347
A618: =A617+1 -> 578 | B618: Rastovich | C618: Michael | D618: =B618 & ", " & C618 -> Rastovich, Michael | E618: =C618 & " " & B618 -> Michael Rastovich | F618: 1953 | G618: 1953
A619: =A618+1 -> 579 | B619: Rathjen | C619: Scott | D619: =B619 & ", " & C619 -> Rathjen, Scott | E619: =C619 & " " & B619 -> Scott Rathjen | F619: 27521 | G619: 27521
A620: =A619+1 -> 580 | B620: Raymond | C620: Orville E (Gene) | D620: =B620 & ", " & C620 -> Raymond, Orville E (Gene) | E620: =C620 & " " & B620 -> Orville E (Gene) Raymond | F620: 20680 | G620: 29906 | H620: Engineer | I620: Deceased 12/5/1981
A621: =A620+1 -> 581 | B621: Reamer | C621: Pamela | D621: =B621 & ", " & C621 -> Reamer, Pamela | E621: =C621 & " " & B621 -> Pamela Reamer | F621: 29865 | G621: 31804 | I621: became Reamer-Williams
A622: =A621+1 -> 582 | B622: Reed | C622: William (Bill) | D622: =B622 & ", " & C622 -> Reed, William (Bill) | E622: =C622 & " " & B622 -> William (Bill) Reed | F622: +/- 11/17/72 | G622: 27521
A623: =A622+1 -> 583 | B623: Reed | C623: Eldean P | D623: =B623 & ", " & C623 -> Reed, Eldean P | E623: =C623 & " " & B623 -> Eldean P Reed | F623: 20141 | G623: 31562 | H623: From KLOR; Film Librarian | I623: Deceased 2/1/97
A624: =A623+1 -> 584 | B624: Reed | C624: Suzanne | D624: =B624 & ", " & C624 -> Reed, Suzanne | E624: =C624 & " " & B624 -> Suzanne Reed | F624: 27521 | G624: 27521
A625: =A624+1 -> 585 | B625: Reed | C625: William L | D625: =B625 & ", " & C625 -> Reed, William L | E625: =C625 & " " & B625 -> William L Reed | F625: 22579 | G625: 1965 | H625: Engineer
A626: =A625+1 -> 586 | B626: Remley | C626: Sue Anne | D626: =B626 & ", " & C626 -> Remley, Sue Anne | E626: =C626 & " " & B626 -> Sue Anne Remley | F626: 27521 | G626: 27521
A627: =A626+1 -> 587 | B627: Renner | C627: Amy | D627: =B627 & ", " & C627 -> Renner, Amy | E627: =C627 & " " & B627 -> Amy Renner | F627: 36844 | G627: 37383 | H627: News | I627: in Eugene, Oregon
A628: =A627+1 -> 588 | B628: Rettke | C628: Joe | D628: =B628 & ", " & C628 -> Rettke, Joe | E628: =C628 & " " & B628 -> Joe Rettke | F628: 28688 | G628: 35153 | H628: Engineering
A629: =A628+1 -> 589 | B629: Reynolds | C629: Megan | D629: =B629 & ", " & C629 -> Reynolds, Megan | E629: =C629 & " " & B629 -> Megan Reynolds | F629: 37091 | G629: 37383 | H629: News
A630: =A629+1 -> 590 | B630: Reynolds | C630: Tammy | D630: =B630 & ", " & C630 -> Reynolds, Tammy | E630: =C630 & " " & B630 -> Tammy Reynolds | F630: 31329 | G630: 32063 | H630: Sales
A631: =A630+1 -> 591 | B631: Rhodes | C631: Marvin | D631: =B631 & ", " & C631 -> Rhodes, Marvin | E631: =C631 & " " & B631 -> Marvin Rhodes | F631: December 1993 | G631: 37501 | H631: Program Manager | I631: now VP of Broadcasting for Total Living Network in Chicago, IL
A632: =A631+1 -> 592 | B632: Richardson | C632: Charles | D632: =B632 & ", " & C632 -> Richardson, Charles | E632: =C632 & " " & B632 -> Charles Richardson | F632: 19287 | G632: November 1956
A633: =A632+1 -> 593 | B633: Riedl | C633: Kathy | D633: =B633 & ", " & C633 -> Riedl, Kathy | E633: =C633 & " " & B633 -> Kathy Riedl | F633: 31278 | G633: PRESENT | H633: Production | I633: At KPTV (Meredith Corp.)
A634: =A633+1 -> 594 | B634: Riordan | C634: Frank | D634: =B634 & ", " & C634 -> Riordan, Frank | E634: =C634 & " " & B634 -> Frank Riordan | F634: 11/17/54 | G634: 8/30/59 | H634: General Manager
A635: =A634+1 -> 595 | B635: Rios | C635: Modesto | D635: =B635 & ", " & C635 -> Rios, Modesto | E635: =C635 & " " & B635 -> Modesto Rios | F635: +/- 11/17/72 | G635: 27347
A636: =A635+1 -> 596 | B636: Rios | C636: Will | D636: =B636 & ", " & C636 -> Rios, Will | E636: =C636 & " " & B636 -> Will Rios | F636: 35153 | G636: 35153 | H636: News
B637: Roberts | C637: Barbara | D637: =B637 & ", " & C637 -> Roberts, Barbara | E637: =C637 & " " & B637 -> Barbara Roberts | F637: SEE WOOD, BARBARA
A638: =A636+1 -> 597 | B638: Roberts | C638: Chris | D638: =B638 & ", " & C638 -> Roberts, Chris | E638: =C638 & " " & B638 -> Chris Roberts | F638: 35054 | G638: 37932 | H638: Engineering | I638: living in Little Rock, AR; working for KLTR-TV
A639: =A638+1 -> 598 | B639: Roberts | C639: Val R | D639: =B639 & ", " & C639 -> Roberts, Val R | E639: =C639 & " " & B639 -> Val R Roberts | F639: 22013 | G639: 37449 | H639: Engineering | I639: living in Bancroft, ID
A640: =A639+1 -> 599 | B640: Robertson | C640: Rosalyn | D640: =B640 & ", " & C640 -> Robertson, Rosalyn | E640: =C640 & " " & B640 -> Rosalyn Robertson | F640: 31079 | G640: 35153 | H640: Traffic/Sales | I640: Deceased 8/24/2003
A641: =A640+1 -> 600 | B641: Rodriguez | C641: Ken | D641: =B641 & ", " & C641 -> Rodriguez, Ken | E641: =C641 & " " & B641 -> Ken Rodriguez | F641: 34835 | G641: PRESENT | H641: Engineering | I641: At KPTV (Meredith Corp.)
A642: =A641+1 -> 601 | B642: Rodriguez | C642: Roxanne | D642: =B642 & ", " & C642 -> Rodriguez, Roxanne | E642: =C642 & " " & B642 -> Roxanne Rodriguez | F642: 35153 | G642: 35153 | H642: News
A643: =A642+1 -> 602 | B643: Rogers | C643: Chuck | D643: =B643 & ", " & C643 -> Rogers, Chuck | E643: =C643 & " " & B643 -> Chuck Rogers | F643: +/- 11/17/72 | G643: +/- 11/17/72
A644: =A643+1 -> 603 | B644: Rogers | C644: Roxan | D644: =B644 & ", " & C644 -> Rogers, Roxan | E644: =C644 & " " & B644 -> Roxan Rogers | F644: 25622 | G644: 37652 | H644: Business Dept | I644: AKA Roxan Ellis
A645: =A644+1 -> 604 | B645: Rogness | C645: Dan | D645: =B645 & ", " & C645 -> Rogness, Dan | E645: =C645 & " " & B645 -> Dan Rogness | F645: 31905 | G645: 33237 | H645: Engineer | I645: Deceased
A646: =A645+1 -> 605 | B646: Romans | C646: Kenneth | D646: =B646 & ", " & C646 -> Romans, Kenneth | E646: =C646 & " " & B646 -> Kenneth Romans | F646: 28178 | G646: PRESENT | H646: Engineering | I646: At KPTV (Meredith Corp.)
A647: =A646+1 -> 606 | B647: Romer | C647: Ted | D647: =B647 & ", " & C647 -> Romer, Ted | E647: =C647 & " " & B647 -> Ted Romer | F647: 1953 | G647: 1953
A648: =A647+1 -> 607 | B648: Rose | C648: Charles G, Jr. (Glen) | D648: =B648 & ", " & C648 -> Rose, Charles G, Jr. (Glen) | E648: =C648 & " " & B648 -> Charles G, Jr. (Glen) Rose | F648: 12/19/1958 | G648: 31804 | H648: Engineering
A649: =A648+1 -> 608 | B649: Rose | C649: Wayne | D649: =B649 & ", " & C649 -> Rose, Wayne | E649: =C649 & " " & B649 -> Wayne Rose | F649: 19287 | G649: 1953
A650: =A649+1 -> 609 | B650: Ross | C650: George | D650: =B650 & ", " & C650 -> Ross, George | E650: =C650 & " " & B650 -> George Ross | F650: 1962 | G650: 34424 | H650: Talent/Sales | I650: in Gearhart, Oregon
A651: =A650+1 -> 610 | B651: Rudolph | C651: Bruno | D651: =B651 & ", " & C651 -> Rudolph, Bruno | E651: =C651 & " " & B651 -> Bruno Rudolph | F651: 35153 | G651: 37437 | H651: Promotion | I651: now Advertising Manager at Wildhorse Resort and Casino in Pendleton, OR
A652: =A651+1 -> 611 | B652: Russell | C652: Grace | D652: =B652 & ", " & C652 -> Russell, Grace | E652: =C652 & " " & B652 -> Grace Russell | F652: 1953 | G652: 1953
A653: =A652+1 -> 612 | B653: Russell | C653: Terri | D653: =B653 & ", " & C653 -> Russell, Terri | E653: =C653 & " " & B653 -> Terri Russell | F653: 35153 | G653: 35153
A654: =A653+1 -> 613 | B654: Ryan | C654: James R Jr. | D654: =B654 & ", " & C654 -> Ryan, James R Jr. | E654: =C654 & " " & B654 -> James R Jr. Ryan | F654: 22712 | G654: +/- 11/17/72
A655: =A654+1 -> 614 | B655: Rygg | C655: Bill | D655: =B655 & ", " & C655 -> Rygg, Bill | E655: =C655 & " " & B655 -> Bill Rygg | F655: 1960 | G655: 1960 | H655: Director
A656: =A655+1 -> 615 | B656: Sage | C656: George | D656: =B656 & ", " & C656 -> Sage, George | E656: =C656 & " " & B656 -> George Sage | F656: 1950s
A657: =A656+1 -> 616 | B657: Salisbury | C657: John | D657: =B657 & ", " & C657 -> Salisbury, John | E657: =C657 & " " & B657 -> John Salisbury | F657: 5/1/57 | G657: 22266 | H657: News Anchor | I657: also worked for KXL radio; deceased
A658: =A657+1 -> 617 | B658: Salsman | C658: Rick | D658: =B658 & ", " & C658 -> Salsman, Rick | E658: =C658 & " " & B658 -> Rick Salsman | F658: 27521 | G658: 28795 | H658: Engineer
A659: =A658+1 -> 618 | B659: Sammons | C659: John | D659: =B659 & ", " & C659 -> Sammons, John | E659: =C659 & " " & B659 -> John Sammons | F659: +/- 11/17/72 | G659: +/- 11/17/72
A660: =A659+1 -> 619 | B660: Samp | C660: Mary | D660: =B660 & ", " & C660 -> Samp, Mary | E660: =C660 & " " & B660 -> Mary Samp | F660: 32931 | G660: 35153 | H660: Sales
A661: =A660+1 -> 620 | B661: Sanders | C661: George | D661: =B661 & ", " & C661 -> Sanders, George | E661: =C661 & " " & B661 -> George Sanders | F661: September 1960 | G661: May 1963 | H661: News Anchor
A662: =A661+1 -> 621 | B662: Savan | C662: Sally | D662: =B662 & ", " & C662 -> Savan, Sally | E662: =C662 & " " & B662 -> Sally Savan | F662: 19287 | G662: 1953
B663: Scharf | C663: Erin | D663: =B663 & ", " & C663 -> Scharf, Erin | E663: =C663 & " " & B663 -> Erin Scharf | F663: SEE DUNBAR, ERIN
A664: =A662+1 -> 622 | B664: Scarlett | C664: Cinda | D664: =B664 & ", " & C664 -> Scarlett, Cinda | E664: =C664 & " " & B664 -> Cinda Scarlett | F664: +/- 11/17/72 | G664: +/- 11/17/72
A665: =A664+1 -> 623 | B665: Scattarella | C665: Christy | D665: =B665 & ", " & C665 -> Scattarella, Christy | E665: =C665 & " " & B665 -> Christy Scattarella | F665: 31329 | G665: 31678 | H665: News
A666: =A665+1 -> 624 | B666: Schechtel | C666: Stephen (Steve) | D666: =B666 & ", " & C666 -> Schechtel, Stephen (Steve) | E666: =C666 & " " & B666 -> Stephen (Steve) Schechtel | F666: +/- 11/17/72 | G666: 33043 | H666: Engineering
A667: =A666+1 -> 625 | B667: Schenk | C667: Barbara | D667: =B667 & ", " & C667 -> Schenk, Barbara | E667: =C667 & " " & B667 -> Barbara Schenk | F667: 1953 | G667: 1953
A668: =A667+1 -> 626 | B668: Schierholz | C668: Norma | D668: =B668 & ", " & C668 -> Schierholz, Norma | E668: =C668 & " " & B668 -> Norma Schierholz | F668: 1953 | G668: 1953
A669: =A668+1 -> 627 | B669: Schill | C669: Diane | D669: =B669 & ", " & C669 -> Schill, Diane | E669: =C669 & " " & B669 -> Diane Schill | F669: 30272 | G669: 30773 | H669: Production Copywriter | I669: Now at KATU
A670: =A669+1 -> 628 | B670: Schira | C670: Donald F (Don) | D670: =B670 & ", " & C670 -> Schira, Donald F (Don) | E670: =C670 & " " & B670 -> Donald F (Don) Schira | F670: 21852 | G670: 33402 | H670: Film Editor | I670: Deceased, April 1992
A671: =A670+1 -> 629 | B671: Schirle | C671: Mark | D671: =B671 & ", " & C671 -> Schirle, Mark | E671: =C671 & " " & B671 -> Mark Schirle | F671: 30245 | G671: 30477 | H671: Floor Director | I671: in Los Angeles
A672: =A671+1 -> 630 | B672: Schneider | C672: Carrie | D672: =B672 & ", " & C672 -> Schneider, Carrie | E672: =C672 & " " & B672 -> Carrie Schneider | F672: 36844 | G672: 37383 | H672: Sales
A673: =A672+1 -> 631 | B673: Scholz | C673: Pete | D673: =B673 & ", " & C673 -> Scholz, Pete | E673: =C673 & " " & B673 -> Pete Scholz | F673: 36844 | G673: 37383
A674: =A673+1 -> 632 | B674: Schotland | C674: Alain | D674: =B674 & ", " & C674 -> Schotland, Alain | E674: =C674 & " " & B674 -> Alain Schotland | F674: 36844 | G674: 36844
B675: Schroeder | C675: Martha | D675: =B675 & ", " & C675 -> Schroeder, Martha | E675: =C675 & " " & B675 -> Martha Schroeder | F675: SEE ALGECIRAS, MARTHA
A676: =A674+1 -> 633 | B676: Schufeldt | C676: Robert | D676: =B676 & ", " & C676 -> Schufeldt, Robert | E676: =C676 & " " & B676 -> Robert Schufeldt | F676: 19287 | G676: 19287
A677: =A676+1 -> 634 | B677: Schwambeck | C677: Bill | D677: =B677 & ", " & C677 -> Schwambeck, Bill | E677: =C677 & " " & B677 -> Bill Schwambeck | F677: 28795 | G677: 28795
A678: =A677+1 -> 635 | B678: Schweitzer | C678: Armond | D678: =B678 & ", " & C678 -> Schweitzer, Armond | E678: =C678 & " " & B678 -> Armond Schweitzer | F678: 28688 | G678: 35153 | H678: Maintenance
A679: =A678+1 -> 636 | B679: Scott | C679: Coreen | D679: =B679 & ", " & C679 -> Scott, Coreen | E679: =C679 & " " & B679 -> Coreen Scott | F679: 31804 | G679: 31804
A680: =A679+1 -> 637 | B680: Sears | C680: John | D680: =B680 & ", " & C680 -> Sears, John | E680: =C680 & " " & B680 -> John Sears | F680: 28688 | G680: Summer 2002 | H680: News
A681: =A680+1 -> 638 | B681: Sedillo | C681: Eloy | D681: =B681 & ", " & C681 -> Sedillo, Eloy | E681: =C681 & " " & B681 -> Eloy Sedillo | F681: 31079 | G681: 32407 | H681: News | I681: in Los Angeles, working for Fox
A682: =A681+1 -> 639 | B682: Selig | C682: Ida | D682: =B682 & ", " & C682 -> Selig, Ida | E682: =C682 & " " & B682 -> Ida Selig | F682: 1957 | G682: 1963 | I682: Deceased 2/1/1995
B683: Sellars | C683: Leah | D683: =B683 & ", " & C683 -> Sellars, Leah | E683: =C683 & " " & B683 -> Leah Sellars | F683: SEE KOONTZ, LEAH
A684: =A682+1 -> 640 | B684: Senter | C684: Mamie | D684: =B684 & ", " & C684 -> Senter, Mamie | E684: =C684 & " " & B684 -> Mamie Senter | F684: 28688 | G684: Summer 2002 | H684: Receptionist
A685: =A684+1 -> 641 | B685: Serrano | C685: Armando | D685: =B685 & ", " & C685 -> Serrano, Armando | E685: =C685 & " " & B685 -> Armando Serrano | F685: 31079 | G685: 31329
A686: =A685+1 -> 642 | B686: Shade | C686: Kenton P | D686: =B686 & ", " & C686 -> Shade, Kenton P | E686: =C686 & " " & B686 -> Kenton P Shade | F686: 23256 | G686: 1965 | H686: Engineer | I686: Went to KATU; Deceased, approx 2000
A687: =A686+1 -> 643 | B687: Shain | C687: Kitty | D687: =B687 & ", " & C687 -> Shain, Kitty | E687: =C687 & " " & B687 -> Kitty Shain | F687: 1956 | G687: 1956
A688: =A687+1 -> 644 | B688: Shaw | C688: Bill | D688: =B688 & ", " & C688 -> Shaw, Bill | E688: =C688 & " " & B688 -> Bill Shaw | F688: +/- 11/17/72 | G688: +/- 11/17/72
A689: =A688+1 -> 645 | B689: Shelby | C689: Greg | D689: =B689 & ", " & C689 -> Shelby, Greg | E689: =C689 & " " & B689 -> Greg Shelby | F689: 31908 | G689: 38436 | H689: Sales
A690: =A689+1 -> 646 | B690: Sheldon | C690: Kristi | D690: =B690 & ", " & C690 -> Sheldon, Kristi | E690: =C690 & " " & B690 -> Kristi Sheldon | F690: 32613 | G690: 34766 | H690: National Sales Assistant | I690: AKA Kristi Moreland
A691: =A690+1 -> 647 | B691: Sheppard | C691: Clifford | D691: =B691 & ", " & C691 -> Sheppard, Clifford | E691: =C691 & " " & B691 -> Clifford Sheppard | F691: 29561 | G691: 29593 | H691: Engineer | I691: in Bay Area
A692: =A691+1 -> 648 | B692: Sheridan | C692: Kristine | D692: =B692 & ", " & C692 -> Sheridan, Kristine | E692: =C692 & " " & B692 -> Kristine Sheridan | F692: 34799 | G692: 35370 | H692: National Sales Assistant
A693: =A692+1 -> 649 | B693: Shevland | C693: Charles W "Shevy" | D693: =B693 & ", " & C693 -> Shevland, Charles W "Shevy" | E693: =C693 & " " & B693 -> Charles W "Shevy" Shevland | F693: 1953; 2/24/1962 | G693: 31804 | H693: Film Editor | I693: Deceased 6/8/1991
A694: =A693+1 -> 650 | B694: Shierholz | C694: Norma | D694: =B694 & ", " & C694 -> Shierholz, Norma | E694: =C694 & " " & B694 -> Norma Shierholz | F694: 19287 | G694: 19287
A695: =A694+1 -> 651 | B695: Shleifer | C695: Denny | D695: =B695 & ", " & C695 -> Shleifer, Denny | E695: =C695 & " " & B695 -> Denny Shleifer | F695: 32687 | G695: 33402 | H695: News
A696: =A695+1 -> 652 | B696: Shoquist | C696: Ron | D696: =B696 & ", " & C696 -> Shoquist, Ron | E696: =C696 & " " & B696 -> Ron Shoquist | F696: 31678 | G696: 35153 | H696: Sales
A697: =A696+1 -> 653 | B697: Shyduik | C697: Donna-Mae | D697: =B697 & ", " & C697 -> Shyduik, Donna-Mae | E697: =C697 & " " & B697 -> Donna-Mae Shyduik | F697: 31079 | G697: 31495 | H697: Traffic
A698: =A697+1 -> 654 | B698: Sibert | C698: Jim | D698: =B698 & ", " & C698 -> Sibert, Jim | E698: =C698 & " " & B698 -> Jim Sibert | F698: 27347 | G698: 31678 | H698: Engineering
A699: =A698+1 -> 655 | B699: Sierra | C699: Alejandro | D699: =B699 & ", " & C699 -> Sierra, Alejandro | E699: =C699 & " " & B699 -> Alejandro Sierra | F699: 27960 | G699: Summer 2002 | H699: Production
A700: =A699+1 -> 656 | B700: Simmons | C700: Kevin | D700: =B700 & ", " & C700 -> Simmons, Kevin | E700: =C700 & " " & B700 -> Kevin Simmons | F700: 36097 | G700: PRESENT | H700: News | I700: At KPTV (Meredith Corp.)
A701: =A700+1 -> 657 | B701: Simone | C701: Bob | D701: =B701 & ", " & C701 -> Simone, Bob | E701: =C701 & " " & B701 -> Bob Simone | F701: 37103 | G701: 37424 | H701: General Mgr
A702: =A701+1 -> 658 | B702: Simpson | C702: Ruth | D702: =B702 & ", " & C702 -> Simpson, Ruth | E702: =C702 & " " & B702 -> Ruth Simpson | F702: 19359 | G702: 1953
A703: =A702+1 -> 659 | B703: Singer | C703: Kim | D703: =B703 & ", " & C703 -> Singer, Kim | E703: =C703 & " " & B703 -> Kim Singer | F703: abt 1984 | G703: 36584 | H703: Talent | I703: Now at KPTV (Meredith Corp.) reporting for Better Homes & Gardens
A704: =A703+1 -> 660 | B704: Skipper | C704: Jen | D704: =B704 & ", " & C704 -> Skipper, Jen | E704: =C704 & " " & B704 -> Jen Skipper | F704: 36935 | G704: 37383 | H704: News
A705: =A704+1 -> 661 | B705: Smith | C705: Brenda | D705: =B705 & ", " & C705 -> Smith, Brenda | E705: =C705 & " " & B705 -> Brenda Smith | F705: +/- 11/17/72 | G705: +/- 11/17/72
A706: =A705+1 -> 662 | B706: Smith | C706: Elaine | D706: =B706 & ", " & C706 -> Smith, Elaine | E706: =C706 & " " & B706 -> Elaine Smith | F706: 19359 | G706: 1953
A707: =A706+1 -> 663 | B707: Smith | C707: Ivan | D707: =B707 & ", " & C707 -> Smith, Ivan | E707: =C707 & " " & B707 -> Ivan Smith | F707: 1955 | G707: November 1956 | H707: Newscaster | I707: Deceased May 1998
A708: =A707+1 -> 664 | B708: Smith | C708: Kathy | D708: =B708 & ", " & C708 -> Smith, Kathy | E708: =C708 & " " & B708 -> Kathy Smith | F708: 36844 | G708: 37110 | H708: Talent
A709: =A708+1 -> 665 | B709: Smith | C709: Mike | D709: =B709 & ", " & C709 -> Smith, Mike | E709: =C709 & " " & B709 -> Mike Smith | F709: +/- 11/17/72
A710: =A709+1 -> 666 | B710: Smith | C710: Patricia | D710: =B710 & ", " & C710 -> Smith, Patricia | E710: =C710 & " " & B710 -> Patricia Smith | F710: 28998 | G710: Summer 2002 | H710: Production | I710: AKA Patricia Talton, Patricia Jackson
A711: =A710+1 -> 667 | B711: Smoller | C711: Ron | D711: =B711 & ", " & C711 -> Smoller, Ron | E711: =C711 & " " & B711 -> Ron Smoller | F711: 29561 | G711: 30477 | H711: Engineer
A712: =A711+1 -> 668 | B712: Snipes | C712: Currin | D712: =B712 & ", " & C712 -> Snipes, Currin | E712: =C712 & " " & B712 -> Currin Snipes | F712: 36496 | G712: 36496 | H712: Talent
A713: =A712+1 -> 669 | B713: Soeterik | C713: Nancy | D713: =B713 & ", " & C713 -> Soeterik, Nancy | E713: =C713 & " " & B713 -> Nancy Soeterik | F713: 36024 | G713: PRESENT | H713: Local Operations Coordinator, Traffic | I713: At KPTV (Meredith Corp.)
B714: Soika | C714: Patricia | D714: =B714 & ", " & C714 -> Soika, Patricia | E714: =C714 & " " & B714 -> Patricia Soika | F714: SEE MOSS, PATRICIA (TRISH)
A715: =A713+1 -> 670 | B715: Soles | C715: George | D715: =B715 & ", " & C715 -> Soles, George | E715: =C715 & " " & B715 -> George Soles | F715: 1953 | G715: 1953
A716: =A715+1 -> 671 | B716: Sorensen | C716: Mary E | D716: =B716 & ", " & C716 -> Sorensen, Mary E | E716: =C716 & " " & B716 -> Mary E Sorensen | F716: 23767 | G716: 1965 | H716: Accounts Payable
A717: =A716+1 -> 672 | B717: Spannagel | C717: Judy | D717: =B717 & ", " & C717 -> Spannagel, Judy | E717: =C717 & " " & B717 -> Judy Spannagel | F717: +/- 11/17/72 | G717: +/- 11/17/72
A718: =A717+1 -> 673 | B718: Springer | C718: Pete | D718: =B718 & ", " & C718 -> Springer, Pete | E718: =C718 & " " & B718 -> Pete Springer | F718: 35153 | G718: 35153 | H718: News
A719: =A718+1 -> 674 | B719: Srack | C719: Paul | D719: =B719 & ", " & C719 -> Srack, Paul | E719: =C719 & " " & B719 -> Paul Srack | F719: 28795 | G719: 28795
A720: =A719+1 -> 675 | B720: Stafford | C720: Melody | D720: =B720 & ", " & C720 -> Stafford, Melody | E720: =C720 & " " & B720 -> Melody Stafford | F720: 29561 | G720: 29561 | H720: Promotion
A721: =A720+1 -> 676 | B721: Stamer | C721: George | D721: =B721 & ", " & C721 -> Stamer, George | E721: =C721 & " " & B721 -> George Stamer | F721: 28688 | G721: 29103 | H721: Floor Director | I721: in Los Angeles
A722: =A721+1 -> 677 | B722: Stanchfield | C722: Jennifer | D722: =B722 & ", " & C722 -> Stanchfield, Jennifer | E722: =C722 & " " & B722 -> Jennifer Stanchfield | F722: 36496 | G722: 36496
A723: =A722+1 -> 678 | B723: Stedman | C723: Mitch | D723: =B723 & ", " & C723 -> Stedman, Mitch | E723: =C723 & " " & B723 -> Mitch Stedman | F723: 30790 | G723: 37501 | H723: Engineering, Production | I723: now with Vic Alfonso Cadillac
A724: =A723+1 -> 679 | B724: Stedman | C724: Stephen (Steve) | D724: =B724 & ", " & C724 -> Stedman, Stephen (Steve) | E724: =C724 & " " & B724 -> Stephen (Steve) Stedman | F724: 27347 | G724: 29103 | H724: Director
B725: Steed | C725: Marie | D725: =B725 & ", " & C725 -> Steed, Marie | E725: =C725 & " " & B725 -> Marie Steed | F725: SEE ECKMAN, MARIE
A726: =A724+1 -> 680 | B726: Steinbock | C726: Irving M | D726: =B726 & ", " & C726 -> Steinbock, Irving M | E726: =C726 & " " & B726 -> Irving M Steinbock | F726: 1965 | G726: 1965
A727: =A726+1 -> 681 | B727: Stellges | C727: Donald F (Don) | D727: =B727 & ", " & C727 -> Stellges, Donald F (Don) | E727: =C727 & " " & B727 -> Donald F (Don) Stellges | F727: 23818 | G727: 28998 | H727: News Director, Anchor
A728: =A727+1 -> 682 | B728: Stephan | C728: George | D728: =B728 & ", " & C728 -> Stephan, George | E728: =C728 & " " & B728 -> George Stephan | F728: 31079 | G728: 35153 | H728: Talent
A729: =A728+1 -> 683 | B729: Stephens | C729: Fred | D729: =B729 & ", " & C729 -> Stephens, Fred | E729: =C729 & " " & B729 -> Fred Stephens | F729: +/- 11/17/72 | G729: +/- 11/17/72
A730: =A729+1 -> 684 | B730: Stephens | C730: Junia | D730: =B730 & ", " & C730 -> Stephens, Junia | E730: =C730 & " " & B730 -> Junia Stephens | F730: 28795 | G730: 31495 | H730: News
A731: =A730+1 -> 685 | B731: Stinnett | C731: Tina | D731: =B731 & ", " & C731 -> Stinnett, Tina | E731: =C731 & " " & B731 -> Tina Stinnett | F731: 33402 | G731: 35153 | H731: News
A732: =A731+1 -> 686 | B732: Stinson | C732: Sylvia | D732: =B732 & ", " & C732 -> Stinson, Sylvia | E732: =C732 & " " & B732 -> Sylvia Stinson | F732: 27347 | G732: 32687 | H732: Talent
A733: =A732+1 -> 687 | B733: Stoddard | C733: Dave | D733: =B733 & ", " & C733 -> Stoddard, Dave | E733: =C733 & " " & B733 -> Dave Stoddard | F733: 31495 | G733: 33984 | H733: Sales
A734: =A733+1 -> 688 | B734: Stose | C734: Joyce | D734: =B734 & ", " & C734 -> Stose, Joyce | E734: =C734 & " " & B734 -> Joyce Stose | F734: 1972 | G734: 1978 | I734: Now J.J. Allen; works at KPTV/KPDX
A735: =A734+1 -> 689 | B735: Stout | C735: William (Bill) | D735: =B735 & ", " & C735 -> Stout, William (Bill) | E735: =C735 & " " & B735 -> William (Bill) Stout | F735: 19287 | G735: 1953
A736: =A735+1 -> 690 | B736: Strand | C736: Paul | D736: =B736 & ", " & C736 -> Strand, Paul | E736: =C736 & " " & B736 -> Paul Strand | F736: 31079 | G736: 31079 | H736: News
A737: =A736+1 -> 691 | B737: Strandlien | C737: Julie | D737: =B737 & ", " & C737 -> Strandlien, Julie | E737: =C737 & " " & B737 -> Julie Strandlien | F737: +/- 11/17/72 | G737: 29103
A738: =A737+1 -> 692 | B738: Sturdevant | C738: Kai | D738: =B738 & ", " & C738 -> Sturdevant, Kai | E738: =C738 & " " & B738 -> Kai Sturdevant | F738: +/- 11/17/72 | G738: 27521
A739: =A738+1 -> 693 | B739: Svela | C739: Sugar | D739: =B739 & ", " & C739 -> Svela, Sugar | E739: =C739 & " " & B739 -> Sugar Svela | F739: 27347 | G739: 27521
A740: =A739+1 -> 694 | B740: Swanson | C740: Pat | D740: =B740 & ", " & C740 -> Swanson, Pat | E740: =C740 & " " & B740 -> Pat Swanson | F740: 19287 | G740: 19287 | I740: married Frank Opra
A741: =A740+1 -> 695 | B741: Swanson | C741: Jane | D741: =B741 & ", " & C741 -> Swanson, Jane | E741: =C741 & " " & B741 -> Jane Swanson | F741: 1990 | G741: 1990
A742: =A741+1 -> 696 | B742: Swanson | C742: Stephanie | D742: =B742 & ", " & C742 -> Swanson, Stephanie | E742: =C742 & " " & B742 -> Stephanie Swanson | F742: 35153 | G742: 35153 | H742: News
A743: =A742+1 -> 697 | B743: Swing | C743: Bill | D743: =B743 & ", " & C743 -> Swing, Bill | E743: =C743 & " " & B743 -> Bill Swing | F743: 19359 | G743: 33043 | H743: News | I743: Deceased
B744: Talton | C744: Patricia | D744: =B744 & ", " & C744 -> Talton, Patricia | E744: =C744 & " " & B744 -> Patricia Talton | F744: SEE SMITH, PATRICIA
A745: =A743+1 -> 698 | B745: Tanner | C745: Dorothy | D745: =B745 & ", " & C745 -> Tanner, Dorothy | E745: =C745 & " " & B745 -> Dorothy Tanner | F745: 27347 | G745: 27521
A746: =A745+1 -> 699 | B746: Tashner | C746: Paige | D746: =B746 & ", " & C746 -> Tashner, Paige | E746: =C746 & " " & B746 -> Paige Tashner | F746: 32295 | G746: Fall 2002 | H746: Traffic/Production
A747: =A746+1 -> 700 | B747: Taylor | C747: Curtis (Aaron) | D747: =B747 & ", " & C747 -> Taylor, Curtis (Aaron) | E747: =C747 & " " & B747 -> Curtis (Aaron) Taylor | F747: 29865 | G747: 31079 | H747: Promotion | I747: Deceased
A748: =A747+1 -> 701 | B748: Taylor | C748: Ron | D748: =B748 & ", " & C748 -> Taylor, Ron | E748: =C748 & " " & B748 -> Ron Taylor | F748: 32687 | G748: 32687
A749: =A748+1 -> 702 | B749: Taylor | C749: Sylvia | D749: =B749 & ", " & C749 -> Taylor, Sylvia | E749: =C749 & " " & B749 -> Sylvia Taylor | F749: 1956 | G749: November 1956
A750: =A749+1 -> 703 | B750: Tennyson | C750: Mark | D750: =B750 & ", " & C750 -> Tennyson, Mark | E750: =C750 & " " & B750 -> Mark Tennyson | F750: 29103 | G750: 29910 | H750: Sales
A751: =A750+1 -> 704 | B751: Teodorski | C751: Philip | D751: =B751 & ", " & C751 -> Teodorski, Philip | E751: =C751 & " " & B751 -> Philip Teodorski | F751: 36844 | G751: 37110 | H751: Production
A752: =A751+1 -> 705 | B752: Tetzlaff | C752: Albert | D752: =B752 & ", " & C752 -> Tetzlaff, Albert | E752: =C752 & " " & B752 -> Albert Tetzlaff | F752: March 1962 | G752: May 1969 | H752: P/T Engineering/Master Ctrl | I752: Living in San Francisco, CA
A753: =A752+1 -> 706 | B753: Tevekelian | C753: Dawn | D753: =B753 & ", " & C753 -> Tevekelian, Dawn | E753: =C753 & " " & B753 -> Dawn Tevekelian | F753: 36445 | G753: 36445 | H753: Sales
A754: =A753+1 -> 707 | B754: Thoeny | C754: Harold | D754: =B754 & ", " & C754 -> Thoeny, Harold | E754: =C754 & " " & B754 -> Harold Thoeny | F754: 23253 | G754: 35528 | H754: Engineering
A755: =A754+1 -> 708 | B755: Thibeau | C755: Martin | D755: =B755 & ", " & C755 -> Thibeau, Martin | E755: =C755 & " " & B755 -> Martin Thibeau | F755: 1953 | G755: 1953
A756: =A755+1 -> 709 | B756: Thomas | C756: Laura | D756: =B756 & ", " & C756 -> Thomas, Laura | E756: =C756 & " " & B756 -> Laura Thomas | F756: 36496 | G756: 36496
A757: =A756+1 -> 710 | B757: Thomas | C757: Pam | D757: =B757 & ", " & C757 -> Thomas, Pam | E757: =C757 & " " & B757 -> Pam Thomas | F757: 31495 | G757: 33984 | H757: Sales | I757: New York
A758: =A757+1 -> 711 | B758: Thomas | C758: Regina | D758: =B758 & ", " & C758 -> Thomas, Regina | E758: =C758 & " " & B758 -> Regina Thomas | F758: 32931 | G758: 33043
A759: =A758+1 -> 712 | B759: Thompson | C759: Dave | D759: =B759 & ", " & C759 -> Thompson, Dave | E759: =C759 & " " & B759 -> Dave Thompson | F759: 33724 | G759: 35153 | H759: News
A760: =A759+1 -> 713 | B760: Thompson | C760: Steve | D760: =B760 & ", " & C760 -> Thompson, Steve | E760: =C760 & " " & B760 -> Steve Thompson | F760: 31079 | G760: 32295 | H760: Engineering
A761: =A760+1 -> 714 | B761: Tifft | C761: Joe | D761: =B761 & ", " & C761 -> Tifft, Joe | E761: =C761 & " " & B761 -> Joe Tifft | F761: 1953 | G761: 1953
A762: =A761+1 -> 715 | B762: Tomlinson | C762: Kerry | D762: =B762 & ", " & C762 -> Tomlinson, Kerry | E762: =C762 & " " & B762 -> Kerry Tomlinson | F762: 36451 | G762: PRESENT | H762: News Investigative Reporter | I762: At KPTV (Meredith Corp.)
A763: =A762+1 -> 716 | B763: Tran | C763: Than | D763: =B763 & ", " & C763 -> Tran, Than | E763: =C763 & " " & B763 -> Than Tran | F763: 31079 | G763: 33984 | H763: Engineering
A764: =A763+1 -> 717 | B764: Truong | C764: Han | D764: =B764 & ", " & C764 -> Truong, Han | E764: =C764 & " " & B764 -> Han Truong | F764: 35702 | G764: PRESENT | H764: News | I764: At KPTV (Meredith Corp.)
A765: =A764+1 -> 718 | B765: Tucker | C765: Ulysses | D765: =B765 & ", " & C765 -> Tucker, Ulysses | E765: =C765 & " " & B765 -> Ulysses Tucker | F765: 29103 | G765: 30272 | H765: Talent
A766: =A765+1 -> 719 | B766: Turner | C766: Wallace | D766: =B766 & ", " & C766 -> Turner, Wallace | E766: =C766 & " " & B766 -> Wallace Turner | F766: September 1960 | G766: September 1960 | H766: News Anchor
A767: =A766+1 -> 720 | B767: Tuuri | C767: Barbara | D767: =B767 & ", " & C767 -> Tuuri, Barbara | E767: =C767 & " " & B767 -> Barbara Tuuri | F767: 28688 | G767: 29103
A768: =A767+1 -> 721 | B768: Tykeson | C768: Don | D768: =B768 & ", " & C768 -> Tykeson, Don | E768: =C768 & " " & B768 -> Don Tykeson | F768: 1953 | G768: 1962 | H768: National Sales Manager
A769: =A768+1 -> 722 | B769: Ullauri | C769: Diego | D769: =B769 & ", " & C769 -> Ullauri, Diego | E769: =C769 & " " & B769 -> Diego Ullauri | F769: 31966 | G769: 33984 | H769: Shipping
A770: =A769+1 -> 723 | B770: Underhill | C770: Jill | D770: =B770 & ", " & C770 -> Underhill, Jill | E770: =C770 & " " & B770 -> Jill Underhill | F770: 31905 | G770: 32295
A771: =A770+1 -> 724 | B771: Urban | C771: Paul | D771: =B771 & ", " & C771 -> Urban, Paul | E771: =C771 & " " & B771 -> Paul Urban | F771: 29865 | G771: Summer 2002 | H771: Engineering
A772: =A771+1 -> 725 | B772: Vandervort | C772: David (Dave) | D772: =B772 & ", " & C772 -> Vandervort, David (Dave) | E772: =C772 & " " & B772 -> David (Dave) Vandervort | F772: 3/28/1960; 9/16/1962 | G772: Summer 2002 | H772: Engineering
A773: =A772+1 -> 726 | B773: Vaughn | C773: Roberta | D773: =B773 & ", " & C773 -> Vaughn, Roberta | E773: =C773 & " " & B773 -> Roberta Vaughn | F773: 29561 | G773: 29910 | H773: Engineer | I773: AKA Roberta Blais
A774: =A773+1 -> 727 | B774: Vega-Lloyd | C774: Miltie | D774: =B774 & ", " & C774 -> Vega-Lloyd, Miltie | E774: =C774 & " " & B774 -> Miltie Vega-Lloyd | F774: 33402 | G774: 35153 | H774: Human Resources
A775: =A774+1 -> 728 | B775: Vela | C775: Michele | D775: =B775 & ", " & C775 -> Vela, Michele | E775: =C775 & " " & B775 -> Michele Vela | F775: 36445 | G775: 36445 | H775: Sales
A776: =A775+1 -> 729 | B776: Vermilya | C776: Carl | D776: =B776 & ", " & C776 -> Vermilya, Carl | E776: =C776 & " " & B776 -> Carl Vermilya | F776: December 1960 | G776: January 1962 | H776: News Photographer
A777: =A776+1 -> 730 | B777: Vertrees | C777: Roger | D777: =B777 & ", " & C777 -> Vertrees, Roger | E777: =C777 & " " & B777 -> Roger Vertrees | F777: 31329 | G777: 31495 | H777: Promotion | I777: Dallas, Texas
A778: =A777+1 -> 731 | B778: Waldron | C778: Christy | D778: =B778 & ", " & C778 -> Waldron, Christy | E778: =C778 & " " & B778 -> Christy Waldron | F778: 32295 | G778: 32407
A779: =A778+1 -> 732 | B779: Waldron | C779: Suzanne | D779: =B779 & ", " & C779 -> Waldron, Suzanne | E779: =C779 & " " & B779 -> Suzanne Waldron | F779: 1957 | G779: 1958 | H779: "Tarantula Ghoul" | I779: Deceased
A780: =A779+1 -> 733 | B780: Walker | C780: Gina | D780: =B780 & ", " & C780 -> Walker, Gina | E780: =C780 & " " & B780 -> Gina Walker | F780: 34977 | G780: November 2005 | H780: Production | I780: AKA Gina Brasseur; now living in Colorado Springs, CO
A781: =A780+1 -> 734 | B781: Walker | C781: Ralph | D781: =B781 & ", " & C781 -> Walker, Ralph | E781: =C781 & " " & B781 -> Ralph Walker | F781: +/- 11/17/72 | G781: +/- 11/17/72
A782: =A781+1 -> 735 | B782: Wall | C782: Kristie | D782: =B782 & ", " & C782 -> Wall, Kristie | E782: =C782 & " " & B782 -> Kristie Wall | F782: 36935 | G782: 37179 | H782: News
A783: =A782+1 -> 736 | B783: Wallace | C783: Norman | D783: =B783 & ", " & C783 -> Wallace, Norman | E783: =C783 & " " & B783 -> Norman Wallace | F783: 19287 | G783: 1953
A784: =A783+1 -> 737 | B784: Wanstall | C784: Aaron | D784: =B784 & ", " & C784 -> Wanstall, Aaron | E784: =C784 & " " & B784 -> Aaron Wanstall | F784: 37308 | G784: PRESENT | H784: Production | I784: At KPTV (Meredith Corp.)
A785: =A784+1 -> 738 | B785: Ward | C785: Charles E | D785: =B785 & ", " & C785 -> Ward, Charles E | E785: =C785 & " " & B785 -> Charles E Ward | F785: 22744 | G785: 24088 | H785: P/T Announcer
A786: =A785+1 -> 739 | B786: Warner | C786: George | D786: =B786 & ", " & C786 -> Warner, George | E786: =C786 & " " & B786 -> George Warner | F786: 27347 | G786: 27347
A787: =A786+1 -> 740 | B787: Warren | C787: Ted | D787: =B787 & ", " & C787 -> Warren, Ted | E787: =C787 & " " & B787 -> Ted Warren | F787: 27347 | G787: 30477 | H787: News Anchor | I787: Now working in Seattle for an executive recruitment firm
A788: =A787+1 -> 741 | B788: Wasch | C788: George | D788: =B788 & ", " & C788 -> Wasch, George | E788: =C788 & " " & B788 -> George Wasch | F788: 19572 | G788: 1980s | H788: Director
A789: =A788+1 -> 742 | B789: Washington | C789: Brenda | D789: =B789 & ", " & C789 -> Washington, Brenda | E789: =C789 & " " & B789 -> Brenda Washington | F789: 27347 | G789: 35153 | H789: Accounting
A790: =A789+1 -> 743 | B790: Washington | C790: Geri | D790: =B790 & ", " & C790 -> Washington, Geri | E790: =C790 & " " & B790 -> Geri Washington | F790: 26620 | G790: March 1974 | H790: Traffic
A791: =A790+1 -> 744 | B791: Wathen | C791: Paul | D791: =B791 & ", " & C791 -> Wathen, Paul | E791: =C791 & " " & B791 -> Paul Wathen | F791: 27347 | G791: 27521
A792: =A791+1 -> 745 | B792: Watkins | C792: J.L. | D792: =B792 & ", " & C792 -> Watkins, J.L. | E792: =C792 & " " & B792 -> J.L. Watkins | F792: 36844 | G792: 2005 | H792: News
A793: =A792+1 -> 746 | B793: Watson | C793: David | D793: =B793 & ", " & C793 -> Watson, David | E793: =C793 & " " & B793 -> David Watson | F793: August 1979 | G793: May 1989 | H793: Engineering, Broadcast Engineer | I793: in Murray, UT
A794: =A793+1 -> 747 | B794: Watson | C794: Ed | D794: =B794 & ", " & C794 -> Watson, Ed | E794: =C794 & " " & B794 -> Ed Watson | F794: 1953 | G794: 1953
A795: =A794+1 -> 748 | B795: Weatherford | C795: Carey | D795: =B795 & ", " & C795 -> Weatherford, Carey | E795: =C795 & " " & B795 -> Carey Weatherford | F795: 5/7/75 | G795: 5/7/75
A796: =A795+1 -> 749 | B796: Webster | C796: Jan | D796: =B796 & ", " & C796 -> Webster, Jan | E796: =C796 & " " & B796 -> Jan Webster | F796: 19257 | G796: 1957 | I796: Now Jan Dickinson
A797: =A796+1 -> 750 | B797: Weidinger | C797: Kendall | D797: =B797 & ", " & C797 -> Weidinger, Kendall | E797: =C797 & " " & B797 -> Kendall Weidinger | F797: 9/?/2001 | G797: 9/?/2001 | H797: News
A798: =A797+1 -> 751 | B798: Wells | C798: Dorothy G | D798: =B798 & ", " & C798 -> Wells, Dorothy G | E798: =C798 & " " & B798 -> Dorothy G Wells | F798: 20571 | G798: 1977 | H798: Bookkeeper | I798: Deceased March 1992
A799: =A798+1 -> 752 | B799: Werner | C799: Wendell "Tony" | D799: =B799 & ", " & C799 -> Werner, Wendell "Tony" | E799: =C799 & " " & B799 -> Wendell "Tony" Werner | F799: 29865 | G799: 1991 | H799: Engineering
A800: =A799+1 -> 753 | B800: Wessinger | C800: Anna | D800: =B800 & ", " & C800 -> Wessinger, Anna | E800: =C800 & " " & B800 -> Anna Wessinger | F800: 27347 | G800: 27347
A801: =A800+1 -> 754 | B801: Westby | C801: Steve | D801: =B801 & ", " & C801 -> Westby, Steve | E801: =C801 & " " & B801 -> Steve Westby | F801: 29561 | G801: 29561 | H801: Engineer
A802: =A801+1 -> 755 | B802: Wetjen | C802: Sarah | D802: =B802 & ", " & C802 -> Wetjen, Sarah | E802: =C802 & " " & B802 -> Sarah Wetjen | F802: 35153 | G802: 35153 | H802: Sales
A803: =A802+1 -> 756 | B803: Wheeler | C803: Jessie V | D803: =B803 & ", " & C803 -> Wheeler, Jessie V | E803: =C803 & " " & B803 -> Jessie V Wheeler | F803: 20942 | G803: 1965 | H803: Switchboard
A804: =A803+1 -> 757 | B804: Whiffin | C804: Mary | D804: =B804 & ", " & C804 -> Whiffin, Mary | E804: =C804 & " " & B804 -> Mary Whiffin | F804: 32315 | G804: 32315 | H804: Floor Director
A805: =A804+1 -> 758 | B805: Whitcomb | C805: Ann | D805: =B805 & ", " & C805 -> Whitcomb, Ann | E805: =C805 & " " & B805 -> Ann Whitcomb | F805: +/- 11/17/72 | G805: +/- 11/17/72
A806: =A805+1 -> 759 | B806: Whitcomb | C806: Valarie | D806: =B806 & ", " & C806 -> Whitcomb, Valarie | E806: =C806 & " " & B806 -> Valarie Whitcomb | F806: 27347 | G806: 29103 | H806: Administrative Assistant, Personnel Director
A807: =A806+1 -> 760 | B807: White | C807: Charles | D807: =B807 & ", " & C807 -> White, Charles | E807: =C807 & " " & B807 -> Charles White | F807: 19287 | G807: 1953
A808: =A807+1 -> 761 | B808: White | C808: Gordon F | D808: =B808 & ", " & C808 -> White, Gordon F | E808: =C808 & " " & B808 -> Gordon F White | F808: 19511 | G808: 33984 | H808: Director, Programming Manager | I808: Deceased 10/25/1994
A809: =A808+1 -> 762 | B809: Whitehurst | C809: Dan | D809: =B809 & ", " & C809 -> Whitehurst, Dan | E809: =C809 & " " & B809 -> Dan Whitehurst | F809: 33063 | G809: PRESENT | H809: Production | I809: At KPTV (Meredith Corp.)
A810: =A809+1 -> 763 | B810: Whitmore | C810: Jennifer | D810: =B810 & ", " & C810 -> Whitmore, Jennifer | E810: =C810 & " " & B810 -> Jennifer Whitmore | F810: 36496 | G810: 36496
A811: =A810+1 -> 764 | B811: Wicker | C811: April | D811: =B811 & ", " & C811 -> Wicker, April | E811: =C811 & " " & B811 -> April Wicker | F811: 26620 | G811: 26620
A812: =A811+1 -> 765 | B812: Wilhelmi | C812: Gladys | D812: =B812 & ", " & C812 -> Wilhelmi, Gladys | E812: =C812 & " " & B812 -> Gladys Wilhelmi | F812: 27347 | G812: 30477
A813: =A812+1 -> 766 | B813: Wilkey | C813: John | D813: =B813 & ", " & C813 -> Wilkey, John | E813: =C813 & " " & B813 -> John Wilkey | F813: 28688 | G813: 35153 | H813: Sales
A814: =A813+1 -> 767 | B814: Willhoite | C814: H Warren (Rocky) | D814: =B814 & ", " & C814 -> Willhoite, H Warren (Rocky) | E814: =C814 & " " & B814 -> H Warren (Rocky) Willhoite | F814: 22759 | G814: +/- 11/17/72 | H814: Film Editor
A815: =A814+1 -> 768 | B815: Williams | C815: Beverley | D815: =B815 & ", " & C815 -> Williams, Beverley | E815: =C815 & " " & B815 -> Beverley Williams | F815: +/- 11/17/72 | G815: 12/0/2002 | H815: Accounting | I815: AKA Beverley Lambert
A816: =A815+1 -> 769 | B816: Williams | C816: Lester E (Les) | D816: =B816 & ", " & C816 -> Williams, Lester E (Les) | E816: =C816 & " " & B816 -> Lester E (Les) Williams | F816: 23621 | G816: 30272 | H816: Engineer
A817: =A816+1 -> 770 | B817: Williams | C817: Lindsay | D817: =B817 & ", " & C817 -> Williams, Lindsay | E817: =C817 & " " & B817 -> Lindsay Williams | F817: 37274 | G817: PRESENT
A818: =A817+1 -> 771 | B818: Williams | C818: Lorna | D818: =B818 & ", " & C818 -> Williams, Lorna | E818: =C818 & " " & B818 -> Lorna Williams | F818: 1953 | G818: 1953
A819: =A818+1 -> 772 | B819: Wilson | C819: Dave | D819: =B819 & ", " & C819 -> Wilson, Dave | E819: =C819 & " " & B819 -> Dave Wilson | F819: 34911 | G819: PRESENT | H819: News | I819: At KPTV (Meredith Corp.)
A820: =A819+1 -> 773 | B820: Wininger | C820: Becky | D820: =B820 & ", " & C820 -> Wininger, Becky | E820: =C820 & " " & B820 -> Becky Wininger | F820: 28989 | G820: 31639 | H820: Traffic | I820: AKA Rebecca McDonald, Becky Duncan
A821: =A820+1 -> 774 | B821: Winkenwerder | C821: Charles E "Chuck" (Chuck) | D821: =B821 & ", " & C821 -> Winkenwerder, Charles E "Chuck" (Chuck) | E821: =C821 & " " & B821 -> Charles E "Chuck" (Chuck) Winkenwerder | F821: 23848 | G821: 29593 | H821: Film Editor | I821: Deceased 8/25/1994
A822: =A821+1 -> 775 | B822: Winter | C822: Jeanne | D822: =B822 & ", " & C822 -> Winter, Jeanne | E822: =C822 & " " & B822 -> Jeanne Winter | F822: 36445 | G822: 36445
A823: =A822+1 -> 776 | B823: Wong | C823: Maymelle | D823: =B823 & ", " & C823 -> Wong, Maymelle | E823: =C823 & " " & B823 -> Maymelle Wong | F823: +/- 11/17/72 | G823: +/- 11/17/72
A824: =A823+1 -> 777 | B824: Wood | C824: Barbara | D824: =B824 & ", " & C824 -> Wood, Barbara | E824: =C824 & " " & B824 -> Barbara Wood | H824: News Reporter | I824: AKA Barbara Roberts, living in Little Rock, AR; works for KARK on 5-7am & 12-12:30pm newscasts.
A825: =A824+1 -> 778 | B825: Wood | C825: Germaine | D825: =B825 & ", " & C825 -> Wood, Germaine | E825: =C825 & " " & B825 -> Germaine Wood | F825: 36844 | G825: 37228 | H825: News | I825: AKA Germaine Miera; working for KPTV again (Meredith Corp.)
A826: =A825+1 -> 779 | B826: Woodson | C826: Jon | D826: =B826 & ", " & C826 -> Woodson, Jon | E826: =C826 & " " & B826 -> Jon Woodson | F826: +/- 11/17/72 | G826: 27521
A827: =A826+1 -> 780 | B827: Wray | C827: John B | D827: =B827 & ", " & C827 -> Wray, John B | E827: =C827 & " " & B827 -> John B Wray | F827: 5/25/59 | G827: 1965 | H827: Engineering
A828: =A827+1 -> 781 | B828: Wu | C828: Rebecca | D828: =B828 & ", " & C828 -> Wu, Rebecca | E828: =C828 & " " & B828 -> Rebecca Wu | F828: 36844 | G828: 37453 | H828: News Reporter
A829: =A828+1 -> 782 | B829: Yeh | C829: Emerald | D829: =B829 & ", " & C829 -> Yeh, Emerald | E829: =C829 & " " & B829 -> Emerald Yeh | F829: 29561 | G829: 30245 | H829: News Anchor | I829: in San Francisco, KRON
A830: =A829+1 -> 783 | B830: Yip | C830: Randall | D830: =B830 & ", " & C830 -> Yip, Randall | E830: =C830 & " " & B830 -> Randall Yip | F830: June 1996 | G830: September 2001 | H830: Executive Producer, Good Day Oregon | I830: Investigative and consumer producer for KGO-TV, San Francisco, CA
A831: =A830+1 -> 784 | B831: Young | C831: Gail | D831: =B831 & ", " & C831 -> Young, Gail | E831: =C831 & " " & B831 -> Gail Young | F831: +/- 11/17/72 | G831: +/- 11/17/72
A832: =A831+1 -> 785 | B832: Young | C832: Scott | D832: =B832 & ", " & C832 -> Young, Scott | E832: =C832 & " " & B832 -> Scott Young | F832: 31905 | G832: 33043 | H832: Engineering
A833: =A832+1 -> 786 | B833: Young | C833: Todd | D833: =B833 & ", " & C833 -> Young, Todd | E833: =C833 & " " & B833 -> Todd Young | F833: 28688 | G833: 28688 | H833: Business Manager
A834: =A833+1 -> 787 | B834: Zacharias | C834: Patricia A | D834: =B834 & ", " & C834 -> Zacharias, Patricia A | E834: =C834 & " " & B834 -> Patricia A Zacharias | F834: (2) 10/14/65 | G834: 1965 | H834: P/T PBX
A836: EMPLOYEE PAGE
A838: MAIN PAGE
A840: This page last updated | C840: =TODAY() -> 38873
A841: Yesterday's KPTV Website design and content ©2003-2005 by Ronald L. Dunevant, unless otherwise noted.
A842: This website is not affiliated with or operated by KPTV or its parent company, Meredith Broadcasting Corporation.
A843: Please direct any inquiries to: yesterdayskptv@gmail.com.